1008002020,服饰、鞋、包|男装|大码男装,2014秋季新款韩版修身男士翻领长袖T恤套装 黑色 藏青衣+灰裤 XXXL,服饰内衣>男装>大码男装> 丹杰仕（DAN JIE SHI）>2014秋季新款韩版修身男士翻领长袖T恤...,京东商城,TREYFUS特雷菲斯官方旗舰店
1008002020,服饰、鞋、包|男装|大码男装,新款男士纯棉圆领短袖T恤 宽松特大 加肥加大码 半袖Ball款 白色 XL,服饰鞋帽>男装>T恤>新款男士纯棉圆领短袖T恤 宽松特大 加肥...,京东商城,时尚芭莎
1008002020,服饰、鞋、包|男装|大码男装,2012新款歌瑞尔专柜正品梦幻国度性感宽松男士平角裤 深蓝色 L,歌瑞尔（Gainreel）>2012新款歌瑞尔专柜正品梦幻国度性感宽...,京东商城,歌瑞尔
1008002020,服饰、鞋、包|男装|大码男装,内裤男士纯棉肥佬内裤 特大码全棉透气平角裤宽松胖子内裤 XXXXL XXXXXL 浅蓝色 XXXXL 平铺约34,服饰内衣>内衣>男式内裤> 艾丽馨（ailixin）>内裤男士纯棉肥佬内裤 特大码全棉透气平角...,京东商城,八爪蜘蛛内衣专营店
1008002020,服饰、鞋、包|男装|大码男装,三奇14新款沙滩衣男士宽松防晒罩衫沙滩游泳玩水浮潜必备游泳装备 货到付款 88089 蓝色 L,运动户外>游泳用品>其它> 三奇>三奇14新款沙滩衣男士宽松防晒罩衫沙滩游...,京东商城,惠捷伟业运动专营店
1008002020,服饰、鞋、包|男装|大码男装,小护士纯棉3件装 男士中老年全棉平角内裤JMN 宽松透气/高腰深档 1浅灰+1铁灰+1黑 XL(175/105),服饰内衣>内衣>男式内裤> 小护士>小护士纯棉3件装 男士中老年全棉平角内裤...,京东商城,小护士内衣旗舰店
1008002020,服饰、鞋、包|男装|大码男装,蓝彩狐 春秋宽松大码装女款运动装男士运动套装情侣两件套卫衣休闲套装 班服 深蓝色 XXXL,服饰内衣>女装>卫衣> 蓝彩狐（LANCAIHU）>蓝彩狐 春秋宽松大码装女款运动装男士运动...,京东商城,蓝彩狐旗舰店
1008002020,服饰、鞋、包|男装|大码男装,男士长袖T恤 男式长袖T恤衫 中国风鲤鱼印花 男装t恤上衣 胖子宽松加肥加大码装,服装?>?男士服装?>?T恤?>?男士长袖T恤?男式长袖T恤衫?中国风鲤鱼印花?男装t恤上衣?胖子宽...,当当网,赫伦堡
1008002020,服饰、鞋、包|男装|大码男装,健将 男士内裤 纯棉 男平角内裤 休闲运动型 透气宽松男式内裤 两条装 三色随机 XL,服饰内衣>内衣>男式内裤>健将>健将 男士内裤 纯棉 男平角内裤 休闲运...,京东商城,正通人和服饰专营店
1008002020,服饰、鞋、包|男装|大码男装,第五街 5th street经典款男士直筒炫色休闲宽松牛仔长裤03019133 中灰色086 40,第五街 5th street经典款男士直...,京东商城,第五街
1008002020,服饰、鞋、包|男装|大码男装,玖禾悠莱 个性恶搞文化衫 五角星 海魂衫 纯棉胖子加大码宽松T恤 S,服饰内衣>男装>T恤>玖禾悠莱>玖禾悠莱 个性恶搞文化衫 五角星 海魂衫...,京东商城,玖禾悠莱官方旗舰店
1008002020,服饰、鞋、包|男装|大码男装,萧萧布落2014夏季男士加大加肥宽松平角时尚低腰潮花色泳裤欧美 花色随机发 均码,服饰内衣>内衣>泳衣> 萧萧布落>萧萧布落2014夏季男士加大加肥宽松平角...,京东商城,萧萧布落官方旗舰店
1008002020,服饰、鞋、包|男装|大码男装,RE-SP重塑加肥加大码 大号男装夜光胖子宽松潮流短袖汗衫 DAT-夜光 蜘蛛 夜光XXL/200-215斤,服饰鞋帽>男装>大码装>RE-SP重塑加肥加大码 大号男装夜光胖...,京东商城,RE-SP重塑旗舰店
1008002020,服饰、鞋、包|男装|大码男装,九都企鹅秋装上新大码男士长袖T恤加肥加大商务休闲宽松V领拼接百搭胖人POLO衫7102 军绿色 205,服饰内衣>男装>大码男装> 九都企鹅（jiuduqie）>九都企鹅秋装上新大码男士长袖T恤加肥加大...,京东商城,九都企鹅官方旗舰店
1008002020,服饰、鞋、包|男装|大码男装,良布 加大码短袖T恤男装夏装男士短袖T恤加肥加大码个性圆领打底衫休闲半袖宽松男装 藏青色 2XL,服饰内衣>男装>大码男装> 良布>良布 加大码短袖T恤男装夏装男士短袖T恤...,京东商城,良布官方旗舰店
1008002020,服饰、鞋、包|男装|大码男装,货到付款 胖胖星球JSmix 大码男士印花短袖T恤宽松加肥加大潮胖子男装X1738 X1738深蓝色 5XL-胸围133CM,服饰内衣>男装>大码男装> Jsmix>货到付款 胖胖星球JSmix 大码男士印...,京东商城,Jsmix大码男装旗舰店
1008002020,服饰、鞋、包|男装|大码男装,维仕威 特价精梳棉抗菌男士三角内裤 男纯棉单层无痕宽松内裤 A01 军绿色 L-170,维仕威 特价精梳棉抗菌男士三角内裤 男纯...,京东商城,维仕威
1008002020,服饰、鞋、包|男装|大码男装,春秋新款男士修身韩版直筒宽松运动棉长裤JP331 004 XK232 浅灰色 XXL,春秋新款男士修身韩版直筒宽松运动棉长裤J...,京东商城,MUGUO
1008002020,服饰、鞋、包|男装|大码男装,奥伊尔曼夏季新款加肥加大码大号胖子休闲宽松卫裤男装休闲七分裤F13625# 绿蓝 2XL码,服饰内衣>男装>休闲裤>奥伊尔曼>奥伊尔曼夏季新款加肥加大码大号胖子休闲宽...,京东商城,奥伊尔曼大码肥人专卖店
1008002020,服饰、鞋、包|男装|大码男装,蒙特威斯（MENTVEES）2013新款 夏装男士 时尚休闲 潮流宽松版 休闲裤 606 浅蓝色 M,蒙特威斯（MENTVEES）2013新款...,京东商城,蒙特威斯旗舰店
1008002020,服饰、鞋、包|男装|大码男装,夏装新款宽松男士短袖V领t恤男装打底衫T恤衣服加大码男装J5007 黑色 4XL,首页>服装鞋帽>男装>男士T恤>夏装新款宽松男士短袖V领t恤男装打底...,苏宁,BEBEERU
1008002020,服饰、鞋、包|男装|大码男装,扎卡湾 2013新款特价男士纯棉圆领短袖T恤宽松特大加肥加大码打篮球半袖上衣服 字母 白色 XXXL,服饰内衣>男装>T恤>扎卡湾（Zaka Wan）>扎卡湾 2013新款特价男士纯棉圆领短袖...,京东商城,扎卡湾旗舰店
1008002020,服饰、鞋、包|男装|大码男装,新款特价男士纯棉圆领短袖T恤宽松特大加肥加大码英文字母HELIT半袖 紫色 XL,服饰内衣>男装>T恤>xieling>新款特价男士纯棉圆领短袖T恤宽松特大加肥...,京东商城,时装之苑
1008002020,服饰、鞋、包|男装|大码男装,新款男士纯棉圆领短袖T恤 宽松特大 加肥加大码 半袖CONVERSE款 白色 XL,服饰鞋帽>男装>T恤>新款男士纯棉圆领短袖T恤 宽松特大 加肥...,京东商城,时尚芭莎
1008002020,服饰、鞋、包|男装|大码男装,春秋新款男士韩版直筒宽松运动棉长裤JP331 063 XK231 深灰色 XXL,春秋新款男士韩版直筒宽松运动棉长裤JP3...,京东商城,MUGUO
1008002020,服饰、鞋、包|男装|大码男装,【3件装】畅舒优 男士纯棉宽松内裤 全棉休闲透气家居睡裤 阿罗裤 2314 黄色+绿色+红色 XXL(95KG以下),服饰内衣>内衣>男式内裤> 畅舒优>【3件装】畅舒优 男士纯棉宽松内裤 全棉...,京东商城,畅舒优旗舰店
1008002020,服饰、鞋、包|男装|大码男装,凯迪龙正品游泳裤 加大宽松版 男式平角 男士高级泳裤 XXXL,运动健康>户外装备>泳衣>凯迪龙正品游泳裤 加大宽松版 男式平角 ...,京东商城,凯迪龙旗舰店
1008002020,服饰、鞋、包|男装|大码男装,夏装新款宽松男士短袖翻领t恤男装打底衫T恤衣服加大码男装J2008 白色 4XL,首页>服装鞋帽>男装>男士T恤>夏装新款宽松男士短袖翻领t恤男装打底...,苏宁,BEBEERU
1008002020,服饰、鞋、包|男装|大码男装,2014夏季新品大码圆领短袖t恤 特大宽松加肥加大码短袖t恤男士 宝蓝色 7XL,服饰内衣>男装>大码男装> 帝都琼斯>2014夏季新品大码圆领短袖t恤 特大宽...,京东商城,爱悦世纪服饰专营店
1008002020,服饰、鞋、包|男装|大码男装,C.CTN(3条装)男士平角内裤阿罗裤 纯棉宽松舒适家居睡裤BOXER CB603 M(建议腰围2尺-2尺6),服饰内衣>内衣>男式内裤>C.CTN>C.CTN(3条装)男士平角内裤阿罗裤 ...,京东商城,C.CTN
1008002020,服饰、鞋、包|男装|大码男装,3条装 碧竹男士内裤 平角裤 纯棉 肥佬裤 宽松加大码 全棉加肥 深蓝3条 7XL,服饰内衣>内衣>男式内裤>碧竹>3条装 碧竹男士内裤 平角裤 纯棉 肥佬...,京东商城,碧竹旗舰店
1008002020,服饰、鞋、包|男装|大码男装,男士内裤 抗菌抑菌优质竹纤维 男士 平角裤 内裤 男ck00 加肥加大胖子大码内裤ck04 特大码男内裤 灰 XXXL,男士内裤 抗菌抑菌优质竹纤维 男士 平角...,京东商城,因内希
1008002020,服饰、鞋、包|男装|大码男装,海林鹿男士肥佬内裤透气宽松xxxxl胖子加肥加大码莫代尔平角裤 肥佬内裤-浅灰 4XL,服饰内衣>内衣>男式内裤> 海林鹿（HAILINLU）>海林鹿男士肥佬内裤透气宽松xxxxl胖子...,京东商城,海林鹿官方旗舰店
1008002020,服饰、鞋、包|男装|大码男装,Dockers码头工人 男士商务休闲宽松直筒裤 手机裤R00009 黑色04 W33,Dockers码头工人 男士商务休闲宽松...,京东商城,美国宝贝店
1008002020,服饰、鞋、包|男装|大码男装,时尚芭莎新款男士纯棉圆领短袖T恤 宽松特大 加肥加大 男士T恤 纯棉T恤 流川枫款 枣红 L,服饰鞋帽>男装>T恤>时尚芭莎新款男士纯棉圆领短袖T恤 宽松特...,京东商城,时尚芭莎
1008002020,服饰、鞋、包|男装|大码男装,北极绒男士内裤 纯色U凸平角裤 宽松四角裤内衣潮 黑色 L,服饰内衣>内衣>男式内裤>北极绒（BEJIROG）>北极绒男士内裤 纯色U凸平角裤 宽松四角...,京东商城,北极绒鼎惠专卖店
1008002020,服饰、鞋、包|男装|大码男装,九帝狼 2012秋冬新款直筒宽松男士商政休闲裤 7007 黑灰色 33,九帝狼 2012秋冬新款直筒宽松男士商...,京东商城,九帝狼
1008002020,服饰、鞋、包|男装|大码男装,扎卡湾 2013新款特价男士纯棉圆领短袖T恤宽松特大加肥加大码打篮球半袖上衣服 羽毛 黑色 XL,服饰鞋帽>男装>T恤>扎卡湾 2013新款特价男士纯棉圆领短袖...,京东商城,扎卡湾旗舰店
1008002020,服饰、鞋、包|男装|大码男装,金丰田男士夏季加大码纯棉宽松家居短裤平角裤 3170一条装 浅灰色系 XL,金丰田>金丰田男士夏季加大码纯棉宽松家居短裤平角...,京东商城,金丰田
1008002020,服饰、鞋、包|男装|大码男装,金丰田男士纯棉宽松平角内裤3107一条装 不规则款 XXXL,金丰田男士纯棉宽松平角内裤3107一条装...,京东商城,金丰田
1008002020,服饰、鞋、包|男装|大码男装,恒源祥 男士内裤礼盒装平角 无痕精梳棉美体弹力 U凸透气宽松 紫红8034 170-180/90-100,服饰内衣>内衣>男式内裤> 恒源祥（HYX）>恒源祥 男士内裤礼盒装平角 无痕精梳棉美...,京东商城,飞龙服饰旗舰店
1008002020,服饰、鞋、包|男装|大码男装,扎卡湾 2013新款特价男士纯棉圆领短袖T恤宽松特大加肥加大码打篮球半袖上衣服 字母 蓝宝石 M,服饰内衣>男装>T恤>扎卡湾（Zaka Wan）>扎卡湾 2013新款特价男士纯棉圆领短袖...,京东商城,扎卡湾旗舰店
1008002020,服饰、鞋、包|男装|大码男装,扎卡湾 2013新款特价男士纯棉圆领短袖T恤宽松特大加肥加大码半袖上衣服38号(绿色 XL),服饰鞋帽>T恤>扎卡湾>扎卡湾 2013新款特价男士纯棉圆领短袖T恤宽松特大加肥加大码半袖上衣服38号(绿色 XL),国美电器网上商城,扎卡湾官方旗舰店
1008002020,服饰、鞋、包|男装|大码男装,BXMAN 纯棉男士内裤男平角阿罗裤宽松家居短睡裤BOXER CB912 XXL(建议2尺6-3尺5),服饰内衣>内衣>男式内裤> BXMAN>BXMAN 纯棉男士内裤男平角阿罗裤宽松...,京东商城,C.CTN
1008002020,服饰、鞋、包|男装|大码男装,American Eagle 美国之鹰 男士纯棉时尚休闲宽松牛仔长裤 A00008 蓝色04 W30,American Eagle 美国之鹰 ...,京东商城,美国宝贝店
1008002020,服饰、鞋、包|男装|大码男装,扎卡湾 2013新款特价男士纯棉圆领短袖T恤宽松特大加肥加大码打篮球半袖上衣服 38号 黄色 XL,服饰鞋帽>男装>T恤>扎卡湾 2013新款特价男士纯棉圆领短袖...,京东商城,扎卡湾旗舰店
1008002020,服饰、鞋、包|男装|大码男装,FREEGUN 京品年货 纯色男内裤平角裤 中腰潮男士内裤宽松 黑色 L,服饰内衣>内衣>男式内裤>其他>FREEGUN 京品年货 纯色男内裤平角...,京东商城,FREEGUN官方旗舰店
1008002020,服饰、鞋、包|男装|大码男装,水晶豆中老年内裤男士纯棉三角内裤老年人内裤棉档宽松大码 正品老人男裤头 深兰色 110(腰围2.8-3尺),服饰内衣>内衣>男式内裤>水晶豆（shuijingdou）>水晶豆中老年内裤男士纯棉三角内裤老年人内...,京东商城,水晶豆旗舰店
1008002020,服饰、鞋、包|男装|大码男装,【2条装】畅舒优 阿罗裤 男士内裤 纯棉 宽松 全棉休闲透气家居睡裤 2314 黄色+黑色 XXL(95KG以下),服饰内衣>内衣>男式内裤> 畅舒优>【2条装】畅舒优 阿罗裤 男士内裤 纯棉...,京东商城,畅舒优旗舰店
1008002020,服饰、鞋、包|男装|大码男装,良布 加大码短袖T恤男装夏装男士短袖T恤加肥加大码个性圆领打底衫休闲半袖宽松男装 藏青色 2XL,服饰内衣>男装>大码男装> 良布>良布 加大码短袖T恤男装夏装男士短袖T恤...,京东商城,良布官方旗舰店
1008002020,服饰、鞋、包|男装|大码男装,CHUJI 秋装新款 摇滚音乐狂 潮流宽松男装 加肥加大号胖子长袖t恤 黄色-ROCK 6XL(胸围136CM),服饰内衣>男装>T恤>初己（CHUJI）>CHUJI 秋装新款 摇滚音乐狂 潮流宽...,京东商城,初己旗舰店
1008002020,服饰、鞋、包|男装|大码男装,良布 加大码短袖T恤男装 夏季装男装半袖T恤加肥大码男士宽松打底小衫潮男装 黑色 2XL,服饰内衣>男装>大码男装> 良布>良布 加大码短袖T恤男装 夏季装男装半袖...,京东商城,良布官方旗舰店
1008002020,服饰、鞋、包|男装|大码男装,金丰田Eagic系列男士精疏纯棉罗纹宽松平角裤E1005一条 深卡其 XXL,服饰鞋帽>内衣>男式内裤>金丰田Eagic系列男士精疏纯棉罗纹宽松...,京东商城,金丰田
1008002020,服饰、鞋、包|男装|大码男装,顶美加肥加大码特大号男士特胖人宽松平角肥佬内裤内衣短裤头最大9XL（1030加 纯色藏青 6XL(适合3尺4左右),服饰内衣>内衣>男式内裤>顶美（dingmei）>顶美加肥加大码特大号男士特胖人宽松平角肥...,京东商城,顶美京东旗舰店
1008002020,服饰、鞋、包|男装|大码男装,Dockers码头工人 男士商务休闲宽松直筒裤 手机裤R00009 棕色01 W36,Dockers码头工人 男士商务休闲宽松...,京东商城,美国宝贝店
1008002020,服饰、鞋、包|男装|大码男装,依泽麦布2014夏装男士短袖T恤宽松新款短袖T恤 加肥加大男装大码T恤 8321 黑色 XXXL,服饰内衣>男装>T恤>依泽麦布>依泽麦布2014夏装男士短袖T恤宽松新款...,京东商城,依泽麦布旗舰店
1008002020,服饰、鞋、包|男装|大码男装,C.CTN(两条装)纯棉条纹男士平角内裤 阿罗裤 宽松短睡裤 CB141 条纹 M,C.CTN(两条装)纯棉条纹男士平角内裤...,京东商城,C.CTN
1008002020,服饰、鞋、包|男装|大码男装,胖胖星球JSmix 情侣装胖子大码男装加肥加大短袖T恤男士宽松X1773 货到付 X1773深灰色(男款) 3XL-胸围123CM,服饰内衣>男装>大码男装> Jsmix>胖胖星球JSmix 情侣装胖子大码男装加...,京东商城,Jsmix大码男装旗舰店
1008002020,服饰、鞋、包|男装|大码男装,第五街 5th street经典款男士直筒炫色休闲宽松牛仔长裤03019133 中灰色086 31,第五街 5th street经典款男士直...,京东商城,第五街
1008002020,服饰、鞋、包|男装|大码男装,特价男士纯棉圆领短袖T恤 宽松特大加肥加大码半袖 烫金花款 黑色 XL,服饰鞋帽>男装>T恤>特价男士纯棉圆领短袖T恤 宽松特大加肥加...,京东商城,时尚芭莎
1008002020,服饰、鞋、包|男装|大码男装,INTOUCH 超舒适时尚格子宽松休闲家居裤 男士 靓腰四角阿罗裤 D26 红小 L,服饰鞋帽>内衣>男式内裤>INTOUCH 超舒适时尚格子宽松休闲家...,京东商城,Intouch旗舰店
1008002020,服饰、鞋、包|男装|大码男装,维仕威莫代尔男士内裤 u凸囊袋平角裤 无痕宽松内裤 C01 深紫色 L-170,维仕威莫代尔男士内裤 u凸囊袋平角裤 无...,京东商城,维仕威
1008002020,服饰、鞋、包|男装|大码男装,加肥胖子特大码T恤男装翻领长袖高弹宽松大号胖人长袖体恤008,服装?>?男士服装?>?T恤?>?商品详情,当当网,书生豪气
1008002020,服饰、鞋、包|男装|大码男装,金丰田男士本命年马年宽松纯棉平角裤 红色全棉男式内裤509 红色 M,服饰内衣>内衣>男式内裤>金丰田>金丰田男士本命年马年宽松纯棉平角裤 红色...,京东商城,金丰田
1008002020,服饰、鞋、包|男装|大码男装,奥伊尔曼夏季新款加肥加大码大号胖子休闲宽松卫裤男装休闲七分裤F13625# 绿蓝 6XL码,服饰内衣>男装>休闲裤> 奥伊尔曼>奥伊尔曼夏季新款加肥加大码大号胖子休闲宽...,京东商城,奥伊尔曼大码肥人专卖店
1008002020,服饰、鞋、包|男装|大码男装,春秋新款男士修身韩版直筒宽松运动棉长裤JP331 004 XK232 黑色 XXXL,春秋新款男士修身韩版直筒宽松运动棉长裤J...,京东商城,MUGUO
1008002020,服饰、鞋、包|男装|大码男装,23MEN 爱杉士 【爱的宣言,46种语言的“我爱你”】男士情侣款超舒适竹纤维时尚婚庆平角内裤/平角裤 有加大码SLUW525 黑色,首页> 内衣> 男士内衣> 内裤> 平角内裤> 23MEN 爱杉士 【爱的宣言,46种语言的“我爱你”】男士情侣款超舒适竹纤维时尚婚庆平角内裤/平角
1008002020,服饰、鞋、包|男装|大码男装,Dockers码头工人 男士商务休闲宽松直筒裤 手机裤R00009 黑色04 W40,Dockers码头工人 男士商务休闲宽松...,京东商城,美国宝贝店
1008002020,服饰、鞋、包|男装|大码男装,扎卡湾 2013新款特价男士纯棉圆领短袖T恤宽松特大加肥加大码打篮球半袖上衣服 骆驼样式 白色 M,服饰鞋帽>男装>T恤>扎卡湾 2013新款特价男士纯棉圆领短袖...,京东商城,扎卡湾旗舰店
1008002020,服饰、鞋、包|男装|大码男装,UYUK 有衣有靠 春装男士圆领纯棉长袖T恤中国风鲤鱼印花宽松休闲加大加肥码长袖t恤,服饰箱包 > 男装 > T恤、Polo衫 > T恤,亚马逊(卓越网),$N
1008002020,服饰、鞋、包|男装|大码男装,玉康冬季男士珊瑚绒三层夹棉睡袍加肥加大加厚款式浴袍冬天超厚Y5208 图片色 XL,服饰内衣>内衣>睡衣>玉康（yukang）>玉康冬季男士珊瑚绒三层夹棉睡袍加肥加大加...,京东商城,玉康梦幻香旗舰店
1008002020,服饰、鞋、包|男装|大码男装,时尚芭莎新款男士纯棉圆领短袖T恤 宽松特大 加肥加大 男士T恤 纯棉T恤 流川枫款 大红 L,服饰鞋帽>男装>T恤>时尚芭莎新款男士纯棉圆领短袖T恤 宽松特...,京东商城,时尚芭莎
1008002020,服饰、鞋、包|男装|大码男装,许巴 男内裤 纯棉内裤 条纹宽松透气平角裤 男士内裤 七色可选XB1311215 黑色XB1311215002,首页 >内衣 >男士内衣 >男士内裤 >许巴 男内裤 纯棉内裤 条纹宽松透气平角裤 男士内裤 七色可选XB1311215,vjia,XUBA许巴官方旗舰店
1008002020,服饰、鞋、包|男装|大码男装,北极绒莫代尔加肥加大码男士特胖人宽松平角肥佬内裤 短裤头 一条装,首页 > 内衣 > 平角 > 北极绒莫代尔加肥加大码男士特胖人宽松平角肥佬内裤 短裤头 一条装,乐蜂网,北极绒
1008002020,服饰、鞋、包|男装|大码男装,RE-SP重塑2013新款男士纯棉圆领短袖T恤宽松特大加肥加大码打篮球半袖上衣 黄色 S,服饰内衣>男装>T恤>重塑 RE-SP>RE-SP重塑2013新款男士纯棉圆领短...,京东商城,RE-SP重塑旗舰店
1008002020,服饰、鞋、包|男装|大码男装,书生豪气 夏季新款男士T恤短袖直筒休闲男体恤加肥加大码胖子宽松156253,所有分类>服饰内衣、鞋靴童装>男装>T恤>书生豪气>书生豪气 夏季新款男...,1号店,书生豪气
1008002020,服饰、鞋、包|男装|大码男装,猫人 情侣内裤纯棉内衣金色酷猫性感男士平角裤中腰 宽松U凸设计吸汗透气 女士内裤 漂白-女 XL,服饰内衣>内衣>男式内裤> 猫人（maoren）>猫人 情侣内裤纯棉内衣金色酷猫性感男士平...,京东商城,猫人齐氏专卖店
1008002020,服饰、鞋、包|男装|大码男装,健将肥佬内裤 纯棉 透气吸汗 加大码男士三角内裤 宽松纯色男内裤 两条装 四色随机 5XL,服饰内衣>内衣>男式内裤>健将>健将肥佬内裤 纯棉 透气吸汗 加大码男士...,京东商城,正通人和服饰专营店
1008002020,服饰、鞋、包|男装|大码男装,新款男士纯棉圆领短袖T恤 宽松特大 加肥加大码 半袖CONVERSE款 灰色 XXL,服饰内衣>男装>T恤>雅戈蓝>新款男士纯棉圆领短袖T恤 宽松特大 加肥...,京东商城,时尚芭莎
1008002020,服饰、鞋、包|男装|大码男装,扎卡湾 2013新款特价男士纯棉圆领短袖T恤宽松特大加肥加大码打篮球半袖上衣服 帽子 黑色 M,服饰鞋帽>男装>T恤>扎卡湾 2013新款特价男士纯棉圆领短袖...,京东商城,扎卡湾旗舰店
1008002020,服饰、鞋、包|男装|大码男装,BXMAN 精品纯棉男士内裤男平角阿罗裤宽松家居睡裤BOXER 精致松紧3条装 M(建议腰围2尺-2尺6),服饰内衣>内衣>男式内裤>BXMAN>BXMAN 精品纯棉男士内裤男平角阿罗裤...,京东商城,C.CTN
1008002020,服饰、鞋、包|男装|大码男装,2014多款式加大加肥短袖圆领T恤 特大号胖子大码宽松个性男士纯棉t恤耳机 A 白色 XXXXL,服饰内衣>男装>T恤> 扎卡湾（Zaka Wan）>2014多款式加大加肥短袖圆领T恤 特大...,京东商城,扎卡湾旗舰店
1008002020,服饰、鞋、包|男装|大码男装,时尚芭莎新款男士纯棉圆领短袖T恤 宽松特大 加肥加大 男士T恤 纯棉T恤 流川枫款 墨绿色 3XL,服饰鞋帽>男装>T恤>时尚芭莎新款男士纯棉圆领短袖T恤 宽松特...,京东商城,时尚芭莎
1008002020,服饰、鞋、包|男装|大码男装,维仕威 特价精梳棉抗菌男士三角内裤 男纯棉单层无痕宽松内裤 A01 深花灰 L-170,维仕威 特价精梳棉抗菌男士三角内裤 男纯...,京东商城,维仕威
1008002020,服饰、鞋、包|男装|大码男装,RE-SP重塑 2013新款男士肥佬宽松T恤短袖 加肥加大码男装 胖子T恤 DAT-38号 紫色 M,服饰内衣>男装>T恤>重塑 RE-SP>RE-SP重塑 2013新款男士肥佬宽松...,京东商城,RE-SP重塑旗舰店
1008002020,服饰、鞋、包|男装|大码男装,【货到付款】男士纯棉圆领短袖T恤宽松特大加肥加大码打篮球半袖上衣服 美国英雄 黑色 L,服饰内衣>男装>T恤>扎卡湾（Zaka Wan）>【货到付款】男士纯棉圆领短袖T恤宽松特大...,京东商城,扎卡湾旗舰店
1008002020,服饰、鞋、包|男装|大码男装,Dockers 男士棉质商务休闲宽松休闲裤R00007 棕色02 W32,Dockers 男士棉质商务休闲宽松休闲...,京东商城,美国宝贝店
1008002020,服饰、鞋、包|男装|大码男装,【FEIPINPAI】天丝+牛奶蛋白纤维时尚商务男士休闲裤（宽松）(nonbrand)NON1116/00003-04 灰色 35(2.76尺),【FEIPINPAI】天丝+牛奶蛋白纤维...,京东商城,FEIPINPAI
1008002020,服饰、鞋、包|男装|大码男装,扎卡湾 2013新款特价男士纯棉圆领短袖T恤宽松特大加肥加大码打篮球半袖上衣服 骆驼样式 白色 XL,服饰鞋帽>男装>T恤>扎卡湾 2013新款特价男士纯棉圆领短袖...,京东商城,扎卡湾旗舰店
1008002020,服饰、鞋、包|男装|大码男装,BXMAN 男士内裤宽松透气平角阿罗裤舒适家居短睡裤新款棉质弹力 C3 XXL(建议2尺6-3尺5),服饰内衣>内衣>男式内裤> BXMAN>BXMAN 男士内裤宽松透气平角阿罗裤舒...,京东商城,C.CTN
1008002020,服饰、鞋、包|男装|大码男装,小护士 男士顶级莫代尔烫银短袖套装 XAT009宽松大版 经典黑 170/100,服饰鞋帽>内衣>家居>小护士 男士顶级莫代尔烫银短袖套装 XA...,京东商城,小护士
1008002020,服饰、鞋、包|男装|大码男装,扎卡湾 2013新款特价男士纯棉圆领短袖T恤宽松特大加肥加大码打篮球半袖上衣服 滑板 白色 XXXL,服饰鞋帽>男装>T恤>扎卡湾 2013新款特价男士纯棉圆领短袖...,京东商城,扎卡湾旗舰店
1008002020,服饰、鞋、包|男装|大码男装,健将男士肥佬裤 多条装 莫代尔透气男士平角裤 加肥加大码宽松男内裤 04-702+482四条装多色 5XL,服饰内衣>内衣>男式内裤> 健将>健将男士肥佬裤 多条装 莫代尔透气男士平...,京东商城,正通人和服饰专营店
1008002020,服饰、鞋、包|男装|大码男装,金丰田 男士阿罗裤纯棉　宽松平角裤　全棉舒适3127,所有分类>服饰内衣、鞋靴童装>内衣>内裤>金丰田>金丰田 男士阿罗裤纯...,1号店,金丰田
1008002020,服饰、鞋、包|男装|大码男装,庄吉Judger 2013春秋新款休闲百搭直筒宽松男士单裤 DK015F1003500 白色 41,庄吉Judger 2013春秋新款休闲百...,京东商城,庄吉官方旗舰店
