1008002020,服饰、鞋、包|男装|大码男装,玖禾悠莱 新款春夏装圆领男士短袖t恤 男装韩版宽松胖子加肥加大码纯棉短袖潮T恤 纯色t恤 白色 4XL,服饰内衣>男装>T恤>玖禾悠莱>玖禾悠莱 新款春夏装圆领男士短袖t恤 男...,京东商城,玖禾悠莱官方旗舰店
1008002020,服饰、鞋、包|男装|大码男装,特价 飞秒纯棉男士内裤 u凸囊袋纯色平角裤宽松内裤F012,服饰内衣>内衣>男式内裤>飞秒（feimiao）>特价 飞秒纯棉男士内裤 u凸囊袋纯色平角...,京东商城,飞秒内裤旗舰店
1008002020,服饰、鞋、包|男装|大码男装,千竹坊竹纤维男士平角内裤 全镂空透气宽松无痕大码U凸内裤 NK023 宝蓝 XXXL,服饰内衣>内衣>男式内裤> 千竹坊>千竹坊竹纤维男士平角内裤 全镂空透气宽松...,京东商城,千竹坊内衣专卖店
1008002020,服饰、鞋、包|男装|大码男装,C.CTN(两条装)纯棉条纹男士平角内裤 阿罗裤 宽松短睡裤 CB141 CB604 M(建议腰围2尺-2尺6),C.CTN(两条装)纯棉条纹男士平角内裤...,京东商城,C.CTN
1008002020,服饰、鞋、包|男装|大码男装,男士四角内裤竹炭纤维四角内裤男宽松平角裤头男平角1108,服装 > 内衣袜品 > 内裤,当当网,SUZLE 苏泽尔
1008002020,服饰、鞋、包|男装|大码男装,七匹狼SEPTWOLVES男士全棉三角内裤/纯棉内裤 宽松舒适型（2条装） 03576/两条装颜色随机 XL,服饰内衣>内衣>男式内裤>七匹狼（SEPTWOLVES）>七匹狼SEPTWOLVES男士全棉三角内...,京东商城,盛旺服饰旗舰店
1008002020,服饰、鞋、包|男装|大码男装,时尚芭莎 清仓特价新品男士纯棉圆领短袖T恤 宽松特大加肥加大码半袖 男士t恤 北款 紫色 L,服饰内衣>男装>T恤>雅戈蓝>时尚芭莎 清仓特价新品男士纯棉圆领短袖T...,京东商城,时尚芭莎
1008002020,服饰、鞋、包|男装|大码男装,BXMAN 新款男士内裤平角裤阿罗裤宽松舒适纯棉弹力 C4 L(建议2尺2-2尺8),服饰内衣>内衣>男式内裤> BXMAN>BXMAN 新款男士内裤平角裤阿罗裤宽松...,京东商城,C.CTN
1008002020,服饰、鞋、包|男装|大码男装,金丰田男士夏季加大码纯棉宽松家居短裤平角裤 3170一条装 青色系 4XL,金丰田>金丰田男士夏季加大码纯棉宽松家居短裤平角...,京东商城,金丰田
1008002020,服饰、鞋、包|男装|大码男装,RE-SP重塑2013新款男士纯棉圆领短袖T恤宽松特大加肥加大码打篮球半袖上衣 红色 S/120斤-135斤,服饰鞋帽>男装>T恤>RE-SP重塑2013新款男士纯棉圆领短...,京东商城,RE-SP重塑旗舰店
1008002020,服饰、鞋、包|男装|大码男装,BXMAN 男士内裤 平角阿罗裤 纯棉宽松舒适BOXER 903 903 XL,首页>服装鞋帽>内衣>内裤>BXMAN男士内裤平角阿罗裤纯...,苏宁,删除
1008002020,服饰、鞋、包|男装|大码男装,良布 加大码短袖T恤男装 夏季装男装半袖T恤加肥大码男士宽松打底小衫潮男装 黑色 2XL,服饰内衣>男装>大码男装> 良布>良布 加大码短袖T恤男装 夏季装男装半袖...,京东商城,良布官方旗舰店
1008002020,服饰、鞋、包|男装|大码男装,轩姿鸟夏季莫代尔加肥加大码宽松圆领男士T恤短袖弹力莱卡竹纤维 白色 185/105(XXL),服饰内衣>内衣>保暖内衣> 轩姿鸟>轩姿鸟夏季莫代尔加肥加大码宽松圆领男士T...,京东商城,轩姿鸟官方旗舰店
1008002020,服饰、鞋、包|男装|大码男装,扎卡湾 2013新款特价男士纯棉圆领短袖T恤宽松特大加肥加大码打篮球半袖上衣服 骆驼样式 黄色 XL,服饰鞋帽>男装>T恤>扎卡湾 2013新款特价男士纯棉圆领短袖...,京东商城,扎卡湾旗舰店
1008002020,服饰、鞋、包|男装|大码男装,I'm David 爱大卫 夏装 韩版正品男士宽松三色休闲裤DKPT3114 石头色/ST 165/72A/28/S,爱大卫（Im david）>I'm David 爱大卫 夏装 韩版正...,京东商城,百家好basic house
1008002020,服饰、鞋、包|男装|大码男装,韦恩泽维尔 加肥加大胖人潮男士夏装宽松短袖时尚拼皮短袖T恤#175 白色 XXL,服饰鞋帽>男装>大码装>韦恩泽维尔 加肥加大胖人潮男士夏装宽松短...,京东商城,韦恩泽维尔旗舰店
1008002020,服饰、鞋、包|男装|大码男装,Calvin Klein ck男士宽松直筒时尚休闲牛仔长裤C00012 深蓝水洗 W32,Calvin Klein>Calvin Klein ck男士宽松直...,京东商城,美国宝贝店
1008002020,服饰、鞋、包|男装|大码男装,骄圣鸟中老年内裤男士纯棉三角内裤老年人内裤棉档宽松 正品老人男裤头 浅兰色 115公分(3-3.2尺),服饰内衣>内衣>男式内裤> 骄圣鸟（jiaoshengniao）>骄圣鸟中老年内裤男士纯棉三角内裤老年人内...,京东商城,骄圣鸟服饰旗舰店
1008002020,服饰、鞋、包|男装|大码男装,千竹坊竹纤维男士平角内裤 全镂空透气宽松无痕大码U凸内裤 NK023 宝蓝 XXL,服饰内衣>内衣>男式内裤> 千竹坊>千竹坊竹纤维男士平角内裤 全镂空透气宽松...,京东商城,千竹坊内衣专卖店
1008002020,服饰、鞋、包|男装|大码男装,新款男士纯棉圆领短袖T恤 宽松特大 加肥加大码 半袖Ball款 白色 3XL,服饰内衣>男装>T恤>雅戈蓝>新款男士纯棉圆领短袖T恤 宽松特大 加肥...,京东商城,时尚芭莎
1008002020,服饰、鞋、包|男装|大码男装,VeniMasee 男式阿罗裤宽松拼色平角裤家居运动男士内裤纯棉透气 宝蓝色 XXL 3尺-3尺3,服饰内衣>内衣>男式内裤> VENI MASEE >VeniMasee 男式阿罗裤宽松拼色平...,京东商城,venimasee旗舰店
1008002020,服饰、鞋、包|男装|大码男装,茵宝umbro男士快干足球运动裤训练比赛球裤日常生活休闲宽松裤 桔色 M,服饰内衣>运动>运动裤>茵宝（Umbro）>茵宝umbro男士快干足球运动裤训练比赛...,京东商城,运动世家服饰专营店
1008002020,服饰、鞋、包|男装|大码男装,BENCL本客 春装新款 加肥加大胖人长袖上衣 男士大码宽松V领T恤衫,所有分类>服饰内衣、鞋靴童装>男装>T恤>BENCL本客>BENCL本客 春装...,1号店,BENCL本客
1008002020,服饰、鞋、包|男装|大码男装,雪完美男士内裤运动内裤速干U凸竹浆纤维内裤男生平角裤宽松透气 竹纤维运动内裤 番洋红 M,服饰内衣>内衣>男式内裤>雪完美（CUA）>雪完美男士内裤运动内裤速干U凸竹浆纤维内...,京东商城,
1008002020,服饰、鞋、包|男装|大码男装,韦恩泽维尔 货到付款 男士加肥加大圆领短袖t恤 宽松条纹打底衫 潮胖2013 灰色 XXXL(胸围138CM),服饰内衣>男装>大码男装> 韦恩泽维尔>韦恩泽维尔 货到付款 男士加肥加大圆领短...,京东商城,韦恩泽维尔旗舰店
1008002020,服饰、鞋、包|男装|大码男装,良布 加大码短袖T恤男装夏装男士短袖T恤加肥加大码个性圆领打底衫休闲半袖宽松男装 藏青色 2XL,服饰内衣>男装>大码男装> 良布>良布 加大码短袖T恤男装夏装男士短袖T恤...,京东商城,良布官方旗舰店
1008002020,服饰、鞋、包|男装|大码男装,卡闲/kaxes 2013冬款男士加绒加厚运动休闲套装 男士翻领开衫保暖加大大码运动服套装,所有分类>运动户外>运动服/包/配件>运动套装>卡闲/kaxes>卡闲/kaxes 2...,1号店,卡闲/kaxes
1008002020,服饰、鞋、包|男装|大码男装,RE-SP重塑 2013新款男士肥佬宽松T恤短袖 加肥加大码男装 胖子T恤 DAT-38号 蓝色 XXL,服饰内衣>男装>T恤>重塑 RE-SP>RE-SP重塑 2013新款男士肥佬宽松...,京东商城,RE-SP重塑旗舰店
1008002020,服饰、鞋、包|男装|大码男装,顶美加肥加大码特大号男士特胖人宽松平角肥佬内裤内衣短裤头最大9XL（1030加 花色浅灰 7XL(适合3尺6左右),服饰内衣>内衣>男式内裤> 顶美（dingmei）>顶美加肥加大码特大号男士特胖人宽松平角肥...,京东商城,顶美京东旗舰店
1008002020,服饰、鞋、包|男装|大码男装,扎卡湾 2014多款式加大加肥夜光短袖圆领T恤 特大号胖子宽松个性男士纯棉t恤衫 fxck M(体重130斤-150斤),服饰内衣>男装>T恤>扎卡湾（Zaka Wan）>扎卡湾 2014多款式加大加肥夜光短袖圆...,京东商城,扎卡湾旗舰店
1008002020,服饰、鞋、包|男装|大码男装,货到付款 胖胖星球JSmix 潮胖子大码男士宽松插肩短袖T恤加肥加大男装X1708 X1708蓝色 5XL-胸围138CM,服饰内衣>男装>大码男装> Jsmix>货到付款 胖胖星球JSmix 潮胖子大码...,京东商城,Jsmix大码男装旗舰店
1008002020,服饰、鞋、包|男装|大码男装,时尚芭莎新款男士纯棉圆领短袖T恤 宽松特大 加肥加大 男士T恤 纯棉T恤 流川枫款 蓝色 M,服饰鞋帽>男装>T恤>时尚芭莎新款男士纯棉圆领短袖T恤 宽松特...,京东商城,时尚芭莎
1008002020,服饰、鞋、包|男装|大码男装,古仕卡特男装 2014夏新款欧美宽松大码胖子男士短袖T恤衫 纯棉透气弹力t桖DT8001 橙色 5xl,服饰内衣>男装>大码男装> GUSSKATER >古仕卡特男装 2014夏新款欧美宽松大码...,京东商城,GUSSKATER专营店
1008002020,服饰、鞋、包|男装|大码男装,棉文化 男士内裤纯棉中腰平角裤U凸囊袋阴囊托内裤宽松四角内裤性感春夏薄 单条0026 黑色 XXXL(190/105),服饰内衣>内衣>男式内裤> 棉文化（COTTON CULTURE）>棉文化 男士内裤纯棉中腰平角裤U凸囊袋阴...,京东商城,棉文化旗舰店
1008002020,服饰、鞋、包|男装|大码男装,韦恩泽维尔 加肥加大码短袖t恤 男士宽松打底衫上衣 潮胖子#1696 白色 M(胸围114CM),服饰内衣>男装>大码男装> 韦恩泽维尔>韦恩泽维尔 加肥加大码短袖t恤 男士宽松...,京东商城,韦恩泽维尔旗舰店
1008002020,服饰、鞋、包|男装|大码男装,夏装新款宽松男士短袖翻领t恤男装打底衫T恤衣服加大码男装J501 黑色灰领 4XL,首页>服装鞋帽>男装>男士T恤>夏装新款宽松男士短袖翻领t恤男装打底...,苏宁,Bebeeru
1008002020,服饰、鞋、包|男装|大码男装,2014春季新款AFS JEEP战地吉普男士纯棉长袖T恤 宽松加大码V领套头衫纯棉 灰绿 L建议145斤左右,首页>服装鞋帽>男装>男士T恤>2014春季新款AFSJEEP战地...,苏宁,AFS JEEP/战地吉普
1008002020,服饰、鞋、包|男装|大码男装,九年储创意V领短袖t恤 男士新款宽松大码男装t恤 加肥加大纯色潮款体恤衫 黑色 XXL,服饰鞋帽>男装>T恤>九年储创意V领短袖t恤 男士新款宽松大码...,京东商城,九年储旗舰店
1008002020,服饰、鞋、包|男装|大码男装,C.CTN 男士内裤平角阿罗裤 纯棉宽松家居睡裤 825+851+841+848 XL(建议腰围2尺4-3尺1),服饰内衣>内衣>男式内裤>C.CTN>C.CTN 男士内裤平角阿罗裤 纯棉宽松...,京东商城,C.CTN
1008002020,服饰、鞋、包|男装|大码男装,2014多款式加大加肥短袖圆领T恤 特大号胖子大码宽松个性男士纯棉t恤 法拉利 A 灰色 M,服饰内衣>男装>T恤> 扎卡湾（Zaka Wan）>2014多款式加大加肥短袖圆领T恤 特大...,京东商城,扎卡湾旗舰店
1008002020,服饰、鞋、包|男装|大码男装,维仕威莫代尔男士内裤 u凸囊袋平角裤 无痕宽松内裤 C01 深青色 L-170,维仕威莫代尔男士内裤 u凸囊袋平角裤 无...,京东商城,维仕威
1008002020,服饰、鞋、包|男装|大码男装,4条男士内裤冰丝内裤男 大码男士红内裤 潮 超人内裤宽松裤衩男 4色各一条6919 (4XL/190)特大宽体,服饰内衣>内衣>男式内裤> 浪莎（LangSha）>4条男士内裤冰丝内裤男 大码男士红内裤 ...,京东商城,仙痕服饰专营店
1008002020,服饰、鞋、包|男装|大码男装,RE-SP重塑 2013新款男士肥佬宽松T恤短袖 加肥加大码男装 胖子T恤 DAT-38号 灰色 M,服饰内衣>男装>T恤>重塑 RE-SP>RE-SP重塑 2013新款男士肥佬宽松...,京东商城,RE-SP重塑旗舰店
1008002020,服饰、鞋、包|男装|大码男装,WAYNEXZAVIER 韦恩泽维尔 大码男装 男士加肥加大圆领短袖T恤 宽松上衣潮WZ14B1815 花灰色,首页> 男装> T恤> 短袖T恤> WAYNEXZAVIER 韦恩泽维尔 大码男装 男士加肥加大圆领短袖T恤 宽松上衣潮WZ14B181,凡客诚品,WAYNEXZAVIER 韦恩泽维尔
1008002020,服饰、鞋、包|男装|大码男装,良布 加大码短袖T恤男装夏装男士短袖T恤加肥加大码个性圆领打底衫休闲半袖宽松男装 藏青色 2XL,服饰内衣>男装>大码男装> 良布>良布 加大码短袖T恤男装夏装男士短袖T恤...,京东商城,良布官方旗舰店
1008002020,服饰、鞋、包|男装|大码男装,【货到付款】 2013多款式加大加肥夜光短袖t恤 特大号胖子宽松个性男士短袖 纯棉t恤衫 三叶草 XXL200-218,服饰内衣>男装>T恤>扎卡湾（Zaka Wan）>【货到付款】 2013多款式加大加肥夜光...,京东商城,扎卡湾旗舰店
1008002020,服饰、鞋、包|男装|大码男装,雪完美男士内裤运动内裤速干U凸竹浆纤维内裤男生平角裤宽松透气 竹纤维运动内裤 深魅紫 L,服饰内衣>内衣>男式内裤>雪完美（CUA）>雪完美男士内裤运动内裤速干U凸竹浆纤维内...,京东商城,京珠内衣专营店
1008002020,服饰、鞋、包|男装|大码男装,良布 加大码短袖T恤男装 夏季装男装半袖T恤加肥大码男士宽松打底小衫潮男装 黑色 2XL,服饰内衣>男装>大码男装> 良布>良布 加大码短袖T恤男装 夏季装男装半袖...,京东商城,良布官方旗舰店
1008002020,服饰、鞋、包|男装|大码男装,C.CTN 纯棉男士内裤平角阿罗裤 本命年红色格子宽松舒适款 CB602 XL,服饰内衣>内衣>男式内裤>C.CTN 纯棉男士内裤平角阿罗裤 本命...,京东商城,C.CTN
1008002020,服饰、鞋、包|男装|大码男装,加肥胖子特大码T恤男装翻领长袖高弹宽松大号胖人长袖体恤100,服装?>?男士服装?>?T恤?>?商品详情,当当网,书生豪气
1008002020,服饰、鞋、包|男装|大码男装,新款特价男士纯棉圆领短袖T恤宽松特大加肥加大码英文字母HELIT半袖 枚红色 L,服饰内衣>男装>T恤>xieling>新款特价男士纯棉圆领短袖T恤宽松特大加肥...,京东商城,时装之苑
1008002020,服饰、鞋、包|男装|大码男装,【 货到付款】ACEFIT男式阿罗裤宽松平角裤加大家居睡裤男士内裤纯棉四角短裤 三条装 L 2.3-2.5 腰围,服饰内衣>内衣>男式内裤> 爱非特（Acefit）>【 货到付款】ACEFIT男式阿罗裤宽松...,京东商城,层峰鑫达专营店
1008002020,服饰、鞋、包|男装|大码男装,C.CTN 纯棉宽松内裤男平角裤男士阿罗裤短睡裤 加长水洗 CW188 M(建议腰围2尺3-2尺8),服饰内衣>内衣>男式内裤>C.CTN 纯棉宽松内裤男平角裤男士阿罗...,京东商城,C.CTN
1008002020,服饰、鞋、包|男装|大码男装,【京东直营】小护士2件装 男士中老年纯棉三角内裤JMN 全棉亲肤/宽松透气 浅灰+铁灰 L(170/100),服饰内衣>内衣>男式内裤>小护士>【京东直营】小护士2件装 男士中老年纯棉...,京东商城,小护士
1008002020,服饰、鞋、包|男装|大码男装,时尚芭莎新款男士纯棉圆领短袖T恤 宽松特大 加肥加大 男士T恤 纯棉T恤 流川枫款 玫红 3XL,服饰鞋帽>男装>T恤>时尚芭莎新款男士纯棉圆领短袖T恤 宽松特...,京东商城,时尚芭莎
1008002020,服饰、鞋、包|男装|大码男装,24H发货包邮 健将男士平角内裤 品牌正品 U凸竹浆纤维 宽松 男 平角裤 单条装 可 深蓝色 XXL-身高175/腰围95,服饰内衣>内衣>男式内裤>24H发货包邮 健将男士平角内裤 品牌正...,京东商城,健将xns专卖店
1008002020,服饰、鞋、包|男装|大码男装,金丰田男士纯棉宽松家居裤 全棉布阿罗裤3127两条装 绿色 M,服饰内衣>内衣>家居>金丰田男士纯棉宽松家居裤 全棉布阿罗裤3...,京东商城,金丰田
1008002020,服饰、鞋、包|男装|大码男装,C.CTN 男士内裤平角阿罗裤 纯棉宽松加长柔软水洗 CB607 L(建议腰围2尺5-3尺1),服饰内衣>内衣>男式内裤>C.CTN>C.CTN 男士内裤平角阿罗裤 纯棉宽松...,京东商城,C.CTN
1008002020,服饰、鞋、包|男装|大码男装,七匹狼内裤 男士 平角 宽松舒适型 全棉撞线 2条装 03343,服装?>?内衣袜品?>?内裤?>?商品详情,当当网,七匹狼
1008002020,服饰、鞋、包|男装|大码男装,ZOKE/洲克 游泳裤 男 五分 平角时尚男士泳衣宽松加肥加大码温泉低腰潮男款 16749,所有分类>运动户外>球类/健身>游泳>男士泳衣>ZOKE/洲克>ZOKE/洲克 游泳...,1号店,ZOKE/洲克
1008002020,服饰、鞋、包|男装|大码男装,莱派蒂 【包邮 货到付款】热卖爆款男内裤 可爱蓝色胖子卡通中腰内裤 男士平角内裤912-NK66 蓝色胖子,首页 >内衣 >男士内衣 >男士内裤 >莱派蒂 【包邮 货到付款】热卖爆款男内裤 可爱蓝色胖子卡通中腰内裤 男士平角内裤912-NK66,vjia,咪琦服饰旗舰店
1008002020,服饰、鞋、包|男装|大码男装,BXMAN 新款男士内裤平角裤阿罗裤宽松舒适纯棉弹力 C3 L(建议2尺2-2尺8),服饰内衣>内衣>男式内裤> BXMAN>BXMAN 新款男士内裤平角裤阿罗裤宽松...,京东商城,C.CTN
1008002020,服饰、鞋、包|男装|大码男装,2013春季新款休闲时尚个性宽松加肥加大男士短袖T恤 JTA339 055 100黑色 3XL,服饰鞋帽>男装>T恤>2013春季新款休闲时尚个性宽松加肥加大...,京东商城,伯克思
1008002020,服饰、鞋、包|男装|大码男装,新款优惠 男士纯棉圆领短袖T恤 宽松加肥加大码可选 自行车运动款 宝蓝色 XXL,服饰鞋帽>男装>T恤>新款优惠 男士纯棉圆领短袖T恤 宽松加肥...,京东商城,时尚芭莎
1008002020,服饰、鞋、包|男装|大码男装,夏装新款宽松男士短袖翻领t恤男装打底衫T恤衣服加大码男装J501 黑色灰领 L,首页>服装鞋帽>男装>男士T恤>夏装新款宽松男士短袖翻领t恤男装打底...,苏宁,Bebeeru
1008002020,服饰、鞋、包|男装|大码男装,时尚芭莎年中清仓特价夏季热卖男士纯棉圆领短袖T恤 宽松特大加肥加大码 犀牛款 浅灰 M,服饰鞋帽>男装>T恤>时尚芭莎年中清仓特价夏季热卖男士纯棉圆领...,京东商城,时尚芭莎
1008002020,服饰、鞋、包|男装|大码男装,扎卡湾 2013新款特价男士纯棉圆领短袖T恤宽松特大加肥加大码打篮球半袖上衣服 字母 蓝宝石 XXXXL,服饰鞋帽>男装>T恤>扎卡湾 2013新款特价男士纯棉圆领短袖...,京东商城,扎卡湾旗舰店
1008002020,服饰、鞋、包|男装|大码男装,良布 加大码短袖T恤男装夏装男士短袖T恤加肥加大码个性圆领打底衫休闲半袖宽松男装 白色 2XL,服饰内衣>男装>大码男装> 良布>良布 加大码短袖T恤男装夏装男士短袖T恤...,京东商城,良布官方旗舰店
1008002020,服饰、鞋、包|男装|大码男装,力将 男士家居裤 短睡裤 顶级精梳棉宽松平角内裤阿罗裤 4条装 L-2017 XL,服饰内衣>内衣>男式内裤>力将（lijiang）>力将 男士家居裤 短睡裤 顶级精梳棉宽松...,京东商城,力将内衣旗舰店
1008002020,服饰、鞋、包|男装|大码男装,扎卡湾 2013新款特价男士纯棉圆领短袖T恤宽松特大加肥加大码打篮球半袖上衣服 骆驼样式 白色 L,服饰鞋帽>男装>T恤>扎卡湾 2013新款特价男士纯棉圆领短袖...,京东商城,扎卡湾旗舰店
1008002020,服饰、鞋、包|男装|大码男装,九帝狼 2012秋冬新款直筒宽松男士商政休闲裤 7007 黑灰色 32,九帝狼 2012秋冬新款直筒宽松男士商...,京东商城,九帝狼
1008002020,服饰、鞋、包|男装|大码男装,4条男士内裤冰丝内裤男 大码男士红内裤 潮 超人内裤宽松裤衩男 2黑1藏青1灰8017 (2XL/180)简约时尚,服饰内衣>内衣>男式内裤> 浪莎（LangSha）>4条男士内裤冰丝内裤男 大码男士红内裤 ...,京东商城,仙痕服饰专营店
1008002020,服饰、鞋、包|男装|大码男装,2012新款歌瑞尔梦幻国度性感宽松男士平角裤 灰色撞红色 XXL,2012新款歌瑞尔梦幻国度性感宽松男士平...,京东商城,歌瑞尔
1008002020,服饰、鞋、包|男装|大码男装,扎卡湾 2013新款特价男士纯棉圆领短袖T恤宽松特大加肥加大码打篮球半袖上衣服 赛车 绿色 XL,服饰鞋帽>男装>T恤>扎卡湾 2013新款特价男士纯棉圆领短袖...,京东商城,扎卡湾旗舰店
1008002020,服饰、鞋、包|男装|大码男装,UYUK 有衣有靠 春装男士V领莱卡棉长袖T恤 个性拼皮领 加大加肥码宽松休闲t恤,服饰箱包 > 男装 > T恤、Polo衫 > T恤,亚马逊(卓越网),$N
1008002020,服饰、鞋、包|男装|大码男装,依泽麦布2014夏装男士短袖T恤宽松新款短袖T恤 加肥加大男装大码T恤 8321 黑色 XXL,服饰内衣>男装>T恤>依泽麦布>依泽麦布2014夏装男士短袖T恤宽松新款...,京东商城,依泽麦布旗舰店
1008002020,服饰、鞋、包|男装|大码男装,BXMAN 新款男士内裤平角裤阿罗裤宽松舒适纯棉弹力 S5 XL(建议2尺4-3尺1),服饰内衣>内衣>男式内裤> BXMAN>BXMAN 新款男士内裤平角裤阿罗裤宽松...,京东商城,C.CTN
1008002020,服饰、鞋、包|男装|大码男装,MOEE莫乙正品 韩版男士内裤大码宽松平角裤男式底裤透气四角裤sz029-80612 墨绿色 XXXL,服饰内衣>内衣>男式内裤> 莫乙（moee）>MOEE莫乙正品 韩版男士内裤大码宽松平...,京东商城,莫乙家居官方旗舰店
1008002020,服饰、鞋、包|男装|大码男装,朵彩 彩棉宽松男士平角内裤2条装 DA6842 棕色 XXXL,朵彩>朵彩 彩棉宽松男士平角内裤2条装 DA6...,京东商城,朵彩官方旗舰店
1008002020,服饰、鞋、包|男装|大码男装,奥派阿西 夏装新款 口袋纯色韩版宽松休闲裤七分裤 男士 12133 陀色 29,奥派阿西 夏装新款 口袋纯色韩版宽松休...,京东商城,奥派阿西
1008002020,服饰、鞋、包|男装|大码男装,特价男士纯棉圆领短袖T恤 宽松特大加肥加大码半袖 烫金花款 墨绿色 5XL,服饰鞋帽>男装>T恤>特价男士纯棉圆领短袖T恤 宽松特大加肥加...,京东商城,时尚芭莎
1008002020,服饰、鞋、包|男装|大码男装,拓品 夏装V领中年男士短袖T恤 纯棉莱卡宽松款纯色打底衫 胖子衣服男装半袖体恤 加肥加大码 黑色 M/175,服饰内衣>男装>T恤>拓品（TUOPIN）>拓品 夏装V领中年男士短袖T恤 纯棉莱卡...,京东商城,拓品官方旗舰店
1008002020,服饰、鞋、包|男装|大码男装,金丰田男士夏季加大码纯棉宽松家居短裤平角裤 3170一条装 浅灰色系 3XL,金丰田>金丰田男士夏季加大码纯棉宽松家居短裤平角...,京东商城,金丰田
1008002020,服饰、鞋、包|男装|大码男装,ZOD男士内裤平角裤纯全棉宽松男U凸囊袋透气四角裤低腰阿罗裤 白色小圆点 L,服饰内衣>内衣>男式内裤> ZOD>ZOD男士内裤平角裤纯全棉宽松男U凸囊袋...,京东商城,ZOD CUMO旗舰店
1008002020,服饰、鞋、包|男装|大码男装,23MEN 爱杉士 【春季新品,浪漫小清新情侣款内裤】男士超舒适竹纤维时尚婚庆平角内裤/平角裤 有加大码SLUW526 蓝色,首页> 内衣> 男士内衣> 内裤> 平角内裤> 23MEN 爱杉士 【春季新品,浪漫小清新情侣款内裤】男士超舒适竹纤维时尚婚庆平角内裤/平角裤 有加
1008002020,服饰、鞋、包|男装|大码男装,扎卡湾 2013新款特价男士纯棉圆领短袖T恤宽松特大加肥加大码打篮球半袖上衣服 帽子 黑色 XXL,服饰鞋帽>男装>T恤>扎卡湾 2013新款特价男士纯棉圆领短袖...,京东商城,扎卡湾旗舰店
1008002020,服饰、鞋、包|男装|大码男装,时尚芭莎新款男士纯棉圆领短袖T恤 宽松特大 加肥加大 男士T恤 纯棉T恤 流川枫款 黑色 M,服饰鞋帽>男装>T恤>时尚芭莎新款男士纯棉圆领短袖T恤 宽松特...,京东商城,时尚芭莎
1008002020,服饰、鞋、包|男装|大码男装,晨唐 2012秋冬新款男士时尚休闲宽松运动裤 CT309 军绿色 L,晨唐 2012秋冬新款男士时尚休闲宽松运...,京东商城,晨唐旗舰店
1008002020,服饰、鞋、包|男装|大码男装,玖禾悠莱 新款春夏装圆领男士短袖t恤男装韩版宽松胖子加肥加大码纯棉短袖潮T恤 纯色t恤 白色 3XL,服饰内衣>男装>T恤>玖禾悠莱>玖禾悠莱 新款春夏装圆领男士短袖t恤男装...,京东商城,玖禾悠莱官方旗舰店
1008002020,服饰、鞋、包|男装|大码男装,千竹坊竹纤维平角男士内裤 抗菌透气吸汗宽松无痕大码U凸内裤 男 平角 NK017四条装 二红二黄 XXXL,服饰内衣>内衣>男式内裤> 千竹坊>千竹坊竹纤维平角男士内裤 抗菌透气吸汗宽...,京东商城,千竹坊内衣专卖店
1008002020,服饰、鞋、包|男装|大码男装,庄吉Judger秋冬 水洗牛仔男士宽松休闲含棉舒适百搭款长裤DK202I0101621 牛仔灰 33(175/82),庄吉Judger秋冬 水洗牛仔男士宽松休...,京东商城,庄吉官方旗舰店
1008002020,服饰、鞋、包|男装|大码男装,男士长袖T恤衫 V领 拼接撞色男式上衣 男装胖子宽松加肥加大码装,服装?>?男士服装?>?T恤?>?男士长袖T恤衫?V领?拼接撞色男式上衣?男装胖子宽松加肥加大码装,当当网,无
1008002020,服饰、鞋、包|男装|大码男装,第五街 5th street经典款男士直筒炫色休闲宽松牛仔长裤03019133 朱红019 33,第五街 5th street经典款男士直...,京东商城,第五街
