1008002020,服饰、鞋、包|男装|大码男装,RE-SP重塑 2013新款男士肥佬宽松T恤短袖 加肥加大码男装 胖子T恤 DAT-38号 绿色 4XL/230斤-250斤,服饰鞋帽>男装>T恤>RE-SP重塑 2013新款男士肥佬宽松...,京东商城,RE-SP重塑旗舰店
1008002020,服饰、鞋、包|男装|大码男装,七匹狼 内裤男平角U凸设计性感潮中腰透气宽松青年裤头男士四角裤,所有分类>服饰内衣、鞋靴童装>内衣>内裤>七匹狼,1号店,内裤
1008002020,服饰、鞋、包|男装|大码男装,良布 加大码短袖T恤男装 夏季装男装半袖T恤加肥大码男士宽松打底小衫潮男装 白色 2XL,服饰内衣>男装>大码男装> 良布>良布 加大码短袖T恤男装 夏季装男装半袖...,京东商城,良布官方旗舰店
1008002020,服饰、鞋、包|男装|大码男装,【支持货到付款】ULICI 尤利奇 夏季人气民族风短T恤 男士加大码宽松休闲百搭T恤 牛仔蓝 5XL,服饰内衣>男装>T恤> ULICI>【支持货到付款】ULICI 尤利奇 夏季...,京东商城,尤利奇专营
1008002020,服饰、鞋、包|男装|大码男装,BENCL 大码男装2014春装 特大码加肥加大宽松翻领长袖 男士大号休闲polo衫 黄色 2XL,服饰内衣>男装>大码装>本客BENCL>BENCL 大码男装2014春装 特大码...,京东商城,本客旗舰店
1008002020,服饰、鞋、包|男装|大码男装,intouch男士内裤 平角家居阿罗裤 低腰宽松家居裤 平角裤D49 黑色 L,服饰鞋帽>内衣>男式内裤>intouch男士内裤 平角家居阿罗裤 ...,京东商城,Intouch旗舰店
1008002020,服饰、鞋、包|男装|大码男装,夏装新款宽松男士短袖翻领t恤男装打底衫T恤衣服加大码男装J6212 黑色 XXXL,首页>服装鞋帽>男装>男士T恤>夏装新款宽松男士短袖翻领t恤男装打底...,苏宁,BEBEERU
1008002020,服饰、鞋、包|男装|大码男装,ZOD内裤3件装男士内裤平角裤纯全棉宽松运动休闲U凸囊袋透气四 大圆点花色三件装 L 我有点贵 但我无比舒适,服饰内衣>内衣>男式内裤> ZOD>ZOD内裤3件装男士内裤平角裤纯全棉宽松...,京东商城,ZOD CUMO旗舰店
1008002020,服饰、鞋、包|男装|大码男装,时尚芭莎夏季热卖清仓特价新款男士纯棉圆领短袖T恤 宽松特大 加肥加大 半袖悍马款 白色 XL,服饰鞋帽>男装>T恤>时尚芭莎夏季热卖清仓特价新款男士纯棉圆领...,京东商城,时尚芭莎
1008002020,服饰、鞋、包|男装|大码男装,2014多款式加大加肥短袖圆领T恤 特大号胖子宽松个性男士t恤衫 安德万 A 白色 XXL/230-250,服饰内衣>男装>T恤> 扎卡湾（Zaka Wan）>2014多款式加大加肥短袖圆领T恤 特大...,京东商城,扎卡湾旗舰店
1008002020,服饰、鞋、包|男装|大码男装,NAJIE 夏季新品 男士短袖T恤 宽松大码加大全棉T恤 白色 XL,服饰内衣>男装>T恤> 纳捷>NAJIE 夏季新品 男士短袖T恤 宽松...,京东商城,纳捷商务男装旗舰店
1008002020,服饰、鞋、包|男装|大码男装,扎卡湾 2014多款式加大加肥夜光短袖圆领T恤 特大号胖子宽松个性男士纯棉t恤衫 张国荣 M(体重130斤-150斤),服饰内衣>男装>T恤>扎卡湾（Zaka Wan）>扎卡湾 2014多款式加大加肥夜光短袖圆...,京东商城,扎卡湾旗舰店
1008002020,服饰、鞋、包|男装|大码男装,春季新品七匹狼SEPTWOLVES男士内裤纯棉平角宽松舒适裤头居家裤衩全棉睡裤 2条装 D3305-2宝蓝+灰色 XXXL,服饰内衣>内衣>男式内裤>七匹狼（SEPTWOLVES）>春季新品七匹狼SEPTWOLVES男士内...,京东商城,七匹狼特约专卖店
