1018002011,数码|数码配件|电池、充电器,盛诺美 原装手表电池 RENATA 电池手表电池纽扣电池 电子 多种型号373/SR916SW,钟表 > 配件,亚马逊(卓越网),盛诺美
1018002011,数码|数码配件|电池、充电器,xustan 旭天 XST-E471B 手机智能充电展示防盗报警器,手机\通讯 > 手机配件 > 其他配件,亚马逊(卓越网),xustan
1018002011,数码|数码配件|电池、充电器,南孚 充电王+4节数码型5号(AA)2450毫安时,电脑办公?>?办公用品?>?其它?>?商品详情,当当网,南孚
1018002011,数码|数码配件|电池、充电器,DELIPPO USB充电线适用小米高清互联网电视盒 小米盒子电源适配器1代2代充电器线 带线充电器 1.5米长,数码>数码配件>电池/充电器> Delippo>DELIPPO USB充电线适用小米高清...,京东商城,delippo旗舰店
1018002011,数码|数码配件|电池、充电器,日本Ismartdigi LI40B电池（和卡西欧NP-80通用） 750毫安 (适配卡西欧ZS6 ZS100 ZS150 Z28 Z32 JE10 N20等)LI42B LI-40B电池,摄影\摄像 > 配件 > 电池、电源、充电器 > 相机电池,亚马逊(卓越网),Ismartdigi 爱仕码
1018002011,数码|数码配件|电池、充电器,Ponfei/深飞 迷你小巧 USB手机充电器 智能手机充电头 移动电源适配器 1.3大电流输出,所有分类>手机、数码、配件>数码配件>电池及充电器>Ponfei/深飞>Ponfei/深飞 ...,1号店,Ponfei/深飞
1018002011,数码|数码配件|电池、充电器,YUENTAME 越泰 七彩虹 Colorfly 平板电脑充电器 CT971 CT972 CT704 CT973 5V2A,手机\通讯 > 手机配件 > 电池\充电器 > 充电器,亚马逊(卓越网),YUENTAME 越泰
1018002011,数码|数码配件|电池、充电器,PISEN 品胜 W999二代充电器(IC SMART) 高效快速 适用三星电池型号：(EB445163VU) 适用三星手机：W999 S7530,手机\通讯 > 手机配件 > 电池\充电器 > 充电器,亚马逊(卓越网),Pisen 品胜
1018002011,数码|数码配件|电池、充电器,飞毛腿蓝调(TP) BL-5B 商务电池(适用诺基亚5200/5300/5320XM/6120C/6120CI等机型),手机\通讯 > 手机配件 > 电池\充电器 > 电池,亚马逊(卓越网),Scud 飞毛腿
1018002011,数码|数码配件|电池、充电器,【尼康EL12电池】尼康EN-EL12 S9200 S8200 S6300 P310 锂电池正品行货 假一罚十,当当网 > 数码影音 > 摄影摄像 > 摄影配件,当当网,Nikon
1018002011,数码|数码配件|电池、充电器,尼康(Nikon)原装电池 EN-EL20 适用J1 J2 相机电池 行货,数码影音?>?数码配件?>?电池/充电器?>?尼康(Nikon)原装电池?EN-EL20?适用J1?J2?相机电池?行货,当当网,尼康(Nikon)
1018002011,数码|数码配件|电池、充电器,FB沣标 NP-FP90电池 索尼SR100 HC96E SR60E SR80E HC3E,数码影音?>?数码配件?>?电池/充电器?>?商品详情,当当网,FB
1018002011,数码|数码配件|电池、充电器,hp 原装 惠普HP DV4 DV5 CQ71 CQ40 CQ45 CQ41 CQ61 笔记本电池 EV06,所有分类>电脑、平板、办公设备>周边配件>笔记本电池>hp,1号店,笔记本电池
1018002011,数码|数码配件|电池、充电器,FB沣标 夏普BT-L226U电池 VR-BL1 VR-BLZ7 VR-BLZ9,手机 摄影 数码>电池/充电器>沣标>FB沣标 夏普BT-L226U电池 VR-BL1 VR-BLZ7 VR-BLZ9,国美,沣标
1018002011,数码|数码配件|电池、充电器,Nikon/尼康BL-3 BL3 电池仓盖适合EN-EL4 EN-EL4A 锂电池正品行货,数码影音 > 数码配件 > 其它,当当网,Nikon/尼康
1018002011,数码|数码配件|电池、充电器,GoingPower 卓鹰 IBM T60 R60e T61 T60P SL300 SL400 SL500 笔记本电池 9芯 普屏,电脑\IT > 外设产品 > 笔记本、上网本配件 > 电池,亚马逊(卓越网),GoingPower 卓鹰
1018002011,数码|数码配件|电池、充电器,Kmashi 柯玛仕 for DELL/戴尔 OGW240 UK716 WK371 XR693 WP193 Inspiron 1525 Inspiron 1526 Inspiron 1545笔记本电池 全国联保,电脑\IT > 外设产品 > 笔记本、上网本配件 > 电池,亚马逊(卓越网),Kmashi 柯玛仕
1018002011,数码|数码配件|电池、充电器,【当当自营】 PADO 半岛铁盒 D5000 5000MAh 移动电源 充电宝 便携充电器 白色,数码影音?>?数码配件?>?移动电源?>?商品详情,当当网,半岛铁盒
1018002011,数码|数码配件|电池、充电器,NEW VIEW 新境界 CGA-S303数码相机电池充电器套装 座充 单充+车充+美转欧插头 3件套 车载充电器,摄影\摄像 > 配件 > 电池、电源、充电器 > 相机电池充电器,亚马逊(卓越网),NEW VIEW 新境界
1018002011,数码|数码配件|电池、充电器,B-TWO 二郎 联想 Lenovo IdeaPad Y450 Y450G Y550 Y550A Y550P 笔记本电池,电脑\IT > 外设产品 > 笔记本、上网本配件 > 电池,亚马逊(卓越网),B-TWO 二郎
1018002011,数码|数码配件|电池、充电器,B-TWO 二郎 宏基 ACER TravelMate 7230 7330 7530 7530G 7730 电池 12芯,电脑\IT > 外设产品 > 笔记本、上网本配件 > 电池,亚马逊(卓越网),B-TWO 二郎
1018002011,数码|数码配件|电池、充电器,圣奇仕（SUNQS）NP-120数码电池（适用机型：富士M603/F10/F11等数码摄相机）,手机 摄影 数码>电池/充电器>圣奇仕>圣奇仕（SUNQS）NP-120数码电池（适用机型：富士M603/F10/F11等数码摄相机）,国美,圣奇仕
1018002011,数码|数码配件|电池、充电器,PISEN/品胜 EN-EL3E+电池 尼康 D90 D200 D300s D700 D70S电池,数码影音?>?摄影摄像?>?摄影配件?>?商品详情,当当网,GE通用
1018002011,数码|数码配件|电池、充电器,GoingPower 卓鹰 宏基 Acer Aspire One A110 A150 ZG5 UM08A31 笔记本电池 9芯,电脑\IT > 外设产品 > 笔记本、上网本配件 > 电池,亚马逊(卓越网),GoingPower 卓鹰
1018002011,数码|数码配件|电池、充电器,品胜 中兴 C360 C361 C362 S100 C370 S191 S192 S160 电池 yxw,数码影音?>?数码配件?>?电池/充电器?>?商品详情,当当网,品胜
1018002011,数码|数码配件|电池、充电器,品能/PINENG PN-W-400无绳电话机 子母机充电电池 3.6V400毫,手机 摄影 数码>电池/充电器>肯高>品能/PINENG PN-W-400无绳电话机 子母机充电电池 3.6V400毫,国美,肯高
1018002011,数码|数码配件|电池、充电器,Metrans 美创 MWT03S Qi标准 无线充电器 全球最小 无线充 升级版 支持三星N7100 i9300 i9500 诺基亚920 Nexus4,手机\通讯 > 手机配件 > 电池\充电器 > 充电器,亚马逊(卓越网),Metrans 美创
1018002011,数码|数码配件|电池、充电器,New View 新境界 VW-VBG260 全解码 摄像机电池,摄影\摄像 > 配件 > 电池、电源、充电器 > 摄像机电池,亚马逊(卓越网),NEW VIEW 新境界
1018002011,数码|数码配件|电池、充电器,红富士 联想Lenovo S10-3 电池 IdeaPad S100 S100c S10-3 S110 S205 S205s U160 U165 昭阳M13 57Y6442 57Y6446 L09S6Y14 笔记本电池 6芯 优质电芯/一年质保 黑色,电脑\IT > 外设产品 > 笔记本、上网本配件 > 电池,亚马逊(卓越网),红富士
1018002011,数码|数码配件|电池、充电器,【当当自营】 IT-CEO U6850 5000mAh 移动电源 充电宝 便携充电器 黑色,数码影音?>?数码配件?>?移动电源?>?商品详情,当当网,IT-CEO
1018002011,数码|数码配件|电池、充电器,圣奇仕(sunqs) 摄像机/数码相机电池 富士NP40 适用于富士F402 F455 F460 F470 F480,F610 F650 F700 F710等,高鸿商城 > 手机数码 > 数码配件 > 电池/充电器,高鸿商城
1018002011,数码|数码配件|电池、充电器,FB沣标三洋DBL90锂电池　 VPC-SH1 DMX-SH1相机电池,数码影音?>?数码配件?>?电池/充电器?>?商品详情,当当网,FB/沣标
1018002011,数码|数码配件|电池、充电器,联想 LENOVO ThinkPad T510 T510i T520 W510 W520 笔记本电池,电子/类别/电脑\IT/外设产品/笔记本、上网本配件/电池,亚马逊(卓越网),GoingPower 卓鹰
1018002011,数码|数码配件|电池、充电器,FB沣标 BP420E 锂电池 (三星SMX-F44/F50HMX-S15/S16 相机电池),摄影\摄像 > 配件 > 电池、电源、充电器 > 相机电池,亚马逊(卓越网),FB 沣标
1018002011,数码|数码配件|电池、充电器,Askey Dell 戴尔 Vostro 3400 3500 3700 【新一代锂离子技术 更稳定】6芯 笔记本 电池 适用多种型号 黑色,电脑\IT > 外设产品 > 笔记本、上网本配件 > 电池,亚马逊(卓越网),Askey
1018002011,数码|数码配件|电池、充电器,圣奇仕(sunqs) 奥林巴斯Li－40B/42B 高品质电池 适用于奥林巴斯μ700/μ710/μ720/μ725/μ730等,数码>数码配件>电池/充电器>圣奇仕（sunqs）>圣奇仕Li－40B/42B,京东商城,圣奇仕（sunqs）
1018002011,数码|数码配件|电池、充电器,品胜 NP120 卡西欧 CNP-120 EX-S200 EX-ZS10电池,摄影\摄像 > 配件 > 电池、电源、充电器 > 相机电池,亚马逊(卓越网),Pisen 品胜
1018002011,数码|数码配件|电池、充电器,品胜 BP1310 相机电池 三星 NX10,数码影音?>?数码配件?>?电池/充电器?>?商品详情,当当网,品胜
1018002011,数码|数码配件|电池、充电器,powerstation IBM T30 T30 Series 02K7034 02K7037 02K7038 笔记本电池 【进口A电芯+全国联保】 【进口A电芯+全国联保】,电脑\IT > 外设产品 > 笔记本、上网本配件 > 电池,亚马逊(卓越网),powerstation
1018002011,数码|数码配件|电池、充电器,桑格 松下VSK0697 HDC-HS100 HS20 HS250K 数码相机电源适配器,摄影\摄像 > 配件 > 电池、电源、充电器 > 电源适配器,亚马逊(卓越网),桑格
1018002011,数码|数码配件|电池、充电器,nikon/尼康D4相机电池 EN-EL18,手机 摄影 数码>电池/充电器>尼康>nikon/尼康D4相机电池 EN-EL18,国美电器网上商城,尼康鑫普拓专营店
1018002011,数码|数码配件|电池、充电器,LEISE 雷摄 NB-10L 锂电充电电池,摄影\摄像 > 配件 > 电池、电源、充电器 > 相机电池,亚马逊(卓越网),LEISE 雷摄
1018002011,数码|数码配件|电池、充电器,飞利浦 5号1600毫安时镍氢充电电池2粒装,所有分类>大小家电、厨电、汽车>电器附件>电池>Philips/飞利浦>飞利浦 5号1600毫安时镍氢充电电池2粒装,1号店,Philips/飞利浦
1018002011,数码|数码配件|电池、充电器,品胜BLM1座充 奥林巴斯EL3 E510 E500 E-30 E520 C5060 WZ充电器,首页>手机/数码/配件>数码配件>电池/充电器>品胜BLM1座充奥林巴斯EL3E...,苏宁,品胜
1018002011,数码|数码配件|电池、充电器,HSW戴尔DELL K110H M297J M300J N254J N255J PP39S笔记本电池8芯,电脑\IT > 外设产品 > 笔记本、上网本配件 > 电池,亚马逊(卓越网),HSW
1018002011,数码|数码配件|电池、充电器,SAMSUNG 三星 NOTE3充电器 Note3原装座充 N9009 座充N9008V N9006原装电池座充,所有分类>手机、数码、配件>手机配件>充电器>SAMSUNG,1号店,充电器
1018002011,数码|数码配件|电池、充电器,HTC手机原装盒装电池(适用于HTC X515m/X515d)1730mAh,手机\通讯 > 手机配件 > 电池\充电器 > 电池,亚马逊(卓越网),HTC
1018002011,数码|数码配件|电池、充电器,GoingPower 卓鹰 惠普HP COMPAQ 8710w 8710w 9400 nc8200 nc8230笔记本电池 12芯,电脑\IT > 外设产品 > 笔记本、上网本配件 > 电池,亚马逊(卓越网),GoingPower 卓鹰
1018002011,数码|数码配件|电池、充电器,New View 新境界 BN-V107U相机专用 车充+座充+带线插头 套装 三件充座V107U,摄影\摄像 > 配件 > 电池、电源、充电器 > 相机电池充电器,亚马逊(卓越网),NEW VIEW 新境界
1018002011,数码|数码配件|电池、充电器,品胜 佳能BP522 相机电池 CANON MV500i MV750i MV700i,数码影音?>?数码配件?>?电池/充电器?>?商品详情,当当网,无
1018002011,数码|数码配件|电池、充电器,深飞电池 华为U8500 一电一充套装(适用于U8110/U8500/U8100/T552/U7519/C8000/摩托罗拉EX300/OM5B),手机\通讯 > 手机配件 > 电池\充电器 > 套装,亚马逊(卓越网),$N
1018002011,数码|数码配件|电池、充电器,飞毛腿商务电池实系列摩托罗拉E398(SNN5699A),手机\通讯 > 手机配件 > 电池\充电器 > 电池,亚马逊(卓越网),$N
1018002011,数码|数码配件|电池、充电器,三星 N7000 Galaxy Note I9220 I9228 电池 原装电池 带包装,当当网 > 数码影音 > 数码配件 > 电池/充电器,当当网,$N
1018002011,数码|数码配件|电池、充电器,tinyun 添源 香水味 迷你型 手机 移动电源 通用型 足量 2600mAH 多功能 香水移动电源2600 带香味的便携 手机充电宝 (适用于所有USB接口的IPHONE 三星 HTC 摩拖罗拉 诺基亚 小米 中兴 天语等各种智能手机 及 MP3 MP4 PDA [超PSP 数码相机 掌上游戏机 蓝牙设备) (适用mp4, 白色),手机\通讯 > 手机配件 > 电池\充电器 > 移动电源 数码影音 > 数码配件 > MP3、MP4配件 > 移动电源,亚马逊(卓越网)
1018002011,数码|数码配件|电池、充电器,Cellularmega 赛力码 FV100 7.4V 3900MAH相机电池/摄像机电池/相机配件,摄影\摄像 > 配件 > 电池、电源、充电器 > 相机电池,亚马逊(卓越网),Cellularmega 赛力码
1018002011,数码|数码配件|电池、充电器,圣奇仕700毫安7号充电式镍氢环保电池（两支）,数码>数码配件>电池/充电器>圣奇仕（sunqs）>圣奇仕镍氢电池,京东商城,圣奇仕（sunqs）
1018002011,数码|数码配件|电池、充电器,录科 松下相机电池充电器DMW-BLA13E BLA13PP BLA13GK DMC-L10 L10GK SDR-H79 H50 H80 H90 H200 H40 H68 H91GK SDR-W20 H58 H48 W28 H60 H41 TM30 TM10GK VW-VBG130GK VBG130E VBG070A AG-HSC1UMC HDC-SD7 SD10 SD5 SD1 SD3GK SD,摄影\摄像 > 配件 > 电池、电源、充电器 > 相机电池充电器,亚马逊(卓越网),录科
1018002011,数码|数码配件|电池、充电器,YUENTAME 越泰 亚马逊amazon kindle Fire HD平板电脑充电器线 电源适配器变压器,手机\通讯 > 手机配件 > 电池\充电器 > 充电器,亚马逊(卓越网),YUENTAME 越泰
1018002011,数码|数码配件|电池、充电器,瑞能 数码电池 R-SBP819 （佳能）,手机 摄影 数码>电池/充电器>肯高>瑞能 数码电池 R-SBP819 （佳能）,国美电器网上商城,诺金数码专营店
1018002011,数码|数码配件|电池、充电器,蒂森特(DSTE) BT-S7 一电一充 爱国者 S7 HD-A210 A12M33 相机电池,首页>手机/数码/配件>数码配件>电池/充电器>蒂森特(DSTE)BT-S7一电...,苏宁,蒂森特(DSTE)
1018002011,数码|数码配件|电池、充电器,nikon 尼康MD-10手柄,摄影\摄像 > 配件 > 相机机身配件 > 手柄电池盒,亚马逊(卓越网),Nikon 尼康
1018002011,数码|数码配件|电池、充电器,桑格 佳能DC310/DC330/DC420/DC410摄像机电池 NB-2L电,手机 摄影 数码>电池/充电器>肯高>桑格 佳能DC310/DC330/DC420/DC410摄像机电池 NB-2L电,国美电器网上商城,肯高
1018002011,数码|数码配件|电池、充电器,usb充电器 多口充电器 USB充电 口usb充电器 usb 充电器多口 插头 双USB口配苹果5+安卓数据线,数码>时尚影音>苹果配件>F.L>usb充电器 多口充电器 USB充电 口...,京东商城,博大深鑫数码专卖店
1018002011,数码|数码配件|电池、充电器,录科 松下相机充电器DMW-BLD10E BLD10PP DMC-GF2 G3 GX1GK,摄影\摄像 > 配件 > 电池、电源、充电器 > 相机电池充电器,亚马逊(卓越网),录科
1018002011,数码|数码配件|电池、充电器,友达电 戴尔 Dell Studio XPS 13 电池 Studio XPS 1340 笔记本电池 【9芯高容量加厚电池】 一年质保,电脑\IT > 外设产品 > 平板电脑配件 > 充电器、 电源适配器,亚马逊(卓越网),友达电
1018002011,数码|数码配件|电池、充电器,南孚 电池7号 AAA LR03 高性能碱性电池 南孚7号电池2节装 聚能环碱性电池,所有分类>大小家电、厨电、汽车>电器附件>电池>南孚>南孚 电池7号 AA...,1号店,南孚
1018002011,数码|数码配件|电池、充电器,aMagic iphone4，HTC专用万用移动电源-APB_1126BK-黑色-魔羯座-香港热卖,手机\通讯 > 手机配件 > 电池\充电器 > 充电器,亚马逊(卓越网),aMagic
1018002011,数码|数码配件|电池、充电器,GoingPower 卓鹰 基围 Gateway 6000 MX6000 MX6900 MX8000 M360 笔记本电池 8芯,电子/类别/电脑\IT/外设产品/笔记本、上网本配件/电池,亚马逊(卓越网),GoingPower 卓鹰
1018002011,数码|数码配件|电池、充电器,唐都 三星 AA-PL0NC9B,AA-PL0NC9B/E,AA-PL1NC9B 高容9芯 保1年,电脑\IT > 外设产品 > 笔记本、上网本配件 > 电池
1018002011,数码|数码配件|电池、充电器,Nikon/尼康 Coolpix 8400 8800相机专用 EN-EL7电池 电板,所有分类>手机、数码、配件>数码配件>电池及充电器>Nikon/尼康>Nikon/尼康 C...,1号店,Nikon/尼康
1018002011,数码|数码配件|电池、充电器,品胜 PISEN TS-DV001-SLB-07A 数码相机充电电池,摄影\摄像 > 配件 > 电池、电源、充电器 > 相机电池,亚马逊(卓越网),Pisen 品胜
1018002011,数码|数码配件|电池、充电器,电小二 钢铁侠WT-M4400A移动电源 (黑色),手机\通讯 > 手机配件 > 电池\充电器 > 套装 ,亚马逊(卓越网),Dxpower 电小二
1018002011,数码|数码配件|电池、充电器,Kensington 肯辛通 K39288 iphone4&4s保护壳电池移动充电电池 k39287白色,手机\通讯 > 手机配件 > 手机保护壳、套 > 保护壳,亚马逊(卓越网),Kensington 肯辛通
1018002011,数码|数码配件|电池、充电器,飞毛腿 索爱SA-T919 T936 T938 T966 T988 NP40 相机电池充电器 座充,首页>手机/数码/配件>数码配件>电池/充电器>飞毛腿索爱SA-T919T936...,苏宁,$N
1018002011,数码|数码配件|电池、充电器,品胜LP-E8电池+充电器 佳能EOS 550D 600D佳能 E8电池套装,数码影音?>?数码配件?>?电池/充电器?>?商品详情,当当网,品胜LP-E8电池+充电器
1018002011,数码|数码配件|电池、充电器,蒂森特(DSTE) SB-LH73 充电器 三星 SDL-MS615 SDC-MS61相机,数码>数码配件>电池/充电器> 蒂森特（dste）>蒂森特(DSTE) SB-LH73 充电...,京东商城,蒂森特官方旗舰店
1018002011,数码|数码配件|电池、充电器,品胜EL3e+电池 尼康D90 D80 D70 D700 D300 D300S D200,数码影音?>?摄影摄像?>?电池/电源?>?商品详情,当当网,GE通用
1018002011,数码|数码配件|电池、充电器,摩米士(MOMAX) 适用于IPHONE4/4S 背盖式电池 黑色特价中,当当网 > 数码影音 > 苹果/配件 > ipod配件,当当网,摩米士(MOMAX)
1018002011,数码|数码配件|电池、充电器,FB 沣标 9V充电电池280mAh万用表测线仪 无线麦克风方形电池,摄影\摄像 > 配件 > 电池、电源、充电器 > 相机电池,亚马逊(卓越网),FB 沣标
1018002011,数码|数码配件|电池、充电器,【特价包邮】小米 BM40 BM41 座充 小米2A 红米 原装座充 充电器 小米手机座充 红米充电器 bm40充电器 bm41充电器 bm40座充 bm41座充,手机通讯?>?手机配件?>?充电器/数据线?>?【特价包邮】小米?BM40?BM41?座充?小米2A?红米?原装座充?充电器?...,当当网,小米
1018002011,数码|数码配件|电池、充电器,三星 NOTE3 N9000 N9002电池座充 N9006 N9005手机座充 N9009 N9008原装盒装座充,其他 > 其他,亚马逊(卓越网),$N
1018002011,数码|数码配件|电池、充电器,Cheerjewel 持航 索尼 VGP-BPS2A/S VGP-BPS2B VGP-BPS2C 电池 6芯,电脑\IT > 外设产品 > 笔记本、上网本配件 > 电池,亚马逊(卓越网),Cheerjewel 持航
1018002011,数码|数码配件|电池、充电器,卓鹰 联想 LENOVO IdeaPad Y430 电池 V450 电池 L08S6D01 笔记本电池,所有分类>电脑、平板、办公设备>周边配件>笔记本电池>卓鹰>卓鹰 联想 LENO...,1号店,卓鹰
1018002011,数码|数码配件|电池、充电器,Viwipow 金铂力 9V充电电池600mAh 遥控器无线唛麦克风9V 6F22方型锂电池,家居装修 > 工具 > 工具配件 > 专用电池、充电器 ,亚马逊(卓越网),Viwipow 金铂力
1018002011,数码|数码配件|电池、充电器,品胜SLB-07A电池 三星ST600 PL150 TL205 PL15 TL210相机电池,首页>手机/数码/配件>数码配件>电池/充电器>品胜SLB-07A电池三星ST60...,苏宁,品胜
1018002011,数码|数码配件|电池、充电器,录科 VIVITAR威达相机电池NP-60 NP60 VIVICAM 3930 4000 3795,摄影\摄像 > 配件 > 电池、电源、充电器 > 摄像机电池 ,亚马逊(卓越网),录科
1018002011,数码|数码配件|电池、充电器,GoingPower 卓鹰 华硕 ASUS X43 X43B X43BY X43E X43J X43JE X43JF 笔记本电池,电脑\IT > 外设产品 > 笔记本、上网本配件 > 电池,亚马逊(卓越网),GoingPower 卓鹰
1018002011,数码|数码配件|电池、充电器,爱玛科（AIMC) M-C41 便携式车载充电器 水滴炫彩 2100毫安/mAh,数码>数码配件>电池/充电器> 爱玛科（AIMC）>爱玛科（AIMC) M-C41 便携式车...,京东商城,大懒猫数码专营店
1018002011,数码|数码配件|电池、充电器,贝得宝 高品质笔记本电池 华硕 ASUS X65 X70 A32-F82 K50ip 5200mah 进口三星电芯制造 超强续航,电脑\IT > 外设产品 > 笔记本、上网本配件 > 电池,亚马逊(卓越网),宝
1018002011,数码|数码配件|电池、充电器,【Sony索尼】NP-FW50 可重复充电电池 新年,数码影音?>?摄影摄像?>?电池/电源?>?商品详情,当当网,Sony索尼
1018002011,数码|数码配件|电池、充电器,迪比科5号充电电池 2750毫安2节 迪比科镍氢充电套装 608-2750,当当网 > 数码影音 > 数码配件 > 电池/充电器,当当网,迪比科
1018002011,数码|数码配件|电池、充电器,REMAX 睿量 诺基亚BL-5CT 商务电池(适用于诺基亚5220/6303c/C3-01/C5-00/C6-01),手机\通讯 > 手机配件 > 电池\充电器 > 电池,亚马逊(卓越网),Remax 睿量
1018002011,数码|数码配件|电池、充电器,瑞能（RUIEN）RM4L-803-27充电器（四通道标准充+四节5号2700mAh ）（充电器适用AA（5号）/AAA（7号）镍氢（Ni-MH）充电电池）,摄影\摄像 > 配件 > 电池、电源、充电器 > 相机电池充电器,亚马逊(卓越网),瑞能
1018002011,数码|数码配件|电池、充电器,Askey 华硕 ASUS VX3 N20 N20A U6S 系列 【新一代锂离子技术 更稳定】 A32-U6 A33-U6 6芯 笔记本 电池 黑色 适用多种型号,电脑\IT > 外设产品 > 笔记本、上网本配件 > 电池,亚马逊(卓越网),Askey
1018002011,数码|数码配件|电池、充电器,B-TWO 二郎 惠普 hp 4411s电池 4410s 4415s 4416s 笔记本电池 原装方案,电脑\IT > 外设产品 > 笔记本、上网本配件 > 电池,亚马逊(卓越网),B-TWO 二郎
1018002011,数码|数码配件|电池、充电器,SAMSUNG/三星 三星S4充电器i9100 i929 I9250 N7000 I9300 i9220 S3原装直充充,所有分类>手机、数码、配件>手机配件>充电器>SAMSUNG/三星>SAMSUNG/三星...,1号店,SAMSUNG/三星
1018002011,数码|数码配件|电池、充电器,GoingPower 卓鹰 联想 Lenovo ThinkPad X220 X220i X220s 笔记本电池 原装方案,电脑\IT > 外设产品 > 笔记本、上网本配件 > 电池,亚马逊(卓越网),GoingPower 卓鹰
1018002011,数码|数码配件|电池、充电器,GP超霸 700豪安镍氢充电电池二节装 70AAAHC-L2,首页>手机/数码/配件>数码配件>电池/充电器>GP超霸700豪安镍氢充电电池二节...,苏宁,GP超霸
1018002011,数码|数码配件|电池、充电器,YUENTAME 越泰 斯贝S-MP98 S-MD99 S-MD08 S-MD06 平板电脑充电器电源适配器5v2a,手机\通讯 > 手机配件 > 电池\充电器 > 充电器,亚马逊(卓越网),YUENTAME 越泰
1018002011,数码|数码配件|电池、充电器,奈特科尔NiteCore i4 锂电18650 14500 4槽智能充电器 电池充电器,运动健康>户外装备>户外照明>奈特科尔NiteCore i4 锂电18...,京东商城,斯托克司科技户外装备
1018002011,数码|数码配件|电池、充电器,贝得宝 高品质笔记本电池 HP 451545-361 456623-001 HSTNN-DB51 KU530AA 5200MAH 进口三星电芯制造 超强续航,电脑\IT > 外设产品 > 笔记本、上网本配件 > 电池,亚马逊(卓越网),宝
1018002011,数码|数码配件|电池、充电器,品胜V714充电器 JVC BN-VF707U VF714U VF733座充,手机 摄影 数码>电池/充电器>品胜（PISEN）>品胜V714充电器 JVC BN-VF707U VF714U VF733座充,国美电器网上商城,九州诚品数码专营店
1018002011,数码|数码配件|电池、充电器,品胜BL-4C电池 诺基亚6300 6100 3500C 1202 6101,手机 摄影 数码>充电器>品胜（PISEN）>品胜BL-4C电池 诺基亚6300 6100 3500C 1202 6101,国美电器网上商城,品胜（PISEN）
1018002011,数码|数码配件|电池、充电器,Cellularmega 赛力码 KLIC-7006数码相机电池 适用于柯达Easyshare M873/M883 Zoom相机,摄影\摄像 > 配件 > 电池、电源、充电器 > 电源适配器,亚马逊(卓越网),Cellularmega 赛力码
1018002011,数码|数码配件|电池、充电器,桑格数码电池SG-BLS5,首页>手机/数码/配件>数码配件>电池/充电器>桑格数码电池SG-BLS5,苏宁,桑格
1018002011,数码|数码配件|电池、充电器,录科 松下摄像机电池HDC-Z10000GK AJ-PCS060G AG-DVC180B EZ80 CGA-D54S D54SE/1B D54SE/1H D54D VW-VBD55 AG-HVX203 HPX170 DVC80 DVX1000 HPX250MC,摄影\摄像 > 配件 > 电池、电源、充电器 > 摄像机电池 ,亚马逊(卓越网),录科
1018002011,数码|数码配件|电池、充电器,FB 沣标 9V充电电池280mAh万用表测线仪 无线麦克风方形电池,所有分类>手机、数码、配件>数码配件>电池及充电器>FB>FB 沣标 9V充电...,1号店,FB
1018002011,数码|数码配件|电池、充电器,iFans Apple苹果RFi品牌移动电源 充电宝，适用于手机及平板电脑等USB充电设备，进口韩国三星电芯，质保一年!和平系列3500mAh 蓝色,手机\通讯 > 手机配件 > 电池\充电器 > 移动电源 数码影音 > 数码配件 > MP3、MP4配件 > 移动电源,亚马逊(卓越网),iFans
