1018002011,数码|数码配件|电池、充电器,HotFire 热火 U-520G USB电源适配器 苹果手机iPhone平板iPad充电器 5V/2.1A 橙色(适用于iPad mini/三星/小米等移动设备),手机\通讯 > 手机配件 > 电池\充电器 > 充电器,亚马逊(卓越网),Hotfire 热火
1018002011,数码|数码配件|电池、充电器,飞毛腿摩托罗拉BH6X Atrix4G Atrix MB861 ME860精品手机电池 yxw,当当网 > 数码影音 > 数码配件 > 电池/充电器,当当网,飞毛腿
1018002011,数码|数码配件|电池、充电器,悦酷 三星n7100后盖 note2电池盖 N7108手机保护壳 超薄 浮雕工艺 百花争艳,数码>时尚影音>苹果配件> 悦酷（Yeahcool）>悦酷 三星n7100后盖 note2电池...,京东商城,YEAHCOOL悦酷旗舰店
1018002011,数码|数码配件|电池、充电器,Chotto 戴尔 DELL F732H FM332 FM335 FM335 YP463 笔记本电池 大容量6芯电池,电脑\IT > 外设产品 > 平板电脑配件 > 充电器、 电源适配器,亚马逊(卓越网),Chotto
1018002011,数码|数码配件|电池、充电器,XiangXingDa 祥兴达 Acer 宏基 笔记本电池 5540 3242 3290 3284 3282 GARDA31 6230 3623 9芯 电池,电脑\IT > 外设产品 > 笔记本、上网本配件 > 电池,亚马逊(卓越网),祥兴达
1018002011,数码|数码配件|电池、充电器,卓鹰 联想 IBM ThinkPad W700ds 电池 ThinkPad W700 笔记本电池 现货,所有分类>电脑、平板、办公设备>周边配件>笔记本电池>卓鹰>卓鹰 联想 IBM ...,1号店,卓鹰
1018002011,数码|数码配件|电池、充电器,品胜 ROSE160 手机充电器多普达 S740 等手机电池适用 座充,手机\通讯 > 手机配件 > 电池\充电器 > 充电器,亚马逊(卓越网),Pisen 品胜
1018002011,数码|数码配件|电池、充电器,悦酷 三星n7100后盖 note2电池盖 N7108手机保护壳 超薄 浮雕工艺 赏雪MM,数码>时尚影音>苹果配件> 悦酷（Yeahcool）>悦酷 三星n7100后盖 note2电池...,京东商城,YEAHCOOL悦酷旗舰店
1018002011,数码|数码配件|电池、充电器,美蝎 宏基 BT.00603.012 BT.00603.039 BT.00603.040笔记本电池,电脑\IT > 外设产品 > 笔记本、上网本配件 > 电池,亚马逊(卓越网),MEIXIE 美蝎
1018002011,数码|数码配件|电池、充电器,wisebrave 双USB充电器 1A插头 适用iPhone/三星/小米/ipad充电头 银色 英国标准,数码>时尚影音>苹果配件> wisebrave>wisebrave 双USB充电器 1A...,京东商城,智黎珈数码专营店
1018002011,数码|数码配件|电池、充电器,索尼 NP-FW50原装电池 NEX-5C NEX-3C微单反相机 A33 A5,手机 摄影 数码>电池/充电器>肯高>索尼 NP-FW50原装电池 NEX-5C NEX-3C微单反相机 A33 A5,国美,肯高
1018002011,数码|数码配件|电池、充电器,New-View/新境界 官方旗舰店 原装 适用尼康EN-EL11/奥林巴斯LI-60B 数码相机电池 Optio W80,所有分类>手机、数码、配件>数码配件>电池及充电器>New-View/新境界>New-View/新...,1号店,New-View/新境界
1018002011,数码|数码配件|电池、充电器,品胜BF6X电池套装 摩托罗拉XT882/MT870电池+充电器,首页>手机/数码/配件>手机配件>其他配件>品胜BF6X电池套装摩托罗拉XT8...,苏宁,$N
1018002011,数码|数码配件|电池、充电器,登品USB数据线+品胜BK-B-45电池+优能充 套装 (适配步步高vivo S1 vivo V2 vivo S6) 智能手机电板 1850mAh 大容量 BK-B-45电板,手机\通讯 > 手机配件 > 电池\充电器 > 电池,亚马逊(卓越网),登品 品胜
1018002011,数码|数码配件|电池、充电器,Morewer（USA) 全新苹果笔记本电脑电池分离式充电器适合于：Apple M8983 661-2822 Apple MacBook 13 Series PowerBook G3 G4 12 15 17 系列电池...插孔接触片:6 片 [输出:12.6V 2.5A 40W 适合于苹果10.8V 11.1V 笔记本电池的分离式充电及电量检测 颜色：苹果白 专利产品，震撼推出],电脑\IT > 外设产品 > 笔记本、上网本配件 > 充电器、电源适配器 > 上网本充电器 ,亚马逊(卓越网),Morewer
1018002011,数码|数码配件|电池、充电器,品胜 NB-9L 充电电池 适用于：佳能IXUS 1000 HS/SD4500IS/IXY50S,首页 >数码配件 >相机电池 >相机/摄像机电池 >PISEN 品胜 >NB-9L,易迅网,PISEN 品胜
1018002011,数码|数码配件|电池、充电器,三星 NOTE 2充电器 N7100 N7000 I9300 I9220 I9308手机直充 2A 充电器头+数据线,手机\通讯 > 手机配件 > 电池\充电器 > 充电器,亚马逊(卓越网),特马仕
1018002011,数码|数码配件|电池、充电器,B-TWO 二郎 东芝Toshiba DynaBook TX/2 TX3 TX4 TX F20 MX 笔记本电池 12芯,电脑\IT > 外设产品 > 笔记本、上网本配件 > 电池,亚马逊(卓越网),B-TWO 二郎
1018002011,数码|数码配件|电池、充电器,瑞能正品 苹果手机充电器 兼MP3 iPhone4G touch 苹果充电器,手机 摄影 数码>电池/充电器>肯高>瑞能正品 苹果手机充电器 兼MP3 iPhone4G touch 苹果充电器,国美电器网上商城,诺金数码专营店
1018002011,数码|数码配件|电池、充电器,圣奇仕 603-2300AA 4小时速充宝套装 含2节2300mah,首页 >数码配件 >充电电池 >充电器 >圣奇仕 >,易迅网,有圣奇仕、品冠、新世代等，是专业从事数码电池、充电
1018002011,数码|数码配件|电池、充电器,Sansys 闪易 宏碁 Acer AS10D31 Aspire 4551G 4552G 4733Z 4741G 4743G 4750G 5253G 5552G ..... 笔记本电池 【加厚大容量9芯电池】,电脑\IT > 外设产品 > 笔记本、上网本配件 > 电池,亚马逊(卓越网),Sansys
1018002011,数码|数码配件|电池、充电器,CNTONG 承诺通 移动电源 充电宝 2600mAh 糖果色便携式移动电源(水果香)材质自带香味 (适用ipad iphone 三星 HTC 索尼 小米 华为 联想 LG 酷派 华为 索尼等3C数码所有USB接口设备)充电宝 小精灵 高品质 超实惠 经第三方专业机构检测认证 品质有保证(黄色),手机\通讯 > 手机配件 > 电池\充电器 > 移动电源 数码影音 > 数码配件 > MP3、MP4配件 > 移动电源,亚马逊(卓越网),cntong 承诺通
1018002011,数码|数码配件|电池、充电器,桑格F750充电器 索尼 FX1000E 190P F550 F730电池充电器,手机 摄影 数码>电池/充电器>桑格>桑格F750充电器 索尼 FX1000E 190P F550 F730电池充电器,国美电器网上商城,桑格
1018002011,数码|数码配件|电池、充电器,神牛40CM柔光摄影棚4背景布 摄影器材,数码影音?>?摄影摄像?>?电池/电源?>?商品详情,当当网,BenQ明基
1018002011,数码|数码配件|电池、充电器,蒂森特(DSTE) EN-EL12 一电一充 尼康 S6300 S8200 S610 S620 S630 相机电池,首页>手机/数码/配件>数码配件>电池/充电器>蒂森特(DSTE)EN-EL12...,苏宁,蒂森特(DSTE)
1018002011,数码|数码配件|电池、充电器,MP 骐源 802 电池充电器5号7号9V可充电电池5号7号智能快速多功能充电器,手机\通讯 > 手机配件 > 电池\充电器,亚马逊(卓越网),MP 骐源
1018002011,数码|数码配件|电池、充电器,FB/沣标 EL14+ 尼康D3100 D3200 D5100 D5200 P7100 P7800 相机电池,首页>手机/数码/配件>数码配件>电池/充电器>FB/沣标EL14+尼康D310...,苏宁,FB/沣标
1018002011,数码|数码配件|电池、充电器,Cameron Sino 尼康相机电池EN-EL21 1 V2 1020毫安,摄影\摄像 > 配件 > 电池、电源、充电器 > 相机电池,亚马逊(卓越网),Cameron Sino
1018002011,数码|数码配件|电池、充电器,Pisen/品胜 PISEN 充电电池2300MA 5# 蓝色,手机通讯、数码电器>数码配件>电池/充电器>Pisen/品胜,1号店,Pisen/品胜
1018002011,数码|数码配件|电池、充电器,盒装 HTC原装充电器 HD3（7 Mozart /T8698） 直充 线充 分体充 旅行充 充电头 白色,手机\通讯 > 手机配件 > 电池\充电器 > 充电器,亚马逊(卓越网),HTC
1018002011,数码|数码配件|电池、充电器,SONY索尼摄象机电池 NP-FP90电池,数码影音?>?数码配件?>?电池/充电器?>?商品详情,当当网,Sony索尼
1018002011,数码|数码配件|电池、充电器,松下爱乐普四代2100次电池eneloop 7号4节装充电电池正品行货,首页>手机/数码/配件>数码配件>电池/充电器>松下爱乐普四代2100次电池enel...,苏宁,$N
1018002011,数码|数码配件|电池、充电器,DELL Insprion 1440,1525,1526,1545
1018002011,数码|数码配件|电池、充电器,RN-M4A-25 标准充电套装+5号电池*4节 2500mAh|包邮中RN-M4A-25 标准充电套装,当当网 > 电脑办公 > 电脑整机 > 笔记本配件 > 其它,当当网,$N
1018002011,数码|数码配件|电池、充电器,品胜BP819电池 佳能HF100/10/11/200/HG21/20相机电池,首页>手机/数码/配件>数码配件>电池/充电器>品胜BP819电池佳能HF100/...,苏宁,$N
1018002011,数码|数码配件|电池、充电器,Kmashi 柯玛仕 佳能/Canon PowerShot S230 PowerShot S300 PowerShot S330 PowerShot S400 PowerShot S410 PowerShot S500 Digital ELPHS数码相机电池 单反照相机电池 相机配件,摄影\摄像 > 配件 > 电池、电源、充电器 > 摄像机电池 ,亚马逊(卓越网),Kmashi 柯玛仕
1018002011,数码|数码配件|电池、充电器,Pisen 品胜 BP511A 充电器 佳能50D 40D 30D 5D BP512 BP522 座充,摄影\摄像 > 配件 > 电池、电源、充电器 > 相机电池充电器,亚马逊(卓越网),Pisen 品胜
1018002011,数码|数码配件|电池、充电器,桑格L90电池 三洋DB-L90 DBL90 VPC-SH1 DMX-SH1 VPC-SH11 DMX-SH11电池,首页>手机/数码/配件>数码配件>电池/充电器>桑格L90电池三洋DB-L90D...,苏宁,桑格
1018002011,数码|数码配件|电池、充电器,三星10A座充电器WB700 WB750 WB850F EX2F ES55,数码>电池/充电器>飞毛腿电池/充电器>三星10A座充电器WB700 WB750 WB850F EX2F ES55,国美电器网上商城,飞毛腿电池/充电器
1018002011,数码|数码配件|电池、充电器,HSW东芝TOSHIBA PA3166U PA3166U1BAS PA3166U-1BAS 笔记本电池8芯,电脑\IT > 外设产品 > 笔记本、上网本配件 > 电池,亚马逊(卓越网),HSW
1018002011,数码|数码配件|电池、充电器,松下 爱乐普（eneloop） BK-3MCCA/4C 高性能充电电池5号4粒装,数码>数码配件>电池/充电器> 爱乐普（eneloop）>松下 爱乐普BK-3MCCA/4C,京东商城,爱乐普（eneloop）
1018002011,数码|数码配件|电池、充电器,卓鹰（GoingPower）6芯笔记本电池 戴尔XPS M1330,手机 摄影 数码>电池/充电器>卓鹰>卓鹰（GoingPower）6芯笔记本电池 戴尔XPS M1330,国美电器网上商城,卓鹰旗舰店
1018002011,数码|数码配件|电池、充电器,B-TWO 二郎 东芝 Toshiba PA3357U-2BRL PABASO48 PABASO49 笔记本电池 12芯,电脑\IT > 外设产品 > 笔记本、上网本配件 > 电池,亚马逊(卓越网),B-TWO 二郎
1018002011,数码|数码配件|电池、充电器,三星（SAMSUNG）10.6W N9001 N9002 N9005 原装充电器,手机 摄影 数码>充电器>三星（SAMSUNG）>三星（SAMSUNG）10.6W N9001 N9002 N9005 原装充电器,国美,三星（SAMSUNG）
1018002011,数码|数码配件|电池、充电器,沣标FB-T102充电电池组 子母机无绳电话机镍氢电池3.6V 800mAh,数码影音?>?数码配件?>?电池/充电器?>?商品详情,当当网,FB/沣标
1018002011,数码|数码配件|电池、充电器,恒盈普泰 宏基 Acer 5210 高容量笔记本电池（6芯）,电脑\IT > 外设产品 > 笔记本、上网本配件 > 电池,亚马逊(卓越网),恒盈普泰
1018002011,数码|数码配件|电池、充电器,GoingPower 卓鹰 三星 VP-W70 VP-W70U VP-W71 VP-W75 数码相机电池 相机电池 摄相机电池 单反电池【卓越品质，品牌售后，一年保修】,电子/类别/摄影\摄像/配件/电池、电源、充电器/相机电池,亚马逊(卓越网),GoingPower 卓鹰
1018002011,数码|数码配件|电池、充电器,FB沣标 FE1 锂电池 (数码相机/摄像机电池),摄影\摄像 > 配件 > 电池、电源、充电器 > 相机电池,亚马逊(卓越网),FB 沣标
1018002011,数码|数码配件|电池、充电器,台积电 联想 ThinkPad X200 X200s 笔记本电池 12芯 超大容量,电脑\IT > 外设产品 > 笔记本、上网本配件 > 电池,亚马逊(卓越网),台积电
1018002011,数码|数码配件|电池、充电器,电超人18000mAh大容量双USB 移动电源 手机充电宝 白黑粉蓝色四色可选(白色),手机\通讯 > 手机配件 > 电池\充电器 > 移动电源 数码影音 > 数码配件 > MP3、MP4配件 > 移动电源,亚马逊(卓越网),电超人
1018002011,数码|数码配件|电池、充电器,比苛(Pkcell) 五号镍氢AA2200毫安低自放电环保耐用5号充电电池 （1节）,数码>数码配件>电池/充电器>比苛（Pkcell）>比苛(Pkcell) 五号镍氢AA220...,京东商城,pkcell深圳专卖店
1018002011,数码|数码配件|电池、充电器,佳能BP-208电池 DC20 DC22 mvx460 mvx430 佳能BP208原装电池支持货到付款,当当网 > 数码影音 > 数码配件 > 电池/充电器,当当网,Canon佳能
1018002011,数码|数码配件|电池、充电器,HSW 品牌 惠普Pavilion dv5t dv7电池Dv7t g4t g6 笔记本电池12芯,电脑\IT > 外设产品 > 笔记本、上网本配件 > 电池,亚马逊(卓越网),HSW
1018002011,数码|数码配件|电池、充电器,索尼/Sony PJ600E 赠原装FV70电池+肯高原装UV镜+原装U10摄像包+座充+贴膜+清洁布~,当当网 > 数码影音 > 摄影摄像 > 数码摄像机,当当网,Sony索尼
1018002011,数码|数码配件|电池、充电器,唐都 SONY CR13 CR15 CR21 CR31S CR33 CR382 CR490 CR50B 电池,电脑\IT > 外设产品 > 笔记本、上网本配件 > 电池,亚马逊(卓越网),唐都
1018002011,数码|数码配件|电池、充电器,比苛（Pkcell） 七号AAA 850毫安耐用环保超低自放电7号充电电池 1节,数码>数码配件>电池/充电器>比苛（Pkcell）>比苛（Pkcell） 七号AAA 850...,京东商城,pkcell深圳专卖店
1018002011,数码|数码配件|电池、充电器,Yoobao羽博 诺基亚BP-6MT N81 N82 E51 电池+座充 完美套装BFZ,当当网 > 数码影音 > 数码配件 > 电池/充电器,当当网,GE通用
1018002011,数码|数码配件|电池、充电器,Samsung 三星 I9220 座充,手机/配件 > 手机配件 > 充电器,易迅网,Samsung 三星
1018002011,数码|数码配件|电池、充电器,SAMSUNG 三星 W2013 EB645247LU原装电池 1850mAh,手机\通讯 > 手机配件 > 电池\充电器 > 电池,亚马逊(卓越网),Samsung 三星
1018002011,数码|数码配件|电池、充电器,桑格V114电池JVC BN-V114U电池GR-DVP7 GR-DVP3 DVP9 DX28 DX95 V107电池,首页>手机/数码/配件>数码配件>电池/充电器>桑格V114电池JVCBN-V11...,苏宁,桑格
1018002011,数码|数码配件|电池、充电器,美创 无线充电线圈 三星 n7100 i9500 note2 I9300无线充电器接收器 (无线充电器),电子/类别/手机\通讯/手机配件/电池\充电器/充电器,亚马逊(卓越网),美创
1018002011,数码|数码配件|电池、充电器,【限时包邮】三星Note2原装座充 三星 GALAXY Note II N7102 N7105 N7108 N7108D N719 N7100 座充 原装座充 白色,手机通讯?>?手机配件?>?充电器/数据线?>?商品详情,当当网,Samsung三星
1018002011,数码|数码配件|电池、充电器,品胜 索爱W980 W995 Z770 F100 BST-38 X10 mini座充 充电器 yxw,数码影音?>?数码配件?>?电池/充电器?>?商品详情,当当网,品胜
1018002011,数码|数码配件|电池、充电器,飞毛腿 松下FZ8充电器 FZ18座充 FZ35 FZ28 FZ38 FZ30FZ50 FZ7 S006E 电池充电器,首页>手机/数码/配件>数码配件>电池/充电器>飞毛腿松下FZ8充电器FZ18座...,苏宁,飞毛腿
1018002011,数码|数码配件|电池、充电器,Capshi 1A新版 苹果充电器套装 （1A充电器+Lightning接口数据线）,数码>时尚影音>苹果配件> Capshi>Capshi1A新版,京东商城,Capshi
1018002011,数码|数码配件|电池、充电器,飞毛腿（SCUD）三星（SAMSUNG）D828（BST4048BE） 精品电池 适用于三星:E239,D820,P300,P308等机型
1018002011,数码|数码配件|电池、充电器,哈马 HCC066 多功能车充 双USB接口 四合一 车载充电器 红色,所有分类>手机、数码、配件>手机配件>充电器>Hiphophippo/哈马,1号店,充电器
1018002011,数码|数码配件|电池、充电器,美琪 移动电源 5200mAh M2 冰海绿 双USB接口 超大容量 适用于苹果 三星 小米 魅族 中兴 华为 iphone 索尼 酷派 等智能手机 岩砂外壳 电量显示灯 充电宝 配有充电线 接受第三方专业机构检测,手机\通讯 > 手机配件 > 电池\充电器 > 移动电源 数码影音 > 数码配件 > MP3、MP4配件 > 移动电源,亚马逊(卓越网),美琪
1018002011,数码|数码配件|电池、充电器,卓鹰 联想 LENOVO ThinkPad SL410 SL410k SL510 L412 L512笔记本电池,所有分类>电脑、平板、办公设备>周边配件>笔记本电池>卓鹰>卓鹰 联想 LENO...,1号店,卓鹰
1018002011,数码|数码配件|电池、充电器,binwoo 缤购 炫彩系列 智能车载充电器,所有分类>手机、数码、配件>手机配件>充电器>binwoo/缤购,1号店,充电器
1018002011,数码|数码配件|电池、充电器,Sunqs 圣奇仕 S612-AA2500 5号充电套装（含4节2500mAh充电电池+充电器）,首页>数码配件>充电电池>充电电池>圣奇仕 S612-AA2500,易迅网, Sunqs/圣奇仕
1018002011,数码|数码配件|电池、充电器,LINSEN 联胜 F570 数码相机充电器,摄影\摄像 > 配件 > 电池、电源、充电器 > 相机电池充电器,亚马逊(卓越网),LINSEN 联胜
1018002011,数码|数码配件|电池、充电器,桑格K8000电池 柯达Z612 Z712 Z812 Z1012 Z1015 IS KLIC-8000锂电池,首页>手机/数码/配件>数码配件>电池/充电器>桑格K8000电池柯达Z612Z...,苏宁,桑格
1018002011,数码|数码配件|电池、充电器,卓鹰 华硕 ASUS Eee PC 1005P 1005HA 1005HE 1005HR 笔记本电池 6芯,所有分类>电脑、平板、办公设备>周边配件>笔记本电池>卓鹰>卓鹰 华硕 ASUS...,1号店,卓鹰
1018002011,数码|数码配件|电池、充电器,品胜 奥林巴斯8080 7070 E300 E500 C5060 E510 E520 BLM1锂电池,数码影音?>?数码配件?>?电池/充电器?>?商品详情,当当网,GE通用
1018002011,数码|数码配件|电池、充电器,MOKIS/摩奇思 5V/1A 多色USB充电器,所有分类>手机、数码、配件>手机配件>充电器>MOKIS/摩奇思>MOKIS/摩奇思 ...,1号店,MOKIS/摩奇思
1018002011,数码|数码配件|电池、充电器,yongse 扬仕 E20 移动电源 黑色(高品质充电宝 8400mAh LED照明 双独立USB输出 高能效供电 时尚美观 安全可靠),手机\通讯 > 手机配件 > 电池\充电器 > 移动电源 数码影音 > 数码配件 > MP3、MP4配件 > 移动电源 电脑\IT > 外设产品 > 平板电脑配件 > 充电器、 电源适配器,亚马逊(卓越网),yongse 扬仕
1018002011,数码|数码配件|电池、充电器,三星 原装 行货 简体中文版 原厂 手机充电器 S6352充电器 线充 直充 小牛头,手机\通讯 > 手机配件 > 电池\充电器 > 充电器,亚马逊(卓越网),Samsung 三星
1018002011,数码|数码配件|电池、充电器,品胜1137D 三星I100 I85 NV106 HV100HD 相机电池 送贴膜一张,当当网 > 数码影音 > 数码配件 > 电池/充电器,当当网,Pisen/品胜
1018002011,数码|数码配件|电池、充电器,more-thing移动冷手宝便携迷你风扇电冷宝掌上空调电池USB双用 蓝色,手机>手机配件>创意配件> more-thing>more-thing移动冷手宝便携迷你风...,京东商城,Mate专营店
1018002011,数码|数码配件|电池、充电器,GoingPower 卓鹰 全新 戴尔 DELL D820 D830 D531 M65 M4300 笔记本电池 9芯 现货,电脑\IT > 外设产品 > 笔记本、上网本配件 > 电池,亚马逊(卓越网),GoingPower 卓鹰
1018002011,数码|数码配件|电池、充电器,安通威视 防水双绞线传输器 无源传输器 无源防水双绞线视频传输器,摄影\摄像 > 配件 > 电池、电源、充电器 > 电源适配器,亚马逊(卓越网),安通威视
1018002011,数码|数码配件|电池、充电器,工夫龙 商务电池 3100mAh 电池型号EB595675LU,手机\通讯 > 手机配件 > 电池\充电器 > 电池,亚马逊(卓越网),工夫龙
1018002011,数码|数码配件|电池、充电器,Ubit HTC 飞行者 flyer P510E原装内置电池 BG41200内置电池 4000mAh,手机\通讯 > 手机配件 > 电池\充电器 > 电池,亚马逊(卓越网),Ubit
1018002011,数码|数码配件|电池、充电器,威刚16G TF内存卡+品胜 CPLD-82电池+品胜优能充2代 电池充电器套装 酷派 8026电池 高质量手机商务电池 大容量电板 1300毫安 CPLD-82电板+座充,手机\通讯 > 手机配件 > 电池\充电器 > 电池,亚马逊(卓越网),品胜 威刚
1018002011,数码|数码配件|电池、充电器,桑格NB8L套装 佳能IXUS110 115 130 SD960 NB4L 电池+充电器,数码影音?>?数码配件?>?电池/充电器?>?商品详情,当当网,桑格
1018002011,数码|数码配件|电池、充电器,徳鑫明（dexim） iPhone5/5S 背夹电池 移动电源 外置电池 电池外壳合二为一,数码>时尚影音>苹果配件>德鑫明（dexim）>徳鑫明（dexim） iPhone5/5...,京东商城,德鑫明苹果用品专卖店
1018002011,数码|数码配件|电池、充电器,YBY HTC Sensation Pyramid 金字塔 Z710E G14 座充 便携充电器,手机通讯?>?手机配件?>?充电器/数据线?>?商品详情,当当网,YBY
1018002011,数码|数码配件|电池、充电器,原装 Panasonic 松下 LUMIX DMW-BMB9E 数码相机电池 DMC-FZ100,DMC-FZ45,摄影\摄像 > 配件 > 电池、电源、充电器 > 摄像机电池 ,亚马逊(卓越网)
1018002011,数码|数码配件|电池、充电器,品胜 苹果 iphone 4 4S TOUCH IPOD专用充电器+数据线 5V 1A,电子/类别/手机\通讯/手机配件/电池\充电器/套装,亚马逊(卓越网),Pisen 品胜
1018002011,数码|数码配件|电池、充电器,YOUBO/优博 （送苹果头+V3头+V8头）简约时尚8400毫安mAh LED照明 防火高光外壳 双USB输出 手机 ipad 通用 移动电源充电器 充电宝,手机\通讯 > 手机配件 > 电池\充电器 > 移动电源 数码影音 > 数码配件 > MP3、MP4配件 > 移动电源,亚马逊(卓越网),YOUBO/优博
1018002011,数码|数码配件|电池、充电器,品色 MB D10 竖拍 尼康 D700 D300 300S D10 手柄电池盒,所有分类>手机、数码、配件>数码配件>闪光灯及手柄>品色>品色 MB D10 ...,1号店,品色
1018002011,数码|数码配件|电池、充电器,三星 SAMSUNG  S5830 i569 i579 s5670 S5838 s5660手机原装电池+壹博源座充+数据线,其他/商品/其他,亚马逊(卓越网),Samsung 三星
1018002011,数码|数码配件|电池、充电器,友达电 ASUS华硕 G73 G73JH G73JW G73SW G73G G73S G73J G73G 笔记本电池,电脑\IT > 外设产品 > 平板电脑配件 > 充电器、 电源适配器,亚马逊(卓越网),友达电
1018002011,数码|数码配件|电池、充电器,Bevik 倍克 尼康D800E D800 D7000 V1相机电池EN-EL15,摄影\摄像 > 配件 > 电池、电源、充电器 > 相机电池,亚马逊(卓越网),Bevik 倍克
