1005009013,健康运动、户外|运动鞋|健身鞋,鸿星尔克erke超轻女士运动鞋舒适轻便女健身鞋12113109011 A3 正黑/碳灰 35,运动户外>运动鞋包>训练鞋>鸿星尔克（ERKE）>鸿星尔克erke超轻女士运动鞋舒适轻便女...,京东商城,鸿星尔克官方运动旗舰店
1005009013,健康运动、户外|运动鞋|健身鞋,【特价大促】361度跑鞋男鞋透气综合运动鞋 室内健身鞋 训练鞋轻便571314450 黑/白 41,运动户外>运动鞋包>训练鞋>361度>【特价大促】361度跑鞋男鞋透气综合运动...,京东商城,361度官方旗舰店
1005009013,健康运动、户外|运动鞋|健身鞋,迈舞正品秋冬季新款现代舞蹈鞋跳舞鞋软底女式广场舞增高健身鞋网面透气MW717（偏小一码） 黑红 39,运动健康>纤体瑜伽>舞蹈鞋服>迈舞>迈舞正品秋冬季新款现代舞蹈鞋跳舞鞋软底女...,京东商城,迈舞旗舰店
1005009013,健康运动、户外|运动鞋|健身鞋,FWLIPI凤舞立品 新款软底健身鞋跳舞鞋 现代广场舞舞蹈鞋女 加绒红色 35,鞋靴>时尚女鞋>休闲鞋> 凤舞立品（FWLIPI）>FWLIPI凤舞立品 新款软底健身鞋跳舞...,京东商城,凤舞立品旗舰店
1005009013,健康运动、户外|运动鞋|健身鞋,Dance legend 舞蹈传奇 格子舞蹈鞋女式低帮广场舞蹈鞋现代舞鞋帆布爵士鞋健身鞋,鞋靴 > 女鞋,亚马逊(卓越网),
1005009013,健康运动、户外|运动鞋|健身鞋,【货到付款】鸿星尔克正品运动鞋2014夏季男款休闲运动耐磨防滑综合训练鞋轻便健身鞋CF 紫罗兰 39,运动户外>运动鞋包>跑步鞋> 鸿星尔克（ERKE）>【货到付款】鸿星尔克正品运动鞋2014夏...,京东商城,探乐运动专营店
1005009013,健康运动、户外|运动鞋|健身鞋,步郎8653真皮休闲运动鞋跳舞鞋舞蹈鞋广场舞鞋现代舞鞋健身鞋多功能鞋女鞋 黑梅红 40偏小一码,首页>服装鞋帽>女鞋>休闲鞋>步郎8653真皮休闲运动鞋跳舞鞋舞蹈...,苏宁,步郎
1005009013,健康运动、户外|运动鞋|健身鞋,优美妮 正品软底女式舞蹈鞋 网面增高健身鞋 女鞋超轻现代广场跳舞鞋 减肥瘦身休闲鞋 跳操鞋 黑金色 38,鞋靴>时尚女鞋>休闲鞋>优美妮>优美妮 正品软底女式舞蹈鞋 网面增高健身...,京东商城,优美妮
1005009013,健康运动、户外|运动鞋|健身鞋,0KV0N 新款时尚流行休闲运动鞋 镂空透气网面 轻便舒适跑步鞋女单鞋平底鞋 韩版潮流户外鞋 健身鞋 时装鞋 旅游鞋 女鞋,鞋靴 > 女鞋 > 休闲运动鞋 鞋靴 > 男鞋,亚马逊(卓越网),
1005009013,健康运动、户外|运动鞋|健身鞋,Double Star/双星 男女同款牛筋底帆布鞋武术-3 专柜正品武术鞋/健身鞋/训练鞋 白红 39/245,首页>运动户外>运动鞋>训练鞋>DoubleStar/双星男女同...,苏宁,
1005009013,健康运动、户外|运动鞋|健身鞋,回力鞋情侣运动鞋经典健身鞋跑步鞋透气男女跑鞋牛筋底帆布训练鞋 红白 42码,首页>运动户外>运动鞋>训练鞋>回力鞋情侣运动鞋经典健身鞋跑步鞋透气...,苏宁,
1005009013,健康运动、户外|运动鞋|健身鞋,鸿星尔克新款运动鞋室内健身鞋女综合训练鞋12112414011 电 玫红 37,服饰内衣>运动>训练鞋>鸿星尔克（ERKE）>鸿星尔克新款运动鞋室内健身鞋女综合训练鞋...,京东商城,乐派运动专营店
1005009013,健康运动、户外|运动鞋|健身鞋,森歌夏季网面透气广场舞蹈鞋女增高帮健身鞋跳操鞋健美操鞋跳舞鞋SG03 黑灰 37,运动健康>纤体瑜伽>舞蹈鞋服>森歌>森歌夏季网面透气广场舞蹈鞋女增高帮健身鞋...,京东商城,森歌舞蹈鞋旗舰店
1005009013,健康运动、户外|运动鞋|健身鞋,舞蹈传奇舞蹈鞋女士帆布软底增高广场舞舞蹈鞋春夏健身鞋现代舞鞋 黑金 38,运动户外>纤体瑜伽>舞蹈鞋服> 舞蹈传奇>舞蹈传奇舞蹈鞋女士帆布软底增高广场舞舞蹈...,京东商城,舞蹈传奇旗舰店
1005009013,健康运动、户外|运动鞋|健身鞋,真好娜韩版时尚广场舞蹈鞋真皮现代跳舞鞋舒适真皮亮片女单鞋健身鞋增高运动女低帮鞋魔术贴883 黑色 36,鞋靴>时尚女鞋>休闲鞋> 真好娜（zhenhaona）>真好娜韩版时尚广场舞蹈鞋真皮现代跳舞鞋舒...,京东商城,丽娜精品皮鞋
1005009013,健康运动、户外|运动鞋|健身鞋,名门望足2014夏款潮流真皮网布透气中高帮减肥鞋舞蹈鞋健身鞋女款 C992 黑玫红 38,鞋靴>时尚女鞋>休闲鞋>名门望足（MMWZ）>名门望足2014夏款潮流真皮网布透气中高...,京东商城,名门望足旗舰店
1005009013,健康运动、户外|运动鞋|健身鞋,平衡健身鞋 AFBG010 -2黄/白/铜绿,首页> 鞋> 女鞋> 运动> 活力运动> 综合运动鞋> 平衡健身鞋 AFBG010,凡客诚品,LI-NING 李宁
1005009013,健康运动、户外|运动鞋|健身鞋,Unbeaten 明星同款时尚透明底 健身鞋 时装鞋 摇摇鞋 修身鞋 女鞋 运动鞋 个性舒适 N字母 休闲鞋 都市流行 阿甘鞋 厚底鞋 单鞋 跑步鞋,,亚马逊(卓越网),
1005009013,健康运动、户外|运动鞋|健身鞋,波罗玛2013夏季单网透气舞蹈鞋现代运动健身鞋 广场舞鞋跳舞鞋712 黑灰 40,鞋靴>时尚女鞋>特色鞋> 波罗玛（boluoma）>波罗玛2013夏季单网透气舞蹈鞋现代运动...,京东商城,波罗玛旗舰店
1005009013,健康运动、户外|运动鞋|健身鞋,AGESEA 夏季女透气鞋女网面摇摇鞋女增高鞋健身鞋休闲鞋女鞋 Q080玫红 37,鞋靴>时尚女鞋>单鞋> 潮顽爱琴海（AGESEA)>AGESEA 夏季女透气鞋女网面摇摇鞋女...,京东商城,爱琴海旗舰店
1005009013,健康运动、户外|运动鞋|健身鞋,千帆叶舞蹈鞋增高软底舒适敏捷跳舞鞋健身鞋现代舞广场舞鞋761 黄色 37,鞋靴>时尚女鞋>休闲鞋>千帆叶>千帆叶舞蹈鞋增高软底舒适敏捷跳舞鞋健身鞋...,京东商城,千帆叶旗舰店
1005009013,健康运动、户外|运动鞋|健身鞋,优美妮2014新款跳舞鞋女软底增高真皮健身鞋 现代舞鞋广场舞蹈鞋 棕色 40,鞋靴>时尚女鞋>特色鞋>优美妮>优美妮2014新款跳舞鞋女软底增高真皮健...,京东商城,优美妮
1005009013,健康运动、户外|运动鞋|健身鞋,2014新款夏季摇摇鞋女潮单鞋女式运动鞋 增高女鞋厚底鞋健身鞋 网布透气休闲鞋松糕鞋平底鞋 78玫红 37,鞋靴>时尚女鞋>休闲鞋> 麦安蒂森>2014新款夏季摇摇鞋女潮单鞋女式运动鞋...,京东商城,麦安蒂森官方旗舰店
1005009013,健康运动、户外|运动鞋|健身鞋,FWLIPI凤舞立品 新款软底健身鞋跳舞鞋 现代广场舞舞蹈鞋女 加绒黑色 40,鞋靴>时尚女鞋>休闲鞋> 凤舞立品（FWLIPI）>FWLIPI凤舞立品 新款软底健身鞋跳舞...,京东商城,凤舞立品旗舰店
1005009013,健康运动、户外|运动鞋|健身鞋,FWLIPI凤舞立品 新款软底健身鞋跳舞鞋 现代广场舞舞蹈鞋女 775黑色 40,鞋靴>时尚女鞋>休闲鞋> 凤舞立品（FWLIPI）>FWLIPI凤舞立品 新款软底健身鞋跳舞...,京东商城,凤舞立品旗舰店
1005009013,健康运动、户外|运动鞋|健身鞋,2014夏季新款网面透气摇摇鞋 健身鞋 女式增高女鞋 厚底松糕鞋白色运动休闲鞋女单鞋平底鞋 白粉红 40,鞋靴>时尚女鞋>休闲鞋> 麦安蒂森>2014夏季新款网面透气摇摇鞋 健身鞋 ...,京东商城,麦安蒂森官方旗舰店
1005009013,健康运动、户外|运动鞋|健身鞋,【领券下单】ALI&BOY 新款夏季健身鞋网面透气摇摇鞋女摇摇底坡跟休闲运动鞋女潮鞋 玫红 40,鞋靴>时尚女鞋>休闲鞋> 阿理公子（ALI&BOY）>【领券下单】ALI&BOY 新款夏季健身...,京东商城,源丰泰鞋业
1005009013,健康运动、户外|运动鞋|健身鞋,千帆叶夏季网面透气休闲女鞋摇摇鞋健身鞋松糕瘦身鞋女单鞋 西瓜红 35,鞋靴>时尚女鞋>休闲鞋> 千帆叶>千帆叶夏季网面透气休闲女鞋摇摇鞋健身鞋松...,京东商城,千帆叶旗舰店
1005009013,健康运动、户外|运动鞋|健身鞋,特价正品摇摇鞋健身鞋厚底松糕鞋单鞋休闲鞋女式健康鞋波鞋女鞋 桃红色 37,鞋靴>时尚女鞋>休闲鞋> 田岗狼（TIANGANGWOLF）>特价正品摇摇鞋健身鞋厚底松糕鞋单鞋休闲鞋...,京东商城,田岗狼旗舰店
1005009013,健康运动、户外|运动鞋|健身鞋,领舞者 夏季女透气鞋女网面摇摇鞋女松糕鞋健身鞋休闲鞋女鞋货到付款 灰色 40,鞋靴>时尚女鞋>休闲鞋>领舞者（Lingwuzhe）>领舞者 夏季女透气鞋女网面摇摇鞋女松糕鞋...,京东商城,领舞者专营店
1005009013,健康运动、户外|运动鞋|健身鞋,千帆叶新款真皮舞蹈鞋女跳舞鞋广场舞鞋现代舞鞋健身鞋软底增高782 黑色 37,鞋靴>时尚女鞋>休闲鞋>千帆叶>千帆叶新款真皮舞蹈鞋女跳舞鞋广场舞鞋现代...,京东商城,千帆叶旗舰店
1005009013,健康运动、户外|运动鞋|健身鞋,新款舞蹈鞋网面高帮真皮增高鞋女式广场舞鞋跳舞鞋健身鞋 黑红色 40,鞋靴>时尚女鞋>休闲鞋>范斯力酷（FANSILIKU）>新款舞蹈鞋网面高帮真皮增高鞋女式广场舞鞋...,京东商城,范斯力酷旗舰店
1005009013,健康运动、户外|运动鞋|健身鞋,木易王子爵士舞蹈鞋女款 运动健身鞋瘦身增高女鞋 女式跳舞鞋休闲鞋 大码 W-010,运动户外 > 运动鞋 > 休闲鞋/板鞋 > 木易王子爵士舞蹈鞋女款 运动健身鞋瘦身增高女鞋 女式跳舞鞋休闲...,当当网,木易王子
1005009013,健康运动、户外|运动鞋|健身鞋,睿登2014秋冬新款厚底摇摇鞋摇摆鞋时尚松糕鞋单鞋 女健身鞋262 262酒红 40,鞋靴>时尚女鞋>休闲鞋> 睿登（RUIDENG）>睿登2014秋冬新款厚底摇摇鞋摇摆鞋时尚...,京东商城,睿登旗舰店
1005009013,健康运动、户外|运动鞋|健身鞋,2014新款夏季摇摇鞋女潮单鞋女式运动鞋 增高女鞋厚底鞋健身鞋 网布透气休闲鞋松糕鞋平底鞋 68灰绿 35,鞋靴>时尚女鞋>休闲鞋> 麦安蒂森>2014新款夏季摇摇鞋女潮单鞋女式运动鞋...,京东商城,麦安蒂森官方旗舰店
1005009013,健康运动、户外|运动鞋|健身鞋,春秋季女士增高鞋 低帮鞋 女式坡跟摇摇鞋 女运动健身鞋韩版休闲厚底松糕鞋女鞋B833 黑色 40,鞋靴>时尚女鞋>休闲鞋> 麦安蒂森>春秋季女士增高鞋 低帮鞋 女式坡跟摇摇鞋...,京东商城,麦安蒂森官方旗舰店
1005009013,健康运动、户外|运动鞋|健身鞋,2014新款夏季摇摇鞋女潮单鞋女式运动鞋 增高女鞋厚底鞋健身鞋 网布透气休闲鞋松糕鞋平底鞋 78灰绿 40,鞋靴>时尚女鞋>休闲鞋> 麦安蒂森>2014新款夏季摇摇鞋女潮单鞋女式运动鞋...,京东商城,麦安蒂森官方旗舰店
1005009013,健康运动、户外|运动鞋|健身鞋,2014夏季新款真皮坡跟女凉鞋摇摇鞋健身鞋松糕厚底凉鞋学生休闲潮 蓝色 40,鞋靴>时尚女鞋>凉鞋> 珍格（ZENGR）>2014夏季新款真皮坡跟女凉鞋摇摇鞋健身...,京东商城,珍格鞋服专营店
1005009013,健康运动、户外|运动鞋|健身鞋,金贝勒夏季网面运动休闲鞋时尚透气瘦身摇摇鞋超轻软底增高鞋旅游鞋健身鞋徒步鞋女鞋子 浅灰色 40,鞋靴>时尚女鞋>休闲鞋> 金贝勒（JINBEILE）>金贝勒夏季网面运动休闲鞋时尚透气瘦身摇摇...,京东商城,金贝勒专营店
1005009013,健康运动、户外|运动鞋|健身鞋,驰升 2014春夏季新款网面透气运动休闲女鞋摇摇鞋健身鞋松糕瘦身鞋正品 灰色 40码,首页>服装鞋帽>女鞋>休闲鞋>驰升2014春夏季新款网面透气运动...,苏宁,驰升
1005009013,健康运动、户外|运动鞋|健身鞋,瓦娜沙真牛皮白增高舞蹈鞋女爵士现代广场跳舞鞋健身鞋跳操鞋高帮V08,运动户外 > 户外鞋袜 > 专项运动鞋 > 瓦娜沙真牛皮白增高舞蹈鞋女爵士现代广场跳舞鞋健身鞋跳操鞋高帮...,当当网,瓦娜沙
