1005009014,健康运动、户外|运动鞋|网球鞋,李宁男鞋 运动鞋网球鞋训练鞋 ATTG009-4/-2/-1 蓝/白 44,服饰鞋帽>运动>足球鞋>李宁（LI-NING）>李宁男鞋 运动鞋网球鞋训练鞋 ATTG0...,京东商城,万淘运动户外专营店
1005009014,健康运动、户外|运动鞋|网球鞋,李宁LI-NING男鞋网球专业鞋-ATPE021-9 红色 41.5,服饰内衣>运动>训练鞋>李宁（LI-NING）>李宁LI-NING男鞋网球专业鞋-ATP...,京东商城,云聚运动专营店
1005009014,健康运动、户外|运动鞋|网球鞋,双星 男子专业网球训练鞋 718-M-9957 白宝石蓝 41,双星 男子专业网球训练鞋 718-M-9...,京东商城,双星旗舰店
1005009014,健康运动、户外|运动鞋|网球鞋,李宁 LINING 女子减震鞋垫网球专业比赛鞋-ATAG006-1 白色 39,服饰内衣>运动>训练鞋>李宁（LI-NING）>李宁 LINING 女子减震鞋垫网球专业...,京东商城,云聚运动专营店
1005009014,健康运动、户外|运动鞋|网球鞋,李宁 LINING 假一赔十 京东 网球训练鞋 ATTH007-2-1-3 -1白/冷灰/亮蓝 45,服饰内衣>运动>训练鞋>李宁 LINING 假一赔十 京东 网球...,京东商城,领动运动专营店
1005009014,健康运动、户外|运动鞋|网球鞋,【当当自营】HEAD海德Supreme Men 网球鞋 272140-WHBK,运动户外 > 运动鞋 > 乒网羽鞋 > 商品详情,当当网,HEAD海德
1005009014,健康运动、户外|运动鞋|网球鞋,特步XTEP男款综训鞋MD网球鞋XM24F595黑兰41码,特步（XTEP）>特步网球鞋,京东商城,特步（XTEP）
1005009014,健康运动、户外|运动鞋|网球鞋,ERKE鸿星尔克 男子网球鞋 11136090-20,首页 > 鸿星尔克 > 网球鞋,乐淘,
1005009014,健康运动、户外|运动鞋|网球鞋,ERKE鸿星尔克 女子网球文化鞋 12136083-40,首页 > 鸿星尔克 > 网球鞋,乐淘,
1005009014,健康运动、户外|运动鞋|网球鞋,Reebok锐步 男子网球鞋 J85177,首页 > 锐步 > 休闲/文化鞋,乐淘,
1005009014,健康运动、户外|运动鞋|网球鞋,ADIDAS 阿迪达斯 中性网球鞋 U42124,首页 > 中性鞋 >,型尚网,阿迪达斯 名称:ADIDAS 阿迪达斯 中性网球鞋
1005009014,健康运动、户外|运动鞋|网球鞋,安踏 anta 女式时尚网球鞋 2043373-7,首页 > 女运动鞋 > 网球鞋 >,型尚网,安踏 名称: 安踏 女式 网球鞋 2043373-
1005009014,健康运动、户外|运动鞋|网球鞋,NIKE耐克IRMAXBREATHE女子网球鞋308661-107，38号,首页>运动>运动鞋>网球鞋,银泰网,NIKE
1005009014,健康运动、户外|运动鞋|网球鞋,adivon 新款男士休闲网球鞋 AY7061 黑色 42,adivon 新款男士休闲网球鞋 AY...,京东商城,阿迪王
1005009014,健康运动、户外|运动鞋|网球鞋,李宁男子网眼透气超耐磨大底场外网球训练鞋ATTF017-2,首页>运动>运动鞋>网球鞋,银泰网,LINING
1005009014,健康运动、户外|运动鞋|网球鞋,NIKE(耐克) 网球鞋 网球鞋 男性 429636104 429636-104NIKE,当当网 > 运动户外 > 运动鞋 > 乒网羽鞋,当当网,耐克
1005009014,健康运动、户外|运动鞋|网球鞋,安踏ANTA 新款 运动鞋 男子网球鞋,首页 > 运动户外 > 运动鞋 > 网球鞋 > 安踏 ANTA > 安踏ANTA 新款 运动鞋 男子网球鞋,品聚网,安踏 ANTA
1005009014,健康运动、户外|运动鞋|网球鞋,Li Ning 李宁 网球系列 女网球鞋 ATCF020-2,鞋靴 > 女鞋 > 专业运动鞋 > 网球鞋,亚马逊(卓越网),
1005009014,健康运动、户外|运动鞋|网球鞋,Adidas 阿迪达斯 网球文化系列 女休闲运动鞋 Premier Classic W Synthetic,鞋靴 > 女鞋 > 专业运动鞋 > 网球鞋 ,亚马逊(卓越网),Adidas 阿迪达斯
1005009014,健康运动、户外|运动鞋|网球鞋,Li Ning 李宁 网球系列 女网球鞋 ATCF020-2,鞋靴 > 女鞋 > 专业运动鞋 > 网球鞋,亚马逊(卓越网),
1005009014,健康运动、户外|运动鞋|网球鞋,361度网球鞋女性8145507-0333,鞋靴 > 女鞋 > 专业运动鞋 > 网球鞋 ,亚马逊(卓越网),361度网球鞋女性
1005009014,健康运动、户外|运动鞋|网球鞋,ANTA 安踏 网球系列 男网球鞋 11143025,鞋靴 > 男鞋 > 专业运动鞋 > 网球鞋,亚马逊(卓越网),
1005009014,健康运动、户外|运动鞋|网球鞋,ADIDAS(阿迪达斯)网球鞋2012年3月新品男性G45562ADIDAS,当当网 > 运动户外 > 运动鞋 > 乒网羽鞋,当当网,阿迪达斯
1005009014,健康运动、户外|运动鞋|网球鞋,Z Lining/李宁 2011新款 女 网球鞋 ATAF006-3,当当网 > 运动户外 > 运动鞋 > 乒网羽鞋,当当网,李宁
1005009014,健康运动、户外|运动鞋|网球鞋,匹克 PEAK 超轻便耐磨男款专业网球鞋E14007C 大白/彩兰,首页 >运动户外 >运动鞋 >网球鞋 >匹克 PEAK 超轻便耐磨男款专业网球鞋E14007C,vjia,匹克旗舰店
1005009014,健康运动、户外|运动鞋|网球鞋,ADIDAS(阿迪) 网球系列 网球鞋 女性 V24737,当当网 > 运动户外 > 运动鞋 > 乒网羽鞋,当当网,阿迪达斯
1005009014,健康运动、户外|运动鞋|网球鞋,361° 男子网球鞋 7145507-179,首页 > 鞋 > 运动鞋 > 网球鞋 > 361°,酷运动,361°
1005009014,健康运动、户外|运动鞋|网球鞋,LiNing Kids李宁童装 中性网球鞋 2KTE101025-17,首页 > 鞋 > 运动 > 网球鞋 > LiNing Kids李宁童装,酷运动,LiNing Kids李宁童装
1005009014,健康运动、户外|运动鞋|网球鞋,【当当自营】HEAD海德网球鞋0077-0177-37,运动户外 > 运动鞋 > 乒网羽鞋 > 商品详情,当当网,HEAD海德
1005009014,健康运动、户外|运动鞋|网球鞋,361° 男子网球鞋 7145507-110/7145507-179/7145507-263此商品不支持货到付款,当当网 > 运动户外 > 运动鞋 > 乒网羽鞋,当当网,361度
1005009014,健康运动、户外|运动鞋|网球鞋,断码 专柜正品 李宁 网球鞋 女鞋 ATTF062-2,运动户外 > 运动鞋 > 乒网羽鞋,当当网,李宁
1005009014,健康运动、户外|运动鞋|网球鞋,361° 男子网球鞋 7145507-263,首页 > 鞋 > 运动鞋 > 网球鞋 > 361°,酷运动,361°
1005009014,健康运动、户外|运动鞋|网球鞋,Dunlop邓禄普 耐磨男子专业网球鞋 DST0956B,当当网 > 运动户外 > 运动鞋 > 乒网羽鞋,当当网,邓禄普
1005009014,健康运动、户外|运动鞋|网球鞋,阿迪达斯Adidas男式网球鞋-G41049,当当网 > 运动户外 > 运动鞋 > 乒网羽鞋,当当网,阿迪达斯Adidas
1005009014,健康运动、户外|运动鞋|网球鞋,Adidas 男式 网球文化系列经典复刻网球鞋 V22515,当当网 > 运动户外 > 运动鞋 > 乒网羽鞋,当当网,阿迪达斯
1005009014,健康运动、户外|运动鞋|网球鞋,ADIDAS(阿迪达斯) 网球鞋 网球鞋 中性 U42127ADIDAS,当当网 > 运动户外 > 运动鞋 > 乒网羽鞋,当当网,阿迪达斯
1005009014,健康运动、户外|运动鞋|网球鞋,PEAK 匹克 网羽系列 女专业网球鞋 E11258C,鞋靴 > 女鞋 > 专业运动鞋 > 网球鞋,亚马逊(卓越网),
1005009014,健康运动、户外|运动鞋|网球鞋,Adidas 阿迪达斯 动感青春系列 女网球鞋 adizero Feather W,鞋靴 > 女鞋 > 专业运动鞋 > 网球鞋,亚马逊(卓越网),
1005009014,健康运动、户外|运动鞋|网球鞋,Adidas 阿迪达斯 经典网球 女网球鞋,鞋靴 > 女鞋 > 专业运动鞋 > 网球鞋,亚马逊(卓越网),
1005009014,健康运动、户外|运动鞋|网球鞋,Nike/耐克 CITYCOURTVI女网球鞋429638-108,所有分类>运动户外>运动鞋>综合训练鞋>Nike/耐克>Nike/耐克 CI...,1号店,Nike/耐克
1005009014,健康运动、户外|运动鞋|网球鞋,耐克Nike 2012年春款男网球鞋454234-134,所有分类 > 服饰内衣、鞋靴运动 > 男鞋 > 男式户外鞋 > Nike/耐克,1号店,
1005009014,健康运动、户外|运动鞋|网球鞋,ERKE/鸿星尔克 新款职业网球女鞋 舒适 轻便 户外运动综训鞋 LM 12036054,所有分类 > 服饰内衣、鞋靴运动 > 运动户外 > 运动鞋. > 网球鞋 > ERKE/鸿星尔克,1号店,
1005009014,健康运动、户外|运动鞋|网球鞋,ANTA/安踏 网球系列网球鞋 11143311-3 |,所有分类 > 服饰内衣、鞋靴运动 > 运动户外 > 运动鞋. > 网球鞋 > ANTA/安踏,1号店,
1005009014,健康运动、户外|运动鞋|网球鞋,ANTA/安踏[XJ] 网球鞋 女鞋 2113382-2,所有分类>运动户外>运动鞋>网球鞋>ANTA/安踏>ANTA/安踏[XJ...,1号店,ANTA/安踏
1005009014,健康运动、户外|运动鞋|网球鞋,Adidas/阿迪达斯 Brasic 3 Lea 网球鞋 男鞋 G41046,所有分类>运动户外>运动鞋>网球鞋>Adidas/阿迪达斯>Adidas/阿迪达...,1号店,Adidas/阿迪达斯
1005009014,健康运动、户外|运动鞋|网球鞋,Adidas/阿迪达斯 CT light 网球鞋 男鞋 G46707,所有分类 > 服饰内衣、鞋靴运动 > 运动户外 > 运动鞋. > 网球鞋 > Adidas/阿迪达斯,1号店,
1005009014,健康运动、户外|运动鞋|网球鞋,3z New Balance/新百伦 网球鞋 男鞋 MC804W-2E,所有分类 > 服饰内衣、鞋靴运动 > 运动户外 > 运动鞋. > 网球鞋 > New Balance/新百伦,1号店,
1005009014,健康运动、户外|运动鞋|网球鞋,Deerway/德尔惠 2012春季 透气 网球鞋 女式 12Q1 31223219,所有分类 > 服饰内衣、鞋靴运动 > 运动户外 > 运动鞋. > 网球鞋 > Deerway/德尔惠,1号店,
1005009014,健康运动、户外|运动鞋|网球鞋,Deerway/德尔惠 春季 网球鞋 女式 11Q4 34123220,所有分类 > 服饰内衣、鞋靴运动 > 运动户外 > 运动鞋. > 网球鞋 > Deerway/德尔惠,1号店,
1005009014,健康运动、户外|运动鞋|网球鞋,ERKE/鸿星尔克 女子网球鞋 12126031-14,所有分类 > 服饰内衣、鞋靴运动 > 女鞋 > 女式休闲运动鞋 > ERKE/鸿星尔克,1号店,
1005009014,健康运动、户外|运动鞋|网球鞋,LI-NING/李宁 女 ATPF004-4 白-银-桔-灰,所有分类 > 服饰内衣、鞋靴运动 > 运动户外 > 运动鞋. > 网球鞋 > LI-NING/李宁,1号店,
1005009014,健康运动、户外|运动鞋|网球鞋,PUMA 彪马 怀旧系列 中性网球鞋 HERITAGE 351290,鞋靴 > 女鞋 > 专业运动鞋 > 网球鞋 ,亚马逊(卓越网),PUMA 彪马
1005009014,健康运动、户外|运动鞋|网球鞋,ANTA 安踏 男网球鞋 11123035,鞋靴 > 男鞋 > 专业运动鞋 > 网球鞋,亚马逊(卓越网),
1005009014,健康运动、户外|运动鞋|网球鞋,ANTA 安踏 女网球鞋 12123039,鞋靴 > 女鞋 > 专业运动鞋 > 网球鞋,亚马逊(卓越网),
1005009014,健康运动、户外|运动鞋|网球鞋,Adidas 阿迪达斯 动感青春系列 男网球鞋 adizero Feather Asia,鞋靴 > 男鞋 > 专业运动鞋 > 网球鞋,亚马逊(卓越网),
1005009014,健康运动、户外|运动鞋|网球鞋,Nike 耐克 TENNIS 男网球鞋 429985,鞋靴 > 男鞋 > 专业运动鞋 > 网球鞋,亚马逊(卓越网),
1005009014,健康运动、户外|运动鞋|网球鞋,Adidas 阿迪达斯 网球文化系列 中性网球鞋 Grand Slam,鞋靴 > 女鞋 > 专业运动鞋 > 网球鞋 ,亚马逊(卓越网),
1005009014,健康运动、户外|运动鞋|网球鞋,ERKE 鸿星尔克 男网球鞋 11136066,鞋靴 > 男鞋 > 专业运动鞋 > 网球鞋,亚马逊(卓越网),
1005009014,健康运动、户外|运动鞋|网球鞋,Li Ning 李宁 网球系列 男网球鞋 ATCF013-2,鞋靴 > 男鞋 > 专业运动鞋 > 网球鞋,亚马逊(卓越网),
1005009014,健康运动、户外|运动鞋|网球鞋,Adidas 阿迪达斯 网球文化 男网球鞋 Brasic 3 Mid lea,鞋靴 > 男鞋 > 专业运动鞋 > 网球鞋,亚马逊(卓越网),
1005009014,健康运动、户外|运动鞋|网球鞋,Li Ning 李宁 网球系列 女网球鞋 ATBF004-1,鞋靴 > 女鞋 > 专业运动鞋 > 网球鞋,亚马逊(卓越网),
1005009014,健康运动、户外|运动鞋|网球鞋,ANTA 安踏 男网球鞋 11133033,鞋靴 > 男鞋 > 专业运动鞋 > 网球鞋,亚马逊(卓越网),
1005009014,健康运动、户外|运动鞋|网球鞋,ASICS 亚瑟士 网球鞋 男网球鞋 GEL-GAME 3 E104Y,鞋靴 > 男鞋 > 专业运动鞋 > 网球鞋,亚马逊(卓越网),ASICS 亚瑟士
1005009014,健康运动、户外|运动鞋|网球鞋,ANTA 安踏 网球系列 男网球鞋 11143032,鞋靴 > 男鞋 > 专业运动鞋 > 网球鞋,亚马逊(卓越网),
1005009014,健康运动、户外|运动鞋|网球鞋,ANTA 安踏 网球系列 女网球鞋 12143030,鞋靴 > 女鞋 > 专业运动鞋 > 网球鞋,亚马逊(卓越网),
1005009014,健康运动、户外|运动鞋|网球鞋,Li Ning 李宁 网球系列 男网球鞋 ATTF055-1,鞋靴 > 男鞋 > 专业运动鞋 > 网球鞋,亚马逊(卓越网),
1005009014,健康运动、户外|运动鞋|网球鞋,Li Ning 李宁 网球系列 男网球鞋 ATTF055-1,鞋靴 > 男鞋 > 专业运动鞋 > 网球鞋,亚马逊(卓越网),
1005009014,健康运动、户外|运动鞋|网球鞋,Lotto 乐途 网球系列 男 短袖POLO EPLF085,运动户外休闲 > 网球 > 网球服 > 男士 > 短袖上衣 鞋靴 > 男鞋 > 专业运动鞋 > 网球鞋,亚马逊(卓越网),Lotto 乐途
1005009014,健康运动、户外|运动鞋|网球鞋,Li Ning 李宁 网球系列 女网球鞋 ATCF050,鞋靴 > 女鞋 > 专业运动鞋 > 网球鞋,亚马逊(卓越网),
1005009014,健康运动、户外|运动鞋|网球鞋,Li Ning 李宁 网球系列 女网球鞋 ATTF074,鞋靴 > 女鞋 > 专业运动鞋 > 网球鞋,亚马逊(卓越网),
1005009014,健康运动、户外|运动鞋|网球鞋,Li Ning 李宁 网球系列 女网球鞋 ATPF024,鞋靴 > 女鞋 > 专业运动鞋 > 网球鞋,亚马逊(卓越网),
1005009014,健康运动、户外|运动鞋|网球鞋,Li Ning 李宁 网球系列 男网球鞋 ATCF027,鞋靴 > 男鞋 > 专业运动鞋 > 网球鞋,亚马逊(卓越网),
1005009014,健康运动、户外|运动鞋|网球鞋,Nike 耐克 网球系列 女网球鞋 454233,鞋靴 > 女鞋 > 专业运动鞋 > 网球鞋,亚马逊(卓越网),
1005009014,健康运动、户外|运动鞋|网球鞋,Li Ning 李宁 女网球鞋 ATCF050,鞋靴 > 女鞋 > 专业运动鞋 > 网球鞋,亚马逊(卓越网),
1005009014,健康运动、户外|运动鞋|网球鞋,Li Ning 李宁 男网球鞋 ATTF051,鞋靴 > 男鞋 > 专业运动鞋 > 网球鞋,亚马逊(卓越网),
1005009014,健康运动、户外|运动鞋|网球鞋,Adidas 阿迪达斯 网球文化 男网球鞋 Switch Master Synthetic,鞋靴 > 男鞋 > 专业运动鞋 > 网球鞋,亚马逊(卓越网),
1005009014,健康运动、户外|运动鞋|网球鞋,Adidas 阿迪达斯 网球文化 男网球鞋 Switch Master Synthetic,鞋靴 > 男鞋 > 专业运动鞋 > 网球鞋,亚马逊(卓越网),
1005009014,健康运动、户外|运动鞋|网球鞋,Li Ning 李宁 网球系列 男网球鞋 ATCG005,鞋靴 > 男鞋 > 专业运动鞋 > 网球鞋,亚马逊(卓越网),
1005009014,健康运动、户外|运动鞋|网球鞋,Li Ning 李宁 网球系列 男网球鞋 ATTG003,鞋靴 > 男鞋 > 专业运动鞋 > 网球鞋,亚马逊(卓越网),
1005009014,健康运动、户外|运动鞋|网球鞋,ERKE 鸿星尔克 网球系列 男 功能网球鞋 11112112007,鞋靴 > 男鞋 > 专业运动鞋 > 网球鞋,亚马逊(卓越网),
1005009014,健康运动、户外|运动鞋|网球鞋,Nike 耐克网球鞋2012年1月新品男性408071110 408071-110,鞋靴 > 女鞋 > 专业运动鞋 > 网球鞋 ,亚马逊(卓越网),Nike 耐克
1005009014,健康运动、户外|运动鞋|网球鞋,deerway 德尔惠 女网球鞋 31223219,鞋靴 > 女鞋 > 专业运动鞋 > 网球鞋,亚马逊(卓越网),
1005009014,健康运动、户外|运动鞋|网球鞋,Adidas 阿迪达斯 网球文化系列 中性休闲运动鞋 Brasic 3 Textile (cvs),鞋靴 > 女鞋 > 专业运动鞋 > 网球鞋 ,亚马逊(卓越网),Adidas 阿迪达斯
1005009014,健康运动、户外|运动鞋|网球鞋,Adidas 阿迪达斯 网球文化系列 男休闲运动鞋 Oracle V Textile (Canvas),鞋靴 > 男鞋 > 专业运动鞋 > 网球鞋 ,亚马逊(卓越网),Adidas 阿迪达斯
1005009014,健康运动、户外|运动鞋|网球鞋,Nike/耐克 男鞋 网球鞋-511236-401,所有分类 > 服饰内衣、鞋靴运动 > 运动户外 > 运动鞋. > 网球鞋 > Nike/耐克,1号店,
1005009014,健康运动、户外|运动鞋|网球鞋,Nike/耐克 AIR OSCILLE 网球鞋 男鞋 140370-103,所有分类>运动户外>运动鞋>网球鞋>Nike/耐克>Nike/耐克 AI...,1号店,Nike/耐克
1005009014,健康运动、户外|运动鞋|网球鞋,adidas 阿迪达斯 网球 男 网球文化系列 Brasic 3 场上网球鞋 卡其 G65374,首页 > 阿迪达斯 > 网球鞋,乐淘,阿迪达斯鞋子
1005009014,健康运动、户外|运动鞋|网球鞋,Nike/耐克 [XJ]2012新款 AIR MAX COURTBALLISTEC 网球鞋 男鞋 487986-610,所有分类>运动户外>运动鞋>网球鞋>Nike/耐克>Nike/耐克 [X...,1号店,Nike/耐克
1005009014,健康运动、户外|运动鞋|网球鞋,Adidas/阿迪达斯 男式 网球文化系列简约外观网球鞋 G61911 Oracle V,所有分类 > 服饰内衣、鞋靴运动 > 男鞋 > 休闲运动鞋 > Adidas/阿迪达斯,1号店,
1005009014,健康运动、户外|运动鞋|网球鞋,ERKE/鸿星尔克 运动鞋休闲鞋女士网球鞋 12046027,所有分类 > 服饰内衣、鞋靴运动 > 运动户外 > 运动户外鞋 > 网球鞋 > ERKE/鸿星尔克,1号店,
1005009014,健康运动、户外|运动鞋|网球鞋,李宁LI-NING女子网球训练鞋ATTF062-2(37),首页>运动户外>运动鞋>网球鞋>李宁LI-NING女子网球训练鞋AT...,苏宁,李宁LI-NING
1005009014,健康运动、户外|运动鞋|网球鞋,adidas阿迪达斯 男子网球鞋 Oracle V G65293 白色 39,服饰鞋帽>运动>乒羽鞋>adidas阿迪达斯>adidas阿迪达斯 男子网球鞋 Ora...,京东商城,酷运动
1005009014,健康运动、户外|运动鞋|网球鞋,特步 Xtep 网球鞋 女式运动鞋 户外 秋季休闲鞋 LM XW24D891 白黑 35,服饰内衣>运动>训练鞋>特步（XTEP）>特步 Xtep 网球鞋 女式运动鞋 户外...,京东商城,俊林运动专营店
1005009014,健康运动、户外|运动鞋|网球鞋,特步 XTEP 网球鞋 男鞋 XM24G712 白黑 39,特步 XTEP 网球鞋 男鞋 XM24G...,京东商城,特步官方旗舰店
1005009014,健康运动、户外|运动鞋|网球鞋,(颜色以图片为准) Adidas阿迪达斯 网球 女子网球鞋 G41300 黑 38,(颜色以图片为准) Adidas阿迪达斯...,京东商城,酷买运动专营店
1005009014,健康运动、户外|运动鞋|网球鞋,海德HEAD 902TMW0776-0111女款专业网球鞋 防滑佳 白色 35,海德（HEAD）>海德HEAD 902TMW0776-01...,京东商城,来佛运动 专营店
1005009014,健康运动、户外|运动鞋|网球鞋,无货迪亚多纳Diadora 金刀博客经典运动鞋男士网球鞋 12108409 黑色 38,运动户外>运动鞋包>休闲鞋>迪亚多纳（Diadora）>无货迪亚多纳Diadora 金刀博客经典...,京东商城,古戈运动品牌专营店
1005009014,健康运动、户外|运动鞋|网球鞋,安踏Anta男式网球鞋 11213311-4 黑色 40,安踏（ANTA）>安踏Anta男式网球鞋 11213311...,京东商城,西街运动专营店
1005009014,健康运动、户外|运动鞋|网球鞋,正品 李宁 运动鞋 女 网球鞋 女鞋 网球文化鞋 ATCF054-1 黑/紫/白/银 5,服饰内衣>运动>训练鞋>李宁（LI-NING）>正品 李宁 运动鞋 女 网球鞋 女鞋 网...,京东商城,李宁 官方旗舰店
1005009014,健康运动、户外|运动鞋|网球鞋,耐克Nike男鞋网球鞋 511236-401 蓝色 38.5,耐克（NIKE）>耐克Nike男鞋网球鞋 511236-4...,京东商城,西街运动专营店
1005009014,健康运动、户外|运动鞋|网球鞋,安踏/ANTA 新款男子运动鞋 男子网球鞋1043375-3 40,安踏（ANTA）>安踏/ANTA 新款男子运动鞋 男子网球...,京东商城,国威运动专营店
1005009014,健康运动、户外|运动鞋|网球鞋,安踏 ANTA 网球鞋 女式运动鞋 户外 春季休闲鞋 LM 2013339 灰白 36,服饰内衣>运动>休闲鞋>安踏（ANTA）>安踏 ANTA 网球鞋 女式运动鞋 户外...,京东商城,俊林运动专营店
1005009014,健康运动、户外|运动鞋|网球鞋,adidas阿迪达斯女子 Bian网球文化系列网球鞋G46517,首页 > 运动 > 运动鞋 > 网球鞋 > adidas阿迪达斯女子 Bian网球文化系列网球鞋G46517,优购网,无
1005009014,健康运动、户外|运动鞋|网球鞋,adidas阿迪达斯12年新款男子 Brasic 4 网球鞋G63181,首页 > 运动 > 运动鞋 > 网球鞋 > adidas阿迪达斯12年新款男子 Brasic 4 网球鞋G63181,优购网,无
1005009014,健康运动、户外|运动鞋|网球鞋,NIKE耐克 2012新款ZOOM男子网球鞋511236-061,首页 > 运动 > 运动鞋 > 网球鞋 > NIKE耐克 2012新款ZOOM男子网球鞋511236-061,优购网,nike/耐克
1005009014,健康运动、户外|运动鞋|网球鞋,adidas阿迪达斯2012新款女子 Oracle Logo网球文化系列网球鞋V24783,首页 > 运动 > 运动鞋 > 网球鞋 > adidas阿迪达斯2012新款女子 Oracle Logo网球文化系列网球鞋V24783,优购网,无
1005009014,健康运动、户外|运动鞋|网球鞋,adidas阿迪达斯女子 Oracle Logo网球文化系列网球鞋V24782, 首页 > 运动 > 运动鞋 > 网球鞋 > adidas阿迪达斯女子 Oracle Logo网球文化系列网球鞋V24782,优购网,无
1005009014,健康运动、户外|运动鞋|网球鞋,NIKE耐克 2012新款女子网球鞋408070-110,首页 > 运动 > 运动鞋 > 网球鞋 > NIKE耐克 2012新款女子网球鞋408070-110,优购网,nike/耐克
1005009014,健康运动、户外|运动鞋|网球鞋,XTEP 特步 网球系列 女MD网球鞋 XW24A030,鞋靴 > 女鞋 > 运动鞋\\户外鞋 > 网球鞋,亚马逊(卓越网),
1005009014,健康运动、户外|运动鞋|网球鞋,Adidas 阿迪达斯 网球文化系列 女网球鞋 Brasic 3 W,鞋靴 > 女鞋 > 专业运动鞋 > 网球鞋,亚马逊(卓越网),
1005009014,健康运动、户外|运动鞋|网球鞋,Adidas 阿迪达斯 网球文化 男网球鞋 Brasic Light Leather,鞋靴 > 男鞋 > 专业运动鞋 > 网球鞋,亚马逊(卓越网),
1005009014,健康运动、户外|运动鞋|网球鞋,Li Ning 李宁 网球系列 男网球鞋 ATTF053,鞋靴 > 男鞋 > 专业运动鞋 > 网球鞋,亚马逊(卓越网),
1005009014,健康运动、户外|运动鞋|网球鞋,Li Ning 李宁 网球系列 女网球鞋 ATTG004,鞋靴 > 女鞋 > 专业运动鞋 > 网球鞋,亚马逊(卓越网),
1005009014,健康运动、户外|运动鞋|网球鞋,deerway 德尔惠 男网球鞋 31213211,鞋靴 > 男鞋 > 运动鞋\\户外鞋 > 网球鞋,亚马逊(卓越网),
1005009014,健康运动、户外|运动鞋|网球鞋,ERKE 鸿星尔克 ATP网球系列 女网球鞋 12026009-12,鞋靴 > 女鞋 > 专业运动鞋 > 网球鞋,亚马逊(卓越网),
1005009014,健康运动、户外|运动鞋|网球鞋,Li Ning 李宁 正品运动鞋 男鞋夏款透气休闲户外专业健身网球鞋ATTF025-3(41, 黑色),鞋靴 > 女鞋 ,亚马逊(卓越网)
1005009014,健康运动、户外|运动鞋|网球鞋,ERKE 鸿星尔克 男款 网球鞋 11036052-12,鞋靴 > 男鞋 > 专业运动鞋 > 网球鞋,亚马逊(卓越网),
1005009014,健康运动、户外|运动鞋|网球鞋,Nike 耐克 简洁耐磨网球鞋 男 black,鞋靴 > 男鞋 > 运动鞋\\户外鞋 > 网球鞋,亚马逊(卓越网),
1005009014,健康运动、户外|运动鞋|网球鞋,NIKE 耐克 6月新款ZOOM透气网球鞋,鞋靴 > 女鞋 > 专业运动鞋 > 网球鞋 ,亚马逊(卓越网),
1005009014,健康运动、户外|运动鞋|网球鞋,ERKE 鸿星尔克 女子网球鞋,鞋靴 > 女鞋 > 专业运动鞋 > 网球鞋 ,亚马逊(卓越网),
1005009014,健康运动、户外|运动鞋|网球鞋,adidas 阿迪达斯 Switch Master 网球鞋 男鞋 G46861 亮白+1号黑色+银 40.5,阿迪达斯（Adidas）>adidas 阿迪达斯 Switch M...,京东商城,名鞋库adidas官方授权
1005009014,健康运动、户外|运动鞋|网球鞋,耐克/Nike 女子网球鞋 Zoom Swing 2 DD 396045-103 白色 36.5码,耐克（NIKE）>耐克/Nike 女子网球鞋 Zoom S...,京东商城,良景运动专营店
1005009014,健康运动、户外|运动鞋|网球鞋,Adidas阿迪达斯中性鞋 网球 中性网球鞋 V23791 (颜色以图片为准) 黑 40.5,Adidas阿迪达斯中性鞋 网球 中性网...,京东商城,酷买运动专营店
1005009014,健康运动、户外|运动鞋|网球鞋,5折特惠 Adidas/阿迪达斯 Bian M 网球鞋 男鞋 U43812,所有分类 > 服饰内衣、鞋靴运动 > 运动户外鞋 > 网球鞋 > Adidas/阿迪达斯,1号店,
1005009014,健康运动、户外|运动鞋|网球鞋,5折特惠 Adidas/阿迪达斯 Batida II RG FG 网球鞋 男鞋 U43114,所有分类 > 服饰内衣、鞋靴运动 > 运动户外鞋 > 网球鞋 > Adidas/阿迪达斯,1号店,
1005009014,健康运动、户外|运动鞋|网球鞋,Adidas/阿迪达斯 男 2012新款 轻盈减震透气 网球鞋G60623,所有分类>运动户外>运动鞋>网球鞋>Adidas/阿迪达斯>Adidas/阿迪达...,1号店,Adidas/阿迪达斯
1005009014,健康运动、户外|运动鞋|网球鞋,ANTA/安踏 2012新款 网球鞋 女鞋 12233324-3,所有分类>运动户外>运动鞋>网球鞋>ANTA/安踏>ANTA/安踏 20...,1号店,ANTA/安踏
1005009014,健康运动、户外|运动鞋|网球鞋,德尔惠 Deerway 休闲时尚网球鞋 女士运动鞋31223222 淡紫色,首页 >运动户外 >运动鞋 >网球鞋 >德尔惠 Deerway 休闲时尚网球鞋 女士运动鞋31223222,vjia,Deerway德尔惠官方旗舰店
1005009014,健康运动、户外|运动鞋|网球鞋,adivon 女子新款时尚运动户外网球鞋BY7152 黑梅红,首页 >运动户外 >运动鞋 >网球鞋 >adivon 女子新款时尚运动户外网球鞋BY7152,vjia,adivon官方旗舰店
1005009014,健康运动、户外|运动鞋|网球鞋,特步 女子网球鞋989418130085 白红,首页 >运动户外 >运动鞋 >训练鞋 >特步 女子网球鞋989418130085,vjia,特步旗舰店
1005009014,健康运动、户外|运动鞋|网球鞋,德尔惠 Deerway 正品 新款网球鞋 男鞋 休闲时尚运动鞋33213218 白色,首页 >运动户外 >运动鞋 >网球鞋 >德尔惠 Deerway 正品 新款网球鞋 男鞋 休闲时尚运动鞋33213218,vjia,Deerway德尔惠官方旗舰店
