1005009014,健康运动、户外|运动鞋|网球鞋,匹克 PEAK 网球鞋系列 专业网球鞋女款E13498C 大白/水幽兰,首页 >运动户外 >运动鞋 >网球鞋 >匹克 PEAK 网球鞋系列 专业网球鞋女款E13498C,vjia,匹克旗舰店
1005009014,健康运动、户外|运动鞋|网球鞋,Deerway 德尔惠 男士 时尚休闲 网球鞋 低帮运动鞋34113217 银灰色,首页 >运动户外 >运动鞋 >网球鞋 >Deerway 德尔惠 男士 时尚休闲 网球鞋 低帮运动鞋34113217,vjia,Deerway德尔惠官方旗舰店
1005009014,健康运动、户外|运动鞋|网球鞋,安踏 女式 新彩完美炫色网球图案耐磨简约网球鞋 12233052-2 粉色 35,安踏（ANTA）>安踏 女式 新彩完美炫色网球图案耐磨简约...,京东商城,好乐买运动旗舰店
1005009014,健康运动、户外|运动鞋|网球鞋,Adidas阿迪达斯 男子网球鞋adiZ feather II V21125/G62883 白色 40,服饰鞋帽>运动>乒羽鞋>adidas阿迪达斯>Adidas阿迪达斯 男子网球鞋adiZ...,京东商城,酷运动
1005009014,健康运动、户外|运动鞋|网球鞋,阿迪达斯/Adidas 男士网球鞋 Adipower Barricade V23176 橘红 44.5码,阿迪达斯（Adidas）>阿迪达斯/Adidas 男士网球鞋 Ad...,京东商城,良景运动专营店
1005009014,健康运动、户外|运动鞋|网球鞋,Nike 耐克 男子网球 NIKE AIR SERVE RETURN 网球鞋 煤黑/白/黑/青 黑色 40,Nike 耐克 男子网球 NIKE AI...,京东商城,乐淘运动鞋城
1005009014,健康运动、户外|运动鞋|网球鞋,耐克NIKE新款女子运动休闲低帮网球鞋S 429638-108 白色 36,耐克NIKE新款女子运动休闲低帮网球鞋S...,京东商城,辉动运动专营店
1005009014,健康运动、户外|运动鞋|网球鞋,Adidas阿迪达斯男子网球鞋运动鞋 G60520 图片色 39,服饰鞋帽>运动>乒羽鞋>adidas阿迪达斯>Adidas阿迪达斯男子网球鞋运动鞋 G...,京东商城,加百利运动专营店
1005009014,健康运动、户外|运动鞋|网球鞋,安踏Anta女鞋网球鞋 12223051-4 白色 36,安踏（ANTA）>安踏Anta女鞋网球鞋 12223051...,京东商城,西街运动专营店
1005009014,健康运动、户外|运动鞋|网球鞋,安踏Anta男鞋网球鞋 11223305-3 灰色 42,安踏（ANTA）>安踏Anta男鞋网球鞋 11223305...,京东商城,西街运动专营店
1005009014,健康运动、户外|运动鞋|网球鞋,Adidas阿迪达斯 TENNIS网球鞋 女鞋 V21737 蓝色 35,adidas阿迪达斯>Adidas阿迪达斯 TENNIS网球鞋...,京东商城,维士路运动户外旗舰店
1005009014,健康运动、户外|运动鞋|网球鞋,鸿星尔克ERKE男网球鞋11136045 黑色 39,鸿星尔克ERKE男网球鞋11136045...,京东商城,鸿星尔克旗舰店
1005009014,健康运动、户外|运动鞋|网球鞋,Anta/安踏 男款 网球鞋 11233055-1 红色 39,Anta/安踏 男款 网球鞋 11233...,京东商城,大树运动专营店
1005009014,健康运动、户外|运动鞋|网球鞋,鸿星尔克ERKE男生活网球鞋11112112030 白/蓝 39,鸿星尔克ERKE男生活网球鞋111121...,京东商城,鸿星尔克旗舰店
1005009014,健康运动、户外|运动鞋|网球鞋,阿迪达斯 男式 Switch Master鞋款暗纹鞋面网球鞋 V23504 黑色 39,阿迪达斯 男式 Switch Maste...,京东商城,好乐买运动旗舰店
1005009014,健康运动、户外|运动鞋|网球鞋,安踏 女式 网球文化系列靓丽纯色网球鞋 12223050-3 蓝色 35,安踏 女式 网球文化系列靓丽纯色网球鞋 ...,京东商城,好乐买运动旗舰店
1005009014,健康运动、户外|运动鞋|网球鞋,阿迪达斯 女式 网球文化系列网球鞋 V21724 白色 36,服饰鞋帽>运动>乒羽鞋>阿迪达斯（Adidas）>阿迪达斯 女式 网球文化系列网球鞋 V2...,京东商城,好乐买运动旗舰店
1005009014,健康运动、户外|运动鞋|网球鞋,阿迪达斯 男式 耐磨防滑大底网球鞋 V23241 蓝色 44.5,阿迪达斯（Adidas）>阿迪达斯 男式 耐磨防滑大底网球鞋 V2...,京东商城,好乐买运动旗舰店
1005009014,健康运动、户外|运动鞋|网球鞋,Nike 男式 复古网球鞋款运动文化鞋 417643-400 蓝色 40,Nike 男式 复古网球鞋款运动文化鞋 ...,京东商城,好乐买运动旗舰店
1005009014,健康运动、户外|运动鞋|网球鞋,阿迪达斯 女式 网球文化系列高弹缓震前掌经典网球鞋 G60528 白色 38,阿迪达斯 女式 网球文化系列高弹缓震前掌...,京东商城,好乐买运动旗舰店
1005009014,健康运动、户外|运动鞋|网球鞋,德尔惠 女式 网球系列网球鞋 33123231粉红 白色 36,德尔惠 女式 网球系列网球鞋 33123...,京东商城,好乐买运动旗舰店
1005009014,健康运动、户外|运动鞋|网球鞋,鸿星尔克 男式 利落潮款透气减压防滑系带生活网球鞋 11112212020-002 白色 39,鸿星尔克 男式 利落潮款透气减压防滑系带...,京东商城,好乐买运动旗舰店
1005009014,健康运动、户外|运动鞋|网球鞋,鸿星尔克 女式 悦活城市舒适透气网面系带网球鞋 12112212006-602 蓝色 38,鸿星尔克 女式 悦活城市舒适透气网面系带...,京东商城,好乐买运动旗舰店
1005009014,健康运动、户外|运动鞋|网球鞋,贵人鸟 女式 无限运动拼接耐磨舒适网球鞋 W23376-4 蓝色 36,贵人鸟 女式 无限运动拼接耐磨舒适网球鞋...,京东商城,好乐买运动旗舰店
1005009014,健康运动、户外|运动鞋|网球鞋,Nike 男式 AIR MAX系列网眼透气缓震防拖曳保护网球鞋 524647-107 白色 40,Nike 男式 AIR MAX系列网眼透...,京东商城,好乐买运动旗舰店
1005009014,健康运动、户外|运动鞋|网球鞋,Nike 男式 轻盈后跟包裹气垫速度型网球鞋 386233-001 NIKE AIR TOP SERVE 黑色 40.5,耐克（NIKE）>Nike 男式 轻盈后跟包裹气垫速度型网...,京东商城,联合尚品运动户外专营店
1005009014,健康运动、户外|运动鞋|网球鞋,阿迪达斯/Adidas 男士网球鞋 Barricade 6.0 G40440 黑色 43码,阿迪达斯（Adidas）>阿迪达斯/Adidas 男士网球鞋 Ba...,京东商城,良景运动专营店
1005009014,健康运动、户外|运动鞋|网球鞋,Nike 男式 时尚配色稳定大底网球鞋 488141-001 488141-102 CITY COURT 白色 40,Nike 男式 时尚配色稳定大底网球鞋 ...,京东商城,联合尚品运动户外专营店
1005009014,健康运动、户外|运动鞋|网球鞋,李宁 LINING 女鞋 女专业网球鞋 ATPF004-4 4.5,李宁（LI-NING）>李宁 LINING 女鞋 女专业网球鞋 ...,京东商城,李宁古星专卖店
1005009014,健康运动、户外|运动鞋|网球鞋,耐克NIKE女装网球鞋-408070-111 XJ 白色 36,耐克NIKE女装网球鞋-408070-1...,京东商城,五星运动
1005009014,健康运动、户外|运动鞋|网球鞋,Nike 男式 防拖曳保护轻质舒适缓震完美支持抓地力网球鞋 488140-105 40,Nike 男式 防拖曳保护轻质舒适缓震完...,京东商城,联合尚品运动户外专营店
1005009014,健康运动、户外|运动鞋|网球鞋,阿迪达斯Adidas 男鞋 男式网球鞋 V23504 黑色 43,adidas阿迪达斯>阿迪达斯Adidas 男鞋 男式网球鞋 ...,京东商城,联百运动专营店
1005009014,健康运动、户外|运动鞋|网球鞋,Nike耐克女子网球鞋运动鞋 487996-133 图片色 36,服饰鞋帽>运动>乒羽鞋>Nike耐克女子网球鞋运动鞋 48799...,京东商城,加百利运动专营店
1005009014,健康运动、户外|运动鞋|网球鞋,安踏 男式 悦动生活稳定绑带透气面舒适稳定网球鞋 11233321-1 白色 39,安踏 男式 悦动生活稳定绑带透气面舒适稳...,京东商城,好乐买运动旗舰店
1005009014,健康运动、户外|运动鞋|网球鞋,361° 男式 防扭伤科技鞋底透气网面活力配色内里稳定网球鞋 7235506白/深红 白色 41,361°>361° 男式 防扭伤科技鞋底透气网面活...,京东商城,好乐买运动旗舰店
1005009014,健康运动、户外|运动鞋|网球鞋,adidas阿迪达斯 男子 Ambition Str M RG 网球鞋G63133 XJ 白色 40,adidas阿迪达斯>adidas阿迪达斯 男子 Ambiti...,京东商城,五星运动
1005009014,健康运动、户外|运动鞋|网球鞋,纳达尔2012奥运会装备 耐克 Nike Air Max CourtBallistec 4.3 网球鞋 487986 106白色 41,纳达尔2012奥运会装备 耐克 Nike...,京东商城,网亿体育用品专营店
1005009014,健康运动、户外|运动鞋|网球鞋,阿迪达斯adidas2012新款男鞋网球鞋-V21130 白色 40.5,阿迪达斯（Adidas）>阿迪达斯adidas2012新款男鞋网球...,京东商城,西街运动专营店
1005009014,健康运动、户外|运动鞋|网球鞋,Adidas阿迪达斯男子网球鞋运动鞋 G60519 图片色 40,服饰鞋帽>运动>乒羽鞋>adidas阿迪达斯>Adidas阿迪达斯男子网球鞋运动鞋 G...,京东商城,加百利运动专营店
