1005009013,健康运动、户外|运动鞋|健身鞋,鸿星尔克erke超轻舒适透气女健身鞋W12113109011 青紫/蔷薇紫 37,服饰内衣>运动>训练鞋>鸿星尔克（ERKE）>鸿星尔克erke超轻舒适透气女健身鞋W1...,京东商城,跑跑运动专营店
1005009013,健康运动、户外|运动鞋|健身鞋,NEWBALANCE新百伦 女子户外健身鞋 WW733RA0-02E 棕色 37.5,新百伦（New Balance）>NEWBALANCE新百伦 女子户外健身...,京东商城,酷运动
1005009013,健康运动、户外|运动鞋|健身鞋,晋友经典重工网面透气摇摇鞋 坡跟单鞋 厚底女休闲鞋旅游鞋 健身鞋 减肥鞋运动女鞋子 2211桃红色 40,鞋靴>时尚女鞋>单鞋>佳燕飞速（J-Y-feisu）>晋友经典重工网面透气摇摇鞋 坡跟单鞋 厚...,京东商城,佳燕飞速
1005009013,健康运动、户外|运动鞋|健身鞋,FILA斐乐 多色 综合训练系列女时尚健身鞋221061108,斐乐（FILA）>FILA斐乐 多色 综合训练系列女时尚...,京东商城,FILA
1005009013,健康运动、户外|运动鞋|健身鞋,李宁 LINING 京东 平衡健身鞋 AFBG006-3 黑/热力粉 38,服饰内衣>运动>训练鞋>李宁 LINING 京东 平衡健身鞋 A...,京东商城,领动运动专营店
1005009013,健康运动、户外|运动鞋|健身鞋,李宁 LINING 京东 平衡健身鞋 AFBF028-3 深紫色 美码8欧码39,服饰内衣>运动>训练鞋>李宁 LINING 京东 平衡健身鞋 A...,京东商城,领动运动专营店
1005009013,健康运动、户外|运动鞋|健身鞋,威皓新款春夏秋冬款健身鞋 按摩鞋 增高鞋 新款摇摇鞋 瘦身鞋 摇摆鞋 女鞋5816 黑玫红 37,鞋靴>时尚女鞋>休闲鞋>威皓>威皓新款春夏秋冬款健身鞋 按摩鞋 增高鞋...,京东商城,威皓旗舰店
1005009013,健康运动、户外|运动鞋|健身鞋,威皓新款春夏秋冬款男士轻便健身鞋减肥增高鞋 耐磨系带跑步运动鞋 wh6805 灰红 40,鞋靴>流行男鞋>休闲鞋>威皓>威皓新款春夏秋冬款男士轻便健身鞋减肥增高...,京东商城,威皓旗舰店
1005009013,健康运动、户外|运动鞋|健身鞋,Zero意大利零度冬季高端摇摆鞋顶级牛皮健身鞋日常男鞋93055 浅棕 40,鞋靴>流行男鞋>商务休闲鞋>零度（ZERO）>Zero意大利零度冬季高端摇摆鞋顶级牛皮...,京东商城,Zero意大利零度旗舰店
1005009013,健康运动、户外|运动鞋|健身鞋,YOUSHEN 优绅综合训练鞋室内健身鞋 瘦身减肥透气广场舞鞋女款750 黑紫 37,鞋靴>时尚女鞋>单鞋>优绅>YOUSHEN 优绅综合训练鞋室内健身鞋...,京东商城,优绅女鞋
1005009013,健康运动、户外|运动鞋|健身鞋,支持货到付款 优绅秋冬新款真皮气垫增高鞋 软底健身鞋增高瘦身鞋气垫网面舞蹈鞋女款729 黑金 37,鞋靴>时尚女鞋>单鞋>优绅>支持货到付款 优绅秋冬新款真皮气垫增高鞋...,京东商城,优绅女鞋
1005009013,健康运动、户外|运动鞋|健身鞋,YOUSHEN 舞蹈鞋新款 跳舞鞋女鞋 系带跳舞鞋 舞鞋 高帮鞋女式 软底健身鞋 SW1105 黑灰 40,鞋靴>时尚女鞋>单鞋>优绅>YOUSHEN 舞蹈鞋新款 跳舞鞋女鞋 ...,京东商城,优绅女鞋
1005009013,健康运动、户外|运动鞋|健身鞋,GKT专柜正品1288 夏款增高厚底鞋健身鞋透气时尚厚底摇摇女鞋 浅蓝 38,鞋靴>时尚女鞋>单鞋>GKT>GKT专柜正品1288 夏款增高厚底鞋健...,京东商城,潮鞋库
1005009013,健康运动、户外|运动鞋|健身鞋,支持货到付款 雷博 独家首发透气舞蹈网面增高广场舞鞋女士跳舞健身鞋 软底休闲女鞋子 680 桔色 39,鞋靴>时尚女鞋>单鞋>雷博（LAYPOO）>支持货到付款 雷博 独家首发透气舞蹈网面...,京东商城,雷博
1005009013,健康运动、户外|运动鞋|健身鞋,北纬2013 厚气垫舞蹈鞋女鞋健身鞋广场网面跳舞鞋软底增高鞋SG09 黑粉 36,北纬2013 厚气垫舞蹈鞋女鞋健身鞋广场...,京东商城,秋之北纬运动旗舰店
1005009013,健康运动、户外|运动鞋|健身鞋,一品麒麟 2013夏新款风糖果色厚底松糕魔术贴带简约潮女凉鞋 坡跟负跟休闲摇摇健身鞋 D319 桔色 38,鞋靴>时尚女鞋>凉鞋>一品麒麟>一品麒麟 2013夏新款风糖果色厚底松...,京东商城,一品麒麟女鞋
1005009013,健康运动、户外|运动鞋|健身鞋,贝踏男子时尚休闲户外运动鞋 男 经典健身鞋跑步女鞋 情侣鞋 1307 宝蓝色 44,鞋靴>流行男鞋>休闲鞋>贝踏（BEITA）>贝踏男子时尚休闲户外运动鞋 男 经典健身...,京东商城,汇骏鞋类旗舰店
1005009013,健康运动、户外|运动鞋|健身鞋、拖鞋,Zero意大利零度夏季凉鞋透气男士摇摆鞋健身鞋沙滩鞋头层牛皮99613 卡其 39,鞋靴>流行男鞋>凉鞋/沙滩鞋>零度（ZERO）>Zero意大利零度夏季凉鞋透气男士摇摆鞋...,京东商城,Zero意大利零度旗舰店
1005009013,健康运动、户外|运动鞋|健身鞋,品舞 舞蹈鞋 广场舞现代舞鞋 女式增高健身鞋跳操鞋跳舞鞋 女网面瘦身鞋2703 黑灰色 40,鞋靴>时尚女鞋>休闲鞋>品舞>品舞 舞蹈鞋 广场舞现代舞鞋 女式增高健...,京东商城,恋上舞
1005009013,健康运动、户外|运动鞋|健身鞋,双星运动鞋 帆布鞋武术鞋健身鞋太极鞋M跑步鞋晨练鞋 休闲鞋男鞋A142 白红色 43,服饰内衣>运动>帆布鞋>双星（Double Star）>双星运动鞋 帆布鞋武术鞋健身鞋太极鞋M跑...,京东商城,远东运动专营店
1005009013,健康运动、户外|运动鞋|健身鞋,【361度】361°运动综合训练健身鞋女鞋 8234416 浅蓝/橙 38码,服饰内衣>运动>训练鞋>361°>【361度】361°运动综合训练健身鞋女...,京东商城,快易拍运动专营店
1005009013,健康运动、户外|运动鞋|健身鞋,Zero意大利零度 夏季凉鞋 透气男士摇摆鞋 健身鞋沙滩鞋 头层牛皮 99613 黑色 44,鞋靴>流行男鞋>凉鞋/沙滩鞋>Zero意大利零度 夏季凉鞋 透气男士摇...,京东商城,Zero意大利零度旗舰店
1005009013,健康运动、户外|运动鞋|健身鞋,Reebok 女 J22223 健身鞋 蓝色 35,服饰鞋帽>运动>训练鞋>Reebok 女 J22223 健身鞋 ...,京东商城,好乐买运动旗舰店
1005009013,健康运动、户外|运动鞋|健身鞋,李宁 女 AFBG014-2 网眼透气平衡健身鞋 白色,服饰内衣>运动>训练鞋>李宁（LI-NING）>李宁 女 AFBG014-2 网眼透气平...,京东商城,好乐买运动旗舰店
1005009013,健康运动、户外|运动鞋|健身鞋,鸿星尔克 女 12112309006-201 田园园创意松紧带轻便透气健身鞋 粉色 37,服饰鞋帽>运动>训练鞋>鸿星尔克 女 12112309006-2...,京东商城,好乐买运动旗舰店
1005009013,健康运动、户外|运动鞋|健身鞋,尤尼美 广场舞蹈鞋女 夏季新超轻透气软底舒适增高 健身鞋 跳舞鞋752 红色 38,鞋靴>时尚女鞋>休闲鞋>尤妮美>尤尼美 广场舞蹈鞋女 夏季新超轻透气软底...,京东商城,百汇鞋城
1005009013,健康运动、户外|运动鞋|健身鞋,恋上舞 夏季情侣新款 网面透气 运动鞋 男女跑步鞋 休闲鞋 户外鞋 健身鞋 103 桃红色 36,鞋靴>时尚女鞋>休闲鞋>恋上舞>恋上舞 夏季情侣新款 网面透气 运动鞋 ...,京东商城,恋上舞
1005009013,健康运动、户外|运动鞋|健身鞋,恋上舞 夏季情侣新款 网面透气 运动鞋 男女跑步鞋 休闲鞋 户外鞋 健身鞋 103 棕 42,鞋靴>时尚女鞋>休闲鞋>恋上舞>恋上舞 夏季情侣新款 网面透气 运动鞋 ...,京东商城,恋上舞
1005009013,健康运动、户外|运动鞋|健身鞋,FILA斐乐 多色 综合训练系列女时尚健身鞋221061108 白色 38,斐乐（FILA）>FILA斐乐 多色 综合训练系列女时尚...,京东商城,FILA官方旗舰店
1005009013,健康运动、户外|运动鞋|健身鞋,鸿星尔克 女式 溢彩菱形光谱透气网面耐磨舒适健身鞋 12112309005-201 粉色 39,鸿星尔克 女式 溢彩菱形光谱透气网面耐磨...,京东商城,好乐买运动旗舰店
1005009013,健康运动、户外|运动鞋|健身鞋,英伦韩速 高端厚气垫舞蹈鞋女鞋室内健身鞋广场网面跳舞鞋软底增高鞋 SG09 黑金 40鞋码偏小务必加大一码选择,鞋靴>时尚女鞋>休闲鞋>英伦韩速>英伦韩速 高端厚气垫舞蹈鞋女鞋室内健身鞋...,京东商城,英伦韩速旗舰店
1005009013,健康运动、户外|运动鞋|健身鞋,特步xtep运动鞋 健身鞋/网面跑步鞋 989318160002 灰绿 36,服饰鞋帽>运动>休闲鞋>特步xtep运动鞋 健身鞋/网面跑步鞋 ...,京东商城,特步xtep官方旗舰店
1005009013,健康运动、户外|运动鞋|健身鞋,英伦韩速2012新款气垫增高软底广场舞蹈鞋真皮网布透气健身鞋现代舞鞋 SG16 黑红 35此款偏小请加大一码选择,鞋靴>时尚女鞋>休闲鞋>英伦韩速>英伦韩速2012新款气垫增高软底广场舞蹈...,京东商城,英伦韩速旗舰店
1005009013,健康运动、户外|运动鞋|健身鞋,雷博真皮气垫增高鞋 软底健身鞋增高瘦身鞋气垫网面舞蹈鞋 鞋子 女728 黑红 37,鞋靴>时尚女鞋>单鞋>雷博（LAYPOO）>雷博真皮气垫增高鞋 软底健身鞋增高瘦身鞋...,京东商城,雷博
1005009013,健康运动、户外|运动鞋|健身鞋,威皓新款春夏秋冬款男士健身鞋 轻便耐磨跑步鞋时尚帅气运动鞋(约会首选) 1201 浅灰 39,鞋靴>流行男鞋>休闲鞋>威皓>威皓新款春夏秋冬款男士健身鞋 轻便耐磨跑...,京东商城,威皓旗舰店
1005009013,健康运动、户外|运动鞋|健身鞋,威皓新款春夏秋冬款男士健身鞋 轻便耐磨跑步鞋时尚帅气运动鞋(约会首选) 1202 褐色 45,鞋靴>流行男鞋>休闲鞋>威皓>威皓新款春夏秋冬款男士健身鞋 轻便耐磨跑...,京东商城,威皓旗舰店
1005009013,健康运动、户外|运动鞋|健身鞋,威皓新款春夏秋冬款男士健身鞋 轻便耐磨跑步鞋时尚帅气运动鞋(约会首选) 1202 黑色 43,鞋靴>流行男鞋>休闲鞋>威皓>威皓新款春夏秋冬款男士健身鞋 轻便耐磨跑...,京东商城,威皓旗舰店
1005009013,健康运动、户外|运动鞋|健身鞋,威皓新款春夏秋冬款男士健身鞋 轻便耐磨跑步鞋时尚帅气运动鞋(约会首选)1203 蓝色 42,鞋靴>流行男鞋>休闲鞋>威皓>威皓新款春夏秋冬款男士健身鞋 轻便耐磨跑...,京东商城,威皓旗舰店
1005009013,健康运动、户外|运动鞋|健身鞋,莫蕾蔻蕾韩版时尚减肥鞋摇摇鞋 厚底松糕休闲女鞋 增高鞋 健身鞋 保健鞋 运动鞋 跑鞋 咖啡色 36,鞋靴>时尚女鞋>休闲鞋>MOOLECOLE>莫蕾蔻蕾韩版时尚减肥鞋摇摇鞋 厚底松糕休...,京东商城,宏嘉男鞋专营店
1005009013,健康运动、户外|运动鞋|健身鞋,品舞 舞蹈鞋 广场舞现代舞鞋 女式增高健身鞋 跳操鞋跳舞鞋 女减肥瘦身128 黑紫 40,鞋靴>时尚女鞋>休闲鞋>恋上舞>品舞 舞蹈鞋 广场舞现代舞鞋 女式增高健...,京东商城,品舞
1005009013,健康运动、户外|运动鞋|健身鞋,恋上舞 夏季情侣新款 网面透气 运动鞋 男女跑步鞋 休闲鞋 户外鞋 健身鞋 11301 浅灰 43,鞋靴>时尚女鞋>休闲鞋>恋上舞>恋上舞 夏季情侣新款 网面透气 运动鞋 ...,京东商城,恋上舞
1005009013,健康运动、户外|运动鞋|健身鞋,正品李宁女鞋健身鞋舞蹈鞋 AFWG018-2 黑蓝色 38,李宁（LI-NING）>正品李宁女鞋健身鞋舞蹈鞋 AFWG018...,京东商城,万淘运动户外专营店
1005009013,健康运动、户外|运动鞋|健身鞋,李宁女鞋李宁运动鞋综训鞋女款平衡健身鞋 AFBG014-1/-2/-3 绿色 36,李宁（LI-NING）>李宁女鞋李宁运动鞋综训鞋女款平衡健身鞋 ...,京东商城,万淘运动户外专营店
1005009013,健康运动、户外|运动鞋|健身鞋,李宁女鞋健身鞋舞蹈鞋 AFWG016-1/-2/-3 冷灰/荧光黄/白 37.5,李宁（LI-NING）>李宁女鞋健身鞋舞蹈鞋 AFWG016-1...,京东商城,万淘运动户外专营店
1005009013,健康运动、户外|运动鞋|健身鞋,开学季  安踏训练鞋 男鞋正品透气运动休闲健身鞋11337766-1-2,运动户外 > 运动鞋 > 综训鞋 > 商品详情,当当网,安踏
1005009013,健康运动、户外|运动鞋|健身鞋,预售代购ZZ 李宁 LINING 健身系列 平衡室内健身鞋 AFBG006-3,运动户外 > 运动鞋 > 综训鞋,当当网,NULL1005003005
1005009013,健康运动、户外|运动鞋|健身鞋,步郎711夏季透气网布休闲运动凉鞋跳舞鞋现代舞鞋广场舞鞋舞蹈鞋增高鞋健身鞋 黑色 35码,服饰鞋帽>运动>休闲鞋>步郎711夏季透气网布休闲运动凉鞋跳舞鞋...,京东商城,步郎旗舰店
1005009013,健康运动、户外|运动鞋|健身鞋,凤舞立品/Fwlipi 新款时尚休闲鞋舞蹈 现代舞 广场舞健身鞋增高鞋 717 黑色 40,所有分类>服饰内衣、鞋靴童装>女鞋>单鞋/休闲鞋>凤舞立品/Fwlipi>凤舞立品/Fwlip...,1号店,凤舞立品/Fwlipi
1005009013,健康运动、户外|运动鞋|健身鞋,361° 2013年春季新款男鞋室内健身鞋透气男运动鞋 571314434,所有分类>运动户外>运动鞋>综合训练鞋>361°>361° 2013年...,1号店,361°
1005009013,健康运动、户外|运动鞋|健身鞋,Nike 耐克 综合训练鞋+室内健身鞋 女式 580374-601,鞋靴 > 女鞋 > 专业运动鞋 > 综合训练鞋,亚马逊(卓越网),Nike 耐克
1005009013,健康运动、户外|运动鞋|健身鞋,Nike 耐克 综合训练鞋+室内健身鞋 女式 555158-400,鞋靴 > 女鞋 > 专业运动鞋 > 综合训练鞋,亚马逊(卓越网),Nike 耐克
1005009013,健康运动、户外|运动鞋|健身鞋,Nike 耐克 综合训练鞋+室内健身鞋 女式 555159-007,鞋靴 > 女鞋 > 专业运动鞋 > 综合训练鞋,亚马逊(卓越网),Nike 耐克
1005009013,健康运动、户外|运动鞋|健身鞋,步郎935全头层皮休闲运动鞋潮流韩版鞋软底鞋跳舞鞋健身鞋舞蹈鞋女鞋 黑色 38码,服饰鞋帽>运动>休闲鞋>步郎935全头层皮休闲运动鞋潮流韩版鞋软...,京东商城,步郎旗舰店
1005009013,健康运动、户外|运动鞋|健身鞋,Kappa 女 K0165TN82-103 室内健身鞋 灰色 39,服饰鞋帽>运动>训练鞋>Kappa 女 K0165TN82-10...,京东商城,好乐买运动旗舰店
1005009013,健康运动、户外|运动鞋|健身鞋,迈舞正品广场舞鞋 女式秋冬舞蹈鞋 真皮 中跟 跳舞鞋爵士舞鞋健身鞋MW936（偏小一码） 棕色 38,运动健康>纤体瑜伽>舞蹈鞋服>迈舞>迈舞正品广场舞鞋 女式秋冬舞蹈鞋 真皮 ...,京东商城,迈舞旗舰店
1005009013,健康运动、户外|运动鞋|健身鞋,李宁女鞋健身鞋舞蹈鞋 AFWG036-1/-3/-5 粉色 36,服饰内衣>运动>训练鞋>李宁（LI-NING）>李宁女鞋健身鞋舞蹈鞋 AFWG036-1...,京东商城,万淘运动户外专营店
1005009013,健康运动、户外|运动鞋|健身鞋,迪奇琳秋冬新款舞蹈鞋广场舞女子透气增高跳舞鞋健身鞋989 黑红 35,鞋靴>时尚女鞋>休闲鞋>迪奇琳>迪奇琳秋冬新款舞蹈鞋广场舞女子透气增高跳...,京东商城,迪奇琳旗舰店
1005009013,健康运动、户外|运动鞋|健身鞋,米汇乐舞蹈鞋现代舞鞋女子透气增高鞋女鞋跳舞鞋健身鞋软底939 金黄 36,鞋靴>时尚女鞋>休闲鞋>米汇乐>米汇乐舞蹈鞋现代舞鞋女子透气增高鞋女鞋跳...,京东商城,米汇乐旗舰店
1005009013,健康运动、户外|运动鞋|健身鞋,耐克Nike13春季新品男式综合训练鞋+室内健身鞋-553683-001(如图 42),运动户外>训练鞋>耐克>耐克Nike13春季新品男式综合训练鞋+室内健身鞋-553683-001(如图 42),国美电器网上商城,宝库佳协运动专营店
1005009013,健康运动、户外|运动鞋|健身鞋,鸿星尔克女健身鞋12112109034-702浅紫35,首页>运动户外>运动鞋>休闲鞋/板鞋>鸿星尔克女健身鞋1211210903...,苏宁,鸿星尔克
1005009013,健康运动、户外|运动鞋|健身鞋,Adidas/阿迪达斯 男鞋 无痕大底训练鞋 运动鞋 健身鞋 Q22568,所有分类>运动户外>运动鞋>综合训练鞋>Adidas/阿迪达斯>Adidas/阿迪达斯 男鞋 无痕大底训练鞋 运动鞋 健身鞋 Q22568,1号店,Adidas/阿迪达斯
1005009013,健康运动、户外|运动鞋|健身鞋,361° 2013春季新款女款运动鞋休闲室内健身鞋 581314430,所有分类>运动户外>运动鞋>综合训练鞋>361°>361° 2013春...,1号店,361°
1005009013,健康运动、户外|运动鞋|健身鞋,领舞者夏季透气厚底运动鞋摇摇鞋女鞋健身鞋网面透气女鞋(灰色 38),运动户外>休闲鞋/板鞋>领舞者>领舞者夏季透气厚底运动鞋摇摇鞋女鞋健身鞋网面透气女鞋(灰色 38),国美电器网上商城,领舞者鞋服专营店
1005009013,健康运动、户外|运动鞋|健身鞋,领舞者夏季透气厚底运动鞋摇摇鞋女鞋健身鞋网面透气女鞋(紫色 36),运动户外>休闲鞋/板鞋>领舞者>领舞者夏季透气厚底运动鞋摇摇鞋女鞋健身鞋网面透气女鞋(紫色 36),国美电器网上商城,领舞者鞋服专营店
1005009013,健康运动、户外|运动鞋|健身鞋,BD现货 正品李宁女子运动室内分健身鞋 ACVE016-3(如图 39.5),运动户外>训练鞋>李宁>BD现货 正品李宁女子运动室内分健身鞋 ACVE016-3(如图 39.5),国美电器网上商城,宝库佳协运动专营店
1005009013,健康运动、户外|运动鞋|健身鞋,耐克Nike13春季新品男式综合训练鞋+室内健身鞋-553683-001(如图 41),运动户外>训练鞋>耐克>耐克Nike13春季新品男式综合训练鞋+室内健身鞋-553683-001(如图 41),国美电器网上商城,宝库佳协运动专营店
1005009013,健康运动、户外|运动鞋|健身鞋,耐克Nike女式综合训练鞋+室内健身鞋-537509-004(如图 36.5),运动户外>训练鞋>耐克>耐克Nike女式综合训练鞋+室内健身鞋-537509-004(如图 36.5),国美电器网上商城,宝库佳协运动专营店
1005009013,健康运动、户外|运动鞋|健身鞋,增高5CM 领舞者正品真皮软底健身鞋跳舞鞋现代广场舞舞蹈鞋女(黑灰 35),运动户外>跑步鞋>领舞者>增高5CM 领舞者正品真皮软底健身鞋跳舞鞋现代广场舞舞蹈鞋女(黑灰 35),国美电器网上商城,领舞者鞋服专营店
1005009013,健康运动、户外|运动鞋|健身鞋,增高5CM 领舞者正品真皮软底健身鞋跳舞鞋现代广场舞舞蹈鞋女(黑金 38),运动户外>跑步鞋>领舞者>增高5CM 领舞者正品真皮软底健身鞋跳舞鞋现代广场舞舞蹈鞋女(黑金 38),国美电器网上商城,领舞者鞋服专营店
1005009013,健康运动、户外|运动鞋|健身鞋,Li Ning 李宁 正品运动鞋 新款女鞋yna fit楦型+专业舞蹈大底+CUSHION减震科技+短靴设计健身鞋舞蹈鞋AFWF056-1,鞋靴 > 女鞋 > 专业运动鞋 > 乒乓球鞋 ,亚马逊(卓越网),Li Ning 李宁
1005009013,健康运动、户外|运动鞋|健身鞋,尤尼美广场舞蹈鞋女 夏季新超轻透气软底舒适增高 健身鞋 跳舞鞋真皮358,鞋 > 女鞋 > 单鞋 > 商品详情,当当网,尤尼美
1005009013,健康运动、户外|运动鞋|健身鞋,2013春夏款增高厚底鞋健身鞋透气时尚厚底摇(月色 39),运动户外>户外休闲鞋>尤萨>2013春夏款增高厚底鞋健身鞋透气时尚厚底摇(月色 39),国美电器网上商城,骆驼牌中广户外专营店
1005009013,健康运动、户外|运动鞋|健身鞋,鹏威 网布透气室内鞋运动鞋健身鞋 增高跑步鞋 女生摇摇鞋808,所有分类>运动户外>运动鞋>跑步鞋>鹏威>鹏威 网布透气室内鞋...,1号店,鹏威
1005009013,健康运动、户外|运动鞋|健身鞋,左丹狼 摇摇鞋 保健鞋健身鞋女鞋 透气网面休闲鞋 厚底单鞋 松糕鞋z-863,个护健康 > 足部护理 > 足部按摩 > 按摩鞋 鞋靴 > 男鞋 > 专业运动鞋 > 综合训练鞋,亚马逊(卓越网),左丹狼
1005009013,健康运动、户外|运动鞋|健身鞋,鸿星尔克erke正品休闲女鞋 时尚训练鞋室内健身鞋 12112409001 D2,运动户外 > 运动鞋 > 综训鞋 > 商品详情,当当网,鸿星尔克
1005009013,健康运动、户外|运动鞋|健身鞋,鸿星尔克erke正品男健身鞋运动鞋 防滑耐磨男综训鞋11114114217 红色 41码,首页>>>跑步鞋>鸿星尔克erke正品男健身鞋运动鞋...,苏宁,鸿星尔克
1005009013,健康运动、户外|运动鞋|健身鞋,2013春夏款增高厚底鞋健身鞋透气时尚厚底摇(玫红 39),运动户外>户外休闲鞋>尤萨>2013春夏款增高厚底鞋健身鞋透气时尚厚底摇(玫红 39),国美电器网上商城,骆驼牌中广户外专营店
1005009013,健康运动、户外|运动鞋|健身鞋,戈维路 韩版女式摇摇鞋 瘦腿健身鞋 增高减肥鞋(土黄 35),服饰鞋帽>功能鞋>戈维路>戈维路 韩版女式摇摇鞋 瘦腿健身鞋 增高减肥鞋(土黄 35),国美电器网上商城,戈维路旗舰店
1005009013,健康运动、户外|运动鞋|健身鞋,361度2013正品新款女鞋运动鞋休闲轻便室内健身鞋 581314430(蓝/黄 37),运动户外>训练鞋>361°>361度2013正品新款女鞋运动鞋休闲轻便室内健身鞋 581314430(蓝/黄 37),国美电器网上商城,361度官方旗舰店
1005009013,健康运动、户外|运动鞋|健身鞋,步郎 超炫系列秋摇摇鞋 瘦身减肥休闲鞋 健身鞋 时尚多功能鞋 女鞋8219,鞋靴 > 女鞋 > 休闲运动鞋 ,亚马逊(卓越网),
1005009013,健康运动、户外|运动鞋|健身鞋,北帝琦舞蹈鞋增高真皮透气广场舞蹈鞋女健身鞋跳舞鞋女8612 黑灰 40,鞋靴>时尚女鞋>休闲鞋>北帝琦>北帝琦舞蹈鞋增高真皮透气广场舞蹈鞋女健身...,京东商城,北帝琦旗舰店
1005009013,健康运动、户外|运动鞋|健身鞋,雅痞斗仕 2013新款女跳舞鞋 专业舞蹈鞋 增高广场舞鞋 健身鞋 运动鞋 A1105 黑+浅灰 38,鞋靴>时尚女鞋>休闲鞋>雅痞斗仕（yuppiedous)>雅痞斗仕 2013新款女跳舞鞋 专业舞蹈...,京东商城,雅痞斗仕旗舰店
1005009013,健康运动、户外|运动鞋|健身鞋,Warrior/回力 跑步鞋经典运动鞋男女鞋情侣鞋健身鞋牛筋底训练鞋蓝色,所有分类>运动户外>运动鞋>足球鞋>Warrior/回力>Warrior/回力...,1号店,Warrior/回力
1005009013,健康运动、户外|运动鞋|健身鞋,迈舞正品低帮绒布舞蹈鞋女鞋运动健身鞋跳舞鞋现代舞鞋广场舞鞋塑身鞋MW889尺码标准 黑色 37,运动健康>纤体瑜伽>舞蹈鞋服>迈舞>迈舞正品低帮绒布舞蹈鞋女鞋运动健身鞋跳舞...,京东商城,迈舞旗舰店
1005009013,健康运动、户外|运动鞋|健身鞋,夏季跳舞鞋女鞋气垫增高健身鞋健美操网面透气广场舞鞋舞蹈鞋 黑金 39,运动健康>户外鞋服>户外鞋袜>夏季跳舞鞋女鞋气垫增高健身鞋健美操网面透...,京东商城,骆驼牌户外专卖店
1005009013,健康运动、户外|运动鞋|健身鞋,新款舞蹈鞋网面高帮真皮增高鞋女式广场舞鞋跳舞鞋健身鞋 黑金色 36,鞋靴>时尚女鞋>休闲鞋>范斯力酷（FANSILIKU）>新款舞蹈鞋网面高帮真皮增高鞋女式广场舞鞋...,京东商城,范斯力酷旗舰店
1005009013,健康运动、户外|运动鞋|健身鞋,迈舞正品秋冬季新款现代舞蹈鞋跳舞鞋软底女式广场舞增高健身鞋网面透气MW717（偏小一码） 黑红 37,运动健康>纤体瑜伽>舞蹈鞋服>迈舞>迈舞正品秋冬季新款现代舞蹈鞋跳舞鞋软底女...,京东商城,迈舞旗舰店
1005009013,健康运动、户外|运动鞋|健身鞋,LINGWUZHE 领舞者 2014运动鞋女新款增高软底时尚亮片健身鞋 舒适韩版潮流旅游鞋瘦身美腿跑步鞋女鞋精致做工防撞休闲鞋3311 浅灰,首页> 鞋> 女鞋> 运动> 活力运动> 跑步鞋> LINGWUZHE 领舞者 2014运动鞋女新款增高软底时尚亮片健身鞋 舒适韩版潮流旅游鞋瘦身美腿跑,凡客诚品,LINGWUZHE 领舞者
1005009013,健康运动、户外|运动鞋|健身鞋,曲莎迪2014春夏广场舞蹈鞋透气爵士跳舞增高健身鞋子1008 黑色 35,鞋靴>时尚女鞋>休闲鞋>曲莎迪>曲莎迪2014春夏广场舞蹈鞋透气爵士跳舞...,京东商城,曲莎迪官方旗舰店
1005009013,健康运动、户外|运动鞋|健身鞋,Xiangguan 祥冠 韩版夏季超轻网面鞋 健身鞋 健步鞋 跑步鞋 运动鞋 舒适开车鞋 户外鞋休闲鞋 透气情侣鞋,鞋靴 > 女鞋 ,亚马逊(卓越网),
1005009013,健康运动、户外|运动鞋|健身鞋,新款舞蹈鞋网面高帮真皮增高鞋女式广场舞鞋跳舞鞋健身鞋 黑色 37,鞋靴>时尚女鞋>休闲鞋>范斯力酷（FANSILIKU）>新款舞蹈鞋网面高帮真皮增高鞋女式广场舞鞋...,京东商城,范斯力酷旗舰店
1005009013,健康运动、户外|运动鞋|健身鞋,2014年春季新款正品李宁女鞋运动鞋综合健身鞋训练鞋AFPJ004-2 冷灰/深桃红-2 35,服饰内衣>运动>训练鞋>李宁（LI-NING）>2014年春季新款正品李宁女鞋运动鞋综合...,京东商城,金刚体育
1005009013,健康运动、户外|运动鞋|健身鞋,新品鸿星尔克erke正品超轻运动鞋舒适轻便健身鞋 女款 Z1 正黑/碳灰 38,鸿星尔克（ERKE）>新品鸿星尔克erke正品超轻运动鞋舒适轻...,京东商城,运动鞋航之旅专营店
1005009013,健康运动、户外|运动鞋|健身鞋,步郎9227运动鞋休闲鞋多功能健身鞋跑步鞋慢跑鞋开车鞋阿甘鞋 兰月桔 35码,服饰鞋帽>运动>休闲鞋>步郎9227运动鞋休闲鞋多功能健身鞋跑步...,京东商城,步郎旗舰店
1005009013,健康运动、户外|运动鞋|健身鞋,361度2013冬季男鞋运动鞋轻便综训鞋都市健身鞋时尚 571344429 黑/深红 39,服饰内衣>运动>训练鞋>361度>361度2013冬季男鞋运动鞋轻便综训鞋...,京东商城,佳临运动专营店
