1005011024,健康运动、户外|户外服饰|雪地靴、滑雪鞋,欧利萨斯 时尚休闲男士反绒真皮加绒保暖雪地靴 13017,所有分类>服饰内衣、鞋靴童装>男鞋>休闲鞋>欧利萨斯>欧利萨斯 时尚休闲男...,1号店,欧利萨斯
1005011024,健康运动、户外|户外服饰|雪地靴、滑雪鞋,ROSONE 2013冬款 韩版真皮防水内增高休闲高帮女鞋羊糕毛保暖雪地靴魔术贴,所有分类>服饰内衣、鞋靴童装>女鞋>雪地靴>ROSONE>ROSONE 201...,1号店,ROSONE
1005011024,健康运动、户外|户外服饰|雪地靴、滑雪鞋,尚邦 冬季经典款款短筒防水保暖加绒女士休闲雪地靴 mh-5502,所有分类>服饰内衣、鞋靴童装>女鞋>雪地靴>尚邦>尚邦 冬季经典款款短...,1号店,尚邦
1005011024,健康运动、户外|户外服饰|雪地靴、滑雪鞋,GAVEL戈维路 2013冬季女士保暖摇摇鞋棉鞋雪地靴女鞋保暖鞋(土黄色 37),服饰鞋帽>雪地靴>戈维路>GAVEL戈维路 2013冬季女士保暖摇摇鞋棉鞋雪地靴女鞋保暖鞋(土黄色 37),国美电器网上商城,戈维路旗舰店
1005011024,健康运动、户外|户外服饰|雪地靴、滑雪鞋,Milanao 米兰奥冬季女式雪地靴真皮女雪地靴高筒5813侧面牛角扣 防滑牛筋底女靴 牛皮中筒女士保暖靴子灰色,鞋靴/类别/女鞋/靴子/雪地靴,亚马逊(卓越网),Milanao 米兰奥
1005011024,健康运动、户外|户外服饰|雪地靴、滑雪鞋,Warrior回力 冬季时尚流苏雪地靴 女式高档保暖雪地靴 舒适 柔软 潮 包邮 1006 棕色 40,鞋靴>时尚女鞋>雪地靴>回力（Warrior）>Warrior回力 冬季时尚流苏雪地靴 ...,京东商城,北京永诚宏宇
1005011024,健康运动、户外|户外服饰|雪地靴、滑雪鞋,福泰欣 老北京布鞋 冬款 女鞋 雪地靴D35-2602 黑色 37,福泰欣 老北京布鞋 冬款 女鞋 雪地靴D...,京东商城,福泰欣
1005011024,健康运动、户外|户外服饰|雪地靴、滑雪鞋,福泰欣 老北京布鞋 冬款 女鞋 雪地靴D35-2601 黑色 37,福泰欣 老北京布鞋 冬款 女鞋 雪地靴D...,京东商城,福泰欣
1005011024,健康运动、户外|户外服饰|雪地靴、滑雪鞋,739 坡跟高筒女靴 水钻女鞋 流苏雪地靴 羊毛鞋子2013新品 黑色 36,Adfenna芬娜>739 坡跟高筒女靴 水钻女鞋 流苏雪地...,京东商城,香柰莉
1005011024,健康运动、户外|户外服饰|雪地靴、滑雪鞋,Mallboll 2014年时尚潮流韩版牛皮精品新款牛皮亮片羊毛保暖雪地靴M5825-3 金色,首页> 鞋> 女鞋> 单鞋> 松糕鞋> Mallboll 2014年时尚潮流韩版牛皮精品新款牛皮亮片羊毛保暖雪地靴M5825-3,凡客诚品,Mallboll
1005011024,健康运动、户外|户外服饰|雪地靴、滑雪鞋,全民满减闪迪2012秋冬新款尖头褶皱毛线筒拼贴多穿法毛靴雪地靴ZP288-195-1 红色 36,全民满减闪迪2012秋冬新款尖头褶皱毛线...,京东商城,闪迪
1005011024,健康运动、户外|户外服饰|雪地靴、滑雪鞋,奥林百逸雅正宗澳羊毛皮毛一体户外雪地靴羊毛保暖鞋冬季棉鞋超保暖CNX405342咖啡 36,奥林百逸雅正宗澳羊毛皮毛一体户外雪地靴羊...,京东商城,奥林百逸雅
1005011024,健康运动、户外|户外服饰|雪地靴、滑雪鞋,POSCN 新品男童鞋儿童雪地靴男童包跟棉鞋儿童中帮雪 XM2707-0039,鞋靴 > 男童鞋 > 棉鞋、保暖鞋,亚马逊(卓越网),Looney tunes 乐一通
1005011024,健康运动、户外|户外服饰|雪地靴、滑雪鞋,四季兜 真皮男女童雪地靴男女童棉鞋靴 AB016 宝石蓝 25码内长16.3CM,四季兜（SkipToes）>四季兜 真皮男女童雪地靴男女童棉鞋靴 A...,京东商城,四季兜旗舰店
