1005009013,健康运动、户外|运动鞋|健身鞋,李宁LI-NING女式平衡健身鞋-AFBG006-3,当当网 > 运动户外 > 运动鞋 > 跑步鞋,当当网,李宁LI-NING
1005009013,健康运动、户外|运动鞋|健身鞋,LAYPOO 雷博综合训练鞋室内健身鞋 瘦身减肥透气广场舞鞋女款750 黑紫色 40,鞋靴>时尚女鞋>单鞋>雷博（LAYPOO）>LAYPOO 雷博综合训练鞋室内健身鞋 ...,京东商城,雷博
1005009013,健康运动、户外|运动鞋|健身鞋,瓦娜沙新款意大利品牌 综合训练运动健身鞋含增高气垫瘦身鞋网面舞蹈鞋F35 白+粉色 37,运动健康>纤体瑜伽>舞蹈鞋服>瓦娜莎>瓦娜沙新款意大利品牌 综合训练运动健身鞋...,京东商城,叮咚泉体育
1005009013,健康运动、户外|运动鞋|健身鞋,正品Denniya/丹妮娅/街舞鞋/现代舞鞋/健身鞋/舞蹈鞋8115,营养/保健/成人 > 健身瑜伽 > 瑜伽配件,当当网,丹妮娅
1005009013,健康运动、户外|运动鞋|健身鞋,李宁LI-NING女式平衡健身鞋-AFBG006-1,当当网 > 运动户外 > 运动鞋 > 跑步鞋,当当网,李宁LI-NING
1005009013,健康运动、户外|运动鞋|健身鞋,李宁健身系列鞋子 LINING 女式平衡健身鞋~AFBF006-3,当当网 > 运动户外 > 运动鞋 > 跑步鞋,当当网,李宁
1005009013,健康运动、户外|运动鞋|健身鞋,夏款舞鞋 透气软底舞蹈鞋 女增高鞋 跳舞鞋 韩版休闲 健身鞋真皮 减肥 秀腿 瘦身 偏小1码,当当网 > 鞋 > 女鞋 > 单鞋,当当网,韩版
1005009013,健康运动、户外|运动鞋|健身鞋,LAYPOO 增高运动鞋舞蹈学院气垫黑色网面laypoo舞蹈鞋/健身鞋/跳舞鞋 615 黑红 40,鞋靴>时尚女鞋>单鞋>雷博（LAYPOO）>LAYPOO 增高运动鞋舞蹈学院气垫黑色...,京东商城,雷博
1005009013,健康运动、户外|运动鞋|健身鞋,阿迪达斯Adidas 男子室内健身鞋V21806,所有分类 > 服饰内衣、鞋靴运动 > 男鞋 > 男式综合训练鞋 > Adidas/阿迪达斯,1号店,
1005009013,健康运动、户外|运动鞋|健身鞋,NIKE 耐克 TRAINING 男健身鞋 男子全能 434368,鞋靴 > 男鞋 > 专业运动鞋 > 综合训练鞋,亚马逊(卓越网),
1005009013,健康运动、户外|运动鞋|健身鞋,Li Ning 李宁 健身系列 女平衡健身鞋 AFBF022,鞋靴 > 女鞋 > 运动鞋\\户外鞋 > 健身\\训练鞋,亚马逊(卓越网),
1005009013,健康运动、户外|运动鞋|健身鞋,NIKE 耐克 TRAINING 女健身鞋 女子全能 441839,鞋靴 > 女鞋 > 专业运动鞋 > 综合训练鞋,亚马逊(卓越网),
1005009013,健康运动、户外|运动鞋|健身鞋,Nike 耐克 TRAINING 女健身鞋 324923,鞋靴 > 女鞋 > 专业运动鞋 > 综合训练鞋,亚马逊(卓越网),
1005009013,健康运动、户外|运动鞋|健身鞋,Nike 耐克 TRAINING 女健身鞋 324923,鞋靴 > 女鞋 > 专业运动鞋 > 综合训练鞋,亚马逊(卓越网),
1005009013,健康运动、户外|运动鞋|健身鞋,夏季 透气 网面 舞蹈鞋 女 气垫 增高 运动 跳舞 健身鞋厂家直销!品质保证!,当当网 > 鞋 > 女鞋 > 户外休闲鞋,当当网,Yizlo
1005009013,健康运动、户外|运动鞋|健身鞋,GKT专柜正品1288 夏款透气时尚厚底摇摇女鞋增高厚底鞋健身鞋,当当网 > 运动户外 > 运动鞋 > 健身鞋,当当网,GKT
1005009013,健康运动、户外|运动鞋|健身鞋,正品 李宁 运动鞋 女 健身鞋 女鞋 健身舞蹈鞋 AFWF056-1/-2/-3 黑/浅绿蓝/中国紫 5,服饰内衣>运动>训练鞋>李宁（LI-NING）>正品 李宁 运动鞋 女 健身鞋 女鞋 健...,京东商城,李宁 官方旗舰店
1005009013,健康运动、户外|运动鞋|健身鞋,雷博真皮气垫增高鞋 软底健身鞋增高瘦身鞋气垫网面舞蹈鞋 鞋子 女728 黑金 35,鞋靴>时尚女鞋>单鞋>雷博（LAYPOO）>雷博真皮气垫增高鞋 软底健身鞋增高瘦身鞋...,京东商城,雷博
1005009013,健康运动、户外|运动鞋|健身鞋,李宁儿童舞蹈健身鞋 2KTE411016 淡紫色 30,服饰鞋帽>童装>童鞋>李宁>李宁儿童舞蹈健身鞋 2KTE41101...,京东商城,派克兰帝&童壹库官方品牌集合店
1005009013,健康运动、户外|运动鞋|健身鞋,Nike 耐克 TRAINING 女健身鞋 366197,鞋靴 > 女鞋 > 专业运动鞋 > 综合训练鞋,亚马逊(卓越网),
1005009013,健康运动、户外|运动鞋|健身鞋,Nike 耐克 TRAINING 男健身鞋 431846,鞋靴 > 男鞋 > 专业运动鞋 > 综合训练鞋,亚马逊(卓越网),
1005009013,健康运动、户外|运动鞋|健身鞋,Nike 耐克 TRAINING 女健身鞋 324923,鞋靴 > 女鞋 > 专业运动鞋 > 综合训练鞋,亚马逊(卓越网),
1005009013,健康运动、户外|运动鞋|健身鞋,阿里公子 跳舞健身鞋 休闲时尚增高瘦身舞蹈网布女鞋 618 黑金 35,鞋靴>时尚女鞋>休闲鞋>阿里公子（ALI&BOY）>阿里公子 跳舞健身鞋 休闲时尚增高瘦身...,京东商城,源丰泰鞋业
1005009013,健康运动、户外|运动鞋|健身鞋,鸿星尔克 女式 清新田园园创意松紧带轻便舒适透气健身鞋 12112309006-201 粉色 37,鸿星尔克 女式 清新田园园创意松紧带轻便...,京东商城,好乐买运动旗舰店
1005009013,健康运动、户外|运动鞋|健身鞋,健汶 天然石头按摩鞋-鹅卵石拖鞋-足底按摩鞋-穴位按摩鞋-足疗鞋-保健鞋-健身鞋-居家日用拖鞋 40码/蓝/黑,个护健康 > 足部护理 > 足部按摩 > 按摩鞋,亚马逊(卓越网),健汶
1005009013,健康运动、户外|运动鞋|健身鞋,TieBao 新潮透气网面跑步鞋摇摆鞋 时尚流行风尚运动鞋 摇摇鞋健身鞋 休闲鞋女士户外鞋 轻便舒适旅游鞋女鞋,鞋靴 > 女鞋 > 休闲运动鞋,亚马逊(卓越网),Tiebao 铁豹
1005009013,健康运动、户外|运动鞋|健身鞋,特步XTEP 休闲运动健身鞋女鞋 988218160611 红白 35码,特步（XTEP）>特步XTEP 休闲运动健身鞋女鞋 988...,京东商城,快易拍运动专营店
1005009013,健康运动、户外|运动鞋|健身鞋,吉星宇 健身鞋 瘦身摇摇鞋 松糕鞋 厚底女鞋 透气减肥鞋运动增高气垫摇摆鞋 21203 胡绿 36,吉星宇 健身鞋 瘦身摇摇鞋 松糕鞋 厚底...,京东商城,吉星宇官方旗舰店
1005009013,健康运动、户外|运动鞋|健身鞋,李宁 白/银/浅灰 男 健身鞋 AFPE007-3,,拍鞋网,李宁
1005009013,健康运动、户外|运动鞋|健身鞋,李宁白/浅灰/酸橙绿男子健身鞋AFPD019-1,,拍鞋网,李宁
1005009013,健康运动、户外|运动鞋|健身鞋,威皓新款春夏秋冬款男士健身鞋 轻便耐磨跑步鞋时尚帅气运动鞋(约会首选) 1201 红色 39,鞋靴>流行男鞋>休闲鞋>威皓>威皓新款春夏秋冬款男士健身鞋 轻便耐磨跑...,京东商城,威皓旗舰店
1005009013,健康运动、户外|运动鞋|健身鞋,雅痞斗仕 2013新款女跳舞鞋 专业舞蹈鞋 增高广场舞鞋 健身鞋 运动鞋 A1105 黑+金色 35,鞋靴>时尚女鞋>休闲鞋>雅痞斗仕（yuppiedous)>雅痞斗仕 2013新款女跳舞鞋 专业舞蹈...,京东商城,雅痞斗仕旗舰店
1005009013,健康运动、户外|运动鞋|健身鞋,【秋冬特惠五折】WEIHAO 威皓 2012秋冬 潮人运动鞋 健身鞋 跑步鞋 减肥鞋 按摩鞋 男鞋SND-6806,鞋靴/类别/女鞋/专业运动鞋/跑步鞋,亚马逊(卓越网),威皓
1005009013,健康运动、户外|运动鞋|健身鞋,威皓 春季 真皮 减肥鞋 瘦身鞋 增高鞋 单层底女运动休闲摇摇鞋 帆船鞋 健身鞋,鞋靴 > 女鞋 > 专业户外鞋 > 徒步鞋 ,亚马逊(卓越网),威皓
1005009013,健康运动、户外|运动鞋|健身鞋,威皓 新款皮面 弯月型双层构造 健身鞋 运动鞋 增高鞋 帆船鞋 旅游鞋 休闲鞋 徒步鞋 摇摇鞋,鞋靴 > 男鞋 > 专业户外鞋 > 徒步鞋 ,亚马逊(卓越网),威皓新款春夏秋冬款男士健身鞋
1005009013,健康运动、户外|运动鞋|健身鞋,verycram 维蔻 蛇纹豹纹厚底摇摇鞋真皮松糕坡跟女凉鞋健身鞋,鞋靴 > 女鞋 > 专业运动鞋 > 健步鞋 ,亚马逊(卓越网),verycram 维蔻
1005009013,健康运动、户外|运动鞋|健身鞋,HAMBOO专业舞蹈鞋迎双十一季 增高跳舞鞋 女士软底现代广场舞 运动健身鞋女款 黑紫 35,鞋靴>时尚女鞋>休闲鞋>韩卟（Hamboo）>HAMBOO专业舞蹈鞋迎双十一季 增高跳...,京东商城,国韩鞋服
1005009013,健康运动、户外|运动鞋|健身鞋,2013春夏新款 舞蹈鞋软底女鞋 透气广场舞鞋 增高鞋现代舞健身鞋 跳舞鞋 716 黑+金 35,鞋靴>时尚女鞋>休闲鞋>雅痞斗仕（yuppiedous)>2013春夏新款 舞蹈鞋软底女鞋 透气广...,京东商城,雅痞斗仕旗舰店
1005009013,健康运动、户外|运动鞋|健身鞋,英伦韩速 高端厚气垫舞蹈鞋女鞋室内健身鞋广场网面跳舞鞋软底增高鞋 SG09 黑粉 35 黑粉 36鞋码偏小务必加大,鞋靴>时尚女鞋>休闲鞋>英伦韩速>英伦韩速 高端厚气垫舞蹈鞋女鞋室内健身鞋...,京东商城,英伦韩速旗舰店
1005009013,健康运动、户外|运动鞋|健身鞋,品舞 舞蹈鞋 广场舞现代舞鞋 女式增高健身鞋 跳操鞋跳舞鞋 女减肥瘦身128 黑紫 35,鞋靴>时尚女鞋>休闲鞋>恋上舞>品舞 舞蹈鞋 广场舞现代舞鞋 女式增高健...,京东商城,品舞
1005009013,健康运动、户外|运动鞋|健身鞋,雅痞斗仕 2014舞蹈鞋 网面高帮真皮增高鞋 女式广场舞鞋 透气跳舞鞋 健身鞋 737 黑+红 35,鞋靴>时尚女鞋>休闲鞋>雅痞斗仕（yuppiedous)>雅痞斗仕 2014舞蹈鞋 网面高帮真皮增...,京东商城,雅痞斗仕旗舰店
1005009013,健康运动、户外|运动鞋|健身鞋,品舞 软底增高爵士舞蹈鞋 真皮 健身鞋 跳舞鞋女A717 黑灰色 39,鞋靴>时尚女鞋>休闲鞋>恋上舞>品舞 软底增高爵士舞蹈鞋 真皮 健身鞋 ...,京东商城,品舞
1005009013,健康运动、户外|运动鞋|健身鞋,HAMBOO广场舞跳舞鞋 超轻透气舞蹈鞋女款 一脚蹬增高 软底 女人健身鞋瘦身减肥鞋 黑金 40,鞋靴>时尚女鞋>休闲鞋>隆鹰>HAMBOO广场舞跳舞鞋 超轻透气舞蹈鞋...,京东商城,国韩鞋服
1005009013,健康运动、户外|运动鞋|健身鞋,品舞 女式舞蹈鞋 夏季新款气垫增高健身鞋 广场跳舞鞋DW728 黑金色 36,鞋靴>时尚女鞋>休闲鞋>恋上舞>品舞 女式舞蹈鞋 夏季新款气垫增高健身鞋...,京东商城,恋上舞
1005009013,健康运动、户外|运动鞋|健身鞋、拖鞋,Zero意大利零度夏季新品凉鞋透气休闲男鞋男士摇摆健身鞋沙滩鞋99613 浅棕 38,鞋靴>流行男鞋>凉鞋/沙滩鞋>零度（ZERO）>Zero意大利零度夏季新品凉鞋透气休闲男...,京东商城,零度
1005009013,健康运动、户外|运动鞋|健身鞋,阿里公子 跳舞健身鞋 休闲时尚增高瘦身舞蹈女鞋 729 黑金 38,鞋靴>时尚女鞋>休闲鞋>阿里公子（ALI&BOY）>阿里公子 跳舞健身鞋 休闲时尚增高瘦身...,京东商城,源丰泰鞋业
1005009013,健康运动、户外|运动鞋|健身鞋,阿里公子 跳舞健身鞋 休闲时尚增高瘦身舞蹈女鞋 729 黑红 35,鞋靴>时尚女鞋>休闲鞋>阿里公子（ALI&BOY）>阿里公子 跳舞健身鞋 休闲时尚增高瘦身...,京东商城,源丰泰鞋业
1005009013,健康运动、户外|运动鞋|健身鞋,蕾舞 舞蹈鞋女 软底广场现代舞鞋健身鞋增高跳舞鞋休闲鞋128 黑紫 38,鞋靴>时尚女鞋>休闲鞋>蕾舞LEIWU>蕾舞 舞蹈鞋女 软底广场现代舞鞋健身鞋增...,京东商城,金时尚旗舰店
1005009013,健康运动、户外|运动鞋|健身鞋,Moolecole 莫蕾蔻蕾 时尚女鞋 健身鞋 摇摇鞋 美丽瘦身松糕鞋 高贵典雅 轻爽单鞋 女单鞋,鞋靴 > 女鞋 > 单鞋 > 松糕鞋 ,亚马逊(卓越网),Moolecole 莫蕾蔻蕾
1005009013,健康运动、户外|运动鞋|健身鞋,特戈 时尚趋势 引领潮流款 针织羊毛铆钉中筒靴 三色松糕雪地靴 摇摇健身鞋 保暖女靴 女鞋,鞋靴 > 女鞋 > 靴子 ,亚马逊(卓越网),特戈
1005009013,健康运动、户外|运动鞋|健身鞋,Li Ning 李宁 女 平衡健身鞋 AFBG012,鞋靴 > 女鞋 > 专业运动鞋 > 舞鞋,亚马逊(卓越网),Li Ning 李宁
1005009013,健康运动、户外|运动鞋|健身鞋,SHALOXI 莎诺西 包邮增高跳舞鞋 运动舞蹈鞋广场舞 现代舞鞋 健身鞋运动鞋女鞋 7295,鞋靴/类别/女鞋/专业运动鞋/舞鞋,亚马逊(卓越网),SHALOXI 莎诺西
1005009013,健康运动、户外|运动鞋|健身鞋,erke 鸿星尔克 男款综训鞋轻便透气室内健身鞋11112214008e,鞋靴 > 男鞋 > 专业运动鞋 > 篮球鞋 ,亚马逊(卓越网),ERKE 鸿星尔克
1005009013,健康运动、户外|运动鞋|健身鞋,LAYPOO 雷博舞蹈鞋女鞋真皮广场舞鞋 增高鞋软底 女跳舞鞋运动鞋健身鞋P760 黑桃红,首页 >鞋靴 >女鞋 >运动休闲 >LAYPOO 雷博舞蹈鞋女鞋真皮广场舞鞋 增高鞋软底 女跳舞鞋运动鞋健身鞋P760,vjia,laypoo官方旗舰店
1005009013,健康运动、户外|运动鞋|健身鞋,千帆叶春夏广场舞蹈鞋跳舞鞋女式增高健身鞋跳操鞋健美操鞋新款现代透气舞蹈鞋新款女鞋619 黑金 35,鞋靴>时尚女鞋>特色鞋>千帆叶>千帆叶春夏广场舞蹈鞋跳舞鞋女式增高健身鞋...,京东商城,千帆叶旗舰店
1005009013,健康运动、户外|运动鞋|健身鞋,Li Ning 李宁 健身系列 女健身鞋 AFGG002,鞋靴 > 女鞋 > 专业运动鞋 > 综合训练鞋,亚马逊(卓越网),Li Ning 李宁
1005009013,健康运动、户外|运动鞋|健身鞋,Li Ning 李宁 健身系列 女健身鞋 AFWG004,鞋靴 > 女鞋 > 专业运动鞋 > 综合训练鞋,亚马逊(卓越网),Li Ning 李宁
1005009013,健康运动、户外|运动鞋|健身鞋,英伦韩速舞蹈鞋 广场舞现代舞鞋 女式增高健身鞋 跳操鞋跳舞鞋女减肥瘦身1916 黑红 35 黑灰 37,鞋靴>时尚女鞋>休闲鞋>英伦韩速>英伦韩速舞蹈鞋 广场舞现代舞鞋 女式增高...,京东商城,英伦韩速旗舰店
1005009013,健康运动、户外|运动鞋|健身鞋,鸿星尔克女健身鞋12112109034-702浅紫37,首页>运动户外>运动鞋>休闲鞋/板鞋>鸿星尔克女健身鞋1211210903...,苏宁,鸿星尔克
1005009013,健康运动、户外|运动鞋|健身鞋,FILA斐乐 运动休闲鞋 女健身鞋 221061107 白色 39,FILA斐乐 运动休闲鞋 女健身鞋 22...,京东商城,FILA官方旗舰店
1005009013,健康运动、户外|运动鞋|健身鞋,尤尼美2013春夏新款 舞蹈鞋网面 增高鞋女式广场舞鞋跳舞鞋健身鞋991 桃红 35,鞋靴>时尚女鞋>休闲鞋>尤妮美>尤尼美2013春夏新款 舞蹈鞋网面 增高...,京东商城,百汇鞋城
1005009013,健康运动、户外|运动鞋|健身鞋,李宁 LINING 健身系列 女平衡健身鞋 AFBF062-1 5.5,李宁 LINING 健身系列 女平衡健身...,京东商城,李宁旗舰店
1005009013,健康运动、户外|运动鞋|健身鞋,ANTA 男鞋 安踏运动鞋 透气训练鞋综训健身鞋 11137739 黑 43,ANTA 男鞋 安踏运动鞋 透气训练鞋综...,京东商城,安踏官方旗舰店
1005009013,健康运动、户外|运动鞋|健身鞋,Zero意大利零度 高端 摇摆鞋 商务皮鞋 顶级头层皮 健身鞋 日常男鞋93089 浅棕 41,鞋靴>流行男鞋>商务休闲鞋>零度（ZERO）>Zero意大利零度 高端 摇摆鞋 商务皮...,京东商城,Zero意大利零度旗舰店
1005009013,健康运动、户外|运动鞋|健身鞋,英伦韩速 冬季新款纯牛皮增高广场舞蹈鞋 女 真皮现代舞鞋 健身鞋 黑金 38 8361舞蹈鞋黑金 40,鞋靴>时尚女鞋>休闲鞋>英伦韩速>英伦韩速 冬季新款纯牛皮增高广场舞蹈鞋 ...,京东商城,英伦韩速旗舰店
1005009013,健康运动、户外|运动鞋|健身鞋,金贝勒 2013夏季新款时尚透气皮厚底增高女鞋瘦身健身鞋摇摇鞋 1108 梅红 40,运动健康>户外鞋服>户外鞋袜>金贝勒（JINBEILE）>金贝勒 2013夏季新款时尚透气皮厚底增...,京东商城,亨宇运动户外专营店
1005009013,健康运动、户外|运动鞋|健身鞋,安踏 ANTA 男鞋 综训健身鞋 11217743 大红 42,服饰内衣>运动>训练鞋>安踏（ANTA）>安踏 ANTA 男鞋 综训健身鞋 112...,京东商城,安踏官方旗舰店
1005009013,健康运动、户外|运动鞋|健身鞋,FILA斐乐 运动休闲鞋女花边软底健身鞋 22225604-2 39,FILA斐乐 运动休闲鞋女花边软底健身鞋...,京东商城,FILA官方旗舰店
1005009013,健康运动、户外|运动鞋|健身鞋,李宁儿童舞蹈健身鞋 2KTE411016 淡紫色 37,服饰鞋帽>童装>童鞋>李宁>李宁儿童舞蹈健身鞋 2KTE41101...,京东商城,派克兰帝&童壹库官方品牌集合店
1005009013,健康运动、户外|运动鞋|健身鞋,李宁 女式 稳定减震鞋底专业舞蹈健身鞋 AFWG004-2 金色 35,李宁 女式 稳定减震鞋底专业舞蹈健身鞋 ...,京东商城,好乐买运动旗舰店
1005009013,健康运动、户外|运动鞋|健身鞋,正品 李宁 运动鞋 女 健身鞋 女鞋 健身舞蹈鞋 AFWF056-1/-2/-3 靛青/提琴紫 8,服饰内衣>运动>训练鞋>李宁（LI-NING）>正品 李宁 运动鞋 女 健身鞋 女鞋 健...,京东商城,李宁 官方旗舰店
1005009013,健康运动、户外|运动鞋|健身鞋,安踏ANTA男鞋综训健身鞋61211731 棕色 42,服饰内衣>运动>训练鞋>安踏（ANTA）>安踏ANTA男鞋综训健身鞋6121173...,京东商城,安踏官方旗舰店
1005009013,健康运动、户外|运动鞋|健身鞋,蕾舞 舞蹈鞋女 软底广场现代舞鞋健身鞋增高跳舞鞋休闲鞋128 蓝色 38,鞋靴>时尚女鞋>休闲鞋>蕾舞LEIWU>蕾舞 舞蹈鞋女 软底广场现代舞鞋健身鞋增...,京东商城,金时尚旗舰店
1005009013,健康运动、户外|运动鞋|健身鞋,鸿星尔克erke正品舒适透气女健身鞋 乐享生活12113109011 黑色 40,运动健康>户外鞋服>户外鞋袜>鸿星尔克erke正品舒适透气女健身鞋 乐...,京东商城,乐享生活户外旗舰店
1005009013,健康运动、户外|运动鞋|健身鞋,步郎8221正品跳舞鞋广场舞鞋舞蹈鞋休闲鞋运动休闲鞋多功能健身鞋女鞋,运动户外>运动鞋包>休闲鞋>步郎8221正品跳舞鞋广场舞鞋舞蹈鞋休闲...,京东商城,步郎旗舰店
1005009013,健康运动、户外|运动鞋|健身鞋,先驱者夏季女鞋女透气鞋女网面摇摇鞋女增高鞋健身鞋休闲鞋 阿北809 灰粉 35,鞋靴>时尚女鞋>休闲鞋>Avant-garde>先驱者夏季女鞋女透气鞋女网面摇摇鞋女增高...,京东商城,辉煌的店
1005009013,健康运动、户外|运动鞋|健身鞋,特价鸿星尔克ERKE女子健身鞋训练鞋G 果绿 39,服饰鞋帽>运动>休闲鞋>特价鸿星尔克ERKE女子健身鞋训练鞋G ...,京东商城,环球运动专营店
1005009013,健康运动、户外|运动鞋|健身鞋,阿迪达斯 Adidas新款男子综合训练鞋健身鞋G62588 白色G62588 42,服饰鞋帽>运动>训练鞋>adidas阿迪达斯>阿迪达斯 Adidas新款男子综合训练鞋...,京东商城,木木三运动专营店
1005009013,健康运动、户外|运动鞋|健身鞋,金贝勒 夏季新款网面透气摇摇鞋女 舒适软底增高鞋健身鞋女士运动鞋 1116 浅灰 39,鞋靴>时尚女鞋>休闲鞋>金贝勒（JINBEILE）>金贝勒 夏季新款网面透气摇摇鞋女 舒适软...,京东商城,金贝勒旗舰店
1005009013,健康运动、户外|运动鞋|健身鞋,雅痞斗仕 2014新款网面摇摇鞋增高松糕鞋透气网面女鞋减肥健身鞋休闲运动鞋 719 玫红+浅蓝 37,鞋靴>时尚女鞋>休闲鞋>雅痞斗仕（yuppiedous)>雅痞斗仕 2014新款网面摇摇鞋增高松糕...,京东商城,雅痞斗仕旗舰店
1005009013,健康运动、户外|运动鞋|健身鞋,2013春夏新款 舞蹈鞋软底女鞋 透气广场舞鞋 增高鞋现代舞健身鞋 跳舞鞋 716 黑+红 40,鞋靴>时尚女鞋>休闲鞋>雅痞斗仕（yuppiedous)>2013春夏新款 舞蹈鞋软底女鞋 透气广...,京东商城,雅痞斗仕旗舰店
1005009013,健康运动、户外|运动鞋|健身鞋,高秀紧身鞋GM-601A健身鞋 减肥 跑步 摇摇鞋,高秀>高秀紧身鞋GM-601A健身鞋 减肥 跑...,京东商城,塑可儿瘦身美体馆
1005009013,健康运动、户外|运动鞋|健身鞋,阿里公子 跳舞健身鞋 休闲时尚增高瘦身舞蹈网布女鞋 618 黑金 36,鞋靴>时尚女鞋>休闲鞋>阿里公子（ALI&BOY）>阿里公子 跳舞健身鞋 休闲时尚增高瘦身...,京东商城,源丰泰鞋业
1005009013,健康运动、户外|运动鞋|健身鞋,北纬2013 厚气垫舞蹈鞋女鞋健身鞋广场网面跳舞鞋软底增高鞋SG09 白红 36,北纬2013 厚气垫舞蹈鞋女鞋健身鞋广场...,京东商城,秋之北纬运动旗舰店
1005009013,健康运动、户外|运动鞋|健身鞋,李宁 LINING 京东 平衡健身鞋 AFCF010-1 白色 美码4.5欧码341/3,服饰内衣>运动>休闲鞋>李宁 LINING 京东 平衡健身鞋 A...,京东商城,领动运动专营店
1005009013,健康运动、户外|运动鞋|健身鞋,361度2013新款女运动鞋超轻网面女健身鞋 581314449 浅粉/深红 36,服饰鞋帽>运动>训练鞋>361度2013新款女运动鞋超轻网面女健...,京东商城,逸航运动专营店
1005009013,健康运动、户外|运动鞋|健身鞋,361度2013新款女运动鞋超轻网面女健身鞋 581314449 浅蓝/蓝 38,服饰鞋帽>运动>训练鞋>361度2013新款女运动鞋超轻网面女健...,京东商城,逸航运动专营店
1005009013,健康运动、户外|运动鞋|健身鞋,雅痞斗仕 2014舞蹈鞋 网面高帮真皮增高鞋 女式广场舞鞋 透气跳舞鞋 健身鞋 737 黑+红 37,鞋靴>时尚女鞋>休闲鞋>雅痞斗仕（yuppiedous)>雅痞斗仕 2014舞蹈鞋 网面高帮真皮增...,京东商城,雅痞斗仕旗舰店
1005009013,健康运动、户外|运动鞋|健身鞋,双星鞋特价鞋寿星鞋老年老人鞋秋冬季健身鞋晨练鞋休闲鞋轻便舒适男女鞋 黑色 45,服饰内衣>运动>休闲鞋>双星（Double Star）>双星鞋特价鞋寿星鞋老年老人鞋秋冬季健身鞋...,京东商城,远东运动专营店
1005009013,健康运动、户外|运动鞋|健身鞋,鸿星尔克 女式 舒适网布面便捷松紧口纯色健身鞋 12112209011-201 粉色 39,鸿星尔克 女式 舒适网布面便捷松紧口纯色...,京东商城,好乐买运动旗舰店
1005009013,健康运动、户外|运动鞋|健身鞋,鸿星尔克 女式 炫彩溢色透气网面耐磨大底系带舒适健身鞋 12112209002-203 红色 37,鸿星尔克 女式 炫彩溢色透气网面耐磨大底...,京东商城,好乐买运动旗舰店
1005009013,健康运动、户外|运动鞋|健身鞋,品舞 专业舞蹈鞋 女内增高鞋 厚底广场舞网面健身鞋跳舞鞋SW1105 黑红色 38,鞋靴>时尚女鞋>休闲鞋>恋上舞>品舞 专业舞蹈鞋 女内增高鞋 厚底广场舞...,京东商城,品舞
1005009013,健康运动、户外|运动鞋|健身鞋,特步XTEP 女子休闲运动健身鞋 989418110127 红黑 35码,特步（XTEP）>特步XTEP 女子休闲运动健身鞋 989...,京东商城,快易拍运动专营店
1005009013,健康运动、户外|运动鞋|健身鞋,【货到付款】特步XTEP 休闲运动健身鞋女鞋 988218160011 蓝白 35码,特步（XTEP）>【货到付款】特步XTEP 休闲运动健身鞋...,京东商城,快易拍运动专营店
1005009013,健康运动、户外|运动鞋|健身鞋,LAYPOO 雷博舞蹈鞋女鞋真皮广场舞鞋 增高鞋软底 女跳舞鞋运动鞋健身鞋P760 黑桃红,首页> 鞋> 女鞋> 休闲鞋> 日常休闲鞋> LAYPOO 雷博舞蹈鞋女鞋真皮广场舞鞋 增高鞋软底 女跳舞鞋运动鞋健身P760,凡客诚品,LAYPOO
1005009013,健康运动、户外|运动鞋|健身鞋,高秀紧身鞋GM-601A健身鞋 减肥跑步摇摇鞋 44,高秀紧身鞋GM-601A健身鞋 减肥跑步...,京东商城,实惠商场
1005009013,健康运动、户外|运动鞋|健身鞋,高秀紧身鞋GM-208B健身鞋 减肥跑步摇摇鞋 40,高秀>高秀紧身鞋GM-208B健身鞋 减肥跑步...,京东商城,实惠商场
1005009013,健康运动、户外|运动鞋|健身鞋,支持货到付款 优绅舞蹈鞋网面增高现代广场舞鞋女士跳舞鞋健身鞋软底休闲鞋 680 粉红色 36,鞋靴>时尚女鞋>单鞋>优绅>支持货到付款 优绅舞蹈鞋网面增高现代广场...,京东商城,优绅女鞋
1005009013,健康运动、户外|运动鞋|健身鞋,HAMBOO广场舞跳舞鞋 超轻透气舞蹈鞋女款 一脚蹬增高 软底 女人健身鞋瘦身减肥鞋 黑金 39,鞋靴>时尚女鞋>休闲鞋>隆鹰>HAMBOO广场舞跳舞鞋 超轻透气舞蹈鞋...,京东商城,国韩鞋服
1005009013,健康运动、户外|运动鞋|健身鞋,斐乐 FILA 女健身鞋 221061108 红色 36,斐乐 FILA 女健身鞋 2210611...,京东商城,Kappa官方旗舰店
1005009013,健康运动、户外|运动鞋|健身鞋,尤尼美 舞蹈鞋广场舞现代舞鞋女式增高健身鞋跳操鞋跳舞鞋女运动鞋8657 金色 37,鞋靴>时尚女鞋>休闲鞋>尤妮美>尤尼美 舞蹈鞋广场舞现代舞鞋女式增高健身...,京东商城,百汇鞋城
1005009013,健康运动、户外|运动鞋|健身鞋,HAMBOO专业舞蹈鞋迎双十一季 增高跳舞鞋 女士软底现代广场舞 运动健身鞋女款 黑紫 40,鞋靴>时尚女鞋>休闲鞋>韩卟（Hamboo）>HAMBOO专业舞蹈鞋迎双十一季 增高跳...,京东商城,国韩鞋服
1005009013,健康运动、户外|运动鞋|健身鞋,品舞 舞蹈鞋 广场舞现代舞鞋 女式增高健身鞋 跳操鞋跳舞鞋 女减肥瘦身979 黑红色 38,鞋靴>时尚女鞋>休闲鞋>品舞>品舞 舞蹈鞋 广场舞现代舞鞋 女式增高健...,京东商城,品舞
1005009013,健康运动、户外|运动鞋|健身鞋,支持货到付款优绅新款现代舞鞋 女 跳舞鞋 女式健身鞋软底增高广场舞蹈鞋女爵士舞鞋女 952 黑金 37,鞋靴>时尚女鞋>单鞋>优绅>支持货到付款优绅新款现代舞鞋 女 跳舞鞋...,京东商城,优绅女鞋
1005009013,健康运动、户外|运动鞋|健身鞋,时尚厚底摇摇鞋增高厚底鞋健身鞋透气女鞋 玫红 39,鞋靴>时尚女鞋>休闲鞋>时尚厚底摇摇鞋增高厚底鞋健身鞋透气女鞋 ...,京东商城,江南style
