1005011012,健康运动、户外|户外服饰|登山鞋,M360自然之旅 情侣款中邦登山徒步鞋 防滑耐磨 MM-2481 灰/紫色 39,运动健康>户外鞋服>户外鞋袜>M360>M360自然之旅 情侣款中邦登山徒步鞋 ...,京东商城,M360乐活户外生活馆
1005011012,健康运动、户外|户外服饰|登山鞋,五一特价 超低价抢购 侨丰QAOFG新品 优质反绒皮 耐磨防滑保暖防水 男士户外登山徒步鞋 21058 卡其 39,运动健康>户外鞋服>户外鞋袜>五一特价 超低价抢购 侨丰QAOFG新品...,京东商城,侨丰户外旗舰店
1005011012,健康运动、户外|户外服饰|登山鞋,QAOFG新品 优质反绒皮 耐磨防滑防水 加绒保暖 男士户外高帮登山徒步鞋241 军绿棉 40,运动健康>户外鞋服>户外鞋袜>QAOFG新品 优质反绒皮 耐磨防滑防水...,京东商城,侨丰户外旗舰店
1005011012,健康运动、户外|户外服饰|登山鞋,全民满减 花花公子新款运动休闲男士户外登山徒步保暖鞋11687041 黑色 43,全民满减 花花公子新款运动休闲男士户外登...,京东商城,PLAYBOY 花花公子
1005011012,健康运动、户外|户外服饰|登山鞋,新品上市 限时抢购 侨丰QAOFG秋冬新品 优质反绒皮 耐磨防滑保暖防水 男士户外登山徒步鞋 2188 军绿 45,运动健康>户外鞋服>户外鞋袜>新品上市 限时抢购 侨丰QAOFG秋冬新...,京东商城,侨丰-户外旗舰店
1005011012,健康运动、户外|户外服饰|登山鞋,kingcamp男款登山徒步鞋KF3723 深灰 42码,首页>运动户外>户外鞋服>徒步鞋>kingcamp男款登山徒步鞋KF3...,苏宁,
1005011012,健康运动、户外|户外服饰|登山鞋,骆途LUOTU 2012新款男鞋 透气舒适 真皮户外登山男鞋 LT-9X037 军绿 卡其 43码,运动健康>户外鞋服>户外鞋袜>骆途LUOTU 2012新款男鞋 透气舒...,京东商城,骆途
1005011012,健康运动、户外|户外服饰|登山鞋,Cantorp骆驼2012新款时尚休闲男款户外登山男鞋LT-D13056 烟灰 43,运动健康>户外鞋服>户外鞋袜>Cantorp骆驼2012新款时尚休闲男...,京东商城,cantorp骆驼专卖店
1005011012,健康运动、户外|户外服饰|登山鞋,冬装 Cantorp骆驼2012新款时尚休闲女款户外登山防水鞋LT-D23060 红色 36,运动健康>户外鞋服>户外鞋袜>冬装 Cantorp骆驼2012新款时尚...,京东商城,乐酷户外
1005011012,健康运动、户外|户外服饰|登山鞋,康尔KingCamp登山徒步鞋 高帮 防滑耐磨防水防撞减震KF3568 蓝色 45,运动健康>户外鞋服>户外鞋袜>KingCamp>康尔KingCamp登山徒步鞋 高帮 防...,京东商城,KingCamp旗舰店
1005011012,健康运动、户外|户外服饰|登山鞋,新品上市 限时抢购 2012年秋冬新品 优质反绒皮 耐磨防滑保暖防水 男士户外登山徒步鞋 21059 军绿 42,运动健康>户外鞋服>户外鞋袜>新品上市 限时抢购 2012年秋冬新品 ...,京东商城,侨丰-户外旗舰店
1005011012,健康运动、户外|户外服饰|登山鞋,瑞行（RAX）户外鞋 男防滑减震登山徒步鞋 Q-雪狼15-5C007 摩卡棕 39男款,运动健康>户外鞋服>户外鞋袜>RAX>瑞行（RAX）户外鞋 男防滑减震登山徒步...,京东商城,野狼户外专营店
1005011012,健康运动、户外|户外服饰|登山鞋,【2014新品推荐】Cantorp肯拓普时尚休闲户外休闲登山男鞋E13108 咖啡色 42,运动健康>户外鞋服>户外鞋袜>CAN TORP>【2014新品推荐】Cantorp肯拓普...,京东商城,CANTORP专营店
1005011012,健康运动、户外|户外服饰|登山鞋,2013新品耐伯德 头层牛皮经典百搭户外休闲登山徒步鞋男款9033 卡其 44,运动健康>户外鞋服>户外鞋袜>2013新品耐伯德 头层牛皮经典百搭户外...,京东商城,新西狼户外
1005011012,健康运动、户外|户外服饰|登山鞋,【品牌特卖】凯狄仕 cindiress 专业户外登山徒步男鞋 25108 卡其 41,运动健康>户外鞋服>户外鞋袜>【品牌特卖】凯狄仕 cindiress ...,京东商城,凯狄仕官方旗舰店
1005011012,健康运动、户外|户外服饰|登山鞋,骆驼（CAMEL）户外 秋冬新款 徒步鞋 反毛皮 男款 登山徒步鞋 82330608 军绿 40,运动健康>户外鞋服>户外鞋袜>骆驼（CAMEL）>骆驼（CAMEL）户外 秋冬新款 徒步...,京东商城,骆驼户外旗舰店LBP
1005011012,健康运动、户外|户外服饰|登山鞋,2012秋冬新款 美国骆驼CANTORP 牛皮户外登山徒步男鞋D17772 军绿 44,运动健康>户外鞋服>户外鞋袜>骆驼（Cantorp）>2012秋冬新款 美国骆驼CANTORP...,京东商城,辉腾运动户外专营店
1005011012,健康运动、户外|户外服饰|登山鞋,骆驼动感 camel active 男户外登山徒步鞋 155103305 棕色 43,运动健康>户外鞋服>户外鞋袜>其它>骆驼动感 camel active 男户...,京东商城,共道户外专营店
1005011012,健康运动、户外|户外服饰|登山鞋,HOTPOTATO/户外特工 6101多功能户外鞋溯溪徒步登山hp6101 桔灰 44,运动健康>户外鞋服>户外鞋袜>HOTPOTATO/户外特工 6101多...,京东商城,辉云户外专营店
1005011012,健康运动、户外|户外服饰|登山鞋,美国骆驼CANTORP 牛皮户外登山男鞋 C13029 卡其 43,运动健康>户外鞋服>户外鞋袜>骆驼（CAMEL）>美国骆驼CANTORP 牛皮户外登山男鞋...,京东商城,辉腾运动户外专营店
1005011012,健康运动、户外|户外服饰|登山鞋,五一特价 超低价抢购 侨丰QAOFG秋冬新品 优质反绒皮 耐磨防滑保暖防水 男士户外登山徒步鞋 230 深灰 39,运动健康>户外鞋服>户外鞋袜>五一特价 超低价抢购 侨丰QAOFG秋冬...,京东商城,侨丰户外旗舰店
1005011012,健康运动、户外|户外服饰|登山鞋,踏旺 2013秋冬新品户外登山防滑耐磨男鞋加绒款6381A 棕色 44,运动健康>户外鞋服>户外鞋袜>踏旺 2013秋冬新品户外登山防滑耐磨男...,京东商城,踏旺官方旗舰店
1005011012,健康运动、户外|户外服饰|登山鞋,M360自然之旅 情侣款中邦登山徒步鞋 防滑耐磨 MM-2481 梅红色 38,运动健康>户外鞋服>户外鞋袜>M360>M360自然之旅 情侣款中邦登山徒步鞋 ...,京东商城,M360乐活户外生活馆
1005011012,健康运动、户外|户外服饰|登山鞋,addnice/德意志山峰 男士休闲透气户外登山旅游鞋 XQ21003 浅棕/桔黄 39,运动健康>户外鞋服>户外鞋袜>addnice/德意志山峰 男士休闲透气...,京东商城,共道户外专营店
1005011012,健康运动、户外|户外服饰|登山鞋,美国波派旗下瑞蛙 新款春季休闲/运动/时尚/户外/防滑/登山/满帮/保暖男鞋子 KM00304-12/09 44,美国波派旗下瑞蛙 新款春季休闲/运动/时...,京东商城,波派
1005011012,健康运动、户外|户外服饰|登山鞋,年终热卖 花花公子/playboy2013新款休闲男士低帮鞋细带圆头户外登山徒步旅游鞋 0CX30048军绿 44,运动健康>户外鞋服>户外鞋袜>花花公子（PLAYBOY）>年终热卖 花花公子/playboy201...,京东商城,布依信户外专营店
1005011012,健康运动、户外|户外服饰|登山鞋,新品上市 限时抢购 侨丰QAOFG秋冬新品 优质反绒皮 耐磨防滑保暖防水 男士户外登山徒步鞋 232 棕色 43,运动健康>户外鞋服>户外鞋袜>新品上市 限时抢购 侨丰QAOFG秋冬新...,京东商城,侨丰-户外旗舰店
1005011012,健康运动、户外|户外服饰|登山鞋,美国骆驼CANTORP 牛皮户外高帮登山男鞋14001 军绿 41,运动健康>户外鞋服>户外鞋袜>骆驼（CAMEL）>美国骆驼CANTORP 牛皮户外高帮登山...,京东商城,辉腾运动户外专营店
1005011012,健康运动、户外|户外服饰|登山鞋,冬装 Cantorp骆驼2012新款时尚休闲女款户外登山防水鞋LT-D23060 军绿色 36,运动健康>户外鞋服>户外鞋袜>冬装 Cantorp骆驼2012新款时尚...,京东商城,乐酷户外
1005011012,健康运动、户外|户外服饰|登山鞋,kingcamp男款登山徒步鞋KF3723 卡其色 41码,首页>运动户外>户外鞋服>徒步鞋>kingcamp男款登山徒步鞋KF3...,苏宁,
1005011012,健康运动、户外|户外服饰|登山鞋,ANTA/安踏 男子休闲时尚登山户外鞋 深棕 39,服饰鞋帽>运动>跑步鞋>ANTA/安踏 男子休闲时尚登山户外鞋 ...,京东商城,凯旋运动专营店
1005011012,健康运动、户外|户外服饰|登山鞋,萨拉曼牛皮防水防滑耐磨减震防撞轻户外男鞋登山徒步情侣鞋11006 深灰 42,运动健康>户外鞋服>户外鞋袜>萨拉曼牛皮防水防滑耐磨减震防撞轻户外男鞋...,京东商城,萨拉曼户外旗舰店
1005011012,健康运动、户外|户外服饰|登山鞋,骆驼（CAMEL）户外 秋冬新款 徒步鞋 反毛皮 男款 登山徒步鞋 82330608 卡其 39,运动健康>户外鞋服>户外鞋袜>骆驼（CAMEL）>骆驼（CAMEL）户外 秋冬新款 徒步...,京东商城,骆驼户外旗舰店LBP
1005011012,健康运动、户外|户外服饰|登山鞋,英国HI-TEC进口牛皮专业防水男户外登山徒步鞋20-5B083 深麦色 44,运动健康>户外鞋服>户外鞋袜>英国HI-TEC进口牛皮专业防水男户外登...,京东商城,HI-TEC海泰客户外旗舰店
1005011012,健康运动、户外|户外服饰|登山鞋,生活无限 夏季热卖情侣款户外多功能翻毛牛皮登山徒步鞋 男女款 11247137 深卡其男98 40,运动健康>户外鞋服>户外鞋袜>生活无限（SmartLife）>生活无限 夏季热卖情侣款户外多功能翻毛牛...,京东商城,LU生活无限
1005011012,健康运动、户外|户外服饰|登山鞋,骆驼（CAMEL）男鞋 新款 腾海磨砂牛皮户外休闲登山男鞋 2330028 卡其 44,运动健康>户外鞋服>户外鞋袜>骆驼（CAMEL）男鞋 新款 腾海磨砂牛...,京东商城,骆驼户外旗舰店LBP
1005011012,健康运动、户外|户外服饰|登山鞋,AQUA TWO跨途2013秋冬新品首发 头层牛皮登山耐磨男鞋潮流透气休闲帆船鞋 巧克力色 39,运动健康>户外鞋服>户外鞋袜>跨途（AQUA TWO）>AQUA TWO跨途2013秋冬新品首发...,京东商城,炫凡运动专营店
1005011012,健康运动、户外|户外服饰|登山鞋,五一特价 超低价抢购侨丰QAOFG 秋冬新品 优质反绒皮 耐磨防滑保暖防水 男士户外登山徒步鞋 21049 棕色 44,运动健康>户外鞋服>户外鞋袜>五一特价 超低价抢购侨丰QAOFG 秋冬...,京东商城,侨丰户外旗舰店
1005011012,健康运动、户外|户外服饰|登山鞋,【M360】牛皮情侣款自然之旅中邦登山徒步鞋 防撞耐磨 MM-2480/MW-2485 灰/蓝色 40,运动健康>户外鞋服>户外鞋袜>【M360】牛皮情侣款自然之旅中邦登山徒...,京东商城,M360乐活户外生活馆
1005011012,健康运动、户外|户外服饰|登山鞋,五一特价 超低价抢购侨丰QAOFG秋冬新品 优质反绒皮 耐磨防滑保暖防水 男士户外登山徒步鞋 232 棕色 39,运动健康>户外鞋服>户外鞋袜>五一特价 超低价抢购侨丰QAOFG秋冬新...,京东商城,侨丰户外旗舰店
1005011012,健康运动、户外|户外服饰|登山鞋,生活无限 夏季热卖情侣款私模大底户外多功能登山徒步鞋 11247135 4色 咖啡色 40,运动健康>户外鞋服>户外鞋袜>生活无限（SmartLife）>生活无限 夏季热卖情侣款私模大底户外多功...,京东商城,LU生活无限
1005011012,健康运动、户外|户外服饰|登山鞋,瑞行（RAX）户外鞋 男防滑减震登山徒步鞋 Q-雪狼15-5C007 摩卡棕 42男款,运动健康>户外鞋服>户外鞋袜>RAX>瑞行（RAX）户外鞋 男防滑减震登山徒步...,京东商城,野狼户外专营店
1005011012,健康运动、户外|户外服饰|登山鞋,jeep男鞋户外休闲情侣鞋登山徒步休闲男鞋JL801/LL801 咖色/CO 43,运动健康>户外鞋服>户外鞋袜>jeep男鞋户外休闲情侣鞋登山徒步休闲男...,京东商城,志旗户外专营店
1005011012,健康运动、户外|户外服饰|登山鞋,五一特价 超低价抢购 侨丰QAOFG新品 优质反绒皮 耐磨防滑保暖防水 男士户外登山徒步鞋 2186 棕色 40,运动健康>户外鞋服>户外鞋袜>五一特价 超低价抢购 侨丰QAOFG新品...,京东商城,侨丰户外旗舰店
1005011012,健康运动、户外|户外服饰|登山鞋,英国HI-TEC/海泰客专业防水男款登山徒步鞋094-升级版 深灰色 45,运动健康>户外鞋服>户外鞋袜>英国HI-TEC/海泰客专业防水男款登山...,京东商城,HI-TEC海泰客户外旗舰店
1005011012,健康运动、户外|户外服饰|登山鞋,祥冠 秋冬热卖 真皮低帮 防滑防水耐磨 户外登山男鞋85216 黑色 44,运动健康>户外鞋服>户外鞋袜>祥冠 秋冬热卖 真皮低帮 防滑防水耐磨 ...,京东商城,骆尔户外专营店
1005011012,健康运动、户外|户外服饰|登山鞋,骆驼CANTORP户外牛皮登山徒步男鞋A13022 特大码45、46、47 军绿 45,运动健康>户外鞋服>户外鞋袜>骆驼（Cantorp）>骆驼CANTORP户外牛皮登山徒步男鞋A...,京东商城,辉腾运动户外专营店
1005011012,健康运动、户外|户外服饰|登山鞋,五一特价 超低价抢购 侨丰QAOFG新品 优质反绒皮 耐磨防滑保暖防水 男士户外登山徒步鞋 239 棕色 45,运动健康>户外鞋服>户外鞋袜>五一特价 超低价抢购 侨丰QAOFG新品...,京东商城,侨丰户外旗舰店
1005011012,健康运动、户外|户外服饰|登山鞋,MERRTO 迈途 顶级装备 动态防水 3M新雪丽保温棉 棉鞋 登山鞋M18035-M18046 男_卡其加棉,首页 >运动户外 >户外鞋服 >户外鞋 >MERRTO 迈途 顶级装备 动态防水 3M新雪丽保温棉 棉鞋 登山鞋M18035-M18046,vjia,MERRTO迈途旗舰店
1005011012,健康运动、户外|户外服饰|登山鞋,MERRTO迈途 科迪勒拉 情侣款 动态防水保暖 棉鞋 登山鞋M18035-M18046 男咖啡 39,运动健康>户外鞋服>户外鞋袜>MERRTO迈途 科迪勒拉 情侣款 动态...,京东商城,MERRTO迈途户外旗舰店
1005011012,健康运动、户外|户外服饰|登山鞋,J1201072兽康冬季男士休闲鞋男鞋反绒皮鞋板鞋英伦时尚流行韩版潮流棉鞋,运动户外休闲 > 登山、攀岩 > 登山鞋,亚马逊(卓越网),兽康
1005011012,健康运动、户外|户外服饰|登山鞋,左丹狼 男士保暖登山棉鞋 户外棉鞋 kz876 42 黑灰 [服饰] [服饰] [服饰],鞋靴/类别/女鞋/专业户外鞋/登山鞋,亚马逊(卓越网),左丹狼
1005011012,健康运动、户外|户外服饰|登山鞋,Y.General 杨家将 冬季时尚潮流 皮革保暖棉鞋 英伦短靴 登山靴 韩版雪地靴 登山鞋 男棉鞋2722,鞋靴 > 女鞋 > 专业户外鞋 > 登山鞋 ,亚马逊(卓越网),杨家将
1005011012,健康运动、户外|户外服饰|登山鞋,彼得潘童鞋 真皮男童棉鞋 大棉加毛保暖儿童雪地靴户外登山鞋 P085 灰色 31码/20cm,母婴>童装童鞋>靴子>彼得-潘>彼得潘童鞋 真皮男童棉鞋 大棉加毛保暖儿...,京东商城,彼得潘旗舰店
1005011012,健康运动、户外|户外服饰|登山鞋,2012秋冬新款 流行男鞋 高帮鞋 户外登山鞋 徒步鞋92677-2,当当网 > 运动户外 > 户外用品 > 户外运动鞋 > 户外登山鞋,当当网,edbo
1005011012,健康运动、户外|户外服饰|登山鞋,今日团购！ 美国花花公子户外高帮登山鞋 PM10212 军绿 41,运动健康>户外鞋服>户外鞋袜>今日团购！ 美国花花公子户外高帮登山鞋 ...,京东商城,花花公子&骆驼户外专营店
1005011012,健康运动、户外|户外服饰|登山鞋,Cantrop/骆驼牌 户外 女 登山鞋高帮鞋LT-C24012 紫色 36,运动健康>户外鞋服>户外鞋袜>骆驼（CAMEL）>Cantrop/骆驼牌 户外 女 登山鞋...,京东商城,花花公子&骆驼户外专营店
1005011012,健康运动、户外|户外服饰|登山鞋,addnice德意志山峰 登山鞋男户外登山鞋 AD205100棕/黑/红 棕/黑/红 42,运动健康>户外鞋服>户外鞋袜>其它>addnice德意志山峰 登山鞋男户外登...,京东商城,德意志山峰官方旗舰店
1005011012,健康运动、户外|户外服饰|登山鞋,骆驼（CAMEL）男女鞋 户外登山鞋情侣款徒步鞋 0650013男/1090521女 棕色 男42,运动健康>户外鞋服>户外鞋袜>骆驼（CAMEL）男女鞋 户外登山鞋情侣...,京东商城,骆驼户外旗舰店
1005011012,健康运动、户外|户外服饰|登山鞋,addnice德意志山峰 女户外登山鞋 ML206059 军绿 39,运动健康>户外鞋服>户外鞋袜>addnice德意志山峰 女户外登山鞋...,京东商城,德意志山峰官方旗舰店
1005011012,健康运动、户外|户外服饰|登山鞋,迈途 情侣户外徒步鞋 登山鞋 休闲鞋 M18055-M18056 黑色 38,运动健康>户外鞋服>户外鞋袜>迈途（MERRTO）>迈途 情侣户外徒步鞋 登山鞋 休闲鞋 M...,京东商城,迈途户外用品旗舰店
1005011012,健康运动、户外|户外服饰|登山鞋,Topland美国天坡伦户外运动登山鞋男鞋E1633特价 41,运动健康>户外鞋服>户外鞋袜>Topland美国天坡伦户外运动登山鞋男...,京东商城,topland旗舰店
1005011012,健康运动、户外|户外服饰|登山鞋,美国花花公子 户外 女 登山鞋 越野跑鞋 促销款PW20062 卡其 40,运动健康>户外鞋服>户外鞋袜>美国花花公子 户外 女 登山鞋 越野跑鞋...,京东商城,花花公子&骆驼户外专营店
1005011012,健康运动、户外|户外服饰|登山鞋,MERRTO迈途 头层牛皮 户外登山鞋 徒步鞋M18023-18039 女金黄 38,运动健康>户外鞋服>户外鞋袜>MERRTO迈途 头层牛皮 户外登山鞋 ...,京东商城,迈途户外用品旗舰店
1005011012,健康运动、户外|户外服饰|登山鞋,Cantrop/骆驼牌 户外登山鞋 男鞋 防水透气耐磨 LT-C14018 军绿 43,运动健康>户外鞋服>户外鞋袜>骆驼（CAMEL）>Cantrop/骆驼牌 户外登山鞋 男鞋...,京东商城,花花公子&骆驼户外专营店
1005011012,健康运动、户外|户外服饰|登山鞋,木林森户外 情侣户外鞋 网面登山鞋徒步鞋 男鞋女鞋8210003 绿色 39,运动健康>户外鞋服>户外鞋袜>木林森（MULINSEN）>木林森户外 情侣户外鞋 网面登山鞋徒步鞋...,京东商城,木林森户外旗舰店
1005011012,健康运动、户外|户外服饰|登山鞋,木林森户外 情侣户外鞋 网面登山鞋徒步鞋 男鞋女鞋8210003 黄棕 35,运动健康>户外鞋服>户外鞋袜>木林森（MULINSEN）>木林森户外 情侣户外鞋 网面登山鞋徒步鞋...,京东商城,木林森户外旗舰店
1005011012,健康运动、户外|户外服饰|登山鞋,美国豹牌 户外鞋 男式 登山鞋冬款休闲徒步鞋 户外鞋男鞋7031 卡其色 42,运动健康>户外鞋服>户外鞋袜>美国豹牌 户外鞋 男式 登山鞋冬款休闲徒...,京东商城,美国豹牌旗舰店
1005011012,健康运动、户外|户外服饰|登山鞋,生活无限 男款 防滑透气户外徒步 登山鞋 41042123 2色 暗黄 44,运动健康>户外鞋服>户外鞋袜>生活无限（SmartLife）>生活无限 男款 防滑透气户外徒步 登山鞋...,京东商城,生活无限
1005011012,健康运动、户外|户外服饰|登山鞋,木林森户外 情侣款式网面登山鞋徒步鞋 男鞋女鞋8210003 棕灰/浅紫 39,运动健康>户外鞋服>户外鞋袜>木林森户外 情侣款式网面登山鞋徒步鞋 男...,京东商城,木林森户外旗舰店
1005011012,健康运动、户外|户外服饰|登山鞋,MERRTO迈途 高帮情侣款 户外登山鞋M18035-M18046 女金黄 39,运动健康>户外鞋服>户外鞋袜>迈途（MERRTO）>MERRTO迈途 高帮情侣款 户外登山鞋...,京东商城,迈途户外用品旗舰店
1005011012,健康运动、户外|户外服饰|登山鞋,addnice德意志山峰 男户外登山鞋 ML205175 咖啡色 40,运动健康>户外鞋服>户外鞋袜>德意志山峰（ADDNICE）>addnice德意志山峰 男户外登山鞋...,京东商城,德意志山峰官方旗舰店
1005011012,健康运动、户外|户外服饰|登山鞋,迈途 情侣户外徒步鞋 登山鞋 休闲鞋 M18055-M18056 卡其 40,运动健康>户外鞋服>户外鞋袜>迈途（MERRTO）>迈途 情侣户外徒步鞋 登山鞋 休闲鞋 M...,京东商城,迈途户外用品旗舰店
1005011012,健康运动、户外|户外服饰|登山鞋,塞沃斯户外男女款透气徒步登山鞋0257 男女款军绿 39,运动健康>户外鞋服>户外鞋袜>塞沃斯户外男女款透气徒步登山鞋0257 ...,京东商城,犸凯奴官方旗舰店
1005011012,健康运动、户外|户外服饰|登山鞋,CAMEL/骆驼情侣款鞋子 户外登山鞋户外情侣鞋运动徒步男女鞋 2001196 棕色 男43,运动健康>户外鞋服>户外鞋袜>CAMEL/骆驼情侣款鞋子 户外登山鞋...,京东商城,骆驼户外旗舰店
1005011012,健康运动、户外|户外服饰|登山鞋,美国花花公子 户外 女 登山鞋 越野跑鞋 促销款PW20062 卡其 35,运动健康>户外鞋服>户外鞋袜>美国花花公子 户外 女 登山鞋 越野跑鞋...,京东商城,花花公子&骆驼户外专营店
1005011012,健康运动、户外|户外服饰|登山鞋,addnice德意志山峰登山鞋徒步攀岩越野防滑登山鞋男户外登山鞋AD205082三色 卡其/浅卡/黑/桔黄 41,运动健康>户外鞋服>户外鞋袜>addnice德意志山峰登山鞋徒步攀岩越...,京东商城,德意志山峰官方旗舰店
1005011012,健康运动、户外|户外服饰|登山鞋,木林森户外 情侣户外鞋 网面登山鞋徒步鞋 男鞋女鞋8210003 沙棕色 40,运动健康>户外鞋服>户外鞋袜>木林森（MULINSEN）>木林森户外 情侣户外鞋 网面登山鞋徒步鞋...,京东商城,木林森户外旗舰店
1005011012,健康运动、户外|户外服饰|登山鞋,美骆世家camssoo 秋冬户外低帮休闲男鞋 防水防滑徒步鞋 登山鞋 开拓者二代 灰/大黄 43,运动户外>户外鞋服>登山鞋>美骆世家（CAMSSOO）>美骆世家camssoo 秋冬户外低帮休闲...,京东商城,美骆世家官方旗舰店
1005011012,健康运动、户外|户外服饰|登山鞋,Cantrop/骆驼牌 户外登山鞋 女鞋 防水透气耐磨 LT-C23027 军绿 37,运动健康>户外鞋服>户外鞋袜>骆驼（CAMEL）>Cantrop/骆驼牌 户外登山鞋 女鞋...,京东商城,花花公子&骆驼户外专营店
1005011012,健康运动、户外|户外服饰|登山鞋,Cantrop/骆驼牌 户外登山鞋 LT-C13026 烟灰 39,运动健康>户外鞋服>户外鞋袜>Cantrop/骆驼牌 户外登山鞋 LT...,京东商城,花花公子&骆驼户外专营店
1005011012,健康运动、户外|户外服饰|登山鞋,骆驼队长 男子户外登山鞋 218001717_Z,首页 > 鞋 > 户外鞋 > 登山鞋 > 骆驼队长,酷运动,骆驼队长
1005011012,健康运动、户外|户外服饰|登山鞋,今日团购！美国花花公子 户外女登山鞋 越野跑鞋 专柜正品HC50001 卡其 40,运动健康>户外鞋服>户外鞋袜>今日团购！美国花花公子 户外女登山鞋 越...,京东商城,花花公子&骆驼户外专营店
1005011012,健康运动、户外|户外服饰|登山鞋,addnice德意志山峰女登山鞋徒步越野攀岩防滑鞋女户外登山鞋AD206024 黑/深灰/紫 39,运动健康>户外鞋服>户外鞋袜>德意志山峰（ADDNICE）>addnice德意志山峰女登山鞋徒步越野...,京东商城,德意志山峰官方旗舰店
1005011012,健康运动、户外|户外服饰|登山鞋,骆驼（CAMEL）户外登山鞋 运动徒步越野男鞋 男款登山鞋 2330021 军绿 43,运动健康>户外鞋服>户外鞋袜>骆驼（CAMEL）>骆驼（CAMEL）户外登山鞋 运动徒步越...,京东商城,骆驼户外旗舰店
1005011012,健康运动、户外|户外服饰|登山鞋,addnice德意志山峰男经典户外登山鞋 X1531019 军绿 44,运动健康>户外鞋服>户外鞋袜>德意志山峰（ADDNICE）>addnice德意志山峰男经典户外登山鞋...,京东商城,德意志山峰官方旗舰店
1005011012,健康运动、户外|户外服饰|登山鞋,MERRTO迈途 情侣款 户外登山鞋 徒步鞋M18028-M18038 女浅棕 35,运动健康>户外鞋服>户外鞋袜>MERRTO迈途 情侣款 户外登山鞋 徒...,京东商城,迈途户外用品旗舰店
1005011012,健康运动、户外|户外服饰|登山鞋,addnice德意志山峰 男子户外登山鞋 X1531008 军绿 40,运动健康>户外鞋服>户外鞋袜>addnice德意志山峰 男子户外登山鞋...,京东商城,德意志山峰官方旗舰店
1005011012,健康运动、户外|户外服饰|登山鞋,美国豹牌 户外登山鞋 高帮舒适户外马丁靴 男鞋 徒步鞋7053 棕色 40,运动健康>户外鞋服>户外鞋袜>美国豹牌 户外登山鞋 高帮舒适户外马丁靴...,京东商城,美国豹牌旗舰店
1005011012,健康运动、户外|户外服饰|登山鞋,美国豹牌 户外鞋 男式 登山鞋冬款休闲徒步鞋 户外鞋男鞋7031 军绿色 43,运动健康>户外鞋服>户外鞋袜>美国豹牌 户外鞋 男式 登山鞋冬款休闲徒...,京东商城,美国豹牌旗舰店
1005011012,健康运动、户外|户外服饰|登山鞋,迈途 情侣户外徒步鞋 登山鞋 休闲鞋 M18055-M18056 绿色 38,运动健康>户外鞋服>户外鞋袜>迈途（MERRTO）>迈途 情侣户外徒步鞋 登山鞋 休闲鞋 M...,京东商城,迈途户外用品旗舰店
1005011012,健康运动、户外|户外服饰|登山鞋,2011正品迈途运动户外男士徒步鞋登山鞋轻便透气流行休闲鞋M18021,当当网 > 运动户外 > 户外用品 > 户外运动鞋 > 户外登山鞋,当当网,迈途
1005011012,健康运动、户外|户外服饰|登山鞋,特价热销 头层磨砂皮意式手工户外登山鞋 防滑耐磨户外越野徒步鞋,当当网 > 运动户外 > 户外用品 > 户外运动鞋 > 户外登山鞋,当当网,优驮
1005011012,健康运动、户外|户外服饰|登山鞋,MERRTO迈途 高帮情侣款 户外登山鞋M18035-M18046 男咖啡加绒毛 40,运动健康>户外鞋服>户外鞋袜>迈途（MERRTO）>MERRTO迈途 高帮情侣款 户外登山鞋...,京东商城,迈途户外用品旗舰店
