1006001006,珠宝|时尚饰品|头饰、发饰,斯通亨奇水砖发夹 韩版新款头饰 靓丽饰品6809 金蓝色 个,服饰鞋帽>配饰>其他配件>斯通亨奇水砖发夹 韩版新款头饰 靓丽饰品...,京东商城,斯通亨奇女装旗舰店
1006001006,珠宝|时尚饰品|头饰、发饰,斯通亨奇韩版头饰发绳 韩国饰品12026804 红色 个,服饰鞋帽>配饰>其他配件>斯通亨奇韩版头饰发绳 韩国饰品12026...,京东商城,斯通亨奇女装旗舰店
1006001006,珠宝|时尚饰品|头饰、发饰,斯通亨奇新款发夹 韩版甜美高贵头饰 水砖饰品 6808 粉色 个,服饰鞋帽>配饰>其他配件>斯通亨奇新款发夹 韩版甜美高贵头饰 水砖...,京东商城,斯通亨奇女装旗舰店
1006001006,珠宝|时尚饰品|头饰、发饰,斯通亨奇新款发夹 韩版高贵实用头饰 靓丽饰品 6810 心形紫色 个,服饰鞋帽>配饰>其他配件>斯通亨奇新款发夹 韩版高贵实用头饰 靓丽...,京东商城,斯通亨奇女装旗舰店
1006001006,珠宝|时尚饰品|头饰、发饰,YIBOYO韩国进口 时尚饰品流行头饰 糖果色 彩色 可爱 蝴蝶结小花 儿童橡皮筋发圈 Y10390201005 红色-格子,珠宝首饰>时尚饰品>头饰>YIBOYO韩国进口 时尚饰品流行头饰 ...,京东商城,韩国YIBOYO饰品官方旗舰店
1006001006,珠宝|时尚饰品|头饰、发饰,YIBOYO韩国进口时尚饰品 流行头饰 糖果色 彩色 可爱 蝴蝶结小花侧夹 儿童发夹 边夹Y10390204004 粉色-条纹,珠宝首饰>时尚饰品>头饰>YIBOYO韩国进口时尚饰品 流行头饰 ...,京东商城,韩国YIBOYO饰品官方旗舰店
1006001006,珠宝|时尚饰品|头饰、发饰,tsful 结爱 正品盘发饰品韩国韩版头饰大水钻夹子顶夹发卡水晶,珠宝首饰>时尚饰品>头饰>其他>tsful 结爱 正品盘发饰品韩国韩版头...,京东商城,观浔
1006001006,珠宝|时尚饰品|头饰、发饰,典雅发饰 韩版发圈 水钻头绳头饰头花 花形头圈发卡韩版CY02875 粉红色,珠宝首饰>时尚饰品>头饰>典雅发饰 韩版发圈 水钻头绳头饰头花 花...,京东商城,典雅饰品
1006001006,珠宝|时尚饰品|头饰、发饰,典雅韩国奢华发饰品进口水钻头饰发圈发绳头花头绳盘发CY03002 紫色,珠宝首饰>时尚饰品>头饰>典雅韩国奢华发饰品进口水钻头饰发圈发绳头...,京东商城,典雅饰品
1006001006,珠宝|时尚饰品|头饰、发饰,tsful 醉心-法国板材琥珀色发夹 头饰 顶夹 边夹 一字夹 女生发夹饰品,珠宝首饰>时尚饰品>头饰>其它>tsful 醉心-法国板材琥珀色发夹 头...,京东商城,观浔
1006001006,珠宝|时尚饰品|头饰、发饰,韩国YIBOYO 宽发箍多彩规则波浪纹发箍 简单实用大方男女适用头饰 (A-014浅紫色),珠宝首饰 > 头饰 > 发箍\\发带,亚马逊(卓越网),YIBOYO
1006001006,珠宝|时尚饰品|头饰、发饰,special头饰发夹发卡头花女手工合成珍珠蝴蝶结发饰如诗如黛 马尾夹 M01A06FS,珠宝首饰>时尚饰品>头饰>special头饰发夹发卡头花女手工合成...,京东商城,SPECIAL
1006001006,珠宝|时尚饰品|头饰、发饰,Royal SaSa 皇家莎莎头饰韩版时尚热卖亚克力水钻发卡发夹发饰-炫亮魅力 紫色,首页 >配饰 >时尚饰品 >发饰 >Royal SaSa 皇家莎莎头饰韩版时尚热卖亚克力水钻发卡发夹发饰-炫亮魅力,vjia,RoyalSaSa旗舰店
1006001006,珠宝|时尚饰品|头饰、发饰,Royal SaSa 皇家莎莎头饰韩版时尚热卖合金水晶贝珠蝴蝶结发夹发饰-粉蝶珠梦 花色,首页 >配饰 >时尚饰品 >发饰 >Royal SaSa 皇家莎莎头饰韩版时尚热卖合金水晶贝珠蝴蝶结发夹发饰-粉蝶珠梦,vjia,RoyalSaSa旗舰店
1006001006,珠宝|时尚饰品|头饰、发饰,韩国YIBOYO 宽发箍多彩规则波浪纹发箍 简单实用大方男女适用头饰 (A-013橙色),珠宝首饰 > 头饰 > 发箍\\发带,亚马逊(卓越网),YIBOYO
1006001006,珠宝|时尚饰品|头饰、发饰,华庭丽娜 牵牛花 桃木发簪发钗 桃木雕刻饰品 古典盘发头饰发饰 催桃花 驱灾辟邪 送亲友礼物,珠宝首饰 > 头饰 > 发簪,亚马逊(卓越网),华庭丽娜
1006001006,珠宝|时尚饰品|头饰、发饰,华庭丽娜 枫叶 桃木发簪发钗 桃木雕刻饰品 古典盘发头饰发饰 催桃花 驱灾辟邪 送亲友礼物,珠宝首饰 > 头饰 > 发簪,亚马逊(卓越网),华庭丽娜
1006001006,珠宝|时尚饰品|头饰、发饰,华庭丽娜 松树 桃木发簪发钗 桃木雕刻饰品 古典盘发头饰发饰 催桃花 驱灾辟邪 送亲友礼物,珠宝首饰 > 头饰 > 发簪,亚马逊(卓越网),华庭丽娜
1006001006,珠宝|时尚饰品|头饰、发饰,典雅韩版头饰 蝴蝶结发饰 韩国流行发卡边夹 一字夹发夹BR02333 米色,珠宝首饰>时尚饰品>头饰>典雅韩版头饰 蝴蝶结发饰 韩国流行发卡边...,京东商城,典雅饰品
1006001006,珠宝|时尚饰品|头饰、发饰,special头饰女时尚蝴蝶结蕾丝布艺发夹发饰饰品天边一抹蓝M03A13FS 弹簧夹 M04A13FS,珠宝首饰>时尚饰品>头饰>special头饰女时尚蝴蝶结蕾丝布艺发...,京东商城,SPECIAL
1006001006,珠宝|时尚饰品|头饰、发饰,YIBOYO辣妈正传同款发箍 猫耳朵头箍 韩国进口 发饰正品 头饰发卡Y101501060 粉色钻款,珠宝首饰>时尚饰品>头饰>YIBOYO辣妈正传同款发箍 猫耳朵头箍...,京东商城,韩国YIBOYO饰品官方旗舰店
1006001006,珠宝|时尚饰品|头饰、发饰,She's茜子头饰 可爱小兔子波点醋酸板材儿童发箍发绳发夹三件套 DHG9709180 蓝色C0 均码,珠宝首饰>时尚饰品>头饰>She's茜子头饰 可爱小兔子波点醋酸板...,京东商城,She's
1006001006,珠宝|时尚饰品|头饰、发饰,华庭丽娜饰品 桃木发簪发钗 桃木雕刻饰品 古典盘发头饰发饰 催桃花 驱灾辟邪 送女友送妈妈礼物 圆头2,珠宝首饰>时尚饰品>头饰>华庭丽娜饰品 桃木发簪发钗 桃木雕刻饰品...,京东商城,响当当饰品
1006001006,珠宝|时尚饰品|头饰、发饰,新光饰品2013新款镂空蝴蝶结 奥登水钻 锆石 高贵典雅 礼物 金底白全钻 发夹发饰头饰,珠宝首饰>时尚饰品>头饰>新光饰品>新光饰品2013新款镂空蝴蝶结 奥登水钻...,京东商城,新光饰品
1006001006,珠宝|时尚饰品|头饰、发饰,She's girl茜子头饰 小碎花田园风少女发箍 头箍GHG9811319 A9 均码,珠宝首饰>时尚饰品>头饰>茜子（She's）>She's girl茜子头饰 小碎花田园...,京东商城,She's
1006001006,珠宝|时尚饰品|头饰、发饰,韩国版饰品 时尚水钻淑女发饰头饰发夹顶夹边夹6401 银色,珠宝首饰>时尚饰品>头饰>JUKO ACC>韩国版饰品 时尚水钻淑女发饰头饰发夹顶夹...,京东商城,Juko饰品
1006001006,珠宝|时尚饰品|头饰、发饰,皇家莎莎RoyalSaSa 韩版头饰 高端发卡时尚发饰品 亚克力水钻顶夹发夹 星光胖蝴蝶,珠宝首饰>时尚饰品>头饰>皇家 莎莎（Royal sasa）>皇家莎莎RoyalSaSa 韩版头饰 高...,京东商城,皇家莎莎RoyalSaSa
1006001006,珠宝|时尚饰品|头饰、发饰,羽儿发箍 发卡 头箍发圈新款水钻花色发箍满钻发卡发夹发饰 韩版时尚简约头饰YR4-0925 白AB色,珠宝首饰>时尚饰品>头饰>羽儿发箍 发卡 头箍发圈新款水钻花色发箍...,京东商城,羽儿饰品旗舰店
1006001006,珠宝|时尚饰品|头饰、发饰,She's茜子饰品 甜美浪漫花朵头饰发簪盘发插梳发夹SHZ9709190 C0 均码,珠宝首饰>时尚饰品>头饰>茜子（She's）>She's茜子饰品 甜美浪漫花朵头饰发簪...,京东商城,She's
1006001006,珠宝|时尚饰品|头饰、发饰,tsful 初见 纯美 山茶花发饰/盘发夹 顶夹 一字夹 韩国 正品头饰 浅黄色,珠宝首饰>时尚饰品>头饰>其它>tsful 初见 纯美 山茶花发饰/盘发...,京东商城,观浔
1006001006,珠宝|时尚饰品|头饰、发饰,JUKO秋冬新款韩国进口 优雅小清新珍珠蝴蝶结发圈 发绳头花头饰Q0282 香芋紫,珠宝首饰>时尚饰品>头饰>JUKO ACC>JUKO秋冬新款韩国进口 优雅小清新珍珠...,京东商城,Juko饰品
1006001006,珠宝|时尚饰品|头饰、发饰,羽儿发夹横夹 叶叶柔情 满钻水钻时尚横夹扭扭夹顶夹发夹 头饰饰品YR6-2361 香槟色+白AB,珠宝首饰>时尚饰品>头饰>羽儿发夹横夹 叶叶柔情 满钻水钻时尚横夹...,京东商城,羽儿饰品旗舰店
1006001006,珠宝|时尚饰品|头饰、发饰,羽儿发夹 弹簧夹 韩版 大水晶新款头饰马尾盘发弹簧夹发饰时尚女士饰品YR6-2248 气质紫,珠宝首饰>时尚饰品>头饰>羽儿发夹 弹簧夹 韩版 大水晶新款头饰马...,京东商城,羽儿饰品旗舰店
1006001006,珠宝|时尚饰品|头饰、发饰,SaSa 公主 头饰韩版时尚热卖 亚克力水钻发卡发夹发饰-珠芳点钻（橘色）,珠宝首饰 > 头饰 > 发夹,亚马逊(卓越网),SaSa 公主
1006001006,珠宝|时尚饰品|头饰、发饰,SaSa 公主 头饰韩版时尚热卖 亚克力水钻发卡发夹发饰-珠花镂瓣（橘色）,珠宝首饰 > 头饰 > 发夹,亚马逊(卓越网),SaSa 公主
1006001006,珠宝|时尚饰品|头饰、发饰,Angel's 儿童头饰四件套礼盒装 大小蝴蝶结-017,珠宝首饰 > 头饰 > 发箍\\发带,亚马逊(卓越网),Angel's
1006001006,珠宝|时尚饰品|头饰、发饰,Angel's 儿童头饰礼盒装可爱兔浅粉色-011,珠宝首饰 > 头饰 > 发箍\\发带,亚马逊(卓越网),Angel's
1006001006,珠宝|时尚饰品|头饰、发饰,PEKI佩琪挽纱系列头圈发圈 红色盘发头饰（专柜正品、赠送精美包装盒）,珠宝首饰 > 头饰 > 发夹,亚马逊(卓越网),PEKI 佩琪
1006001006,珠宝|时尚饰品|头饰、发饰,PEKI佩琪饰品发饰 咖啡潮款头圈发圈 头花盘发头饰品（专柜正品、赠送精美包装盒）,珠宝首饰 > 头饰 > 发夹,亚马逊(卓越网),PEKI 佩琪
1006001006,珠宝|时尚饰品|头饰、发饰,CHARM ANGEL 妩媚精灵 锆石花顶夹发夹发饰饰品头饰批发特价 (香槟色),珠宝首饰 > 头饰,亚马逊(卓越网),CHARM ANGEL 妩媚精灵
1006001006,珠宝|时尚饰品|头饰、发饰,WEINY 韦妮 【 立体蝴蝶结造型侧夹】【3色可选】 Maseiline法国进口手工打磨高档头饰 意大利树脂板材发饰 M0028（中号， 亮面丝绸黄色）小边夹 发卡,珠宝首饰 > 头饰 > 侧夹,亚马逊(卓越网),WEINY 韦妮
1006001006,珠宝|时尚饰品|头饰、发饰,兰廷饰佳 复古饰品 古典发夹头饰 民族风弹簧夹发饰盘发流苏发卡马尾夹 (七彩),珠宝首饰 > 头饰 > 发夹,亚马逊(卓越网),兰廷饰佳
1006001006,珠宝|时尚饰品|头饰、发饰,Royal SaSa 皇家莎莎韩版头饰流行前线明星款合金水晶发箍发卡发饰-墨香秀蝶 花色,首页 >配饰 >时尚饰品 >发饰 >Royal SaSa 皇家莎莎韩版头饰流行前线明星款合金水晶发箍发卡发饰-墨香秀蝶,vjia,RoyalSaSa旗舰店
1006001006,珠宝|时尚饰品|头饰、发饰,兰廷饰佳 蝴蝶发夹七彩水钻边夹 宫廷复古步摇弹簧夹古装头饰顶夹一字夹 (琥珀),珠宝首饰 > 头饰 > 侧夹 ,亚马逊(卓越网),兰廷饰佳
1006001006,珠宝|时尚饰品|头饰、发饰,兰廷饰佳 复古发饰民族风古典头饰品弹簧夹水钻蝴蝶结发夹 横夹马尾夹 (烟熏),珠宝首饰 > 头饰 > 侧夹 ,亚马逊(卓越网),兰廷饰佳
1006001006,珠宝|时尚饰品|头饰、发饰,韩版镂空个性满钻头饰 抓链水钻发箍发卡发夹头箍头饰品 时尚潮流 气质灰,珠宝首饰>时尚饰品>头饰>韩版镂空个性满钻头饰 抓链水钻发箍发卡发...,京东商城,羽儿饰品旗舰店
1006001006,珠宝|时尚饰品|头饰、发饰,羽儿 韩国靓丽发饰头饰饰品 精美发夹发抓大抓夹头抓 盘发发饰 亮深紫+浅粉色+白AB,珠宝首饰>时尚饰品>头饰>羽儿 韩国靓丽发饰头饰饰品 精美发夹发抓...,京东商城,羽儿饰品旗舰店1006001007
