1006001006,珠宝|时尚饰品|头饰、发饰,Angel's 儿童头饰四件套礼盒装 小熊-030,珠宝首饰 > 头饰 > 发箍\\发带,亚马逊(卓越网),Angel's
1006001006,珠宝|时尚饰品|头饰、发饰,韩国YIBOYO饰品 韩国进口 实用弹力皮筋/发圈/头绳/头饰 (黑色),珠宝首饰 > 头饰 > 发圈,亚马逊(卓越网),YIBOYO
1006001006,珠宝|时尚饰品|头饰、发饰,典雅 韩版流行饰品 海星水钻 发卡 刘海夹 头饰 一只 br02263 富贵紫,珠宝首饰>时尚饰品>头饰>典雅 韩版流行饰品 海星水钻 发卡 刘海...,京东商城,典雅饰品
1006001006,珠宝|时尚饰品|头饰、发饰,雅秀 韩版宽边发箍 布艺头箍 百搭韩版发饰头饰蕾丝发箍BTG012 卡其色,珠宝首饰>时尚饰品>头饰>雅秀 韩版宽边发箍 布艺头箍 百搭韩版发...,京东商城,雅秀饰品
1006001006,珠宝|时尚饰品|头饰、发饰,YIBOYO韩国进口流行发饰品 日韩别致双条层次发箍 时尚个性女士头箍发卡头饰 N30600106005A 粉色,珠宝首饰>时尚饰品>头饰>YIBOYO韩国进口流行发饰品 日韩别致...,京东商城,韩国YIBOYO饰品官方旗舰店
1006001006,珠宝|时尚饰品|头饰、发饰,典雅发饰水钻韩版头饰发夹刘海夹子顶夹一字夹边夹发卡子 一只 BR02180 粉红色,珠宝首饰>时尚饰品>头饰>典雅发饰水钻韩版头饰发夹刘海夹子顶夹一字...,京东商城,典雅饰品
1006001006,珠宝|时尚饰品|头饰、发饰,YIBOYO 韩国进口流行发饰品 超韧性宽发箍头饰 时尚头箍 N20180106013A 蓝色,珠宝首饰>时尚饰品>头饰>YIBOYO 韩国进口流行发饰品 超韧...,京东商城,韩国YIBOYO饰品官方旗舰店
1006001006,珠宝|时尚饰品|头饰、发饰,典雅 发饰水钻韩版头饰发夹刘海夹子顶夹一字夹边夹发卡子 一只 BR02237 浅蓝,珠宝首饰>时尚饰品>头饰>典雅 发饰水钻韩版头饰发夹刘海夹子顶夹一...,京东商城,典雅饰品
1006001006,珠宝|时尚饰品|头饰、发饰,典雅韩国发饰 水钻香蕉夹 竖夹 竖卡 正品头饰发卡 cu00734 粉红色,珠宝首饰>时尚饰品>头饰>典雅韩国发饰 水钻香蕉夹 竖夹 竖卡 正...,京东商城,典雅饰品
1006001006,珠宝|时尚饰品|头饰、发饰,典雅韩国发饰 水钻香蕉夹 竖夹 竖卡 正品头饰发卡 cu00736 紫色,珠宝首饰>时尚饰品>头饰>典雅韩国发饰 水钻香蕉夹 竖夹 竖卡 正...,京东商城,典雅饰品
1006001006,珠宝|时尚饰品|头饰、发饰,典雅 发梳插梳发卡 水钻鸭嘴夹盘发 发夹 发饰 头饰 CS00713 粉红色,珠宝首饰>时尚饰品>头饰>典雅 发梳插梳发卡 水钻鸭嘴夹盘发 发夹...,京东商城,典雅饰品
1006001006,珠宝|时尚饰品|头饰、发饰,京东中秋狂欢节 卡乔 发饰 头饰 元宝蝶插梳 发梳流行发卡 礼物 酒红,珠宝首饰>时尚饰品>头饰>卡乔>京东中秋狂欢节 卡乔 发饰 头饰 元宝蝶...,京东商城,卡乔旗舰店
1006001006,珠宝|时尚饰品|头饰、发饰,典雅韩国发饰 水钻香蕉夹 竖夹 竖卡 正品头饰发卡 cu00734 株红色,珠宝首饰>时尚饰品>头饰>典雅韩国发饰 水钻香蕉夹 竖夹 竖卡 正...,京东商城,典雅饰品
1006001006,珠宝|时尚饰品|头饰、发饰,韩国YIBOYO饰品 彩钻镶嵌高档法国树脂板材 蝴蝶结抓夹头饰-蝶语璀璨 粉色,珠宝首饰>时尚饰品>头饰>韩国YIBOYO饰品 彩钻镶嵌高档法国树...,京东商城,韩国YIBOYO饰品官方旗舰店
1006001006,珠宝|时尚饰品|头饰、发饰,韩国YIBOYO饰品 高档法国树脂板材 镂空满钻蝴蝶抓夹头饰 粉色,珠宝首饰>时尚饰品>头饰>韩国YIBOYO饰品 高档法国树脂板材 ...,京东商城,韩国YIBOYO饰品官方旗舰店
1006001006,珠宝|时尚饰品|头饰、发饰,韩国YIBOYO饰品 高档法国树脂板材 双层蝴蝶结满钻发夹头饰 粉色,珠宝首饰>时尚饰品>头饰>韩国YIBOYO饰品 高档法国树脂板材 ...,京东商城,韩国YIBOYO饰品官方旗舰店
1006001006,珠宝|时尚饰品|头饰、发饰,典雅 韩国奢华发饰品 韩版进口水钻头饰发圈发绳头花头绳盘发CY02617 咖啡色,珠宝首饰>时尚饰品>头饰>典雅 韩国奢华发饰品 韩版进口水钻头饰...,京东商城,典雅饰品
1006001006,珠宝|时尚饰品|头饰、发饰,韩国YIBOYO饰品 高档法国树脂板材 时尚双层蝴蝶结发夹头饰 粉色,珠宝首饰>时尚饰品>头饰>韩国YIBOYO饰品 高档法国树脂板材 ...,京东商城,韩国YIBOYO饰品官方旗舰店
1006001006,珠宝|时尚饰品|头饰、发饰,卡乔正品发饰 头饰 飞渡横 个性时尚发卡 高档礼物 紫罗兰,珠宝首饰>时尚饰品>头饰>卡乔>卡乔正品发饰 头饰 飞渡横 个性时尚发卡...,京东商城,卡乔旗舰店
1006001006,珠宝|时尚饰品|头饰、发饰,典雅发饰头饰 流行横夹弹簧夹顶夹 水钻发卡韩式盘发夹韩版 大号 CH03859 紫色,珠宝首饰>时尚饰品>头饰>典雅发饰头饰 流行横夹弹簧夹顶夹 水钻发...,京东商城,典雅饰品
1006001006,珠宝|时尚饰品|头饰、发饰,Aznavour 韩国可爱蝴蝶内锯齿发箍 精致大方款细边发卡 头饰 HB1512G 黄色,珠宝首饰>时尚饰品>头饰>Aznavour>Aznavour 韩国可爱蝴蝶内锯齿发箍...,京东商城,Aznavour
1006001006,珠宝|时尚饰品|头饰、发饰,Aznavour韩国饰品 大蝴蝶结细边发卡 甜美时尚发箍头饰 HB1131G 橙色,珠宝首饰>时尚饰品>头饰>Aznavour>Aznavour韩国饰品 大蝴蝶结细边发...,京东商城,Aznavour
1006001006,珠宝|时尚饰品|头饰、发饰,典雅发饰头饰 流行横夹弹簧夹顶夹 水钻发卡韩式盘发夹韩版 CH03745 咖啡色,珠宝首饰>时尚饰品>头饰>典雅发饰头饰 流行横夹弹簧夹顶夹 水钻发...,京东商城,典雅饰品
1006001006,珠宝|时尚饰品|头饰、发饰,尹语彤头饰盘发复古发梳糖果5240 绿色,珠宝首饰>时尚饰品>头饰>尹语彤头饰盘发复古发梳糖果5240 绿色,京东商城,尹语彤饰品
1006001006,珠宝|时尚饰品|头饰、发饰,shes茜子发夹 手工古典刺绣花朵八字夹 母亲节礼品 头饰 HP81794 浅灰色M2 均码,珠宝首饰>时尚饰品>头饰>shes茜子发夹 手工古典刺绣花朵八字夹...,京东商城,she's饰品官方旗舰店
1006001006,珠宝|时尚饰品|头饰、发饰,典雅发梳插梳发卡 水钻鸭嘴夹盘发 发夹 发饰 头饰 cs00933 粉红色,珠宝首饰>时尚饰品>头饰>典雅发梳插梳发卡 水钻鸭嘴夹盘发 发夹 ...,京东商城,典雅饰品
1006001006,珠宝|时尚饰品|头饰、发饰,韩国YIBOYO饰品 高档法国板材 韩式不规则蝴蝶结镶钻发夹头饰 米色,珠宝首饰>时尚饰品>头饰>韩国YIBOYO饰品 高档法国板材 韩式...,京东商城,韩国YIBOYO饰品官方旗舰店
1006001006,珠宝|时尚饰品|头饰、发饰,she's茜子饰品 发箍 简约欧美风 发卡发箍水晶盘发头饰SHG9901445 灰色M0 均码,珠宝首饰>时尚饰品>头饰>she's茜子饰品 发箍 简约欧美风 发...,京东商城,She's饰品官方旗舰店
1006001006,珠宝|时尚饰品|头饰、发饰,典雅韩国发饰 水钻香蕉夹 竖夹 竖卡 正品头饰发卡 CU00842 香槟,珠宝首饰>时尚饰品>头饰>典雅韩国发饰 水钻香蕉夹 竖夹 竖卡 正...,京东商城,典雅饰品
1006001006,珠宝|时尚饰品|头饰、发饰,she's茜子 shes发箍 简约时尚发饰 PU皮头箍 盘发头饰 SHG9809140 咖啡色F2 均码,珠宝首饰>时尚饰品>头饰>she's茜子 shes发箍 简约时尚发...,京东商城,She's
1006001006,珠宝|时尚饰品|头饰、发饰,尹语彤头饰 韩版饰品 带水钻亚克力香蕉夹F9854 咖色,珠宝首饰>时尚饰品>头饰>尹语彤头饰 韩版饰品 带水钻亚克力香蕉夹...,京东商城,尹语彤饰品
1006001006,珠宝|时尚饰品|头饰、发饰,YIBOYO韩国进口流行发饰品 甜美清新斑点宽布五彩蝴蝶结香蕉夹 时尚女士竖夹头饰 Y10200105001 藏蓝色,珠宝首饰>时尚饰品>头饰>YIBOYO韩国进口流行发饰品 甜美清新...,京东商城,韩国YIBOYO饰品官方旗舰店
1006001006,珠宝|时尚饰品|头饰、发饰,尹语彤头饰 韩国进口饰品 亚克力 头饰F9026 黑色,珠宝首饰>时尚饰品>头饰>尹语彤头饰 韩国进口饰品 亚克力 头饰F...,京东商城,尹语彤饰品
1006001006,珠宝|时尚饰品|头饰、发饰,She's girl茜子头饰 都市OL风格 纯色PU皮蝴蝶结发抓 小抓夹GHU9811239 蓝色C0 均码,珠宝首饰>时尚饰品>头饰>She's girl茜子头饰 都市OL风...,京东商城,She's
1006001006,珠宝|时尚饰品|头饰、发饰,韩国YIBOYO饰品 夏日甜美风编织条纹皮质发卡发箍头饰 N20180106001 黑色,珠宝首饰>时尚饰品>头饰>韩国YIBOYO饰品 夏日甜美风编织条纹...,京东商城,韩国YIBOYO饰品官方旗舰店
1006001006,珠宝|时尚饰品|头饰、发饰,YIBOYO韩国流行发饰品 夏日甜美风编织条纹皮质发卡 时尚女士专属宽布发箍头饰 N20180106001 粉色,珠宝首饰>时尚饰品>头饰>YIBOYO韩国流行发饰品 夏日甜美风编...,京东商城,韩国YIBOYO饰品官方旗舰店
1006001006,珠宝|时尚饰品|头饰、发饰,韩国YIBOYO饰品 高档法国板材 简约满钻别致花纹头绳发圈头饰 粉色,珠宝首饰>时尚饰品>头饰>韩国YIBOYO饰品 高档法国板材 简约...,京东商城,韩国YIBOYO饰品官方旗舰店
1006001006,珠宝|时尚饰品|头饰、发饰,韩国YIBOYO饰品 高档法国板材 双层不规则蝴蝶结高档镶钻发夹头饰 粉色,珠宝首饰>时尚饰品>头饰>韩国YIBOYO饰品 高档法国板材 双层...,京东商城,韩国YIBOYO饰品官方旗舰店
1006001006,珠宝|时尚饰品|头饰、发饰,韩国YIBOYO饰品 高档法国板材 时尚蝴蝶结镶钻发夹头饰 蓝色,珠宝首饰>时尚饰品>头饰>韩国YIBOYO饰品 高档法国板材 时尚...,京东商城,韩国YIBOYO饰品官方旗舰店
1006001006,珠宝|时尚饰品|头饰、发饰,Angel's 儿童头饰四件套礼盒装 小熊蝴蝶结-005,珠宝首饰 > 头饰 > 发箍\\发带,亚马逊(卓越网),
1006001006,珠宝|时尚饰品|头饰、发饰,卡利雅新品头饰盘发饰品韩国韩版水钻横夹发卡布艺大发夹 虔诚 墨兰色,珠宝首饰>时尚饰品>头饰>卡利雅新品头饰盘发饰品韩国韩版水钻横夹发...,京东商城,卡利雅
1006001006,珠宝|时尚饰品|头饰、发饰,典雅发梳插梳发卡 水钻中号鸭嘴夹盘发 发夹 发饰 头饰 CS00637 株红色,珠宝首饰>时尚饰品>头饰>典雅发梳插梳发卡 水钻中号鸭嘴夹盘发 发...,京东商城,典雅饰品
1006001006,珠宝|时尚饰品|头饰、发饰,she's茜子头饰 shes发卡 水晶珠片优雅花朵发夹顶夹 八字夹 灰色M0 均码,珠宝首饰>时尚饰品>头饰>she's茜子头饰 shes发卡 水晶...,京东商城,She's饰品官方旗舰店
1006001006,珠宝|时尚饰品|头饰、发饰,雅秀 韩版宽边发箍 布艺头箍 百搭韩版发饰头饰蕾丝发箍BTG013 米色,珠宝首饰>时尚饰品>头饰>雅秀 韩版宽边发箍 布艺头箍 百搭韩版发...,京东商城,雅秀饰品
1006001006,珠宝|时尚饰品|头饰、发饰,韩国YIBOYO饰品 高档法国板材 蝴蝶结条纹边夹头饰 紫色,珠宝首饰>时尚饰品>头饰>韩国YIBOYO饰品 高档法国板材 蝴蝶...,京东商城,韩国YIBOYO饰品官方旗舰店
1006001006,珠宝|时尚饰品|头饰、发饰,kaliya 卡利雅头饰盘发饰品韩版水钻横夹顶夹发卡发夹星夜 香槟色,珠宝首饰>时尚饰品>头饰>卡利雅（kaliya）>kaliya 卡利雅头饰盘发饰品韩版水钻...,京东商城,卡利雅
1006001006,珠宝|时尚饰品|头饰、发饰,韩国Aznavour正品 明星款简单大方三角型波点发夹Cellulose高档材质时尚女士边夹头饰N11430123017 咖啡色,珠宝首饰>时尚饰品>头饰>韩国Aznavour正品 明星款简单大方...,京东商城,韩国YIBOYO饰品官方旗舰店
1006001006,珠宝|时尚饰品|头饰、发饰,韩国YIBOYO饰品 高档法国板材 别致蝴蝶结法国板材光板侧夹头饰 绿色,珠宝首饰>时尚饰品>头饰>韩国YIBOYO饰品 高档法国板材 别致...,京东商城,韩国YIBOYO饰品官方旗舰店
1006001006,珠宝|时尚饰品|头饰、发饰,韩国YIBOYO饰品 韩国进口 手工珍珠镶钻蝴蝶结发夹头饰-B款 白色,珠宝首饰>时尚饰品>头饰>韩国YIBOYO饰品 韩国进口 手工珍珠...,京东商城,韩国YIBOYO饰品官方旗舰店
1006001006,珠宝|时尚饰品|头饰、发饰,kaliya 卡利雅正品盘发夹横夹发卡头饰品水钻韩国韩版头花顶夹发饰波斯菊 紫色,珠宝首饰>时尚饰品>头饰>卡利雅（kaliya）>kaliya 卡利雅正品盘发夹横夹发卡头...,京东商城,卡利雅
1006001006,珠宝|时尚饰品|头饰、发饰,韩国进口流行Aznavour正品 顶级材质Cellulose 时尚糖果色一字夹发夹顶夹头饰 N11430102002 深蓝色,珠宝首饰>时尚饰品>头饰>韩国进口流行Aznavour正品 顶级材...,京东商城,韩国YIBOYO饰品官方旗舰店
1006001006,珠宝|时尚饰品|头饰、发饰,kaliya 卡利雅韩国韩版头饰发夹子横夹发卡顶夹水晶 浅咖色,珠宝首饰>时尚饰品>头饰>kaliya 卡利雅韩国韩版头饰发夹子横...,京东商城,卡利雅
1006001006,珠宝|时尚饰品|头饰、发饰,special头饰女欧美手工个性时尚蝴蝶结蕾丝顶夹微微笑的洛丽塔圣诞礼物M02A07FS,珠宝首饰>时尚饰品>头饰>special>special头饰女欧美手工个性时尚蝴蝶...,京东商城,SPECIAL
1006001006,珠宝|时尚饰品|头饰、发饰,Aznavour正品 韩国进口时尚饰品 顶级材质Cellulose 韩式蝴蝶结银杏叶点点鸭嘴夹 女士侧夹头饰 黑色,珠宝首饰>时尚饰品>头饰>Aznavour正品 韩国进口时尚饰品 ...,京东商城,韩国YIBOYO饰品官方旗舰店
1006001006,珠宝|时尚饰品|头饰、发饰,kaliya 卡利雅发夹横夹子满钻发卡子头饰品水钻韩版亚克力顶夹星幕 香槟粉,珠宝首饰>时尚饰品>头饰>卡利雅（kaliya）>kaliya 卡利雅发夹横夹子满钻发卡子...,京东商城,卡利雅
1006001006,珠宝|时尚饰品|头饰、发饰,凤凰涅槃 中国风饰品流行首饰 发簪红檀木盘发头饰发饰 簪子 女p03120721 新品预售,首页 >配饰 >时尚饰品 >发饰 >凤凰涅磐 中国风饰品流行首饰 发簪红檀木盘发头饰发饰 簪子 女p03120721,vjia,凤凰涅磐旗舰店
1006001006,珠宝|时尚饰品|头饰、发饰,京东头饰金秋大促 卡乔发饰 韩版热卖 大羽毛横夹顶夹 发卡发饰饰品 时尚盘发 高 黑色,珠宝首饰>时尚饰品>头饰>京东头饰金秋大促 卡乔发饰 韩版热卖 大...,京东商城,卡乔旗舰店
1006001006,珠宝|时尚饰品|头饰、发饰,She's 茜子头饰 欧美时尚复古水晶胶珠盘发抓夹 中号 SHU9911162 黑色G0 均码,珠宝首饰>时尚饰品>头饰>She's 茜子头饰 欧美时尚复古水晶胶...,京东商城,She's
1006001006,珠宝|时尚饰品|头饰、发饰,京东店庆月 卡乔发饰 头饰 歌魅发抓顶抓 时尚发卡 高档礼品 裸色,珠宝首饰>时尚饰品>头饰>京东店庆月 卡乔发饰 头饰 歌魅发抓顶抓...,京东商城,卡乔旗舰店
1006001006,珠宝|时尚饰品|头饰、发饰,She's girl茜子头饰 个性新颖异域印花 抓夹 发夹 GHX9811526 桔红色A4 均码,珠宝首饰>时尚饰品>头饰>She's girl茜子头饰 个性新颖异...,京东商城,She's
1006001006,珠宝|时尚饰品|头饰、发饰,Aznavour头饰 韩国一字蝴蝶头箍 少女发卡 HB1231G 草绿,珠宝首饰>时尚饰品>头饰>Aznavour头饰 韩国一字蝴蝶头箍 ...,京东商城,Aznavour
1006001006,珠宝|时尚饰品|头饰、发饰,She's 茜子 头饰 豹纹宽边发箍 布艺包边头箍 HG81857-深灰,珠宝首饰 > 头饰 > 发箍\\发带,亚马逊(卓越网),she's 茜子
1006001006,珠宝|时尚饰品|头饰、发饰,she's 茜子 头饰发卡 仿珍珠花朵发夹顶夹一字夹 优雅 SHP9911023G0黑色,珠宝首饰 > 头饰 > 发夹,亚马逊(卓越网),she's 茜子
1006001006,珠宝|时尚饰品|头饰、发饰,尹语彤韩国头饰发饰宽发箍布艺发带发卡4930 黄色,珠宝首饰>时尚饰品>头饰>尹语彤韩国头饰发饰宽发箍布艺发带发卡49...,京东商城,尹语彤饰品
1006001006,珠宝|时尚饰品|头饰、发饰,YIBOYO韩国进口流行饰品 亮粉简约日韩发夹 时尚职业女士半月形横夹大夹子头饰 H11430102003 黑色,珠宝首饰>时尚饰品>头饰>YIBOYO韩国进口流行饰品 亮粉简约日...,京东商城,韩国YIBOYO饰品官方旗舰店
1006001006,珠宝|时尚饰品|头饰、发饰,韩国Aznavour正品 顶级材质Cellulose 韩版多色蝴蝶结带防滑梳齿发箍头饰 N11430106007 天蓝色,珠宝首饰>时尚饰品>头饰>韩国Aznavour正品 顶级材质Cel...,京东商城,韩国YIBOYO饰品官方旗舰店
1006001006,珠宝|时尚饰品|头饰、发饰,She's girl茜子头饰 个性异域印花欧美时尚发饰 头箍GHG9811519 蓝色C0 均码,珠宝首饰>时尚饰品>头饰>She's girl茜子头饰 个性异域印...,京东商城,She's
1006001006,珠宝|时尚饰品|头饰、发饰,DIANYA 典雅 奢华高贵 头饰发饰水钻发卡盘发抓夹CB09063 株红色,珠宝首饰>时尚饰品>头饰>DIANYA 典雅 奢华高贵 头饰发饰水...,京东商城,典雅饰品
1006001006,珠宝|时尚饰品|头饰、发饰,MOREACC饰品 波西米亚风 蕾丝珍珠丝带蝴蝶结发夹发饰头饰H30154 蓝色,珠宝首饰>时尚饰品>头饰>MOREACC饰品 波西米亚风 蕾丝珍珠...,京东商城,MOREACC摩尔爱饰
1006001006,珠宝|时尚饰品|头饰、发饰,MOREACC饰品 百搭时尚优雅优雅羊绒长条发夹发饰头饰H30171 绿色,珠宝首饰>时尚饰品>头饰>MOREACC饰品 百搭时尚优雅优雅羊绒...,京东商城,MOREACC摩尔爱饰
1006001006,珠宝|时尚饰品|头饰、发饰,MOREACC饰品 韩国绒长毛球蝴蝶结发夹发饰头饰H30173 灰色,珠宝首饰>时尚饰品>头饰>MOREACC饰品 韩国绒长毛球蝴蝶结发...,京东商城,MOREACC摩尔爱饰
1006001006,珠宝|时尚饰品|头饰、发饰,MOREACC饰品 海军风条纹蝴蝶结发箍发饰头饰H30182 紫色,珠宝首饰>时尚饰品>头饰>MOREACC饰品 海军风条纹蝴蝶结发箍...,京东商城,MOREACC摩尔爱饰
1006001006,珠宝|时尚饰品|头饰、发饰,she's茜子头饰 shes发卡 糖果色醋酸板材蝴蝶结发圈 发绳 皮筋 SHQ9819269 红色A1 均码,珠宝首饰>时尚饰品>头饰>she's茜子头饰 shes发卡 糖果色...,京东商城,She's
1006001006,珠宝|时尚饰品|头饰、发饰,皇家莎莎RoyalSaSa韩版头饰流行发卡时尚饰品进口亚克力水晶发抓发夹发饰-蝶伴相随,珠宝首饰>时尚饰品>头饰>皇家莎莎RoyalSaSa韩版头饰流行发...,京东商城,皇家莎莎RoyalSaSa
1006001006,珠宝|时尚饰品|头饰、发饰,MOREACC饰品 日韩流行蝴蝶结发饰头饰发夹H30220 灰色,珠宝首饰>时尚饰品>头饰>MOREACC饰品 日韩流行蝴蝶结发饰头...,京东商城,MOREACC摩尔爱饰
1006001006,珠宝|时尚饰品|头饰、发饰,DIANYA 典雅 韩国盘头发饰品 韩版水钻头饰奢华发抓夹 正品盘发夹发卡ED01421 咖啡色,珠宝首饰>时尚饰品>头饰>DIANYA 典雅 韩国盘头发饰品 韩版...,京东商城,典雅饰品
1006001006,珠宝|时尚饰品|头饰、发饰,皇家莎莎RoyalSaSa 韩版头饰时尚饰品 高端发卡亚克力水晶横夹 发夹发饰 花结蜜芯,珠宝首饰>时尚饰品>头饰>皇家 莎莎（Royal sasa）>皇家莎莎RoyalSaSa 韩版头饰时尚...,京东商城,
1006001006,珠宝|时尚饰品|头饰、发饰,She's茜子 宽发箍 手工精致水晶串珠发卡头箍头饰 SHG9911485 咖啡色F0 均码,珠宝首饰>时尚饰品>头饰>茜子（She's）>She's茜子 宽发箍 手工精致水晶串珠...,京东商城,She's
1006001006,珠宝|时尚饰品|头饰、发饰,MOREACC饰品 时尚流行糖果色 纱织雪纺手工花 玫瑰花头饰发饰发夹H30077 粉色,珠宝首饰>时尚饰品>头饰>MOREACC饰品 时尚流行糖果色 纱织...,京东商城,MOREACC摩尔爱饰
1006001006,珠宝|时尚饰品|头饰、发饰,皇家莎莎RoyalSaSa韩版头饰流行时尚发卡热卖款皮质水晶横夹发夹发饰-蝶舞清梦,珠宝首饰>时尚饰品>头饰>皇家莎莎RoyalSaSa韩版头饰流行时...,京东商城,皇家莎莎RoyalSaSa
1006001006,珠宝|时尚饰品|头饰、发饰,皇家莎莎RoyalSaSa 韩版头饰流行发卡时尚饰品 亚克力水晶横夹 发夹发饰 玫瑰蕾丝,珠宝首饰>时尚饰品>头饰>皇家 莎莎（Royal sasa）>皇家莎莎RoyalSaSa 韩版头饰流行...,京东商城,皇家莎莎RoyalSaSa
1006001006,珠宝|时尚饰品|头饰、发饰,She's茜子 宽发箍 手工精致水晶串珠发卡头箍头饰 SHG9911485 蓝色C0 均码,珠宝首饰>时尚饰品>头饰>茜子（She's）>She's茜子 宽发箍 手工精致水晶串珠...,京东商城,She's
1006001006,珠宝|时尚饰品|头饰、发饰,皇家莎莎RoyalSaSa 韩版头饰时尚饰品 手工布艺蝴蝶结发圈发饰 墨蓝舞伴,珠宝首饰>时尚饰品>头饰>皇家 莎莎（Royal sasa）>皇家莎莎RoyalSaSa 韩版头饰时尚...,京东商城,皇家莎莎RoyalSaSa
1006001006,珠宝|时尚饰品|头饰、发饰,She's茜子 shes发夹 豹纹印花双层蝴蝶结大号抓夹头饰 SHU9801005 红色A6 均码,珠宝首饰>时尚饰品>头饰>茜子（She's）>She's茜子 shes发夹 豹纹印花双...,京东商城,She's
1006001006,珠宝|时尚饰品|头饰、发饰,皇家莎莎RoyalSaSa韩版头饰原创时尚流行款布艺蝴蝶结手工发箍发卡发饰-玫瑰庄园,珠宝首饰>时尚饰品>头饰>皇家莎莎RoyalSaSa韩版头饰原创时...,京东商城,皇家莎莎RoyalSaSa
1006001006,珠宝|时尚饰品|头饰、发饰,coldel饰品奥地利水晶头饰花朵弹簧发夹横夹CL-1213 蓝色,珠宝首饰>时尚饰品>头饰>coldel饰品奥地利水晶头饰花朵弹簧发...,京东商城,卡兰朵旗舰店
1006001006,珠宝|时尚饰品|头饰、发饰,皇家莎莎RoyalSaSa韩版头饰奢华时尚百搭款进口亚克力水晶发箍发卡发饰-花落,珠宝首饰>时尚饰品>头饰>皇家莎莎RoyalSaSa韩版头饰奢华时...,京东商城,皇家莎莎RoyalSaSa
1006001006,珠宝|时尚饰品|头饰、发饰,皇家莎莎RoyalSaSa韩版头饰奢华时尚百搭款进口亚克力镶钻发箍发卡发饰-沛玲,珠宝首饰>时尚饰品>头饰>皇家莎莎RoyalSaSa韩版头饰奢华时...,京东商城,皇家莎莎RoyalSaSa
1006001006,珠宝|时尚饰品|头饰、发饰,KAROQUE 卡乔 发饰 高档饰品 优雅钢琴发抓 顶抓 水钻头饰发卡 时尚礼品 酒红色,珠宝首饰 > 头饰 > 爪夹,亚马逊(卓越网),KAROQUE 卡乔
1006001006,珠宝|时尚饰品|头饰、发饰,XSTP 象上童品 韩范女童头饰发夹发卡头绳儿童发饰套装 颜色随机 (F套餐),珠宝首饰/类别/头饰/发箍\\发带,亚马逊(卓越网),XSTP 象上童品
1006001006,珠宝|时尚饰品|头饰、发饰,Angel's 儿童头饰三件套礼盒装 蝴蝶小熊-067,珠宝首饰 > 头饰 > 发箍\\发带,亚马逊(卓越网),Angel's
1006001006,珠宝|时尚饰品|头饰、发饰,Angel's 儿童头饰六件套礼盒装 小熊-045,珠宝首饰 > 头饰 > 发箍\\发带,亚马逊(卓越网),Angel's
1006001006,珠宝|时尚饰品|头饰、发饰,Royal SaSa 皇家莎莎韩版头饰流行时尚热卖款豹纹情节发箍发卡发饰-Cool 豹乖女孩SPTFGB0004 花色,首页 >配饰 >时尚饰品 >发饰 >Royal SaSa 皇家莎莎韩版头饰流行时尚热卖款豹纹情节发箍发卡发饰-Cool 豹乖女孩SPTFGB0004,vjia,RoyalSaSa旗舰店
1006001006,珠宝|时尚饰品|头饰、发饰,RoyalSaSa韩版头饰时尚流行款亚克力镶钻发夹发饰-羽翅随星,首页>配饰>流行饰品>头饰/摆件,银泰网,Royal SaSa
1006001006,珠宝|时尚饰品|头饰、发饰,皇家莎莎 RoyalSaSa韩版头饰时尚热卖经典款丝缎蝴蝶结竖夹发夹发饰-双蝶双赢,珠宝首饰>时尚饰品>头饰>皇家 莎莎（Royal sasa）>皇家莎莎 RoyalSaSa韩版头饰时尚...,京东商城,皇家莎莎RoyalSaSa
1006001006,珠宝|时尚饰品|头饰、发饰,华庭丽娜饰品 复古黑檀木发簪 纯手工盘发头饰发饰 民族风木质步摇 辟邪保平安 送妈妈送爱人礼物 出水莲,珠宝首饰>时尚饰品>头饰>华庭丽娜饰品 复古黑檀木发簪 纯手工盘发...,京东商城,响当当饰品
1006001006,珠宝|时尚饰品|头饰、发饰,She's girl茜子头饰 滴油小瓢虫雏菊花朵发夹顶夹发小抓夹 GHU9811623 红色A4 均码,珠宝首饰>时尚饰品>头饰>She's girl茜子头饰 滴油小瓢虫...,京东商城,She's
1006001006,珠宝|时尚饰品|头饰、发饰,典雅韩版水钻蝴蝶结发夹 弹簧夹横夹顶夹边夹 发饰头饰CH03722 灰色,珠宝首饰>时尚饰品>头饰>典雅韩版水钻蝴蝶结发夹 弹簧夹横夹顶夹边...,京东商城,典雅饰品
1006001006,珠宝|时尚饰品|头饰、发饰,典雅新品水晶之恋 韩国发饰头饰满钻蝴蝶结发夹弹簧夹顶夹CH03915 七彩色,珠宝首饰>时尚饰品>头饰>典雅新品水晶之恋 韩国发饰头饰满钻蝴蝶结...,京东商城,典雅饰品
1006001006,珠宝|时尚饰品|头饰、发饰,凤凰涅磐 流苏复古盘发簪子 黑檀木紫水晶发簪头饰 支持货到付款 紫浮 P12130201,珠宝首饰>时尚饰品>头饰>凤凰涅磐>凤凰涅磐 流苏复古盘发簪子 黑檀木紫水晶...,京东商城,凤凰涅磐
1006001006,珠宝|时尚饰品|头饰、发饰,皇家莎莎正品 韩版头饰顶夹 时尚精品马尾夹弹簧夹 发卡亚克力横夹 水钻发夹发饰 并蒂清兰,珠宝首饰>时尚饰品>头饰>皇家 莎莎（Royal sasa）>皇家莎莎正品 韩版头饰顶夹 时尚精品马尾...,京东商城,皇家莎莎RoyalSaSa
1006001006,珠宝|时尚饰品|头饰、发饰,she's 茜子 舒适简约布艺波浪细发箍 头饰 GHG9801623 桔红色,珠宝首饰 > 头饰 > 发箍\\发带,亚马逊(卓越网),She's 茜子
