1008007002,服饰、鞋、包|男包|单肩、斜跨包,BALENCIAGA巴黎世家黑色羊皮材质纯色男士商务休闲单肩机车包,首页>箱包>时尚男包>单肩包,银泰网,BALENCIAGA
1008007002,服饰、鞋、包|男包|单肩、斜跨包,豆鼓眼 2014卡通青蛙单肩帆布包女包 男单肩包斜挎包 男包 时尚休闲女包小 包包包,所有分类>箱包皮具>男包>单肩/斜挎包>豆鼓眼>豆鼓眼 2014卡通...,1号店,豆鼓眼
1008007002,服饰、鞋、包|男包|单肩、斜跨包,2014夏季新款小人单肩手提包时尚帆布可爱印花手提袋,箱包皮具 > 精品男包 > 双肩包 > 2014夏季新款小人单肩手提包时尚帆布可爱印花手提袋,当当网,Maith Bot
1008007002,服饰、鞋、包|男包|单肩、斜跨包,Kaukko/高高路 新款单肩包斜挎包 潮帆布包书包 双肩包男女背包 多功能包 FP81,所有分类>箱包皮具>男包>手提/斜挎包>Kaukko/高高路>Kaukko/高高路...,1号店,Kaukko/高高路
1008007002,服饰、鞋、包|男包|单肩、斜跨包,Van Doren范伯伦 商务休闲 竖版长款 男式单肩包 VG072-08,服饰箱包 > 皮具箱包 > 单肩包、挎包、手包 > 男包 > 单肩包、斜挎包,亚马逊(卓越网),$N
1008007002,服饰、鞋、包|男包|单肩、斜跨包,TSD 男士帆布休闲包 斜挎包 棕色 04-CS92,服饰箱包/类别/皮具箱包/单肩包、挎包、手包/男包/单肩包、斜挎包,亚马逊(卓越网),Same Direction 同一方向【TSD】
1008007002,服饰、鞋、包|男包|单肩、斜跨包,driftwood 漂流木 单肩包 斜挎包 E1787-01,服饰箱包 > 皮具箱包 > 单肩包、挎包、手包 > 男包 > 单肩包、斜挎包,亚马逊(卓越网),$N
1008007002,服饰、鞋、包|男包|单肩、斜跨包,简时元素 2012新款韩版男士包电脑包休闲单肩斜跨包多用包手提包 卡其色,服饰箱包/类别/皮具箱包/单肩包、挎包、手包/男包/单肩包、斜挎包,亚马逊(卓越网),简时元素
1008007002,服饰、鞋、包|男包|单肩、斜跨包,BISON DENIM 美洲野牛 新款男士单肩包牛皮男士包包韩版背包商务休闲男士斜挎包,服饰箱包 > 皮具箱包 > 单肩包、挎包、手包 > 男包 > 单肩包、斜挎包,亚马逊(卓越网),$N
1008007002,服饰、鞋、包|男包|单肩、斜跨包,Sigikid旗下BEASTS TOWN顶级涂鸦潮流休闲款-棕色 咖啡色 小款斜挎包 单肩包 横款小挎包,服饰箱包 > 皮具箱包 > 单肩包、挎包、手包 > 男包 > 单肩包、斜挎包,亚马逊(卓越网),Sigikid 喜吉儿
1008007002,服饰、鞋、包|男包|单肩、斜跨包,豪威袋鼠 新款时尚男包 单肩包 斜跨包 男士休闲包5233,服饰箱包 > 皮具箱包 > 单肩包、挎包、手包 > 男包 > 单肩包、斜挎包,亚马逊(卓越网),豪威袋鼠
1008007002,服饰、鞋、包|男包|单肩、斜跨包,团购EZE正品 送六 新款男士单肩包男包休闲包斜挎包箱书背包8865,服饰箱包 > 皮具箱包 > 单肩包、挎包、手包 > 男包 > 单肩包、斜挎包,亚马逊(卓越网),$N
1008007002,服饰、鞋、包|男包|单肩、斜跨包,HARRYSON 哈迪森 男式 复古休闲潮斜挎单肩包 C01016R2-0001-01,服饰箱包 > 皮具箱包 > 单肩包、挎包、手包 > 男包 > 单肩包、斜挎包,亚马逊(卓越网),Harryson 哈迪森
1008007002,服饰、鞋、包|男包|单肩、斜跨包,Tuscarora 途斯卡洛拉 男式 潮流挎包 K01,服饰箱包 > 皮具箱包 > 单肩包、挎包、手包 > 男包 > 单肩包、斜挎包,亚马逊(卓越网),Tuscarora 途斯卡洛拉
1008007002,服饰、鞋、包|男包|单肩、斜跨包,COACH 蔻驰 男士竖款PVC 单肩斜挎包男包 70589,服饰箱包 > 皮具箱包 > 单肩包、挎包、手包 > 男包 > 单肩包、斜挎包,亚马逊(卓越网),$N
1008007002,服饰、鞋、包|男包|单肩、斜跨包,西部牛匠 XBNJ斜挎包韩版潮包真皮包男包头层牛皮包休闲包斜跨包单肩包,服饰箱包 > 皮具箱包 > 单肩包、挎包、手包 > 男包 > 单肩包、斜挎包,亚马逊(卓越网),西部牛匠
1008007002,服饰、鞋、包|男包|单肩、斜跨包,班妮奔奴 男士单肩包 斜挎包 休闲时尚 高品质 牛津布配真皮 BN-2029,服饰箱包 > 皮具箱包 > 单肩包、挎包、手包 > 男包 > 单肩包、斜挎包,亚马逊(卓越网),$N
1008007002,服饰、鞋、包|男包|单肩、斜跨包,SMPHAN仕墨凡 欧美杂志推荐男士高级复合超薄商务单肩斜挎包 棕色589011-1A,服饰箱包 > 皮具箱包 > 单肩包、挎包、手包 > 男包 > 单肩包、斜挎包,亚马逊(卓越网),SMPHAN仕墨凡
1008007002,服饰、鞋、包|男包|单肩、斜跨包,KINGSONS 金圣斯 时尚商务休闲防震手提/单肩/斜跨电脑包 KS3040W 灰色 14.1寸,服饰箱包 > 皮具箱包 > 单肩包、挎包、手包 > 男包 > 单肩包、斜挎包,亚马逊(卓越网),Kingsons 金圣斯
1008007002,服饰、鞋、包|男包|单肩、斜跨包,Kappa 卡帕 LOGO 中性 单肩包/斜挎包 K01X8BX11,服饰箱包 > 皮具箱包 > 单肩包、挎包、手包 > 男包 > 单肩包、斜挎包,亚马逊(卓越网),Kappa 卡帕
1008007002,服饰、鞋、包|男包|单肩、斜跨包,麦包包戈尔本 商务休闲系列格子纹男士牛皮手提斜挎包,服饰箱包/类别/皮具箱包/单肩包、挎包、手包/男包/单肩包、斜挎包,亚马逊(卓越网),戈尔本
1008007002,服饰、鞋、包|男包|单肩、斜跨包,MILRY 米莱恩 头层牛皮商务休闲 真皮男士单肩斜挎包 油光细纹工艺 超质感商务 MS0076 背包,服饰箱包 > 皮具箱包 > 单肩包、挎包、手包 > 男包 > 单肩包、斜挎包 ,亚马逊(卓越网),MILRY 米莱恩
1008007002,服饰、鞋、包|男包|单肩、斜跨包,FIFTEENSIXTEEN15/16 商务男包 正品韩版男士休闲牛皮 斜挎包 单肩包 ZP0022,服饰箱包 > 皮具箱包 > 单肩包、挎包、手包 > 男包 > 单肩包、斜挎包,亚马逊(卓越网),FIFTEENSIXTEEN15/16
1008007002,服饰、鞋、包|男包|单肩、斜跨包,L'ALpina 意大利袋鼠 精品系列 男式 单肩包/斜挎包 啡色 9962122-07,服饰箱包 > 皮具箱包 > 单肩包、挎包、手包 > 男包 > 单肩包、斜挎包,亚马逊(卓越网),$N
1008007002,服饰、鞋、包|男包|单肩、斜跨包,LUYIVARIYAEN/路易韦恩 男士单肩包 休闲男包 真皮斜挎包L6932,服饰箱包 > 皮具箱包 > 单肩包、挎包、手包 > 男包 > 单肩包、斜挎包,亚马逊(卓越网),$N
1008007002,服饰、鞋、包|男包|单肩、斜跨包,UIYI 佑一良品 防水尼龙配真皮 简洁混搭型男斜挎包 HY-13085-1,服饰箱包/类别/皮具箱包/单肩包、挎包、手包/男包/单肩包、斜挎包,亚马逊(卓越网),UIYI
1008007002,服饰、鞋、包|男包|单肩、斜跨包,doctortoh 意大利登喜路 国际品牌商务男包单肩手提斜挎包,服饰箱包 > 皮具箱包 > 单肩包、挎包、手包 > 男包 > 手拎包 ,亚马逊(卓越网),doctortoh 意大利登喜路
1008007002,服饰、鞋、包|男包|单肩、斜跨包,GLUX 古莱仕 时尚系列 GLB13-414 日本 挎包 胸包,服饰箱包 > 皮具箱包 > 单肩包、挎包、手包 > 男包 > 单肩包、斜挎包,亚马逊(卓越网),GLUX 古莱仕
1008007002,服饰、鞋、包|男包|单肩、斜跨包,COULSTON 康森 新款正品 真皮男包 男士商务单肩包 休闲头层牛皮 斜挎包包男9907,服饰箱包 > 皮具箱包 > 单肩包、挎包、手包 > 男包 > 单肩包、斜挎包,亚马逊(卓越网),COULSTON 康森
1008007002,服饰、鞋、包|男包|单肩、斜跨包,GAMEDGE 卡曼奇 数码印花单肩电脑包/邮差包 但丁地狱 Dante’s Inferno Death B01-097,服饰箱包 > 皮具箱包 > 单肩包、挎包、手包 > 男包 > 单肩包、斜挎包,亚马逊(卓越网),GAMEDGE 卡曼奇
1008007002,服饰、鞋、包|男包|单肩、斜跨包,ZHENPISI 珍皮士 韩版新款 男包牛皮手提包 斜跨包 电脑包 韩版商务休闲包包 ZP1039,服饰箱包 > 皮具箱包 > 单肩包、挎包、手包 > 男包 > 单肩包、斜挎包 ,亚马逊(卓越网),ZHENPISI 珍皮士
1008007002,服饰、鞋、包|男包|单肩、斜跨包,Esprit 埃斯普利特 男式 单肩包/斜挎包 SC6002F,服饰箱包 > 皮具箱包 > 单肩包、挎包、手包 > 男包 > 单肩包、斜挎包,亚马逊(卓越网),Esprit 埃斯普利特
1008007002,服饰、鞋、包|男包|单肩、斜跨包,CAMAC 凯马 男包 M100901C-1 4*42*11*11*9 黑/灰,服饰箱包 > 皮具箱包 > 单肩包、挎包、手包 > 男包 > 单肩包、斜挎包,亚马逊(卓越网),CAMAC 凯马
1008007002,服饰、鞋、包|男包|单肩、斜跨包,班妮奔奴 男包 体闲 单肩包 斜挎包 牛津布 物美价廉 啡色 900-3,服饰箱包 > 皮具箱包 > 单肩包、挎包、手包 > 男包 > 单肩包、斜挎包,亚马逊(卓越网),$N
1008007002,服饰、鞋、包|男包|单肩、斜跨包,Beleer 贝伦 包包2012新款 潮 男士手提包男包单肩包斜挎包男包 牛皮 手工,服饰箱包 > 皮具箱包 > 单肩包、挎包、手包 > 男包 > 单肩包、斜挎包,亚马逊(卓越网),Beleer 贝伦
1008007002,服饰、鞋、包|男包|单肩、斜跨包,【UIVY优维】真皮单肩手提 牛仔布包 条纹提花 学院风文艺范 精湛手工 男女通用,服饰箱包 > 皮具箱包 > 单肩包、挎包、手包 > 男包 > 单肩包、斜挎包,亚马逊(卓越网),UIVY优维
1008007002,服饰、鞋、包|男包|单肩、斜跨包,SEPTWOLVES 七匹狼 新品上市 新潮男人 男士单肩包 黑色 斜挎包国货精品,服饰箱包 > 皮具箱包 > 单肩包、挎包、手包 > 男包 > 手拎包,亚马逊(卓越网),SEPTWOLVES 七匹狼
1008007002,服饰、鞋、包|男包|单肩、斜跨包,Byishi 七色棉 帆布包韩版单肩斜挎包电脑包男包复古休闲包,服饰箱包/类别/皮具箱包/单肩包、挎包、手包/男包/单肩包、斜挎包,亚马逊(卓越网),Byishi（MDJB）
1008007002,服饰、鞋、包|男包|单肩、斜跨包,真皮包 商务男包 时尚斜挎包男款 休闲单肩包包 欧美 2013年新款,服饰箱包 > 皮具箱包 > 单肩包、挎包、手包 > 男包 > 单肩包、斜挎包,亚马逊(卓越网),DreamRider
1008007002,服饰、鞋、包|男包|单肩、斜跨包,YESO 户外大师 正品男士单肩包斜跨包优质PU皮横款商务包 潮包,服饰箱包 > 皮具箱包 > 单肩包、挎包、手包 > 男包 > 单肩包、斜挎包,亚马逊(卓越网),YESO 户外大师
1008007002,服饰、鞋、包|男包|单肩、斜跨包,马龙世家 简单大方 男士棕色单肩斜挎包,服饰箱包 > 皮具箱包 > 单肩包、挎包、手包 > 男包 > 单肩包、斜挎包,亚马逊(卓越网),马龙世家
1008007002,服饰、鞋、包|男包|单肩、斜跨包,P.kuone 皮客优一 韩版时尚 潮流 男士单肩包 头层牛皮 斜跨包 男包 P112782-1,服饰箱包 > 皮具箱包 > 单肩包、挎包、手包 > 男包 > 单肩包、斜挎包,亚马逊(卓越网),P.kuone 皮客优一
1008007002,服饰、鞋、包|男包|单肩、斜跨包,Playboy 花花公子 男包正品手提包男士单肩包斜挎包电脑包复古公文包包韩版,服饰箱包 > 皮具箱包 > 单肩包、挎包、手包 > 男包 > 单肩包、斜挎包,亚马逊(卓越网),Playboy 花花公子
1008007002,服饰、鞋、包|男包|单肩、斜跨包,Bottega Veneta 宝缇嘉 男款羊皮深棕色单肩/斜挎包 276356 V465C 2186,服饰箱包 > 皮具箱包 > 单肩包、挎包、手包 > 男包 > 单肩包、斜挎包,亚马逊(卓越网),Bottega Veneta 宝缇嘉
1008007002,服饰、鞋、包|男包|单肩、斜跨包,Coach 蔻驰 PVC 经典字母C连续压纹图案 男士 单肩包 F70589 SKHBR,服饰箱包 > 皮具箱包 > 单肩包、挎包、手包 > 男包 > 单肩包、斜挎包,亚马逊(卓越网),Coach 蔻驰
1008007002,服饰、鞋、包|男包|单肩、斜跨包,Laorentou 老人头 鳄鱼纹牛皮女包 亮面漆皮时尚单肩斜挎手提包包,服饰箱包 > 皮具箱包 > 单肩包、挎包、手包 > 男包 > 单肩包、斜挎包 ,亚马逊(卓越网),LAORENTOU 老人头
1008007002,服饰、鞋、包|男包|单肩、斜跨包,ManBang 曼邦 男包 单肩斜跨包 真皮男包 皮质柔滑 时尚潮流款式MB40923145L蓝,服饰箱包 > 皮具箱包 > 单肩包、挎包、手包 > 男包 > 单肩包、斜挎包,亚马逊(卓越网),ManBang 曼邦
1008007002,服饰、鞋、包|男包|单肩、斜跨包,AKARMY 男包 真皮牛皮包 单肩斜挎包 手提复古包 手工休闲商务公文包,服饰箱包 > 皮具箱包 > 单肩包、挎包、手包 > 男包 > 单肩包、斜挎包,亚马逊(卓越网),AKARMY
1008007002,服饰、鞋、包|男包|单肩、斜跨包,YIMAI 实拍UV400专业户外 骑行 防紫外线 多功能太阳运动镜924,运动户外休闲 > 露营\徒步 > 户外眼镜,亚马逊(卓越网),YIMAI
1008007002,服饰、鞋、包|男包|单肩、斜跨包,BAKMK 芭卡玛卡 男士商务休闲单肩斜跨包 欧美男商务包 多用途气质手提皮包TT688,所有分类>运动户外>户外装备>户外背包>挎包/拎包/休闲包>BAKMK>BAKMK 芭卡玛卡...,1号店,BAKMK
1008007002,服饰、鞋、包|男包|单肩、斜跨包,VOLUNTEER 华朗迪尔 男 单肩 斜挎 VR1373-06,运动户外休闲 > 露营\徒步 > 背包\袋 > 腰包,亚马逊(卓越网),Volunteer 华朗迪尔
