1008001029,服饰、鞋、包|女装|长袖T恤,HEINE 海恩娜 女式 假两件系带装饰长袖T恤 16703 ,所有分类>服饰内衣、鞋靴童装>女装>T恤>HEINE>HEINE 海恩娜 ...,1号店,HEINE
1008001029,服饰、鞋、包|女装|长袖T恤,女式绿色圆领细横条纹图案蝙蝠袖长袖韩版宽松常规款长袖T恤OR2548【韩都衣舍 2014春装】 ,您所在的位置 > 韩都衣舍 > HSTYLE女装 > 上装 > T恤/打底衫 > 女式绿色圆领细横条纹图案蝙蝠袖长袖韩版宽松常规款长袖T恤OR2548【韩都衣舍 2014春装】,韩都衣舍, HSTYLE女装
1008001029,服饰、鞋、包|女装|长袖T恤,【2倍积分】 女式两色街头纯色拼接拉链圆领宽松长袖T恤HH3279【韩都衣舍 2014春装新款】 ,您所在的位置 > 韩都衣舍 > HSTYLE女装 > 上装 > T恤/打底衫 > 女式两色街头纯色拼接拉链圆领宽松长袖T恤HH3279【韩都衣舍 2014春装新款】,韩都衣舍, HSTYLE女装
1008001029,服饰、鞋、包|女装|长袖T恤,女象牙色休闲简约宽松圆领袖部花朵图案长袖T恤JW3138【韩都衣舍 2014春装新款】 ,您所在的位置 > 韩都衣舍 > HSTYLE女装 > 上装 > T恤/打底衫 > 女象牙色休闲简约宽松圆领袖部花朵图案长袖T恤JW3138【韩都衣舍 2014春装新款】,韩都衣舍, HSTYLE女装
1008001029,服饰、鞋、包|女装|长袖T恤,韩都衣舍 韩版2014春装新款女圆领印花长袖T恤GD2165 ,您所在的位置 > 韩都衣舍 > HSTYLE女装 > 上装 > T恤/打底衫 > 韩都衣舍 韩版2014春装新款女圆领印花长袖T恤GD2165,韩都衣舍, HSTYLE女装
1008001029,服饰、鞋、包|女装|长袖T恤,女装西瓜红时尚韩版拼接撞色翻领宽松长袖T恤DU3086【韩都衣舍 2014春装新款】 ,您所在的位置 > 韩都衣舍 > HSTYLE女装 > 上装 > T恤/打底衫 > 女装西瓜红时尚韩版拼接撞色翻领宽松长袖T恤DU3086【韩都衣舍 2014春装新款】,韩都衣舍, HSTYLE女装
1008001029,服饰、鞋、包|女装|长袖T恤,女装黑色时尚印花修身显瘦长袖T恤LD4052【韩都衣舍 2014秋装新款】 ,您所在的位置 > 韩都衣舍 > HSTYLE女装 > 上装 > 秋·T恤 > 女装黑色时尚印花修身显瘦长袖T恤LD4052【韩都衣舍 2014秋装新款】,韩都衣舍, HSTYLE女装
1008001029,服饰、鞋、包|女装|长袖T恤,女装灰色宽松显瘦长袖T恤NW4016【韩都衣舍 2014秋冬新款】 ,您所在的位置 > 韩都衣舍 > HSTYLE女装 > 上装 > 秋·T恤 > 女装灰色宽松显瘦长袖T恤NW4016【韩都衣舍 2014秋冬新款】,韩都衣舍, HSTYLE女装
1008001029,服饰、鞋、包|女装|长袖T恤,女装灰色韩版通勤棉常规宽松圆领动物图案不对称印花拼接装饰长袖T恤JM3259【韩都衣舍 2014秋冬装新款】 ,您所在的位置 > 韩都衣舍 > HSTYLE女装 > 上装 > 秋·T恤 > 女装灰色韩版通勤棉常规宽松圆领动物图案不对称印花拼接装饰长袖T恤JM3259【韩都衣舍 2014秋冬装新款】,韩都衣舍, HSTYLE女装
1008001029,服饰、鞋、包|女装|长袖T恤,女装 象牙白色时尚韩版印花格子拼接长袖T恤【韩都衣舍 2014秋装】 ,您所在的位置 > 韩都衣舍 > HSTYLE女装 > 上装 > 秋·T恤 > 女装 象牙白色时尚韩版印花格子拼接长袖T恤【韩都衣舍 2014秋装】,韩都衣舍, HSTYLE女装
1008001029,服饰、鞋、包|女装|长袖T恤,秋装 交叉V领 抽褶打底衫 镶钻环扣 长袖T恤瑞丽修身常规 ,服装 > 女士服装 > 针织衫/毛衣 > 秋装 交叉V领 抽褶打底衫 镶钻环扣 长袖T恤瑞丽修身常规 ,当当网,影麦
1008001029,服饰、鞋、包|女装|长袖T恤,RJMEMORY 2014年秋装新款长袖t恤女款宽松上衣假两件莫代尔打底衫 OLD-9918p100         ,服装 > 女士服装 > T恤 > RJMEMORY 2014年秋装新款长袖t恤女款宽松上衣假两件莫代尔打底衫...,当当网,R.JMEMORY
1008001029,服饰、鞋、包|女装|长袖T恤,女装 灰色时尚韩版拼接长袖T恤GD3244【韩都衣舍 2014秋装】 ,您所在的位置 > 韩都衣舍 > HSTYLE女装 > 上装 > 秋·T恤 > 女装 灰色时尚韩版拼接长袖T恤GD3244【韩都衣舍 2014秋装】,韩都衣舍, HSTYLE女装
1008001029,服饰、鞋、包|女装|长袖T恤,女装白色韩版通勤直筒常规圆领蕾丝印花拼接蕾丝长袖T恤GY4124【韩都衣舍 2014秋冬新款】 ,您所在的位置 > 韩都衣舍 > HSTYLE女装 > 上装 > 秋·T恤 > 女装白色韩版通勤直筒常规圆领蕾丝印花拼接蕾丝长袖T恤GY4124【韩都衣舍 2014秋冬新款】,韩都衣舍, HSTYLE女装
