1008001029,服饰、鞋、包|女装|长袖T恤,2014春夏装新款韩版女 胖mm加肥加大码 时尚显瘦蕾丝长袖上衣长袖T恤衫A7379 红色 3XL/胸围118-138cm,服饰内衣>女装>大码女装> 喜玛奴>2014春夏装新款韩版女 胖mm加肥加大...,京东商城,喜玛奴旗舰店
1008001029,服饰、鞋、包|女装|长袖T恤,薇尔正品 体恤 骷髅纯色长袖打底衫 t恤 女款修身女装长袖T恤 灰色 L,服饰鞋帽>女装>T恤>薇尔正品 体恤 骷髅纯色长袖打底衫 t恤...,京东商城,薇尔官方旗舰店
1008001029,服饰、鞋、包|女装|长袖T恤,夏装新款2013夏日短t 短袖女t恤宽松大码文艺休闲韩版长款T恤 绿色 均码,服饰内衣>女装>T恤> 花棠香衣>夏装新款2013夏日短t 短袖女t恤宽松...,京东商城,花棠香衣官方旗舰店
1008001029,服饰、鞋、包|女装|长袖T恤,O.SA2011新品秋装新款女装韩版时尚大码长袖女款T恤 女ST11024(短款) 咖啡色 M,服饰内衣>女装>T恤>O.SA2011新品秋装新款女装韩版时尚...,京东商城,osa官方旗舰店
1008001029,服饰、鞋、包|女装|长袖T恤,【京品年货】探拓者（Tectop）户外女款圆领吸湿排汗长袖速干t恤 SL3036 6色 浅灰色 L,运动健康>户外鞋服>户外服装>探拓者（tectop）>【京品年货】探拓者（Tectop）户外女...,京东商城,步步升官方直营店
1008001029,服饰、鞋、包|女装|长袖T恤,所在 新款 冬装女装 V领修身针织棉t恤女长袖潮31130052 黑色,首页 >女装 >T恤 >长袖T恤 >所在 新款 冬装女装 V领修身针织棉t恤女长袖潮31130052,vjia,所在裂帛旗舰店
1008001029,服饰、鞋、包|女装|长袖T恤,初语 2014春装新款女装 小清新圆领长袖t恤女 拼接女装 341101007,所有分类>服饰内衣、鞋靴童装>女装>T恤>初语>初语 2014春装新...,1号店,初语
1008001029,服饰、鞋、包|女装|长袖T恤,Uranya 尤兰妮娅 韩版秋装时尚圆领 棉卡通设计百搭 女款长袖t恤女打底衫6195 黄色,首页> 女装> T恤> 长袖T恤> Uranya 尤兰妮娅 韩版秋装时尚圆领 棉卡通设计百搭 女款长袖t恤女打底衫6195,凡客诚品,Uranya 尤兰妮娅
1008001029,服饰、鞋、包|女装|长袖T恤,LIEWERAN 黎维娜 2014秋装上衣体桖修身韩版t桖大码女装长袖t恤女款B500X852XXJXW0220806X1 黄色,首页> 女装> T恤> 长袖T恤> LIEWERAN 黎维娜 2014秋装上衣体桖修身韩版t桖大码女装长袖t恤女款B500X852XXJ,凡客诚品,LIEWERAN 黎维娜
1008001029,服饰、鞋、包|女装|长袖T恤,韩都衣舍春装新款时尚条纹蝙蝠圆领长袖T恤HG2027 ,您所在的位置 > 韩都衣舍 > HSTYLE女装 > 上装 > T恤/打底衫 > 韩都衣舍春装新款时尚条纹蝙蝠圆领长袖T恤HG2027,韩都衣舍,?HSTYLE女装
1008001029,服饰、鞋、包|女装|长袖T恤,韩都衣舍春装新款女装字母印花V领修身长袖T恤NG1037 ,您所在的位置 > 韩都衣舍 > HSTYLE女装 > 上装 > T恤/打底衫 > 韩都衣舍春装新款女装字母印花V领修身长袖T恤NG1037,韩都衣舍,?HSTYLE女装
1008001029,服饰、鞋、包|女装|长袖T恤,韩都衣舍春装新款女装中长款纯色V领修身长袖T恤GQ2088 ,您所在的位置 > 韩都衣舍 > HSTYLE女装 > 上装 > T恤/打底衫 > 韩都衣舍春装新款女装中长款纯色V领修身长袖T恤GQ2088,韩都衣舍,?HSTYLE女装
1008001029,服饰、鞋、包|女装|长袖T恤,韩都衣舍春装新款女装圆领修身条纹打底长袖T恤AA1079 ,您所在的位置 > 韩都衣舍 > HSTYLE女装 > 上装 > T恤/打底衫 > 韩都衣舍春装新款女装圆领修身条纹打底长袖T恤AA1079,韩都衣舍,?HSTYLE女装
1008001029,服饰、鞋、包|女装|长袖T恤,【限时秒杀】韩都衣舍春装新款女装圆领宽松长袖T恤JM3061 ,您所在的位置 > 韩都衣舍 > HSTYLE女装 > 上装 > T恤/打底衫 > 【限时秒杀】韩都衣舍春装新款女装圆领宽松长袖T恤JM3061,韩都衣舍,?会员专享
1008001029,服饰、鞋、包|女装|长袖T恤,女装两色韩版通勤圆领波点宽松拼接长袖T恤EQ2168【韩都衣舍 2014春装新款】 ,您所在的位置 > 韩都衣舍 > HSTYLE女装 > 上装 > T恤/打底衫 > 女装两色韩版通勤圆领波点宽松拼接长袖T恤EQ2168【韩都衣舍 2014春装新款】,韩都衣舍,?HSTYLE女装
1008001029,服饰、鞋、包|女装|长袖T恤,nibbuns尼班诗春装新品女装拉链拼贴长袖T恤WSZ3104 ,您所在的位置 > 韩都衣舍 > niBBuns女装 > 上装 > T恤 > nibbuns尼班诗春装新品女装拉链拼贴长袖T恤WSZ3104,韩都衣舍,?nibbuns女装
1008001029,服饰、鞋、包|女装|长袖T恤,卡熙琳娜 2013秋装新款 民族风 绣花 修身 花布拼接长袖T恤 ,服饰内衣、鞋靴运动>女装>T恤>卡熙琳娜,1号店,卡熙琳娜
1008001029,服饰、鞋、包|女装|长袖T恤,柏夕BOXI 2013秋装新款韩版中长款打底衫修身显瘦假两件套长袖T恤A078083 ,服饰内衣、鞋靴运动>女装>T恤>柏夕BOXI,1号店,柏夕BOXI
1008001029,服饰、鞋、包|女装|长袖T恤,HSTYLE/韩都衣舍 韩国2013秋装新款女圆领时尚印花显瘦长袖T恤NJ3067-0626⑥ ,服饰内衣、鞋靴童装>女装>T恤>HSTYLE/韩都衣舍,1号店,HSTYLE/韩都衣舍
1008001029,服饰、鞋、包|女装|长袖T恤,卓欧 2013秋装新款女装纯色长袖t恤女士蕾丝拼接修身T恤打底衫6B306005 ,服饰内衣、鞋靴童装>女装>T恤>卓欧,1号店,卓欧
1008001029,服饰、鞋、包|女装|长袖T恤,HodooAge 女装 春装新款 小动物全家福 韩版可爱女装长袖T恤 TL1007 ,服饰内衣、鞋靴童装>女装>T恤>HodooAge,1号店,HodooAge
1008001029,服饰、鞋、包|女装|长袖T恤, 帕菲儿童T恤 秋装2012新款大童上衣 全棉圆领荷叶边女童长袖T恤 ,商城首页 >商品列表 > 帕菲儿,为为网,帕菲儿
1008001029,服饰、鞋、包|女装|长袖T恤,HSTYLE/韩都衣舍 韩国2013秋冬装新款女装棉涤混纺打底纯色高领长袖T恤DU0494 ,所有分类>服饰内衣、鞋靴童装>女装>T恤>HSTYLE/韩都衣舍>HSTYLE/韩都衣...,1号店,HSTYLE/韩都衣舍
1008001029,服饰、鞋、包|女装|长袖T恤,Buyimamia/布衣妈咪 1111孕妇秋装新款 时尚韩版孕妇装 宽松萝莉卡通长袖t恤 孕妇上衣 ,所有分类>母婴用品、玩具>孕妈专区>孕妈服饰>孕妇上装/套装>Buyimamia/布衣妈咪>Buyimamia/...,1号店,Buyimamia/布衣妈咪
1008001029,服饰、鞋、包|女装|长袖T恤,女式青年西瓜红色时尚拼接撞色设计弧形下摆贴布口袋套头圆领长袖T恤DU3057【韩都衣舍 2014春装】 ,您所在的位置 > 韩都衣舍 > HSTYLE女装 > 上装 > T恤/打底衫 > 女式青年西瓜红色时尚拼接撞色设计弧形下摆贴布口袋套头圆领长袖T恤DU3057【韩都衣舍 2014春装】,韩都衣舍,?HSTYLE女装
1008001029,服饰、鞋、包|女装|长袖T恤,韩都衣舍秋装新款图案圆领长袖T恤DD0915FX ,您所在的位置 > 韩都衣舍 > HSTYLE女装 > 上装 > 秋·T恤 > 【不参与优惠】韩都衣舍秋装新款图案圆领长袖T恤DD0915FX,韩都衣舍,?会员专享
1008001029,服饰、鞋、包|女装|长袖T恤,【2倍积分】 女青年灰色白色通勤韩版猫头鹰印花拼接长袖T恤OU3036 【韩都衣舍?2014春装新款】 ,您所在的位置 > 韩都衣舍 > HSTYLE女装 > 上装 > T恤/打底衫 > 女青年灰色白色通勤韩版猫头鹰印花拼接长袖T恤OU3036 【韩都衣舍?2014春装新款】,韩都衣舍,?HSTYLE女装
1008001029,服饰、鞋、包|女装|长袖T恤,素缕souline 2014年春装新款圆领纯色宽松文艺长袖T恤SL413035媫 ,您所在的位置 > 韩都衣舍 > HSTYLE女装 > 上装 > T恤/打底衫 > 素缕souline 2014年春装新款圆领纯色宽松文艺长袖T恤SL413035媫,韩都衣舍,?SOULINE素缕
1008001029,服饰、鞋、包|女装|长袖T恤,女装灰色韩版通勤时尚圆领卡通图案长袖T恤MR3018【韩都衣舍 2014春装新款】 ,您所在的位置 > 韩都衣舍 > HSTYLE女装 > 上装 > T恤/打底衫 > 女装灰色韩版通勤时尚圆领卡通图案长袖T恤MR3018【韩都衣舍 2014春装新款】,韩都衣舍,?HSTYLE女装
1008001029,服饰、鞋、包|女装|长袖T恤,女通勤韩版圆领套头细横条纹拼接镂空蕾丝蝙蝠袖长袖T恤DF3379【韩都衣舍 2014春装新款】 ,您所在的位置 > 韩都衣舍 > HSTYLE女装 > 上装 > T恤/打底衫 > 女通勤韩版圆领套头细横条纹拼接镂空蕾丝蝙蝠袖长袖T恤DF3379【韩都衣舍 2014春装新款】,韩都衣舍,?HSTYLE女装
1008001029,服饰、鞋、包|女装|长袖T恤,女灰色韩版圆领镂空绣花显瘦长袖T恤HO3300【韩都衣舍 2014春装新款】 ,您所在的位置 > 韩都衣舍 > HSTYLE女装 > 上装 > T恤/打底衫 > 女灰色韩版圆领镂空绣花显瘦长袖T恤HO3300【韩都衣舍 2014春装新款】,韩都衣舍,?HSTYLE女装
1008001029,服饰、鞋、包|女装|长袖T恤,女时尚两色秋新款女圆领条纹蕾丝拼接长袖T恤NJ4025【韩都衣舍 2014秋装新款】 ,您所在的位置 > 韩都衣舍 > HSTYLE女装 > 上装 > T恤/打底衫 > 女时尚两色秋新款女圆领条纹蕾丝拼接长袖T恤NJ4025【韩都衣舍 2014秋装新款】,韩都衣舍,?HSTYLE女装
1008001029,服饰、鞋、包|女装|长袖T恤,中老年女装妈妈装中年女宽松长袖T恤FQ4014【迪葵纳 2014秋装新款】 ,您所在的位置 > 韩都衣舍 > Dequanna迪葵纳 > 上装 > T恤 > 中老年女装妈妈装中年女宽松长袖T恤FQ4014【迪葵纳 2014秋装新款】,韩都衣舍,?Dequanna迪葵纳
1008001029,服饰、鞋、包|女装|长袖T恤,女装多色可选欧美街头时尚纯色长袖T恤WBZ4207【nibbuns 2014秋装新款】 ,您所在的位置 > 韩都衣舍 > niBBuns女装 > 上装 > 秋·T恤 > 女装多色可选欧美街头时尚纯色长袖T恤WBZ4207【nibbuns 2014秋装新款】,韩都衣舍,?nibbuns女装
1008001029,服饰、鞋、包|女装|长袖T恤,女装黑色时尚撞色拼接印花长袖T恤JP4063【韩都衣舍 2014秋装新款】 ,您所在的位置 > 韩都衣舍 > HSTYLE女装 > 上装 > 秋·T恤 > 女装黑色时尚撞色拼接印花长袖T恤JP4063【韩都衣舍 2014秋装新款】,韩都衣舍,?HSTYLE女装
1008001029,服饰、鞋、包|女装|长袖T恤,女装灰色时尚欧美印花拼接套头长袖T恤WEZ4515【NIBBUNS 2014年秋季新款】 ,您所在的位置 > 韩都衣舍 > niBBuns女装 > 上装 > 秋·T恤 > 女装灰色时尚欧美印花拼接套头长袖T恤WEZ4515【NIBBUNS 2014年秋季新款】,韩都衣舍,?nibbuns女装
1008001029,服饰、鞋、包|女装|长袖T恤,（实拍）包邮2014秋冬装女装韩版宽松大码卡通小狗条纹宽松长袖T恤 ,服装?>?女士服装?>?T恤?>?（实拍）包邮2014秋冬装女装韩版宽松大码卡通小狗条纹宽松长袖T...,当当网,Chrewlly
1008001029,服饰、鞋、包|女装|长袖T恤,女式灰色韩版街头个性字母印花拼接假两件中长款长袖T恤AA4004【韩都衣舍 2014秋款】 ,您所在的位置 > 韩都衣舍 > HSTYLE女装 > 上装 > 秋·T恤 > 女式灰色韩版街头个性字母印花拼接假两件中长款长袖T恤AA4004【韩都衣舍 2014秋款】,韩都衣舍,?HSTYLE女装
1008001029,服饰、鞋、包|女装|长袖T恤,女装黑色时尚圆领印花收腰长袖T恤AA3419【韩都衣舍 2014秋冬新款】 ,您所在的位置 > 韩都衣舍 > HSTYLE女装 > 上装 > 秋·T恤 > 女装黑色时尚圆领印花收腰长袖T恤AA3419【韩都衣舍 2014秋冬新款】,韩都衣舍,?HSTYLE女装
1008001029,服饰、鞋、包|女装|长袖T恤,韩都衣舍春装新款女装纯色直筒常规款长袖T恤MM2178 ,您所在的位置 > 韩都衣舍 > HSTYLE女装 > 上装 > T恤/打底衫 > 韩都衣舍春装新款女装纯色直筒常规款长袖T恤MM2178,韩都衣舍,?HSTYLE女装
1008001029,服饰、鞋、包|女装|长袖T恤,韩都衣舍春装装新款圆领拼接长袖T恤DU2235 ,您所在的位置 > 韩都衣舍 > HSTYLE女装 > 上装 > T恤/打底衫 > 韩都衣舍春装装新款圆领拼接长袖T恤DU2235,韩都衣舍,?HSTYLE女装
1008001029,服饰、鞋、包|女装|长袖T恤、绒衫,韩都衣舍新品女款甜美圆领拼接长袖T恤JS2097 ,您所在的位置 > 韩都衣舍 > HSTYLE女装 > 上装 > T恤/打底衫 > 韩都衣舍新品女款甜美圆领拼接长袖T恤JS2097,韩都衣舍,?HSTYLE女装
1008001029,服饰、鞋、包|女装|长袖T恤,韩都衣舍春装新品女装不规则纯色宽松长袖T恤NJ2045 ,您所在的位置 > 韩都衣舍 > HSTYLE女装 > 上装 > T恤/打底衫 > 韩都衣舍春装新品女装不规则纯色宽松长袖T恤NJ2045,韩都衣舍,?HSTYLE女装
1008001029,服饰、鞋、包|女装|长袖T恤,【爆款特卖】韩都衣舍春装新款女装韩版可爱硬挺贴布宽松长袖T恤JS2152 ,您所在的位置 > 韩都衣舍 > HSTYLE女装 > 上装 > T恤/打底衫 > 【爆款特卖】韩都衣舍春装新款女装韩版可爱硬挺贴布宽松长袖T恤JS2152,韩都衣舍,?HSTYLE女装
1008001029,服饰、鞋、包|女装|长袖T恤,印花抽摺长袖T恤 ,您所在的位置 > 韩都衣舍 > HSTYLE女装 > 上装 > T恤/打底衫 > 印花抽摺长袖T恤,韩都衣舍,?HSTYLE女装
1008001029,服饰、鞋、包|女装|长袖T恤,韩都衣舍春装新款女装圆领宽松长袖T恤NN3265L01 ,您所在的位置 > 韩都衣舍 > HSTYLE女装 > 上装 > T恤/打底衫 > 韩都衣舍春装新款女装圆领宽松长袖T恤NN3265L01,韩都衣舍,?HSTYLE女装
1008001029,服饰、鞋、包|女装|长袖T恤,【限时秒杀】韩都衣舍春装新款女装宽松V领拼接长袖T恤HH3023 ,您所在的位置 > 韩都衣舍 > HSTYLE女装 > 上装 > T恤/打底衫 > 【限时秒杀】韩都衣舍春装新款女装宽松V领拼接长袖T恤HH3023,韩都衣舍,?HSTYLE女装
1008001029,服饰、鞋、包|女装|长袖T恤,韩都衣舍秋装新款女装中长款蝙蝠长袖T恤GW3502 ,您所在的位置 > 韩都衣舍 > HSTYLE女装 > 上装 > 秋·T恤 > 韩都衣舍秋装新款女装中长款蝙蝠长袖T恤GW3502,韩都衣舍,?HSTYLE女装
1008001029,服饰、鞋、包|女装|长袖T恤,韩都衣舍春装新款女装纯色圆领长袖T恤EK2388 ,您所在的位置 > 韩都衣舍 > HSTYLE女装 > 上装 > T恤/打底衫 > 韩都衣舍春装新款女装纯色圆领长袖T恤EK2388,韩都衣舍,?HSTYLE女装
1008001029,服饰、鞋、包|女装|长袖T恤,HSTYLE/韩都衣舍 韩国2013秋装新款女拼接修身娃娃领长袖T恤DU3024-0814② ,服饰内衣、鞋靴运动>女装>T恤>HSTYLE/韩都衣舍,1号店,HSTYLE/韩都衣舍
1008001029,服饰、鞋、包|女装|长袖T恤,合伙新梦想 2013年上衣新款甜美女印花长袖T恤修身圆领打底衫大10-8027 ,服饰内衣、鞋靴童装>女装>T恤>合伙新梦想,1号店,合伙新梦想
1008001029,服饰、鞋、包|女装|长袖T恤,乐卡索 中老年服装时尚丝巾领雪纺袖长袖t恤中年女装妈妈秋装L133110518 ,服饰内衣、鞋靴童装>女装>中老年服饰>乐卡索,1号店,乐卡索
1008001029,服饰、鞋、包|女装|长袖T恤,HSTYLE/韩都衣舍 韩国2013秋装新款女装纯色圆领蕾丝长袖T恤HO1276 ,服饰内衣、鞋靴童装>女装>T恤>HSTYLE/韩都衣舍,1号店,HSTYLE/韩都衣舍
1008001029,服饰、鞋、包|女装|长袖T恤,HSTYLE/韩都衣舍 韩国2013秋冬装新款女装棉混纺修身长袖T恤LD1101L01 ,服饰内衣、鞋靴童装>女装>T恤>HSTYLE/韩都衣舍,1号店,HSTYLE/韩都衣舍
1008001029,服饰、鞋、包|女装|长袖T恤,乐卡索 2012春夏 圆领亮片长袖T恤 中老年时尚妈妈装NFL0830CT ,服饰内衣、鞋靴童装>女装>中老年服饰>乐卡索,1号店,乐卡索
1008001029,服饰、鞋、包|女装|长袖T恤, 新款撞色条纹长袖T恤商务休闲长袖POLO衫BM21001405 ,商城首页 >商品列表 > Biosoft拜柔,为为网,Biosoft拜柔
1008001029,服饰、鞋、包|女装|长袖T恤,Buyimamia/布衣妈咪 1111孕妇秋装新款 时尚韩版孕妇装宽松女棉卡通贵大嘴猴长袖t恤 孕妇上衣 ,所有分类>母婴用品、玩具>孕妈专区>孕妈服饰>孕妇上装/套装>Buyimamia/布衣妈咪>Buyimamia/...,1号店,Buyimamia/布衣妈咪
1008001029,服饰、鞋、包|女装|长袖T恤,卡熙琳娜 2013秋装新款 民族风绣花修身显瘦 花布拼接长袖T恤 ,所有分类>服饰内衣、鞋靴童装>女装>T恤>卡熙琳娜>卡熙琳娜 2013秋...,1号店,卡熙琳娜
1008001029,服饰、鞋、包|女装|长袖T恤,Qianbusha/千步沙 2013秋冬新款大码女装韩版V领蝙蝠衫韩国显瘦字母长款长袖T恤 ,所有分类>服饰内衣、鞋靴童装>女装>T恤>Qianbusha/千步沙>Qianbusha/...,1号店,Qianbusha/千步沙
1008001029,服饰、鞋、包|女装|长袖T恤,LadyCloud/女人云 2013秋装 超修身 绣花 纯棉 长袖T恤 打底衫 雀舞 ,所有分类>服饰内衣、鞋靴童装>女装>T恤>LadyCloud/女人云>LadyCloud/...,1号店,LadyCloud/女人云
1008001029,服饰、鞋、包|女装|长袖T恤,妖精de狂欢 2013秋冬新款韩版女金丝绒网纱加绒打底衫PU皮长袖T恤 ,所有分类>服饰内衣、鞋靴童装>女装>T恤>妖精de狂欢>妖精de狂欢 201...,1号店,妖精de狂欢
1008001029,服饰、鞋、包|女装|长袖T恤,BOTUDISHA/柏图蒂莎 2013秋冬款韩版时尚金丝绒加绒加厚网纱打底衫大码长袖T恤2536 ,所有分类>服饰内衣、鞋靴童装>女装>T恤>BOTUDISHA/柏图蒂莎>BOTUDISHA/...,1号店,BOTUDISHA/柏图蒂莎
1008001029,服饰、鞋、包|女装|长袖T恤,素缕Souline 2014秋文艺V领做旧女士长袖T恤SL6204 ,您所在的位置 > 韩都衣舍 > SOULINE素缕 > 上装 > T恤 > 素缕Souline 2014秋文艺V领做旧女士长袖T恤SL6204,韩都衣舍,?SOULINE素缕
1008001029,服饰、鞋、包|女装|长袖T恤,女藏蓝色韩版街头休闲翻领蕾丝拼接长袖T恤GJ3322【韩都衣舍2014春装新款】 ,您所在的位置 > 韩都衣舍 > HSTYLE女装 > 上装 > T恤/打底衫 > 女藏蓝色韩版街头休闲翻领蕾丝拼接长袖T恤GJ3322【韩都衣舍2014春装新款】,韩都衣舍,?HSTYLE女装
1008001029,服饰、鞋、包|女装|长袖T恤,字母蝙蝠长袖T恤 ,您所在的位置 > 韩都衣舍 > HSTYLE女装 > 上装 > T恤/打底衫 > 字母蝙蝠长袖T恤,韩都衣舍,?HSTYLE女装
1008001029,服饰、鞋、包|女装|长袖T恤,迪葵纳2014中老年女装中年秋装妈妈装长袖T恤WQ3287【迪葵纳 2014夏装新款】 ,您所在的位置 > 韩都衣舍 > Dequanna迪葵纳 > 上装 > T恤 > 迪葵纳2014中老年女装中年秋装妈妈装长袖T恤WQ3287【迪葵纳 2014夏装新款】,韩都衣舍,?Dequanna迪葵纳
1008001029,服饰、鞋、包|女装|长袖T恤,女式蓝色韩版条纹园领镂空长袖T恤HH4193【韩都衣舍 2014秋装新款】 ,您所在的位置 > 韩都衣舍 > HSTYLE女装 > 上装 > 秋·T恤 > 女式蓝色韩版条纹园领镂空长袖T恤HH4193【韩都衣舍 2014秋装新款】,韩都衣舍,?HSTYLE女装
1008001029,服饰、鞋、包|女装|长袖T恤,女装白色青年时尚蕾丝镂空长袖T恤LF3269【韩都衣舍 2014秋装新款】 ,您所在的位置 > 韩都衣舍 > HSTYLE女装 > 上装 > 秋·T恤 > 女装白色青年时尚蕾丝镂空长袖T恤LF3269【韩都衣舍 2014秋装新款】,韩都衣舍,?HSTYLE女装
1008001029,服饰、鞋、包|女装|长袖T恤,女韩都衣舍韩版2014秋装新款女装宽松印花拼接长袖T恤DQ3585【韩都衣舍 2014秋装新款】 ,您所在的位置 > 韩都衣舍 > HSTYLE女装 > 上装 > 秋·T恤 > 女韩都衣舍韩版2014秋装新款女装宽松印花拼接长袖T恤DQ3585【韩都衣舍 2014秋装新款】,韩都衣舍,?HSTYLE女装
1008001029,服饰、鞋、包|女装|长袖T恤,女两色韩版通勤直筒单件常规数字印花棉拼接圆领长袖T恤OI3046【韩都衣舍 2014秋装新款】 ,您所在的位置 > 韩都衣舍 > HSTYLE女装 > 上装 > 秋·T恤 > 女两色韩版通勤直筒单件常规数字印花棉拼接圆领长袖T恤OI3046【韩都衣舍 2014秋装新款】,韩都衣舍,?HSTYLE女装
1008001029,服饰、鞋、包|女装|长袖T恤,女装黑色时尚圆领蕾丝拼接直筒长袖T恤YQ3484【韩都衣舍 2014秋装新款】 ,您所在的位置 > 韩都衣舍 > HSTYLE女装 > 上装 > 秋·T恤 > 女装黑色时尚圆领蕾丝拼接直筒长袖T恤YQ3484【韩都衣舍 2014秋装新款】,韩都衣舍,?HSTYLE女装
1008001029,服饰、鞋、包|女装|长袖T恤,大码女装黑色韩版胖mm花色字母钩花镂空单件宽松圆领套头棉印花长袖T恤FB4034【范奎恩 2014秋装新款】 ,您所在的位置 > 韩都衣舍 > Forqueens范奎恩 > 上装 > T恤 > 大码女装黑色韩版胖mm花色字母钩花镂空单件宽松圆领套头棉印花长袖T恤FB4034【范奎恩 2014秋装新款】,韩都衣舍,?Forqueens范奎恩
1008001029,服饰、鞋、包|女装|长袖T恤,韩都衣舍春装新款女装条纹中长款宽松长袖T恤JN2166 ,您所在的位置 > 韩都衣舍 > HSTYLE女装 > 上装 > T恤/打底衫 > 韩都衣舍春装新款女装条纹中长款宽松长袖T恤JN2166,韩都衣舍, HSTYLE女装
1008001029,服饰、鞋、包|女装|长袖T恤,圆领头像长袖T恤 ,您所在的位置 > 韩都衣舍 > HSTYLE女装 > 上装 > T恤/打底衫 > 圆领头像长袖T恤,韩都衣舍, HSTYLE女装
1008001029,服饰、鞋、包|女装|长袖T恤,韩都衣舍秋装新款女装宽松圆领长袖T恤MM2118 ,您所在的位置 > 韩都衣舍 > HSTYLE女装 > 上装 > T恤/打底衫 > 韩都衣舍秋装新款女装宽松圆领长袖T恤MM2118,韩都衣舍, HSTYLE女装
1008001029,服饰、鞋、包|女装|长袖T恤,蕾丝拼接修身长袖T恤 ,您所在的位置 > 韩都衣舍 > HSTYLE女装 > 上装 > T恤/打底衫 > 蕾丝拼接修身长袖T恤,韩都衣舍, HSTYLE女装
1008001029,服饰、鞋、包|女装|长袖T恤,女装圆领中长款长袖T恤 ,您所在的位置 > 韩都衣舍 > HSTYLE女装 > 上装 > T恤/打底衫 > 女装圆领中长款长袖T恤,韩都衣舍, HSTYLE女装
1008001029,服饰、鞋、包|女装|长袖T恤,韩都衣舍夏装新款女装薄款防晒印花长袖T恤GJ1391 ,您所在的位置 > 韩都衣舍 > HSTYLE女装 > 上装 > T恤/打底衫 > 韩都衣舍夏装新款女装薄款防晒印花长袖T恤GJ1391,韩都衣舍, HSTYLE女装
1008001029,服饰、鞋、包|女装|长袖T恤,时尚字母长袖T恤 ,您所在的位置 > 韩都衣舍 > HSTYLE女装 > 上装 > T恤/打底衫 > 时尚字母长袖T恤,韩都衣舍, HSTYLE女装
1008001029,服饰、鞋、包|女装|长袖T恤,韩都衣舍韩版春装新款女装纯色连帽修身打底长袖T恤DU0153 ,您所在的位置 > 韩都衣舍 > HSTYLE女装 > 上装 > T恤/打底衫 > 韩都衣舍韩版春装新款女装纯色连帽修身打底长袖T恤DU0153,韩都衣舍, HSTYLE女装
1008001029,服饰、鞋、包|女装|长袖T恤,韩都衣舍春装新款女装宽松粗横条纹长袖T恤LD3005 ,您所在的位置 > 韩都衣舍 > HSTYLE女装 > 上装 > T恤/打底衫 > 韩都衣舍春装新款女装宽松粗横条纹长袖T恤LD3005,韩都衣舍, HSTYLE女装
1008001029,服饰、鞋、包|女装|长袖T恤,nibbuns尼班诗欧美春装新款女装修身V领拉链长袖T恤WFZ3502 ,您所在的位置 > 韩都衣舍 > niBBuns女装 > 上装 > T恤 > nibbuns尼班诗欧美春装新款女装修身V领拉链长袖T恤WFZ3502,韩都衣舍, nibbuns女装
1008001029,服饰、鞋、包|女装|长袖T恤,韩都衣舍秋装新款女装宽松大码印花长袖T恤MI2143 ,您所在的位置 > 韩都衣舍 > HSTYLE女装 > 上装 > T恤/打底衫 > 韩都衣舍秋装新款女装宽松大码印花长袖T恤MI2143,韩都衣舍, HSTYLE女装
1008001029,服饰、鞋、包|女装|长袖T恤,婴唯儿宝宝长袖T恤Y10DB13682米色100(品牌婴唯儿)&nbsp; ,首页 > 宝宝服饰 > 宝宝外出服,母婴之家,婴唯儿
1008001029,服饰、鞋、包|女装|长袖T恤,韩都衣舍2014春装新款女装韩版休闲圆领条纹长袖T恤HO310 ,您所在的位置 > 韩都衣舍 > HSTYLE女装 > 上装 > T恤/打底衫 > 韩都衣舍2014春装新款女装韩版休闲圆领条纹长袖T恤HO310,韩都衣舍, HSTYLE女装
1008001029,服饰、鞋、包|女装|长袖T恤,尚俪佳人 2013秋装新款女装 韩版时尚潮流长袖T恤 针织衫 三款 ,服饰内衣、鞋靴童装>女装>T恤>尚俪佳人,1号店,尚俪佳人
1008001029,服饰、鞋、包|女装|长袖T恤,沃家/wohome 秋装圆领格子拼接街头宽松长袖T恤 T301 ,服饰内衣、鞋靴童装>女装>T恤>沃家/wohome,1号店,沃家/wohome
1008001029,服饰、鞋、包|女装|长袖T恤,TAOYEE 2013秋冬新款民族风文艺范下摆开叉压褶长袖衬衫纯天然棉麻亚麻长袖T恤衫 ,服饰内衣、鞋靴童装>女装>衬衫>TAOYEE,1号店,TAOYEE
1008001029,服饰、鞋、包|女装|长袖T恤,HSTYLE/韩都衣舍 韩国2013秋装新款女装纯色圆领蕾丝长袖T恤HO1276 ,服饰内衣、鞋靴童装>女装>T恤>HSTYLE/韩都衣舍,1号店,HSTYLE/韩都衣舍
1008001029,服饰、鞋、包|女装|长袖T恤,乐卡索 2012春夏 圆领亮片长袖T恤 中老年时尚妈妈装NFL0830CT ,服饰内衣、鞋靴童装>女装>中老年服饰>乐卡索,1号店,乐卡索
1008001029,服饰、鞋、包|女装|长袖T恤,LadyCloud/女人云 2013秋装新款 民族风 绣花 修身 花布拼接长袖T恤 ,所有分类>服饰内衣、鞋靴童装>女装>T恤>LadyCloud/女人云>LadyCloud/...,1号店,LadyCloud/女人云
1008001029,服饰、鞋、包|女装|长袖T恤,LadyCloud/女人云 2013秋装新款 假两件 撞色 灯笼袖 超修身 长袖t恤 ,所有分类>服饰内衣、鞋靴童装>女装>T恤>LadyCloud/女人云>LadyCloud/...,1号店,LadyCloud/女人云
1008001029,服饰、鞋、包|女装|长袖T恤,JOYSOPO/宅衣尚品 2013秋装新款中老年女装妈妈装 宽松大码中老年假两件上衣长袖T恤 ,所有分类>服饰内衣、鞋靴童装>女装>中老年服饰>JOYSOPO/宅衣尚品>JOYSOPO/宅衣...,1号店,JOYSOPO/宅衣尚品
