1008006008,服饰、鞋、包|女包|帆布包,CONPOREI真美惠基本款女士环保帆布包660002草莓,礼品箱包>潮流女包>手提包>真美惠（CONPOREI）>真美惠帆布包,京东商城,真美惠（CONPOREI）
1008006008,服饰、鞋、包|女包|帆布包,CONPOREI真美惠印花拉链女士大帆布包131003棕色,礼品箱包>潮流女包>手提包>真美惠（CONPOREI）>真美惠大帆布包,京东商城,真美惠（CONPOREI）
1008006008,服饰、鞋、包|女包|帆布包,CONPOREI 真美惠 夏威夷系列 海边漫步风情帆布包x5001-01 浅蓝色,首页 >箱包 >潮流女包 >单肩包 >CONPOREI 真美惠 海边漫步风情帆布包,vjia,CONPOREI
1008006008,服饰、鞋、包|女包|帆布包,春雷行动【优袋】优袋物语帆布包托特包休闲单肩包女士包包J0035010 浅米色,礼品箱包>潮流女包>单肩包>春雷行动【优袋】优袋物语帆布包托特包休闲...,京东商城,优袋物语
1008006008,服饰、鞋、包|女包|帆布包,喆代仁LE DECADE 新款帆布包帆布配牛皮男女通用手提包欧美时尚包包单肩包220412 军绿色 手提单肩,礼品箱包>潮流女包>手提包>喆代仁LE DECADE 新款帆布包帆布...,京东商城,众焱箱包
1008006008,服饰、鞋、包|女包|帆布包,路迪克2013新款英伦时尚潮女包 帆布包 手提斜挎包 特价热卖 包邮 草绿,礼品箱包>潮流女包>手提包>路迪克2013新款英伦时尚潮女包 帆布包...,京东商城,LDK箱包旗舰店
1008006008,服饰、鞋、包|女包|帆布包,Ben's Jiao's 本真情侣包 新款单肩斜挎包黑色帆布包休闲男女通用包7998-103 黑色（横款）,首页 >箱包 >潮流女包 >手提/斜跨包 >Ben's Jiao's 本真情侣包 新款单肩斜挎包黑色帆布包休闲男女通用包7998-103,vjia,本色娇姿情侣包旗舰店
1008006008,服饰、鞋、包|女包|帆布包,易秀 波西米亚风女士休闲单肩手提帆布包BFK009101 卡其色,首页 >箱包 >潮流女包 >单肩包 >易秀 波西米亚风女士休闲单肩手提帆布包BFK009101,vjia,易秀箱包旗舰店
1008006008,服饰、鞋、包|女包|帆布包,Ben's Jiao's 本真情侣包 休闲男女包帆布包 大容量手提斜挎包旅行出差包7998-104 橘红,首页 >箱包 >潮流女包 >手提/斜跨包 >Ben's Jiao's 本真情侣包 休闲男女包帆布包 大容量手提斜挎包旅行出差包7998-104,vjia,本色娇姿情侣包旗舰店
1008006008,服饰、鞋、包|女包|帆布包,Ben's Jiao's 本真情侣包 夏季女包单肩斜挎包 休闲帆布包大容量包520-101 卡其色,首页 >箱包 >精品男包 >单肩/斜挎包 >bensjiaos 本真情侣包 夏季女包单肩斜挎包 休闲帆布包大容量包520-101,vjia,本色娇姿情侣包旗舰店
1008006008,服饰、鞋、包|女包|帆布包,优袋物语 自然Ⅱ帆布包单肩包休闲女包时尚手袋韩版女包J0035109 雅致灰,首页 >箱包 >潮流女包 >单肩包 >优袋物语 自然Ⅱ帆布包单肩包休闲女包时尚手袋韩版女包J0035109,vjia,优袋旗舰店
1008006008,服饰、鞋、包|女包|帆布包,优袋物语 帆布包单肩包休闲女包时尚手袋学生包卡通可爱女包J0035039 米白色,首页 >箱包 >潮流女包 >单肩包 >优袋物语 帆布包单肩包休闲女包时尚手袋学生包卡通可爱女包J0035039,vjia,优袋旗舰店
1008006008,服饰、鞋、包|女包|帆布包,初刻CRUCCO 春夏新品 配饰 多功能拼接帆布包12AWFBB1006 米色,首页 >箱包 >潮流女包 >单肩/斜挎包 >初刻CRUCCO 春夏新品 配饰 多功能拼接帆布包12AWFBB1006,vjia,初刻CRUCCO
1008006008,服饰、鞋、包|女包|帆布包,越古单肩斜挎纯棉帆布包复古水杯IPAD韩版潮多功能多口袋男女6006 湖蓝,礼品箱包>潮流女包>斜挎包>越古（BACTIM）>越古单肩斜挎纯棉帆布包复古水杯IPAD韩...,京东商城,越古帆布包旗舰店
1008006008,服饰、鞋、包|女包|帆布包,优袋物语 优袋韩版帆布包单肩包休闲女包时尚手袋女士托特包B1002B50 黑色,首页 >箱包 >潮流女包 >单肩包 >优袋物语 优袋韩版帆布包单肩包休闲女包时尚手袋女士托特包B1002B50,vjia,优袋旗舰店
1008006008,服饰、鞋、包|女包|帆布包,易秀 韩版时尚帆布包 休闲女士单肩斜挎包BFK010461 枚红色,首页 >箱包 >潮流女包 >单肩/斜挎包 >易秀 韩版时尚帆布包 休闲女士单肩斜挎包BFK010461,vjia,易秀箱包旗舰店
1008006008,服饰、鞋、包|女包|帆布包,帆布派 新款韩版帆布包包复古单肩包斜跨包大包 PT01-7 军咖色,礼品箱包>潮流女包>单肩包>帆布派 新款韩版帆布包包复古单肩包斜跨包...,京东商城,帆布派
1008006008,服饰、鞋、包|女包|帆布包,出游季 易秀 2014新款欧美包帆布包单肩包女包休闲手提女款包包 BFK010571 卡其色,礼品箱包>潮流女包>单肩包>易秀>出游季 易秀 2014新款欧美包帆布包单...,京东商城,易秀箱包
1008006008,服饰、鞋、包|女包|帆布包,麦克棉花真皮配帆布欧美风女士单肩帆布包C803 深灰色,礼品箱包>潮流女包>单肩包>麦克棉花真皮配帆布欧美风女士单肩帆布包C...,京东商城,麦克棉花旗舰店
1008006008,服饰、鞋、包|女包|帆布包,艺汇家 民族风包包民族风情苗绣包帆布包手提包单肩包 夏花 H-4 货到付款,礼品箱包>潮流女包>单肩包>艺汇家>艺汇家 民族风包包民族风情苗绣包帆布包手...,京东商城,艺汇家
1008006008,服饰、鞋、包|女包|帆布包,出游季 易秀 女包帆布包休闲包潮流单肩斜跨包手提包韩版撞色女斜挎包 BFK010591 卡其色,礼品箱包>潮流女包>单肩包>易秀>出游季 易秀 女包帆布包休闲包潮流单肩斜...,京东商城,易秀箱包
1008006008,服饰、鞋、包|女包|帆布包,【麦克棉花】多袋帆布包韩版女包单肩包男包c839 黑色,礼品箱包>潮流女包>单肩包>【麦克棉花】多袋帆布包韩版女包单肩包男包...,京东商城,麦克棉花旗舰店
1008006008,服饰、鞋、包|女包|帆布包,丑奴儿 复古文艺韩版休闲旅行女帆布包手提挎斜单肩包 H6590 咖啡色 单肩/斜挎/手提,礼品箱包>潮流女包>单肩包>丑奴儿>丑奴儿 复古文艺韩版休闲旅行女帆布包手提...,京东商城,丑奴儿旗舰店
1008006008,服饰、鞋、包|女包|帆布包,BAKMK芭卡玛卡 K系列韩版帆布包 女包 单肩包 斜挎包 时尚女包手提包 FJ30 淑女咖啡色,礼品箱包>潮流女包>单肩包>BAKMK芭卡玛卡 K系列韩版帆布包 女...,京东商城,德龙锐霸箱包
1008006008,服饰、鞋、包|女包|帆布包,莎缇2012冬季新款欧美时尚帆布包百魅单肩女包9801-20,礼品箱包>潮流女包>单肩包>莎缇2012冬季新款欧美时尚帆布包百魅单...,京东商城,莎缇旗舰店
1008006008,服饰、鞋、包|女包|帆布包,木村耀司新款时尚学生双肩包电脑包帆布包3100 黄色,礼品箱包>潮流女包>双肩包>木村耀司（MCYS&JPN）>木村耀司新款时尚学生双肩包电脑包帆布包3...,京东商城,木村耀司旗舰店
1008006008,服饰、鞋、包|女包|帆布包,火部落女包2013新款韩版斜挎包帆布包A1446 银灰色,礼品箱包>潮流女包>斜挎包>火部落女包2013新款韩版斜挎包帆布包A...,京东商城,火部落官方旗舰店
1008006008,服饰、鞋、包|女包|帆布包,BAKMK芭卡玛卡 优雅淑女帆布包 时尚大容量子母包 单肩手提斜挎包B3012 红色,礼品箱包>潮流女包>斜挎包>BAKMK芭卡玛卡 优雅淑女帆布包 时尚...,京东商城,德龙锐霸箱包
1008006008,服饰、鞋、包|女包|帆布包,优袋物语 新款帆布包女包大包复古潮流单肩手提包女潮时尚女式包手拎拉链款J0054048 雅致灰,首页 >箱包 >潮流女包 >单肩包 >优袋物语 新款帆布包女包大包复古潮流单肩手提包女潮时尚女式包手拎拉链款J0054048,vjia,优袋旗舰店
1008006008,服饰、鞋、包|女包|帆布包,易秀 韩版女士单肩包斜跨包手提包 2013新款复古潮流休闲帆布包女包BFK010801 水洗黑,首页 >箱包 >潮流女包 >单肩包 >易秀 韩版女士单肩包斜跨包手提包 2013新款复古潮流休闲帆布包女包BFK010801,vjia,易秀箱包旗舰店
1008006008,服饰、鞋、包|女包|帆布包,牛皮肩带撞色帆布包 绿色,礼品箱包>潮流女包>单肩包>牛皮肩带撞色帆布包 绿色,京东商城,幸福里时尚女包直营店
1008006008,服饰、鞋、包|女包|帆布包,紫魅onemay 2013新款帆布包 学院双肩包三色 运动休闲包潮流背包男女多用B13F129 卡其色,礼品箱包>潮流女包>双肩包>紫魅onemay 2013新款帆布包 学...,京东商城,ONE MAY 韩国时尚包柜
1008006008,服饰、鞋、包|女包|帆布包,两用包 女韩版 帆布包潮酷风范新款单肩包斜挎复古时尚女包潮流女包 宝蓝,礼品箱包>潮流女包>单肩包>SANZI >两用包 女韩版 帆布包潮酷风范新款单肩包...,京东商城,sanzi旗舰店
1008006008,服饰、鞋、包|女包|帆布包,吉野帆布包休闲学生书包新款复古女包单肩包斜挎包时尚韩版大包女式包新款潮女包旅行包069A6 杏色,礼品箱包>潮流女包>单肩包>吉野>吉野帆布包休闲学生书包新款复古女包单肩包...,京东商城,吉野旗舰店
1008006008,服饰、鞋、包|女包|帆布包,吉野韩版女包学院风大包帆布包新款潮女包手提单肩包斜挎包休闲个性大包旅行包复古学生书包B03 黑色,礼品箱包>潮流女包>单肩包>吉野>吉野韩版女包学院风大包帆布包新款潮女包手...,京东商城,吉野旗舰店
1008006008,服饰、鞋、包|女包|帆布包,吉野帆布包韩版休闲女包手提单肩斜挎包时尚潮女式包多功能大包运动包加厚学院风旅行包318D2 黑色,礼品箱包>潮流女包>单肩包>吉野>吉野帆布包韩版休闲女包手提单肩斜挎包时尚...,京东商城,吉野旗舰店
1008006008,服饰、鞋、包|女包|帆布包,吉野学院风帆布包休闲包女士新款双肩包时尚背包韩版高中大学生书包加厚女包包旅行背包2011F 灰色,礼品箱包>潮流女包>双肩包>吉野>吉野学院风帆布包休闲包女士新款双肩包时尚...,京东商城,吉野旗舰店
1008006008,服饰、鞋、包|女包|帆布包,pink sheep 粉色绵羊 新款男士女士真皮疯马皮帆布包 学生书包单肩包斜挎包潮流休闲街头复古包6824 军绿色,首页 >箱包 >潮流女包 >单肩/斜挎包 >pink sheep 粉色绵羊 新款男士女士真皮疯马皮帆布包 学生书包单肩包斜挎包潮流休闲街头复古包6824,vjia,粉色绵羊潮流帽饰
1008006008,服饰、鞋、包|女包|帆布包,中艺美缤纷海棠系列帆布包女手提链条树叶图案Zhxjm0009 武汉 设计师品牌 杏色,礼品箱包>潮流女包>单肩包>中艺美（Zhongyimei）>中艺美缤纷海棠系列帆布包女手提链条树叶图...,京东商城,中艺美旗舰店
1008006008,服饰、鞋、包|女包|帆布包,乐沙儿FEIER系列帆布包包铆钉女包韩版新款单肩包斜挎包复古潮时尚女包F920 红色,礼品箱包>潮流女包>单肩包>乐沙儿（leshaer）>乐沙儿FEIER系列帆布包包铆钉女包韩版...,京东商城,尚洛皮具
1008006008,服饰、鞋、包|女包|帆布包,两用包 帆布包 手提包 帆布包 爆款 男单肩包女斜挎包日韩风范 挂包女包 梅红,礼品箱包>潮流女包>单肩包>SANZI >两用包 帆布包 手提包 帆布包 爆款 男...,京东商城,sanzi旗舰店
1008006008,服饰、鞋、包|女包|帆布包,城市公主帆布包新款个性手绘涂鸦情侣帆布斜挎包甜蜜爱情M-E169 米白+手绘 横款,礼品箱包>潮流女包>斜挎包>城市公主（Cityprincess）>城市公主帆布包新款个性手绘涂鸦情侣帆布斜...,京东商城,城市公主手绘箱包旗舰店
1008006008,服饰、鞋、包|女包|帆布包,漂流木韩版学生书包情侣帆布包双肩背包旅行包2142011 藏青,礼品箱包>潮流女包>双肩包>漂流木（driftwood）>漂流木韩版学生书包情侣帆布包双肩背包旅行...,京东商城,漂流木旗舰店
1008006008,服饰、鞋、包|女包|帆布包,啦芘妮 帆布包2013新款女包双背撞色潮女包日韩风范包包743 玫红,礼品箱包>潮流女包>双肩包>啦芘妮 帆布包2013新款女包双背撞色潮...,京东商城,阳春皮具
1008006008,服饰、鞋、包|女包|帆布包,城市公主小左小右爱情故事手绘帆布包情大容量双肩背包韩版个性旅行包YC-CB057,礼品箱包>潮流女包>双肩包>城市公主（Cityprincess）>城市公主小左小右爱情故事手绘帆布包情大容...,京东商城,城市公主手绘箱包旗舰店
1008006008,服饰、鞋、包|女包|帆布包,COACH 寇驰 女款帆布包 棕色 F15440,礼品箱包>潮流女包>单肩包>蔻驰（COACH）>COACH 寇驰 女款帆布包 棕色 F1...,京东商城,嘉乐国际
1008006008,服饰、鞋、包|女包|帆布包,dhh韩版2012新款撞色复古帆布包单肩包时尚女士包包小包斜挎包潮 玫红色,礼品箱包>潮流女包>单肩包>dhh韩版2012新款撞色复古帆布包单肩...,京东商城,dhh旗舰店
1008006008,服饰、鞋、包|女包|帆布包,麦克棉花韩版休闲素色帆布包斜挎包C627 宝蓝色,礼品箱包>潮流女包>斜挎包>麦克棉花韩版休闲素色帆布包斜挎包C627...,京东商城,麦克棉花旗舰店
1008006008,服饰、鞋、包|女包|帆布包,全城爱日韩可爱休闲包帆布包百搭女士手提包 单肩女包7213 图片色,礼品箱包>潮流女包>手提包>全城爱日韩可爱休闲包帆布包百搭女士手提包...,京东商城,全城爱
1008006008,服饰、鞋、包|女包|帆布包,城市公主 韩版创意卡通手绘帆布包优质高密度单肩包休闲女包F-K017 米白+手绘 竖款,礼品箱包>潮流女包>单肩包>城市公主（Cityprincess）>城市公主 韩版创意卡通手绘帆布包优质高密...,京东商城,城市公主手绘箱包旗舰店
1008006008,服饰、鞋、包|女包|帆布包,米蓝蒂铆钉帆布包包女包韩版2012新爆款单肩斜挎包时尚女式包002 米色,礼品箱包>潮流女包>单肩包>米蓝蒂铆钉帆布包包女包韩版2012新爆款...,京东商城,米蓝蒂旗舰店
1008006008,服饰、鞋、包|女包|帆布包,春款女包 易秀 韩版女背包帆布包双肩包潮学院风小背包学生书包双肩女包 BFB002031 黑色,礼品箱包>潮流女包>双肩包>易秀>春款女包 易秀 韩版女背包帆布包双肩包潮...,京东商城,易秀箱包
1008006008,服饰、鞋、包|女包|帆布包,米蓝蒂铆钉帆布包包女包韩版2012新爆款单肩斜挎包时尚女式包002 咖啡色,礼品箱包>潮流女包>单肩包>米蓝蒂>米蓝蒂铆钉帆布包包女包韩版2012新爆款...,京东商城,米蓝蒂旗舰店
1008006008,服饰、鞋、包|女包|帆布包,单肩包 女包 休闲旅行 时尚 韩版帆布包单肩包休闲包手提包印花 梅红,礼品箱包>潮流女包>单肩包>SANZI >单肩包 女包 休闲旅行 时尚 韩版帆布包...,京东商城,sanzi旗舰店
1008006008,服饰、鞋、包|女包|帆布包,易秀 韩版时尚女士帆布包 休闲单肩斜挎包BFK010591 卡其色,首页> 箱包> 女包> 单肩包> 易秀 韩版时尚女士帆布包 休闲单肩斜挎包BFK010591,凡客诚品,易秀
1008006008,服饰、鞋、包|女包|帆布包,DISNEY 迪士尼 米奇包包专柜正品帆布包手提斜挎撞色女包手袋 包包JF2024-02 白色,首页> 箱包> 女包> 单肩包> DISNEY迪士尼 米奇包包专柜正品帆布包手提斜挎撞色女包手袋JF2024-02,凡客诚品,Disney 迪士尼
1008006008,服饰、鞋、包|女包|帆布包,优袋物语帆布包包女包韩版2013夏季新款文艺小清新单肩包女潮手提J0034059 米色,首页> 箱包> 女包> 单肩包> 优袋物语帆布包包女包韩版2013夏季新款文艺小清新单肩包女潮手提J0034059,凡客诚品,优袋物语
1008006008,服饰、鞋、包|女包|帆布包,DISNEY 迪士尼 米奇包包专柜正品帆布包手提斜挎撞色女包手袋 包包JF2024-02 红色,首页> 箱包> 女包> 单肩包> DISNEY迪士尼 米奇包包专柜正品帆布包手提斜挎撞色女包手袋JF2024-02,凡客诚品,Disney 迪士尼
1008006008,服饰、鞋、包|女包|帆布包,紫洋2014新款清新学院风简单条纹帆布包 单肩包 书包女包6305 黄白条纹,礼品箱包>潮流女包>单肩包>紫洋united ants>紫洋2014新款清新学院风简单条纹帆布包...,京东商城,紫洋箱包旗舰店
1008006008,服饰、鞋、包|女包|帆布包,越古帆布包韩版女式休闲单肩斜挎女包学院派大中学生书包电脑包IPAD包6028 卡其,礼品箱包>潮流女包>斜挎包>越古（BACTIM）>越古帆布包韩版女式休闲单肩斜挎女包学院派...,京东商城,越古帆布包旗舰店
1008006008,服饰、鞋、包|女包|帆布包,易秀 欧美休闲女包大容量单肩包手提包简约帆布包BFK010941 卡其色,首页 >箱包 >潮流女包 >单肩包 >易秀 欧美休闲女包大容量单肩包手提包简约帆布包BFK010941,vjia,易秀箱包旗舰店
1008006008,服饰、鞋、包|女包|帆布包,卡伊娜KAYLENA防水帆布包个性涂鸦手提斜挎休闲女包韩版潮流小包K1350 蓝色/宝蓝色,礼品箱包>潮流女包>斜挎包>卡伊娜（KAYLENA）>卡伊娜KAYLENA防水帆布包个性涂鸦手...,京东商城,卡伊娜箱包官方旗舰店
1008006008,服饰、鞋、包|女包|帆布包,兔斯基新款单肩斜跨帆布包 撞色卡通时尚手提包 女生MM最爱 兔斯基-J008T001,礼品箱包>潮流女包>斜挎包>优袋物语（UFUKURO）>兔斯基新款单肩斜跨帆布包 撞色卡通时尚手...,京东商城,吉汇卡通吉祥物专卖店
1008006008,服饰、鞋、包|女包|帆布包,城市公主中国风蝶恋花牡丹图彩绘优质帆布包高密度厚实耐用时尚单肩包女F-K021 米白+手绘 竖款,礼品箱包>潮流女包>单肩包>城市公主（Cityprincess）>城市公主中国风蝶恋花牡丹图彩绘优质帆布包...,京东商城,城市公主手绘箱包旗舰店
1008006008,服饰、鞋、包|女包|帆布包,春款女包新款女式斜挎包韩版帆布包牛津复古时尚布包斜跨女布包包单肩搭盖褶皱女包防盗68 咖啡色,礼品箱包>潮流女包>斜挎包>OSER>春款女包新款女式斜挎包韩版帆布包牛津复古...,京东商城,灵星美包
1008006008,服饰、鞋、包|女包|帆布包,BAKMK芭卡玛卡 男女通用多功能帆布包 帆布双肩包 帆布单肩包手提包斜跨包 书包957 海蓝色,礼品箱包>潮流女包>单肩包>BAKMK芭卡玛卡 男女通用多功能帆布包...,京东商城,伊自尚EASTSUN
1008006008,服饰、鞋、包|女包|帆布包,啦芘妮 帆布包男女包包新款潮女单肩包手提斜挎包大包包大包 蓝色,礼品箱包>潮流女包>斜挎包>啦芘妮 帆布包男女包包新款潮女单肩包手提...,京东商城,阳春皮具
1008006008,服饰、鞋、包|女包|帆布包,卡伊娜女包防水帆布包 2013新款日韩风手提单肩斜挎包休闲书包K1349 蓝色/宝蓝色,礼品箱包>潮流女包>斜挎包>卡伊娜（KAYLENA）>卡伊娜女包防水帆布包 2013新款日韩风...,京东商城,卡伊娜箱包官方旗舰店
1008006008,服饰、鞋、包|女包|帆布包,优袋物语 2014新款兔斯基帆布包女包单肩包文艺小清新手提包拉链款正品原创品牌J004T007 帆布自然色,首页 >箱包 >潮流女包 >单肩包 >优袋物语 2014新款兔斯基帆布包女包单肩包文艺小清新手提包拉链款正品原创品牌J004T007,vjia,优袋旗舰店
1008006008,服饰、鞋、包|女包|帆布包,优袋物语 帆布包手袋帆布单肩包休闲女包音乐系列J003A001 米白色1,首页 >箱包 >潮流女包 >单肩包 >优袋物语 帆布包手袋帆布单肩包休闲女包音乐系列J003A001,vjia,优袋旗舰店
1008006008,服饰、鞋、包|女包|帆布包,FourOne 2013新款帆布包女式包大包 手提斜挎单肩包 潮 女9563 SOLE LOVE/红色,首页 >箱包 >潮流女包 >单肩/斜挎包 >FourOne 2013新款帆布包女式包大包 手提斜挎单肩包 潮 女9563,vjia,fourone旗舰店
1008006008,服饰、鞋、包|女包|帆布包,优袋物语 2014夏季新款帆布包休闲单肩包女包小清新女式包两用款J0021 帆布自然色1,首页 >箱包 >潮流女包 >单肩包 >优袋物语 2014夏季新款帆布包休闲单肩包女包小清新女式包两用款J0021,vjia,优袋旗舰店
1008006008,服饰、鞋、包|女包|帆布包,易秀 韩版女士单肩包斜跨包手提包 2014新款复古潮流休闲帆布包女包{新增颜色}BFK010801 柠檬黄,首页 >箱包 >潮流女包 >单肩包 >易秀 韩版女士单肩包斜跨包手提包 2014新款复古潮流休闲帆布包女包{新增颜色}BFK010801,vjia,易秀箱包旗舰店
1008006008,服饰、鞋、包|女包|帆布包,易秀 2013新款时尚女包帆布包女士包包单肩包韩版斜挎包休闲手提包 BFK010711,首页>皮具箱包>时尚女包>女士单肩包>易秀2013新款时尚女包帆布包女士...,苏宁,易秀
1008006008,服饰、鞋、包|女包|帆布包,易秀 新款女包印花帆布包休闲包手提包时尚单肩包大容量旅行包 BFK010391,首页>皮具箱包>时尚女包>女士单肩包>易秀新款女包印花帆布包休闲包手提包...,苏宁,易秀
1008006008,服饰、鞋、包|女包|帆布包,易秀 帆布包2013新款女包韩版潮女士包包单肩包斜挎包手提包休闲包包 BFK008406,首页>皮具箱包>时尚女包>女士单肩包>易秀帆布包2013新款女包韩版潮女...,苏宁,易秀
1008006008,服饰、鞋、包|女包|帆布包,吉野 2013新款旅行包帆布包韩版潮女单肩包斜挎包手提包休闲运动包女包包 318D2 军绿色,首页>皮具箱包>时尚女包>女士单肩包>吉野2013新款旅行包帆布包韩版潮...,苏宁,吉野
1008006008,服饰、鞋、包|女包|帆布包,城市公主江南水乡系列手绘涂鸦帆布包单肩包F-L010 米白+手绘,首页>皮具箱包>时尚女包>女士单肩包>城市公主江南水乡系列手绘涂鸦帆布包单...,苏宁,城市公主cityprincess
1008006008,服饰、鞋、包|女包|帆布包,易秀 帆布包斜挎包女包休闲单肩包韩版斜跨包潮学生女士包包 黑色,首页>皮具箱包>时尚女包>女士单肩包>易秀帆布包斜挎包女包休闲单肩包韩版...,苏宁,易秀
1008006008,服饰、鞋、包|女包|帆布包,泽优诚品 非主流潮女女包帆布包单肩包高雅气质休闲布包B3027A,箱包奢品>手提包>泽优诚品>泽优诚品 非主流潮女女包帆布包单肩包高雅气质休闲布包B3027A,国美电器网上商城,泽优诚品旗舰店
1008006008,服饰、鞋、包|女包|帆布包,吉野 新款韩版女包休闲包加厚帆布包单肩包斜挎包手提包潮女大包健身运动包旅行包男包女包212B 黑灰色,首页>皮具箱包>功能箱包>旅行包>吉野新款韩版女包休闲包加厚帆布包单...,苏宁,
1008006008,服饰、鞋、包|女包|帆布包,易秀 新款女包韩版卡通图案休闲帆布包单肩斜挎包手提包(橙红色),箱包奢品>单肩包>易秀>易秀 新款女包韩版卡通图案休闲帆布包单肩斜挎包手提包(橙红色),国美电器网上商城,易秀箱包旗舰店
1008006008,服饰、鞋、包|女包|帆布包,易秀 新款女包 韩版帆布包 单肩斜挎包 可爱小包女潮流清新包(紫色),箱包奢品>斜挎包>易秀>易秀 新款女包 韩版帆布包 单肩斜挎包 可爱小包女潮流清新包(紫色),国美电器网上商城,易秀箱包旗舰店
1008006008,服饰、鞋、包|女包|帆布包,易秀 女包新款潮韩版帆布包女学生单肩包手提包女斜挎包复古包(玫红色),箱包奢品>手提包>易秀>易秀 女包新款潮韩版帆布包女学生单肩包手提包女斜挎包复古包(玫红色),国美电器网上商城,易秀箱包旗舰店
1008006008,服饰、鞋、包|女包|帆布包,春款女包 易秀 韩版帆布包 多口袋双背法帆布包斜跨包女包 BFK010861 雅致黑,礼品箱包>潮流女包>单肩包>易秀>春款女包 易秀 韩版帆布包 多口袋双背法...,京东商城,易秀箱包
1008006008,服饰、鞋、包|女包|帆布包,泽优诚品 2014新款女包多用包时尚单肩包手提包斜挎包帆布包印花包 A9456,首页>款式包>帆布>泽优诚品 2014新款女包多用包时尚单肩包手提包斜挎包帆布包印花包 A9456,乐蜂网,泽优诚品
1008006008,服饰、鞋、包|女包|帆布包,泽优诚品 新款单肩女包休闲高雅气质帆布包 B3027A,首页>款式包>帆布>泽优诚品 新款单肩女包休闲高雅气质帆布包 B3027A,乐蜂网,泽优诚品
1008006008,服饰、鞋、包|女包|帆布包,卡迪路菲帆布包 女包 单肩包 斜跨手提女士新款包包 韩版 潮 女 格纹 单肩包,礼品箱包>潮流女包>单肩包>卡迪路菲（kadilufei）>卡迪路菲帆布包 女包 单肩包 斜跨手提女...,京东商城,卡迪路菲旗舰店
1008006008,服饰、鞋、包|女包|帆布包,城市公主手会芦苇小妞个性卡通帆布包多功能提挎包M-E141 白色+手绘,首页>皮具箱包>时尚女包>女士斜挎包>城市公主手会芦苇小妞个性卡通帆布包多...,苏宁,城市公主(cityprincess)
1008006008,服饰、鞋、包|女包|帆布包,城市公主单车少女手绘韩国插画帆布包休闲百搭斜挎包M-E142 白色+手绘,首页>皮具箱包>时尚女包>女士斜挎包>城市公主单车少女手绘韩国插画帆布包休...,苏宁,城市公主(cityprincess)
1008006008,服饰、鞋、包|女包|帆布包,KAY LENA 卡伊娜 防水帆布包迷你韩版休闲百搭小包新品女包潮K1319 卡其色,首页 >箱包 >潮流女包 >单肩/斜挎包 >KAY LENA 卡伊娜 防水帆布包迷你韩版休闲百搭小包新品女包潮K1319,vjia,胡桃夹子箱包配饰商城
