1011003033,家用电器|厨房电器|刨冰机、碎冰机,夏季特价 家用刨冰机 炒冰机 手动刨冰碎冰机 刨冰,家居日用 > 厨房用品 > 厨房杂件 > 厨房配件 > 商品详情,当当网,博纳屋
1011003033,家用电器|厨房电器|刨冰机、碎冰机,Vitaland/威的 全自动家用刨冰机 制冰机 碎冰机 冰沙机 点压一秒即可出冰 VL-3006A,所有分类>大小家电、厨电、汽车>厨房电器>料理机及搅拌机>Vitaland/威的,1号店,料理机及搅拌机
1011003033,家用电器|厨房电器|刨冰机、碎冰机,天骏 TJ-718A 电动家用沙冰机 冰沙机小型碎冰机 雪花刨冰机,家居日用>其他用品>天骏小天使>天骏 TJ-718A 电动家用沙冰机 冰沙机小型碎冰机 雪花刨冰机,国美,天骏小天使
1011003033,家用电器|厨房电器|刨冰机、碎冰机,咏期 家用刨冰机（032）碎冰机 手动碎冰机 制冰机,厨具 > 厨用小工具 > 食物处理工具 > 凿冰器 小家电 > 厨房电器 > 刨冰机\冰激凌机,亚马逊(卓越网),咏期
1011003033,家用电器|厨房电器|刨冰机、碎冰机,天骏 小天使 电动刨冰机 TJ-718D 碎冰机,所有分类>大小家电、厨电、汽车>厨房电器>其它厨房电器>天骏>天骏 小天使 电动刨...,1号店,天骏
1011003033,家用电器|厨房电器|刨冰机、碎冰机,优芬 家用手动刨冰机 Ice Pro 碎冰机 制冰器 刨冰机,所有分类>家居家纺、锅具餐具>装饰/日用>其他生活日用品>优芬>优芬 家用手动刨冰机...,1号店,优芬
1011003033,家用电器|厨房电器|刨冰机、碎冰机,家乐宝 家用手动刨冰机 Ice Pro 碎冰机 制冰器,所有分类>家居家纺、锅具餐具>厨具锅具>厨房工具>其他厨房工具>家乐宝>家乐宝 家用手动刨冰...,1号店,家乐宝
1011003033,家用电器|厨房电器|刨冰机、碎冰机,天天享 家用手动刨冰机 制冰器,天天享>天天享 家用手动刨冰机 制冰器,京东商城,缤纷家居馆
1011003033,家用电器|厨房电器|刨冰机、碎冰机,冰雪家用刨冰机/碎冰机/炒冰机(031),当当网 > 家居日用 > 厨房用品 > 烹饪锅具 > 套装锅,当当网,振兴
1011003033,家用电器|厨房电器|刨冰机、碎冰机,路奈 家用手动刨冰机 Ice Pro 碎冰机 制冰器 刨冰机,所有分类>家居家纺、锅具餐具>厨具锅具>厨房工具>其他厨房工具>路奈>路奈 家用手动刨冰机...,1号店,路奈
1011003033,家用电器|厨房电器|刨冰机、碎冰机,天骏TJ-718B家用雪花刨冰机冰沙机小型碎冰机 电动绞冰机刨冰器,家用电器 > 厨房电器 > 酸奶机/冰淇淋机 > 商品详情,当当网,天骏小天使
1011003033,家用电器|厨房电器|刨冰机、碎冰机,朗路国际 家用全自动快速刨冰机/碎冰机 MD-108 官方特卖免邮【最低价亏本促销 数量有限售完为止】,小家电 > 厨房电器 > 刨冰机\冰激凌机,亚马逊(卓越网),朗路
1011003033,家用电器|厨房电器|刨冰机、碎冰机,日本one’family 电动刨冰机 冰沙机 碎冰机 刨冰机,音乐>文娱周边>居家日用>日本one’family电动刨冰机冰...,京东商城,$N
1011003033,家用电器|厨房电器|刨冰机、碎冰机,Vitaland/威的 VL-3006A刨冰机 全自动家用制冰/沙冰/碎冰机 全网首创 享受自制沙冰的乐趣,所有分类>大小家电、厨电、汽车>厨房电器>料理机及搅拌机>Vitaland/威的>Vitaland/威...,1号店,Vitaland/威的
1011003033,家用电器|厨房电器|刨冰机、碎冰机,天骏 电动刨冰机 碎冰机 冰沙机 绵绵冰机,首页 > 天骏TIJUMP电器专场 > 电动刨冰机 碎冰机 冰沙机 绵绵冰机,唯品会,无
1011003033,家用电器|厨房电器|刨冰机、碎冰机,家用手动刨冰机 Ice Pro 碎冰机 制冰器,楼龙(Loulong)>家用手动刨冰机 Ice Pro 碎冰机 ...,京东商城,圣唐家居馆
1011003033,家用电器|厨房电器|刨冰机、碎冰机,天骏 小天使 电动刨冰机 TJ-718D 碎冰机,所有分类>大小家电、厨电、汽车>厨房电器>其它厨房电器>天骏>天骏 小天使 电动刨...,1号店,天骏
1011003033,家用电器|厨房电器|刨冰机、碎冰机,伟丰WF-108商用电动大功率碎冰机 奶茶沙冰机雪花刨冰机 纯铝合金,家用电器 > 厨房电器 > 榨汁机/料理机 > 伟丰WF-108商用电动大功率碎冰机 奶茶沙冰机雪花刨冰机 纯铝合金,当当网,伟丰
1011003033,家用电器|厨房电器|刨冰机、碎冰机,天骏 小天使 电动刨冰机 TJ-718B 碎冰机,所有分类>大小家电、厨电、汽车>厨房电器>其它厨房电器>天骏>天骏 小天使 电动刨...,1号店,天骏
1011003033,家用电器|厨房电器|刨冰机、碎冰机,天骏 小天使 电动刨冰机 TJ-718A 碎冰机,所有分类>大小家电、厨电、汽车>厨房电器>其它厨房电器>天骏>天骏 小天使 电动刨...,1号店,天骏
1011003033,家用电器|厨房电器|刨冰机、碎冰机,楼龙 家用手动刨冰机 碎冰机 制冰器 刨冰机 颜色发货随机,楼龙(Loulong)>楼龙 家用手动刨冰机 碎冰机 制冰器 刨...,京东商城,缤纷家居馆
1011003033,家用电器|厨房电器|刨冰机、碎冰机,天骏 小天使 电动刨冰机 TJ-718C 碎冰机,所有分类>大小家电、厨电、汽车>厨房电器>其它厨房电器>天骏>天骏 小天使 电动刨...,1号店,天骏
1011003033,家用电器|厨房电器|刨冰机、碎冰机,众辰商用大容量 大功率 雪花状刨冰机 碎冰机 沙冰机 电动冰沙机,首页>厨卫电器生活电器>厨房小家电>其它厨房小家电>众辰商用大容量大功率雪花状刨冰机...,苏宁,众辰
1011003033,家用电器|厨房电器|刨冰机、碎冰机,家的感觉 家用刨冰机 炒冰机 手动刨冰碎冰机 DM-BJ2,所有分类>家居家纺、锅具餐具>厨具锅具>厨房工具>其他厨房工具>家的感觉>家的感觉 家用刨冰机...,1号店,家的感觉
1011003033,家用电器|厨房电器|刨冰机、碎冰机,自由城 家用手动刨冰机 Ice Pro 碎冰机 制冰器,家居日用 > 厨房用品 > 厨房杂件 > 厨房配件 > 商品详情,当当网,自由城
1011003033,家用电器|厨房电器|刨冰机、碎冰机,天骏 电动刨冰机 碎冰机 冰沙机 绵绵冰机,首页 > 天骏TIJUMP电器专场 > 电动刨冰机 碎冰机 冰沙机 绵绵冰机,唯品会,无
1011003033,家用电器|厨房电器|刨冰机、碎冰机,红兔子 家用手动刨冰机 碎冰机 制冰器 小型刨冰机,红兔子>红兔子 家用手动刨冰机 碎冰机 制冰器 ...,京东商城,缤纷家居馆
1011003033,家用电器|厨房电器|刨冰机、碎冰机,天骏 小天使 电动刨冰机 TJ-718A 碎冰机,所有分类>大小家电、厨电、汽车>厨房电器>其它厨房电器>天骏>天骏 小天使 电动刨...,1号店,天骏
1011003033,家用电器|厨房电器|刨冰机、碎冰机,家的感觉 家用大号刨冰机 碎冰机 刨冰器 夏日家庭必备,家居家装>家装软饰>其他>家的感觉 家用大号刨冰机 碎冰机 刨冰器...,京东商城,一品居家居店
1011003033,家用电器|厨房电器|刨冰机、碎冰机,天骏 小天使 电动刨冰机 TJ-718B 碎冰机,其它厨房电器 > 冰激凌机 > ,1号店,天骏
1011003033,家用电器|厨房电器|刨冰机、碎冰机,天骏 电动刨冰机 碎冰机 冰沙机 绵绵冰机,首页 > 天骏TIJUMP电器专场 > 电动刨冰机 碎冰机 冰沙机 绵绵冰机,唯品会,无
1011003033,家用电器|厨房电器|刨冰机、碎冰机,家用手动刨冰机 Ice Pro 碎冰机 制冰器 刨冰机 VIP84,家居日用 > 清洁护理 > 其它 > 商品详情,当当网,星空夏日
1011003033,家用电器|厨房电器|刨冰机、碎冰机,新款特价 商用电动大功率碎冰机 奶茶沙冰机 雪花刨冰机 纯铝合金,首页>厨卫电器生活电器>厨房小家电>商用厨房小家电>新款特价商用电动大功率碎冰机奶茶...,苏宁,健康莱
1011003033,家用电器|厨房电器|刨冰机、碎冰机,几米生活 家用手动刨冰机 Ice Pro 碎冰机 制冰器,所有分类>家居家纺、锅具餐具>厨具锅具>厨房工具>其他厨房工具>几米生活>几米生活 家用手动刨...,1号店,几米生活
1011003033,家用电器|厨房电器|刨冰机、碎冰机,家用手动刨冰机 Ice Pro 碎冰机 制冰器,家居日用 > 厨房用品 > 厨房杂件 > 厨房配件 > 商品详情,当当网,红兔子
1011003033,家用电器|厨房电器|刨冰机、碎冰机,红兔子 家用手动刨冰机 Ice Pro 碎冰机 制冰器 刨冰机,所有分类>家居家纺、锅具餐具>厨具锅具>厨房工具>其他厨房工具>红兔子>红兔子 家用手动刨冰...,1号店,红兔子
1011003033,家用电器|厨房电器|刨冰机、碎冰机,家乐宝 家用手动刨冰机 Ice Pro 碎冰机 制冰器-A,所有分类>家居家纺、锅具餐具>厨具锅具>厨房工具>其他厨房工具>家乐宝>家乐宝 家用手动刨冰...,1号店,家乐宝
1011003033,家用电器|厨房电器|刨冰机、碎冰机,朗路 LangLu/朗路国际 家用 极地电动刨冰机 碎冰机 沙冰机 全自动,所有分类>大小家电、厨电、汽车>厨房电器>料理机及搅拌机>朗路>朗路 LangLu/...,1号店,朗路
1011003033,家用电器|厨房电器|刨冰机、碎冰机,天骏 小天使 电动刨冰机 TJ-718B 碎冰机,所有分类>大小家电、厨电、汽车>厨房电器>其它厨房电器>天骏>天骏 小天使 电动刨...,1号店,天骏
1011003033,家用电器|厨房电器|刨冰机、碎冰机,祈和KS-10000 沙冰机 冰沙机 奶茶店碎冰机商用搅拌机 家用,首页>厨卫电器生活电器>厨房小家电>食品加工机/搅拌机>祈和KS-10000沙冰机冰沙机...,苏宁,祈和电器(KPS)
1011003033,家用电器|厨房电器|刨冰机、碎冰机,天天享 家用手动刨冰机 制冰器,厨具>烹饪锅具>厨用杂件>天天享>天天享 家用手动刨冰机 制冰器,京东商城,来此购生活馆
1011003033,家用电器|厨房电器|刨冰机、碎冰机,天骏 TJ-718A 电动家用沙冰机 冰沙机小型碎冰机 雪花刨冰机,家居日用>其他用品>天骏小天使>天骏 TJ-718A 电动家用沙冰机 冰沙机小型碎冰机 雪花刨冰机,国美电器网上商城,天骏小天使
1011003033,家用电器|厨房电器|刨冰机、碎冰机,钱龙 家用手动刨冰机 碎冰机 制冰器,厨具>烹饪锅具>厨用杂件>钱龙 家用手动刨冰机 碎冰机 制冰器,京东商城,钱龙旗舰店
1011003033,家用电器|厨房电器|刨冰机、碎冰机,家用手动刨冰机 碎冰机 制冰器,家居日用 > 厨房用品 > 厨房杂件 > 厨房配件 > 商品详情,当当网,天天享
1011003033,家用电器|厨房电器|刨冰机、碎冰机,客来美Climax HA-3508家用电动刨冰机,家用电器>厨房电器>其它厨房电器>客来美（climax）>客来美Climax HA-3508家用电...,京东商城,客来美电器旗舰店
1011003033,家用电器|厨房电器|刨冰机、碎冰机,天骏 小天使 电动刨冰机 TJ-718C 碎冰机,所有分类>大小家电、厨电、汽车>厨房电器>其它厨房电器>天骏>天骏 小天使 电动刨...,1号店,天骏
1011003033,家用电器|厨房电器|刨冰机、碎冰机,维特尔 家用手动刨冰机 Ice Pro 碎冰机 制冰器 刨冰机,所有分类>大小家电、厨电、汽车>厨房电器>料理机及搅拌机>维特尔>维特尔 家用手动刨冰...,1号店,维特尔
1011003033,家用电器|厨房电器|刨冰机、碎冰机,天骏  蓝色电动刨冰机碎冰机,冰沙机小型碎冰机雪花刨冰机,首页 > 天骏TIJUMP电器专场 > 蓝色电动刨冰机碎冰机,唯品会
