1011003010,家用电器|厨房电器|煮蛋器、蒸蛋器,生活日记 ZDQ-F6 蒸蛋器煮蛋器自动断电 情侣双层多功能 正品特价,家用电器?>?厨房电器?>?打蛋器/煮蛋器?>?商品详情,当当网,生活日记
1011003010,家用电器|厨房电器|煮蛋器、蒸蛋器,Bear 小熊 ZDQ-206 情侣不锈钢煮蛋器 煮蛋机蒸蛋器 自动断电小家电,小家电 > 厨房电器 > 蒸\煮锅 > 煮蛋器,亚马逊(卓越网),Bear 小熊
1011003010,家用电器|厨房电器|煮蛋器、蒸蛋器,居优乐 ZDQ-502 5个蛋孔家用多功能煮蛋器 蒸蛋器,生活电器、汽车生活>厨房电器>煮蛋器,1号店,居优乐
1011003010,家用电器|厨房电器|煮蛋器、蒸蛋器,Bear/小熊 ZDQ-2191 不锈钢多功能双层煮蛋器14个蛋蒸煮煎烙全能蒸蛋机电煎锅,所有分类>大小家电、厨电、汽车>厨房电器>煮蛋器>Bear/小熊>Bear/小熊 ZD...,1号店,Bear/小熊
1011003010,家用电器|厨房电器|煮蛋器、蒸蛋器,小熊 双层多功能蒸煎烙煮蛋器 14个蛋,首页?>?小熊电器专场?>?双层多功能蒸煎烙煮蛋器 14个蛋,唯品会,无
1011003010,家用电器|厨房电器|煮蛋器、蒸蛋器,天际 多功能煮蛋器 双层蒸蛋,首页?>?.天际TONZE电器专场?>?多功能煮蛋器 双层蒸蛋,唯品会,无
1011003010,家用电器|厨房电器|煮蛋器、蒸蛋器,优益 新品 Y-ZDQ3双层蒸蛋器 煮蛋器 煮蛋机自动断电,所有分类>大小家电、厨电、汽车>厨房电器>煮蛋器>优益>优益 新品 Y-ZD...,1号店,优益
1011003010,家用电器|厨房电器|煮蛋器、蒸蛋器,宜阁多功能煮蛋器 自动蛋卷机早餐机鸡蛋杯煮蛋大师 粉,首页>厨卫电器生活电器>厨房小家电>煮蛋器>宜阁多功能煮蛋器自动蛋卷机早餐机鸡...,苏宁,宜阁(EDEI)
1011003010,家用电器|厨房电器|煮蛋器、蒸蛋器,优益Y-ZDQ3双层蒸蛋器 煮蛋器 煮蛋机自动断电,生活电器 厨卫电器>打蛋器/煮蛋器>优益>优益Y-ZDQ3双层蒸蛋器 煮蛋器 煮蛋机自动断电,国美电器网上商城,奥帝尔电器专营店
1011003010,家用电器|厨房电器|煮蛋器、蒸蛋器,Bear/小熊 ZDQ-207GA煮蛋器蒸蛋器煎蛋器电煎蛋器多功能蒸蛋器防干烧自动断电,所有分类>大小家电、厨电、汽车>厨房电器>煮蛋器>Bear/小熊>Bear/小熊 ZD...,1号店,Bear/小熊
1011003010,家用电器|厨房电器|煮蛋器、蒸蛋器,Bear/小熊 煮蛋器|防干烧自动断电小熊煮蛋器ZDQ-205 包邮,当当网 > 家用电器 > 厨房电器 > 打蛋器/煮蛋器,当当网,$N
1011003010,家用电器|厨房电器|煮蛋器、蒸蛋器,富贵熊 全不锈钢 自动断电情侣 煮蛋器 可煮7个蛋 蒸蛋器 防干烧 自动断开,首页>厨卫电器生活电器>厨房小家电>煮蛋器>富贵熊全不锈钢自动断电情侣煮蛋...,苏宁,富贵熊
1011003010,家用电器|厨房电器|煮蛋器、蒸蛋器,益多 YD-888 多功能煮蛋器蒸蛋器/不锈钢发热盘,生活电器 厨卫电器>打蛋器/煮蛋器>益多（yiduo）>益多 YD-888 多功能煮蛋器蒸蛋器/不锈钢发热盘,国美电器网上商城,益多（yiduo）
1011003010,家用电器|厨房电器|煮蛋器、蒸蛋器,小熊 多功能蒸煎烙煮蛋器 7个蛋,蒸煮煎蛋，煎牛排，烙面饼，样样皆能,首页?>?小熊电器专场?>?多功能蒸煎烙煮蛋器 7个蛋,唯品会
1011003010,家用电器|厨房电器|煮蛋器、蒸蛋器,小熊 多功能双层煎烙煮蛋器 14个蛋 （橙黄色）ZDQ-2191 黄色,首页 >家用电器 >厨房电器 >煮蛋器 >小熊 多功能双层煎烙煮蛋器 14个蛋 （橙黄色）ZDQ-2191,vjia,时尚生活旗舰店
1011003010,家用电器|厨房电器|煮蛋器、蒸蛋器,Yoice/优益 Y-ZDQ6多功能煮鸡蛋器 煮蛋机全不锈钢 煎蛋器煎牛排(深卡其布色),生活电器 厨卫电器>打蛋器/煮蛋器>优益打蛋器/煮蛋器>Yoice/优益 Y-ZDQ6多功能煮鸡蛋器 煮蛋机全不锈钢 煎蛋器煎牛排(深卡其布色),国美,优益打蛋器/煮蛋器
1011003010,家用电器|厨房电器|煮蛋器、蒸蛋器,生活日记 ZDQ-Q5 煮蛋器 蒸蛋器 不锈钢 正品特价包邮,家居日用>其他工具>生活日记（shenghuoriji ）>生活日记 ZDQ-Q5 煮蛋器 蒸蛋器 不锈钢 正品特价包邮,国美,生活日记（shenghuoriji ）
1011003010,家用电器|厨房电器|煮蛋器、蒸蛋器,酷力 多功能情侣煮蛋器 不锈钢蒸蛋器 煮蛋机 自动断电 黄色,小家电 > 厨房电器 > 蒸\煮锅 > 煮蛋器,亚马逊(卓越网),酷力
1011003010,家用电器|厨房电器|煮蛋器、蒸蛋器,Bear小熊 煮蛋器 ZDQ-2112 (不锈钢碗，自动断电，还可蒸水蛋,紫色)(亚马逊独家订制),小家电 > 厨房电器 > 蒸\煮锅 > 煮蛋器,亚马逊(卓越网)
1011003010,家用电器|厨房电器|煮蛋器、蒸蛋器,索力浦正品slp-m3 多功能煮蛋器 自动断电 防干烧,首页>厨卫电器生活电器>厨房小家电>煮蛋器>索力浦正品slp-m3多功能煮蛋器...,苏宁,索力浦
1011003010,家用电器|厨房电器|煮蛋器、蒸蛋器,优益 Y-ZDQ3 双层蒸蛋器 煮蛋器煮蛋机自动断电,其他 > 其他,亚马逊(卓越网),优益
1011003010,家用电器|厨房电器|煮蛋器、蒸蛋器,天际 多功能煮蛋器 双层蒸蛋,更多容量 全家都有,首页?>?天际TONZE电器专场?>?多功能煮蛋器 双层蒸蛋,唯品会
1011003010,家用电器|厨房电器|煮蛋器、蒸蛋器,天际煮蛋器DZG-W405E 蒸蛋器 煮蛋机 自动断电,生活电器 厨卫电器>打蛋器/煮蛋器>天际（TONZE）>天际煮蛋器DZG-W405E 蒸蛋器 煮蛋机 自动断电,国美,天际（TONZE）
1011003010,家用电器|厨房电器|煮蛋器、蒸蛋器,GATES 意品自动断电多功能煮蛋器 (5个蛋容)蒸蛋器 米色,厨具>烹饪锅具>厨用杂件>GATES 意品自动断电多功能煮蛋器 ...,京东商城,贸号专营店
1011003010,家用电器|厨房电器|煮蛋器、蒸蛋器,Bear/小熊 ZDQ-212家用全自动煮蛋器 多功能迷你蒸蛋羹机早餐机 防自动断电 煮5个鸡蛋,所有分类>大小家电、厨电、汽车>厨房电器>煮蛋器>Bear/小熊,1号店,煮蛋器
1011003010,家用电器|厨房电器|煮蛋器、蒸蛋器,小浣熊 煮蛋 煎蛋 蒸食物多功能煮蛋器 HM-201 6个蛋附送蒸蛋架&量杯 (白色),小家电 > 厨房电器 > 蒸\煮锅 > 煮蛋器,亚马逊(卓越网),小浣熊
1011003010,家用电器|厨房电器|煮蛋器、蒸蛋器,小熊 ZDQ-2151 不锈钢多功能煮蛋器蒸蛋机制作蛋羹旋转控制定时蜂鸣提示 6个蛋,所有分类>大小家电、厨电、汽车>厨房电器>煮蛋器>小熊>小熊 ZDQ-2151 不锈钢多功能煮蛋器蒸蛋机制作蛋羹旋转控制定时蜂鸣提示 6个蛋,1号店,小熊
1011003010,家用电器|厨房电器|煮蛋器、蒸蛋器,胜道多功能煮蛋器自动蒸蛋器 早餐神器防干烧自动断电煮蛋机 一次最多可煮7个蛋，小小身材，大大容量  可蒸蛋羹、热包子，限量送不锈钢蒸碗,家用电器?>?厨房电器?>?打蛋器/煮蛋器?>?胜道多功能煮蛋器自动蒸蛋器?早餐神器防干烧自动断电煮蛋机?一次...,当当网,胜道
1011003010,家用电器|厨房电器|煮蛋器、蒸蛋器,生活日记 ZDQ-Q5 煮蛋器 蒸蛋器 自动断电 不锈钢 情侣 特价 包邮,家用电器?>?厨房电器?>?打蛋器/煮蛋器?>?商品详情,当当网,生活日记
1011003010,家用电器|厨房电器|煮蛋器、蒸蛋器,金满圆家用早餐神器多功能蒸蛋器煮蛋器包邮特价秒杀自动煮蛋大师,$N,淘宝网,$N
1011003010,家用电器|厨房电器|煮蛋器、蒸蛋器,幸福磨坊 EG3270S 煮蛋器 蒸蛋器 自动断电 情侣 正品,首页>厨卫电器生活电器>厨房小家电>煮蛋器>幸福磨坊EG3270S煮蛋器蒸...,苏宁,$N
1011003010,家用电器|厨房电器|煮蛋器、蒸蛋器,奥西美 PA-601多功能煮蛋器 煮蛋机蒸蛋器配送不锈钢碗,所有分类>大小家电、厨电、汽车>厨房电器>煮蛋器>奥西美>奥西美 PA-601...,1号店,奥西美
1011003010,家用电器|厨房电器|煮蛋器、蒸蛋器,生活日记 ZDQ-F1 煮蛋器 自动断电 蒸蛋器 不锈钢 情侣 包邮 特价,家居日用>其他工具>生活日记（shenghuoriji ）>生活日记 ZDQ-F1 煮蛋器 自动断电 蒸蛋器 不锈钢 情侣 包邮 特价,国美电器网上商城,生活日记（shenghuoriji ）
1011003010,家用电器|厨房电器|煮蛋器、蒸蛋器,生活日记 ZDQ-F6煮蛋器 双层 温泉蒸蛋器自动断电 防干烧,首页>厨卫电器生活电器>厨房小家电>煮蛋器>生活日记ZDQ-F6煮蛋器双层...,苏宁,生活日记
1011003010,家用电器|厨房电器|煮蛋器、蒸蛋器,快乐一叮 W-513 煮蛋器 不锈钢碗蒸蛋器定时多功能煮蛋 正品 特价 银色,小家电 > 厨房电器 > 蒸\煮锅 > 煮蛋器,亚马逊(卓越网),快乐一叮
1011003010,家用电器|厨房电器|煮蛋器、蒸蛋器,小熊 双层多功能蒸煮蛋器6个蛋,煮蛋、热菜、蒸小食、奶瓶消毒,首页?>?小熊电器专场?>?双层多功能蒸煮蛋器6个蛋,唯品会
1011003010,家用电器|厨房电器|煮蛋器、蒸蛋器,华迅仕 MD-703 多功能蒸蛋器 自动断电 情侣款煮蛋器,所有分类>大小家电、厨电、汽车>厨房电器>煮蛋器>华迅仕>华迅仕 MD-703...,1号店,华迅仕
1011003010,家用电器|厨房电器|煮蛋器、蒸蛋器,Bear 小熊 ZDQ-219 煮蛋器 蒸蛋 煎蛋 牛扒 烙饼 双层多功能煮蛋器,小家电 > 厨房电器 > 蒸\煮锅 > 煮蛋器,亚马逊(卓越网),Bear 小熊
1011003010,家用电器|厨房电器|煮蛋器、蒸蛋器,益多 YD-551卡通煮蛋器蒸蛋器自动断电,厨具 > 厨用小工具 > 鸡蛋加工 > 煎蛋模具,亚马逊(卓越网),益多
1011003010,家用电器|厨房电器|煮蛋器、蒸蛋器,优益鸡蛋杯多功能蛋卷机早餐机鸡蛋卷肉卷煮蛋器煮蛋大师蒸蛋器(橙色),生活电器 厨卫电器>打蛋器/煮蛋器>优益打蛋器/煮蛋器>优益鸡蛋杯多功能蛋卷机早餐机鸡蛋卷肉卷煮蛋器煮蛋大师蒸蛋器(橙色),国美,优益打蛋器/煮蛋器
1011003010,家用电器|厨房电器|煮蛋器、蒸蛋器,小白熊煮蛋器 多功能蒸蛋机 干烧断电保护 HL-0635 全国联保,母婴>喂养用品>暖奶/消毒>小白熊>小白熊煮蛋器 多功能蒸蛋机 干烧断电保护...,京东商城,TITITA踢踢踏母婴
1011003010,家用电器|厨房电器|煮蛋器、蒸蛋器,中亲多功能不锈钢煮蛋器蒸蛋器 自动断电煮蛋机蒸蛋机早餐机,母婴>喂养用品>辅食料理机> 中亲>中亲多功能不锈钢煮蛋器蒸蛋器 自动断电煮...,京东商城,宝贝色彩专营店
1011003010,家用电器|厨房电器|煮蛋器、蒸蛋器,Bear/小熊 JDQ-B01A1 家用全自动蛋卷机 煮鸡蛋杯立式煎蛋早餐神器热狗机,所有分类>大小家电、厨电、汽车>厨房电器>煮蛋器>Bear/小熊>Bear/小熊 JD...,1号店,Bear/小熊
1011003010,家用电器|厨房电器|煮蛋器、蒸蛋器,Bear/小熊 ZDQ-206 多功能不锈钢煮蛋器蒸蛋羹机蒸蛋器干烧断电 6个蛋,所有分类>大小家电、厨电、汽车>厨房电器>煮蛋器>Bear/小熊>Bear/小熊 ZD...,1号店,Bear/小熊
1011003010,家用电器|厨房电器|煮蛋器、蒸蛋器,Yoice/优益 Y-ZDQ6多功能煮鸡蛋器 煮蛋机全不锈钢 煎蛋器煎牛排(红色),生活电器 厨卫电器>打蛋器>优益打蛋器>Yoice/优益 Y-ZDQ6多功能煮鸡蛋器 煮蛋机全不锈钢 煎蛋器煎牛排(红色),国美,优益打蛋器
1011003010,家用电器|厨房电器|煮蛋器、蒸蛋器,生活日记 ZDQ-Q1 煮蛋器 蒸蛋器 自动断电 情侣 正品 安全高品质,首页>厨卫电器生活电器>厨房小家电>煮蛋器>生活日记ZDQ-Q1煮蛋器蒸蛋...,苏宁,生活日记
1011003010,家用电器|厨房电器|煮蛋器、蒸蛋器,生活日记 ZDQ-F8 煮蛋器 蒸蛋器 自动断电 双层升3层 不锈钢 情侣,家居日用>其他工具>生活日记（shenghuoriji ）>生活日记 ZDQ-F8 煮蛋器 蒸蛋器 自动断电 双层升3层 不锈钢 情侣,国美电器网上商城,生活日记（shenghuoriji ）
1011003010,家用电器|厨房电器|煮蛋器、蒸蛋器,小熊 双层多功能蒸煎烙煮蛋器 14个蛋,首页?>?小熊电器专场?>?双层多功能蒸煎烙煮蛋器 14个蛋,唯品会,无
1011003010,家用电器|厨房电器|煮蛋器、蒸蛋器,名友煮蛋器MY-35A 全不锈钢多功能蒸蛋器 自动断电保护 桃红,首页>厨卫电器生活电器>厨房小家电>煮蛋器>名友煮蛋器MY-35A全不锈钢多功...,苏宁,名友
1011003010,家用电器|厨房电器|煮蛋器、蒸蛋器,小熊 ZDQ-209 煮蛋器 7个蛋 煮蛋 煎蛋 煎烙饼 多功能一体Bear蒸煮煎烙饼 全能机,当当网 > 家用电器 > 厨房电器 > 打蛋器/煮蛋器,当当网,小熊
1011003010,家用电器|厨房电器|煮蛋器、蒸蛋器,Yililai/亿利来 煮蛋器蒸蛋器自动断电煮蛋器迷你蒸蛋机正品特价包邮,所有分类>大小家电、厨电、汽车>厨房电器>煮蛋器>Yililai/亿利来>Yililai/亿利...,1号店,Yililai/亿利来
1011003010,家用电器|厨房电器|煮蛋器、蒸蛋器,小逸小资XIAOYIXIAOZI 多功能蒸蛋器煮蛋器煎蛋器煎饼,所有分类>大小家电、厨电、汽车>厨房电器>煮蛋器>小逸小资XIAOYIXIAOZI>小逸小资XIAOYI...,1号店,小逸小资XIAOYIXIAOZI
1011003010,家用电器|厨房电器|煮蛋器、蒸蛋器,Bear小熊 煮蛋器 ZDQ-205 (不锈钢发热盘，省电节能，加热快，水烧干自动断电，使用更放心,蓝色),小家电 > 厨房电器 > 蒸\煮锅 > 煮蛋器,亚马逊(卓越网)
1011003010,家用电器|厨房电器|煮蛋器、蒸蛋器,天际蒸蛋器煮蛋器蒸蛋机DZG-7D不锈钢多功能,文轩网 > 百货 > 生活家电 > 厨卫电器 > 煮蛋器 > 天际蒸蛋器煮蛋器蒸蛋机DZG-7D不锈钢多功能,文轩网,天际
1011003010,家用电器|厨房电器|煮蛋器、蒸蛋器,Bear/小熊 ZDQ-2015煮蛋器 7个蛋容 多功能全不锈钢蒸蛋器 煎蛋器蛋羹机 自动断电,所有分类>大小家电、厨电、汽车>厨房电器>煮蛋器>Bear/小熊>Bear/小熊 ZD...,1号店,Bear/小熊
1011003010,家用电器|厨房电器|煮蛋器、蒸蛋器,Edei/宜阁 自动早餐蛋卷机神器 香肠卷鸡蛋杯 杯形煮蛋器煎蛋机 迷你早餐机,所有分类>大小家电、厨电、汽车>厨房电器>煮蛋器>Edei/宜阁>Edei/宜阁 自动...,1号店,Edei/宜阁
1011003010,家用电器|厨房电器|煮蛋器、蒸蛋器,Bear/小熊 JDQ-C301/ JDQ-C3011煎蛋器 自动调节温度,家用电器?>?厨房电器?>?打蛋器/煮蛋器?>?商品详情,当当网,Bear/小熊
1011003010,家用电器|厨房电器|煮蛋器、蒸蛋器,快乐一叮 煮蛋器ZDQ-501 自动定时 多功能 4-6玫蛋 白色,所有分类>大小家电、厨电、汽车>厨房电器>煮蛋器>快乐一叮>快乐一叮 煮蛋器ZD...,1号店,快乐一叮
1011003010,家用电器|厨房电器|煮蛋器、蒸蛋器,名友煮蛋器MY-35A 全不锈钢多功能蒸蛋器 自动断电保护 红古铜,首页>厨卫电器生活电器>厨房小家电>煮蛋器>名友煮蛋器MY-35A全不锈钢多功...,苏宁,名友
1011003010,家用电器|厨房电器|煮蛋器、蒸蛋器,BANDARI/班得瑞 ZDQ-F21多功能情侣煮蛋器蒸蛋器煮蛋大师鸡蛋杯 白色,首页>厨卫电器生活电器>厨房小家电>煮蛋器>BANDARI/班得瑞ZDQ-F2...,苏宁,$N
1011003010,家用电器|厨房电器|煮蛋器、蒸蛋器,十度良品SD-926喵O迷你煮蛋器 多功能蒸蛋器 带蒸碗 正品特价(粉红色),家居日用>其他工具>十度良品>十度良品SD-926喵O迷你煮蛋器 多功能蒸蛋器 带蒸碗 正品特价(粉红色),国美电器网上商城,竣丰汇通美之家专营店
1011003010,家用电器|厨房电器|煮蛋器、蒸蛋器,Bear/小熊 ZDQ-202 多功能迷你煮蛋器蒸蛋机,所有分类>大小家电、厨电、汽车>厨房电器>煮蛋器>Bear/小熊,1号店,煮蛋器
1011003010,家用电器|厨房电器|煮蛋器、蒸蛋器,益多 YD-500煮蛋器全不锈钢蒸蛋器配蒸碗自动断电,所有分类>大小家电、厨电、汽车>厨房电器>煮蛋器>益多>益多 YD-500煮...,1号店,益多
1011003010,家用电器|厨房电器|煮蛋器、蒸蛋器,益多YD-5051煮蛋器自动断电蒸蛋器送不锈钢蒸碗分离器特价包邮,家用电器>厨房电器>煮蛋器> 益多>益多YD-5051煮蛋器自动断电蒸蛋器送...,京东商城,益多官方旗舰店
1011003010,家用电器|厨房电器|煮蛋器、蒸蛋器,亨尼多功能情侣煮蛋器不锈钢蒸蛋器煮蛋机自动断电 清新蓝,首页>厨卫电器生活电器>厨房小家电>煮蛋器>亨尼多功能情侣煮蛋器不锈钢蒸蛋器煮蛋...,苏宁,亨尼(Honne)
1011003010,家用电器|厨房电器|煮蛋器、蒸蛋器,yoice优益Y-ZDQ2多功能情侣煮蛋器 蒸蛋器 煮蛋机 特价(白色),生活电器 厨卫电器>打蛋器/煮蛋器>优益>yoice优益Y-ZDQ2多功能情侣煮蛋器 蒸蛋器 煮蛋机 特价(白色),国美,优益
1011003010,家用电器|厨房电器|煮蛋器、蒸蛋器,富贵熊多功能不锈钢情侣煮蛋器 粉色小熊款 自动断电蒸蛋机 煎蛋器 FM-3103,首页>厨卫电器生活电器>厨房小家电>煮蛋器>富贵熊多功能不锈钢情侣煮蛋器粉色小...,苏宁,富贵熊
1011003010,家用电器|厨房电器|煮蛋器、蒸蛋器,BANDARI/班得瑞 ZDQ-F21多功能情侣煮蛋器蒸蛋器煮蛋大师鸡蛋杯 粉色,首页>厨卫电器生活电器>厨房小家电>煮蛋器>BANDARI/班得瑞ZDQ-F2...,苏宁,$N
1011003010,家用电器|厨房电器|煮蛋器、蒸蛋器,每时乐MSL-1021 不锈钢多功能煮蛋器 蒸蛋器 可煮7个蛋,小家电 > 厨房电器 > 蒸\煮锅 > 煮蛋器,亚马逊(卓越网),每时乐
1011003010,家用电器|厨房电器|煮蛋器、蒸蛋器,BANDARI/班得瑞 煮蛋器 ZDQ-F16 全自动断电 蒸蛋器 多功能 双层煮蛋器,小家电 > 厨房电器 > 蒸\煮锅 > 煮蛋器,亚马逊(卓越网),班得瑞
1011003010,家用电器|厨房电器|煮蛋器、蒸蛋器,宜阁(EDEI)自动早餐蛋卷机神器 香肠卷鸡蛋杯 杯形煮蛋器煎蛋机 迷你早餐机ZQ-ZD03,首页>厨卫电器生活电器>厨房小家电>煮蛋器>宜阁(EDEI)自动早餐蛋卷机神器...,苏宁,$N
1011003010,家用电器|厨房电器|煮蛋器、蒸蛋器,煮蛋器 ZDQ-Q5 自动断电 5个蛋 煮蛋蒸蛋 情侣,家用电器?>?厨房电器?>?打蛋器/煮蛋器?>?商品详情,当当网,生活日记
1011003010,家用电器|厨房电器|煮蛋器、蒸蛋器,Tonze/天际 DZG-W414F 蒸蛋器 双层煮蛋器多功能 不锈钢煎蒸煮蛋,家用电器?>?厨房电器?>?打蛋器/煮蛋器?>?商品详情,当当网,创能
1011003010,家用电器|厨房电器|煮蛋器、蒸蛋器,小熊多功能煮蛋器ZDQ-2191,所有分类>大小家电、厨电、汽车>厨房电器>煮蛋器>Bear/小熊>小熊多功能煮蛋器ZDQ-2191,1号店,Bear/小熊
1011003010,家用电器|厨房电器|煮蛋器、蒸蛋器,yoice优益Y-ZDQ2多功能情侣煮蛋器 蒸蛋器 煮蛋机 特价(红色),生活电器 厨卫电器>打蛋器/煮蛋器>优益>yoice优益Y-ZDQ2多功能情侣煮蛋器 蒸蛋器 煮蛋机 特价(红色),国美,优益
1011003010,家用电器|厨房电器|煮蛋器、蒸蛋器,小熊 ZDQ-206 多功能不锈钢煮蛋器蒸蛋羹机蒸蛋器干烧断电 6个蛋,所有分类>大小家电、厨电、汽车>厨房电器>煮蛋器>小熊>小熊 ZDQ-206 多功能不锈钢煮蛋器蒸蛋羹机蒸蛋器干烧断电 6个蛋,1号店,小熊
1011003010,家用电器|厨房电器|煮蛋器、蒸蛋器,Tonze/天际 DZG-W414F 蒸蛋器 双层煮蛋器多功能 不锈钢煎蒸煮蛋,家用电器?>?厨房电器?>?打蛋器/煮蛋器?>?商品详情,当当网,Tonze/天际
1011003010,家用电器|厨房电器|煮蛋器、蒸蛋器,PLLS/普林勒仕 蒸蛋器 煮蛋器 可煎蛋 不锈钢发热盘 防干烧 自动断电 蒸6个蛋LMZD-05黄,小家电 > 厨房电器 > 蒸\煮锅 > 煮蛋器,亚马逊(卓越网),PLLS普林勒仕
1011003010,家用电器|厨房电器|煮蛋器、蒸蛋器,班得瑞BANDARI ZDQ-Q2 煮蛋器 迷你蒸蛋器 陶瓷容器 可煮5个鸡蛋 自动断电防干烧,所有分类>大小家电、厨电、汽车>厨房电器>煮蛋器>班得瑞BANDARI>班得瑞BANDARI...,1号店,班得瑞BANDARI
1011003010,家用电器|厨房电器|煮蛋器、蒸蛋器,班得瑞BANDARI ZDQ-F17 微电脑定时 双层煮蛋器 自动断电防干烧蒸蛋器 蒸蛋羹 可煮12个鸡蛋,所有分类>大小家电、厨电、汽车>厨房电器>煮蛋器>班得瑞BANDARI>班得瑞BANDARI...,1号店,班得瑞BANDARI
1011003010,家用电器|厨房电器|煮蛋器、蒸蛋器,爱友客 AYK FM-3102 多功能迷你小鸡煮蛋器 自动断电,所有分类>大小家电、厨电、汽车>厨房电器>煮蛋器>爱友客>爱友客 AYK FM...,1号店,爱友客
1011003010,家用电器|厨房电器|煮蛋器、蒸蛋器,富贵熊 全不锈钢 自动断电情侣 煮蛋器 可煮7个蛋 蒸蛋器 机,所有分类>大小家电、厨电、汽车>厨房电器>煮蛋器>富贵熊>富贵熊 全不锈钢 自...,1号店,富贵熊
1011003010,家用电器|厨房电器|煮蛋器、蒸蛋器,小熊 ZDQ-2136 不锈钢多功能煮蛋器蒸煮蛋羹机 5个蛋容送不锈钢蒸碗 干烧自动断电,所有分类>大小家电、厨电、汽车>厨房电器>煮蛋器>小熊>小熊 ZDQ-2136 不锈钢多功能煮蛋器蒸煮蛋羹机 5个蛋容送不锈钢蒸碗 干烧自动断电,1号店,小熊
1011003010,家用电器|厨房电器|煮蛋器、蒸蛋器,益多 YD-5051智能煮蛋器蒸蛋器自动断电,厨具 > 厨用小工具 > 鸡蛋加工 > 煎蛋模具,亚马逊(卓越网),益多
1011003010,家用电器|厨房电器|煮蛋器、蒸蛋器,奥西美 PA-610多功能煮蛋器 煮蛋机蒸蛋器 自动断电,所有分类>大小家电、厨电、汽车>厨房电器>煮蛋器>奥西美,1号店,煮蛋器
1011003010,家用电器|厨房电器|煮蛋器、蒸蛋器,【潮顺电器专营店】BANDARI/班得瑞 煮蛋器 ZDQ-F10 三层大容量蒸蛋器 多功能 干水断电,家用电器?>?厨房电器?>?打蛋器/煮蛋器?>?商品详情,当当网,BANDARI/班得瑞
1011003010,家用电器|厨房电器|煮蛋器、蒸蛋器,Yoice优益 Y-ZDQ1多功能情侣煮蛋器 不锈钢蒸蛋器 煮蛋机 煎蛋器,所有分类>大小家电、厨电、汽车>厨房电器>煮蛋器>Yoice优益>Yoice优益 Y-...,1号店,Yoice优益
1011003010,家用电器|厨房电器|煮蛋器、蒸蛋器,Bear/小熊 ZDQ-205 煮蛋器 蒸蛋器 防干烧 自动断电,当当网 > 家用电器 > 厨房电器 > 打蛋器/煮蛋器,当当网,Bear/小熊
1011003010,家用电器|厨房电器|煮蛋器、蒸蛋器,三角牌（Triangle）HYD-6203煮蛋器 7个蛋容 多功能 不锈钢 自动断电,家用电器>厨房电器>煮蛋器>三角（Triangle）>三角牌（Triangle）HYD-620...,京东商城,三角电器官方旗舰店
1011003010,家用电器|厨房电器|煮蛋器、蒸蛋器,Yililai/亿利来 煮蛋器蒸蛋器自动断电煮蛋器迷你蒸蛋机正品特价包邮,所有分类>大小家电、厨电、汽车>厨房电器>煮蛋器>Yililai/亿利来>Yililai/亿利...,1号店,Yililai/亿利来
1011003010,家用电器|厨房电器|煮蛋器、蒸蛋器,Yoice优益 Y-ZDQ1多功能情侣煮蛋器 不锈钢蒸蛋器 煮蛋机 煎蛋器,所有分类>大小家电、厨电、汽车>厨房电器>煮蛋器>Yoice优益>Yoice优益 Y-...,1号店,Yoice优益
1011003010,家用电器|厨房电器|煮蛋器、蒸蛋器,益多ZDQ-206煮蛋器自动断电不锈钢煮蛋器送蛋清分离器防干烧无需看守 蓝色,家用电器>厨房电器>煮蛋器> 益多>益多ZDQ-206煮蛋器自动断电不锈钢煮...,京东商城,益多官方旗舰店
1011003010,家用电器|厨房电器|煮蛋器、蒸蛋器,Tonze/天际 DZG-W30Q煮蛋器大师 多功能双层蒸蛋器 自动断电蒸蛋机,所有分类>大小家电、厨电、汽车>厨房电器>煮蛋器>Tonze/天际>Tonze/天际 D...,1号店,Tonze/天际
1011003010,家用电器|厨房电器|煮蛋器、蒸蛋器,【天际官方旗舰店】天际煮蛋器DZG-W30Q 双层蒸蛋器 蒸煮蛋机 自动断电,生活电器 厨卫电器>打蛋器/煮蛋器>天际>【天际官方旗舰店】天际煮蛋器DZG-W30Q 双层蒸蛋器 蒸煮蛋机 自动断电,国美电器网上商城,天际旗舰店
1011003010,家用电器|厨房电器|煮蛋器、蒸蛋器,快乐一叮 煮蛋器ZDQ-501 自动定时 多功能 4-6玫蛋 白色,所有分类>大小家电、厨电、汽车>厨房电器>煮蛋器>快乐一叮>快乐一叮 煮蛋器ZD...,1号店,快乐一叮
1011003010,家用电器|厨房电器|煮蛋器、蒸蛋器,Bear小熊 煮蛋器ZDQ-2136 超Q外观 防干烧 自动断电 可蒸水蛋,小家电 > 厨房电器 > 蒸\煮锅 > 煮蛋器,亚马逊(卓越网),Bear 小熊
1011003010,家用电器|厨房电器|煮蛋器、蒸蛋器,爱友客 PA-518 情侣煮蛋器迷你蒸蛋器自动断电,首页>厨卫电器生活电器>厨房小家电>煮蛋器>爱友客PA-518情侣煮蛋器迷你...,苏宁,爱友客
1011003010,家用电器|厨房电器|煮蛋器、蒸蛋器,奥西美 PA-610多功能煮蛋器 煮蛋机蒸蛋器 自动断电,所有分类>大小家电、厨电、汽车>厨房电器>煮蛋器>奥西美>奥西美 PA-610...,1号店,奥西美
1011003010,家用电器|厨房电器|煮蛋器、蒸蛋器,Bear 小熊 煮蛋器 ZDQ-216 多功能蒸蛋器 自动断电 12只蛋,家用/类别/小家电/厨房电器/蒸\煮锅/煮蛋器,亚马逊(卓越网),Bear 小熊
1011003010,家用电器|厨房电器|煮蛋器、蒸蛋器,名友 全不锈钢 多功能煮蛋器 蒸蛋器 颜色随机 MY-35G,小家电 > 厨房电器 > 蒸\煮锅 > 煮蛋器,亚马逊(卓越网),meyou 名友
1011003010,家用电器|厨房电器|煮蛋器、蒸蛋器,【益多】益多ZDQ-206多功能煮蛋器情侣煮蛋机全不锈钢蒸蛋器自动断电 ?,首页?>?电器/数码?>?厨卫电器?>?料理/榨汁机 >??【益多】益多ZDQ-206多功能煮蛋器情侣煮蛋机全不锈钢蒸蛋器自动断电,D1优尚网,无
