1011002024,家用电器|生活电器|暖手宝、暖脚宝,绒毛保暖抱枕电热水袋 电暖手宝暖水袋暖手袋 兰色款 充水,家居家装>家装软饰>其他>魅之优品>绒毛保暖抱枕电热水袋 电暖手宝暖水袋暖手...,京东商城,义乌仁璟家居
1011002024,家用电器|生活电器|暖手宝、暖脚宝,悠趣 卡戈尔 暖手宝 绒布绣花 防爆 充电热水袋 暖水袋 需注水 花色颜色随机发货,悠趣>悠趣 卡戈尔 暖手宝 绒布绣花 防爆 充...,京东商城,悠趣
1011002024,家用电器|生活电器|暖手宝、暖脚宝,优水 卡通T恤电暖袋电暖水袋 暖手宝 电热水袋防爆 未加水 咖色熊,优水 卡通T恤电暖袋电暖水袋 暖手宝 电...,京东商城,优水旗舰店
1011002024,家用电器|生活电器|暖手宝、暖脚宝,JOYMON/巨铭 超柔绒面暖手宝充电热水袋暖水袋手焐,所有分类>家居家纺、锅具餐具>装饰/日用>取暖/降温>暖手宝/热水袋>JOYMON/巨铭>JOYMON/巨铭 ...,1号店,JOYMON/巨铭
1011002024,家用电器|生活电器|暖手宝、暖脚宝,JOYMON/巨铭 充电热水袋　暖手宝　电暖宝　暖水袋,所有分类>家居家纺、锅具餐具>装饰/日用>取暖/降温>暖手宝/热水袋>JOYMON/巨铭>JOYMON/巨铭 ...,1号店,JOYMON/巨铭
1011002024,家用电器|生活电器|暖手宝、暖脚宝,尔腾 电热水袋 暖手宝 热水袋充电 卡通暖水袋 防爆 毛绒双擦手已注水 可拆洗深咖双绒,家居 > 居家防护 > 保暖用品 > 暖手宝暖脚宝,亚马逊(卓越网),尔腾
1011002024,家用电器|生活电器|暖手宝、暖脚宝,春笑 卡通电热水袋 毛绒布充电防爆暖手宝 暖水袋 电暖宝 暖手袋 KT04黄色小狗,家居 > 居家防护 > 保暖用品 > 暖手宝暖脚宝,亚马逊(卓越网),春笑
1011002024,家用电器|生活电器|暖手宝、暖脚宝,爱贝斯 暖手宝 充电毛绒抱枕 卡通插电暖手袋 电热靠垫 创意电暖宝 棕色,家居 > 居家防护 > 保暖用品 > 暖手宝暖脚宝,亚马逊(卓越网),爱贝斯
1011002024,家用电器|生活电器|暖手宝、暖脚宝,美家宝电暖袋/暖水袋/暖手宝时尚刺绣双插手型暖色系列（颜色随机23.5*7*18cm）MXD-328B （无需注水双插手、限压防爆式结构、优质温控器、翻盖防尘设计、刺绣工艺不掉毛、立体卡通暖手器）,热水袋/暖手宝/电热毯/暖贴（亚马逊自营）2件8折 在订单确认页面输入JHUH44FY 点此查看如何获得促销优惠 (促销说明),亚马逊(卓越网),美家宝
1011002024,家用电器|生活电器|暖手宝、暖脚宝,泉力 QUANLI 电热水袋 电暖宝 充电防爆 暖手宝暖水袋 已注水 10种颜色可选,所有分类>家居家纺、锅具餐具>装饰/日用>取暖/降温>暖手宝/热水袋>泉力 QUANLI>泉力 QUANLI ...,1号店,泉力 QUANLI
1011002024,家用电器|生活电器|暖手宝、暖脚宝,泉力电热水袋 防暴充电 已注水暖手宝电暖宝 暖水袋电热宝 卡通棕色小熊,家居家装>家装软饰>其他>泉力>泉力电热水袋 防暴充电 已注水暖手宝电暖...,京东商城,佳易购家居专营店
1011002024,家用电器|生活电器|暖手宝、暖脚宝,孙小圣 卡通充电宝防爆暖手宝电暖宝暖水袋双插毛绒电热水袋秋冬季礼品送女孩老婆朋友礼品 求无敌,礼品箱包>礼品>创意礼品>孙小圣>孙小圣 卡通充电宝防爆暖手宝电暖宝暖水袋...,京东商城,孙小圣旗舰店
1011002024,家用电器|生活电器|暖手宝、暖脚宝,暖手宝充电热水袋暖水袋 毛绒布卡通防爆电暖宝新款 特价包邮 突眼小羊 30cm,玩具乐器>毛绒布艺>毛绒/布艺>暖手宝充电热水袋暖水袋 毛绒布卡通防爆电...,京东商城,茵凡礼品
1011002024,家用电器|生活电器|暖手宝、暖脚宝,暖手宝充电热水袋暖水袋 毛绒布卡通防爆电暖宝新款 特价包邮 安吉拉(红色) 30cm,玩具乐器>毛绒布艺>毛绒/布艺>暖手宝充电热水袋暖水袋 毛绒布卡通防爆电...,京东商城,茵凡礼品
1011002024,家用电器|生活电器|暖手宝、暖脚宝,年终卖热暖手宝双插手热水袋 超柔性绒毛公仔暖手宝防爆充电 可爱卡通暖水袋 已注水 大眼睛-粉色 加大款,家居家装>家装软饰>保暖防护>盛宝>年终卖热暖手宝双插手热水袋 超柔性绒毛公...,京东商城,盛宝家居旗舰店
1011002024,家用电器|生活电器|暖手宝、暖脚宝,喜家家充电热水袋冬季暖水袋保暖暖手宝暖宝宝 立体绣可爱猪/粉色,家居家装>家装软饰>保暖防护>喜家家>喜家家充电热水袋冬季暖水袋保暖暖手宝暖宝...,京东商城,喜家家家居生活馆
1011002024,家用电器|生活电器|暖手宝、暖脚宝,喜家家充电热水袋冬季暖水袋保暖暖手宝暖宝宝 猫头型憨菜菜/蓝色,家居家装>家装软饰>保暖防护>喜家家>喜家家充电热水袋冬季暖水袋保暖暖手宝暖宝...,京东商城,喜家家家居生活馆
1011002024,家用电器|生活电器|暖手宝、暖脚宝,暖腰宝 充电热水袋 已充水 暖手宝 电暖宝 暖水袋 热宝 尔腾 正品 尔腾暖腰带大红色,家居家装>家装软饰>其他>尔腾>暖腰宝 充电热水袋 已充水 暖手宝 电暖...,京东商城,深圳美轩家居专营店
1011002024,家用电器|生活电器|暖手宝、暖脚宝,暖手宝双插手热水袋 超柔性毛绒公仔暖手宝 防爆充电 可爱卡通暖水袋 冬天保温防寒 嘟嘟猴-棕色,家居家装>家装软饰>保暖防护>盛宝>暖手宝双插手热水袋 超柔性毛绒公仔暖手宝...,京东商城,盛宝家居旗舰店
1011002024,家用电器|生活电器|暖手宝、暖脚宝,上海如兰 电热暖宝宝 暖手宝 毛绒充电暖宝 防爆暖水袋暖手袋 暖脚宝 暖脚套 脚宝宝,家居家装>家纺>电热毯>如蘭（RULAN）>上海如兰 电热暖宝宝 暖手宝 毛绒充电暖...,京东商城,如兰家纺旗舰店
1011002024,家用电器|生活电器|暖手宝、暖脚宝,2013新款惠通多功能组合双插手电热水袋防爆暖水袋毛绒暖手宝电暖宝已注水组合式可拆洗H-601-2 CCTV上榜名牌产品 3C认证 太平洋保险,家居 > 居家防护 > 保暖用品 > 暖手宝暖脚宝,亚马逊(卓越网),
1011002024,家用电器|生活电器|暖手宝、暖脚宝,盛派 马卡龙macaron移动电源 USB迷你暖手宝电暖宝电热宝电热饼热销 (红色),家居 > 居家防护 > 保暖用品 > 暖手宝暖脚宝,亚马逊(卓越网),盛派
1011002024,家用电器|生活电器|暖手宝、暖脚宝,泉力 QUANLI 热水袋 充电防爆电热水袋 暖手宝 暖水袋 电暖宝 电暖袋 海绵宝宝,所有分类>家居家纺、锅具餐具>装饰/日用>取暖/降温>暖手宝/热水袋>泉力 QUANLI>泉力 QUANLI ...,1号店,泉力 QUANLI
1011002024,家用电器|生活电器|暖手宝、暖脚宝,淘乐士 卡通暖手宝USB充电/电池两用/暖手器暖手袋热宝暖水袋省电携带1个装,所有分类>家居家纺、锅具餐具>装饰/日用>取暖/降温>暖手宝/热水袋>淘乐士>淘乐士 卡通暖手宝U...,1号店,淘乐士
1011002024,家用电器|生活电器|暖手宝、暖脚宝,泉力 QUANLI 电热水袋 多功能暖手宝 绒布绣花 已注水 防爆 暖水袋,所有分类>家居家纺、锅具餐具>装饰/日用>取暖/降温>热水袋>泉力 QUANLI>泉力 QUANLI 电热水袋 多功能暖手宝 绒布绣花 已注水 防爆 暖水袋,1号店,泉力 QUANLI
1011002024,家用电器|生活电器|暖手宝、暖脚宝,JOYMON/巨铭 可拆洗双插手充电热水袋暖手宝绒面暖水袋电暖宝,所有分类>家居家纺、锅具餐具>装饰/日用>取暖/降温>暖手宝/热水袋>JOYMON/巨铭>JOYMON/巨铭 ...,1号店,JOYMON/巨铭
1011002024,家用电器|生活电器|暖手宝、暖脚宝,家博士毛绒森林娃娃系列电热水袋暖手宝暖水袋 安全防爆 多个颜色 湖蓝色,首页>家居/家装建材/厨具>生活日用>生活日用>家博士毛绒森林娃娃系列电热水袋暖手宝...,苏宁,家博士
1011002024,家用电器|生活电器|暖手宝、暖脚宝,泉力 QUANLI 热水袋 充电防爆电热水袋 暖手宝 暖水袋 电暖宝 电暖袋 小熊,所有分类>家居家纺、锅具餐具>装饰/日用>取暖/降温>暖手宝/热水袋>泉力 QUANLI>泉力 QUANLI ...,1号店,泉力 QUANLI
1011002024,家用电器|生活电器|暖手宝、暖脚宝,泉力 绒布防爆 电暖袋 多功能 已注水暖水袋 暖手宝 电热水袋 双插手粉色白兔,家居日用>居家软饰>泉力>泉力 绒布防爆 电暖袋 多功能 已注水暖水袋 暖手宝 电热水袋 双插手粉色白兔,国美电器网上商城,泉力
1011002024,家用电器|生活电器|暖手宝、暖脚宝,泉力 绒布防爆 电暖袋 多功能 已注水暖水袋 暖手宝 电热水袋 双插手带帽女孩,家居日用>居家软饰>泉力>泉力 绒布防爆 电暖袋 多功能 已注水暖水袋 暖手宝 电热水袋 双插手带帽女孩,国美电器网上商城,泉力
1011002024,家用电器|生活电器|暖手宝、暖脚宝,春風 充电式热水袋 卡通毛绒暖手宝 双插手防爆电热袋暖手袋 电暖宝,所有分类>家居家纺、锅具餐具>装饰/日用>取暖/降温>暖手宝/热水袋>春風>春風 充电式热水袋 ...,1号店,春風
1011002024,家用电器|生活电器|暖手宝、暖脚宝,盛宝 暖手宝 暖宝宝 电热暖水袋 电暖袋 防爆热水袋 毛绒充电暖宝 立体双插手,所有分类>家居家纺、锅具餐具>装饰/日用>取暖/降温>暖手宝/热水袋>盛宝>盛宝 暖手宝 暖宝宝...,1号店,盛宝
1011002024,家用电器|生活电器|暖手宝、暖脚宝,暖之缘 充电毛绒热水袋 双插手暖水袋电暖宝电热宝 防爆暖手宝袋(小狗棕色Q2116),家居日用>居家软饰>星空夏日>暖之缘 充电毛绒热水袋 双插手暖水袋电暖宝电热宝 防爆暖手宝袋(小狗棕色Q2116),国美电器网上商城,衢州普润家居专营店
1011002024,家用电器|生活电器|暖手宝、暖脚宝,暖之缘 书写垫 暖桌垫暖桌宝 电暖加热垫 保暖垫 暖手宝 电热桌垫(蓝底白点 Q4113),家居日用>居家软饰>星空夏日>暖之缘 书写垫 暖桌垫暖桌宝 电暖加热垫 保暖垫 暖手宝 电热桌垫(蓝底白点 Q4113),国美电器网上商城,衢州普润家居专营店
1011002024,家用电器|生活电器|暖手宝、暖脚宝,暖手宝 暖宝宝 充电热水袋 毛绒保暖暖水袋 立体双插手 可爱狗狗(卡其色),家居日用>居家软饰>盛宝>暖手宝 暖宝宝 充电热水袋 毛绒保暖暖水袋 立体双插手 可爱狗狗(卡其色),国美电器网上商城,涵涵家居专营店
1011002024,家用电器|生活电器|暖手宝、暖脚宝,美家宝MXD-328B时尚刺绣双插手暖手宝充电电暖袋防爆暖水袋热水袋抱抱我系列(棕色抱抱我),家居日用>居家软饰>美家宝>美家宝MXD-328B时尚刺绣双插手暖手宝充电电暖袋防爆暖水袋热水袋抱抱我系列(棕色抱抱我),国美电器网上商城,锦绣金源家居用品专营店
1011002024,家用电器|生活电器|暖手宝、暖脚宝,光一 迷你掌上空调暖风机暖手宝 创意便携学生电热宝暖手器电暖宝,所有分类>家居家纺、锅具餐具>装饰/日用>取暖/降温>暖手宝/热水袋>光一>光一 迷你掌上空调暖...,1号店,光一
1011002024,家用电器|生活电器|暖手宝、暖脚宝,博弘 2013新款毛绒充电防爆电热水袋 暖水袋 暖手宝 暖宝宝(Q2113熊大),家居日用>居家软饰>春笑>博弘 2013新款毛绒充电防爆电热水袋 暖水袋 暖手宝 暖宝宝(Q2113熊大),国美电器网上商城,衢州普润家居专营店
1011002024,家用电器|生活电器|暖手宝、暖脚宝,红缨枪时尚卡通防爆充电暖水袋暖手宝热水袋,首页>家居/家装建材/厨具>生活日用>生活日用>红缨枪时尚卡通防爆充电暖水袋暖手宝热...,苏宁,红缨枪
1011002024,家用电器|生活电器|暖手宝、暖脚宝,淘乐士 卡通花布热水袋/时尚暖水袋/布包暖手宝 热宝暖手暖脚热敷5个装,所有分类>家居家纺、锅具餐具>装饰/日用>取暖/降温>暖手宝/热水袋>淘乐士>淘乐士 卡通花布热水...,1号店,淘乐士
1011002024,家用电器|生活电器|暖手宝、暖脚宝,Juzon 马卡龙macaron移动电源 USB迷你暖手宝电暖宝电热宝电热饼热销 (草莓红),家居 > 居家防护 > 保暖用品 > 暖手宝暖脚宝,亚马逊(卓越网),Juzon
1011002024,家用电器|生活电器|暖手宝、暖脚宝,博弘 2013新款电热水袋充电防爆暖水袋暖手宝充水毛绒暖手袋双插手（悠嘻龙）,家居日用>居家软饰>自由城>博弘 2013新款电热水袋充电防爆暖水袋暖手宝充水毛绒暖手袋双插手（悠嘻龙）,国美电器网上商城,自由城
1011002024,家用电器|生活电器|暖手宝、暖脚宝,小由国标充电已注水暖手宝毛绒双插手防爆暖水袋暖宝宝热水袋,首页>厨卫电器生活电器>生活小家电>暖手暖脚宝>小由国标充电已注水暖手宝毛绒双插手防...,苏宁,由噻
1011002024,家用电器|生活电器|暖手宝、暖脚宝,如喜星座系列 电热暖宝宝 暖手宝 毛绒充电暖宝 防爆暖水袋暖手袋(金牛座),家纺寝居>电热毯>如兰>如喜星座系列 电热暖宝宝 暖手宝 毛绒充电暖宝 防爆暖水袋暖手袋(金牛座),国美电器网上商城,如兰旗舰店
1011002024,家用电器|生活电器|暖手宝、暖脚宝,泉力 可定时防爆电热水袋暖水袋 充电毛绒 电热宝 暖手宝(咖啡色),家居日用>居家软饰>泉力>泉力 可定时防爆电热水袋暖水袋 充电毛绒 电热宝 暖手宝(咖啡色),国美电器网上商城,思明思家居专营店
1011002024,家用电器|生活电器|暖手宝、暖脚宝,家博士双插手毛绒热水袋暖手宝暖水袋 小白兔系列 安全防爆,首页>家居/家装建材/厨具>生活日用>生活日用>家博士双插手毛绒热水袋暖手宝暖水袋...,苏宁,家博士
1011002024,家用电器|生活电器|暖手宝、暖脚宝,泉力 QUANLI 电热水袋 多功能暖手宝 绒布绣花 已注水 防爆 暖水袋,所有分类>家居家纺、锅具餐具>装饰/日用>取暖/降温>暖手宝/热水袋>泉力 QUANLI>泉力 QUANLI ...,1号店,泉力 QUANLI
1011002024,家用电器|生活电器|暖手宝、暖脚宝,泉力 QUANLI 热水袋已注水 超柔软充电防爆电热水袋 暖手宝 暖水袋 电暖宝 电暖袋 取暖器,所有分类>家居家纺、锅具餐具>装饰/日用>取暖/降温>热水袋>泉力 QUANLI>泉力 QUANLI 热水袋已注水 超柔软充电防爆电热水袋 暖手宝 暖水袋 电暖宝 电暖袋 取暖器,1号店,泉力 QUANLI
1011002024,家用电器|生活电器|暖手宝、暖脚宝,fashy 新品 德国原装进口 6442 充注水PVC热水袋 暖水袋 冰袋 暖手宝 2L,所有分类>家居家纺、锅具餐具>装饰/日用>取暖/降温>暖手宝/热水袋>fashy>fashy 新品 德...,1号店,fashy
1011002024,家用电器|生活电器|暖手宝、暖脚宝,博弘 2013新款电热水袋充电防爆暖水袋暖手宝充水毛绒暖手袋双插手(熊猫 Q1105),家居日用>居家软饰>星空夏日>博弘 2013新款电热水袋充电防爆暖水袋暖手宝充水毛绒暖手袋双插手(熊猫 Q1105),国美电器网上商城,衢州普润家居专营店
1011002024,家用电器|生活电器|暖手宝、暖脚宝,暖之缘热水袋水电分离带防爆夹电热水袋电暖宝暖手宝暖水袋(点点双插咖啡Q4108),家居日用>居家软饰>星空夏日>暖之缘热水袋水电分离带防爆夹电热水袋电暖宝暖手宝暖水袋(点点双插咖啡Q4108),国美电器网上商城,衢州普润家居专营店
1011002024,家用电器|生活电器|暖手宝、暖脚宝,泉力 热水袋已注水防爆定时电热水袋 暖水袋 暖手宝电热宝电暖宝(米白色),家居日用>居家软饰>泉力>泉力 热水袋已注水防爆定时电热水袋 暖水袋 暖手宝电热宝电暖宝(米白色),国美电器网上商城,思明思家居专营店
1011002024,家用电器|生活电器|暖手宝、暖脚宝,春风充电注水暖水袋 双插手暖手宝暖手袋 安全防爆毛绒电热水袋,家居家装>家装软饰>保暖防护>春风>春风充电注水暖水袋 双插手暖手宝暖手袋 ...,京东商城,紫媛丰家居专营店
1011002024,家用电器|生活电器|暖手宝、暖脚宝,博弘 新款电热水袋充电防爆暖水袋暖手宝暖宝宝毛绒暖手袋双插手 电暖袋 （Q1105熊猫,家居家装>家装软饰>保暖防护>博弘>博弘 新款电热水袋充电防爆暖水袋暖手宝暖...,京东商城,缤纷家居馆
1011002024,家用电器|生活电器|暖手宝、暖脚宝,华庭丽娜暖手宝电热水袋 暖宝宝 快乐家族系列充电热水袋 卡通双插手暖水袋 插电充电电热器 开心鹿,家居家装>家装软饰>其他>华庭丽娜>华庭丽娜暖手宝电热水袋 暖宝宝 快乐家族...,京东商城,响当当家居
1011002024,家用电器|生活电器|暖手宝、暖脚宝,博弘充电毛绒双插热水袋 暖手宝 暖宝宝暖手袋 电热水袋 电热宝 电暖袋棕色,家居家装>家装软饰>保暖防护>博弘>博弘充电毛绒双插热水袋 暖手宝 暖宝宝暖...,京东商城,缤纷家居馆
1011002024,家用电器|生活电器|暖手宝、暖脚宝,小金猴 暖桌垫 电暖书写垫发热垫 暖手宝电热暖桌垫时尚天鹅绒棕色36*60CM E2402,家居家装>家装软饰>其他>红兔子>小金猴 暖桌垫 电暖书写垫发热垫 暖手宝...,京东商城,楼龙旗舰店
1011002024,家用电器|生活电器|暖手宝、暖脚宝,春笑 插手暖手宝 电热水袋 防爆毛绒充电暖宝宝暖水袋暖手袋电热宝电暖袋 关联010 R2102咖啡兔,家居家装>家装软饰>保暖防护>春笑>春笑 插手暖手宝 电热水袋 防爆毛绒充电...,京东商城,缤纷家居馆
1011002024,家用电器|生活电器|暖手宝、暖脚宝,春笑 电热水袋 电暖手宝 水电分离 安全防爆 毛绒卡通 暖手宝 暖腰宝 暖宝宝 暖水袋抱枕 R2108粉鼠,家居家装>家装软饰>保暖防护>红兔子>春笑 电热水袋 电暖手宝 水电分离 安全...,京东商城,楼龙旗舰店
1011002024,家用电器|生活电器|暖手宝、暖脚宝,博弘 经典充电热水袋防爆暖手宝超热暖水袋双插毛绒电暖宝热宝 防爆可注水双手插热水袋暧手宝 卡通紫色,家居家装>家装软饰>其他>春笑>博弘 经典充电热水袋防爆暖手宝超热暖水袋...,京东商城,维双家居专营店
1011002024,家用电器|生活电器|暖手宝、暖脚宝,博弘 经典充电热水袋防爆暖手宝超热暖水袋双插毛绒电暖宝热宝 防爆可注水双手插热水袋暧手宝 卡通棕色,家居家装>家装软饰>其他>春笑>博弘 经典充电热水袋防爆暖手宝超热暖水袋...,京东商城,维双家居专营店
1011002024,家用电器|生活电器|暖手宝、暖脚宝,暖之缘暖手宝 充电热水袋防爆暖水袋电暖宝电热宝 插电毛绒 创意暖手袋 电热水袋 点点褐色,家居家装>家装软饰>其他>春笑>暖之缘暖手宝 充电热水袋防爆暖水袋电暖宝...,京东商城,维双家居专营店
1011002024,家用电器|生活电器|暖手宝、暖脚宝,暖之缘暖手宝 充电热水袋防爆暖水袋电暖宝电热宝 插电毛绒 创意暖手袋 电热水袋 悠嘻猴粉色,家居家装>家装软饰>其他>春笑>暖之缘暖手宝 充电热水袋防爆暖水袋电暖宝...,京东商城,维双家居专营店
1011002024,家用电器|生活电器|暖手宝、暖脚宝,暖手宝充电热水袋暖水袋 毛绒布卡通防爆电暖宝新款 情人节礼物 高档泰迪狗,玩具乐器>毛绒布艺>靠垫/抱枕>其它>暖手宝充电热水袋暖水袋 毛绒布卡通防爆电...,京东商城,茵凡礼品
1011002024,家用电器|生活电器|暖手宝、暖脚宝,易普 丛林兄弟手捂水电隔离式 充电式电暖宝 暖手宝 电暖水袋 热敷腰腹 热脚(小象),家装建材>智能居家>易普（eap）>易普 丛林兄弟手捂水电隔离式 充电式电暖宝 暖手宝 电暖水袋 热敷腰腹 热脚(小象),国美电器网上商城,牧童家居专营店
1011002024,家用电器|生活电器|暖手宝、暖脚宝,易普 北极绒超柔插手 水电隔离式 充电式电暖宝 电暖水袋  暖手宝 捂被 暖腰腹(棕色),家装建材>智能居家>易普（eap）>易普 北极绒超柔插手 水电隔离式 充电式电暖宝 电暖水袋  暖手宝 捂被 暖腰腹(棕色),国美电器网上商城,牧童家居专营店
1011002024,家用电器|生活电器|暖手宝、暖脚宝,博弘 2013新款电热水袋充电防爆暖水袋暖手宝充水毛绒暖手袋双插手 黑色Q1102   ,时尚居家>居家创意>装饰日用>博弘 2013新款电热水袋充电防爆暖水袋暖手宝充水毛绒暖手袋双插手 黑色Q1102   ,为为网,红兔子
1011002024,家用电器|生活电器|暖手宝、暖脚宝,春笑未注水电热水袋充电防爆毛绒暖手宝暖水袋电暖宝暖手袋 蓝色小兔,家居家装>家装软饰>其他>春笑>春笑未注水电热水袋充电防爆毛绒暖手宝暖水...,京东商城,海燕家居专营店
1011002024,家用电器|生活电器|暖手宝、暖脚宝,汇丰信佳 韩式印花型 小号 冲水热水袋充水 暖手袋 暖水袋 暖手宝,家居日用>其他用品>汇丰信佳其他用品>汇丰信佳 韩式印花型 小号 冲水热水袋充水 暖手袋 暖水袋 暖手宝,国美电器网上商城,汇丰信佳其他用品
1011002024,家用电器|生活电器|暖手宝、暖脚宝,【工厂直营】名门新贵 暖手宝 环游世界系列 热水袋 暖手袋 电热水袋防爆双插手毛绒电暖袋 电暖宝 暖脚宝 抗寒袋 ,家居日用 > 清洁护理 > 暖宝宝 > 【工厂直营】名门新贵 暖手宝 环游世界系列 热水袋 暖手袋 电热...,当当网,名门新贵1011002025
