1011003022,家用电器|厨房电器|电热饭盒,十度良品SD-905蒸快乐不锈钢电热饭盒 插电饭盒 多功能加热饭盒,其他 > 其他,亚马逊(卓越网),Seed 十度良品
1011003022,家用电器|厨房电器|电热饭盒,诺洁仕 HM-2016 多功能不锈钢内胆电热饭盒 双层保温加热饭盒,所有分类>大小家电、厨电、汽车>厨房电器>电热饭盒>诺洁仕>诺洁仕 HM-201...,1号店,诺洁仕
1011003022,家用电器|厨房电器|电热饭盒,十度良品SD-969 电热饭盒 不锈钢内胆加热饭盒 定时蒸煮 橙色,家用电器>厨房电器>多用途锅>十度良品>十度良品SD-969 电热饭盒 不锈钢内...,京东商城,十度良品旗舰店
1011003022,家用电器|厨房电器|电热饭盒,继红 多功能保温 循环加热 电热饭盒 802,所有分类>家居家纺、锅具餐具>餐具水具>保温饭盒>继红>继红 多功能保温 ...,1号店,继红
1011003022,家用电器|厨房电器|电热饭盒,富贵熊 升级版多功能三层不锈钢电子饭盒 便携式保温电饭盒 酸奶机 纳豆机 蒸煮饭盒,所有分类>大小家电、厨电、汽车>厨房电器>电热饭盒>富贵熊>富贵熊 升级版多功能...,1号店,富贵熊
1011003022,家用电器|厨房电器|电热饭盒,Seed/十度良品 SD-937 电热饭盒 加热饭盒 不锈钢内胆 可定时电饭盒,所有分类>大小家电、厨电、汽车>厨房电器>电热饭盒>Seed/十度良品>Seed/十度良品 ...,1号店,Seed/十度良品
1011003022,家用电器|厨房电器|电热饭盒,爱友客（aiyouke）电饭盒不锈钢内胆多功能饭盒蒸蛋器保温 保温电热饭盒 加热插电饭盒 浪漫紫,玩具乐器>创意减压>创意玩具>爱友客>爱友客（aiyouke）电饭盒不锈钢内胆...,京东商城,麦宝创玩
1011003022,家用电器|厨房电器|电热饭盒,十度良品 SD-936电热饭盒 大容量不锈钢内胆蒸煮米饭加热饭盒,所有分类>大小家电、厨电、汽车>厨房电器>电热饭盒>十度良品>十度良品 SD-93...,1号店,十度良品
1011003022,家用电器|厨房电器|电热饭盒,NCN 恩西恩 电热饭盒 恒温加热 热饭煮饭 蒸煮蛋NCN-1315 不锈钢内胆 安全更卫生(紫),网络文化经营许可证京网文[2012] 0405 -126号 | 营业执照： 110105001308484,亚马逊(卓越网),NCN 恩西恩
1011003022,家用电器|厨房电器|电热饭盒,SKG  电热饭盒 全自动 时尚环保 大功率，多功能插电子加热蒸煮饭盒,首页 > SKG电器 > 电热饭盒 全自动 时尚环保 大功率,唯品会,无
1011003022,家用电器|厨房电器|电热饭盒,小熊/Bear DFH-S2011 电热饭盒 电加热饭盒电子饭盒 蒸煮 插电保温,首页>厨卫电器生活电器>厨房小家电>电热饭盒>小熊/BearDFH-S2011...,苏宁,小熊
1011003022,家用电器|厨房电器|电热饭盒,索力浦正品 电热饭盒 不锈钢电热饭盒 电子饭盒 正品,首页>厨卫电器生活电器>厨房小家电>电热饭盒>索力浦正品电热饭盒不锈钢电热饭盒...,苏宁,索力浦
1011003022,家用电器|厨房电器|电热饭盒,Bear小熊 电热饭盒DFH-S2012,首页 > 数码家电 > Bear 小熊 > Bear小熊 电热饭盒DFH-S2012,品聚网,Bear 小熊
1011003022,家用电器|厨房电器|电热饭盒,SKG 多功能保温 电热饭盒 TFC-01 蓝色,所有分类>大小家电、厨电、汽车>厨房电器>电热饭盒>SKG>SKG 多功能保温 ...,1号店,SKG
1011003022,家用电器|厨房电器|电热饭盒,SKG 多功能电热饭盒SKG-510 电加热饭盒 400W超大功率 极速加热 十项全能,所有分类>大小家电、厨电、汽车>厨房电器>电热饭盒>SKG>SKG 多功能电热饭盒SKG-510 电加热饭盒 400W超大功率 极速加热 十项全能,1号店,SKG
1011003022,家用电器|厨房电器|电热饭盒,SKG 便携式电热饭盒 TFC-02 白紫色,所有分类>大小家电、厨电、汽车>厨房电器>电热饭盒>SKG>SKG 便携式电热饭...,1号店,SKG
1011003022,家用电器|厨房电器|电热饭盒,十度良品 SD-902 蒸快乐电热饭盒(绿色),家用电器 > 厨房电器 > 其它厨房电器 >十度良品 SD-902 蒸快乐电热饭盒(绿...,高鸿商城,十度良品
1011003022,家用电器|厨房电器|电热饭盒,十度良品 SD-910 电热饭盒 不锈钢内胆 电饭盒 加热饭盒 环保餐具,所有分类>大小家电、厨电、汽车>厨房电器>电热饭盒>十度良品>十度良品 SD-91...,1号店,十度良品
1011003022,家用电器|厨房电器|电热饭盒,Bear/小熊 DFH-S2016 电热饭盒1.3L 便携式不锈钢电饭盒加热保温饭盒 双层密封保鲜饭盒,所有分类>大小家电、厨电、汽车>厨房电器>电热饭盒>Bear/小熊>Bear/小熊 DF...,1号店,Bear/小熊
1011003022,家用电器|厨房电器|电热饭盒,科立泰 电热饭盒 400W,首页 > 科立泰QLT&菲仕尔Fashion Cooker电器混合专场 > 科立泰 电热饭盒 400W,唯品会,无
1011003022,家用电器|厨房电器|电热饭盒,十度良品 电热饭盒 SD-909 不锈钢 插电 蒸饭器 加热饭盒 电饭盒,所有分类>大小家电、厨电、汽车>厨房电器>电热饭盒>十度良品>十度良品 电热饭盒 ...,1号店,十度良品
1011003022,家用电器|厨房电器|电热饭盒,Seed/十度良品 电饭盒 SD-922 真空保鲜电热饭盒 不锈钢 插电 加热饭盒,所有分类>大小家电、厨电、汽车>厨房电器>电热饭盒>Seed/十度良品>Seed/十度良品 ...,1号店,Seed/十度良品
1011003022,家用电器|厨房电器|电热饭盒,十度良品 SD-909三层大容量 不锈钢电热饭盒 加热饭盒 插电,所有分类>大小家电、厨电、汽车>厨房电器>电热饭盒>十度良品>十度良品 SD-90...,1号店,十度良品
1011003022,家用电器|厨房电器|电热饭盒,longde龙的 电热饭盒 NK-FH2001A,所有分类>大小家电、厨电、汽车>厨房电器>电热饭盒>Longde/龙的>longde龙的 电...,1号店,Longde/龙的
1011003022,家用电器|厨房电器|电热饭盒,爱友客 不锈钢电热饭盒 DFH-2012 全紫,首页>厨卫电器生活电器>厨房小家电>电热饭盒>爱友客不锈钢电热饭盒DFH-20...,苏宁,爱友客
1011003022,家用电器|厨房电器|电热饭盒,爱友客 三层304不锈钢内胆电热饭盒 DFH-2019 粉色,首页>厨卫电器生活电器>厨房小家电>电热饭盒>爱友客三层304不锈钢内胆电热饭盒...,苏宁,爱友客
1011003022,家用电器|厨房电器|电热饭盒,爱友客 多功能304不锈钢电热饭盒 DFH-2013 天蓝色款,首页>厨卫电器生活电器>厨房小家电>电热饭盒>爱友客多功能304不锈钢电热饭盒...,苏宁,爱友客
1011003022,家用电器|厨房电器|电热饭盒,美苏 MS-40 橙色多功能电热饭盒食品级塑料 加热保温电热饭,首页>厨卫电器生活电器>厨房小家电>电热饭盒>美苏MS-40橙色多功能电热饭盒...,苏宁,美苏
1011003022,家用电器|厨房电器|电热饭盒,小浣熊HM2016电热饭盒 蒸煮饭盒,首页>厨卫电器生活电器>厨房小家电>电热饭盒>小浣熊HM2016电热饭盒蒸煮饭盒,苏宁,小浣熊
1011003022,家用电器|厨房电器|电热饭盒,爱友客 DFH-2019 三层电热饭盒 电加热饭盒 304不锈钢内胆电饭盒,所有分类>大小家电、厨电、汽车>厨房电器>电热饭盒>爱友客>爱友客 DFH-20...,1号店,爱友客
1011003022,家用电器|厨房电器|电热饭盒,双狐 电热饭盒 BF-DFH150紫,所有分类>大小家电、厨电、汽车>厨房电器>电热饭盒>双狐>双狐 电热饭盒 BF...,1号店,双狐
1011003022,家用电器|厨房电器|电热饭盒,十度良品电热饭盒 SD-936 不锈钢 插电 蒸煮饭盒 加热饭盒 电饭盒(粉色),家居日用>保鲜盒/碗>十度良品>十度良品电热饭盒 SD-936 不锈钢 插电 蒸煮饭盒 加热饭盒 电饭盒(粉色),国美电器网上商城,竣丰汇通美之家专营店
1011003022,家用电器|厨房电器|电热饭盒,早中晚电热水壶S1801 + 早中晚电热饭盒ZZW-02,生活电器 厨卫电器>其他厨房电器>早中晚（zaozhongwan）>早中晚电热水壶S1801 + 早中晚电热饭盒ZZW-02,国美电器网上商城,早中晚（zaozhongwan）
1011003022,家用电器|厨房电器|电热饭盒,金力 I2多功能双层蒸煮电热饭盒(清新绿),生活电器 厨卫电器>电饭煲>金力（GINNIE）>金力 I2多功能双层蒸煮电热饭盒(清新绿),国美电器网上商城,金力电器旗舰店
1011003022,家用电器|厨房电器|电热饭盒,十度良品SD-910多功能不锈钢电热饭盒 插电加热饭盒 多功能 三胆,家居日用>其他工具>十度良品>十度良品SD-910多功能不锈钢电热饭盒 插电加热饭盒 多功能 三胆,国美电器网上商城,竣丰汇通美之家专营店
1011003022,家用电器|厨房电器|电热饭盒,十度良品SD-933加热饭盒 不锈钢内胆电热饭盒 5色可选 包邮(蓝色),家居日用>其他工具>十度良品>十度良品SD-933加热饭盒 不锈钢内胆电热饭盒 5色可选 包邮(蓝色),国美电器网上商城,竣丰汇通美之家专营店
1011003022,家用电器|厨房电器|电热饭盒,早中晚电热饭盒SKG510,生活电器 厨卫电器>其他厨房电器>早中晚（zaozhongwan）>早中晚电热饭盒SKG510,国美电器网上商城,早中晚（zaozhongwan）
1011003022,家用电器|厨房电器|电热饭盒,小熊电热饭盒 DFH-S2358 双层多功能电热饭盒 304不锈钢内胆 密封保鲜 2L大容量,首页>厨卫电器生活电器>厨房小家电>电热饭盒>小熊电热饭盒DFH-S2358双...,苏宁,小熊
1011003022,家用电器|厨房电器|电热饭盒,Seed/十度良品 电热饭盒 SD-967不锈钢电饭盒 电饭煲 三层插电保温定时密封保鲜加热饭盒,所有分类>大小家电、厨电、汽车>厨房电器>电热饭盒>Seed/十度良品>Seed/十度良品 ...,1号店,Seed/十度良品
1011003022,家用电器|厨房电器|电热饭盒,艾欣奇ZZW-01 炫彩时尚轻便电热饭盒 蓝色,首页>厨卫电器生活电器>厨房小家电>电热饭盒>艾欣奇ZZW-01炫彩时尚轻便电热...,苏宁,艾欣奇
1011003022,家用电器|厨房电器|电热饭盒,现代 1.5L粉红便携式不锈钢内胆电热饭盒,首页 > .现代HYUNDAI电器专场 > 1.5L粉红便携式不锈钢内胆电热饭盒,唯品会,无
1011003022,家用电器|厨房电器|电热饭盒,十度良品电热饭盒SD-923 三层大容量真空保鲜不锈钢内胆 加热饭盒,家用电器>厨房电器>多用途锅>十度良品>十度良品电热饭盒SD-923 三层大容量...,京东商城,十度良品旗舰店
1011003022,家用电器|厨房电器|电热饭盒,Rileosip 雅乐思 1.2L 电饭煲/电热饭盒 MFH-02 蓝色,所有分类>大小家电、厨电、汽车>厨房电器>电热饭盒>Rileosip/雅乐思>Rileosip 雅...,1号店,Rileosip/雅乐思
1011003022,家用电器|厨房电器|电热饭盒,金正 多功能电热饭盒1.2L,首页 > 金正NINTAUS电器专场 > 多功能电热饭盒1.2L,唯品会,无
1011003022,家用电器|厨房电器|电热饭盒,双层不锈钢内胆电热饭盒/蒸煮饭盒,厨具>烹饪锅具>煲类>京东良品>双层不锈钢内胆电热饭盒/蒸煮饭盒,京东商城,usn优尚专营店
1011003022,家用电器|厨房电器|电热饭盒,雅乐思（Rileosip）电热饭盒MFH-01粉,家用电器>厨房电器>多用途锅>雅乐思（Rileosip）>雅乐思（Rileosip）电热饭盒MFH...,京东商城,雅乐思电器旗舰店
1011003022,家用电器|厨房电器|电热饭盒,十度良品电饭盒 SD-903 电热饭盒加热饭盒 不锈钢双层加热保温经典,首页>厨卫电器生活电器>厨房小家电>电热饭盒>十度良品电饭盒SD-903电热饭...,苏宁,十度良品
1011003022,家用电器|厨房电器|电热饭盒,十度良品电热饭盒 SD-920 玻璃瓷内胆 插电保温加热饭盒 独立双胆,首页>厨卫电器生活电器>厨房小家电>电热饭盒>十度良品电热饭盒SD-920玻璃...,苏宁,十度良品
1011003022,家用电器|厨房电器|电热饭盒,十度良品 电热饭盒 SD-935 不锈钢 插电 蒸饭器 加热饭盒 电饭盒 真空密封,首页>厨卫电器生活电器>厨房小家电>电热饭盒>十度良品电热饭盒SD-935不...,苏宁,十度良品
1011003022,家用电器|厨房电器|电热饭盒,小熊 双层负压保鲜密封电热饭盒1.3L，1分钟出蒸汽负压保鲜,首页 > 小熊电器专场 > 双层负压保鲜密封电热饭盒1.3L,唯品会,无
1011003022,家用电器|厨房电器|电热饭盒,多功能电热饭盒 加热饭盒 1个颜色随机,家居家装>生活日用>收纳用品>魅之优品>多功能电热饭盒 加热饭盒 1个颜色随机,京东商城,义乌仁璟家居
1011003022,家用电器|厨房电器|电热饭盒,伊莱特（Enaiter ）电热饭盒HM-2018不锈钢内胆 电子蒸煮饭盒 2L(蓝色),生活电器 厨卫电器>电蒸锅/炖锅>伊莱特（Enaiter）>伊莱特（Enaiter ）电热饭盒HM-2018不锈钢内胆 电子蒸煮饭盒 2L(蓝色),国美电器网上商城,伊莱特（Enaiter）
1011003022,家用电器|厨房电器|电热饭盒,麦卓 MJ-2011电热饭盒 不锈钢内胆电加热饭盒(咖啡色 1.2L带餐具三件套),生活电器 厨卫电器>电蒸锅/炖锅>麦卓（MAKEJOY）>麦卓 MJ-2011电热饭盒 不锈钢内胆电加热饭盒(咖啡色 1.2L带餐具三件套),国美电器网上商城,麦卓（MAKEJOY）
1011003022,家用电器|厨房电器|电热饭盒,艾纳优 A-325真空保鲜 电热饭盒 不锈钢 加热饭盒,家用电器>厨房电器>多用途锅> 艾纳优（inayou）>艾纳优 A-325真空保鲜 电热饭盒 不...,京东商城,艾纳优官方旗舰店
1011003022,家用电器|厨房电器|电热饭盒,富贵熊 学生宿舍 单身白领 迷你电饭煲 电饭1-2人学生1.2L黄金容量电热饭盒,所有分类>大小家电、厨电、汽车>厨房电器>电热饭盒>富贵熊>富贵熊 学生宿舍 单...,1号店,富贵熊
1011003022,家用电器|厨房电器|电热饭盒,Bear/小熊 电热饭盒 DFH-S205,生活电器 厨卫电器>其他厨房电器>小熊（Bear）>Bear/小熊 电热饭盒 DFH-S205,国美电器网上商城,小熊（Bear）
1011003022,家用电器|厨房电器|电热饭盒,【天际官方旗舰店】Tonze/天际 电热饭盒 FHJ-W130A 不锈钢内胆 加热保温蒸煮 电子饭盒 1升容量,家用电器 > 厨房电器 > 电饭煲 > 【天际官方旗舰店】Tonze/天际 电热饭盒 FHJ-W130A 不锈钢内胆 ...,当当网,天际
1011003022,家用电器|厨房电器|电热饭盒,十度良品电热饭盒 SD-937 不锈钢 插电保温 定时 加热饭盒 电饭盒,首页>厨卫电器生活电器>厨房小家电>电热饭盒>十度良品电热饭盒SD-937不锈...,苏宁,十度良品
1011003022,家用电器|厨房电器|电热饭盒,十度良品加热饭盒SD-909插电饭盒保温不锈钢内胆电热饭盒蒸煮饭盒,首页>厨卫电器生活电器>厨房小家电>电热饭盒>十度良品加热饭盒SD-909插电饭盒...,苏宁,十度良品
1011003022,家用电器|厨房电器|电热饭盒,艾纳优 A-313C 迷你电饭煲 1.6L 智能小电饭煲 2-3人电饭锅 电热饭盒 酸奶机功能,所有分类>大小家电、厨电、汽车>厨房电器>电饭煲>艾纳优>艾纳优 A-313C 迷你电饭煲 1.6L 智能小电饭煲 2-3人电饭锅 电热饭盒 酸奶机功能,1号店,艾纳优
1011003022,家用电器|厨房电器|电热饭盒,Bear 小熊 DFH-S2116 不锈钢电热饭盒,电视、空调、家用电器 > 厨卫电器 > 电火锅/多用途锅 > Bear 小熊 DFH-S2116 不锈钢电热饭盒,百联E城,
1011003022,家用电器|厨房电器|电热饭盒,十度良品SD-923电热饭盒 不锈钢 加热饭盒三层真空密封电饭盒保鲜,首页>厨卫电器生活电器>厨房小家电>电热饭盒>十度良品SD-923电热饭盒不锈钢...,苏宁,十度良品
1011003022,家用电器|厨房电器|电热饭盒,麦卓MakejoyMJ-2012电热饭盒不锈钢内胆电加热饭盒3层酸奶机煮蛋器蒸蛋器 粉红色,家用电器>厨房电器>多用途锅> 麦卓>麦卓MakejoyMJ-2012电热饭盒...,京东商城,麦卓电器旗舰店
1011003022,家用电器|厨房电器|电热饭盒,麦卓Makejoy多功能电热饭盒MJ-2014不锈钢内胆热饭蒸饭煮蛋器蒸蛋器,家用电器>厨房电器>多用途锅> 麦卓>麦卓Makejoy多功能电热饭盒MJ-2...,京东商城,麦卓电器旗舰店
1011003022,家用电器|厨房电器|电热饭盒,十度良品电热饭盒SD-970多功能双层负压保鲜三档开关保温插电热饭盒,首页>厨卫电器生活电器>厨房小家电>电热饭盒>十度良品电热饭盒SD-970多功能双...,苏宁,十度良品(SEED)
1011003022,家用电器|厨房电器|电热饭盒,Lecon/乐创 LC-130 电热饭盒 便携式电子电饭盒蒸煮快速加热,首页>厨卫电器生活电器>厨房小家电>电热饭盒>Lecon/乐创LC-130电热...,苏宁,乐创(lecon)
1011003022,家用电器|厨房电器|电热饭盒,欧科OKF-230B 电热饭盒 电饭盒 迷你电饭煲 双层蒸煮饭盒 不锈钢内胆 蒸煮热均可,首页>厨卫电器生活电器>厨房小家电>电热饭盒>欧科OKF-230B电热饭盒电饭...,苏宁,欧科
1011003022,家用电器|厨房电器|电热饭盒,SKG 液体加热器 SKG-510 大容量电热饭盒 白紫色,所有分类>大小家电、厨电、汽车>厨房电器>电热饭盒>SKG>SKG 液体加热器 ...,1号店,SKG
1011003022,家用电器|厨房电器|电热饭盒,十度良品 SD-902 蒸快乐电热饭盒(黄色),家用电器 > 厨房电器 > 其它厨房电器 >十度良品 SD-902 蒸快乐电热饭盒(黄...,高鸿商城,十度良品
1011003022,家用电器|厨房电器|电热饭盒,十度良品 SD-905 双层不锈钢电热饭盒 电饭盒,所有分类>大小家电、厨电、汽车>厨房电器>电热饭盒>十度良品>十度良品 SD-90...,1号店,十度良品
1011003022,家用电器|厨房电器|电热饭盒,Bear/小熊 DFH-S2116多功能不锈钢电热饭盒加热饭盒 1.3L大容量饭煲双层密封保温电饭锅,所有分类>大小家电、厨电、汽车>厨房电器>电热饭盒>Bear/小熊>Bear/小熊 DF...,1号店,Bear/小熊
1011003022,家用电器|厨房电器|电热饭盒,Bear/小熊 DFH-S2017 多功能不锈钢蒸煮电热饭盒 2L大容量单双层随意组合 插电加热饭盒,所有分类>大小家电、厨电、汽车>厨房电器>电热饭盒>Bear/小熊>Bear/小熊 DF...,1号店,Bear/小熊
1011003022,家用电器|厨房电器|电热饭盒,longde龙的 电热饭盒 NK-FH2002 全不锈钢内胆,电热饭盒 > ,1号店,Longde/龙的
1011003022,家用电器|厨房电器|电热饭盒,格来德电热饭盒GEB-1001,首页>厨卫电器生活电器>厨房小家电>电热饭盒>格来德电热饭盒GEB-1001,苏宁,格来德
1011003022,家用电器|厨房电器|电热饭盒,诺洁仕 电热饭盒CE-B1 加热保温饭盒 便当盒,所有分类>大小家电、厨电、汽车>厨房电器>电热饭盒>诺洁仕>诺洁仕 电热饭盒CE...,1号店,诺洁仕
1011003022,家用电器|厨房电器|电热饭盒,TCL 电热饭盒,首页 > TCL&松下Panasonic家电专场 > TCL 电热饭盒,唯品会,TCL
1011003022,家用电器|厨房电器|电热饭盒,小熊 2L双层大容量电热饭盒,首页 > .小熊电器专场 > 2L双层大容量电热饭盒,唯品会,无
1011003022,家用电器|厨房电器|电热饭盒,十度良品 SD-933 电热饭盒 304食品级不锈钢内胆 二层 蒸煮米饭 加热饭盒,所有分类>大小家电、厨电、汽车>厨房电器>电热饭盒>十度良品>十度良品 SD-93...,1号店,十度良品
1011003022,家用电器|厨房电器|电热饭盒,好妈咪 多功能电热饭盒 HMI-F610,所有分类>大小家电、厨电、汽车>厨房电器>电热饭盒>好妈咪>好妈咪 多功能电热饭...,1号店,好妈咪
1011003022,家用电器|厨房电器|电热饭盒,十度良品 SD-218不锈钢电热饭盒 加热饭盒 插电保温 电煮锅 电饭煲 电炖盅电火锅 煲汤,所有分类>大小家电、厨电、汽车>厨房电器>电热饭盒>十度良品>十度良品 SD-21...,1号店,十度良品
1011003022,家用电器|厨房电器|电热饭盒,十度良品 SD-910三层不锈钢电热饭盒 加热饭盒 插电饭盒保温电饭盒,所有分类>大小家电、厨电、汽车>厨房电器>电热饭盒>十度良品>十度良品 SD-91...,1号店,十度良品
1011003022,家用电器|厨房电器|电热饭盒,Seed/十度良品 电热饭盒SD-923 三层大容量真空保鲜不锈钢内胆 加热饭盒,所有分类>大小家电、厨电、汽车>厨房电器>电热饭盒>Seed/十度良品,1号店,电热饭盒
1011003022,家用电器|厨房电器|电热饭盒,Seed/十度良品 电饭盒SD-909 三层大容量 不锈钢电热饭盒 加热饭盒 插电,所有分类>大小家电、厨电、汽车>厨房电器>电热饭盒>Seed/十度良品,1号店,电热饭盒
1011003022,家用电器|厨房电器|电热饭盒,十度良品 SD-936电热饭盒 大容量不锈钢内胆蒸煮米饭加热饭盒,所有分类>大小家电、厨电、汽车>厨房电器>电热饭盒>十度良品>十度良品 SD-93...,1号店,十度良品
1011003022,家用电器|厨房电器|电热饭盒,金力 电热饭盒 I2,所有分类>大小家电、厨电、汽车>厨房电器>电热饭盒>金力>金力 电热饭盒 I2,1号店,金力
1011003022,家用电器|厨房电器|电热饭盒,longde龙的 电热饭盒 NK-FH2002 全不锈钢内胆,所有分类>大小家电、厨电、汽车>厨房电器>电热饭盒>Longde/龙的>longde龙的 电...,1号店,Longde/龙的
1011003022,家用电器|厨房电器|电热饭盒,爱友客 插电不锈钢电热饭盒 DFH-2012 白粉色,首页>厨卫电器生活电器>厨房小家电>电热饭盒>爱友客插电不锈钢电热饭盒DFH-...,苏宁,爱友客
1011003022,家用电器|厨房电器|电热饭盒,小浣熊 HM-2016 电热饭盒 两层蒸煮饭盒 不锈钢内胆 蒸煮热皆可,首页>厨卫电器生活电器>厨房小家电>电热饭盒>小浣熊HM-2016电热饭盒两...,苏宁,小浣熊
1011003022,家用电器|厨房电器|电热饭盒,十度良品电热饭盒SD-937+福瑞康厨房秤VBS-305,首页>厨卫电器生活电器>厨房小家电>电热饭盒>十度良品电热饭盒SD-937+福瑞康...,苏宁,十度良品
1011003022,家用电器|厨房电器|电热饭盒,小熊（Bear）蒸煮电热饭盒DFH-S2011,生活电器 厨卫电器>电饭煲>小熊（Bear）>小熊（Bear）蒸煮电热饭盒DFH-S2011,国美电器网上商城,小熊电器官方旗舰店
1011003022,家用电器|厨房电器|电热饭盒,爱友客 电热饭盒 专用不锈钢汤盒 AYK-005,生活电器 厨卫电器>其他厨房电器>爱友客（aiyouke）>爱友客 电热饭盒 专用不锈钢汤盒 AYK-005,国美电器网上商城,鸿瑞电器旗舰店
1011003022,家用电器|厨房电器|电热饭盒,Bear/小熊 电热饭盒DFH-S2011,生活电器 厨卫电器>其他厨房电器>小熊（Bear）>Bear/小熊 电热饭盒DFH-S2011,国美电器网上商城,小熊（Bear）
1011003022,家用电器|厨房电器|电热饭盒,小熊（Bear）DFH-S2012 便携式不锈钢蒸煮电热饭盒（深紫色）,首页>厨卫电器生活电器>厨房小家电>电热饭盒>小熊（Bear）DFH-S2012...,苏宁,小熊
1011003022,家用电器|厨房电器|电热饭盒,金正 多功能电热饭盒1.2L,首页 > 金正NINTAUS电器专场 > 多功能电热饭盒1.2L,唯品会,无
1011003022,家用电器|厨房电器|电热饭盒,十度良品SD-933加热饭盒 不锈钢内胆电热饭盒 5色可选 包邮(蓝色),家居日用>其他工具>十度良品>十度良品SD-933加热饭盒 不锈钢内胆电热饭盒 5色可选 包邮(蓝色),国美电器网上商城,竣丰汇通美之家专营店
1011003022,家用电器|厨房电器|电热饭盒,小熊 立体定位受热电热饭盒1.3L,首页 > 小熊电器专场 > 立体定位受热电热饭盒1.3L,唯品会,无
1011003022,家用电器|厨房电器|电热饭盒,亿利来GE-X2 蒸煮饭盒 多功能加热饭盒 电子饭盒 电热饭盒不锈钢饭盒(绿色）(橙色),生活电器 厨卫电器>其他厨房电器>亿利来（Yililai）>亿利来GE-X2 蒸煮饭盒 多功能加热饭盒 电子饭盒 电热饭盒不锈钢饭盒(绿色）(橙色),国美电器网上商城,雅轩电器专营店
1011003022,家用电器|厨房电器|电热饭盒,小熊 立体定位受热电热饭盒1.3L,首页 > 小熊电器专场 > 立体定位受热电热饭盒1.3L,唯品会,无
1011003022,家用电器|厨房电器|电热饭盒,十度良品蒸功夫饭盒 电热饭盒 加热插电饭盒SD-938 黄色,厨具>厨房配件>饭盒/提锅>喜家家>十度良品蒸功夫饭盒 电热饭盒 加热插电饭...,京东商城,喜家家家居生活馆
1011003022,家用电器|厨房电器|电热饭盒,十度良品电热饭盒SD-921 不锈钢加热饭盒 插电 真空保鲜密封 咖啡色,家用电器>厨房电器>多用途锅>十度良品>十度良品电热饭盒SD-921 不锈钢加热...,京东商城,十度良品旗舰店
1011003022,家用电器|厨房电器|电热饭盒,美苏MS-D03电热饭盒 多功能加热 蒸煮饭盒1.2L 不锈钢内胆 地区包邮,生活电器 厨卫电器>其他厨房电器>美苏>美苏MS-D03电热饭盒 多功能加热 蒸煮饭盒1.2L 不锈钢内胆 地区包邮,国美电器网上商城,雅轩电器专营店
1011003022,家用电器|厨房电器|电热饭盒,亿利来DFH-2012不锈钢蒸煮饭盒 电热饭盒包邮 蒸蛋正品(蓝色),生活电器 厨卫电器>其他厨房电器>亿利来（Yililai）>亿利来DFH-2012不锈钢蒸煮饭盒 电热饭盒包邮 蒸蛋正品(蓝色),国美电器网上商城,雅轩电器专营店
1011003022,家用电器|厨房电器|电热饭盒,金正 多功能电热饭盒1.5L,首页 > 金正NINTAUS电器专场 > 多功能电热饭盒1.5L,唯品会,无
1011003022,家用电器|厨房电器|电热饭盒,十度良品 SD-902蒸快乐电热饭盒 插电饭盒 多功能加热双层蒸煮 食品级PP 双胆 粉色,所有分类>大小家电、厨电、汽车>厨房电器>电热饭盒>十度良品>十度良品 SD-90...,1号店,十度良品
