1011002024,家用电器|生活电器|暖手宝、暖脚宝,富嘉牌小号暖手饼/暖手宝(12CM)FJ-250W,家用电器?>?生活电器?>?电热毯/电热袋?>?商品详情,当当网,富嘉
1011002024,家用电器|生活电器|暖手宝、暖脚宝,富迪 FD-b004暖宝袋暖手袋暖宝宝，家用暖手宝，可充电,家用电器?>?生活电器?>?电热毯/电热袋?>?商品详情,当当网,富迪
1011002024,家用电器|生活电器|暖手宝、暖脚宝,爱贝斯 电暖宝 毛绒插电暖宝宝包邮 插手暖手宝 正品保暖电热宝,家居家装>家纺>电热毯>爱贝斯>爱贝斯 电暖宝 毛绒插电暖宝宝包邮 插手...,京东商城,汉之亲家纺旗舰店
1011002024,家用电器|生活电器|暖手宝、暖脚宝,彩阳 全线路 安全保护 多功能调温型暖手暖脚宝（纸盒）37×37cm 8002,所有分类>家居家纺、锅具餐具>床上用品>电热毯>彩阳>彩阳 全线路 安全保...,1号店,彩阳
1011002024,家用电器|生活电器|暖手宝、暖脚宝,彩虹 TB21暖手器 电热饼 暖手器  暖手宝,家用电器?>?生活电器?>?电热毯/电热袋?>?商品详情,当当网,彩虹
1011002024,家用电器|生活电器|暖手宝、暖脚宝,三春插电暖脚宝 电暖宝 电暖鞋 冬季保暖电热鞋 暖脚器 正品,家居家装>家纺>电热毯>三春>三春插电暖脚宝 电暖宝 电暖鞋 冬季保暖...,京东商城,
1011002024,家用电器|生活电器|暖手宝、暖脚宝,春笑 暖脚宝/暖脚鞋/暖脚王/电暖鞋/暖鞋王电热鞋 卡通款红宝宝,家居家装>家纺>电热毯>春笑>春笑 暖脚宝/暖脚鞋/暖脚王/电暖鞋/暖...,京东商城,苏适家居
1011002024,家用电器|生活电器|暖手宝、暖脚宝,[当当自营]惠风 暖手宝 HF-04 枕形卡通丝光电暖宝/电暖袋  花色随机,家用电器?>?生活电器?>?电热毯/电热袋?>?商品详情,当当网,惠风
1011002024,家用电器|生活电器|暖手宝、暖脚宝,彩虹 多用途电热垫 暖身宝 电暖脚 暖手脚 TB111,所有分类>家居家纺、锅具餐具>床上用品>电热毯>彩虹,1号店,电热毯
1011002024,家用电器|生活电器|暖手宝、暖脚宝,三春17858安全控温暖脚宝 暖脚鞋 居家电暖垫暖宝宝 颜色随机发 均码,家居家装>家纺>电热毯>三春>三春17858安全控温暖脚宝 暖脚鞋 居...,京东商城,科鹿优品专营店
1011002024,家用电器|生活电器|暖手宝、暖脚宝,爱贝斯多功能发热垫 书写垫 电暖垫 暖手宝 电热桌垫 暖手暖脚垫58993,家居家装>家纺>电热毯>爱贝斯>爱贝斯多功能发热垫 书写垫 电暖垫 暖手...,京东商城,爱贝斯旗舰店
1011002024,家用电器|生活电器|暖手宝、暖脚宝,富洋正品嘟嘟羊热水袋双插手卡通毛绒电热水袋防爆暖手袋,家用电器?>?生活电器?>?电热毯/电热袋?>?商品详情,当当网,富洋
1011002024,家用电器|生活电器|暖手宝、暖脚宝,美美MM313(A-200A1)暖水袋电暖袋暖手暖脚暖腰电热水袋充电式无需注水 电暖袋 电暖袋,家居家装>家装软饰>保暖防护>美美（Maymay）>美美MM313(A-200A1)暖水袋电...,京东商城,赛玛日用品专营店
1011002024,家用电器|生活电器|暖手宝、暖脚宝,春笑牌直插电试两档调温电暖鞋/电热鞋/暖脚宝/暖脚鞋/暖脚王 红色,家居家装>家装软饰>其他>红缨枪>春笑牌直插电试两档调温电暖鞋/电热鞋/暖...,京东商城,海燕家居专营店
1011002024,家用电器|生活电器|暖手宝、暖脚宝,博弘 卡通毛绒防爆充电热水袋创意暖水袋热水袋电暖宝暖Q5106小鹿,家居日用?>?清洁护理?>?暖宝宝?>?商品详情,当当网,博弘
1011002024,家用电器|生活电器|暖手宝、暖脚宝,家博士水电分离热水袋暖水袋JBS-N008-1湖蓝,首页>家居/家装建材/厨具>生活日用>生活日用>家博士水电分离热水袋暖水袋JBS-N...,苏宁,家博士
1011002024,家用电器|生活电器|暖手宝、暖脚宝,御泉坊 威将电热垫 可拆洗 暖脚宝 电暖宝 电暖鞋 暖手宝宝,所有分类>家居家纺、锅具餐具>装饰/日用>取暖/降温>暖手宝/热水袋>御泉坊>御泉坊 威将电热垫 ...,1号店,御泉坊
1011002024,家用电器|生活电器|暖手宝、暖脚宝,集暖 可拆洗防爆电热水袋十二生肖之猴暖手袋暖手宝暖水袋电暖宝电热宝褐色,所有分类>大小家电、厨电、汽车>生活电器>其它生活电器>集暖>集暖 可拆洗防爆电热...,1号店,集暖
1011002024,家用电器|生活电器|暖手宝、暖脚宝,博弘 2013新款电热水袋充电防爆暖水袋暖手宝充水毛绒暖手,家居日用?>?清洁护理?>?暖宝宝?>?商品详情,当当网,博弘
1011002024,家用电器|生活电器|暖手宝、暖脚宝,家博士 毛绒 水电分离 暖水袋 JBS-N008,所有分类>家居家纺、锅具餐具>装饰/日用>取暖/降温>暖手宝/热水袋>家博士>家博士 毛绒 水电分...,1号店,家博士
1011002024,家用电器|生活电器|暖手宝、暖脚宝,振兴布塑热水袋/暖水袋 暖宝宝 热水袋 电暖袋 电暖宝 暖脚宝 暖手宝电暖袋 电暖宝 暖脚宝 大号FEM7514),家居日用 > 清洁护理 > 暖宝宝,当当网,振兴
1011002024,家用电器|生活电器|暖手宝、暖脚宝,富嘉电热暖水袋/电暖袋/暖手袋/暖手宝 丝光七彩烫金 梅花型,家用电器?>?生活电器?>?电热毯/电热袋?>?商品详情,当当网,富嘉
1011002024,家用电器|生活电器|暖手宝、暖脚宝,惠风 阿狸超柔热水袋 暖手宝 充电暖宝 暖水袋暖手袋正品防爆 K132 咖啡色,$N,亚马逊(卓越网),惠风
1011002024,家用电器|生活电器|暖手宝、暖脚宝,红缨枪已注水双插手卡通防爆电热水袋 暖水袋 暖手宝 电热宝 电暖宝 咖啡色美人狐,家居家装>家装软饰>保暖防护>红缨枪>红缨枪已注水双插手卡通防爆电热水袋 暖水...,京东商城,海燕家居专营店
1011002024,家用电器|生活电器|暖手宝、暖脚宝,JOYMON巨铭可拆洗暖腰带　充电热水袋　双插手暖手宝电暖水袋手捂　注水 双插手灰可爱猫,家居家装>家装软饰>保暖防护>巨铭>JOYMON巨铭可拆洗暖腰带　充电热水袋...,京东商城,巨铭伟业专营店
1011002024,家用电器|生活电器|暖手宝、暖脚宝,春笑 电暖袋暖脚宝/暖脚鞋电暖鞋 电热鞋 (含电热水袋),所有分类>家居家纺、锅具餐具>装饰/日用>取暖/降温>暖脚宝/暖脚垫>春笑>春笑 电暖袋暖脚宝/...,1号店,春笑
1011002024,家用电器|生活电器|暖手宝、暖脚宝,泉力 QUANLI 热水袋 充电防爆电热水袋 暖手宝 暖水袋 电暖宝 电暖袋 蒙奇奇,所有分类>家居家纺、锅具餐具>装饰/日用>取暖/降温>暖手宝/热水袋>泉力 QUANLI>泉力 QUANLI ...,1号店,泉力 QUANLI
1011002024,家用电器|生活电器|暖手宝、暖脚宝,泉力电热水袋 2013新款 已注水 充电 防暴 暖水袋 双插手暖手宝 黄色蝴蝶结,家居家装>家装软饰>其他>泉力>泉力电热水袋 2013新款 已注水 充电...,京东商城,佳易购家居专营店
1011002024,家用电器|生活电器|暖手宝、暖脚宝,孙小圣 卡通系列热水袋暖手宝毛绒充电双插手暖水袋 创意礼品 灰色轻松熊,礼品箱包>礼品>创意礼品>孙小圣>孙小圣 卡通系列热水袋暖手宝毛绒充电双插...,京东商城,孙小圣创意礼品旗舰店
1011002024,家用电器|生活电器|暖手宝、暖脚宝,喜家家充电热水袋冬季暖水袋保暖暖手宝暖宝宝 猫头型憨菜菜/蓝色,家居家装>家装软饰>保暖防护>喜家家>喜家家充电热水袋冬季暖水袋保暖暖手宝暖宝...,京东商城,喜家家家居生活馆
1011002024,家用电器|生活电器|暖手宝、暖脚宝,泉力电热水袋 2013新款 已注水 充电 防暴 暖水袋 双插手暖手宝 卡其色熊掌,家居家装>家装软饰>其他>泉力>泉力电热水袋 2013新款 已注水 充电...,京东商城,佳易购家居专营店
1011002024,家用电器|生活电器|暖手宝、暖脚宝,汇丰信佳 韩式印花型 中号 冲水热水袋充水 暖手袋 暖水袋 暖手宝,家居日用?>?清洁护理?>?暖宝宝?>?商品详情,当当网,汇丰信佳
1011002024,家用电器|生活电器|暖手宝、暖脚宝,博弘 2013新款毛绒充电防爆电热水袋 暖水袋 暖手宝 暖宝宝(Q2114熊二),家居日用>居家软饰>春笑>博弘 2013新款毛绒充电防爆电热水袋 暖水袋 暖手宝 暖宝宝(Q2114熊二),国美,衢州普润家居专营店
1011002024,家用电器|生活电器|暖手宝、暖脚宝,暖之缘暖手宝 充电热水袋防爆暖水袋电暖宝电热宝 插电毛绒 创意暖手袋 电热水袋 紫色小熊,家居家装>家装软饰>其他>春笑>暖之缘暖手宝 充电热水袋防爆暖水袋电暖宝...,京东商城,维双家居专营店
1011002024,家用电器|生活电器|暖手宝、暖脚宝,暖之缘系列 充电毛绒热水袋 双插手暖水袋电暖宝宝电热宝 防爆暖手宝袋 电暖袋 浣熊棕色Q3105,家居家装>家装软饰>保暖防护>其它>暖之缘系列 充电毛绒热水袋 双插手暖水袋...,京东商城,缤纷家居馆
1011002024,家用电器|生活电器|暖手宝、暖脚宝,【尚福乐】特大号热水袋2000ML(橡胶注水热水袋暖手袋暖水袋暖手宝),家居家装>清洁用品>清洁工具>美好家 >【尚福乐】特大号热水袋2000ML(橡胶...,京东商城,美好家居
1011002024,家用电器|生活电器|暖手宝、暖脚宝,春笑牌 丝光布电热水袋/电暖袋/电暖宝/暖水袋SGL01,家居 > 居家防护 > 保暖用品 > 热水袋,亚马逊(卓越网),春笑
1011002024,家用电器|生活电器|暖手宝、暖脚宝,fashy 德国进口fashy热水袋/暖水袋/热敷袋/冰敷袋/暖脚垫北极风情热水袋 灰色6771,所有分类>家居家纺、锅具餐具>装饰/日用>取暖/降温>暖手宝/热水袋>fashy>fashy 德国进口...,1号店,fashy
1011002024,家用电器|生活电器|暖手宝、暖脚宝,FASHY 利快德国进口秘鲁风情 热水袋/暖水袋 (紫色),$N,亚马逊(卓越网),Fashy 利快
1011002024,家用电器|生活电器|暖手宝、暖脚宝,暖冬必备【非电暖宝】超大号冬季灌水冲水橡胶热水袋暖手宝双面防烫暖水袋情侣款 暖手暖脚宝 红绿蓝各一个,家居家装>家装软饰>其他>悠趣>暖冬必备【非电暖宝】超大号冬季灌水冲水橡...,京东商城,悠趣
1011002024,家用电器|生活电器|暖手宝、暖脚宝,博弘 充电暖宫带暖腰带暖腰宝 痛经热宝电热水袋电暖宝暖手宝 未注水电热宝（红色）,家居家装>家装软饰>其他>红兔子>博弘 充电暖宫带暖腰带暖腰宝 痛经热宝电...,京东商城,
1011002024,家用电器|生活电器|暖手宝、暖脚宝,家博士 JBS-N0011 生气乖乖热水袋 暖水袋,所有分类 > 生活电器、汽车生活 > 生活电器 > 取暖电器 > 家博士,1号店,$N
1011002024,家用电器|生活电器|暖手宝、暖脚宝,乐雪儿 电热水袋 电暖宝 暖腰宝暖腰带 暖手宝 暖水袋充电暖腰带,家居家装>家装软饰>其他>乐雪儿>乐雪儿 电热水袋 电暖宝 暖腰宝暖腰带 ...,京东商城,淘金百货
1011002024,家用电器|生活电器|暖手宝、暖脚宝,费许fashy 坐垫式热水袋 6425 红色 1.2升暖水袋,FASHY>费许fashy 坐垫式热水袋 6425 ...,京东商城,fashy专卖店
1011002024,家用电器|生活电器|暖手宝、暖脚宝,菲绣绣艺 上禾电器 电暖袋 韩版卡通电热水袋 时尚暖手宝 暖水袋 随机发货 N1-10,家居家装>生活日用>家装软饰>菲绣绣艺 上禾电器 电暖袋 韩版卡通电...,京东商城,菲绣绣艺家居
1011002024,家用电器|生活电器|暖手宝、暖脚宝,红兔子卡通毛绒防爆充电热水袋暖手宝创意 暖水袋电暖宝暖手袋暖宝宝 暖手宝 暖脚宝 Q5103树熊,$N,亚马逊(卓越网),红兔子
1011002024,家用电器|生活电器|暖手宝、暖脚宝,鱼型、猪型暖水袋/暖手袋 (黄色, 猪型),家用/类别/家居/居家防护/保暖用品/热水袋,亚马逊(卓越网)
1011002024,家用电器|生活电器|暖手宝、暖脚宝,博弘 2013新款电热水袋充电防爆暖水袋暖手宝 未注水电热宝 毛绒暖手袋双插手（玫红色）,家居家装>家装软饰>其他>红兔子>博弘 2013新款电热水袋充电防爆暖水袋...,京东商城,
1011002024,家用电器|生活电器|暖手宝、暖脚宝,edon特价促销毛绒防爆双插手充电热水袋暖手宝热宝暖宝宝暖水袋电暖袋暖手袋hot water bag warm hand暖宝贴暖贴electric heating water bag正品公仔 (黑白熊猫),家居 > 居家防护 > 保暖用品 > 热水袋,亚马逊(卓越网),EDON
1011002024,家用电器|生活电器|暖手宝、暖脚宝,孙小圣 充电热水袋 防暴暖水袋 双插手暖手宝 卡通毛绒电暖宝 冬季必备品 (趴趴熊圆点浅绿),尊贵的新老客户：凡在亚马逊网豆商城购买的任何物品，只要出现任何商品、服务等质量问题，请邮件联系我们售后，我们将第一时间为您解决！ 网豆商城主页面：www.amazon.cn/shops/AE8WHW252G14L 点此查看如何获得促销优惠 (促销说明),亚马逊(卓越网),尤物
1011002024,家用电器|生活电器|暖手宝、暖脚宝,泉力 充电热水袋 电暖宝暖手宝暖宝宝 绒布已注水防爆暖水袋 双插手 (灰色呆呆熊),$N,亚马逊(卓越网),泉力
1011002024,家用电器|生活电器|暖手宝、暖脚宝,H暖手宝 热水袋 电热水袋 充电 防爆毛绒暖手宝暖水袋电暖宝暖手袋 安吉拉粉色兔,家居家装>家装软饰>其他>三代>H暖手宝 热水袋 电热水袋 充电 防爆毛...,京东商城,任逍遥家居专营店
1011002024,家用电器|生活电器|暖手宝、暖脚宝,家博士梅花型猫象和系列充电热水袋暖手宝暖水袋金色象,首页>家居/家装建材/厨具>生活日用>生活日用>家博士梅花型猫象和系列充电热水袋暖手...,苏宁,家博士
1011002024,家用电器|生活电器|暖手宝、暖脚宝,易普 柔性电暖宝ZY-01/电热水袋/电暖水袋/碎花绒布枕型（热敷/暖手/暖腰/暖胃/暖背/专利防爆/快速升温/持久保暖/对神经痛、腰腿痛有良好热敷作用),点击查看个护健康店特价折扣区，低价购买日用清洁、医疗器械、眼镜护理、口腔护理、保健品、成人用品等,亚马逊(卓越网),易普
1011002024,家用电器|生活电器|暖手宝、暖脚宝,惠通 电热水袋 防爆暖水袋毛绒卡通暖手宝电暖宝暖手袋 可拆卸 已注水 包邮,首页>家居/家装建材/厨具>生活日用>生活日用>惠通电热水袋防爆暖水袋毛绒卡通暖...,苏宁,惠通
1011002024,家用电器|生活电器|暖手宝、暖脚宝,爱之家 庆丰 热水袋 冲水 热水袋充水 暖手袋 暖水袋 1750ml 30*15CM 颜色随机发,Home,亚马逊(卓越网),庆丰
1011002024,家用电器|生活电器|暖手宝、暖脚宝,淘乐士 怀旧大号橡胶热水袋/加厚暖水袋/暖手宝 热宝暖手暖脚热敷颜色随机,所有分类>家居家纺、锅具餐具>装饰/日用>取暖/降温>暖手宝/热水袋>淘乐士>淘乐士 怀旧大号橡胶...,1号店,淘乐士
1011002024,家用电器|生活电器|暖手宝、暖脚宝,悦萌 冬天保暖贮水式毛绒布袋灌水冲水热水袋 暖手袋暖手宝 暖水袋,所有分类>家居家纺、锅具餐具>装饰/日用>取暖/降温>暖手宝/热水袋>悦萌>悦萌 冬天保暖贮水式...,1号店,悦萌
1011002024,家用电器|生活电器|暖手宝、暖脚宝,易普 丛林兄弟手捂水电隔离式 充电式电暖宝 暖手宝 电暖水袋 热敷腰腹 热脚(狮子),家装建材>智能居家>易普（eap）>易普 丛林兄弟手捂水电隔离式 充电式电暖宝 暖手宝 电暖水袋 热敷腰腹 热脚(狮子),国美电器网上商城,牧童家居专营店
1011002024,家用电器|生活电器|暖手宝、暖脚宝,博弘 充电暖宫带暖腰带暖腰宝 痛经热宝电热水袋电暖宝暖手宝 未注水电热宝 Q2112 红色,家居家装>家装软饰>其他>红兔子>博弘 充电暖宫带暖腰带暖腰宝 痛经热宝电...,京东商城,
1011002024,家用电器|生活电器|暖手宝、暖脚宝,泉力 QUANLI 电热水袋 充电 暖手宝 暖水袋 充电防爆电暖袋 国标水电分离,所有分类>家居家纺、锅具餐具>装饰/日用>取暖/降温>暖手宝/热水袋>泉力 QUANLI>泉力 QUANLI ...,1号店,泉力 QUANLI
1011002024,家用电器|生活电器|暖手宝、暖脚宝,锐智 暖腰宝RZ-904 暖膝宝RZ-903 暖颈宝RZ-901 缓解多种疼痛 安全无副作用 自动恒温 防水防潮 可拆洗电热水袋 电暖水袋 (护膝),个护健康 > 家庭急救、医疗耗材 > 冷敷热敷治疗,亚马逊(卓越网),锐智
1011002024,家用电器|生活电器|暖手宝、暖脚宝,『春笑牌』新款高档超柔毛绒梅花电热水袋/电暖袋/电暖宝/暖水袋,家居建材 > 家装软饰 > 春笑,国美电器网上商城,$N
1011002024,家用电器|生活电器|暖手宝、暖脚宝,酷宝礼坊暖水袋 充电暖水袋暖水袋 可爱卡通图案电热水袋 暖手宝 暖手器居家用品 维尼熊手套,礼品箱包>礼品>创意礼品>酷宝礼坊>酷宝礼坊暖水袋 充电暖水袋暖水袋 可爱卡...,京东商城,酷宝礼坊
1011002024,家用电器|生活电器|暖手宝、暖脚宝,伊暖儿 豪华海虎毛全包拉链大拖鞋USB暖脚鞋 电热鞋 电暖鞋暖脚宝 赠送USB充(粉红色),生活电器 厨卫电器>创意家居>伊暖儿（e.warmer）>伊暖儿 豪华海虎毛全包拉链大拖鞋USB暖脚鞋 电热鞋 电暖鞋暖脚宝 赠送USB充(粉红色),国美电器网上商城,牧童家居专营店
1011002024,家用电器|生活电器|暖手宝、暖脚宝,电热水袋 充电防爆 暖手宝充水 毛绒暖手袋 插手暖水袋电暖宝包邮 咩咩咖啡 32*25cm,玩具乐器>毛绒布艺>毛绒/布艺>卡拉梦>电热水袋 充电防爆 暖手宝充水 毛绒暖手...,京东商城,茵凡礼品
1011002024,家用电器|生活电器|暖手宝、暖脚宝,暖之缘 充电毛绒热水袋 双插手暖水袋电暖宝电热宝 防爆暖手宝袋 悠嘻猴褐色Q2115,家居家装>家装软饰>其他>红兔子>暖之缘 充电毛绒热水袋 双插手暖水袋电暖...,京东商城,普润家居专营店
1011002024,家用电器|生活电器|暖手宝、暖脚宝,春笑 电热水袋 电暖手宝 水电分离 安全防爆 毛绒卡通 暖手宝 暖腰宝 暖宝宝 暖水袋抱枕 R2110咖啡猫,家居家装>家装软饰>保暖防护>红兔子>春笑 电热水袋 电暖手宝 水电分离 安全...,京东商城,楼龙旗舰店
1011002024,家用电器|生活电器|暖手宝、暖脚宝,红缨枪时尚卡通防爆充电暖水袋暖手宝热水袋 棕kity,首页>家居/家装建材/厨具>生活日用>生活日用>红缨枪时尚卡通防爆充电暖水袋暖手宝热...,苏宁,红缨枪
1011002024,家用电器|生活电器|暖手宝、暖脚宝,福保 FB-A-12充电热水袋防爆暖水袋 毛绒暖手宝电暖宝暖手袋热宝已注水,首页>厨卫电器生活电器>生活小家电>暖手暖脚宝>福保FB-A-12充电热水袋防爆暖...,苏宁,FB-A-12
1011002024,家用电器|生活电器|暖手宝、暖脚宝,fashy 费许 刺绣麋鹿暖水袋 2L 6771,家用/类别/家居/居家防护/保暖用品/热水袋,亚马逊(卓越网),fashy
1011002024,家用电器|生活电器|暖手宝、暖脚宝,博弘新款电热水袋充电防爆暖水袋暖手宝充水毛绒暖手袋双插手 悠嘻龙Q1108 ??,时尚居家>居家创意>装饰日用>博弘新款电热水袋充电防爆暖水袋暖手宝充水毛绒暖手袋双插手 悠嘻龙Q1108 ??,为为网,红兔子
1011002024,家用电器|生活电器|暖手宝、暖脚宝,恋美充电暖水袋 卡通暖手宝 暖手器冬季保健防寒居家用品 创新暖宝宝保温礼品 双插手卡通个性狐狸红色,家居家装>家装软饰>其他>恋美>恋美充电暖水袋 卡通暖手宝 暖手器冬季保...,京东商城,响当当
1011002024,家用电器|生活电器|暖手宝、暖脚宝,美美柔性双插手绣花B-609B1电暖袋双插手绣花系列热水袋暖水袋 宝蓝简约绣花,家居家装>家装软饰>其他>美美（Maymay）>美美柔性双插手绣花B-609B1电暖袋双...,京东商城,锦绣金源家居专营店
1011002024,家用电器|生活电器|暖手宝、暖脚宝,爱贝斯暖脚宝 插电 电热垫 电暖鞋 电热鞋充电鞋 电热坐垫暖手宝,首页>厨卫电器生活电器>生活小家电>电热毯>爱贝斯暖脚宝插电电热垫电暖鞋...,苏宁,爱贝斯
1011002024,家用电器|生活电器|暖手宝、暖脚宝,德国进口fashy牌热水袋/暖水袋/热敷袋/冰敷袋/暖脚垫.柔绒外套热水袋 酒红色6707,家居家装>家装软饰>保暖防护>FASHY>德国进口fashy牌热水袋/暖水袋/热敷...,京东商城,君品家居专营店
1011002024,家用电器|生活电器|暖手宝、暖脚宝,【年终热卖】圣诞狂欢季 惠通热水袋充电防爆毛绒卡通电暖宝暖手宝已注水电热宝双插手 嘟嘟羊607-3,家居家装>家装软饰>其他>惠通>【年终热卖】圣诞狂欢季 惠通热水袋充电防...,京东商城,华韵家居专营店
1011002024,家用电器|生活电器|暖手宝、暖脚宝,美家宝 暖手宝电暖宝暖水袋电热水袋MXD-328C 苹果形状,母婴>妈妈专区>妈妈护理>艾芭薇>美家宝 暖手宝电暖宝暖水袋电热水袋MXD...,京东商城,易好药母婴旗舰店
1011002024,家用电器|生活电器|暖手宝、暖脚宝,【年终热卖】圣诞狂欢季 惠通热水袋充电防爆毛绒卡通电暖宝暖手宝已注水电热宝双插手 嘟嘟羊607-1,家居家装>家装软饰>其他>惠通>【年终热卖】圣诞狂欢季 惠通热水袋充电防...,京东商城,华韵家居专营店
1011002024,家用电器|生活电器|暖手宝、暖脚宝,韩基电 碳晶地暖 电热地毯 电热垫 暖脚垫 200*56（卡通系列麦兜）,购买由和硕电器销售的指定商品超过 1 件，每件商品可立即享受 15% 的优惠 点此查看如何获得促销优惠 (促销说明),亚马逊(卓越网),韩基电
1011002024,家用电器|生活电器|暖手宝、暖脚宝,咏期 卡通绒布套热水袋/时尚暖水袋/布包热水袋（小号）,家用/类别/家居/居家防护/保暖用品/暖手宝暖脚宝,亚马逊(卓越网),咏期
1011002024,家用电器|生活电器|暖手宝、暖脚宝,魅之优品 防爆防漏电热水袋暖手袋 充电暖水袋,所有分类>家居家纺、锅具餐具>装饰/日用>取暖/降温>暖手宝/热水袋>魅之优品>魅之优品 防爆防漏电...,1号店,魅之优品
1011002024,家用电器|生活电器|暖手宝、暖脚宝,红兔子 两档调温电暖鞋/电热鞋/暖脚宝/暖脚鞋/暖脚王 电暖鞋/电热鞋 烘鞋器/干鞋器 27号玫红色,$N,亚马逊(卓越网),红兔子
1011002024,家用电器|生活电器|暖手宝、暖脚宝,居优乐 电热水袋 暖手宝 热水袋充电 卡通暖水袋 防爆 毛绒双擦手已注水 双擦手深咖双绒,家居 > 居家防护 > 保暖用品 > 暖手宝暖脚宝 ,亚马逊(卓越网),居优乐
1011002024,家用电器|生活电器|暖手宝、暖脚宝,贝喜 暖手宝 充电热水袋防爆暖水袋电暖宝电热宝 插电毛绒 凸眼红色803,礼品乐器?>?礼品?>?创意礼品?>?商品详情,当当网,贝喜
1011002024,家用电器|生活电器|暖手宝、暖脚宝,可拆洗热水袋 双插手暖手宝 毛绒充电暖宝宝 防爆热宝 卡通暖水袋,$N,淘宝网,$N
1011002024,家用电器|生活电器|暖手宝、暖脚宝,小金猴 多功能电热书写垫暖桌垫发热垫暖手桌垫加热垫保暖垫暖手宝36*60CM（浅咖啡）,家居家装>家装软饰>其他>春笑>小金猴 多功能电热书写垫暖桌垫发热垫暖手...,京东商城,维双家居专营店
1011002024,家用电器|生活电器|暖手宝、暖脚宝,维康Wecan 卡通电热坐垫全线路安全保护多功能 插电发热暖脚宝 暖脚袋 暖手袋 棕色小熊,家居家装>生活日用>净化除味>维康>维康Wecan 卡通电热坐垫全线路安全保...,京东商城,维康官方旗舰店
1011002024,家用电器|生活电器|暖手宝、暖脚宝,暖桌垫 多功能书写垫发热垫桌上暖垫暖桌宝 创意加热垫电热桌垫冬日温暖送男女朋友老师同学 棕色,礼品箱包>礼品>创意礼品>言周>暖桌垫 多功能书写垫发热垫桌上暖垫暖桌宝...,京东商城,创意礼品商城
1011002024,家用电器|生活电器|暖手宝、暖脚宝,普润 多功能电热书写垫暖桌垫发热垫暖手桌垫加热垫保暖垫暖手宝ck-46	ck2,家居日用 > 清洁护理 > 暖宝宝 > 商品详情,当当网,普润
1011002024,家用电器|生活电器|暖手宝、暖脚宝,易普六角超柔绣花 小猫充电式电热水袋 (电暖宝 暖手宝 电暖袋 电热宝 暖水袋),家居 > 居家防护 > 保暖用品 > 暖手宝暖脚宝 ,亚马逊(卓越网),
1011002024,家用电器|生活电器|暖手宝、暖脚宝,易普枕型金丝提花充电式电热水袋 (电暖宝 暖手宝 电暖袋 电热宝 暖水袋),家居 > 居家防护 > 保暖用品 > 暖手宝暖脚宝 ,亚马逊(卓越网),
1011002024,家用电器|生活电器|暖手宝、暖脚宝,博弘立体卡通双面绒电暖袋/暖手器/电暖水袋/电暖宝/暖宝宝/暖手宝(海绵宝宝)(热敷/暖手/暖脚/暖腰/暖背/安全防爆/储能发热/持久恒温/防寒必备),家用/类别/家居/居家防护/保暖用品/暖手宝暖脚宝,亚马逊(卓越网),博弘
1011002024,家用电器|生活电器|暖手宝、暖脚宝,美美暖水袋蝶型系列 电暖袋//暖手宝/电热宝/电热水宝 蝶形红色花花,家居家装>家装软饰>保暖防护>美美（Maymay）>美美暖水袋蝶型系列 电暖袋//暖手宝/...,京东商城,锦绣金源家居专营店
