1011003010,家用电器|厨房电器|煮蛋器、蒸蛋器,生活日记 ZDQ-F10 三层自动断电 温泉煮蛋器 蒸蛋器 电蒸笼,所有分类>大小家电、厨电、汽车>厨房电器>煮蛋器>生活日记>生活日记 ZDQ-F...,1号店,生活日记
1011003010,家用电器|厨房电器|煮蛋器、蒸蛋器,快乐一叮 W-512情侣煮蛋器 不锈钢煮蛋机多功能自动断电蒸蛋器特价,所有分类>大小家电、厨电、汽车>厨房电器>煮蛋器>快乐一叮>快乐一叮 W-512...,1号店,快乐一叮
1011003010,家用电器|厨房电器|煮蛋器、蒸蛋器,Yililai/亿利来 煮蛋器蒸蛋器自动断电 情侣迷你煮蛋器,所有分类>大小家电、厨电、汽车>厨房电器>煮蛋器>Yililai/亿利来>Yililai/亿利...,1号店,Yililai/亿利来
1011003010,家用电器|厨房电器|煮蛋器、蒸蛋器,莱弗凯（LFCare）ZDQ-201多功能煮蛋器，大功率380W ，7个蛋 防干烧自动断电 白色,家用电器>厨房电器>煮蛋器>莱弗凯>莱弗凯（LFCare）ZDQ-201多功...,京东商城,莱弗凯家用电器专卖店
1011003010,家用电器|厨房电器|煮蛋器、蒸蛋器,益多 YD-504煮蛋器全不锈钢蒸蛋器配环保蒸碗自动断电,厨具 > 厨用小工具 > 鸡蛋加工 > 煎蛋模具,亚马逊(卓越网),益多
1011003010,家用电器|厨房电器|煮蛋器、蒸蛋器,开馨宝 多功能蒸煮器 家用蒸蛋器煮蛋器厂家 新款不锈钢蒸蛋器 一次可煮7个,所有分类>大小家电、厨电、汽车>生活电器>其它生活电器>开馨宝>开馨宝 多功能蒸煮器...,1号店,开馨宝
1011003010,家用电器|厨房电器|煮蛋器、蒸蛋器,益多 YD-502煮蛋器蒸蛋器配全不锈钢蒸碗自动断电,厨具 > 厨用小工具 > 鸡蛋加工 > 煎蛋模具,亚马逊(卓越网),益多
1011003010,家用电器|厨房电器|煮蛋器、蒸蛋器,普林勒仕/plls包邮 自动断电 蒸蛋器 煮蛋器三色可选 多功能 黄色,首页>厨卫电器生活电器>厨房小家电>煮蛋器>普林勒仕/plls包邮自动断电蒸...,苏宁,普林勒仕
1011003010,家用电器|厨房电器|煮蛋器、蒸蛋器,幸福磨坊 家用煮蛋器 小鸡煮蛋器 全不锈钢蒸蛋器 七夕情人节礼物 多功能煮蛋器 可蒸7个蛋蒸蛋器 M4 (白色),当您购买 1 或由网豆商城提供的更多指定商品时，您将免运费获得此商品 点此查看如何获得促销优惠 (促销说明),亚马逊(卓越网),幸福磨坊
1011003010,家用电器|厨房电器|煮蛋器、蒸蛋器,小白熊 煮蛋器 多功能蒸蛋机 干烧断电保护 HL-0635,母婴用品 > 喂养用品 > 辅食料理器,亚马逊(卓越网),$N
1011003010,家用电器|厨房电器|煮蛋器、蒸蛋器,TONZE天际 DZG-W30Q煮蛋器多功能双层蒸蛋器自动断电蒸煮蛋机64,所有分类>大小家电、厨电、汽车>厨房电器>煮蛋器>TONZE天际>TONZE天际 DZ...,1号店,TONZE天际
1011003010,家用电器|厨房电器|煮蛋器、蒸蛋器,GATES 意品自动断电多功能煮蛋器 (5个蛋容)蒸蛋器 粉色,厨具>烹饪锅具>厨用杂件>GATES 意品自动断电多功能煮蛋器 ...,京东商城,贸号专营店
1011003010,家用电器|厨房电器|煮蛋器、蒸蛋器,【小熊电器官方旗舰店】小熊（Bear) ZDQ-2191 多功能双层煎烙煮蛋器 14个蛋 （橙黄色）,家用电器?>?厨房电器?>?打蛋器/煮蛋器?>?商品详情,当当网,小熊
1011003010,家用电器|厨房电器|煮蛋器、蒸蛋器,快乐一叮 W-506情侣全不锈钢煮蛋器煮蛋机自动断电蒸蛋器特价包邮,所有分类>大小家电、厨电、汽车>厨房电器>煮蛋器>快乐一叮>快乐一叮 W-506...,1号店,快乐一叮
1011003010,家用电器|厨房电器|煮蛋器、蒸蛋器,金力 煮蛋神器ZD-01 蒸蛋器 自动断电 多功能蛋卷大师(可爱粉),生活电器 厨卫电器>打蛋器/煮蛋器>金力（GINNIE）>金力 煮蛋神器ZD-01 蒸蛋器 自动断电 多功能蛋卷大师(可爱粉),国美电器网上商城,金力电器旗舰店
1011003010,家用电器|厨房电器|煮蛋器、蒸蛋器,生活日记 ZDQ-Q5煮蛋器蒸蛋器蒸蛋羹热饭菜自动断电不锈钢情侣,所有分类>大小家电、厨电、汽车>厨房电器>煮蛋器>生活日记>生活日记 ZDQ-Q...,1号店,生活日记
1011003010,家用电器|厨房电器|煮蛋器、蒸蛋器,小熊(Bear)JDQ-A01A1 鸡蛋杯 早餐蛋卷机 热狗机 煎蛋煮蛋器,家用电器>厨房电器>煮蛋器> 小熊（Bear）>小熊JDQ-A01A1,京东商城,小熊（Bear）
1011003010,家用电器|厨房电器|煮蛋器、蒸蛋器,生活日记ZDQ-F4煮蛋器蒸蛋器双层自动断电情侣迷你正品,家居日用>其他工具>生活日记（shenghuoriji ）>生活日记ZDQ-F4煮蛋器蒸蛋器双层自动断电情侣迷你正品,国美电器网上商城,生活日记（shenghuoriji ）
1011003010,家用电器|厨房电器|煮蛋器、蒸蛋器,天际 DZG-W30Q 煮蛋器 双层蒸蛋器 可蒸18颗蛋 自动断电 消毒/蒸/煮,生活电器 厨卫电器>打蛋器/煮蛋器>天际（TONZE）>天际 DZG-W30Q 煮蛋器 双层蒸蛋器 可蒸18颗蛋 自动断电 消毒/蒸/煮,国美,天际（TONZE）
1011003010,家用电器|厨房电器|煮蛋器、蒸蛋器,Bear小熊 煮蛋器 ZDQ-201 (经典型号，水烧干自动断电,黄色),小家电 > 厨房电器 > 蒸\煮锅 > 煮蛋器,亚马逊(卓越网)
1011003010,家用电器|厨房电器|煮蛋器、蒸蛋器,幸福磨坊 煮蛋器EP2150 蒸蛋器煮蛋器自动断电,首页>厨卫电器生活电器>厨房小家电>煮蛋器>幸福磨坊煮蛋器EP2150蒸蛋器...,苏宁,意品
1011003010,家用电器|厨房电器|煮蛋器、蒸蛋器,meyou名友 多功能全不锈钢宝宝煮蛋/蒸蛋器 自动断电保护 可消毒 香槟粉,母婴>喂养用品>暖奶/消毒>名友(meyou)>meyou名友 多功能全不锈钢宝宝煮蛋/...,京东商城,babynest专营店
1011003010,家用电器|厨房电器|煮蛋器、蒸蛋器,【天际官方旗舰店】Tonze/天际 煮蛋器 DZG-W45AE 蒸蛋器 煮蛋机 情侣款 5蛋同锅！陶瓷蛋碗！自动断电！,家用电器?>?厨房电器?>?打蛋器/煮蛋器?>?商品详情,当当网,天际
1011003010,家用电器|厨房电器|煮蛋器、蒸蛋器,小熊煮蛋器ZDQ-2121 ，蒸蛋、煮蛋，功能二合一，自动断电,家用电器?>?厨房电器?>?打蛋器/煮蛋器?>?商品详情,当当网,小熊
1011003010,家用电器|厨房电器|煮蛋器、蒸蛋器,名友不锈钢多功能宝宝煮蛋器蒸蛋器早餐必备 大容量款自动断电保护 红色,母婴>喂养用品>暖奶/消毒>名友(meyou)>名友不锈钢多功能宝宝煮蛋器蒸蛋器早餐必备...,京东商城,babynest专营店
1011003010,家用电器|厨房电器|煮蛋器、蒸蛋器,小熊 煮蛋器 蒸蛋器 多功能 配蒸蛋碗 双层 不锈钢发热ZDQ-2041 白色,首页 >家用电器 >厨房电器 >煮蛋器 >小熊 煮蛋器 蒸蛋器 多功能 配蒸蛋碗 双层 不锈钢发热ZDQ-2041,vjia,易积电器官方旗舰店
1011003010,家用电器|厨房电器|煮蛋器、蒸蛋器,好福家HFK-601A煮蛋器 双层带煎蛋蒸蛋器(粉色),生活电器 厨卫电器>打蛋器/煮蛋器>好福家（Haofujia）>好福家HFK-601A煮蛋器 双层带煎蛋蒸蛋器(粉色),国美电器网上商城,好福家电器专营店
1011003010,家用电器|厨房电器|煮蛋器、蒸蛋器,奥西美 PA-601多功能煮蛋器 煮蛋机蒸蛋器配送不锈钢碗,所有分类>大小家电、厨电、汽车>厨房电器>煮蛋器>奥西美>奥西美 PA-601...,1号店,奥西美
1011003010,家用电器|厨房电器|煮蛋器、蒸蛋器,me you/名友MY-35A全不锈钢情侣煮蛋器 多功能蒸蛋器 自动断电保护 特价促销 香槟粉,母婴>喂养用品>辅食料理机> 名友(meyou)>me you/名友MY-35A全不锈钢情...,京东商城,名友母婴专营店
1011003010,家用电器|厨房电器|煮蛋器、蒸蛋器,麦卓Makejoy MJ-2116多功能煮蛋器蒸蛋器 煮蛋机 蒸蛋羹 带蒸碗 自动断电,厨具>厨房配件>厨房DIY/小工具> 麦卓>麦卓Makejoy MJ-2116多...,京东商城,宝洱家居专营店
1011003010,家用电器|厨房电器|煮蛋器、蒸蛋器,小熊 ZDQ-2031 煮蛋器 蒸蛋器 多功能 自动断电煮蛋器 蒸蛋器 多功能 自动断电,当当网 > 家用电器 > 厨房电器 > 打蛋器/煮蛋器,当当网,小熊
1011003010,家用电器|厨房电器|煮蛋器、蒸蛋器,MOHO-ZOOM 贸号 意品多功能不锈钢煮蛋器 （6个蛋容）蒸蛋器EG3160,小家电 > 厨房电器 > 蒸\煮锅 > 煮蛋器,亚马逊(卓越网),MOHO-ZOOM 贸号
1011003010,家用电器|厨房电器|煮蛋器、蒸蛋器,格菱乐不锈钢情侣多功能煮蛋机 蒸蛋器 防干烧自动断电,首页>厨卫电器生活电器>厨房小家电>煮蛋器>格菱乐不锈钢情侣多功能煮蛋机蒸蛋器...,苏宁,glinl/格菱乐
1011003010,家用电器|厨房电器|煮蛋器、蒸蛋器,生活日记 ZDQ-F6 煮蛋器 双层 温泉蒸蛋器自动断电 防干烧 送蒸蛋碗,所有分类>大小家电、厨电、汽车>厨房电器>煮蛋器>生活日记>生活日记 ZDQ-F...,1号店,生活日记
1011003010,家用电器|厨房电器|煮蛋器、蒸蛋器,亿利来JH850蒸蛋器 煮蛋大师 多功能情侣煮蛋器 自动断电煎蛋器蒸蛋机(随机颜色),生活电器 厨卫电器>打蛋器/煮蛋器>亿利来（Yililai）>亿利来JH850蒸蛋器 煮蛋大师 多功能情侣煮蛋器 自动断电煎蛋器蒸蛋机(随机颜色),国美,亿利来（Yililai）
1011003010,家用电器|厨房电器|煮蛋器、蒸蛋器,Tonze 天际 DZG-W406Q多功能煮蛋器蒸蛋器自动断电,小家电 > 厨房电器 > 蒸\煮锅 > 煮蛋器,亚马逊(卓越网),Tonze 天际
1011003010,家用电器|厨房电器|煮蛋器、蒸蛋器,Joyoung/九阳 ZD-5W05蒸煮蛋器煎蛋器多功能 自动断电正品,所有分类>大小家电、厨电、汽车>厨房电器>煮蛋器>Joyoung/九阳>Joyoung/九阳 ZD-5W05蒸煮蛋器煎蛋器多功能 自动断电正品,1号店,Joyoung/九阳
1011003010,家用电器|厨房电器|煮蛋器、蒸蛋器,美的 ES07MS-AY蒸蛋器 煮蛋器 小熊煮蛋器 煎蛋器,首页>厨卫电器生活电器>厨房小家电>煮蛋器>美的ES07MS-AY蒸蛋器煮蛋...,苏宁,$N
1011003010,家用电器|厨房电器|煮蛋器、蒸蛋器,班得瑞 ZDQ-F6 煮蛋器 蒸蛋器 双层 多功能,当当网 > 家用电器 > 厨房电器 > 打蛋器/煮蛋器,当当网,班得瑞
1011003010,家用电器|厨房电器|煮蛋器、蒸蛋器,自动早餐蛋卷机神器 香肠卷鸡蛋杯 杯形煮蛋器煎蛋机 迷你早餐机 ZQ-ZD03橙色,首页>厨卫电器生活电器>厨房小家电>煮蛋器>自动早餐蛋卷机神器香肠卷鸡蛋杯杯...,苏宁,$N
1011003010,家用电器|厨房电器|煮蛋器、蒸蛋器,煮蛋大师 eggmaster全自动煮蛋器自动断电蒸蛋器包邮,其他 > 其他,亚马逊(卓越网),xin
1011003010,家用电器|厨房电器|煮蛋器、蒸蛋器,小熊 ZDQ-212 蒸蛋器 煮蛋器 多功能 防干烧蒸蛋器 煮蛋器 多功能 防干烧,当当网 > 家用电器 > 厨房电器 > 打蛋器/煮蛋器,当当网,小熊
1011003010,家用电器|厨房电器|煮蛋器、蒸蛋器,益多 666多功能煮蛋器 蒸蛋器 煎蛋器 煮蛋机 蒸蛋羹,所有分类>大小家电、厨电、汽车>厨房电器>煮蛋器>益多>益多 666多功能煮...,1号店,益多
1011003010,家用电器|厨房电器|煮蛋器、蒸蛋器,秀竹sorge煎烤器（煎蛋器 煮蛋器 煮蛋大师 蒸蛋器 鸡蛋杯 早餐机 点心机）,首页>厨卫电器生活电器>厨房小家电>煮蛋器>秀竹sorge煎烤器（煎蛋器煮蛋器...,苏宁,$N
1011003010,家用电器|厨房电器|煮蛋器、蒸蛋器,TONZE天际 DZG-W405E多功能煮蛋器 情侣 蒸蛋器 自动断电 煮蛋机,所有分类>大小家电、厨电、汽车>厨房电器>煮蛋器>TONZE天际>TONZE天际 DZ...,1号店,TONZE天际
1011003010,家用电器|厨房电器|煮蛋器、蒸蛋器, 包邮 美堂手持式 多功能 蒸蛋器/煮蛋器/煎蛋器/ 防干烧自动断电DX-3103 橘黄色 ,商城首页 >商品列表 > 美堂,为为网,美堂
1011003010,家用电器|厨房电器|煮蛋器、蒸蛋器,小熊 双层多功能蒸煎烙煮蛋器 14个蛋,首页?>?.小熊电器专场?>?双层多功能蒸煎烙煮蛋器 14个蛋,唯品会,无
1011003010,家用电器|厨房电器|煮蛋器、蒸蛋器,富贵熊 全不锈钢 自动断电情侣 煮蛋器带碗 可煮7个蛋 蒸蛋器 防干烧 自动断开,首页>厨卫电器生活电器>厨房小家电>煮蛋器>富贵熊全不锈钢自动断电情侣煮蛋...,苏宁,富贵熊
1011003010,家用电器|厨房电器|煮蛋器、蒸蛋器,索爱D08煮蛋器蒸蛋器自动断电蒸蛋机煮蛋机全不锈钢多功能,家用电器?>?厨房电器?>?打蛋器/煮蛋器?>?商品详情,当当网,索爱
1011003010,家用电器|厨房电器|煮蛋器、蒸蛋器,小熊 ZDQ-201 煮蛋器 蒸蛋器 不锈钢 自动断电煮蛋器 蒸蛋器 不锈钢 自动断电,当当网 > 家用电器 > 厨房电器 > 打蛋器/煮蛋器,当当网,小熊
1011003010,家用电器|厨房电器|煮蛋器、蒸蛋器,富贵熊 多功能不粘锅煮蛋器 煎蛋机 煎饼煎牛排 蒸蛋器 自动断电 防干烧,首页>厨卫电器生活电器>厨房小家电>煮蛋器>富贵熊多功能不粘锅煮蛋器煎蛋机...,苏宁,富贵熊
1011003010,家用电器|厨房电器|煮蛋器、蒸蛋器,小熊 煮蛋器 双层 煎蛋 蒸蛋 多功能ZDQ-2191 黄色,首页 >家用电器 >厨房电器 >煮蛋器 >小熊 煮蛋器 双层 煎蛋 蒸蛋 多功能ZDQ-2191,vjia,易积电器官方旗舰店
1011003010,家用电器|厨房电器|煮蛋器、蒸蛋器,Fxunshi 华迅仕 多功能煮蛋器 自动断电 7个蛋 MD-701,其他 > 其他,亚马逊(卓越网),Fxunshi 华迅仕
1011003010,家用电器|厨房电器|煮蛋器、蒸蛋器,班得瑞BANDARI ZDQ-F21多功能早餐机 底部可卸 情侣煮蛋器蒸蛋器煮蛋大师鸡蛋杯 蛋糕机,所有分类>大小家电、厨电、汽车>厨房电器>煮蛋器>班得瑞BANDARI>班得瑞BANDARI...,1号店,班得瑞BANDARI
1011003010,家用电器|厨房电器|煮蛋器、蒸蛋器,小熊 ZDQ-2161 双层定时煮蛋器 煮蛋器 蒸蛋器 多功能Bear 定时煮蛋器,当当网 > 家用电器 > 厨房电器 > 打蛋器/煮蛋器,当当网,小熊
1011003010,家用电器|厨房电器|煮蛋器、蒸蛋器,小熊 煮蛋器正品 包邮 特价 多功能全自动 蒸蛋器 不锈钢ZDQ-201 白色,首页 >家用电器 >厨房电器 >煮蛋器 >小熊 煮蛋器正品 包邮 特价 多功能全自动 蒸蛋器 不锈钢ZDQ-201,vjia,易积电器官方旗舰店
1011003010,家用电器|厨房电器|煮蛋器、蒸蛋器,胜道 PQ-702 双层多功能情侣煮蛋器不锈钢蒸蛋器煮蛋机 大容量 特价,家用电器?>?厨房电器?>?打蛋器/煮蛋器?>?胜道?PQ-702?双层多功能情侣煮蛋器不锈钢蒸蛋器煮蛋机?大容量?特...,当当网,胜道
1011003010,家用电器|厨房电器|煮蛋器、蒸蛋器,Bear小熊 煮蛋器 ZDQ-2191 (不粘涂层发热盘，可煎蛋、烙面饼、煎牛扒，自动断电，更大空间,橙黄色),小家电 > 厨房电器 > 蒸\煮锅 > 煮蛋器,亚马逊(卓越网)
1011003010,家用电器|厨房电器|煮蛋器、蒸蛋器,IdeaShow 上品堂多功能煮蛋器 不锈钢蒸蛋器 粉色,礼品箱包>礼品>创意礼品>IdeaShow 上品堂多功能煮蛋器 ...,京东商城,艾尚礼品专营店
1011003010,家用电器|厨房电器|煮蛋器、蒸蛋器,HYUNDAI/现代 多功能蒸煮蛋器 蒸蛋器 小巧自动断电 BD-ZD502,所有分类>大小家电、厨电、汽车>厨房电器>煮蛋器>HYUNDAI/现代>HYUNDAI/现代...,1号店,HYUNDAI/现代
1011003010,家用电器|厨房电器|煮蛋器、蒸蛋器,BANDARI/班得瑞 ZDQ-Q1不锈钢自动断电 迷你蒸蛋器煮蛋器正品,小家电 > 厨房电器 > 蒸\煮锅 > 煮蛋器,亚马逊(卓越网),班得瑞
1011003010,家用电器|厨房电器|煮蛋器、蒸蛋器,小熊煮蛋器 ZDQ-2015 多功能 不锈钢蒸碗 蒸煎煮烙 蒸蛋器,家用电器 > 厨房电器 > 打蛋器/煮蛋器,当当网,小熊
1011003010,家用电器|厨房电器|煮蛋器、蒸蛋器,金正 JZZD-35B 煮蛋器 多功能迷你 自动控温防干烧 蒸蛋器,生活电器 厨卫电器>打蛋器/煮蛋器>金正（NiNTAUS）>金正 JZZD-35B 煮蛋器 多功能迷你 自动控温防干烧 蒸蛋器,国美电器网上商城,金正（NiNTAUS）
1011003010,家用电器|厨房电器|煮蛋器、蒸蛋器,十度良品煮蛋器 SD-926 多功能蒸蛋机 可蒸蛋羹 煮5个鸡蛋 蒸包玉米 自动断电 粉红色,家用电器>厨房电器>煮蛋器> 十度良品>十度良品煮蛋器 SD-926 多功能蒸蛋...,京东商城,十度良品旗舰店
1011003010,家用电器|厨房电器|煮蛋器、蒸蛋器,生活日记 ZDQ-Q6 煮蛋器 蒸蛋器 多功能 正品 特价 包邮,家居日用>其他工具>生活日记（shenghuoriji ）>生活日记 ZDQ-Q6 煮蛋器 蒸蛋器 多功能 正品 特价 包邮,国美,生活日记（shenghuoriji ）
1011003010,家用电器|厨房电器|煮蛋器、蒸蛋器,开馨宝 幸福磨坊全不锈钢蒸蛋器 小鸡煮蛋器 多功能煮蛋机（可蒸7个蛋） (黄色),小家电 > 厨房电器 > 蒸\煮锅 > 煮蛋器,亚马逊(卓越网),开馨宝
1011003010,家用电器|厨房电器|煮蛋器、蒸蛋器,生活日记 ZDQ-Q6 煮蛋器 蒸蛋器 多功能 正品 特价 包邮,家居日用>其他工具>生活日记（shenghuoriji ）>生活日记 ZDQ-Q6 煮蛋器 蒸蛋器 多功能 正品 特价 包邮,国美电器网上商城,竣丰汇通美之家专营店
1011003010,家用电器|厨房电器|煮蛋器、蒸蛋器,生活日记ZDQ-F4煮蛋器蒸蛋器双层自动断电情侣迷你正品,小家电 > 厨房电器 > 蒸\煮锅 > 煮蛋器,亚马逊(卓越网),生活日记
1011003010,家用电器|厨房电器|煮蛋器、蒸蛋器,BANDARI/班得瑞 ZDQ-F4 煮蛋器蒸蛋器双层 自动断电情侣迷你,小家电 > 厨房电器 > 蒸\煮锅 > 煮蛋器,亚马逊(卓越网),班得瑞
1011003010,家用电器|厨房电器|煮蛋器、蒸蛋器,益多 YD-507煮蛋器蒸蛋器配全不锈钢蒸碗自动断电,厨具 > 厨用小工具 > 鸡蛋加工 > 煎蛋模具,亚马逊(卓越网),益多
1011003010,家用电器|厨房电器|煮蛋器、蒸蛋器,Bigbear 大熊 多功能蒸蛋器 DX-3108 7个蛋 一机多用（鸡蛋/蛋羹/馒头）,小家电 > 厨房电器 > 蒸\煮锅 > 煮蛋器 ,亚马逊(卓越网),bigbear 大熊
1011003010,家用电器|厨房电器|煮蛋器、蒸蛋器,益多 YD-5218 多功能情侣煮蛋器不锈钢蒸蛋器煮蛋机自动断电,所有分类>大小家电、厨电、汽车>厨房电器>煮蛋器>益多>益多 YD-5218...,1号店,益多
1011003010,家用电器|厨房电器|煮蛋器、蒸蛋器,Yililai/亿利来 煮蛋器蒸蛋器自动断电 情侣迷你煮蛋器 ,所有分类>大小家电、厨电、汽车>厨房电器>煮蛋器>Yililai/亿利来>Yililai/亿利...,1号店,Yililai/亿利来
1011003010,家用电器|厨房电器|煮蛋器、蒸蛋器,小熊 多功能全自动煮蛋器 6个蛋,首页?>?小熊电器专场?>?多功能全自动煮蛋器 6个蛋,唯品会,无
1011003010,家用电器|厨房电器|煮蛋器、蒸蛋器,优益 Y-ZDQ3双层蒸蛋器煮蛋器煮蛋机自动断电,生活电器 厨卫电器>打蛋器/煮蛋器>优益>优益 Y-ZDQ3双层蒸蛋器煮蛋器煮蛋机自动断电,国美,优益
1011003010,家用电器|厨房电器|煮蛋器、蒸蛋器,meyou名友 多功能全不锈钢宝宝煮蛋/蒸蛋器 自动断电保护 可消毒 宝石蓝,母婴>喂养用品>暖奶/消毒>名友(meyou)>meyou名友 多功能全不锈钢宝宝煮蛋/...,京东商城,babynest专营店
1011003010,家用电器|厨房电器|煮蛋器、蒸蛋器,me you/名友MY-35A全不锈钢情侣煮蛋器 多功能蒸蛋器 自动断电保护 特价促销 粉色,母婴>喂养用品>辅食料理机> 名友(meyou)>me you/名友MY-35A全不锈钢情...,京东商城,名友母婴专营店
1011003010,家用电器|厨房电器|煮蛋器、蒸蛋器,Bear 小熊 ZDQ-2191 多功能双层煎烙煮蛋器 最多能煮14个蛋,电视、空调、家用电器 > 厨卫电器 > 煮蛋器 > Bear 小熊 ZDQ-2191 多功能双层煎烙煮蛋器 最多能煮14个蛋,百联E城,$N
1011003010,家用电器|厨房电器|煮蛋器、蒸蛋器,新力士 多功能煮蛋器 煮玉米 可蒸蛋 蒸蛋器 自动蜂鸣S3157,所有分类>大小家电、厨电、汽车>厨房电器>煮蛋器>新力士,1号店,煮蛋器
1011003010,家用电器|厨房电器|煮蛋器、蒸蛋器,Bear小熊 煮蛋器 ZDQ-2041 (更大空间，更多组合，多功能于一身，水干自动断电，浅绿色),小家电 > 厨房电器 > 蒸\煮锅 > 煮蛋器,亚马逊(卓越网),Bear 小熊
1011003010,家用电器|厨房电器|煮蛋器、蒸蛋器,小熊 双层多功能蒸煎烙煮蛋器 14个蛋,首页?>?小熊电器专场?>?双层多功能蒸煎烙煮蛋器 14个蛋,唯品会,无
1011003010,家用电器|厨房电器|煮蛋器、蒸蛋器,班得瑞BANDARI ZDQ-F10 三层多功能煮蛋器 自动断电 防干烧 可煮18个鸡蛋 蒸蛋器,所有分类>大小家电、厨电、汽车>厨房电器>煮蛋器>班得瑞BANDARI>班得瑞BANDARI...,1号店,班得瑞BANDARI
1011003010,家用电器|厨房电器|煮蛋器、蒸蛋器,小白熊多功能宝宝煮蛋器婴儿蒸蛋器0635辅食料理机 自动断电煮蛋器 多功能蒸蛋机,母婴>喂养用品>辅助用品>小白熊>小白熊多功能宝宝煮蛋器婴儿蒸蛋器0635...,京东商城,哈皮贝贝母婴专营店
1011003010,家用电器|厨房电器|煮蛋器、蒸蛋器,富贵熊多功能不锈钢情侣煮蛋器 黄色小熊款 蒸蛋机 煎蛋器 自动断电 FM-3101,首页>厨卫电器生活电器>厨房小家电>煮蛋器>富贵熊多功能不锈钢情侣煮蛋器黄色小...,苏宁,富贵熊
1011003010,家用电器|厨房电器|煮蛋器、蒸蛋器,益多 YD-666多功能煮蛋器蒸蛋器情侣煎蛋器自动断电特,所有分类>大小家电、厨电、汽车>厨房电器>煮蛋器>益多>益多 YD-666多...,1号店,益多
1011003010,家用电器|厨房电器|煮蛋器、蒸蛋器,班得瑞BANDARI ZDQ-F18煮蛋器蒸蛋器定时自动断电三层多功能 可煮18个鸡蛋,所有分类>大小家电、厨电、汽车>厨房电器>煮蛋器>班得瑞BANDARI>班得瑞BANDARI...,1号店,班得瑞BANDARI
1011003010,家用电器|厨房电器|煮蛋器、蒸蛋器,Bear/小熊 JDQ-A01A1 卷蛋器早餐机 家用多功能煮蛋器鸡蛋杯 可拆卸底座不粘锅内胆紫色,所有分类>大小家电、厨电、汽车>厨房电器>煮蛋器>Bear/小熊,1号店,煮蛋器
1011003010,家用电器|厨房电器|煮蛋器、蒸蛋器,生活日记 ZDQ-F7 煮蛋器 蒸蛋器 自动断电 双层升3层 不锈钢 情侣 (白色),Refinements/X-Site Refinements/色板/白色,亚马逊(卓越网),生活日记
1011003010,家用电器|厨房电器|煮蛋器、蒸蛋器,好福家HFK-601A 迷你煎蛋器 电热锅 双层蒸蛋器 学生宝宝小电器,首页>厨卫电器生活电器>厨房小家电>煮蛋器>好福家HFK-601A迷你煎蛋器...,苏宁,好福家
1011003010,家用电器|厨房电器|煮蛋器、蒸蛋器,天际煮蛋器DZG-W406F 蒸蛋器 煮蛋机 自动断电,生活电器 厨卫电器>打蛋器/煮蛋器>天际（TONZE）>天际煮蛋器DZG-W406F 蒸蛋器 煮蛋机 自动断电,国美电器网上商城,天际旗舰店
1011003010,家用电器|厨房电器|煮蛋器、蒸蛋器,Yoice优益 ZDQ1多功能情侣煮蛋器不锈钢蒸蛋器煮蛋机自动断电 煎蛋器,所有分类>大小家电、厨电、汽车>厨房电器>煮蛋器>Yoice优益>Yoice优益 ZD...,1号店,Yoice优益
1011003010,家用电器|厨房电器|煮蛋器、蒸蛋器,Soar/索爱 不锈钢煮蛋器 多功能蒸蛋器 自动断电 带蒸碗 大容量,所有分类>大小家电、厨电、汽车>厨房电器>煮蛋器>Soar/索爱>Soar/索爱 不锈...,1号店,Soar/索爱
1011003010,家用电器|厨房电器|煮蛋器、蒸蛋器,生活日记ZDQ-Q5煮蛋器蒸蛋器蒸蛋羹热饭菜自动断电不锈钢情侣,首页>厨卫电器生活电器>厨房小家电>煮蛋器>生活日记ZDQ-Q5煮蛋器蒸蛋器蒸蛋...,苏宁,生活日记
1011003010,家用电器|厨房电器|煮蛋器、蒸蛋器,QBANG乔邦 ZQ-2D02鸡蛋杯 卷蛋机 蒸蛋器 蛋大师 煎蛋机 杯型煮蛋器 懒人蛋堡早餐机,所有分类>大小家电、厨电、汽车>厨房电器>煮蛋器>QBANG乔邦>QBANG乔邦 ZQ...,1号店,QBANG乔邦
1011003010,家用电器|厨房电器|煮蛋器、蒸蛋器, 正品特价包邮 美堂蒸蛋器/煮蛋器 多功能 煎蛋器/煮蛋羹自动断电 YS-602 ,商城首页 >商品列表 > 美堂,为为网,美堂
1011003010,家用电器|厨房电器|煮蛋器、蒸蛋器,天际 DZG-W405E多功能煮蛋器 情侣 蒸蛋器 自动断电 煮蛋机,家用电器?>?厨房电器?>?打蛋器/煮蛋器?>?商品详情,当当网,天际
1011003010,家用电器|厨房电器|煮蛋器、蒸蛋器,小熊煮蛋器 ZDQ-2091 全不锈钢蒸蛋器 正品 特价,家用电器 > 厨房电器 > 打蛋器/煮蛋器,当当网,小熊
1011003010,家用电器|厨房电器|煮蛋器、蒸蛋器,益多 5216多功能情侣煮蛋器不锈钢蒸蛋器煮蛋机自动断电,所有分类>大小家电、厨电、汽车>厨房电器>煮蛋器>益多>益多 5216多功能...,1号店,益多
1011003010,家用电器|厨房电器|煮蛋器、蒸蛋器,TONZE天际 DZG-W45AE多功能煮蛋器 情侣 蒸蛋器 自动断电 煮蛋机,所有分类>大小家电、厨电、汽车>厨房电器>煮蛋器>TONZE天际>TONZE天际 DZ...,1号店,TONZE天际
1011003010,家用电器|厨房电器|煮蛋器、蒸蛋器,小熊 多功能304不锈钢碗蒸煮蛋器 5个蛋,首页 > 小熊电器专场 > 多功能304不锈钢碗蒸煮蛋器 5个蛋,唯品会,无
1011003010,家用电器|厨房电器|煮蛋器、蒸蛋器,小熊 360°旋转蒸煎烙多功能煮蛋器7个蛋，分离式底座 不锈钢上盖、蒸盘、蒸碗,首页 > 小熊电器 > 360°旋转蒸煎烙多功能煮蛋器7个蛋,唯品会,无
