1014005006,钟表|钟|投影钟,Doulex 都乐 投影钟 粉色,数码/相机 > 娱乐影音 > 潮流电玩,易迅网,
1014005006,钟表|钟|投影钟,家天下 超维带万年历声控投影钟 电子闹钟CW8097C,当当网 > 家具装饰 > 园艺家饰 > 挂钟闹钟 > 闹钟,当当网,超维
1014005006,钟表|钟|投影钟,Mini 酷 LED投影钟8190,首页 > 酷生活 > 生活日用 > Mini酷,欧酷网,
1014005006,钟表|钟|投影钟,音乐星空投影钟/梦幻安眠星空电子时钟灯/七彩闹钟,钟表 > 钟 > 闹钟,亚马逊(卓越网),家居产品
1014005006,钟表|钟|投影钟,麦宝创玩 彩屏可旋转电子闹钟 气象站投影钟 温湿度时间闹钟 创意礼物礼品 懒人钟创意摆件家,玩具乐器>创意减压>创意玩具>麦宝创玩（imybao）>麦宝创玩 彩屏可旋转电子闹钟 气象站投影...,京东商城,麦宝创玩
1014005006,钟表|钟|投影钟,好时达七彩投影钟(黑),家用/专卖店/家居专卖店/Regular Stores/创意家居,亚马逊(卓越网),HIGHSTAR 好时达
1014005006,钟表|钟|投影钟,Timess 声控背光语音闹钟 报时 投影钟 闹钟 BR-806,所有分类>家居家纺、锅具餐具>装饰/日用>闹钟/挂钟/落地钟>闹钟/投影钟>Timess>Timess 声控背...,1号店,Timess
1014005006,钟表|钟|投影钟,机器人投影钟 梦幻星空投影仪万年历 音乐投影钟 创意闹钟 (苹果绿),家用/类别/家居/家具,亚马逊(卓越网),其他
1014005006,钟表|钟|投影钟,超维 声控背光 投影钟 静音 夜光 多功能万年历 创意 LED (灰白),家用/类别/家居/家居装饰/装饰摆件、挂件/室内温度计湿度计,亚马逊(卓越网),超维
1014005006,钟表|钟|投影钟,悠意 夜光音乐机器人投影钟万年历 创意家居用品可爱led闹钟静音时钟 粉红色(送电池) 机器人,钟表/类别/钟/闹钟,亚马逊(卓越网),悠意
1014005006,钟表|钟|投影钟,DOULEX/都乐 迷你装扮LED投影钟 翻转报时 M魔法消息 贪睡钟 粉色,,1号店,DOULEX/都乐
1014005006,钟表|钟|投影钟,声控投影钟/闹钟 多功能语音报时 LED显示温度/时间 闹铃 (黑色),Refinements/X-Site Refinements/LBR Brands/2012/04/06 1/艾嘉居,亚马逊(卓越网),艾嘉居
1014005006,钟表|钟|投影钟,超维 梦幻夜光星空万年历音乐投影钟 创意多功能时钟闹钟 Led电子闹钟 新品青色机器人投影钟 erwrss,钟表/类别/钟/闹钟,亚马逊(卓越网),超维
1014005006,钟表|钟|投影钟,超维 声控投影钟 静音 LED夜光 多功能电子钟 创意 灰色/白,钟表 > 钟 > 座钟 ,亚马逊(卓越网),超维
1014005006,钟表|钟|投影钟,超维 声控投影闹钟 多功能投影钟 白橙投影钟 图片,家用电器>生活电器>其它生活电器>福玛特（FMART）>超维 声控投影闹钟 多功能投影钟 白橙投...,京东商城,好药师
1014005006,钟表|钟|投影钟,超维 声控投影闹钟 万年历投影钟 粉红投影钟 S,运动健康>保健器械>家庭护理>班乐士（Balan's）>超维 声控投影闹钟 万年历投影钟 粉红投...,京东商城,好药师
1014005006,钟表|钟|投影钟,Oregon Scientific 欧西亚 RM303P 时间投影钟 闹钟 创意懒人 静音 可爱时钟 红色,首页 >娱乐影音 >潮流电玩 >其他数码酷玩 >Oregon Scientific 欧西亚 >RM303P,易迅网,Oregon scientific/欧西亚
1014005006,钟表|钟|投影钟,易美特 创意多功能投影钟 数字电子静音时钟背光贪睡闹钟多组闹铃 M0211S （银色）,首页>家居/家装建材/厨具>生活日用>装饰用品>易美特创意多功能投影钟数字电子静...,苏宁,易美特
1014005006,钟表|钟|投影钟,Timess 声控背光语音闹钟 报时 投影钟 闹钟 BR-809,所有分类>家居家纺、锅具餐具>装饰/日用>闹钟/挂钟/落地钟>闹钟/投影钟>Timess>Timess 声控背...,1号店,Timess
1014005006,钟表|钟|投影钟,好时达 创意静音电子LED投影钟 懒人闹钟 投影闹钟 创意礼品,家用/类别/家居/家居装饰,亚马逊(卓越网),HIGHSTAR 好时达
1014005006,钟表|钟|投影钟,Timess 天美时 声控背光语音闹钟 报时 投影钟 闹钟 BR-806,钟 > 闹钟 > 田园/n复古/n中式/n简约/n创意 > ,1号店,TIMESS/天美时
1014005006,钟表|钟|投影钟,超维 声控投影温度计 台历CW8097 投影钟 贪睡迷你 电子投影闹钟(白橙）,钟表/类别/钟/闹钟,亚马逊(卓越网),超维
1014005006,钟表|钟|投影钟,孙小圣 大屏幕投影钟 创意可爱时尚大屏显示闹钟,礼品箱包>礼品>创意礼品>孙小圣>孙小圣 大屏幕投影钟 创意可爱时尚大屏显...,京东商城,孙小圣旗舰店
1014005006,钟表|钟|投影钟,艾嘉居 创意LED投影钟 懒人静音音乐闹钟128A,所有分类>家居家纺、锅具餐具>装饰/日用>闹钟/挂钟/落地钟>闹钟/投影钟>艾嘉居>艾嘉居 创意LED投...,1号店,艾嘉居
1014005006,钟表|钟|投影钟,超维 声控投影闹钟 多功能投影钟 白灰投影钟 图片,家用电器>生活电器>其它生活电器>福玛特（FMART）>超维 声控投影闹钟 多功能投影钟 白灰投...,京东商城,好药师
1014005006,钟表|钟|投影钟,盛派 好时达正品 多功能电子闹钟投影闹钟创意 投影钟创意礼品1139A (白色),,亚马逊(卓越网),盛派
1014005006,钟表|钟|投影钟,YIDA 第二代魔幻星月投影钟 星月投影 闹钟 静音 夜光时钟 创意电子表 迷你 个性懒人贪睡钟创意卡通电子静音儿童夜光懒人可爱时钟小闹钟音乐 多功能 闹钟 贪睡 迷你 时钟表 可爱 萤光 个性 懒人 创意 闹钟 静音 夜光荧光 欧式 田园 打铃 创意 时尚 可爱 小闹钟， 小闹钟 创意 个性 学生钟 静音 懒人闹钟 夜光 音乐 数字闹钟 创意电子钟 金属打铃 双铃 静音闹钟4.5寸 懒人创意卧室,办公用品 > 办公家具灯具 > 办公灯具,亚马逊(卓越网),YIDA
1014005006,钟表|钟|投影钟,Oregon Scientific 欧西亚 超薄室内外 温度投影时钟 时间闹钟 背光投影钟 创意时钟,所有分类>大小家电、厨电、汽车>生活电器>其它生活电器>Oregon Scientific>Oregon Sci...,1号店,Oregon Scientific
1014005006,钟表|钟|投影钟,闹钟时计简约时尚 声控投影钟声控投影钟8097智能投影,家用电器 > 生活电器 > 其它 > 闹钟时计简约时尚 声控投影钟声控投影钟8097智能投影,当当网,other/其他
1014005006,钟表|钟|投影钟,Mini酷 迷你投影钟(黑色),首页 > 时尚/流行 > 时尚手表 > Mini酷,欧酷网,
1014005006,钟表|钟|投影钟,OregonScientific 欧西亚 投影宝贝 闹钟投影钟 RM303P (红色),家居 > 家居装饰 > 挂钟、闹钟 > 闹钟,亚马逊(卓越网),OregonScientific 欧西亚
1014005006,钟表|钟|投影钟,时光机 电子投影钟 商务桌闹钟 LD3301 银色,钟表>闹钟挂钟>电子钟>时光机>时光机 电子投影钟 商务桌闹钟 LD33...,京东商城,时光工厂
1014005006,钟表|钟|投影钟,Timess 天美时 天气预报 投影钟 闹钟 BR-812,家居生活、运动保健>装饰/日用>钟,1号店,TIMESS/天美时
1014005006,钟表|钟|投影钟,Timess 天美时 声控背光语音闹钟 报时 投影钟 闹钟 BR-809,钟 > 闹钟 > 田园/n复古/n中式/n简约/n创意 > ,1号店,TIMESS/天美时
1014005006,钟表|钟|投影钟,吉满 音乐星空投影钟 万年历时钟 七彩投影灯,礼品箱包>礼品>创意礼品>吉满 音乐星空投影钟 万年历时钟 七彩投...,京东商城,吉满礼品专营店
1014005006,钟表|钟|投影钟,超维 声控投影闹钟 多功能投影钟 粉红投影钟 图片,家用电器>生活电器>其它生活电器>福玛特（FMART）>超维 声控投影闹钟 多功能投影钟 粉红投...,京东商城,好药师
1014005006,钟表|钟|投影钟,G+DESIGN 语音报时 投影钟 投影闹钟 报时 闹钟 806 (白色),当您购买 1 或由G+DESIGN提供的更多指定商品时，您将免运费获得此商品 点此查看如何获得促销优惠 (促销说明),亚马逊(卓越网),G+DESIGN
1014005006,钟表|钟|投影钟,盛派 好时达正品 多功能电子闹钟投影闹钟创意 投影钟创意礼品1139A (黑色),,亚马逊(卓越网),盛派
1014005006,钟表|钟|投影钟,梦幻夜光星空万年历音乐投影钟 创意多功能时钟闹钟 Led电子闹钟星空投影 时间 温度 日历 4功能,,亚马逊(卓越网),盛派
1014005006,钟表|钟|投影钟,TIMESS 声控背光语音报时投影钟-809,首页 >钟表/礼品配饰 >闹钟/挂钟/计时器 >TIMESS >投影钟-809,易迅网,
1014005006,钟表|钟|投影钟,More-thing星月投影闹钟投影时间座钟魔幻七彩投影钟创意礼品,手机>手机配件>创意配件> more-thing>More-thing星月投影闹钟投影时间...,京东商城,麦果京东数码专营店
1014005006,钟表|钟|投影钟,麦宝创玩 彩屏可旋转电子闹钟 气象站投影钟 温湿度时间闹钟 创意礼物礼品 懒人钟创意摆件家,母婴用品 玩具>DIY创意>麦宝创玩DIY创意>麦宝创玩 彩屏可旋转电子闹钟 气象站投影钟 温湿度时间闹钟 创意礼物礼品 懒人钟创意摆件家,国美电器网上商城,麦宝创玩DIY创意
1014005006,钟表|钟|投影钟,欧西亚 DP200 超高清时间投影钟仪 温度计,家用电器>生活电器>其它生活电器>欧西亚（Oregon Scientific）>欧西亚DP200,京东商城,欧西亚（Oregon Scientific）
1014005006,钟表|钟|投影钟,好事达正品投影钟 万年历投影表 闹钟 投影钟 万年历 闹钟,礼品乐器 > 礼品 > 创意礼品 > 商品详情,当当网,无
1014005006,钟表|钟|投影钟,Mini酷 迷你投影钟(红色),首页 > 时尚/流行 > 时尚手表 > Mini酷,欧酷网,
1014005006,钟表|钟|投影钟,Timess 天美时 天气预报 投影钟 闹钟 BR-812,钟 > 闹钟 > 田园/n复古/n中式/n简约/n创意 > ,1号店,TIMESS/天美时
1014005006,钟表|钟|投影钟,超维 声控夜光双投影 个性电子静音 创意 懒人 闹钟/投影钟 橙/白色,家居 > 家居装饰 > 挂钟、闹钟 > 座钟 ,亚马逊(卓越网),超维
1014005006,钟表|钟|投影钟,超维 声控投影闹钟 多功能投影钟 黑红投影钟 图片,家用电器>生活电器>其它生活电器>福玛特（FMART）>超维 声控投影闹钟 多功能投影钟 黑红投...,京东商城,好药师
1014005006,钟表|钟|投影钟,超维 声控夜光双投影 个性电子静音 创意 懒人 闹钟/投影钟 (黄白),钟表 > 钟 > 闹钟,亚马逊(卓越网),超维
1014005006,钟表|钟|投影钟,G+DESIGN 语音报时 投影钟 投影闹钟 报时 闹钟 806 (黑色),当您购买 1 或由G+DESIGN提供的更多指定商品时，您将免运费获得此商品 点此查看如何获得促销优惠 (促销说明),亚马逊(卓越网),G+DESIGN
1014005006,钟表|钟|投影钟,RECESKY 创意家居 007手枪造型投影闹钟 懒人时钟投影钟 英国Thumbsup 全球十大创意时钟,,亚马逊(卓越网),recesky
1014005006,钟表|钟|投影钟,好时达HSD128A 3组闹铃投影钟 多功能音乐电子静音夜光闹钟 懒人时钟座钟,礼品箱包>礼品>创意礼品> 好时达（HIGHSTAR）>好时达HSD128A 3组闹铃投影钟 多...,京东商城,好时达旗舰店
1014005006,钟表|钟|投影钟,易美特 创意多功能投影钟 数字电子静音时钟背光贪睡闹钟多组闹铃 M0211S （黑色）,首页>家居/家装建材/厨具>生活日用>装饰用品>易美特创意多功能投影钟数字电子静...,苏宁,易美特
1014005006,钟表|钟|投影钟,可爱创意投影钟万年历时钟电子钟 个性LED夜光懒人静音闹钟表8098,家用电器 > 生活电器 > 其它 > 可爱创意投影钟万年历时钟电子钟 个性LED夜光懒人静音闹钟表8098,当当网,超维
1014005006,钟表|钟|投影钟,麦宝创玩（imybao）多功能语音报时声控投影钟 创意闹钟 多功能 黄色,玩具乐器>创意减压>创意玩具>其它>麦宝创玩（imybao）多功能语音报时声...,京东商城,麦宝创玩
1014005006,钟表|钟|投影钟,爱的曼语 蓝光智能声控投影钟 创意家居新奇特钟表 感应投影座钟闹钟 个性生日礼物送男女朋友同学男女生 情人节礼品,钟表/类别/钟/闹钟,亚马逊(卓越网),爱的曼语
1014005006,钟表|钟|投影钟,Chaowei 超维 创意投影钟 声控夜光 带温度 万年历显示个性 懒人闹钟 CW8097,家用/类别/家居/家居装饰/装饰摆件、挂件/室内温度计湿度计,亚马逊(卓越网),Chaowei 超维
1014005006,钟表|钟|投影钟,超维 个性 声控LED霓虹 投影钟 创意闹钟点阵显示 霓虹灯动态效果 橙/白色,家居 > 家居装饰 > 挂钟、闹钟 > 闹钟,亚马逊(卓越网),超维
1014005006,钟表|钟|投影钟,超维 声控夜光双投影 个性电子静音 创意 懒人 闹钟/投影钟 (蓝白),钟表 > 钟 > 闹钟,亚马逊(卓越网),超维
1014005006,钟表|钟|投影钟,时光机 创意罗马数字投影钟失恋33天黄小仙客厅LED挂钟表时钟 下单后1~3天发货T021 白色 罗马数字,时光机>时光机 创意罗马数字投影钟失恋33天黄小...,京东商城,时光工厂
1014005006,钟表|钟|投影钟,艾嘉居 创意懒人电子投影闹钟 LED音乐投影钟 创意礼品,首页>钟表/珠宝/礼品>钟表>闹钟挂钟>艾嘉居创意懒人电子投影闹钟LED...,苏宁,艾嘉居
1014005006,钟表|钟|投影钟,鑫邦博启 静音夜光天气预报时钟创意闹钟都乐迷你贪睡投影钟翻转报时电子钟,,亚马逊(卓越网),鑫邦博启
1014005006,钟表|钟|投影钟,Timess BR-806 声控背光语音报时投影钟,首页 >钟表/礼品配饰 >闹钟/挂钟/计时器 >TIMESS >806,易迅网,Timess
1014005006,钟表|钟|投影钟,迷你便携式投影钟钥匙扣挺方便的~,当当网 > 家居日用 > 整理收纳 > 创意家居,当当网,EQLI
1014005006,钟表|钟|投影钟,超大LED显示投影钟 投影闹钟 投影表,当当网 > 家用电器 > 生活电器 > 其它,当当网,HIGHSTAR
1014005006,钟表|钟|投影钟,[当当自营] 好时达七彩投影钟(白),当当网 > 钟表珠宝、礼品眼镜 > 礼品 > 创意礼品,当当网,
1014005006,钟表|钟|投影钟,麦宝创玩（imybao）多功能语音报时声控投影钟 创意闹钟 多功能 红色,玩具乐器>创意减压>创意玩具>其它>麦宝创玩（imybao）多功能语音报时声...,京东商城,麦宝创玩
1014005006,钟表|钟|投影钟,Timess 天美时 天气预报投影钟-812,首页 > 箱包、钟表、配饰 > 钟表 > 闹钟挂钟 > Timess 天美时 ,新蛋商城,Timess 天美时
1014005006,钟表|钟|投影钟,OregonScientific 欧西亚 投影宝贝 闹钟投影钟 RM303P (白色),家居 > 家居装饰 > 挂钟、闹钟 > 闹钟,亚马逊(卓越网),OregonScientific 欧西亚
1014005006,钟表|钟|投影钟,淘乐士 创意音乐星空投影钟 夜光万年历静音闹钟温度计 宝宝们最爱 白色,家用/类别/家居/家具/DIY家具配件,亚马逊(卓越网),淘乐士
1014005006,钟表|钟|投影钟,超维 创意投影钟 声控夜光 带温度 万年历显示个性 懒人闹钟 灰/白色,钟表 > 钟 > 座钟 ,亚马逊(卓越网),超维
1014005006,钟表|钟|投影钟,玩意生活 创意手枪闹钟手枪投影钟懒人闹钟英国Thumbsup新品,钟表/类别/钟/闹钟,亚马逊(卓越网),玩意生活
1014005006,钟表|钟|投影钟,吉满 七彩投影时钟jm1419 最新款圆型投影钟 个性时计,礼品箱包>礼品>创意礼品>吉满 七彩投影时钟jm1419 最新款圆...,京东商城,吉满礼品专营店
1014005006,钟表|钟|投影钟,CHAOWEI 超维 CW8097c 灰白色 投影钟 影射经典,智能闹钟，声控投影灯 静音,led夜光 懒人贪睡多功能电子钟,首页 >娱乐影音 >潮流电玩 >其他数码酷玩 > Chaowei超维 >CW8097c灰白色
1014005006,钟表|钟|投影钟,GreatLites格睿莱特 小投影钟 钥匙扣投影 红色 手电筒时计 投影钟 JNW040-1,家居 > 家居装饰 > 挂钟、闹钟 > 座钟 玩具 > 电子类玩具 > 闹钟,亚马逊(卓越网),GreatLites 格睿莱特
1014005006,钟表|钟|投影钟,盛派 多功能电子闹钟投影闹钟创意 创意投影钟礼品1137A好时达正品 (白色),,亚马逊(卓越网),盛派
1014005006,钟表|钟|投影钟,Juzon 梦幻夜光星空万年历音乐投影钟 创意多功能时钟闹钟 Led电子闹钟星空投影 时间 温度 日历 4功能,,亚马逊(卓越网),Juzon
1014005006,钟表|钟|投影钟,吉满 音乐星空投影钟 万年历时钟 七彩投影灯,首页 >居家收纳 >家装软饰 >吉满 >4600,易迅网,其他
1014005006,钟表|钟|投影钟,Timess BR-812 天气预报投影钟,首页 >钟表/礼品配饰 >闹钟/挂钟/计时器 >TIMESS >812,易迅网,Timess
1014005006,钟表|钟|投影钟,TIMESS 天气预报投影钟-812,首页 >钟表/礼品配饰 >闹钟/挂钟/计时器 >TIMESS >投影钟-812,易迅网,
1014005006,钟表|钟|投影钟,★安康国美★感应投影钟 投影表 万年历 温度计闹钟CW8097,当当网 > 家用电器 > 生活电器 > 灯具,当当网,投影钟
1014005006,钟表|钟|投影钟,家天下 好时达 旋转投影钟 创意时钟 闹钟 钟表 LED电子钟 128A旋转投影 日期、时间可切换查询 大屏幕,当当网 > 家具装饰 > 园艺家饰 > 挂钟闹钟 > 闹钟,当当网,好时达
1014005006,钟表|钟|投影钟,Timess 天美时 声控背光语音报时投影钟-806,首页 > 箱包、钟表、配饰 > 钟表 > 闹钟挂钟 > Timess 天美时 ,新蛋商城,Timess 天美时
1014005006,钟表|钟|投影钟,都乐(doulex) 投影钟/粉色,商城首页 >商品列表 > 都乐(doulex),为为网,都乐
1014005006,钟表|钟|投影钟,TIMESS 声控背光语音报时投影钟-809,钟表>闹钟挂钟>闹钟>Timess>天美时投影钟-809,京东商城,Timess
1014005006,钟表|钟|投影钟,一时间 电子投影钟 商务桌闹钟 LD3301 银色,钟表>闹钟挂钟>电子钟>一时间>一时间 电子投影钟 商务桌闹钟 LD33...,京东商城,时光工厂
1014005006,钟表|钟|投影钟,【新奇特】doulex 投影钟 创意闹钟 闹钟 三种颜色可选颜色 (黑色),玩具/类别/卡通钟表/闹钟,亚马逊(卓越网),doulex
1014005006,钟表|钟|投影钟,Philips 飞利浦 投影时间显示 闹铃收音机 投影钟 双闹铃 AJ5030/93,办公用品 > 办公设备 > 投影仪 数码影音 > 收音机 > 家用台式收音机 电视音响 > 投影机,亚马逊(卓越网),Philips 飞利浦
1014005006,钟表|钟|投影钟,汉时钟表HENSE 创意 投影钟 LED投影钟表 音乐星空投影闹钟HWT6 阿拉伯数字带遥控,汉时（Hense）>汉时钟表HENSE 创意 投影钟 LED...,京东商城,汉时
1014005006,钟表|钟|投影钟,时光机 创意罗马数字投影钟失恋33天黄小仙客厅LED挂钟表时钟 下单后1~3天发货T021 蓝色 罗马数字,时光机>时光机 创意罗马数字投影钟失恋33天黄小...,京东商城,时光工厂
1014005006,钟表|钟|投影钟,kwda sz56 热销 畅销 七彩闹钟 电子钟 投影钟 LED 七彩 投影 半球钟 星月 投影 时钟 新品 创意 礼品 生日礼物 女生 实用 玫瑰 送女友 朋友 闺蜜 老婆 特别浪漫 生日礼物 圣诞 春节礼物 礼品,办公用品 > 办公家具灯具 > 办公灯具,亚马逊(卓越网),KWDA
1014005006,钟表|钟|投影钟,（创新电器）创意闹钟 809触控投影钟 语音报时钟 盲人钟LED钟闹钟报温度,家用电器 > 生活电器 > 其它 > 商品详情,当当网,投影报时钟
1014005006,钟表|钟|投影钟,Oregon Scientific 欧西亚 投影钟 BAR339DP 表灯天气预报 温度计 闹钟 创意家居 时尚礼品,所有分类>家居家纺、锅具餐具>装饰/日用>闹钟/挂钟/落地钟>闹钟/投影钟>Oregon Scientific>Oregon Sci...,1号店,Oregon Scientific
1014005006,钟表|钟|投影钟,国庆疯狂促 多功能多组闹钟投影钟 每款限购10件M0211S 银色,钟表>钟表>座钟挂钟> 易美特（Emate）>国庆疯狂促 多功能多组闹钟投影钟 每款限...,京东商城,emate易美特旗舰店
1014005006,钟表|钟|投影钟,欢乐家族 迷你拱形七彩投影钟(七彩变幻),家居日用 > 清洁护理 > 其它,当当网,欢乐家族
1014005006,钟表|钟|投影钟,超炫浪漫音乐星空投影钟 创意电子七彩闹钟万年历时钟 七彩投影灯,当当网,当当网,EQLI
1014005006,钟表|钟|投影钟,迷你拱形七彩投影钟（七彩变幻）,家装建材 > 灯具照明 > 小夜灯 > 商品详情,当当网,星空夏日
1014005006,钟表|钟|投影钟,好时达1137A投影钟 超大屏幕电子钟 可外接电源 可设3组闹钟 白色,家居日用 > 清洁护理 > 卫浴用品 > 商品详情,当当网,Miffy 米菲
1014005006,钟表|钟|投影钟,doulex都乐 多功能报时 闹钟/投影钟 (黑色),钟表/类别/钟/闹钟,亚马逊(卓越网),doulex
1014005006,钟表|钟|投影钟,好时达投影钟HSD1137A创意投影闹钟个性投影时钟LED钟可用电源,钟表/类别/钟/闹钟,亚马逊(卓越网),HIGHSTAR 好时达
1014005006,钟表|钟|投影钟,超维 声控投影温度计 台历CW8097 投影钟 贪睡迷你 电子投影闹钟(黑红）,钟表/类别/钟/闹钟,亚马逊(卓越网),超维
1014005006,钟表|钟|投影钟,超维 声控投影闹钟 万年历投影钟 白灰投影钟 S,运动健康>保健器械>家庭护理>班乐士（Balan's）>超维 声控投影闹钟 万年历投影钟 白灰投...,京东商城,好药师
1014005006,钟表|钟|投影钟,（创新电器）好时达1137A投影钟 超大屏幕电子钟 可外接电源,家用电器 > 生活电器 > 其它 > 商品详情,当当网,投影钟
1014005006,钟表|钟|投影钟,静音夜光天气预报时钟创意闹钟都乐迷你贪睡投影钟翻转报时电子钟,,亚马逊(卓越网),
1014005006,钟表|钟|投影钟,盛派 多功能电子闹钟投影闹钟创意 创意投影钟礼品1137A好时达正品 (黑色),,亚马逊(卓越网),盛派
1014005006,钟表|钟|投影钟,智能声控投影钟 投影闹钟 电子温度计,礼品乐器 > 礼品 > 创意礼品 > 商品详情,当当网,无1014005007
