1019006033,家居家装|家具|花架,慧乐家 瑶台二层实木花架33036,首页 > 慧乐家Funature家具 > 瑶台二层实木花架33036,唯品会,无
1019006033,家居家装|家具|花架,型爵xingjue 现代简约装饰园艺铁艺花架 护栏花架 XJ6023（3个装） 黑色,家具>阳台/户外>花架/装饰架>型爵xingjue 现代简约装饰园艺铁艺...,京东商城,型爵官方旗舰店
1019006033,家居家装|家具|花架,旭美松木置物架 礼品架 杂志架 花架 时尚现代 新品特价xm-204 原木色三层 原木色三层,家具>阳台/户外>花架/装饰架>旭美>旭美松木置物架 礼品架 杂志架 花架 时...,京东商城,旭美家具旗舰店
1019006033,家居家装|家具|花架,腾辉 欧式仿车铁艺花架 创意落地式花架 多层花架子 TH-HJ101 纯净白,家具>阳台/户外>花架/装饰架>腾辉>腾辉 欧式仿车铁艺花架 创意落地式花架 ...,京东商城,道新建材铁艺专营店
1019006033,家居家装|家具|花架,好方便 厨房杂物置物收纳微波炉架可移动厨房大号置物架子 花架，配餐车，书架(胡桃色),家具>层架>好方便>好方便 厨房杂物置物收纳微波炉架可移动厨房大号置物架子 花架，配餐车，书架(胡桃色),国美电器网上商城,好方便旗舰店
1019006033,家居家装|家具|花架,现代中式田园橡木匠实木双层花架 ( 0.96M),家具>置物架>潘顿>现代中式田园橡木匠实木双层花架 ( 0.96M),国美电器网上商城,里外家具旗舰店
1019006033,家居家装|家具|花架,派璀克PATRICK透明钢化玻璃茶几角几电话架花架玻璃圆桌玻璃休闲桌P1-00,家具>茶几>派璀克>派璀克PATRICK透明钢化玻璃茶几角几电话架花架玻璃圆桌玻璃休闲桌P1-00,国美电器网上商城,派璀克旗舰店
1019006033,家居家装|家具|花架,欧润哲 加粗五层扩展版可旋转白色花架（升级容量）,首页 > 欧润哲Orange家具 > 加粗五层扩展版可旋转白色花架（升级容量）,唯品会,无
1019006033,家居家装|家具|花架,诗恩 地中海田园风格收纳架~置物架 实木阳台木制花架,所有分类>家居家纺、锅具餐具>家具家装>架类>其他架类>诗恩>诗恩 地中海田园风格收纳架~置物架 实木阳台木制花架,1号店,诗恩
1019006033,家居家装|家具|花架,腾辉 田园铁艺花架 落地式落三层花盆架 精致实用花架 TH-HJ107 赤铜色,家具>阳台/户外>花架/装饰架>腾辉>腾辉 田园铁艺花架 落地式落三层花盆架 ...,京东商城,道新建材铁艺专营店
1019006033,家居家装|家具|花架,腾辉 欧式经典铁艺置物架 铁艺花架装饰架 多功能落地置物架TH-HJ109 至尊黑,家装建材>装饰材料>园艺休闲>腾辉>腾辉 欧式经典铁艺置物架 铁艺花架装饰架...,京东商城,道新建材铁艺专营店
1019006033,家居家装|家具|花架,藤铁之乡 铁艺花架 自行车花盆架 阶梯多层阳台室内外花架 落地花架子yf-045 古铜色,家具>阳台/户外>花架/装饰架>藤铁之乡 铁艺花架 自行车花盆架 阶梯多...,京东商城,滢发工艺家具旗舰店
1019006033,家居家装|家具|花架,腾铁之乡 欧式阳台花架 铁艺 落地式花架子 创意自行车六盆花架 花盆架 多层 吊兰花架特价 古青铜色,家具>阳台/户外>花架/装饰架>藤铁之乡>腾铁之乡 欧式阳台花架 铁艺 落地式花架...,京东商城,
1019006033,家居家装|家具|花架,欧润哲 加粗版白色旋转三层花架,首页 > 欧润哲Orange家具移动端专场 > 加粗版白色旋转三层花架,唯品会,无
1019006033,家居家装|家具|花架,大三层实木质花架子客厅阳台置物架白色花盆架木制书架层架鞋架收纳架储物架落地户外简约韩式田园,家具>阳台/户外>花架/装饰架>岩轩>大三层实木质花架子客厅阳台置物架白色花盆...,京东商城,岩轩家具旗舰店
1019006033,家居家装|家具|花架,森岳家具 花架装饰架 北欧田园100%纯实木白橡木 棕白色 B1041 小花架,首页>家居/家装建材/厨具>家具>其他家具>森岳家具花架装饰架北欧田园100...,苏宁,森岳家
1019006033,家居家装|家具|花架,福韬 置物架 花架 折叠式多层立式浴室架 欧式铁艺展示架 浴室用品 FTR003包邮 黑,家居家装>生活日用>浴室用品>福韬（F-BARTL）>福韬 置物架 花架 折叠式多层立式浴室架...,京东商城,福韬家居旗舰店
1019006033,家居家装|家具|花架,强迪 HP-11玻璃花瓶花器花架简约花瓶 绿色,家居家装>家装软饰>工艺摆件>强迪>强迪 HP-11玻璃花瓶花器花架简约花瓶...,京东商城,苏适家居
1019006033,家居家装|家具|花架,强迪 HP-10扁形玻璃花瓶花器花架简约花瓶 绿色,家居家装>家装软饰>装饰摆件>强迪>强迪 HP-10扁形玻璃花瓶花器花架简约...,京东商城,强迪家居专营店
1019006033,家居家装|家具|花架,强迪 HP-11玻璃花瓶花器花架简约花瓶 黑色,家居家装>家装软饰>工艺摆件>强迪>强迪 HP-11玻璃花瓶花器花架简约花瓶...,京东商城,苏适家居
1019006033,家居家装|家具|花架,森岳家具 花架装饰架 北欧田园100%纯实木白橡木 棕白色 B1041 高花架,首页>家居/家装建材/厨具>家具>其他家具>森岳家具花架装饰架北欧田园100...,苏宁,森岳家
1019006033,家居家装|家具|花架,家逸 家逸 韩式全木三层折叠花架带收纳筐,首页 > 家逸家具专场 > 家逸 韩式全木三层折叠花架带收纳筐,唯品会,无
1019006033,家居家装|家具|花架,生活诚品 唯品专供三层花架,首页 > 生活诚品Easy life家具 > 唯品专供三层花架,唯品会,无
1019006033,家居家装|家具|花架,家魔仕 DIY木质三层厨房收纳架花架鞋架,厨具>厨房配件>厨房DIY/小工具>家魔仕>家魔仕 DIY木质三层厨房收纳架花架鞋架,京东商城,科歌家居专营店
1019006033,家居家装|家具|花架,果漫美式铁配木艺单层花架落地式花盆架盆栽架子客厅阳台花架花几,家具 > 阳台户外 > 花架/装饰架 > 商品详情,当当网,GOOmer/果漫
1019006033,家居家装|家具|花架,欧润哲 加粗版白色旋转三层花架,首页 > 欧润哲Orange家具移动端专场 > 加粗版白色旋转三层花架,唯品会,无
1019006033,家居家装|家具|花架,新房子铁艺花架 阳台落地花架 铁艺 多层花架 花盆架 L613,家具 > 阳台户外 > 花架/装饰架 > 商品详情,当当网,新房子
1019006033,家居家装|家具|花架,铁艺花架落地式花盆架客厅阳台花架2层架子6001,家具 > 阳台户外 > 花架/装饰架 > 商品详情,当当网,新房子
1019006033,家居家装|家具|花架,红木家具/实木汉室花架装饰架 JCM005,家具>储物家具>层架/置物架> 博古恒韵>红木家具/实木汉室花架装饰架 JCM00...,京东商城,博古恒韵家具旗舰店
1019006033,家居家装|家具|花架,旭美 实木花架 阳台花架 时尚花架 新品XM-216特价 白色 白色,家具>阳台/户外>花架/装饰架>旭美>旭美 实木花架 阳台花架 时尚花架 新品...,京东商城,旭美家具旗舰店
1019006033,家居家装|家具|花架,爱松堡 实木花架 置物架 盆景架,家具>阳台/户外>花架/装饰架> 爱松堡>爱松堡 实木花架 置物架 盆景架,京东商城,爱家屋
1019006033,家居家装|家具|花架,藤铁之乡 铁艺栏杆花架 阳台户外花盆架 阳台花架 壁挂花架yf-040 古铜色 150*20*12,家具>阳台/户外>花架/装饰架>藤铁之乡 铁艺栏杆花架 阳台户外花盆架 ...,京东商城,滢发工艺家具旗舰店
1019006033,家居家装|家具|花架,道新腾辉 花架子 欧式仿古铁艺花架 落地式五连花架 装饰架 TH-HJ104 青铜色,家具>阳台/户外>花架/装饰架>腾辉>道新腾辉 花架子 欧式仿古铁艺花架 落地...,京东商城,道新建材旗舰店
1019006033,家居家装|家具|花架,藤铁之乡 铁艺花架 自行车花盆架 阶梯多层阳台室内外花架 落地花架子yf-045 黑色,家具>阳台/户外>花架/装饰架>藤铁之乡 铁艺花架 自行车花盆架 阶梯多...,京东商城,滢发工艺家具旗舰店
1019006033,家居家装|家具|花架,道新腾辉花架 欧式风格/创意时尚花架 多层花架子 TH-HJ101 赤铜色,家具>阳台/户外>花架/装饰架>腾辉>道新腾辉花架 欧式风格/创意时尚花架 多...,京东商城,道新建材旗舰店
1019006033,家居家装|家具|花架,型爵xingjue 现代筒约铁艺花架 双层落地阳台花架 XJ6033 白色,家具>阳台/户外>花架/装饰架>型爵>型爵xingjue 现代筒约铁艺花架 双...,京东商城,淘点家居专营店
1019006033,家居家装|家具|花架,南方家居爵士简约现代落地阳台花架花几多层置物架黑色杂物架特价 矮款,家具>阳台/户外>花架/装饰架> 南方家居>南方家居爵士简约现代落地阳台花架花几多层...,京东商城,南方家居官方旗舰店
1019006033,家居家装|家具|花架,四海家具 十二橡园 美式复古花架 实木落地花架组合 卡芬达原厂 高花架,家具>阳台/户外>花架/装饰架>卡芬达（carpenter）>四海家具 十二橡园 美式复古花架 实木落...,京东商城,卡芬达家居旗舰店
1019006033,家居家装|家具|花架,自然风实木松木奥斯卡系列角架 梯形架 方架 储物架 置物架 书架 花架 展示架 陈列架 角架+梯形架 5层,家具>阳台/户外>花架/装饰架>自然风>自然风实木松木奥斯卡系列角架 梯形架 方...,京东商城,自然风家具专营店
1019006033,家居家装|家具|花架,防腐碳化 多层实木花架 落地鞋架 书架置物架 碳化色 三层,家具>阳台/户外>花架/装饰架> 悠闲生活>防腐碳化 多层实木花架 落地鞋架 书架...,京东商城,悠闲生活庭院用品专营店
1019006033,家居家装|家具|花架,型爵xingjue 田园铁艺花架 单盆落地花架 XJ15015 古铜色 褐色,家具>阳台/户外>花架/装饰架> 型爵>型爵xingjue 田园铁艺花架 单盆落...,京东商城,型爵妮娜斯专卖店
1019006033,家居家装|家具|花架,豪司罗尔 花架实木橡木 木质花架落地 特价 花盆架,家具>阳台/户外>花架/装饰架> 豪司罗尔>豪司罗尔 花架实木橡木 木质花架落地 特...,京东商城,豪司罗尔官方旗舰店
1019006033,家居家装|家具|花架,红星美凯龙/源氏木语/实木花架/进口橡木/花架/边几/美式宜家家具/Y0139 小花架41cm,家具>阳台/户外>花架/装饰架> 源氏木语>红星美凯龙/源氏木语/实木花架/进口橡木...,京东商城,红星美凯龙星易家旗舰店
1019006033,家居家装|家具|花架,型爵xingjue 田园铁艺花架 落地三盆铁艺花架 XJ6025 白色,家具>阳台/户外>花架/装饰架>型爵xingjue 田园铁艺花架 落地三...,京东商城,型爵官方旗舰店
1019006033,家居家装|家具|花架,【京好】小茶几桌子 花架实木简约易欧式移动办公客厅圆形多功能烤漆家具 C505大号 白色一般48小时内发货,家具>客厅家具>边桌/茶几> 京好>【京好】小茶几桌子 花架实木简约易欧式移...,京东商城,京好家具旗舰店
1019006033,家居家装|家具|花架,新滢 铁艺花架子 多层花几 落地式花盆架 欧式 阶梯花架 白色,家具>阳台/户外>花架/装饰架>新滢>新滢 铁艺花架子 多层花几 落地式花盆架...,京东商城,新滢旗舰店
1019006033,家居家装|家具|花架,藤铁之乡 铁艺多层户外阳台实木阶梯栏杆壁挂花架 花盆架 花架子 置物架 黑色 80*20*35,家具>阳台/户外>花架/装饰架> 藤铁之乡>藤铁之乡 铁艺多层户外阳台实木阶梯栏杆壁...,京东商城,滢发工艺家具旗舰店
1019006033,家居家装|家具|花架,ULIKE家居 铁艺花架 白色高光钢琴烤漆 不锈钢架子花架边架置物架 大号发快递,首页>家居/家装建材/厨具>家具>其他家具>ULIKE家居铁艺花架白色高光钢...,苏宁,ULIKE
1019006033,家居家装|家具|花架,道新腾辉 简约田园精致铁艺花架子 单盆双层落地花架 TH-HJ115（大）-116（小） 纯净白 36*23*68cm,家具>阳台/户外>花架/装饰架>腾辉>道新腾辉 简约田园精致铁艺花架子 单盆双...,京东商城,道新建材旗舰店
1019006033,家居家装|家具|花架,富兰德 美式乡村 实木脚 花几 花架 小圆几 圆台 仿古手绘家具 FW4214-1,家具>阳台/户外>花架/装饰架> 富兰德>富兰德 美式乡村 实木脚 花几 花架 小...,京东商城,富兰德家居旗舰店
1019006033,家居家装|家具|花架,欧润哲 加粗五层扩展版可旋转白色花架（升级容量）,首页 > 欧润哲Orange家具 > 加粗五层扩展版可旋转白色花架（升级容量）,唯品会,无
1019006033,家居家装|家具|花架,简约方款陶瓷花器  花盆花架,家装建材 > 时尚家饰 > 摆饰/挂件 > 简约方款陶瓷花器  花盆花架,当当网,德洛美
1019006033,家居家装|家具|花架,生活诚品 三层花架,首页 > 生活诚品Easy life家具 > 三层花架,唯品会,无
1019006033,家居家装|家具|花架,粤顺实木花架 桦木室内阳台花架花盘架子231,家具 > 阳台户外 > 花架/装饰架 > 粤顺实木花架 桦木室内阳台花架花盘架子231,当当网,粤顺
1019006033,家居家装|家具|花架,宜哉  全实木置物架层架 格子铺收纳架 花架 书架 实木格架  DY3,家具 > 储物家具 > 层架置物架 > 宜哉  全实木置物架层架 格子铺收纳架 花架 书架 实木格架  DY3,当当网,宜哉
1019006033,家居家装|家具|花架,光明实木家具 白色水曲柳花架 实木花架 落地花台 实木组合花架 73101 2个组合,首页>家居/家装建材/厨具>家具>其他家具>光明实木家具白色水曲柳花架实木花...,苏宁,光明家具
1019006033,家居家装|家具|花架,道新腾辉田园铁艺花架落地式三层花盆架精致实用花架TH-HJ107 纯净白,首页>家居/家装建材/厨具>家具>其他家具>道新腾辉田园铁艺花架落地式三层花盆架...,苏宁,TENG-HUI
1019006033,家居家装|家具|花架,欧润哲（ORANGE） 花盆置物架 创意室内客厅白色三层楼梯镂空花架,家具>阳台/户外>花架/装饰架> 欧润哲（ORANGE）>欧润哲花盆置物架,京东商城,欧润哲（ORANGE）
1019006033,家居家装|家具|花架,御品工匠 实木花架纯进口橡木花架 实木花台边几特价K1107 乌金木色高,首页>家居/家装建材/厨具>家具>其他家具>御品工匠实木花架纯进口橡木花架实...,苏宁,御品工匠
1019006033,家居家装|家具|花架,喜之林 花架 实木 阳台花架 客厅花架 实木家具 大花架,首页>家居/家装建材/厨具>家具>其他家具>喜之林花架实木阳台花架客厅花...,苏宁,喜之林
1019006033,家居家装|家具|花架,嘉宜美凉台花架木头架子置物架木头置物架木头花架木架子格架,家具 > 储物家具 > 层架置物架 > 嘉宜美凉台花架木头架子置物架木头置物架木头花架木架子格架,当当网,嘉宜美


