1019006033,家居家装|家具|花架,惠万家实木/书架/鞋架/置物架/花架/货架/五层架子/陈列架/收纳架,惠万家>惠万家实木/书架/鞋架/置物架/花架/货...,京东商城,惠万家旗舰店
1019006033,家居家装|家具|花架,木智实木鞋架/置物架/花架/货号184 原木色 长度70cm,家具>客厅家具>鞋柜>木智>木智实木鞋架/置物架/花架/货号184 ...,京东商城,木智旗舰店
1019006033,家居家装|家具|花架,木智实木鞋架/置物架/花架/货号181 白色 长度53cm,家具>客厅家具>鞋柜>木智>木智实木鞋架/置物架/花架/货号181 ...,京东商城,木智旗舰店
1019006033,家居家装|家具|花架,木智实木鞋架/置物架/花架/货号183 红色 长度90cm,家具>客厅家具>鞋柜>木智>木智实木鞋架/置物架/花架/货号183 ...,京东商城,木智旗舰店
1019006033,家居家装|家具|花架,型爵xingjue 铁艺室内 花架 XJ22099,家居家装>家装软饰>工艺摆件>型爵>型爵xingjue 铁艺室内 花架 XJ...,京东商城,淘点家居专营店
1019006033,家居家装|家具|花架,沃施花架4359 铁丝花架3623 修枝剪1066,家居装修 > 园艺、花束、户外 > 园艺与花束 > 园艺用品 > 花架,亚马逊(卓越网),Worth 沃施
1019006033,家居家装|家具|花架,木智实木多功能换鞋凳/穿鞋凳/鞋架/花架/货号131 原木色 长度70cm,家具>客厅家具>鞋柜>木智>木智实木多功能换鞋凳/穿鞋凳/鞋架/花架...,京东商城,木智旗舰店
1019006033,家居家装|家具|花架,小三层实木质折叠花架子客厅阳台置物架阶梯花盆架木制书架层架鞋架收纳架储物架室内简约韩式田园,家具>阳台/户外>花架/装饰架>岩轩>小三层实木质折叠花架子客厅阳台置物架阶梯...,京东商城,岩轩家具旗舰店
1019006033,家居家装|家具|花架,型爵xingjue 铁艺 落地花架 XJ15025,家居家装>家装软饰>工艺摆件>型爵xingjue 铁艺 落地花架 XJ...,京东商城,淘点家居专营店
1019006033,家居家装|家具|花架,型爵xingjue 铁艺田园花架 XJ 黑6025 均码,家居家装>家装软饰>工艺摆件>型爵xingjue 铁艺田园花架 XJ ...,京东商城,淘点家居专营店
1019006033,家居家装|家具|花架,木智实木鞋架/置物架/花架/货号182 白色 长度70cm,家具>客厅家具>鞋柜>木智>木智实木鞋架/置物架/花架/货号182 ...,京东商城,木智旗舰店
1019006033,家居家装|家具|花架,型爵xingjue 铁艺田园花架 XJ6040 古铜 均码,家居家装>家装软饰>工艺摆件>型爵xingjue 铁艺田园花架 XJ6...,京东商城,淘点家居专营店
1019006033,家居家装|家具|花架,型爵xingjue 铁艺 田园花架 XJ6035 白色 均码,家居家装>家装软饰>工艺摆件>型爵xingjue 铁艺 田园花架 XJ...,京东商城,淘点家居专营店
1019006033,家居家装|家具|花架,唐伯兔 欧式铁艺花架 盆景花架 阳台 落地式 仿古花架 卧室/客厅/厨房置物架96308【春暖花开 养花季】 (黑色),家居 > 家居装饰 > 装饰摆件、挂件 > 水景工艺 家居装修 > 园艺、花束、庭院 > 园艺设施 > 花盆、花架、育苗盘,亚马逊(卓越网),唐伯兔
1019006033,家居家装|家具|花架,玲珑帝DIY实木移动黑白四层书架/花架/层架/置物架,家具>书房家具>书柜/书架>玲珑帝>玲珑帝DIY实木移动黑白四层书架/花架/...,京东商城,玲珑帝旗舰店
1019006033,家居家装|家具|花架,欧施洛 花架(高) 白色落地花架 田园风格 木质花架 花架(高) 实木+中纤板+烤漆工艺35*35*100CM,家具>阳台/户外>花架/装饰架>欧施洛家具>欧施洛 花架(高) 白色落地花架 田园风...,京东商城,欧施洛家具旗舰店
1019006033,家居家装|家具|花架,新滢 花架 铁艺落地式花盆架 室内外阳台客厅 欧式仿古花架子 黑色,家具>阳台/户外>花架/装饰架>新滢>新滢 花架 铁艺落地式花盆架 室内外阳台...,京东商城,新滢旗舰店
1019006033,家居家装|家具|花架,Saide落地式铁艺花架 客厅墙角车型艺术四层阳台花盆架子 飘窗盆栽花架025673 古铜色,家装建材>装饰材料>园艺休闲>Saide>Saide落地式铁艺花架 客厅墙角车型艺...,京东商城,saide旗舰店
1019006033,家居家装|家具|花架,家逸三层折叠花架置物架储物架收纳架鞋架书架实木木质木制宜家室内室外户外阳台田园 白架彩板017,家具>阳台/户外>花架/装饰架>家逸>家逸三层折叠花架置物架储物架收纳架鞋架书...,京东商城,家逸家居
1019006033,家居家装|家具|花架,宜哉 壁挂花架 实木单格架 收纳置物 实木方形放书格架【DY1.1*1】 31CM深,家具>书房家具>书柜/书架>宜哉>宜哉 壁挂花架 实木单格架 收纳置物 实...,京东商城,宜哉家具旗舰店
1019006033,家居家装|家具|花架,Saide欧式家居 铁艺花架 花盆架 脸盆架方形24272 褐色 中,家装建材>装饰材料>园艺休闲>Saide>Saide欧式家居 铁艺花架 花盆架 脸...,京东商城,saide旗舰店
1019006033,家居家装|家具|花架,华谊家具 中花架 纯实木XCF10304-2 实木花架 带抽屉花架 工厂直销 环保养生 家居就旗舰店,家具>储物家具>层架/置物架>华谊>华谊家具 中花架 纯实木XCF10304...,京东商城,家居就建材家居旗舰店
1019006033,家居家装|家具|花架,新房子 新款 铁艺 阳台 落地式 花盆架 客厅 花架6014 古铜,家具>阳台/户外>花架/装饰架>新房子 新款 铁艺 阳台 落地式 花盆架...,京东商城,新房子旗舰店
1019006033,家居家装|家具|花架,田园风格 铁艺花架子 花盆架阳台客厅置物架 多层花架 特价时尚 古铜,家具>阳台/户外>花架/装饰架>田园风格 铁艺花架子 花盆架阳台客厅置物...,京东商城,新房子旗舰店
1019006033,家居家装|家具|花架,艺柳园三层折叠花架置物架储物架收纳架鞋架书架实木木质木制宜家室内室外户外阳台田园 红架白板016,家居家装>生活日用>收纳用品>艺柳园三层折叠花架置物架储物架收纳架鞋架...,京东商城,艺柳园
1019006033,家居家装|家具|花架,SRRS 圣若瑞斯 双层铁艺花架 阳台落地式花盆架宜家 田园欧式拆装 2层花架 (白色),家居 > 家具 > 客厅家具 > 置物架 > 立式置物架 家居装修 > 园艺、花束、庭院 > 园艺设施 > 花盆、花架、育苗盘,亚马逊(卓越网),SRRS 圣若瑞斯
1019006033,家居家装|家具|花架,津沽园艺 园艺用品 铁艺花架 环形攀爬植物专用 3套装,所有分类>家居家纺、锅具餐具>宠物园艺>鲜花速递/绿植园艺>花瓶/花盆/花架>津沽园艺>津沽园艺 园艺用品 ...,1号店,津沽园艺
1019006033,家居家装|家具|花架,慧乐家 瑶台三层实木花架33037,首页 > 慧乐家Funature家具 > 瑶台三层实木花架33037,唯品会,无
1019006033,家居家装|家具|花架,慧乐家 慧乐家芙莱尔双盆花架22097,首页 > 慧乐家Funature家具 > 慧乐家芙莱尔双盆花架22097,唯品会,无
1019006033,家居家装|家具|花架,[当当自营]生活诚品 巴洛克系列落地车型花架CJ25070,家具 > 阳台户外 > 花架/装饰架 > 商品详情,当当网,生活诚品
1019006033,家居家装|家具|花架,楠竹电话架花架置物架实木层架厨房储物架家居收纳架 二层,家具>储物家具>层架/置物架>好空间>楠竹电话架花架置物架实木层架厨房储物架家...,京东商城,德洛美家居专营店
1019006033,家居家装|家具|花架,欧润哲 田园多层旋转式落地花架花盘架 黑色,家具>阳台/户外>花架/装饰架>欧润哲（ORANGE）>欧润哲花盘架,京东商城,欧润哲（ORANGE）
1019006033,家居家装|家具|花架,慧乐家 瑶台二层实木花架白色33036,家具>阳台/户外>花架/装饰架> 慧乐家>慧乐家花架,京东商城,慧乐家
1019006033,家居家装|家具|花架,华谊家具 花架高 XCF10304-3 仿古色,家具>茶几>华谊>华谊家具 花架高 XCF10304-3 仿古色,国美电器网上商城,华谊家具旗舰店
1019006033,家居家装|家具|花架,拜占庭家具 纯实木置物架 白橡木花架 花盆架 复古简约花几 小花架 bzt-fz01 复古色 小花架,家具>阳台/户外>花架/装饰架>拜占庭家具（byzantine）>拜占庭家具 纯实木置物架 白橡木花架 花...,京东商城,拜占庭家具旗舰店
1019006033,家居家装|家具|花架,欧润哲 白色三角花架浴室厨房置物架,首页 > 欧润哲Orange家具 > 白色三角花架浴室厨房置物架,唯品会,无
1019006033,家居家装|家具|花架,御品工匠 花几 Z字型个性花架 装饰用置物花几 大中小花架KZ13,家具 > 阳台户外 > 花架/装饰架 > 商品详情,当当网,御品工匠
1019006033,家居家装|家具|花架,竹禾木生活 花架置物架 楠竹落地花架 阶梯白色花架 盆景架,家具 > 阳台户外 > 花架/装饰架 > 商品详情,当当网,竹禾木生活
1019006033,家居家装|家具|花架,楠竹电话架花架置物架实木层架厨房储物架家居收纳架 二层,家具>阳台/户外>花架/装饰架>竹山下>楠竹电话架花架置物架实木层架厨房储物架家...,京东商城,德洛美家居专营店
1019006033,家居家装|家具|花架,腾辉 欧美田园铁艺花架 三层扇形落地式 铁艺花盆架 TH-HJ103 赤铜色,家装建材>装饰材料>园艺休闲>腾辉>腾辉 欧美田园铁艺花架 三层扇形落地式 ...,京东商城,道新建材铁艺专营店
1019006033,家居家装|家具|花架,藤铁之乡 铁艺花架 阳台室内外欧式花架 花盆架 卧室落地花架子 多层yf-026 黑色,家具>阳台/户外>花架/装饰架>藤铁之乡>藤铁之乡 铁艺花架 阳台室内外欧式花架 ...,京东商城,滢发工艺家具旗舰店
1019006033,家居家装|家具|花架,慧乐家 芙莱尔三盆花架白色22098,家具>阳台/户外>花架/装饰架>慧乐家>慧乐家花架,京东商城,慧乐家
1019006033,家居家装|家具|花架,惠宜家居花架 个性实用花架 水曲柳客厅家具双层花架置物架展示架HY-R013 大,首页>家居/家装建材/厨具>家具>其他家具>惠宜家居花架个性实用花架水曲柳客...,苏宁,惠宜
1019006033,家居家装|家具|花架,欧润哲 棕色拱形花架盆栽架,首页 > 欧润哲Orange家具 > 棕色拱形花架盆栽架,唯品会,无
1019006033,家居家装|家具|花架,强迪 HP-16手绘花瓶 花瓶花器花架简约花瓶 白底高30CM(图案随机),家居家装>家装软饰>工艺摆件>强迪>强迪 HP-16手绘花瓶 花瓶花器花架简...,京东商城,
1019006033,家居家装|家具|花架,强迪 HP-10扁形玻璃花瓶花器花架简约花瓶 黑色,家居家装>家装软饰>装饰摆件>强迪>强迪 HP-10扁形玻璃花瓶花器花架简约...,京东商城,强迪家居专营店
1019006033,家居家装|家具|花架,福嘉福 仿真花假花铁艺花架壁挂墙饰 房间装饰壁饰壁架花盆架 桔黄色,家居家装>家装软饰>工艺摆件>翰丰堂>福嘉福 仿真花假花铁艺花架壁挂墙饰 房间...,京东商城,
1019006033,家居家装|家具|花架,欧润哲 加粗版白色旋转三层花架,首页 > 欧润哲Orange家具 > 加粗版白色旋转三层花架,唯品会,无
1019006033,家居家装|家具|花架,家逸 家逸 韩式全木三层折叠花架,首页 > 家逸家具专场 > 家逸 韩式全木三层折叠花架,唯品会,无
1019006033,家居家装|家具|花架,御品工匠 全实木花架 纯进口白蜡木花架 胡桃色花台边几特价,家具 > 阳台户外 > 花架/装饰架 > 商品详情,当当网,御品工匠
1019006033,家居家装|家具|花架,道新腾辉花架欧式铁艺微波炉架/烤箱架/厨卫双层置物架TH-ZW104 纯净白,首页>家居/家装建材/厨具>家具>其他家具>道新腾辉花架欧式铁艺微波炉架/烤箱架...,苏宁,TENG-HUI
1019006033,家居家装|家具|花架,EVERGREEN 手绘热熔玻璃铁艺装饰边桌/茶几/花架，品质即品味 居家琉璃点睛之笔 一桌多用,首页 > EVERGREEN家居用品专场 > 手绘热熔玻璃铁艺装饰边桌/茶几/花架,唯品会,无
1019006033,家居家装|家具|花架,慧乐家 时尚创意瑶台五层梯形白色转角花架,首页 > 慧乐家Funature家具 > 时尚创意瑶台五层梯形白色转角花架,唯品会,无
1019006033,家居家装|家具|花架,慧乐家 清新韩式瑶台二层白色实木花架,首页 > 慧乐家Funature家具 > 清新韩式瑶台二层白色实木花架,唯品会,无
1019006033,家居家装|家具|花架,欧润哲 白色拱形花架盆栽架,首页 > 欧润哲Orange家具 > 白色拱形花架盆栽架,唯品会,无
1019006033,家居家装|家具|花架,力洲铁艺花架 阳台栏杆花架花盆架 悬挂花架 阳台花盆架,家具 > 阳台户外 > 花架/装饰架 > 商品详情,当当网,LIZHOU力洲
1019006033,家居家装|家具|花架,道新腾辉 欧式铁艺花架 客厅室内落地花架子 阳台花盆架盆景架 赤铜色大,首页>家居/家装建材/厨具>家具>其他家具>道新腾辉欧式铁艺花架客厅室内落地...,苏宁,
1019006033,家居家装|家具|花架,型爵xingjue 欧式铁艺花架 落地三层花架 XJ6027 白色,家具>阳台/户外>花架/装饰架>型爵xingjue 欧式铁艺花架 落地三...,京东商城,型爵官方旗舰店
1019006033,家居家装|家具|花架,藤铁之乡 铁艺花架 阳台室内外欧式花架 花盆架 卧室落地花架子 多层yf-026 白色,家具>阳台/户外>花架/装饰架>藤铁之乡>藤铁之乡 铁艺花架 阳台室内外欧式花架 ...,京东商城,滢发工艺家具旗舰店
1019006033,家居家装|家具|花架,华灏 方架置物架花架三四五层 厨房卧室卫生间角架 层架实木松木 五层,家具>储物家具>层架/置物架>华灏>华灏 方架置物架花架三四五层 厨房卧室卫...,京东商城,华灏家具官方旗舰店
1019006033,家居家装|家具|花架,道新腾辉 简约田园精致铁艺花架子 单盆双层落地花架 TH-HJ115（大）-116（小） 青铜色 40*26*78cm,家具>阳台/户外>花架/装饰架>腾辉>道新腾辉 简约田园精致铁艺花架子 单盆双...,京东商城,道新建材旗舰店
1019006033,家居家装|家具|花架,【京好】花架 置物架欧美式田园客厅阳台实木黑板架层架家具 L07-049C 3层款一般48小时内发货,家具>阳台/户外>花架/装饰架> 京好>【京好】花架 置物架欧美式田园客厅阳台实...,京东商城,京好家具旗舰店
1019006033,家居家装|家具|花架,道新腾辉 欧式铁艺落地式花几 新款盆景花台 室内阳台墙角矮花架TH-HJ110-111 纯净白 35*36cm,家具>阳台/户外>花架/装饰架>腾辉>道新腾辉 欧式铁艺落地式花几 新款盆景花...,京东商城,道新建材旗舰店
1019006033,家居家装|家具|花架,型爵xingjue 铁艺田园花架 落地欧美三盆花架 室内花盆架XJ6035 白色,家具>阳台/户外>花架/装饰架>型爵>型爵xingjue 铁艺田园花架 落地欧...,京东商城,淘点家居专营店
1019006033,家居家装|家具|花架,家装节 喜都汇 楠竹三层电话架花架厨房储物架现代简约收纳架置物架 XDH-0052,家具>储物家具>层架/置物架>喜都汇（shedov）>家装节 喜都汇 楠竹三层电话架花架厨房储...,京东商城,喜都汇家具旗舰店
1019006033,家居家装|家具|花架,自然风实木松木第纳维亚系列多层花架 方架 储物架 置物架 书架 展示架 陈列架 清漆5层,家具>阳台/户外>花架/装饰架>自然风>自然风实木松木第纳维亚系列多层花架 方架...,京东商城,自然风家具专营店
1019006033,家居家装|家具|花架,四海家具 卡芬达 欧式落地花架 实木手工雕刻装饰架 卡芬达原厂 高花架,家具>阳台/户外>花架/装饰架>卡芬达（carpenter）>四海家具 卡芬达 欧式落地花架 实木手工...,京东商城,卡芬达家居旗舰店
1019006033,家居家装|家具|花架,自然风实木松木四色多层花柜 方柜 储物柜 置物柜 书柜 花架 展示柜 陈列柜 清漆 2层,家具>阳台/户外>花架/装饰架>自然风>自然风实木松木四色多层花柜 方柜 储物柜...,京东商城,爱丽思
1019006033,家居家装|家具|花架,果漫(Goomer)欧式铁艺落地式花架多层室内阳台客厅花盆盆栽花架子花几 黑红金,家具>阳台/户外>花架/装饰架> 果漫（Goomer）>果漫(Goomer)欧式铁艺落地式花架多...,京东商城,果漫家居旗舰店
1019006033,家居家装|家具|花架,型爵xingjue 田园铁艺花架 落地三盆铁艺花架 XJ6025 黑色,家具>阳台/户外>花架/装饰架> 型爵>型爵xingjue 田园铁艺花架 落地三...,京东商城,型爵妮娜斯专卖店
1019006033,家居家装|家具|花架,型爵xingjue 欧美式创意蝴蝶吊篮花架 落地花架 XJ6028 黑色 黑色,家具>阳台/户外>花架/装饰架> 型爵>型爵xingjue 欧美式创意蝴蝶吊篮花...,京东商城,型爵妮娜斯专卖店
1019006033,家居家装|家具|花架,允典红木家具 红酸枝 明清古典财神方花架 榫卯结构 手工雕刻 红酸枝栗壳色,家具>阳台/户外>花架/装饰架> 允典>允典红木家具 红酸枝 明清古典财神方花架...,京东商城,允典旗舰店
1019006033,家居家装|家具|花架,果漫(Goomer）美式乡村铁配木艺单层花架落地式花盆架盆栽架子客厅阳台花架（不含花） 黑色,家具>阳台/户外>花架/装饰架>果漫（Goomer）>果漫(Goomer）美式乡村铁配木艺单层...,京东商城,果漫家居旗舰店
1019006033,家居家装|家具|花架,精致花架三件套-置物架-卡兰达精品小家具-体验工艺零利品不包邮,家具>阳台/户外>花架/装饰架> 天成卡兰达>精致花架三件套-置物架-卡兰达精品小家具...,京东商城,天成卡兰达家具旗舰店
1019006033,家居家装|家具|花架,空间生活 宜家三层书架置物架 铁艺花架 靠墙角架 收纳架,家具 > 储物家具 > 墙面搁架 > 空间生活 宜家三层书架置物架 铁艺花架 靠墙角架 收纳架,当当网,空间生活
1019006033,家居家装|家具|花架,岭林家具 现代中式高档客厅 卡斯拉实木带抽屉高中低花架H101,家具 > 阳台户外 > 花架/装饰架 > 岭林家具 现代中式高档客厅 卡斯拉实木带抽屉高中低花架H101,当当网,岭林
1019006033,家居家装|家具|花架,优哲家居 法式田园系列白色高花架 HJMK-558JA,家具 > 阳台户外 > 花架/装饰架 > 优哲家居 法式田园系列白色高花架 HJMK-558JA,当当网,优哲
1019006033,家居家装|家具|花架,惠万家储物架/实木储物架/陈列架/花架/架子/梯架/格架/五层,惠万家>惠万家储物架/实木储物架/陈列架/花架/...,京东商城,乐开家具店
1019006033,家居家装|家具|花架,沃施可调移动花盆架3611 铁丝花架3623 修枝剪1066,家居装修 > 园艺、花束、庭院 > 园艺设施 > 花盆、花架、育苗盘,亚马逊(卓越网),Worth 沃施
1019006033,家居家装|家具|花架,海蒂诗圆型松木移动花架 30CM912678300,家居装修 > 园艺、花束、庭院 > 园艺设施 > 花盆、花架、育苗盘,亚马逊(卓越网),Hettich 海蒂诗
1019006033,家居家装|家具|花架,做旧深灰蓝色.实木花架/置物架.可折叠--S1226,家具>阳台/户外>花架/装饰架>做旧深灰蓝色.实木花架/置物架.可折叠-...,京东商城,尚森家居旗舰店
1019006033,家居家装|家具|花架,木智实木鞋架/置物架/花架/货号183 原木色 长度90cm,家具>客厅家具>鞋柜>木智>木智实木鞋架/置物架/花架/货号183 ...,京东商城,木智旗舰店
1019006033,家居家装|家具|花架,小三层实木质花架子客厅阳台置物架白色花盆架木制书架层架鞋架收纳架储物架落地室内简约韩式田园,家具>阳台/户外>花架/装饰架>岩轩>小三层实木质花架子客厅阳台置物架白色花盆...,京东商城,岩轩家具旗舰店
1019006033,家居家装|家具|花架,型爵xingjue 插花壁挂 花架 XJ22065 古铜 均码,家居家装>家装软饰>工艺摆件>型爵xingjue 插花壁挂 花架 XJ...,京东商城,淘点家居专营店
1019006033,家居家装|家具|花架,型爵xingjue 铁艺 田园花架 XJ6035 古铜 均码,家居家装>家装软饰>工艺摆件>型爵xingjue 铁艺 田园花架 XJ...,京东商城,淘点家居专营店
1019006033,家居家装|家具|花架,型爵xingjue 铁艺 精致落地花架 XJD6077,家居家装>家装软饰>工艺摆件>型爵xingjue 铁艺 精致落地花架 ...,京东商城,淘点家居专营店
1019006033,家居家装|家具|花架,玲珑帝DIY实木黑白大三层75书架/花架/层架/置物架,家具>书房家具>书柜/书架>玲珑帝>玲珑帝DIY实木黑白大三层75书架/花架...,京东商城,玲珑帝旗舰店
1019006033,家居家装|家具|花架,果漫（Goomer）欧式铁艺花架 落地错层 梯形花架子（不含花） 白色,家具>阳台/户外>花架/装饰架>果漫（Goomer）>果漫（Goomer）欧式铁艺花架 落地错...,京东商城,果漫家居旗舰店
1019006033,家居家装|家具|花架,夏老根 鸡翅木花架 落地花架 实木花架 家居摆设 奇石底座 盆景架 3044,家居装修/类别/园艺、花束、庭院/园艺设施/花盆、花架、育苗盘,亚马逊(卓越网),夏老根
1019006033,家居家装|家具|花架,Saide花盆花架铁艺三层花架子花盆架 026610 白色,家装建材>装饰材料>园艺休闲>Saide花盆花架铁艺三层花架子花盆架 ...,京东商城,saide旗舰店
1019006033,家居家装|家具|花架,欧施洛 现货闪电发货 花架 欧式花架 实木花架 复古简约 田园花架,家具>阳台/户外>花架/装饰架>欧施洛家具>欧施洛 现货闪电发货 花架 欧式花架 实...,京东商城,欧施洛家具旗舰店
1019006033,家居家装|家具|花架,果漫（Goomer）后现代铁艺花架花几 盆栽架子 多层错层花架 黑红金,家具>阳台/户外>花架/装饰架>果漫（Goomer）>果漫（Goomer）后现代铁艺花架花几 ...,京东商城,果漫家居旗舰店
1019006033,家居家装|家具|花架,Saide落地式铁艺花架 客厅墙角车型艺术四层阳台花盆架子 飘窗盆栽花架025673 白色,家装建材>装饰材料>园艺休闲>Saide>Saide落地式铁艺花架 客厅墙角车型艺...,京东商城,saide旗舰店
1019006033,家居家装|家具|花架,夏降到底 开心农场 阳台种菜立体花架三层双联种植箱套装【京东联盟会】京东唯一认证组织,家装建材>装饰材料>园艺休闲>夏降到底 开心农场 阳台种菜立体花架三...,京东商城,开心农场
1019006033,家居家装|家具|花架,家逸三层折叠花架置物架储物架收纳架鞋架书架实木木质木制宜家室内室外户外阳台田园 白架兰板015,家具>阳台/户外>花架/装饰架>家逸>家逸三层折叠花架置物架储物架收纳架鞋架书...,京东商城,家逸家居
1019006033,家居家装|家具|花架,宜哉 壁挂花架 单格架 实木方形放书格架【DY1.1*1】 25CM深,家具>书房家具>书柜/书架>宜哉>宜哉 壁挂花架 单格架 实木方形放书格架...,京东商城,宜哉家具
1019006033,家居家装|家具|花架,Saide欧式家居 铁艺花架 花盆架 脸盆架方形24272 褐色 小,家装建材>装饰材料>园艺休闲>Saide>Saide欧式家居 铁艺花架 花盆架 脸...,京东商城,saide旗舰店
1019006033,家居家装|家具|花架,家装节楠竹置物架书架花架多功能组合架 四层,家具>储物家具>层架/置物架>WENTIER>家装节楠竹置物架书架花架多功能组合架 四...,京东商城,韩风时尚家居馆
1019006033,家居家装|家具|花架,果漫（Goomer）欧式铁艺花架 矮个花盆架子（不含花） 黑色,家具>阳台/户外>花架/装饰架>果漫（Goomer）>果漫（Goomer）欧式铁艺花架 矮个花...,京东商城,果漫家居旗舰店
1019006033,家居家装|家具|花架,新房子 2013新上市 欧式铁艺花架 室内 落地式 两层花架6002 古铜,家具>阳台/户外>花架/装饰架>imuse>新房子 2013新上市 欧式铁艺花架 室...,京东商城,新房子旗舰店
1019006033,家居家装|家具|花架,新房子 新款 铁艺 阳台 落地式 花盆架 客厅 花架6014 白色,家具>阳台/户外>花架/装饰架>新房子 新款 铁艺 阳台 落地式 花盆架...,京东商城,新房子旗舰店
1019006033,家居家装|家具|花架,田园风格 铁艺花架子 花盆架阳台客厅置物架 多层花架 特价时尚 白色,家具>阳台/户外>花架/装饰架>田园风格 铁艺花架子 花盆架阳台客厅置物...,京东商城,新房子旗舰店
1019006033,家居家装|家具|花架,田园风格 铁艺花架子 花盆架阳台客厅置物架 多层花架 特价时尚,家具>阳台/户外>花架/装饰架>imuse>田园风格 铁艺花架子 花盆架阳台客厅置物...,京东商城,新房子旗舰店
1019006033,家居家装|家具|花架,艺柳园三层折叠花架置物架储物架收纳架鞋架书架实木木质木制宜家室内室外户外阳台田园 白架彩板017,家居家装>生活日用>收纳用品>艺柳园三层折叠花架置物架储物架收纳架鞋架...,京东商城,艺柳园
1019006033,家居家装|家具|花架,创意家巴洛克转角雕花置物架鞋架花架卧室卫浴转角架 巴洛克7层,创意家巴洛克转角雕花置物架鞋架花架卧室卫...,京东商城,百露旗舰店
1019006033,家居家装|家具|花架,楼龙 欧式铁艺花架 花车 花篮 田园风 AJH130,所有分类>家居家纺、锅具餐具>装饰/日用>摆挂件>楼龙>楼龙 欧式铁艺花架 ...,1号店,楼龙
