1019006011,家居家装|家具|斗柜,玛莎简约家具五斗柜三斗柜四斗柜抽屉柜储藏柜 薰衣草 五斗柜,家具>卧室家具>斗柜>MAXACASA玛莎>玛莎简约家具五斗柜三斗柜四斗柜抽屉柜储藏...,京东商城,玛莎家具
1019006011,家居家装|家具|斗柜,七彩人生儿童家具新款 雅度系列斗柜 板木结合 浅香槟色 五斗柜,七彩人生儿童家具新款 雅度系列斗柜 板木...,京东商城,七彩人生旗舰店
1019006011,家居家装|家具|斗柜,红包马上领 FABIO Q家居 斗柜 抽屉柜 置物柜 四斗柜五斗柜六斗柜 白色 五斗柜,家具>卧室家具>斗柜>法比奥（FABIOQ）>红包马上领 FABIO Q家居 斗柜 抽...,京东商城,FABIO Q家居旗舰店
1019006011,家居家装|家具|斗柜,酷漫居 迪士尼 3D系列 高档家具 五斗柜 家具品牌 儿童家具 米妮欢乐时光 五斗柜,家具>卧室家具>斗柜>酷漫居 迪士尼 3D系列 高档家具 五斗...,京东商城,酷漫居旗舰店
1019006011,家居家装|家具|斗柜,酷漫居 迪士尼儿童家具 米奇系列三斗柜 收纳柜 储物柜 米奇车世界 五斗柜,家具>卧室家具>斗柜>迪士尼（Disney）>酷漫居 迪士尼儿童家具 米奇系列三斗柜 ...,京东商城,酷漫居旗舰店
1019006011,家居家装|家具|斗柜,韩式田园白色斗柜 五斗柜,家具>斗柜>潘顿>韩式田园白色斗柜 五斗柜,国美电器网上商城,潘顿
1019006011,家居家装|家具|斗柜,时尚美居家具 环保金丝木抽屉储物收纳斗柜五斗柜六斗柜四斗柜收纳柜田园 S1702 金丝木 四斗柜,家具>卧室家具>斗柜>携爱时尚美居（VOGUH）>时尚美居家具 环保金丝木抽屉储物收纳斗柜...,京东商城,携爱时尚美居旗舰店
1019006011,家居家装|家具|斗柜,迪邦三斗柜 卧室家具 韩式田园五斗柜 实木储物收纳柜抽屉柜实木柜包邮 五斗柜,家具>卧室家具>斗柜>迪邦>迪邦三斗柜 卧室家具 韩式田园五斗柜 实...,京东商城,迪邦家具旗舰店
1019006011,家居家装|家具|斗柜,迪士尼 迪士尼麦坤酷车族五斗柜,首页 > 迪士尼Disney家具 > 迪士尼麦坤酷车族五斗柜,唯品会,无
1019006011,家居家装|家具|斗柜,雅居格 美式风格 五斗柜,首页 > 雅居格家具专场 > 美式风格 五斗柜,唯品会,无
1019006011,家居家装|家具|斗柜,名象 带镜格子储物多功能五斗柜,首页 > 名象家具 > 带镜格子储物多功能五斗柜,唯品会,无
1019006011,家居家装|家具|斗柜,歌珥 五斗柜 带抽屉 储物柜 大容量 钢琴烤漆 斗柜 YA395-5dou 5斗柜,家具>客厅家具>边桌/茶几>歌珥（GORL）>歌珥 五斗柜 带抽屉 储物柜 大容量 钢...,京东商城,歌珥旗舰店
1019006011,家居家装|家具|斗柜,中格家具 田园简约实木抽屉式储物柜三斗柜四斗柜五斗柜家具K5803 四斗柜,家具>卧室家具>斗柜> 中格家具（Zhonge）>中格家具 田园简约实木抽屉式储物柜三斗柜...,京东商城,中格家具旗舰店
1019006011,家居家装|家具|斗柜,派森家具 水曲柳实木美式乡村简约卧室斗柜五斗橱储物抽屉柜RLS-DG005 原木色 五斗柜,家具>卧室家具>斗柜>派森（Passion）>派森家具 水曲柳实木美式乡村简约卧室斗柜...,京东商城,派森家具旗舰店
1019006011,家居家装|家具|斗柜,索格家具 法式斗柜 五斗柜 四斗柜 三斗柜 斗柜组合 雕花描银 高档 卧室斗橱 五斗柜,家具>卧室家具>斗柜>索格>索格家具 法式斗柜 五斗柜 四斗柜 三斗...,京东商城,索格家具旗舰店
1019006011,家居家装|家具|斗柜,洛丽莎 法式五斗柜 简约斗柜 抽屉柜 储物柜 珍珠白斗柜 实木斗柜,家具>卧室家具>斗柜> 洛丽莎>洛丽莎 法式五斗柜 简约斗柜 抽屉柜 储...,京东商城,洛丽莎家居旗舰店
1019006011,家居家装|家具|斗柜,索格家具 榆木卧室系列 榆木实木斗柜 实用储物柜 卧室斗柜 三斗柜 四斗柜 五斗柜 斗橱 三斗柜,家具>卧室家具>斗柜>索格>索格家具 榆木卧室系列 榆木实木斗柜 实...,京东商城,索格家具旗舰店
1019006011,家居家装|家具|斗柜,青岛一木02四五六斗柜储物柜杂物收纳柜纯实木抽屉柜榉木家具包邮 五斗柜,首页>家居/家装建材/厨具>家具>卧室家具>青岛一木02四五六斗柜储物柜杂物收纳...,苏宁,青岛一木
1019006011,家居家装|家具|斗柜,御品工匠 实木四斗五斗六斗柜收纳柜组合柜 实木家具储物柜03 五斗柜,首页>家居/家装建材/厨具>家具>卧室家具>御品工匠实木四斗五斗六斗柜收纳柜组...,苏宁,御品工匠
1019006011,家居家装|家具|斗柜,522 酷漫居 迪士尼 米奇快乐家族 高档家具 五斗柜 家具品牌 儿童家具 爱洛粉红 五斗柜,家具>卧室家具>斗柜>522 酷漫居 迪士尼 米奇快乐家族 高...,京东商城,酷漫居旗舰店
1019006011,家居家装|家具|斗柜,红包马上领 FABIO Q家居 斗柜 抽屉柜 置物柜 四斗柜五斗柜六斗柜 白色 四斗柜,家具>卧室家具>斗柜>法比奥（FABIOQ）>红包马上领 FABIO Q家居 斗柜 抽...,京东商城,FABIO Q家居旗舰店
1019006011,家居家装|家具|斗柜,酷漫居 迪士尼 3D系列 高档家具 五斗柜 家具品牌 儿童家具 米奇开心家族 五斗柜,家具>卧室家具>斗柜>酷漫居 迪士尼 3D系列 高档家具 五斗...,京东商城,酷漫居旗舰店
1019006011,家居家装|家具|斗柜,酷漫居 迪士尼儿童家具 米奇系列三斗柜 收纳柜 储物柜 米奇野餐派 五斗柜,家具>卧室家具>斗柜>迪士尼（Disney）>酷漫居 迪士尼儿童家具 米奇系列三斗柜 ...,京东商城,酷漫居旗舰店
1019006011,家居家装|家具|斗柜,酷漫居 迪士尼儿童家具 米妮系列斗柜 收纳柜 储物柜 米妮爱美丽 五斗柜,家具>卧室家具>斗柜>酷漫居 >酷漫居 迪士尼儿童家具 米妮系列斗柜 收...,京东商城,酷漫居旗舰店
1019006011,家居家装|家具|斗柜,青岛一木家具 青韵QY02四五六斗柜 原木色榉木储物柜杂物收纳柜纯实木抽屉柜 四斗柜 四斗柜,家具>卧室家具>斗柜>青岛一木>青岛一木家具 青韵QY02四五六斗柜 原...,京东商城,青岛一木家居旗舰店
1019006011,家居家装|家具|斗柜,帝菲雅家具 储物归纳五斗柜特价 欧式家具白色斗柜,家具>卧室家具>斗柜>帝菲雅>帝菲雅家具 储物归纳五斗柜特价 欧式家具...,京东商城,玖木九美旗舰店
1019006011,家居家装|家具|斗柜,风哥华家具 Y1 五斗柜 四斗柜 欧式实木 储物斗柜 装饰柜 0823 800*450*1200mm 五斗柜,家具>卧室家具>斗柜> 风哥华>风哥华家具 Y1 五斗柜 四斗柜 欧式实...,京东商城,风哥华家居旗舰店
1019006011,家居家装|家具|斗柜,索格家具 欧式描金家具 实木五斗柜 储物柜 复古家具 五斗橱 高档储物柜 雕花斗柜8802 五斗柜,家具>卧室家具>斗柜>索格>索格家具 欧式描金家具 实木五斗柜 储物...,京东商城,索格家具旗舰店
1019006011,家居家装|家具|斗柜,德家 韩式家具田园1 六斗柜 斗橱 实木 储物柜 抽屉柜 柜类 五斗柜,家具>卧室家具>斗柜> 德家>德家 韩式家具田园1 六斗柜 斗橱 实木...,京东商城,德家旗舰店
1019006011,家居家装|家具|斗柜,杰特森斗柜实木斗柜四斗柜五斗柜六斗柜 四斗柜,家具>卧室家具>斗柜> 杰特森（JTS）>杰特森斗柜实木斗柜四斗柜五斗柜六斗柜 四...,京东商城,杰特森家居旗舰店
1019006011,家居家装|家具|斗柜,豪司罗尔实木斗柜 三斗柜 四斗柜 五斗柜 实木家具 储物柜 镜子 五斗柜,家具>卧室家具>斗柜> 豪司罗尔>豪司罗尔实木斗柜 三斗柜 四斗柜 五斗柜...,京东商城,豪司罗尔官方旗舰店
1019006011,家居家装|家具|斗柜,越百亿YUEBAIYI五斗柜 实木五斗橱简约现代 田园抽屉柜 储物柜JTB-斗柜 三斗柜,越百亿YUEBAIYI五斗柜 实木五斗橱...,京东商城,越百亿旗舰店
1019006011,家居家装|家具|斗柜,红包马上领 FABIO Q家居 斗柜 抽屉柜 置物柜 四斗柜五斗柜六斗柜 卡其色 六斗柜,家具>卧室家具>斗柜>法比奥（FABIOQ）>红包马上领 FABIO Q家居 斗柜 抽...,京东商城,FABIO Q家居旗舰店
1019006011,家居家装|家具|斗柜,酷漫居 迪士尼儿童家具 米妮系列斗柜 收纳柜 储物柜 米妮大明星 五斗柜,家具>卧室家具>斗柜>酷漫居 >酷漫居 迪士尼儿童家具 米妮系列斗柜 收...,京东商城,酷漫居旗舰店
1019006011,家居家装|家具|斗柜,迪士尼 美式米奇四斗柜,首页 > 迪士尼Disney家具 > 美式米奇四斗柜,唯品会,无
1019006011,家居家装|家具|斗柜,迪士尼 酷漫居儿童家具 柜子斗柜 储物柜 3D系列五斗柜,家具 > 卧室家具 > 斗柜 > 商品详情,当当网,Disney迪士尼
1019006011,家居家装|家具|斗柜,欧凡蒂(OUFANDI)现代简约斗柜,家具>卧室家具>斗柜>欧凡蒂>欧凡蒂(OUFANDI)现代简约斗柜,京东商城,欧凡蒂家具旗舰店
1019006011,家居家装|家具|斗柜,迪士尼 酷漫居儿童家具 睡美人玫瑰色人生斗柜 储物柜 五斗柜 五斗柜,家具>卧室家具>斗柜>迪士尼（Disney）>迪士尼 酷漫居儿童家具 睡美人玫瑰色人生...,京东商城,酷漫居旗舰店
1019006011,家居家装|家具|斗柜,迪士尼 美式米奇五斗柜,首页 > 迪士尼Disney家具 > 美式米奇五斗柜,唯品会,无
1019006011,家居家装|家具|斗柜,迪士尼 迪士尼白雪公主幸福之约五斗柜,首页 > 迪士尼Disney家具 > 迪士尼白雪公主幸福之约五斗柜,唯品会,无
1019006011,家居家装|家具|斗柜,时尚美居 田园风收纳储物五斗柜,首页 > 时尚美居VOGUH家具 > 田园风收纳储物五斗柜,唯品会,无
1019006011,家居家装|家具|斗柜,里外 乌金木色实木斗柜 储物柜 现代中式乌金木色斗柜 8251 中式实木家具 四斗柜,家具>卧室家具>斗柜>里外（LIWAI） >里外 乌金木色实木斗柜 储物柜 现代中式...,京东商城,里外官方旗舰店
1019006011,家居家装|家具|斗柜,全实木斗柜 松木斗柜 五斗柜 六斗柜 七斗柜 卧室储物柜 储藏柜 斗柜组合 五斗柜,家具>卧室家具>斗柜>索格>全实木斗柜 松木斗柜 五斗柜 六斗柜 ...,京东商城,索格家具旗舰店
1019006011,家居家装|家具|斗柜,美莲娜家具 美式韩式田园五斗柜 六斗柜 储物柜 实木储物柜 收纳柜 现货特价包物流 五斗柜,家具>卧室家具>斗柜> 美莲娜>美莲娜家具 美式韩式田园五斗柜 六斗柜 ...,京东商城,美莲娜家具旗舰店
1019006011,家居家装|家具|斗柜,罗凯芬尼 法式欧式斗柜 新古典三四五五斗柜 奢华时尚斗柜 931OS 三斗柜,家具>卧室家具>斗柜>罗凯芬尼>罗凯芬尼 法式欧式斗柜 新古典三四五五斗...,京东商城,罗凯芬尼家具旗舰店
1019006011,家居家装|家具|斗柜,多喜爱 儿童家具 芭比仙子四斗柜 储物柜 儿童斗柜,家具>卧室家具>斗柜> 多喜爱家具（AOK）>多喜爱 儿童家具 芭比仙子四斗柜 储物柜...,京东商城,多喜爱家具旗舰店
1019006011,家居家装|家具|斗柜,卡斯腾板式873斗柜 组合斗柜 储物柜 三斗柜 四斗柜 五斗柜 包邮 三斗柜,家具>储物家具>储物/收纳用品> 卡斯腾>卡斯腾板式873斗柜 组合斗柜 储物柜 ...,京东商城,卡斯腾旗舰店
1019006011,家居家装|家具|斗柜,御品工匠 实木卧室家具 实木斗柜 三斗四斗五斗柜 收纳储物柜988 三斗柜,首页>家居/家装建材/厨具>家具>卧室家具>御品工匠实木卧室家具实木斗柜三...,苏宁,御品工匠
1019006011,家居家装|家具|斗柜,御品工匠 实木三斗四斗五斗柜收纳柜组合柜 实木家具储物柜K1105 三斗柜,首页>家居/家装建材/厨具>家具>卧室家具>御品工匠实木三斗四斗五斗柜收纳柜组...,苏宁,御品工匠
1019006011,家居家装|家具|斗柜,红包马上领 FABIO Q家居 斗柜 抽屉柜 置物柜 四斗柜五斗柜六斗柜 卡其色 五斗柜,家具>卧室家具>斗柜>法比奥（FABIOQ）>红包马上领 FABIO Q家居 斗柜 抽...,京东商城,FABIO Q家居旗舰店
1019006011,家居家装|家具|斗柜,酷漫居 迪士尼儿童家具 米妮系列斗柜 收纳柜 储物柜 米妮绚烂彩虹桥 五斗柜,家具>卧室家具>斗柜>酷漫居 >酷漫居 迪士尼儿童家具 米妮系列斗柜 收...,京东商城,酷漫居旗舰店
1019006011,家居家装|家具|斗柜,风哥华 欧式家具 斗柜 法式 四斗柜 五斗柜 简约 实木斗柜 9822 象牙白 五斗柜,家具>卧室家具>斗柜>风哥华>风哥华 欧式家具 斗柜 法式 四斗柜 五...,京东商城,风哥华家居旗舰店
1019006011,家居家装|家具|斗柜,风哥华家具 G8 斗柜 法式 欧式五斗柜 抽屉柜 储物柜特价 001斗柜 775*460*1160mm 五斗柜,家具>卧室家具>斗柜>风哥华>风哥华家具 G8 斗柜 法式 欧式五斗柜...,京东商城,风哥华家居旗舰店
1019006011,家居家装|家具|斗柜,风哥华 家居三斗四斗五斗柜多抽屉收纳储物实木五斗储物柜FH111 象牙白 四斗柜,家具>卧室家具>斗柜>风哥华>风哥华 家居三斗四斗五斗柜多抽屉收纳储物...,京东商城,风哥华家居旗舰店
1019006011,家居家装|家具|斗柜,迪士尼 长发公主魔堡奇缘五斗柜,首页 > 迪士尼Disney家具 > 长发公主魔堡奇缘五斗柜,唯品会,无
1019006011,家居家装|家具|斗柜,法香榭韩式白色田园风格现代简约实木五斗柜六斗柜 市区物流点自提 六斗柜,家具>卧室家具>斗柜>法香榭>法香榭韩式白色田园风格现代简约实木五斗柜...,京东商城,法香榭家居旗舰店
1019006011,家居家装|家具|斗柜,光明家具 高端新品 新古典红橡木抽屉柜 五斗柜多抽屉 收纳柜 储物柜 五斗橱 47125抽屉柜 五斗柜 五斗柜,家具>卧室家具>斗柜>光明家具（guangmingjiaju）>光明家具 高端新品 新古典红橡木抽屉柜 ...,京东商城,光明家具旗舰店
1019006011,家居家装|家具|斗柜,Sweetnight韩式田园现代简约五斗柜/六斗柜 实木抽屉柜 储物柜 卧室家具 白色特价 韩式 五斗柜,家具>卧室家具>斗柜> Sweetnight>Sweetnight韩式田园现代简约五斗...,京东商城,Sweetnight家居旗舰店
1019006011,家居家装|家具|斗柜,优以品 卧室斗柜五斗柜收纳储物柜 黑橡+白色 全套斗柜,家具>卧室家具>斗柜> 优以品>优以品 卧室斗柜五斗柜收纳储物柜 黑橡+...,京东商城,优以品家具旗舰店
1019006011,家居家装|家具|斗柜,蒙地亚 MX2实木三斗柜四斗柜五斗柜抽屉柜 欧式客厅家具 象牙白斗柜 五斗柜,家具>卧室家具>斗柜> 蒙地亚>蒙地亚 MX2实木三斗柜四斗柜五斗柜抽屉...,京东商城,蒙地亚家具旗舰店
1019006011,家居家装|家具|斗柜,尚族美居 现代五斗柜/四斗柜/三斗柜/二斗简约白色斗橱欧式田园宜家 烤漆 五斗柜,家具>卧室家具>斗柜> 尚族美居>尚族美居 现代五斗柜/四斗柜/三斗柜/二...,京东商城,尚族美居官方旗舰店
1019006011,家居家装|家具|斗柜,玛莎简约家具五斗柜三斗柜四斗柜抽屉柜储藏柜 薰衣草 四斗柜,家具>卧室家具>斗柜>MAXACASA玛莎>玛莎简约家具五斗柜三斗柜四斗柜抽屉柜储藏...,京东商城,玛莎家具
1019006011,家居家装|家具|斗柜,新干线儿童卧室家具田园白色三斗柜四斗柜五斗柜床头收纳柜储物柜 三斗柜,家具>卧室家具>斗柜>新干线儿童卧室家具田园白色三斗柜四斗柜五...,京东商城,新干线家具
1019006011,家居家装|家具|斗柜,欧意丽都欧式实木斗柜 五斗柜 四斗柜 三斗柜 特价储物柜 欧式斗柜 五斗柜 五斗柜,家具>卧室家具>斗柜>欧意丽都欧式实木斗柜 五斗柜 四斗柜 三...,京东商城,欧意家居旗舰店
1019006011,家居家装|家具|斗柜,红包马上领 FABIO Q家居 斗柜 抽屉柜 置物柜 四斗柜五斗柜六斗柜 卡其色 四斗柜,家具>卧室家具>斗柜>法比奥（FABIOQ）>红包马上领 FABIO Q家居 斗柜 抽...,京东商城,FABIO Q家居旗舰店
1019006011,家居家装|家具|斗柜,迪士尼 美式米奇五斗柜,首页 > 迪士尼Disney家具 > 美式米奇五斗柜,唯品会,无
1019006011,家居家装|家具|斗柜,绿欣轩 简约实用斗柜3002 中式简约现代藤编实木五斗柜 藤木斗柜,所有分类>家居家纺、锅具餐具>家具家装>柜类>其他柜类>绿欣轩>绿欣轩 简约实用斗柜...,1号店,绿欣轩
1019006011,家居家装|家具|斗柜,风哥华GA8 欧式 田园 斗柜 时尚五斗柜 储物柜 抽屉柜 特价 包邮 901斗柜 800*450*1075mm 五斗柜,家具>卧室家具>斗柜>风哥华>风哥华GA8 欧式 田园 斗柜 时尚五斗...,京东商城,风哥华家居旗舰店
1019006011,家居家装|家具|斗柜,信爱家屋 实木四五六七斗柜白色 储物柜松木斗柜 五斗抽屉柜现代简约收纳柜收纳柜木质0505 清漆 五斗柜,家具>卧室家具>斗柜>IKAWOOD>信爱家屋 实木四五六七斗柜白色 储物柜松...,京东商城,爱家屋家居旗舰店
1019006011,家居家装|家具|斗柜,迪士尼 米奇开心家族五斗柜,首页 > 迪士尼Disney家具 > 米奇开心家族五斗柜,唯品会,无
1019006011,家居家装|家具|斗柜,小憨豆 五斗柜,首页 > 小憨豆BEAN HOMES家具 > 五斗柜,唯品会,无
1019006011,家居家装|家具|斗柜,南巢家具 高端实木储物柜 老榆木收纳柜 饰品柜 四斗柜 五斗柜 六斗柜 实木柜 5斗柜 6斗柜,家具>卧室家具>斗柜> 南巢>南巢家具 高端实木储物柜 老榆木收纳柜 ...,京东商城,南巢家具旗舰店
1019006011,家居家装|家具|斗柜,仿比邻乡村地中海田园风格实木家具 定制普林斯特美式实木六斗柜,家具>卧室家具>斗柜>斯维特（srity）>仿比邻乡村地中海田园风格实木家具 定制普...,京东商城,斯维特家居旗舰店
1019006011,家居家装|家具|斗柜,御颢金典原木色三四五斗柜 实木斗橱收纳抽屉储物柜家具 2C083 三斗柜,家具>卧室家具>斗柜> 御颢（yuhao）>御颢金典原木色三四五斗柜 实木斗橱收纳抽...,京东商城,御颢旗舰店
1019006011,家居家装|家具|斗柜,御品工匠 实木三斗四斗五斗柜收纳柜组合柜 实木家具储物柜K1105 五斗柜,首页>家居/家装建材/厨具>家具>卧室家具>御品工匠实木三斗四斗五斗柜收纳柜组...,苏宁,御品工匠
1019006011,家居家装|家具|斗柜,欧意丽都抽柜五斗柜 欧式柜实木柜法式家具 雕花彩绘奢华储物柜收纳柜 五斗柜 三斗柜,家具>卧室家具>斗柜>欧意丽都抽柜五斗柜 欧式柜实木柜法式家具...,京东商城,欧意家居旗舰店
1019006011,家居家装|家具|斗柜,迪士尼 迪士尼汽车风暴五斗柜,首页 > 迪士尼Disney家具专场 > 迪士尼汽车风暴五斗柜,唯品会,迪士尼Disney
1019006011,家居家装|家具|斗柜,欧意丽都欧式实木斗柜 五斗柜 四斗柜 三斗柜 特价储物柜 欧式斗柜 四斗柜 四斗柜,家具>卧室家具>斗柜>欧意丽都欧式实木斗柜 五斗柜 四斗柜 三...,京东商城,欧意家居旗舰店
1019006011,家居家装|家具|斗柜,卡梅尔5806五斗柜 欧式实木五斗柜 实木雕花五斗柜 木制五斗柜 5806五斗柜,家具>卧室家具>斗柜>卡梅尔（carmel）>卡梅尔5806五斗柜 欧式实木五斗柜 实...,京东商城,卡梅尔旗舰店
1019006011,家居家装|家具|斗柜,红包马上领 FABIO Q家居 斗柜 抽屉柜 置物柜 四斗柜五斗柜六斗柜 睿智灰 六斗柜,家具>卧室家具>斗柜>法比奥（FABIOQ）>红包马上领 FABIO Q家居 斗柜 抽...,京东商城,FABIO Q家居旗舰店
1019006011,家居家装|家具|斗柜,迪士尼 米奇骑士五斗柜,首页 > .迪士尼Disney家具 > 米奇骑士五斗柜,唯品会,无
1019006011,家居家装|家具|斗柜,早晨家居 卧室家具 实木杂物收纳柜 储物柜 抽屉柜 三斗柜/四斗柜/五斗柜 MF-905 三斗柜,家具>卧室家具>斗柜>早晨家居 卧室家具 实木杂物收纳柜 储物...,京东商城,早晨家居旗舰店
1019006011,家居家装|家具|斗柜,多美居实木松木家具储物柜多格柜五斗柜六斗柜七斗柜实木斗柜 原木色 六斗柜,家具>卧室家具>斗柜>多美居实木松木家具储物柜多格柜五斗柜六斗...,京东商城,绿果家居旗舰店
1019006011,家居家装|家具|斗柜,欧巴美 简约欧式 全实木水曲柳 斗柜 原木色 三斗柜,家具>卧室家具>斗柜>欧巴美（obami）>欧巴美 简约欧式 全实木水曲柳 斗柜 原...,京东商城,欧巴美家具旗舰店
1019006011,家居家装|家具|斗柜,博洛阁 钢琴烤漆斗柜 抽屉柜 小衣柜 五斗柜,家具>卧室家具>斗柜>博洛阁（boluge）>博洛阁 钢琴烤漆斗柜 抽屉柜 小衣柜 五...,京东商城,博洛阁官方旗舰店
1019006011,家居家装|家具|斗柜,森达凯越 CD-6002A实木斗柜 组合斗柜 三四五斗柜 储物柜 卧室家具 5斗柜,家具>卧室家具>斗柜>森达凯越>森达凯越 CD-6002A实木斗柜 组合...,京东商城,森达凯越家居旗舰店
1019006011,家居家装|家具|斗柜,迪士尼 迪士尼维尼驴友族五斗柜,首页 > 迪士尼Disney家具 > 迪士尼维尼驴友族五斗柜,唯品会,无
1019006011,家居家装|家具|斗柜,雅居格 美式实木五斗柜,首页 > 雅居格家具专场 > 美式实木五斗柜,唯品会,无
1019006011,家居家装|家具|斗柜,名象 韩氏田园大储物五斗柜,首页 > 名象家具 > 韩氏田园大储物五斗柜,唯品会,无
1019006011,家居家装|家具|斗柜,迪邦三斗柜 卧室家具 韩式田园五斗柜 实木储物收纳柜抽屉柜实木柜包邮 三斗柜,家具>卧室家具>斗柜>迪邦>迪邦三斗柜 卧室家具 韩式田园五斗柜 实...,京东商城,迪邦家具旗舰店
1019006011,家居家装|家具|斗柜,里外 中式简约实木斗柜 实木抽屉柜 收纳储物柜 板木结合 6803 家居就旗舰店 胡桃色 五斗柜,家具>卧室家具>斗柜> 里外（LIWAI） >里外 中式简约实木斗柜 实木抽屉柜 收纳...,京东商城,家居就建材家居旗舰店
1019006011,家居家装|家具|斗柜,雨林霏家具 板木结合家具 时尚斗柜 家庭必备斗柜 特价！！！B27 板木结合斗柜 3斗柜,家具>卧室家具>斗柜>雨林霏>雨林霏家具 板木结合家具 时尚斗柜 ...,京东商城,雨林霏家具旗舰店
1019006011,家居家装|家具|斗柜,合家家具 欧式田园斗柜 五斗柜 六斗柜 宜家柜 门厅柜 实木斗柜 六斗柜,家具>卧室家具>斗柜> 合家家具>合家家具 欧式田园斗柜 五斗柜 六斗柜 ...,京东商城,合家家具旗舰店
1019006011,家居家装|家具|斗柜,中格 中式简约 实木五斗柜四斗柜三斗柜 储物柜胡桃色卧室斗柜 泰国进口橡木斗柜 6803 五斗柜,家具>储物家具>储物/收纳用品> 中格家具（Zhonge）>中格 中式简约 实木五斗柜四斗柜三斗柜 ...,京东商城,中格家具旗舰店
1019006011,家居家装|家具|斗柜,金海马 欧式奢华斗柜 田园四/五斗柜 简约时尚储物柜 F202 荷花白色 四斗柜,家具>卧室家具>斗柜>金海马（Kinhom）>金海马 欧式奢华斗柜 田园四/五斗柜 简...,京东商城,金海马官方旗舰店
1019006011,家居家装|家具|斗柜,【百意空间】卧室组合抽屉柜 五斗柜 简约风格储物柜 浅胡桃色加白色 800*400*1200五斗柜,家具>卧室家具>斗柜> 百意空间>【百意空间】卧室组合抽屉柜 五斗柜 简约...,京东商城,百意空间家居旗舰店
1019006011,家居家装|家具|斗柜,御品工坊 实木卧室家具实木斗柜三斗四斗五斗柜现代简约收纳柜 05 三斗柜,首页>家居/家装建材/厨具>家具>卧室家具>御品工坊实木卧室家具实木斗柜三斗四...,苏宁,御品工匠
1019006011,家居家装|家具|斗柜,御品工匠 实木卧室家具 实木斗柜 三斗四斗五斗柜 收纳储物柜988 五斗柜,首页>家居/家装建材/厨具>家具>卧室家具>御品工匠实木卧室家具实木斗柜三...,苏宁,御品工匠
1019006011,家居家装|家具|斗柜,欧意丽都抽柜五斗柜 欧式柜实木柜法式家具 雕花彩绘奢华储物柜收纳柜 三斗柜 四斗柜,家具>卧室家具>斗柜>欧意丽都抽柜五斗柜 欧式柜实木柜法式家具...,京东商城,欧意家居旗舰店
1019006011,家居家装|家具|斗柜,美乐乐家具 五斗柜 五斗橱 收纳柜 储物柜 抽屉柜 白色家具 实木家具/HFE 斗柜,家具>卧室家具>斗柜>美乐乐（MEILELE）>美乐乐家具 五斗柜 五斗橱 收纳柜 储物...,京东商城,美乐乐官方旗舰店
1019006011,家居家装|家具|斗柜,迪士尼 维尼春天的故事五斗柜,首页 > 迪士尼Disney家具专场 > 维尼春天的故事五斗柜,唯品会,迪士尼Disney
1019006011,家居家装|家具|斗柜,欧意丽都欧式实木斗柜 五斗柜 四斗柜 三斗柜 特价储物柜 欧式斗柜 三斗柜 三斗柜,家具>卧室家具>斗柜>欧意丽都欧式实木斗柜 五斗柜 四斗柜 三...,京东商城,欧意家居旗舰店
1019006011,家居家装|家具|斗柜,红包马上领 FABIO Q家居 斗柜 抽屉柜 置物柜 四斗柜五斗柜六斗柜 睿智灰 五斗柜,家具>卧室家具>斗柜>法比奥（FABIOQ）>红包马上领 FABIO Q家居 斗柜 抽...,京东商城,FABIO Q家居旗舰店
1019006011,家居家装|家具|斗柜,斯瑞家居 新东南亚 储物柜 斗柜 五斗柜,斯瑞家居 新东南亚 储物柜 斗柜 五斗...,京东商城,斯瑞家居
