1019006017,家居家装|家具|电视柜,【筑巢】 木质 时尚现代简约 阿尔尼电视柜宜家储物视听柜 新黄橡木,家具>客厅家具>电视柜>【筑巢】 木质 时尚现代简约 阿尔尼电视...,京东商城,筑巢菲尼
1019006017,家居家装|家具|电视柜,慧乐家乐其多功能电视柜黑色99851,家具>客厅家具>电视柜> 慧乐家>慧乐家电视柜,京东商城,慧乐家
1019006017,家居家装|家具|电视柜,ZGHS实木三斗电视柜 实木纹理家具 古典家具 储物装饰柜 HS132 红木色,家具>客厅家具>电视柜>ZGHS>ZGHS实木三斗电视柜 实木纹理家具 古...,京东商城,华森家具旗舰店
1019006017,家居家装|家具|电视柜,你好家 简约时尚电视柜/储物柜 DSG-005,你好家 简约时尚电视柜/储物柜 DSG-...,京东商城,你好家-家居
1019006017,家居家装|家具|电视柜,你好家 组合套件 电视柜+格柜（两件套）客厅系列KT18,你好家 组合套件 电视柜+格柜（两件套）...,京东商城,你好家-家居
1019006017,家居家装|家具|电视柜,pithylove 简单爱 JDA-D-7005 DIY时尚简约 现代竹子五层电视柜,家居 > 家具 > 客厅家具 > 电视柜,亚马逊(卓越网),pithylove 简单爱
1019006017,家居家装|家具|电视柜,pithylove 简单爱 JDA-S-D-7004 DIY时尚简约 现代双色实木贴皮三层电视柜（2）,家居 > 家具 > 客厅家具 > 电视柜,亚马逊(卓越网),pithylove 简单爱
1019006017,家居家装|家具|电视柜,越百亿YUEBAIYI欧式电视柜 简约 实木电视柜 组合 田园电视机柜 地柜HXW-995 象牙白 1.6m电视柜,越百亿YUEBAIYI欧式电视柜 简约 ...,京东商城,越百亿旗舰店
1019006017,家居家装|家具|电视柜,2013新款欧式组合柜 欧式柜 电视地柜 欧式法式家具 玫瑰雕花彩绘 奢华 双门组合柜 电视柜,家具>客厅家具>电视柜>2013新款欧式组合柜 欧式柜 电视地柜...,京东商城,欧意家居旗舰店
1019006017,家居家装|家具|电视柜,美朴生活 现代简约电视柜视听柜 咖啡色 XLVCK0010 收纳柜 美式田园风格,家具>客厅家具>电视柜>美朴生活（maple house） >美朴生活 现代简约电视柜视听柜 咖啡色 ...,京东商城,美朴生活家具
1019006017,家居家装|家具|电视柜,2013新款电视柜包邮 欧式韩式象牙白家具 雕刻描银豪华 田园新古典 组合地柜特价 2.4米电视柜 2.4米电视柜,家具>客厅家具>电视柜>2013新款电视柜包邮 欧式韩式象牙白家...,京东商城,欧意家居旗舰店
1019006017,家居家装|家具|电视柜,HDC典藏家 - 手工转角电视柜,HDC典藏家 - 手工转角电视柜,京东商城,HDC典藏家
1019006017,家居家装|家具|电视柜,惠宜家居 伸缩实用电视柜HY-T005,家具>客厅家具>电视柜>惠宜家居 伸缩实用电视柜HY-T005,京东商城,惠宜专营店
1019006017,家居家装|家具|电视柜,ZERUN家具1.5米/1.8米电视柜100%纯实木复古色,家具>客厅家具>电视柜>ZERUN>ZERUN家具1.5米/1.8米电视柜1...,京东商城,ZERUN家具旗舰店
1019006017,家居家装|家具|电视柜,新美时尚板式 1.2米六抽储物柜 电视柜 M347TW,家具>客厅家具>电视柜>新美（SUNMAKE）>新美时尚板式 1.2米六抽储物柜 电视柜...,京东商城,SUNSOHO新的家居
1019006017,家居家装|家具|电视柜,派森家具 简约时尚组合电视柜/地柜 PS-TV005,家具>客厅家具>电视柜>派森家具 简约时尚组合电视柜/地柜 PS...,京东商城,派森家具旗舰店
1019006017,家居家装|家具|电视柜,乐和居 组合式钢化玻璃电视柜 客厅电视柜组合柜 现代 简约地柜 DSG039,家居建材 > 电视柜 > 乐和居 ,国美电器网上商城,
1019006017,家居家装|家具|电视柜,新品 杰高O系列 电视柜 时尚简约 个性化组合型 储物柜 视听柜 不带背架,杰高>新品 杰高O系列 电视柜 时尚简约 个性...,京东商城,杰高家居旗舰店
1019006017,家居家装|家具|电视柜,理佳木业简约玻璃双门电视柜TV-XW235,家用/类别/家居/家具/客厅家具/电视柜,亚马逊(卓越网),理佳木业
1019006017,家居家装|家具|电视柜,wocle 沃购家具 电视柜 简约 时尚 现代电视柜 电视柜特价 组合电视柜 DG011 深咖啡色,家用/类别/家居/家具/客厅家具/电视柜,亚马逊(卓越网),沃购家具
1019006017,家居家装|家具|电视柜,新悦 电视柜D6662 电视机柜 地柜组合柜 简约,家具>客厅家具>电视柜>新悦 电视柜D6662 电视机柜 地柜组...,京东商城,新悦家居官方旗舰店
1019006017,家居家装|家具|电视柜,乐和居 时尚简欧镶钻钢化玻璃电视柜 茶几组合客厅储物柜 DSG044,家具建材>电视柜>乐和居>乐和居 时尚简欧镶钻钢化玻璃电视柜 茶几组合客厅储物柜 DSG044,国美电器网上商城,乐和居家居旗舰店
1019006017,家居家装|家具|电视柜,理佳木业实木多功能收纳柜 电视柜 储物柜 TV-W268 (天然桐木材质 纹理通直 刨光后有绢丝光泽 材质轻柔 无味 ,白色, 160*40*50cm),家用/类别/家居/家具/客厅家具/电视柜,亚马逊(卓越网),理佳木业
1019006017,家居家装|家具|电视柜,OGSWEET 欧桂 电视柜烤漆白色简约不锈钢视听柜OG-122,家用/类别/家居/家具/客厅家具/电视柜,亚马逊(卓越网),OGSWEET 欧桂
1019006017,家居家装|家具|电视柜,Lofta 乐富庭 Lativa 拉菲亚电视柜 LF-810601 (深棕木纹配碳黑色),家用/类别/家居/家具/客厅家具/电视柜,亚马逊(卓越网),Lofta 乐富庭
1019006017,家居家装|家具|电视柜,米达尔新款 简约 时尚 现代 胡桃木色 电视柜 地柜x0612 (胡桃木色, 200*45*45cm),家用/类别/家居/家具/客厅家具/电视柜,亚马逊(卓越网),米达尔
1019006017,家居家装|家具|电视柜,周家庄 板式客厅茶几 电视柜 现代简约 时尚创意茶几 新品 983 电视柜+茶几(包物流&物流点提货),家具>客厅家具>边桌/茶几>周家庄>周家庄 板式客厅茶几 电视柜 现代简约 ...,京东商城,周家庄家具旗舰店
1019006017,家居家装|家具|电视柜,新悦 F3181 组合电视柜电视墙柜组合 挂柜 白枫木色 F316-9装饰架,家具>客厅家具>电视柜>新悦 F3181 组合电视柜电视墙柜组...,京东商城,新悦家居官方旗舰店
1019006017,家居家装|家具|电视柜,澳洲杰高卧室 电视柜 白色 简约时尚 小户型电视机柜地柜 白橡木,家具>客厅家具>电视柜>杰高>澳洲杰高卧室 电视柜 白色 简约时尚 小...,京东商城,杰高家居旗舰店
1019006017,家居家装|家具|电视柜,澳洲杰高卧室 电视柜 白色 简约时尚 小户型电视机柜地柜 白色,家具>客厅家具>电视柜>杰高>澳洲杰高卧室 电视柜 白色 简约时尚 小...,京东商城,杰高家居旗舰店
1019006017,家居家装|家具|电视柜,法比奥Q家居 电视柜 宜家时尚电视影视柜带抽屉置物储物功能板式电视柜现代简约 白色 单格+电视座+单格,家具>客厅家具>电视柜>法比奥Q家居 电视柜 宜家时尚电视影视柜...,京东商城,FABIO Q家居旗舰店
1019006017,家居家装|家具|电视柜,艾斯 简约特价黑色木皮大气百搭款钢化玻璃TV005电视柜 A款,家具>客厅家具>电视柜>艾利格>艾斯 简约特价黑色木皮大气百搭款钢化玻璃...,京东商城,艾斯家居旗舰店
1019006017,家居家装|家具|电视柜,派森家具 多功能储物柜简约电视柜 地柜 长柜TV001 厅柜实木包边环保无气味,家具>客厅家具>电视柜>派森（Passion）>派森家具 多功能储物柜简约电视柜 地柜 ...,京东商城,派森家具旗舰店
1019006017,家居家装|家具|电视柜
,2012新款电视柜 欧式实木家具 雕刻描银豪华 田园公主新古典,2012新款电视柜 欧式实木家具 雕刻描...,京东商城,欧意家居旗舰店
1019006017,家居家装|家具|电视柜,新悦 D5683 组合式电视柜 檀木色 檀木色 D6663电视柜,家具>客厅家具>电视柜>新悦>新悦 D5683 组合式电视柜 檀木色 ...,京东商城,新悦家居官方旗舰店
1019006017,家居家装|家具|电视柜,千品雅美式田园电视柜白色烤漆客厅象牙白茶几地柜地中海电视柜欧式组合置物柜 组合酒 右两门酒柜+组合厅柜,家具>餐厅家具>酒柜>千品雅美式田园电视柜白色烤漆客厅象牙白茶...,京东商城,千品雅家具旗舰店
1019006017,家居家装|家具|电视柜,尚宅好E家 电视柜 2013新款现代简约时尚高亮光钢琴烤漆钢化玻璃地柜 电视机柜电视柜组合,家具>客厅家具>电视柜>尚宅好E家>尚宅好E家 电视柜 2013新款现代简约...,京东商城,尚宅好e家旗舰店
1019006017,家居家装|家具|电视柜,择木宜居 液晶电视柜组合地柜储物柜 黑胡桃木色 900*430*340mm规格,家具>客厅家具>电视柜>择木宜居 液晶电视柜组合地柜储物柜 黑胡...,京东商城,择木宜居
1019006017,家居家装|家具|电视柜,马氏皇庭 简约现代可伸缩电视柜 黑白色钢琴烤漆宜家地柜组合 108 黑色 B款五抽屉,家具>客厅家具>电视柜>马氏皇庭>马氏皇庭 简约现代可伸缩电视柜 黑白色钢...,京东商城,马氏皇庭家具旗舰店
1019006017,家居家装|家具|电视柜,新悦 组合电视柜 电视墙 电视墙柜 F3185电视机柜地柜矮柜壁挂柜 白枫木色 F316-5装饰柜,新悦 组合电视柜 电视墙 电视墙柜 F3...,京东商城,新悦家居官方旗舰店
1019006017,家居家装|家具|电视柜,新悦 D5686组合式电视柜 檀木色 檀木色 D666-01单玻璃门柜,家具>客厅家具>电视柜>新悦>新悦 D5686组合式电视柜 檀木色 檀...,京东商城,新悦家居官方旗舰店
1019006017,家居家装|家具|电视柜,【派林隆】现代简约可伸缩黑白色电视柜HY176,家具>客厅家具>电视柜>【派林隆】现代简约可伸缩黑白色电视柜HY...,京东商城,派林隆家私旗舰店
1019006017,家居家装|家具|电视柜,森岳家具 1.2米电视柜地柜 北欧田园100%纯实木白橡木 仿古色第一代 1123,家具>客厅家具>电视柜>森岳>森岳家具 1.2米电视柜地柜 北欧田园1...,京东商城,润发家具旗舰店
1019006017,家居家装|家具|电视柜,尼克爱家 电视柜 实木饰面电视柜 烤漆电视柜 电视机柜 浪漫满屋 红色烤漆,家具>客厅家具>电视柜>尼克爱家 电视柜 实木饰面电视柜 烤漆电...,京东商城,尼克爱家家居商城
1019006017,家居家装|家具|电视柜,百意空间白色烤漆电视柜镂空电视柜水立方电视柜视听柜玻璃电视柜LK1800 白色,家具>客厅家具>电视柜>百意空间白色烤漆电视柜镂空电视柜水立方电...,京东商城,百意空间家居旗舰店
1019006017,家居家装|家具|电视柜,丽湾家具 大理石电视柜 现代简约客厅储物地柜式电视柜 特价！D003,家具>客厅家具>电视柜>丽湾>丽湾家具 大理石电视柜 现代简约客厅储物...,京东商城,丽湾家具旗舰店
1019006017,家居家装|家具|电视柜,宜朗 现代简单电视柜 地柜 黑色天然橡木纹 伸缩电视柜,家具>客厅家具>电视柜>宜朗 现代简单电视柜 地柜 黑色天然橡木...,京东商城,宜朗家居旗舰店
1019006017,家居家装|家具|电视柜,红木家具/实木电视柜/红木电视柜置物架/中式明清古典家具 JCM086,家具>客厅家具>电视柜>红木家具/实木电视柜/红木电视柜置物架/...,京东商城,博古恒韵家具旗舰店
1019006017,家居家装|家具|电视柜,欧施洛 电视柜 韩式地柜 时尚 田园储藏柜 现代馆 199-240*47*40cm(可伸缩) E1高密度板+烤漆工艺,家具>客厅家具>电视柜>欧施洛 电视柜 韩式地柜 时尚 田园储藏...,京东商城,欧施洛家具
1019006017,家居家装|家具|电视柜,越茂 七彩电视柜 现代简约时尚电视柜 实木收纳电视柜 多功能电视柜,家具>客厅家具>电视柜>越茂>越茂 七彩电视柜 现代简约时尚电视柜 实...,京东商城,越茂家具旗舰店
1019006017,家居家装|家具|电视柜,越茂 HZ-PCTV-W95 现代简约电视机柜 实木桐木电视柜 七彩系类,家具>客厅家具>电视柜>越茂>越茂 HZ-PCTV-W95 现代简约电...,京东商城,越茂家具旗舰店
1019006017,家居家装|家具|电视柜,杰高 简约时尚O系列钢琴烤漆电视柜个性化组合型储物柜视听柜 A350+A353+背架 黑亮色,杰高 简约时尚O系列钢琴烤漆电视柜个性化...,京东商城,杰高家居旗舰店
1019006017,家居家装|家具|电视柜,理佳木业 多抽屉 实木地柜 电视柜 TV—Y222,理佳木业 多抽屉 实木地柜 电视柜 TV...,京东商城,理佳木业旗舰店
1019006017,家居家装|家具|电视柜,新美家具 时尚高雅/可伸缩 电视柜 储物柜 T-767,家具>客厅家具>电视柜>新美家具 时尚高雅/可伸缩 电视柜 储物...,京东商城,SUNSOHO新的家居
1019006017,家居家装|家具|电视柜,杰高 DIY时尚个性组合电视柜A297.A298 木纹 单个A298不带抽屉,家具>客厅家具>电视柜>杰高 DIY时尚个性组合电视柜A297....,京东商城,杰高家居旗舰店
1019006017,家居家装|家具|电视柜,马氏皇庭 白色钢琴烤漆电视柜 简约现代钢化玻璃客厅地柜 电视柜 白色 2000X400X410,家具>客厅家具>电视柜>马氏皇庭>马氏皇庭 白色钢琴烤漆电视柜 简约现代钢...,京东商城,马氏皇庭家具旗舰店
1019006017,家居家装|家具|电视柜,[库米KUMI]时尚现代电视柜 客厅2.4米简约储物电视机柜家具现货1019 黑色钢化玻璃 2400*500*390,家具>客厅家具>电视柜>库米（KUMI）>[库米KUMI]时尚现代电视柜 客厅2....,京东商城,kumi库米旗舰店
1019006017,家居家装|家具|电视柜,乐和居 简约百搭烤漆钢化玻璃客厅电视柜 DSG051 家居就旗舰店,家具>客厅家具>电视柜>SD>乐和居 简约百搭烤漆钢化玻璃客厅电视柜 ...,京东商城,家居就建材家居旗舰店
1019006017,家居家装|家具|电视柜,和购 田园客厅家具 田园地柜 白色 田园电视柜 视听柜地柜 电视机柜 7192 家居就旗舰店 白色,家具>客厅家具>电视柜>和购 >和购 田园客厅家具 田园地柜 白色 田园...,京东商城,家居就建材家居旗舰店
1019006017,家居家装|家具|电视柜,四海家具 卡芬达 欧式法式实木卧室电视柜 客厅矮柜 卧室收纳柜 储藏柜 已开线孔 别墅主卧,家具>客厅家具>电视柜>卡芬达（carpenter）>四海家具 卡芬达 欧式法式实木卧室电视柜...,京东商城,卡芬达家居旗舰店
1019006017,家居家装|家具|电视柜,ZERUN家具1.5米/1.8米电视柜100%纯实木复古色 2.2米,家具>客厅家具>电视柜>ZERUN>ZERUN家具1.5米/1.8米电视柜1...,京东商城,ZERUN家具旗舰店
1019006017,家居家装|家具|电视柜,福立方 复古带储物柜 置物柜 整体电视柜/视听柜组合机顶盒架 深色胡桃木色柜子TV4229,家具>客厅家具>电视柜>福立方 复古带储物柜 置物柜 整体电视柜...,京东商城,福立方旗舰店
1019006017,家居家装|家具|电视柜,YOUJIA 现代时尚电视柜简约电视机柜A+C/B+C组合 白枫色 规格A,家具>客厅家具>电视柜>悠佳>YOUJIA 现代时尚电视柜简约电视机柜...,京东商城,悠佳家居旗舰店
1019006017,家居家装|家具|电视柜,和购 水曲柳客厅家具 水曲柳家具 欧式电视柜 实木地柜 机顶柜 视听柜 7105R 家居就旗舰店,家具>客厅家具>电视柜>和购 >和购 水曲柳客厅家具 水曲柳家具 欧式电...,京东商城,家居就建材家居旗舰店
1019006017,家居家装|家具|电视柜,法比奥FABIO Q家居 电视柜 宜家时尚电视影视柜带抽屉置物储物功能板式电视柜现代简约 睿智灰双格+电视座+单,家具>客厅家具>电视柜>法比奥（FABIOQ）>法比奥FABIO Q家居 电视柜 宜家时...,京东商城,FABIO Q家居旗舰店
1019006017,家居家装|家具|电视柜,锦沃家具 电视柜 地柜 置物柜 储物柜 红色,家具>客厅家具>电视柜>锦沃家具 电视柜 地柜 置物柜 储物柜 ...,京东商城,恒锦家具厂
1019006017,家居家装|家具|电视柜,野橡 实木电视柜组合柜 美式乡村电视柜 时尚玛莲娜 白色 电视柜,家具>客厅家具>电视柜>野橡（yeoak）>野橡 实木电视柜组合柜 美式乡村电视柜 ...,京东商城,野橡旗舰店
1019006017,家居家装|家具|电视柜,法比奥FABIO Q家居 电视柜 宜家时尚电视影视柜带抽屉置物储物功能板式电视柜现代简约 四斗柜,家具>客厅家具>电视柜>法比奥（FABIOQ）>法比奥FABIO Q家居 电视柜 宜家时...,京东商城,FABIO Q家居旗舰店
1019006017,家居家装|家具|电视柜,顾家家居KUKA客厅 烤漆玻璃电视柜PTF1142 黑色 简约时尚,家具>客厅家具>电视柜>顾家家居KUKA客厅 烤漆玻璃电视柜PT...,京东商城,顾家家居专卖店
1019006017,家居家装|家具|电视柜,和购 水曲柳客厅家具 欧式电视柜 视听柜 简约电视柜 长地柜 7108R 家居就旗舰店,家具>客厅家具>电视柜>和购 >和购 水曲柳客厅家具 欧式电视柜 视听柜...,京东商城,家居就建材家居旗舰店
1019006017,家居家装|家具|电视柜,美国DOREL Altra 深咖啡色环保 简约当代 电视柜 矮柜 地柜 视听柜 151*49*54(cm)(组装后尺寸),家居 > 家具 > 客厅家具 > 电视柜,亚马逊(卓越网),Altra
1019006017,家居家装|家具|电视柜,Homestar/好事达 新品电视柜现代简约时尚小户型卧室可移动 1264,所有分类>家居家纺、锅具餐具>家具家装>柜类>电视柜>Homestar/好事达>Homestar/好...,1号店,Homestar/好事达
1019006017,家居家装|家具|电视柜,韩斯 现代时尚简约2013伸缩电视柜组合 烤漆客厅柜 钢化玻璃 地柜 2240,家居家纺、锅具餐具>家具/灯具>其他柜类>电视柜>韩斯,1号店,韩斯
1019006017,家居家装|家具|电视柜,Lenox 简约时尚实木家具 现代简约电视柜茶几套餐组合,家居家纺、锅具餐具>家具/灯具>其他柜类>电视柜>Lenox,1号店,Lenox
1019006017,家居家装|家具|电视柜,梅德比medalist 简约现代电视柜TV862,所有分类>家居家纺、锅具餐具>家具家装>柜类>电视柜>梅德比medalist>梅德比medalis...,1号店,梅德比medalist
1019006017,家居家装|家具|电视柜,Homestar/好事达 实惠电视柜 79*40*42.4 1261 黑橡木 电视柜简约现代 小户型省空间,所有分类>家居家纺、锅具餐具>家具家装>柜类>电视柜>Homestar/好事达>Homestar/好...,1号店,Homestar/好事达
1019006017,家居家装|家具|电视柜,玉格尔 钢化玻璃电视柜储物柜 简约地柜 古韵,所有分类>家居家纺、锅具餐具>家具家装>柜类>电视柜>玉格尔>玉格尔 钢化玻璃电视...,1号店,玉格尔
1019006017,家居家装|家具|电视柜,阿诗兰 现代简约客厅不锈钢钢化玻璃储物液晶电视柜 组合地柜A498 电视柜15mm厚玻璃,家居 > 家具 > 客厅家具 > 电视柜,亚马逊(卓越网),阿诗兰
1019006017,家居家装|家具|电视柜,1Bearkin 小熊第一 白色大理石钢化玻璃新款时尚电视柜地柜TV002 1.8米钢化玻璃带抽屉,家居 > 家具 > 客厅家具 > 电视柜,亚马逊(卓越网),1Bearkin 小熊第一
1019006017,家居家装|家具|电视柜,1Bearkin 小熊第一 大理石电视柜 时尚高档 不锈钢钢化玻璃地柜 TV03 2.0*0.4含抽屉银白龙,家居 > 家具 > 客厅家具 > 电视柜,亚马逊(卓越网),1Bearkin 小熊第一
1019006017,家居家装|家具|电视柜,1Bearkin 小熊第一 不锈钢大理石时尚 地柜电视玻璃电视柜TV12 2.0米*0.4米大理石电视柜,家居 > 家具 > 客厅家具 > 电视柜,亚马逊(卓越网),1Bearkin 小熊第一
1019006017,家居家装|家具|电视柜,1Bearkin 小熊第一 闪电发货 电视柜组合 玻璃大理石 不锈钢地柜 矮柜TV01 1.8*0.4带抽屉爵士白,家居 > 家具 > 客厅家具 > 电视柜,亚马逊(卓越网),1Bearkin 小熊第一
1019006017,家居家装|家具|电视柜,汉龙赤马 田园设计装饰客厅家具视听柜 白色花影六抽电视柜 实木板白色亮光面漆,家居 > 家具 > 客厅家具 > 电视柜,亚马逊(卓越网),汉龙赤马
1019006017,家居家装|家具|电视柜,家乐铭品 马克0.8米电视柜P52 简约,所有分类>家居家纺、锅具餐具>家具家装>柜类>电视柜>家乐铭品>家乐铭品 马克0.8...,1号店,家乐铭品
1019006017,家居家装|家具|电视柜,Homestar/好事达 索特时尚小户型带抽电视柜 1563尺寸104*40*46.4 好事达新品,所有分类>家居家纺、锅具餐具>家具家装>柜类>电视柜>Homestar/好事达>Homestar/好...,1号店,Homestar/好事达
1019006017,家居家装|家具|电视柜,美达斯 双抽伸缩电视柜（白色）,家具类>板式>电视柜>美达斯 双抽伸缩电视柜（白色）,家品会,
1019006017,家居家装|家具|电视柜,奇居良品 法式新古典欧洲进口白榉木家具彩色抽屉电视柜,首页 > 奇居良品Create For Life家具 > 法式新古典欧洲进口白榉木家具彩色抽屉电视柜,唯品会,无
1019006017,家居家装|家具|电视柜,绿欣轩藤艺电视柜7036 中式藤艺落地式客厅电视储物柜,家具 > 客厅家具 > 电视柜 > 商品详情,当当网,绿欣轩
1019006017,家居家装|家具|电视柜,华谊家具 1.8米电视柜 纯实木 XCF10302-2 背投电视柜 实木电视柜 工厂直销,家具 > 客厅家具 > 电视柜 > 商品详情,当当网,华谊
1019006017,家居家装|家具|电视柜,淘营家具 简约钢化玻璃米黄色电视柜B112,家具 > 客厅家具 > 电视柜 > 商品详情,当当网,淘营
1019006017,家居家装|家具|电视柜,一米爱家具 现代简约烤漆电视柜茶几组合时尚储物地柜电视机柜矮柜,家具 > 客厅家具 > 电视柜 > 商品详情,当当网,一米爱
1019006017,家居家装|家具|电视柜,派森家具 简约现代客厅电视柜  地柜  储物柜 泰国进口实木框架电视柜PS-TV001  绿色环保无异味,家具 > 客厅家具 > 电视柜 > 商品详情,当当网,派森
1019006017,家居家装|家具|电视柜,越茂 ADK 原装进口 时尚简约电视柜 电视机玻璃门柜 卧室电视机柜,所有分类>家居家纺、锅具餐具>家具家装>柜类>电视柜>越茂>越茂 ADK 原装进...,1号店,越茂
1019006017,家居家装|家具|电视柜,派璀克 钢化玻璃不锈钢三层电视柜 29寸及以下黑色 P2-007,所有分类>家居家纺、锅具餐具>家具家装>柜类>电视柜>派璀克>派璀克 钢化玻璃不锈...,1号店,派璀克
1019006017,家居家装|家具|电视柜,乐和居 电视柜 组合套装 电视柜简约 免安装 黑色 两抽屉,家具>客厅家具>电视柜>乐和居>乐和居 电视柜 组合套装 电视柜简约 免...,京东商城,乐和居家居旗舰店
1019006017,家居家装|家具|电视柜,新悦 组合式电视柜 K156-B 红橡木色 全套组合,家具>客厅家具>电视柜>新悦>新悦 组合式电视柜 K156-B 红橡木...,京东商城,新悦家居官方旗舰店
1019006017,家居家装|家具|电视柜,艾斯 简约百搭烤漆钢化玻璃客厅电视柜特价烤漆现代TV008电视柜,家具>客厅家具>电视柜>艾利格>艾斯 简约百搭烤漆钢化玻璃客厅电视柜特价...,京东商城,艾斯家居旗舰店
1019006017,家居家装|家具|电视柜,家乐铭品马克1.2米电视柜P51/P52 简约 储物柜自由组合 2-暖白色,家具>客厅家具>电视柜>爱家乐>家乐铭品马克1.2米电视柜P51/P52...,京东商城,爱家乐家居旗舰店
1019006017,家居家装|家具|电视柜,好事达 实惠转角电视柜1260浅橡木,家具>客厅家具>电视柜>好事达>好事达电视柜,京东商城,好事达
1019006017,家居家装|家具|电视柜,福立方 欧式现代电视机柜 黑色客厅电视柜组合家具地柜影视柜,所有分类>家居家纺、锅具餐具>家具家装>柜类>电视柜>福立方>福立方 欧式现代电视...,1号店,福立方
1019006017,家居家装|家具|电视柜,理佳木业白色简约风格客厅电视柜TV-W271,首页>家居/家装建材/厨具>家具>客厅/餐厅家具>理佳木业白色简约风格客厅电视柜TV-...,苏宁,理佳木业
1019006017,家居家装|家具|电视柜,理佳木业 实木多功能电视柜 抽屉柜 地柜TV-223,首页>家居/家装建材/厨具>家具>客厅/餐厅家具>理佳木业实木多功能电视柜抽屉柜...,苏宁,理佳木业
1019006017,家居家装|家具|电视柜,理佳木业白色简约欧式实木电视柜/简易矮柜地柜/客厅柜收纳储物柜 TV—W278 B,首页>家居/家装建材/厨具>家具>客厅/餐厅家具>理佳木业白色简约欧式实木电视柜/简易...,苏宁,理佳木业
1019006017,家居家装|家具|电视柜,[库米KUMI]时尚客厅电视柜现代简约金属镜面不锈钢黑色装饰玻璃TV1009,首页>家居/家装建材/厨具>家具>客厅/餐厅家具>[库米KUMI]时尚客厅电视柜现代简...,苏宁,库米（KUMI）
1019006017,家居家装|家具|电视柜,华夏风 电视柜 中式 带储物 两抽屉 原木色 电视柜 DSG064,首页>家居/家装建材/厨具>家具>客厅/餐厅家具>华夏风电视柜中式带储物两抽屉...,苏宁,华夏风
1019006017,家居家装|家具|电视柜,择木宜居 现代简约小户型电视柜 储物柜 白色 GT12,家具>客厅家具>电视柜>择木宜居>择木宜居 现代简约小户型电视柜 储物柜 ...,京东商城,择木宜居
1019006017,家居家装|家具|电视柜,丽湾/LIWAN 丽湾家具 橡木电视柜 实木客厅组 红色实木电视柜 208 实木电视柜,所有分类>家居家纺、锅具餐具>家具家装>柜类>电视柜>丽湾/LIWAN>丽湾/LIWAN 丽...,1号店,丽湾/LIWAN
