1019004009,家居家装|家装软饰|花瓶、花器,Snnei室内 卡洛儿陶瓷花瓶 欧式客厅桌面摆设插花器 复古做旧花瓶 坎蒂丝,家居家装>家装软饰>工艺摆件>室内（Snnei）>Snnei室内 卡洛儿陶瓷花瓶 欧式客厅...,京东商城,snnei室内家居官方旗舰店
1019004009,家居家装|家装软饰|花瓶、花器,客厅装饰品花插陶土花瓶花器装饰器皿陶艺花器辛蒂瑞拉桃心花瓶 白色高8.5cm,家居家装>家装软饰>花瓶花艺>米子家居>客厅装饰品花插陶土花瓶花器装饰器皿陶艺花...,京东商城,米子家居专营店
1019004009,家居家装|家装软饰|花瓶、花器,【畅宁】水晶玻璃花瓶 25厘米高 8毫米加厚 通透度高 花器 两种瓶身可选,首页>家居/家装建材/厨具>生活日用>装饰用品>【畅宁】水晶玻璃花瓶25厘米高8...,苏宁,畅宁
1019004009,家居家装|家装软饰|花瓶、花器,【畅宁】螺纹花高温瓷花瓶 宜家风 13厘米 陶瓷 花器 2色可选 黑色,家居家装>家装软饰>花瓶花艺>畅宁>【畅宁】螺纹花高温瓷花瓶 宜家风 13厘...,京东商城,畅宁官方旗舰店
1019004009,家居家装|家装软饰|花瓶、花器,景秀缘 景德镇陶瓷 韩式陶瓷花瓶三件套摆件 花器插花 家居装饰品 纯手工 C款,家居家装>家装软饰>装饰摆件>景秀缘（J）>景秀缘 景德镇陶瓷 韩式陶瓷花瓶三件套摆...,京东商城,景秀缘陶瓷旗舰店
1019004009,家居家装|家装软饰|花瓶、花器,Snnei室内 珍妮·梵欧式陶瓷花瓶 家居摆设装饰品 客厅插花器摆件 土红大号,家居家装>家装软饰>花瓶花艺>室内（Snnei）>Snnei室内 珍妮·梵欧式陶瓷花瓶 家...,京东商城,snnei室内家居官方旗舰店
1019004009,家居家装|家装软饰|花瓶、花器,欧式花瓶摆件 田园现代时尚创意客厅陶瓷花器家居装饰 多款可选 大花款不含花,家居家装>家装软饰>花瓶花艺>墨菲>欧式花瓶摆件 田园现代时尚创意客厅陶瓷花...,京东商城,墨菲官方旗舰店
1019004009,家居家装|家装软饰|花瓶、花器,BX米子家居 现代简约透明雕花玻璃花瓶摆件 插花花器 布朗花瓶 椰子CSC524-31,家居家装>家装软饰>花瓶花艺> 米子家居>BX米子家居 现代简约透明雕花玻璃花瓶摆...,京东商城,米子家居专营店
1019004009,家居家装|家装软饰|花瓶、花器,欢畅 景德镇陶瓷 高档手绘骨瓷 绣球花 萝卜小花瓶 插花器客厅摆件 sz-014,家居家装>家装软饰>花瓶花艺> 欢畅>欢畅 景德镇陶瓷 高档手绘骨瓷 绣球花...,京东商城,欢畅旗舰店
1019004009,家居家装|家装软饰|花瓶、花器,欧式马蹄莲波浪口彩色透明玻璃花瓶 水培花器装饰品摆件 黄色,家居家装>家装软饰>花瓶花艺> 欧颂（Ausone）>欧式马蹄莲波浪口彩色透明玻璃花瓶 水培花...,京东商城,欧颂旗舰店
1019004009,家居家装|家装软饰|花瓶、花器,玐玖琦珥欧式螺纹彩琉璃花瓶水培花器摆件大肚玻璃花瓶插花花瓶 HP028 绿色,家居家装>家装软饰>花瓶花艺> 玐玖琦珥>玐玖琦珥欧式螺纹彩琉璃花瓶水培花器摆件大...,京东商城,玐玖琦珥欧式家装旗舰店
1019004009,家居家装|家装软饰|花瓶、花器,古蓝韵 中式裂纹陶瓷花瓶 高档时尚复古花器 花插 赏瓶装饰摆件,家居家装>家装软饰>花瓶花艺> 墨菲>古蓝韵 中式裂纹陶瓷花瓶 高档时尚复古花...,京东商城,墨菲官方旗舰店
1019004009,家居家装|家装软饰|花瓶、花器,万仟堂 插花花瓶 陶瓷花器 国色春天小雅 国色,家居家装>家装软饰>花瓶花艺> 万仟堂（Edenus） >万仟堂 插花花瓶 陶瓷花器 国色春天小雅...,京东商城,万仟堂旗舰店
1019004009,家居家装|家装软饰|花瓶、花器,创意陶瓷花瓶现代时尚工艺品家居装饰品摆件欧式摆设客厅餐桌花器,家居家装>家装软饰>花瓶花艺> 品和>创意陶瓷花瓶现代时尚工艺品家居装饰品摆件...,京东商城,卡冉柏家居专营店
1019004009,家居家装|家装软饰|花瓶、花器,dp+ 时尚简约玻璃花瓶现代花器水培器小蛮腰设计高档客厅摆件 小,家居家装>家装软饰>花瓶花艺> dp+>dp+ 时尚简约玻璃花瓶现代花器水培器小...,京东商城,dp+的旗舰店
1019004009,家居家装|家装软饰|花瓶、花器,意大利RCR 30CM傲柏花瓶 白色透明水晶花樽花器 原装进口 R239940,家居日用>工艺摆件>RCR>意大利RCR 30CM傲柏花瓶 白色透明水晶花樽花器 原装进口 R239940,国美电器网上商城,RCR
1019004009,家居家装|家装软饰|花瓶、花器,意大利RCR 叶纹花瓶 白色透明水晶花樽花器 原装进口,家居日用>工艺摆件>RCR>意大利RCR 叶纹花瓶 白色透明水晶花樽花器 原装进口,国美电器网上商城,RCR
1019004009,家居家装|家装软饰|花瓶、花器,时光屋 手绘装饰花插/花瓶/花器,家居 > 家居装饰 > 花瓶、装饰瓶、花艺 > 花瓶装饰瓶,亚马逊(卓越网),时光屋
1019004009,家居家装|家装软饰|花瓶、花器,美朴生活 水晶环保玻璃花瓶花器 透明 ZVGVL0071,家居家装>生活日用>家装软饰>美朴生活 水晶环保玻璃花瓶花器 透明 Z...,京东商城,美朴生活家具
1019004009,家居家装|家装软饰|花瓶、花器,壹陶坊 田园欧式家居装饰室内桌面用品 花卉绿植花盆花瓶花器 做旧摆设大小对,家用/类别/家居/家居装饰/花瓶、装饰瓶、花艺,亚马逊(卓越网),壹陶坊
1019004009,家居家装|家装软饰|花瓶、花器,mxmade 茗轩 创意橄榄型花瓶 透明玻璃花瓶 悬挂式水培花器 居家工艺品,家用/类别/家居/家居装饰/花瓶、装饰瓶、花艺/仿真绿植,亚马逊(卓越网),mxmade 茗轩
1019004009,家居家装|家装软饰|花瓶、花器,橡树庄园 美式复古陶瓷手绘花瓶 花插 花器,家用/类别/家居/家居装饰/花瓶、装饰瓶、花艺/花瓶装饰瓶,亚马逊(卓越网),橡树庄园
1019004009,家居家装|家装软饰|花瓶、花器,橡树庄园 简约电镀酒杯奖杯玻璃花瓶 花器 餐桌客厅会所花艺摆件,家用/类别/家居/家居装饰/花瓶、装饰瓶、花艺/花瓶装饰瓶,亚马逊(卓越网),橡树庄园
1019004009,家居家装|家装软饰|花瓶、花器,佳盟 欧式田园陶瓷装饰花瓶现代时尚花器整体仿真花花器 DV0095,家用/类别/家居/家居装饰/花瓶、装饰瓶、花艺/花瓶装饰瓶,亚马逊(卓越网),佳盟
1019004009,家居家装|家装软饰|花瓶、花器,佳盟 欧式田园陶瓷装饰花瓶现代时尚花器整体仿真花花器 DV0057,家用/类别/家居/家居装饰/花瓶、装饰瓶、花艺/花瓶装饰瓶,亚马逊(卓越网),佳盟
1019004009,家居家装|家装软饰|花瓶、花器,佳盟 欧式田园陶瓷装饰花瓶现代时尚花器整体仿真花花器 DV0114,家用/类别/家居/家居装饰/花瓶、装饰瓶、花艺/花瓶装饰瓶,亚马逊(卓越网),佳盟
1019004009,家居家装|家装软饰|花瓶、花器,茗轩 mxmade 创意田园风钻石水晶玻璃花瓶 水培花器 时尚家居饰品工艺品,家居 > 家居装饰 > 花瓶、装饰瓶、花艺 > 花瓶装饰瓶,亚马逊(卓越网),mxmade
1019004009,家居家装|家装软饰|花瓶、花器,正想 白色贝壳银色雕花陶瓷花瓶 手工艺礼品 落地花器家饰品客厅摆设 鼓形花瓶配5枝白色PU玫瑰,家居家装>家装软饰>花瓶花艺>正想>正想 白色贝壳银色雕花陶瓷花瓶 手工艺礼...,京东商城,正想旗舰店
1019004009,家居家装|家装软饰|花瓶、花器,wo+ 现代时尚简约不规则陶瓷花瓶配手感保湿玫瑰套装 仿真花假花插花瓶花器摆设 不规则花器+25支黄色小翠菊,家居家装>家装软饰>工艺摆件>wo+ 现代时尚简约不规则陶瓷花瓶配手感...,京东商城,wojia家居旗舰店
1019004009,家居家装|家装软饰|花瓶、花器,德洛美 现代经典简约白色陶瓷花瓶 宜家花器 花盆欧式现代时尚陶瓷花瓶,所有分类>家居家纺、锅具餐具>装饰/日用>装饰花/花瓶>花瓶>德洛美>德洛美 现代经典简约...,1号店,德洛美
1019004009,家居家装|家装软饰|花瓶、花器,正想 悦目陶瓷大花瓶 家居饰品仿真花卉花器新房摆件结婚礼物装饰品摆件 白色 矮款,家居家装>家装软饰>花瓶花艺>正想>正想 悦目陶瓷大花瓶 家居饰品仿真花卉花...,京东商城,正想旗舰店
1019004009,家居家装|家装软饰|花瓶、花器,春意 高档客厅白色瓷器 餐桌花瓶 现代简约时尚陶瓷花瓶花器 结婚礼物 时尚实用装饰品 摆设 矮款,家居家装>家装软饰>工艺摆件>lmdec>春意 高档客厅白色瓷器 餐桌花瓶 现代简...,京东商城,lmdec家饰旗舰店
1019004009,家居家装|家装软饰|花瓶、花器,意大利RCR 原装进口 高档台面花瓶礼品 透明水晶玻璃花樽花器,家居家装>家装软饰>工艺摆件>YOULET>意大利RCR 原装进口 高档台面花瓶礼...,京东商城,悠乐家居
1019004009,家居家装|家装软饰|花瓶、花器,【轩品阁】景德镇陶瓷/花瓶三件套摆件/花瓶花插花器/家居装饰花瓶套装 深灰色,家居家装>家装软饰>工艺摆件>轩品阁>【轩品阁】景德镇陶瓷/花瓶三件套摆件/花...,京东商城,景德镇轩品阁陶瓷
1019004009,家居家装|家装软饰|花瓶、花器,Snnei室内 卡米拉陶瓷花瓶 白色做旧插花花器 家居桌面摆件小花瓶 大号,家居家装>家装软饰>工艺摆件>室内（Snnei）>Snnei室内 卡米拉陶瓷花瓶 白色做旧...,京东商城,snnei室内家居官方旗舰店
1019004009,家居家装|家装软饰|花瓶、花器,Snnei室内 拉玛藤编小花瓶 浪漫地中海复古装饰 餐桌摆件插花器 紫色 一套,家居家装>家装软饰>工艺摆件>室内（Snnei）>Snnei室内 拉玛藤编小花瓶 浪漫地中...,京东商城,snnei室内家居官方旗舰店
1019004009,家居家装|家装软饰|花瓶、花器,欧式透明水晶玻璃花瓶 现代时尚简约插花器,家居家装>家装软饰>花瓶花艺>德洛美（DLM）>欧式透明水晶玻璃花瓶 现代时尚简约插花器,京东商城,德洛美家居专营店
1019004009,家居家装|家装软饰|花瓶、花器,红鑫 景德镇陶瓷器花瓶 酒店宾馆餐台陶瓷花插 中式书桌摆件花器小号梅瓶 寿桃,家居 > 家居装饰 > 花瓶、装饰瓶、花艺 > 花瓶装饰瓶,亚马逊(卓越网),红鑫
1019004009,家居家装|家装软饰|花瓶、花器,米子家居 木质纤维花瓶 客厅餐厅卧室桌面手工上色花器装饰 布拉格花瓶,家居家装>家装软饰>花瓶花艺>米子家居>米子家居 木质纤维花瓶 客厅餐厅卧室桌面...,京东商城,米子家居专营店
1019004009,家居家装|家装软饰|花瓶、花器,贸号 幸运星花瓶水培植物悬挂瓶花器 家居玻璃摆件 5个装,家居家装>家装软饰>花瓶花艺>贸号（MOHO-ZOOM）>贸号 幸运星花瓶水培植物悬挂瓶花器 家...,京东商城,贸号专营店
1019004009,家居家装|家装软饰|花瓶、花器,巴洛克风格 陶瓷水壶花瓶花器,家居家装>家装软饰>花瓶花艺>德洛美（DLM）>巴洛克风格 陶瓷水壶花瓶花器,京东商城,欣圣佳美家居专营店
1019004009,家居家装|家装软饰|花瓶、花器,【柿子原创】景德镇青瓷小花插 青釉小花瓶 定窑无光白釉迷你花器 青瓷粉青小号,家居家装>家装软饰>装饰摆件>柿子>【柿子原创】景德镇青瓷小花插 青釉小花瓶...,京东商城,龙颜堂旗舰店
1019004009,家居家装|家装软饰|花瓶、花器,花瓶花器方形栅栏 花槽花艺木栅栏插花专用 20CM,家居家装>家装软饰>花瓶花艺>德洛美（DLM）>花瓶花器方形栅栏 花槽花艺木栅栏插花专用...,京东商城,欣圣佳美家居专营店
1019004009,家居家装|家装软饰|花瓶、花器,Snnei室内 珍妮·梵欧式陶瓷花瓶 家居摆设装饰品 客厅插花器摆件 粉绿大号,家居家装>家装软饰>花瓶花艺>室内（Snnei）>Snnei室内 珍妮·梵欧式陶瓷花瓶 家...,京东商城,snnei室内家居官方旗舰店
1019004009,家居家装|家装软饰|花瓶、花器,劲爆价欧式现代时尚田园单耳花瓶创意居家陶瓷装饰品花艺/花器 花鸟款不含花,家居家装>家装软饰>花瓶花艺>墨菲>劲爆价欧式现代时尚田园单耳花瓶创意居家陶...,京东商城,墨菲官方旗舰店
1019004009,家居家装|家装软饰|花瓶、花器,【柿子原创】景德镇青瓷小花插 青釉小花瓶 定窑无光白釉迷你花器 青瓷粉青大号,家居家装>家装软饰>装饰摆件> 柿子>【柿子原创】景德镇青瓷小花插 青釉小花瓶...,京东商城,龙颜堂旗舰店
1019004009,家居家装|家装软饰|花瓶、花器,万仟堂 插花花瓶 陶瓷花器 国色春天小雅 春天,家居家装>家装软饰>花瓶花艺> 万仟堂（Edenus） >万仟堂 插花花瓶 陶瓷花器 国色春天小雅...,京东商城,万仟堂旗舰店
1019004009,家居家装|家装软饰|花瓶、花器,创意陶瓷花瓶现代时尚工艺品家居装饰品摆件欧式摆设客厅餐桌花器,家居家装>家装软饰>花瓶花艺> 品和>创意陶瓷花瓶现代时尚工艺品家居装饰品摆件...,京东商城,卡冉柏家居专营店
1019004009,家居家装|家装软饰|花瓶、花器,创意白色陶瓷花瓶 欧式客厅现代时尚简约家居装饰品花器陶瓷摆件,家居日用>工艺摆件>八方来>创意白色陶瓷花瓶 欧式客厅现代时尚简约家居装饰品花器陶瓷摆件,国美电器网上商城,八方来
1019004009,家居家装|家装软饰|花瓶、花器,【畅宁】玻璃花瓶（绿色） 白菜口花瓶 16厘米高 玻璃花瓶花器 客厅家居装饰品 摆件 2色可选,首页>家居/家装建材/厨具>生活日用>装饰用品>【畅宁】玻璃花瓶（绿色）白菜口花瓶...,苏宁,畅宁
1019004009,家居家装|家装软饰|花瓶、花器,墨菲 欧式花瓶摆件 田园现代时尚创意客厅陶瓷花器家居装饰 多款可选,所有分类>家居家纺、锅具餐具>装饰/日用>装饰花/花瓶>花瓶>墨菲,1号店,花瓶



