1019005004,家居家装|清洁用品|驱虫驱蚊,恒本 可调节夜光驱蚊手环 驱蚊手带20只 (5只一袋） JJD69,家居日用>驱虫除害>恒本>恒本 可调节夜光驱蚊手环 驱蚊手带20只 (5只一袋） JJD69,国美电器网上商城,恒本
1019005004,家居家装|清洁用品|驱虫驱蚊,恒本 宝宝植物精油纳米驱蚊防蚊贴 黄色 10盒200片 JJF121,家居日用>驱虫除害>恒本>恒本 宝宝植物精油纳米驱蚊防蚊贴 黄色 10盒200片 JJF121,国美电器网上商城,恒本
1019005004,家居家装|清洁用品|驱虫驱蚊,恒本 宝宝植物精油纳米驱蚊防蚊贴 黄色 JJF121 hb30 2盒40片,家居家装>清洁用品>驱虫用品>红兔子>恒本 宝宝植物精油纳米驱蚊防蚊贴 黄色 ...,京东商城,圣唐家居馆
1019005004,家居家装|清洁用品|驱虫驱蚊,喜利多/Siligo 纯天然驱蚊手环 5条装 紫色,家居家装>清洁用品>驱虫用品>雅格>喜利多/Siligo 纯天然驱蚊手环 5...,京东商城,喜利多家居旗舰店
1019005004,家居家装|清洁用品|驱虫驱蚊,羽蓝 驱蚊手环 纯天然植物配方/适合孕妇婴幼儿 1条装,家居家装>清洁用品>驱虫用品>羽蓝>羽蓝 驱蚊手环 纯天然植物配方/适合孕妇...,京东商城,英力特家居旗舰店
1019005004,家居家装|清洁用品|驱虫驱蚊,五花红香樟木条驱蚊除虫除味用品物理樟脑丸 20个装,家居家装>清洁用品>驱虫用品>五花>五花红香樟木条驱蚊除虫除味用品物理樟脑丸...,京东商城,天诺雅旗舰店
1019005004,家居家装|清洁用品|驱虫驱蚊,羽蓝 驱蚊手环 纯天然植物配方/适合孕妇婴幼儿 4条装,首页>家居/家装建材/厨具>生活日用>驱蚊驱虫>羽蓝驱蚊手环纯天然植物配方/适合...,苏宁,羽蓝
1019005004,家居家装|清洁用品|驱虫驱蚊,恒本成人婴儿都可用 孕妇宝宝 驱蚊手环驱蚊片防蚊（植物精油驱蚊贴）,家居家装>清洁用品>驱虫用品>恒本>恒本成人婴儿都可用 孕妇宝宝 驱蚊手环驱...,京东商城,亦谷家居专营店
1019005004,家居家装|清洁用品|驱虫驱蚊,维康 夏季新品儿童驱蚊手环 防虫手链字母简约进口环保材料手环 随机发货 C1114,家居家装>清洁用品>驱虫用品>红兔子>维康 夏季新品儿童驱蚊手环 防虫手链字母...,京东商城,祥韧家居生活馆
1019005004,家居家装|清洁用品|驱虫驱蚊,雷达（RADO） 欧护驱蚊液（艾草清新型）100ml,家居家装>清洁用品>驱虫用品>雷达（RADO）>雷达驱蚊液,京东商城,雷达（RADO）
1019005004,家居家装|清洁用品|驱虫驱蚊,雷达欧护驱蚊液（清新芦荟香型）*3瓶 100ml*3,家居家装>清洁用品>驱虫用品>欧护（OFF）>雷达欧护驱蚊液（清新芦荟香型）*3瓶 ...,京东商城,天兴欣业家居专营店
1019005004,家居家装|清洁用品|驱虫驱蚊,雷达 欧护off驱蚊液100ml 防蚊液 驱蚊水 防蚊用品 成人户外用品 (清新芦荟),家居家装>清洁用品>驱虫用品>雷达（RADO）>雷达 欧护off驱蚊液100ml 防蚊液...,京东商城,雅冠家居
1019005004,家居家装|清洁用品|驱虫驱蚊,恒本 植物精油防蚊手环驱蚊圈 驱蚊手镯 可调节大小 3个装,家居家装>清洁用品>驱虫用品>恒本>恒本 植物精油防蚊手环驱蚊圈 驱蚊手镯 ...,京东商城,普润家居专营店
1019005004,家居家装|清洁用品|驱虫驱蚊,朴森家健宝天然驱蚊贴婴童专用型MR02三盒装,首页>家居/家装建材/厨具>生活日用>驱蚊驱虫>朴森家健宝天然驱蚊贴婴童专用型MR0...,苏宁,
1019005004,家居家装|清洁用品|驱虫驱蚊,俏蜻蜓 成人户外驱蚊手环儿童宝宝防蚊手环 卡通啪啪圈驱蚊手链带 含6香片,所有分类>家居家纺、锅具餐具>装饰/日用>驱虫防虫>防蚊贴/防蚊环>俏蜻蜓>俏蜻蜓 成人户外驱蚊...,1号店,俏蜻蜓
1019005004,家居家装|清洁用品|驱虫驱蚊,雷达 灭蚊驱蚊 电蚊香拖线式电热蚊香片加热器 1器+蚊香125mg*15片,首页>家居/家装建材/厨具>生活日用>驱蚊驱虫>雷达灭蚊驱蚊电蚊香拖线式电热蚊香...,苏宁,雷达(RADO)
1019005004,家居家装|清洁用品|驱虫驱蚊,彩虹乖乖电热蚊香液（无香）（母婴驱蚊）45夜 （Q5103）,家居家装>清洁用品>驱虫用品>彩虹>彩虹乖乖电热蚊香液（无香）（母婴驱蚊）4...,京东商城,彩虹集团京东官方旗舰店
1019005004,家居家装|清洁用品|驱虫驱蚊,朴森家健宝天然驱蚊包MR16三包装,家居家装>清洁用品>驱虫用品>朴森>朴森驱蚊包,京东商城,朴森
1019005004,家居家装|清洁用品|驱虫驱蚊,暖友植物精油驱蚊环10条装,所有分类>家居家纺、锅具餐具>装饰/日用>驱虫防虫>防蚊贴/防蚊环>暖友>暖友植物精油驱蚊环1...,1号店,暖友
1019005004,家居家装|清洁用品|驱虫驱蚊,维康 时尚香水驱蚊防蚊手环夏季必备,所有分类>家居家纺、锅具餐具>装饰/日用>驱虫防虫>防蚊贴/防蚊环>维康>维康 时尚香水驱蚊防...,1号店,维康
1019005004,家居家装|清洁用品|驱虫驱蚊,世家充电式驱蚊拍,家居家装>清洁用品>驱虫用品>世家>世家驱蚊拍,京东商城,世家
1019005004,家居家装|清洁用品|驱虫驱蚊,维康 儿童驱蚊手环 维康字母简约进口料手环 颜色随机发 10条装,家居家装>清洁用品>驱虫用品>维康>维康 儿童驱蚊手环 维康字母简约进口料手...,京东商城,维康家居专营店
1019005004,家居家装|清洁用品|驱虫驱蚊,家居源香茅草驱蚊氏120g*3盒 驱蚊防虫驱蚊器驱蚊液防蚊剂防止蚊虫叮咬,家居家装>清洁用品>驱虫用品>家居源香茅草驱蚊氏120g*3盒 驱蚊防...,京东商城,雅冠家居
1019005004,家居家装|清洁用品|驱虫驱蚊,恒本宝宝驱蚊贴防蚊贴 植物精油5盒装,家居家装>清洁用品>驱虫用品>维康>恒本宝宝驱蚊贴防蚊贴 植物精油5盒装,京东商城,忽然一周家居生活馆
1019005004,家居家装|清洁用品|驱虫驱蚊,暖友香香驱蚊精油家庭装 404784,家居家装>清洁用品>驱虫用品>暖友香香驱蚊精油家庭装 404784,京东商城,悠之品家居旗舰店
1019005004,家居家装|清洁用品|驱虫驱蚊,康菲格尔长效驱蚊手环1包装 纯天然植物配方 宝宝婴儿驱蚊防蚊子用品 绿色幸运草,家居家装>清洁用品>驱虫用品>康菲格尔长效驱蚊手环1包装 纯天然植物配...,京东商城,锦怡家居生活馆
1019005004,家居家装|清洁用品|驱虫驱蚊,维康（wecan）香水驱蚊防蚊手环 10条装,家居家装>清洁用品>驱虫用品>维康>维康（wecan）香水驱蚊防蚊手环 10...,京东商城,维康官方旗舰店
1019005004,家居家装|清洁用品|驱虫驱蚊,TO-PLAN 驱蚊贴 36枚装,所有分类>家居家纺、锅具餐具>装饰/日用>驱虫防虫>防蚊贴/防蚊环>TO-PLAN>TO-PLAN 驱蚊...,1号店,TO-PLAN
1019005004,家居家装|清洁用品|驱虫驱蚊,劲森驱蚊灯灭蚊器灭蚊灯 灭蝇灯驱蝇蚊器 餐厅酒店专用捕蚊器,家居家装>清洁用品>驱虫用品>劲森（JUSTSUN）>劲森驱蚊灯灭蚊器灭蚊灯 灭蝇灯驱蝇蚊器 ...,京东商城,劲森光电旗舰店
1019005004,家居家装|清洁用品|驱虫驱蚊,黑客驱蚊电热蚊香片加热器 三维劲风 实惠型,家居家装>清洁用品>驱虫用品>黑客驱蚊电热蚊香片加热器 三维劲风...,京东商城,琳霏家居
1019005004,家居家装|清洁用品|驱虫驱蚊,维康 宝宝儿童驱蚊防蚊手环 安全无毒10条装 颜色随机,家居家装>清洁用品>驱虫用品>维康 宝宝儿童驱蚊防蚊手环 安全无毒10...,京东商城,奇尔汇
1019005004,家居家装|清洁用品|驱虫驱蚊,恒本 蚊香30片装电热蚊香片无味型 驱蚊防虫JJH01 6盒装,家居家装>清洁用品>驱虫用品>维康>恒本 蚊香30片装电热蚊香片无味型 驱蚊...,京东商城,圣唐家居馆
1019005004,家居家装|清洁用品|驱虫驱蚊,恒本 纳米精油驱蚊贴 植物精油驱蚊贴JJF121 1盒20片装,家居家装>清洁用品>驱虫用品>维康>恒本 纳米精油驱蚊贴 植物精油驱蚊贴JJ...,京东商城,圣唐家居馆
1019005004,家居家装|清洁用品|驱虫驱蚊,趣玩 BABY香香驱蚊宝,家居家装>清洁用品>驱虫用品>绿叶（Green Leaf）>趣玩 BABY香香驱蚊宝,京东商城,趣玩生活旗舰店
1019005004,家居家装|清洁用品|驱虫驱蚊,恒本 可调节夜光驱蚊手环 驱蚊手带20只 (5只一袋） JJD69,家居家装>清洁用品>驱虫用品>恒本 可调节夜光驱蚊手环 驱蚊手带20只...,京东商城,来此购生活馆
1019005004,家居家装|清洁用品|驱虫驱蚊,恒本 笑脸卡通防蚊贴 驱蚊手环JJJ158 20包120片装,家居家装>清洁用品>驱虫用品>维康>恒本 笑脸卡通防蚊贴 驱蚊手环JJJ15...,京东商城,来此购生活馆
1019005004,家居家装|清洁用品|驱虫驱蚊,恒本 植物精油驱蚊贴 植物精油驱蚊贴 10盒200片装,家居家装>清洁用品>驱虫用品>维康>恒本 植物精油驱蚊贴 植物精油驱蚊贴 ...,京东商城,来此购生活馆
1019005004,家居家装|清洁用品|驱虫驱蚊,丽尚２盒纯植物精油 婴幼儿宝宝儿童驱蚊贴防蚊贴(颜色随机),家居家装>清洁用品>驱虫用品>丽尚２盒纯植物精油 婴幼儿宝宝儿童驱蚊贴...,京东商城,丽尚易暖堂旗舰店
1019005004,家居家装|清洁用品|驱虫驱蚊,恒本 新款电热蚊香液 驱蚊液无味型 4盒装,家居家装>清洁用品>驱虫用品>恒本>恒本 新款电热蚊香液 驱蚊液无味型 4盒...,京东商城,普润家居专营店
1019005004,家居家装|清洁用品|驱虫驱蚊,恒本 新款电热蚊香液 清香型 驱蚊液 6盒装,家居家装>清洁用品>驱虫用品>恒本>恒本 新款电热蚊香液 清香型 驱蚊液 6...,京东商城,普润家居专营店
1019005004,家居家装|清洁用品|驱虫驱蚊,恒本 新款2合1电热蚊香液送蚊香器 驱蚊片 驱蚊液 组合装 1盒装,家居家装>清洁用品>驱虫用品>恒本>恒本 新款2合1电热蚊香液送蚊香器 驱蚊...,京东商城,普润家居专营店
1019005004,家居家装|清洁用品|驱虫驱蚊,恒本 新款笑脸卡通防蚊贴 驱蚊手环JJJ158 20包120片装,家居家装>清洁用品>驱虫用品>恒本>恒本 新款笑脸卡通防蚊贴 驱蚊手环JJJ...,京东商城,普润家居专营店
1019005004,家居家装|清洁用品|驱虫驱蚊,恒本 电热蚊香液 驱蚊液无味型 防蚊虫 6盒装,家居家装>清洁用品>驱虫用品>恒本>恒本 电热蚊香液 驱蚊液无味型 防蚊虫 ...,京东商城,普润家居专营店
1019005004,家居家装|清洁用品|驱虫驱蚊,恒本 新款电热蚊香液 驱蚊液 清香型 驱蚊防虫 10盒装,家居家装>清洁用品>驱虫用品>恒本>恒本 新款电热蚊香液 驱蚊液 清香型 驱...,京东商城,普润家居专营店
1019005004,家居家装|清洁用品|驱虫驱蚊,皎洁驱蚊草电热蚊香液2瓶套装送加热器 宝宝驱蚊液儿童蚊香液,家居家装>清洁用品>驱虫用品>皎洁驱蚊草电热蚊香液2瓶套装送加热器 宝...,京东商城,锦怡家居生活馆
1019005004,家居家装|清洁用品|驱虫驱蚊,安速电池式风扇驱蚊套装+安速电热蚊香液（薰衣草香）灭蚊子效果好全面杀蚊,家居家装>清洁用品>驱虫用品>安速>安速电池式风扇驱蚊套装+安速电热蚊香液（...,京东商城,雅冠家居
1019005004,家居家装|清洁用品|驱虫驱蚊,恒本 蚊香30片装电热蚊香片无味型 驱蚊防虫JJH01 3盒装,家居家装>清洁用品>驱虫用品>维康>恒本 蚊香30片装电热蚊香片无味型 驱蚊...,京东商城,祥韧家居生活馆
1019005004,家居家装|清洁用品|驱虫驱蚊,恒本 电热蚊香液 驱蚊液无味型 防蚊虫 2盒装,家居家装>清洁用品>驱虫用品>维康>恒本 电热蚊香液 驱蚊液无味型 防蚊虫 ...,京东商城,祥韧家居生活馆
1019005004,家居家装|清洁用品|驱虫驱蚊,恒本 植物精油驱蚊贴 植物精油驱蚊贴 3盒60片装,家居家装>清洁用品>驱虫用品>维康>恒本 植物精油驱蚊贴 植物精油驱蚊贴 3...,京东商城,祥韧家居生活馆
1019005004,家居家装|清洁用品|驱虫驱蚊,恒本 蚊香30片装电热蚊香片无味型 驱蚊防虫JJH01 4盒装,家居家装>清洁用品>驱虫用品>恒本>恒本 蚊香30片装电热蚊香片无味型 驱蚊...,京东商城,楼龙旗舰店
1019005004,家居家装|清洁用品|驱虫驱蚊,恒本 电热蚊香液 清香型 驱蚊液 2盒装,家居家装>清洁用品>驱虫用品>恒本>恒本 电热蚊香液 清香型 驱蚊液 2盒装,京东商城,楼龙旗舰店
1019005004,家居家装|清洁用品|驱虫驱蚊,恒本 2合1电热蚊香液送蚊香器 驱蚊片 驱蚊液 组合装 hb17（1） 6盒装,家居家装>清洁用品>驱虫用品>恒本>恒本 2合1电热蚊香液送蚊香器 驱蚊片 ...,京东商城,楼龙旗舰店
1019005004,家居家装|清洁用品|驱虫驱蚊,恒本 电热双用驱蚊器/蚊香器 3F3-19 4盒装,家居家装>清洁用品>驱虫用品>恒本>恒本 电热双用驱蚊器/蚊香器 3F3-1...,京东商城,楼龙旗舰店
1019005004,家居家装|清洁用品|驱虫驱蚊,户清强效驱蚊液安全环保含金银花清凉舒爽止痒 2瓶装,家居家装>清洁用品>驱虫用品>户清>户清强效驱蚊液安全环保含金银花清凉舒爽止...,京东商城,户清专营店
1019005004,家居家装|清洁用品|驱虫驱蚊,夏日安宁驱蚊手环Ⅱ（3条装 ） 蓝色*2+西瓜红,首页> 家居生活> 清洁洗护> 驱虫/杀虫> 驱蚊贴> 夏日安宁驱蚊手环Ⅱ（3条装,凡客诚品,VANCL 凡客诚品
1019005004,家居家装|清洁用品|驱虫驱蚊,恒本 植物精油驱蚊贴 5盒100片,所有分类>家居家纺、锅具餐具>装饰/日用>驱虫防虫>防蚊贴/防蚊环>恒本>恒本 植物精油驱蚊贴...,1号店,恒本
1019005004,家居家装|清洁用品|驱虫驱蚊,ARS 安速 婴儿驱蚊 食蚊鱼电池式风扇驱蚊替换装（90天）,首页>家居/家装建材/厨具>生活日用>驱蚊驱虫>ARS安速婴儿驱蚊食蚊鱼电池式...,苏宁,安速
1019005004,家居家装|清洁用品|驱虫驱蚊,威灭驱蚊腕带(单条裝),所有分类>家居家纺、锅具餐具>装饰/日用>驱虫防虫>防蚊贴/防蚊环>威灭>威灭驱蚊腕带(单条裝...,1号店,威灭
1019005004,家居家装|清洁用品|驱虫驱蚊,超威贝贝健驱蚊液,首页>家居/家装建材/厨具>生活日用>驱蚊驱虫>超威贝贝健驱蚊液,苏宁,超威
1019005004,家居家装|清洁用品|驱虫驱蚊,恒本 2合1电热蚊香液送蚊香器 驱蚊片 驱蚊液 组合装 hb17（1） 10盒装,家居家装>清洁用品>驱虫用品>恒本>恒本 2合1电热蚊香液送蚊香器 驱蚊片 ...,京东商城,楼龙旗舰店
1019005004,家居家装|清洁用品|驱虫驱蚊,婴儿童宝宝电热双用驱蚊器 驱蚊液 两用蚊香器,首页>家居/家装建材/厨具>生活日用>驱蚊驱虫>婴儿童宝宝电热双用驱蚊器驱蚊液两...,苏宁,贸号
1019005004,家居家装|清洁用品|驱虫驱蚊,可拉熊 儿童驱蚊防蚊手环 一条装,家居家装>清洁用品>驱虫用品>可拉熊>可拉熊 儿童驱蚊防蚊手环 一条装,京东商城,英力特家居旗舰店
1019005004,家居家装|清洁用品|驱虫驱蚊,TO-PLAN 香气/驱蚊手环手带 纳米 纯天然植物精油 10袋,家居家装>清洁用品>驱虫用品>TO-PLAN>TO-PLAN 香气/驱蚊手环手带 纳米...,京东商城,思明思清洁
1019005004,家居家装|清洁用品|驱虫驱蚊,维康夏季 新品 儿童驱蚊手环 字母简约进口料手环手腕带手圈装饰手环 颜色随机发-C1114,家居家装>清洁用品>驱虫用品>其它>维康夏季 新品 儿童驱蚊手环 字母简约进...,京东商城,龙淳名品生活馆
1019005004,家居家装|清洁用品|驱虫驱蚊,恒本 孕婴可用 电热蚊香液 送蚊香器驱蚊 超值套装,家居家装>清洁用品>驱虫用品>恒本>恒本 孕婴可用 电热蚊香液 送蚊香器驱蚊...,京东商城,亦谷家居专营店
1019005004,家居家装|清洁用品|驱虫驱蚊,正品恒本 儿童宝宝 驱蚊灭蚊除蚊香片无味型72片+电热驱蚊器套装,家居家装>清洁用品>驱虫用品>恒本>正品恒本 儿童宝宝 驱蚊灭蚊除蚊香片无味...,京东商城,亦谷家居专营店
1019005004,家居家装|清洁用品|驱虫驱蚊,雷达（RADO） 欧护驱蚊液（金银花香型）100ml,家居家装>清洁用品>驱虫用品>雷达（RADO）>雷达驱蚊液,京东商城,雷达（RADO）
1019005004,家居家装|清洁用品|驱虫驱蚊,可拉熊 天然植物精油驱蚊贴（36片/袋）驱蚊手环组合 夏季必备/安全有效 儿童防蚊组合套装 贴2袋环1条,家居家装>清洁用品>驱虫用品>可拉熊>可拉熊 天然植物精油驱蚊贴（36片/袋）...,京东商城,英力特家居旗舰店
1019005004,家居家装|清洁用品|驱虫驱蚊,庄臣雷达电热蚊香液 电蚊液 驱蚊 无香型 80 32晚 两盒装/4瓶,家居家装>清洁用品>驱虫用品>雷达（RADO）>庄臣雷达电热蚊香液 电蚊液 驱蚊 无香型...,京东商城,雅冠家居
1019005004,家居家装|清洁用品|驱虫驱蚊,朴森康居宝夜灯便携型超声波驱蚊器MC04,家居家装>清洁用品>驱虫用品>朴森>朴森康居宝夜灯便携型超声波驱蚊器MC04,京东商城,杰瑞家居专营店
1019005004,家居家装|清洁用品|驱虫驱蚊,恒本 KT猫无扣夜光驱蚊手环香茅草防蚊手环 驱蚊手镯 五个装,家居家装>清洁用品>驱虫用品>恒本>恒本 KT猫无扣夜光驱蚊手环香茅草防蚊手...,京东商城,普润家居专营店
1019005004,家居家装|清洁用品|驱虫驱蚊,BIGBIO印楝防蚊液 驱蚊液 喷雾剂 孕妇宝宝专用 天然无刺激,家居家装>清洁用品>驱虫用品> 大微（BIGBIO）>BIGBIO印楝防蚊液 驱蚊液 喷雾剂 ...,京东商城,康乐成家居专营店
1019005004,家居家装|清洁用品|驱虫驱蚊,水立方驱蚊手环 精油蚊香防蚊手环 驱蚊防蚊圈 颜色随机(选择套餐更便宜) 1个装,家居家装>清洁用品>驱虫用品> 博康>水立方驱蚊手环 精油蚊香防蚊手环 驱蚊防...,京东商城,妙思家居专营店
1019005004,家居家装|清洁用品|驱虫驱蚊,电热蚊香器驱蚊器防蚊器除蚊器 蚊香片专用2个装,家居家装>清洁用品>驱虫用品> 其它>电热蚊香器驱蚊器防蚊器除蚊器 蚊香片专用...,京东商城,陶钰源家居专营店

