1019005001,家居家装|清洁用品|纸品湿巾,自由森林 擦手纸20包（整箱装）,家居家装>清洁用品>纸品湿巾>自由森林（Free Forest）>自由森林手纸,京东商城,自由森林（Free Forest）
1019005001,家居家装|清洁用品|纸品湿巾,洁云卷筒卫生纸（20卷装）整箱装,家居家装>清洁用品>纸品湿巾>洁云>洁云卫生纸,京东商城,洁云
1019005001,家居家装|清洁用品|纸品湿巾,evergreen爱屋格林创意餐巾N4NL2233,首页>家居/家装建材/厨具>清洁用品>纸品湿巾>evergreen爱屋格林创意餐巾N...,苏宁,爱屋格林
1019005001,家居家装|清洁用品|纸品湿巾,evergreen爱屋格林创意餐巾N4NL2300,首页>家居/家装建材/厨具>清洁用品>纸品湿巾>evergreen爱屋格林创意餐巾N...,苏宁,爱屋格林
1019005001,家居家装|清洁用品|纸品湿巾,娇雪分娩护理包,首页>家居/家装建材/厨具>清洁用品>纸品湿巾>娇雪分娩护理包,苏宁,娇雪
1019005001,家居家装|清洁用品|纸品湿巾,sun-japan日本婴儿手口柔湿纸巾（弱酸 无刺激 润肤）便携式30片 三包装 S-15,家居家装>清洁用品>纸品湿巾>sun-japan日本婴儿手口柔湿纸巾（...,京东商城,尚美家居
1019005001,家居家装|清洁用品|纸品湿巾,阳光 成人湿巾纸(红、蓝包装发货随机) 8453,家居家装>清洁用品>纸品湿巾>阳光>阳光 成人湿巾纸(红、蓝包装发货随机) ...,京东商城,日品客
1019005001,家居家装|清洁用品|纸品湿巾,泉林本色 百草舒140g10粒装卷筒 6提,家居家装>清洁用品>纸品湿巾>泉林本色 百草舒140g10粒装卷筒 6...,京东商城,沁宜纸品专营店
1019005001,家居家装|清洁用品|纸品湿巾,清风卫生纸 长卷无芯四提装（2卷/提）,家居家装>清洁用品>纸品湿巾>清风>清风卫生纸 长卷无芯四提装（2卷/提）,京东商城,百隆家居用品专营店
1019005001,家居家装|清洁用品|纸品湿巾,妮飘(Nepia)HelloKitty（凯蒂）抽纸 整箱24提72包(150抽/包*3/提) 1FK150,家居家装>清洁用品>纸品湿巾>妮飘>妮飘(Nepia)HelloKitty（...,京东商城,棱晶居家
1019005001,家居家装|清洁用品|纸品湿巾,妮飘(Nepia)绒品220节印花卷纸单提装(4卷/提)TRU4,家居家装>清洁用品>纸品湿巾>妮飘>妮飘(Nepia)绒品220节印花卷纸单...,京东商城,妮飘旗舰店
1019005001,家居家装|清洁用品|纸品湿巾,HADARIKI 银离子除菌湿巾筒装100抽 330455,家居家装>清洁用品>纸品湿巾>HADARIKI 银离子除菌湿巾筒装10...,京东商城,日本家居用品专卖
1019005001,家居家装|清洁用品|纸品湿巾,HADARIKI 家具除尘清洁湿巾纸20片装 330714,家居家装>清洁用品>纸品湿巾>HADARIKI 家具除尘清洁湿巾纸20...,京东商城,日本家居用品专卖
1019005001,家居家装|清洁用品|纸品湿巾,泉林本色卫生抽纸巾 180抽塑装面巾软抽纸 3连包 整箱装16提,家居家装>清洁用品>纸品湿巾>泉林本色>泉林本色卫生抽纸巾 180抽塑装面巾软抽...,京东商城,莱锦·摩得生活馆
1019005001,家居家装|清洁用品|纸品湿巾,全棉时代（PurCotton） 消毒棉片 湿巾 内裤 清洁面巾 口罩 膜安全出游必备女包,家居家装>清洁用品>纸品湿巾>全棉时代（PurCotton） 消毒棉片...,京东商城,全棉时代旗舰店
1019005001,家居家装|清洁用品|纸品湿巾,舒洁杀菌洁肤卫生湿巾10片*10包*2,家居家装>清洁用品>纸品湿巾>舒洁>舒洁杀菌洁肤卫生湿巾10片*10包*2,京东商城,麦德龙健康生活馆
1019005001,家居家装|清洁用品|纸品湿巾,维达 抽纸 倍韧2层150抽面巾纸*8包,家居家装>清洁用品>纸品湿巾> 维达>维达面巾纸,京东商城,维达
1019005001,家居家装|清洁用品|纸品湿巾,泉林本色卫生抽纸巾 手帕纸（莲花）原浆本色不漂白整箱装48条,家居家装>清洁用品>纸品湿巾>泉林本色>泉林本色卫生抽纸巾 手帕纸（莲花）原浆本...,京东商城,莱锦·摩得生活馆
1019005001,家居家装|清洁用品|纸品湿巾,清风纸巾 抽纸 婴儿可用花韵超大容量200抽双层软抽纸整箱装（16提/箱）,家居家装>清洁用品>纸品湿巾>清风（APP）>清风纸巾 抽纸 婴儿可用花韵超大容量20...,京东商城,百隆家居用品专营店
1019005001,家居家装|清洁用品|纸品湿巾,心相印茶语双层盒抽200抽*3*3提,家居家装>清洁用品>纸品湿巾>心相印>心相印茶语双层盒抽200抽*3*3提,京东商城,麦德龙健康生活馆
1019005001,家居家装|清洁用品|纸品湿巾,舒洁厨房纸巾4卷装 专供*2组,家居家装>清洁用品>纸品湿巾>舒洁厨房纸巾4卷装 专供*2组,京东商城,麦德龙健康生活馆
1019005001,家居家装|清洁用品|纸品湿巾,帕可丽眼镜纸30张装,家居家装>清洁用品>纸品湿巾>帕可丽>帕可丽眼镜纸30张装,京东商城,小知了旗舰店
1019005001,家居家装|清洁用品|纸品湿巾,清风卫生纸 纸巾 抽纸婴儿可用 红超质感卷纸1提 绿茶茉香200抽软抽2提 蓝手帕,家居家装>清洁用品>纸品湿巾>清风（APP）>清风卫生纸 纸巾 抽纸婴儿可用 红超质感...,京东商城,百隆家居用品专营店
1019005001,家居家装|清洁用品|纸品湿巾,sun-japan日本厨房专用除菌湿巾纸巾 盒装（超强去除油污）50枚厚型两包装O-16,家居家装>清洁用品>纸品湿巾>sun-japan>sun-japan日本厨房专用除菌湿巾纸...,京东商城,尚美家居
1019005001,家居家装|清洁用品|纸品湿巾,泉林本色卫生抽纸巾卷纸 纸锦礼盒商务套装 3提,家居家装>清洁用品>纸品湿巾>泉林本色>泉林本色卫生抽纸巾卷纸 纸锦礼盒商务套装...,京东商城,莱锦·摩得生活馆
1019005001,家居家装|清洁用品|纸品湿巾,心相印商务专用三层卷筒纸（紫色）,首页>家居/家装建材/厨具>清洁用品>纸品湿巾>心相印商务专用三层卷筒纸（紫色）,苏宁,心相印
1019005001,家居家装|清洁用品|纸品湿巾,唯尔福纸音180g特柔3层高级卷筒纸(10卷/提）,首页>家居/家装建材/厨具>清洁用品>纸品湿巾>唯尔福纸音180g特柔3层高级卷筒纸...,苏宁,纸音
1019005001,家居家装|清洁用品|纸品湿巾,P7101-1 纯点1000克小盘纸(单层)整箱,首页>家居/家装建材/厨具>清洁用品>纸品湿巾>P7101-1纯点1000克小盘纸...,苏宁,纯点
1019005001,家居家装|清洁用品|纸品湿巾,清风B130F 清香型100抽3包抽取式卫生纸 整箱（24提）,首页>家居/家装建材/厨具>清洁用品>纸品湿巾>清风B130F清香型100抽3包抽...,苏宁,清风
1019005001,家居家装|清洁用品|纸品湿巾,洁云 卷纸 三层平纹柔韧卷纸270节 10卷装,首页>家居/家装建材/厨具>清洁用品>纸品湿巾>洁云卷纸三层平纹柔韧卷纸270节...,苏宁,洁云
1019005001,家居家装|清洁用品|纸品湿巾,舒洁迷你Q抽取面巾纸45抽5包,家居家装>清洁用品>纸品湿巾>舒洁（Kleenex）>舒洁面巾纸,京东商城,舒洁（Kleenex）
1019005001,家居家装|清洁用品|纸品湿巾,维达 抽纸 超韧3层150抽面巾纸*8包(小规格),家居家装>清洁用品>纸品湿巾> 维达>维达面巾,京东商城,维达
1019005001,家居家装|清洁用品|纸品湿巾,泉林本色卫生有芯卷纸 VIP贵宾专享180g10粒装 3提特惠装,家居家装>清洁用品>纸品湿巾>泉林本色>泉林本色卫生有芯卷纸 VIP贵宾专享18...,京东商城,莱锦·摩得生活馆
1019005001,家居家装|清洁用品|纸品湿巾,维达 卫生纸 至有分量3层180g卷纸*10卷,家居家装>清洁用品>纸品湿巾> 维达>维达卫生纸,京东商城,维达
1019005001,家居家装|清洁用品|纸品湿巾,洁云 纯水亲肤湿巾（独立10片装）,家居家装>清洁用品>纸品湿巾> 洁云>洁云湿巾,京东商城,洁云
1019005001,家居家装|清洁用品|纸品湿巾,自由森林环保三层卷纸260节*12卷*2组,家居家装>清洁用品>纸品湿巾>洁云>自由森林环保三层卷纸260节*12卷*2...,京东商城,麦德龙健康生活馆
1019005001,家居家装|清洁用品|纸品湿巾,Kleenex舒洁 囧时尚迷你手帕纸10包装,家居家装>清洁用品>纸品湿巾>舒洁（Kleenex）>舒洁手帕纸,京东商城,舒洁（Kleenex）
1019005001,家居家装|清洁用品|纸品湿巾,维达 卫生纸 超韧3层140g无芯卷纸*10卷,家居家装>清洁用品>纸品湿巾>维达>维达卫生纸,京东商城,维达
1019005001,家居家装|清洁用品|纸品湿巾,金博士120抽盒装面巾纸（8提装）,家居家装>清洁用品>纸品湿巾>金博士>金博士120抽盒装面巾纸（8提装）,京东商城,百隆家居用品专营店
1019005001,家居家装|清洁用品|纸品湿巾,喜擦擦运动鞋清洁湿巾 擦鞋湿纸巾 一次性多功能湿毛巾 五连包 30片每包 XCC-018,家居家装>清洁用品>纸品湿巾>喜擦擦>喜擦擦运动鞋清洁湿巾 擦鞋湿纸巾 一次性...,京东商城,目磊家居专营店
1019005001,家居家装|清洁用品|纸品湿巾,心相印商务专用200抽双层塑装纸面巾(咖啡装束),首页>家居/家装建材/厨具>清洁用品>纸品湿巾>心相印商务专用200抽双层塑装纸面巾...,苏宁,心相印
1019005001,家居家装|清洁用品|纸品湿巾,维达至有分量系列3层140g卷筒卫生纸*10卷,首页>家居/家装建材/厨具>清洁用品>纸品湿巾>维达至有分量系列3层140g卷筒卫生...,苏宁,维达
1019005001,家居家装|清洁用品|纸品湿巾,心相印C2110 优选系列双层迷你型手帕纸*18包 整箱（24条）,首页>家居/家装建材/厨具>清洁用品>纸品湿巾>心相印C2110优选系列双层迷你型...,苏宁,心相印
1019005001,家居家装|清洁用品|纸品湿巾,心相印独立装洁肤柔湿巾*10片,首页>家居/家装建材/厨具>清洁用品>纸品湿巾>心相印独立装洁肤柔湿巾*10片,苏宁,心相印
1019005001,家居家装|清洁用品|纸品湿巾,洁云 卷纸 柔韧120节无芯卷筒卫生纸-10卷装,首页>家居/家装建材/厨具>清洁用品>纸品湿巾>洁云卷纸柔韧120节无芯卷筒卫生...,苏宁,洁云
1019005001,家居家装|清洁用品|纸品湿巾,心相印优选系列双层迷你型手帕纸(温馨靠枕) *10包,首页>家居/家装建材/厨具>清洁用品>纸品湿巾>心相印优选系列双层迷你型手帕纸(温馨...,苏宁,心相印
1019005001,家居家装|清洁用品|纸品湿巾,心相印平切纸(450张),首页>家居/家装建材/厨具>清洁用品>纸品湿巾>心相印平切纸(450张),苏宁,心相印
1019005001,家居家装|清洁用品|纸品湿巾,洁云 手帕纸 3层手帕纸-12包装,首页>家居/家装建材/厨具>清洁用品>纸品湿巾>洁云手帕纸3层手帕纸-12包装,苏宁,洁云
1019005001,家居家装|清洁用品|纸品湿巾,维达花之韵系列3层100g无芯卷纸*10卷,首页>家居/家装建材/厨具>清洁用品>纸品湿巾>维达花之韵系列3层100g无芯卷纸*...,苏宁,维达
1019005001,家居家装|清洁用品|纸品湿巾,心相印冬己系列130抽盒装面巾纸(畅想)*3盒,首页>家居/家装建材/厨具>清洁用品>纸品湿巾>心相印冬己系列130抽盒装面巾纸(畅...,苏宁,心相印
1019005001,家居家装|清洁用品|纸品湿巾,清风 纸巾 绿茶茉香3层8张9包袖珍面纸,首页>家居/家装建材/厨具>清洁用品>纸品湿巾>清风纸巾绿茶茉香3层8张9包袖珍...,苏宁,清风
1019005001,家居家装|清洁用品|纸品湿巾,舒洁卷纸3层10粒（外袋）,家居家装>清洁用品>纸品湿巾>舒洁卷纸3层10粒（外袋）,京东商城,麦德龙健康生活馆
1019005001,家居家装|清洁用品|纸品湿巾,维达喜羊羊三层卷纸173克*10卷,家居家装>清洁用品>纸品湿巾>维达喜羊羊三层卷纸173克*10卷,京东商城,麦德龙健康生活馆
1019005001,家居家装|清洁用品|纸品湿巾,爱丽思IRIS 宠物狗狗尿片/洁垫ES-44W (44*59cm) 抗菌抑臭,家居家装>清洁用品>纸品湿巾>爱丽思IRIS 宠物狗狗尿片/洁垫ES-...,京东商城,爱丽思IRIS家居旗舰店
1019005001,家居家装|清洁用品|纸品湿巾,维达喜羊羊软抽160*195MM*200抽*3包,家居家装>清洁用品>纸品湿巾>维达喜羊羊软抽160*195MM*200...,京东商城,麦德龙健康生活馆
1019005001,家居家装|清洁用品|纸品湿巾,清风原木纯品婴儿可用手帕纸家庭装6条装（18包/条）,家居家装>清洁用品>纸品湿巾>清风（APP）>清风原木纯品婴儿可用手帕纸家庭装6条装（...,京东商城,百隆家居用品专营店
1019005001,家居家装|清洁用品|纸品湿巾,CHR高级厚身餐具 刀100只,家居家装>清洁用品>纸品湿巾>喜擦擦>CHR高级厚身餐具 刀100只,京东商城,麦德龙健康生活馆
1019005001,家居家装|清洁用品|纸品湿巾,心相印优选三层无芯长卷纸100克*10卷*2袋,家居家装>清洁用品>纸品湿巾>舒洁>心相印优选三层无芯长卷纸100克*10卷...,京东商城,麦德龙健康生活馆
1019005001,家居家装|清洁用品|纸品湿巾,洁云 2层手帕纸（18包装）,家居家装>清洁用品>纸品湿巾> 洁云>洁云纸,京东商城,洁云
1019005001,家居家装|清洁用品|纸品湿巾,蔡司（ZEISS）全效单反相机数码镜头清洁套装 + 50片拭镜纸（新上市）,家居家装>清洁用品>纸品湿巾>蔡司（ZEISS）全效单反相机数码镜头清...,京东商城,蔡司光学护理产品专营店
1019005001,家居家装|清洁用品|纸品湿巾,Kleenex舒洁 精品卷筒卫生纸4粒装,家居家装>清洁用品>纸品湿巾>舒洁（Kleenex）>舒洁卫生纸,京东商城,舒洁（Kleenex）
1019005001,家居家装|清洁用品|纸品湿巾,维达天然洁肤湿巾单片装*10片 去油去汗 VW1015 EC*10包,家居家装>清洁用品>纸品湿巾>维达>维达天然洁肤湿巾单片装*10片 去油去汗...,京东商城,麦德龙健康生活馆
1019005001,家居家装|清洁用品|纸品湿巾,维达 3层卫生纸 V4028 180g*10卷,家居家装>清洁用品>纸品湿巾>维达>维达 3层卫生纸 V4028 180g*...,京东商城,金象大药房旗舰店
1019005001,家居家装|清洁用品|纸品湿巾,得宝Tempo 卫生湿巾 进口湿强纸30包盒装 欧洲原纸,家居家装>清洁用品>纸品湿巾>得宝（TASCO）>得宝Tempo 卫生湿巾 进口湿强纸30...,京东商城,优尚生活馆
1019005001,家居家装|清洁用品|纸品湿巾,泉林本色180抽3包 面巾纸 抽取式 不漂白 抽纸巾 新年纸巾 餐巾纸,家居家装>清洁用品>纸品湿巾>泉林本色>泉林本色180抽3包 面巾纸 抽取式 不...,京东商城,沁宜家居专营店
1019005001,家居家装|清洁用品|纸品湿巾,泉林本色 迷你手帕纸 不漂白 三层面巾纸 环保便携纸巾 10包1条,家居家装>清洁用品>纸品湿巾>泉林本色 迷你手帕纸 不漂白 三层面巾纸...,京东商城,沁宜家居专营店
1019005001,家居家装|清洁用品|纸品湿巾,洁柔 布艺圆点手帕10包装*4条+布艺方格手帕10包装*4条,家居家装>清洁用品>纸品湿巾>洁柔 布艺圆点手帕10包装*4条+布艺方...,京东商城,优尚生活馆
1019005001,家居家装|清洁用品|纸品湿巾,洁柔 C&S200国际版软抽200抽3包装*5提,家居家装>清洁用品>纸品湿巾>洁柔>洁柔 C&S200国际版软抽200抽3包...,京东商城,优尚生活馆
1019005001,家居家装|清洁用品|纸品湿巾,维达多用纸抹布2卷,家居家装>清洁用品>纸品湿巾>维达>维达多用纸抹布,京东商城,维达
1019005001,家居家装|清洁用品|纸品湿巾,妮飘Nepia航海王抑菌湿纸巾*30抽花色随机,家居家装>清洁用品>纸品湿巾>妮飘Nepia航海王抑菌湿纸巾*30抽花...,京东商城,妮飘旗舰店
1019005001,家居家装|清洁用品|纸品湿巾,维达商用系列230mm二层餐巾1/4折*100张,首页>家居/家装建材/厨具>清洁用品>纸品湿巾>维达商用系列230mm二层餐巾1/4...,苏宁,维达
1019005001,家居家装|清洁用品|纸品湿巾,清风 抽纸 原木纯品3层8张9包袖珍面纸,首页>家居/家装建材/厨具>清洁用品>纸品湿巾>清风抽纸原木纯品3层8张9包袖珍...,苏宁,清风
1019005001,家居家装|清洁用品|纸品湿巾,五月花冷酷3层纸手帕10抽*12包,首页>家居/家装建材/厨具>清洁用品>纸品湿巾>五月花冷酷3层纸手帕10抽*12包,苏宁,五月花
1019005001,家居家装|清洁用品|纸品湿巾,得宝迷你手帕纸特惠裝（薄荷味）36包,首页>家居/家装建材/厨具>清洁用品>纸品湿巾>得宝迷你手帕纸特惠裝（薄荷味）36包,苏宁,Tempo/得宝
1019005001,家居家装|清洁用品|纸品湿巾,清风 纸巾 蓝色风车2层10张10包迷你型纸手帕,首页>家居/家装建材/厨具>清洁用品>纸品湿巾>清风纸巾蓝色风车2层10张10包...,苏宁,清风
1019005001,家居家装|清洁用品|纸品湿巾,五月花色彩魔方系列2层纸手帕10抽*6包,首页>家居/家装建材/厨具>清洁用品>纸品湿巾>五月花色彩魔方系列2层纸手帕10抽*...,苏宁,五月花
1019005001,家居家装|清洁用品|纸品湿巾,五月花醇厚经典系列3层无芯卷纸200g*2卷,首页>家居/家装建材/厨具>清洁用品>纸品湿巾>五月花醇厚经典系列3层无芯卷纸200...,苏宁,五月花
1019005001,家居家装|清洁用品|纸品湿巾,清风 纸巾 乐逸joy colors4层8张12包古龙清香迷你型纸手帕,首页>家居/家装建材/厨具>清洁用品>纸品湿巾>清风纸巾乐逸joycolors...,苏宁,清风
1019005001,家居家装|清洁用品|纸品湿巾,妮飘 迷你纸手帕金刚4层 12包装,首页>家居/家装建材/厨具>清洁用品>纸品湿巾>妮飘迷你纸手帕金刚4层12包装,苏宁,妮飘
1019005001,家居家装|清洁用品|纸品湿巾,Tempo/得宝 美人鱼印花4层7张迷你手帕*12包得宝系列满68元立减5元,家居家装>清洁用品>纸品湿巾>得宝（TASCO）>Tempo/得宝 美人鱼印花4层7张迷你...,京东商城,利顺薄利生活馆
1019005001,家居家装|清洁用品|纸品湿巾,Tempo/得宝 香薰果味4层12包纸手帕得宝系列满68元立减5元,家居家装>清洁用品>纸品湿巾>得宝（TASCO）>Tempo/得宝 香薰果味4层12包纸手...,京东商城,利顺薄利生活馆
1019005001,家居家装|清洁用品|纸品湿巾,维达家用餐巾卫生抽纸巾超韧全国包邮3层加厚（150抽 6提 18包）V2219-6提,家居家装>清洁用品>纸品湿巾>维达>维达家用餐巾卫生抽纸巾超韧全国包邮3层加...,京东商城,百迅家居专营店
1019005001,家居家装|清洁用品|纸品湿巾,维达抽纸猫猫抽取式面巾纸餐巾纸卫生纸倍柔细滑3层100抽16提V2165-16提,家居家装>清洁用品>纸品湿巾>维达>维达抽纸猫猫抽取式面巾纸餐巾纸卫生纸倍柔...,京东商城,百迅家居专营店
1019005001,家居家装|清洁用品|纸品湿巾,Tempo得宝纸巾软抽餐巾纸4提共12包+手帕纸12包 套装 随机发货,家居家装>清洁用品>纸品湿巾>得宝（TASCO）>Tempo得宝纸巾软抽餐巾纸4提共12包...,京东商城,沁宜家居专营店
1019005001,家居家装|清洁用品|纸品湿巾,心相印商务用纸130抽盒装面巾纸整箱装-墨绿色（16提/箱）,家居家装>清洁用品>纸品湿巾>心相印>心相印商务用纸130抽盒装面巾纸整箱装-...,京东商城,振聪家居专营店
1019005001,家居家装|清洁用品|纸品湿巾,优全露尔婴儿专用手口湿巾80*2清洁润肤湿纸10片*5无香安全材质,家居家装>清洁用品>纸品湿巾>优全露尔婴儿专用手口湿巾80*2清洁润肤...,京东商城,优全护理官方旗舰店
1019005001,家居家装|清洁用品|纸品湿巾,清风 纸巾 原木纯品手帕纸6条装（10包/条）,家居家装>清洁用品>纸品湿巾>清风（APP）>清风 纸巾 原木纯品手帕纸6条装（10...,京东商城,妙多良品家居专营店
1019005001,家居家装|清洁用品|纸品湿巾,心相印抽纸 三层压花(婴用型)软抽纸巾 120抽*3包,家居家装>清洁用品>纸品湿巾>心相印>心相印抽纸 三层压花(婴用型)软抽纸巾 ...,京东商城,妮飘旗舰店
1019005001,家居家装|清洁用品|纸品湿巾,洁云 尚品120抽盒装面纸（3盒装）,家居家装>清洁用品>纸品湿巾> 洁云>洁云面纸,京东商城,洁云
1019005001,家居家装|清洁用品|纸品湿巾,优全露尔 婴儿手带盖湿巾无香无酒精食品级除菌清洁80片,家居家装>清洁用品>纸品湿巾>优全露尔 婴儿手带盖湿巾无香无酒精食品级...,京东商城,优全护理官方旗舰店
1019005001,家居家装|清洁用品|纸品湿巾,清风275米双层大卷纸整箱装商务专用（12卷/箱）BJ05AB,家居家装>清洁用品>纸品湿巾>真真>清风275米双层大卷纸整箱装商务专用（1...,京东商城,百隆家居用品专营店
1019005001,家居家装|清洁用品|纸品湿巾,【新品上架】花弄影抽纸 凡花絮事 批发包邮 200抽4提12小包,家居家装>清洁用品>纸品湿巾>花弄影>【新品上架】花弄影抽纸 凡花絮事 批发包...,京东商城,上海申欧健康护理用品店
1019005001,家居家装|清洁用品|纸品湿巾,DT9200心相印 抽纸 餐巾纸 优选系列200抽塑装面巾纸（3包/提）4提装,家居家装>清洁用品>纸品湿巾>心相印>DT9200心相印 抽纸 餐巾纸 优选系...,京东商城,振聪家居专营店
1019005001,家居家装|清洁用品|纸品湿巾,心相印可爱系列130抽*2盒装纸面巾（畅想）FT9130,家居家装>清洁用品>纸品湿巾>心相印>心相印可爱系列130抽*2盒装纸面巾（畅...,京东商城,太原唐久大卖场
1019005001,家居家装|清洁用品|纸品湿巾,心相印湿巾10p装（卫生）SA010 *3包,家居家装>清洁用品>纸品湿巾>心相印>心相印湿巾10p装（卫生）SA010 *...,京东商城,太原唐久大卖场
1019005001,家居家装|清洁用品|纸品湿巾,心相印200抽*3盒抽(茶语)H200,家居家装>清洁用品>纸品湿巾>心相印>心相印200抽*3盒抽(茶语)H200,京东商城,太原唐久大卖场
1019005001,家居家装|清洁用品|纸品湿巾,维达花之韵纸餐巾40张 *5包,家居家装>清洁用品>纸品湿巾>维达>维达花之韵纸餐巾40张 *5包,京东商城,太原唐久大卖场
1019005001,家居家装|清洁用品|纸品湿巾,维达卫生湿巾（单片装）VW1009 *3包,家居家装>清洁用品>纸品湿巾>维达>维达卫生湿巾（单片装）VW1009 *3...,京东商城,太原唐久大卖场
1019005001,家居家装|清洁用品|纸品湿巾,优全露尔婴儿清洁润肤无酒精无香料无刺激除菌湿巾80片*3包,家居家装>清洁用品>纸品湿巾>优全露尔婴儿清洁润肤无酒精无香料无刺激除...,京东商城,优全护理官方旗舰店
1019005001,家居家装|清洁用品|纸品湿巾,得宝 无味软抽90抽3包装*6提,家居家装>清洁用品>纸品湿巾>得宝>得宝 无味软抽90抽3包装*6提,京东商城,优尚生活馆
1019005001,家居家装|清洁用品|纸品湿巾,清风240抽软抽擦手纸商务专用整箱装(20包/箱)B900A,家居家装>清洁用品>纸品湿巾>清风（APP）>清风240抽软抽擦手纸商务专用整箱装(2...,京东商城,百隆家居用品专营店
1019005001,家居家装|清洁用品|纸品湿巾,妮飘 hello kitty 凯蒂纸巾组合 软抽200抽3包装*3提+手帕10包装*2条,家居家装>清洁用品>纸品湿巾>妮飘（Nepia）>妮飘 hello kitty 凯蒂纸巾组...,京东商城,优尚生活馆
1019005001,家居家装|清洁用品|纸品湿巾,泉林本色卫生抽纸巾 婴儿软抽 环保面巾纸200抽3连包,家居家装>清洁用品>纸品湿巾>泉林本色>泉林本色卫生抽纸巾 婴儿软抽 环保面巾纸...,京东商城,莱锦·摩得生活馆
1019005001,家居家装|清洁用品|纸品湿巾,泉林本色 卷筒纸 3层加厚不漂白卫生纸 面巾纸120g 纸巾 12粒*1提 卫生健康,家居家装>清洁用品>纸品湿巾>泉林本色 卷筒纸 3层加厚不漂白卫生纸 ...,京东商城,沁宜家居专营店
1019005001,家居家装|清洁用品|纸品湿巾,三仕达车内皮革养护湿巾40片,首页>家居/家装建材/厨具>清洁用品>纸品湿巾>三仕达车内皮革养护湿巾40片,苏宁,三仕达
1019005001,家居家装|清洁用品|纸品湿巾,妮飘2层100抽盒装面纸*50盒（整箱起售）,首页>家居/家装建材/厨具>清洁用品>纸品湿巾>妮飘2层100抽盒装面纸*50盒（整...,苏宁,妮飘
1019005001,家居家装|清洁用品|纸品湿巾,洁柔 抽纸 青春校园系列特惠2层200抽*3包 （小规格）,首页>家居/家装建材/厨具>清洁用品>纸品湿巾>洁柔抽纸青春校园系列特惠2层20...,苏宁,洁柔
1019005001,家居家装|清洁用品|纸品湿巾,蓝欣平板纸450g,首页>家居/家装建材/厨具>清洁用品>纸品湿巾>蓝欣平板纸450g,苏宁,蓝欣
1019005001,家居家装|清洁用品|纸品湿巾,正品75°消毒杀菌清洁湿纸巾润肤便捷独立包装批发,首页>家居/家装建材/厨具>清洁用品>纸品湿巾>正品75°消毒杀菌清洁湿纸巾润肤便捷...,苏宁,75°
1019005001,家居家装|清洁用品|纸品湿巾,洁柔 布艺方格白兰花香手帕10包装*4条+布艺圆点无香手帕10包装*4条,首页>家居/家装建材/厨具>清洁用品>纸品湿巾>洁柔布艺方格白兰花香手帕10包装*...,苏宁,洁柔
1019005001,家居家装|清洁用品|纸品湿巾,得宝tempo 经济装 迷你手帕纸 茉莉味36包餐巾纸*2组 共72小包,首页>家居/家装建材/厨具>清洁用品>纸品湿巾>得宝tempo经济装迷你手帕纸...,苏宁,得宝
1019005001,家居家装|清洁用品|纸品湿巾,三仕达玻璃除雾湿巾20片,首页>家居/家装建材/厨具>清洁用品>纸品湿巾>三仕达玻璃除雾湿巾20片,苏宁,三仕达
