1019005004,家居家装|清洁用品|驱虫驱蚊,朴森康居宝夜灯便携型超声波驱蚊器MC04,家居家装>清洁用品>驱虫用品>朴森>朴森驱蚊器,京东商城,朴森
1019005004,家居家装|清洁用品|驱虫驱蚊,恒本家用新电热蚊香片 孕妇婴儿童驱蚊片套装便携驱蚊器正品,家居家装>清洁用品>驱虫用品>维康>恒本家用新电热蚊香片 孕妇婴儿童驱蚊片套...,京东商城,恒伟家居专营店
1019005004,家居家装|清洁用品|驱虫驱蚊,可拉熊 儿童驱蚊手环 纯天然植物精油防蚊手环,家居家装>清洁用品>驱虫用品>可拉熊>可拉熊 儿童驱蚊手环 纯天然植物精油防蚊...,京东商城,英力特家居旗舰店
1019005004,家居家装|清洁用品|驱虫驱蚊,恒本宝宝驱蚊贴防蚊贴 纳米精油10盒装,家居家装>清洁用品>驱虫用品>维康>恒本宝宝驱蚊贴防蚊贴 纳米精油10盒装,京东商城,忽然一周家居生活馆
1019005004,家居家装|清洁用品|驱虫驱蚊,暖友植物驱蚊脚环(3条) 404783,家居家装>清洁用品>驱虫用品>暖友植物驱蚊脚环(3条) 404783,京东商城,悠之品家居旗舰店
1019005004,家居家装|清洁用品|驱虫驱蚊,卡秀 光摧化驱蚊灭蝇灯环保美观,家居家装>清洁用品>驱虫用品>卡秀 光摧化驱蚊灭蝇灯环保美观,京东商城,维康家居专营店
1019005004,家居家装|清洁用品|驱虫驱蚊,TO-PLAN 驱蚊贴 36枚装,所有分类>家居家纺、锅具餐具>装饰/日用>驱虫防虫>防蚊贴/防蚊环>TO-PLAN>TO-PLAN 驱蚊...,1号店,TO-PLAN
1019005004,家居家装|清洁用品|驱虫驱蚊,劲森驱蚊灯灭蚊器光触媒灭蚊灯防蚊捕虫灭蚊器 不带负离子 红色,家居家装>清洁用品>驱虫用品>劲森驱蚊灯灭蚊器光触媒灭蚊灯防蚊捕虫灭蚊...,京东商城,劲森光电旗舰店
1019005004,家居家装|清洁用品|驱虫驱蚊,黑客驱蚊电热蚊香片加热器 飞碟神风 旋转拖线更方便,家居家装>清洁用品>驱虫用品>黑客驱蚊电热蚊香片加热器 飞碟神风...,京东商城,琳霏家居
1019005004,家居家装|清洁用品|驱虫驱蚊,彩虹电热蚊香液2瓶特惠装 蚊香液/驱蚊液/驱蚊水 无香电蚊液 (5101),家居家装>清洁用品>驱虫用品>彩虹电热蚊香液2瓶特惠装 蚊香液/驱蚊液...,京东商城,彩虹集团京东官方旗舰店
1019005004,家居家装|清洁用品|驱虫驱蚊,彩虹天然植物精油驱蚊片（驱蚊夹替换装）14片*2盒,首页>家居/家装建材/厨具>生活日用>驱蚊驱虫>彩虹天然植物精油驱蚊片（驱蚊夹替换装...,苏宁,彩虹
1019005004,家居家装|清洁用品|驱虫驱蚊,维康 强效驱蚊贴 时效72小时 2片/包（10包装）,家居家装>清洁用品>驱虫用品>维康 强效驱蚊贴 时效72小时 2片/...,京东商城,奇尔汇
1019005004,家居家装|清洁用品|驱虫驱蚊,恒本 笑脸卡通防蚊贴 驱蚊手环JJJ158 5包30片装,家居家装>清洁用品>驱虫用品>维康>恒本 笑脸卡通防蚊贴 驱蚊手环JJJ15...,京东商城,来此购生活馆
1019005004,家居家装|清洁用品|驱虫驱蚊,恒本 电热蚊香液 驱蚊液 清香型 驱蚊防虫 2盒装,家居家装>清洁用品>驱虫用品>维康>恒本 电热蚊香液 驱蚊液 清香型 驱蚊防...,京东商城,圣唐家居馆
1019005004,家居家装|清洁用品|驱虫驱蚊,恒本 电热蚊香片无味型 驱蚊片 JJH01 2盒60片装,家居家装>清洁用品>驱虫用品>维康>恒本 电热蚊香片无味型 驱蚊片 JJH0...,京东商城,圣唐家居馆
1019005004,家居家装|清洁用品|驱虫驱蚊,恒本 宝宝植物精油驱蚊防蚊贴-绿色 10盒200片装,家居家装>清洁用品>驱虫用品>果维康>恒本 宝宝植物精油驱蚊防蚊贴-绿色 10...,京东商城,圣唐家居馆
1019005004,家居家装|清洁用品|驱虫驱蚊,楼龙 天虹系列 矮将军电热液体驱蚊器（0375） QS-9,家居家装>清洁用品>驱虫用品>楼龙(Loulong)>楼龙 天虹系列 矮将军电热液体驱蚊器（0...,京东商城,楼龙旗舰店
1019005004,家居家装|清洁用品|驱虫驱蚊,恒本 植物精油驱蚊贴 植物精油驱蚊贴 4盒80片装,家居家装>清洁用品>驱虫用品>维康>恒本 植物精油驱蚊贴 植物精油驱蚊贴 ...,京东商城,来此购生活馆
1019005004,家居家装|清洁用品|驱虫驱蚊,夏日安宁驱蚊贴Ⅱ（48枚） 蓝+橘+绿+玫红,首页> 家居生活> 清洁洗护> 驱虫/杀虫> 驱蚊贴> 夏日安宁驱蚊贴Ⅱ（48枚）,凡客诚品,VANCL 凡客诚品
1019005004,家居家装|清洁用品|驱虫驱蚊,恒本 新款电热蚊香液 驱蚊液无味型 2盒装,家居家装>清洁用品>驱虫用品>恒本>恒本 新款电热蚊香液 驱蚊液无味型 2盒...,京东商城,普润家居专营店
1019005004,家居家装|清洁用品|驱虫驱蚊,恒本 新款电热蚊香液 清香型 驱蚊液 3盒装,家居家装>清洁用品>驱虫用品>恒本>恒本 新款电热蚊香液 清香型 驱蚊液 3...,京东商城,普润家居专营店
1019005004,家居家装|清洁用品|驱虫驱蚊,恒本 新款笑脸卡通防蚊贴 驱蚊手环JJJ158 5包30片装,家居家装>清洁用品>驱虫用品>恒本>恒本 新款笑脸卡通防蚊贴 驱蚊手环JJJ...,京东商城,普润家居专营店
1019005004,家居家装|清洁用品|驱虫驱蚊,恒本 新款电热双用驱蚊器/蚊香器 3F3-19 JJJ-67 10盒装,家居家装>清洁用品>驱虫用品>恒本>恒本 新款电热双用驱蚊器/蚊香器 3F3...,京东商城,普润家居专营店
1019005004,家居家装|清洁用品|驱虫驱蚊,恒本 电热蚊香液 驱蚊液无味型 防蚊虫 3盒装,家居家装>清洁用品>驱虫用品>恒本>恒本 电热蚊香液 驱蚊液无味型 防蚊虫 ...,京东商城,普润家居专营店
1019005004,家居家装|清洁用品|驱虫驱蚊,恒本 新款电热蚊香液 驱蚊液 清香型 驱蚊防虫 4盒装,家居家装>清洁用品>驱虫用品>恒本>恒本 新款电热蚊香液 驱蚊液 清香型 驱...,京东商城,普润家居专营店
1019005004,家居家装|清洁用品|驱虫驱蚊,五花红香樟木条驱蚊除虫除味用品物理樟脑丸 30个装,家居家装>清洁用品>驱虫用品>五花>五花红香樟木条驱蚊除虫除味用品物理樟脑丸...,京东商城,天诺雅旗舰店
1019005004,家居家装|清洁用品|驱虫驱蚊,安速电池式风扇驱蚊套装便携式电驱蚊器移动电蚊香90天用,家居家装>清洁用品>驱虫用品>安速>安速电池式风扇驱蚊套装便携式电驱蚊器移动...,京东商城,雅冠家居
1019005004,家居家装|清洁用品|驱虫驱蚊,安速电池式风扇驱蚊套装+安速食蚊鱼替换装片 电池驱蚊无味蚊香片宝宝孕妇婴儿适用,家居家装>清洁用品>驱虫用品>安速>安速电池式风扇驱蚊套装+安速食蚊鱼替换装...,京东商城,雅冠家居
1019005004,家居家装|清洁用品|驱虫驱蚊,小而美专业驱蚊强力电子灭蚊灯 餐饮灭苍蝇飞虫 20W(适合30平以内),家居家装>清洁用品>驱虫用品>GATES>小而美专业驱蚊强力电子灭蚊灯 餐饮灭苍蝇...,京东商城,贸号专营店
1019005004,家居家装|清洁用品|驱虫驱蚊,恒本 电热蚊香片送蚊香器 无味型 驱蚊片 hb16 1盒72片装,家居家装>清洁用品>驱虫用品>维康>恒本 电热蚊香片送蚊香器 无味型 驱蚊片...,京东商城,祥韧家居生活馆
1019005004,家居家装|清洁用品|驱虫驱蚊,恒本 电热蚊香液 驱蚊液无味型 防蚊虫 3盒装,家居家装>清洁用品>驱虫用品>维康>恒本 电热蚊香液 驱蚊液无味型 防蚊虫 ...,京东商城,祥韧家居生活馆
1019005004,家居家装|清洁用品|驱虫驱蚊,恒本 植物精油驱蚊贴 植物精油驱蚊贴 10盒200片装,家居家装>清洁用品>驱虫用品>维康>恒本 植物精油驱蚊贴 植物精油驱蚊贴 1...,京东商城,祥韧家居生活馆
1019005004,家居家装|清洁用品|驱虫驱蚊,恒本 电热蚊香片无味型 驱蚊片 JJH01 10盒300片装,家居家装>清洁用品>驱虫用品>恒本>恒本 电热蚊香片无味型 驱蚊片 JJH0...,京东商城,楼龙旗舰店
1019005004,家居家装|清洁用品|驱虫驱蚊,恒本 2合1电热蚊香液送蚊香器 驱蚊片 驱蚊液 组合装 hb17（1） 3盒装,家居家装>清洁用品>驱虫用品>恒本>恒本 2合1电热蚊香液送蚊香器 驱蚊片 ...,京东商城,楼龙旗舰店
1019005004,家居家装|清洁用品|驱虫驱蚊,恒本 电热双用驱蚊器/蚊香器 3F3-19 2盒装,家居家装>清洁用品>驱虫用品>恒本>恒本 电热双用驱蚊器/蚊香器 3F3-1...,京东商城,楼龙旗舰店
1019005004,家居家装|清洁用品|驱虫驱蚊,恒本 电热蚊香液 驱蚊液无味型 防蚊虫 3盒装,家居家装>清洁用品>驱虫用品>恒本>恒本 电热蚊香液 驱蚊液无味型 防蚊虫 ...,京东商城,楼龙旗舰店
1019005004,家居家装|清洁用品|驱虫驱蚊,可拉熊 防蚊贴/防蚊手环 驱蚊贴36贴*2袋 送防蚊手环1根,首页>家居/家装建材/厨具>生活日用>驱蚊驱虫>可拉熊防蚊贴/防蚊手环驱蚊贴36...,苏宁,可拉熊
1019005004,家居家装|清洁用品|驱虫驱蚊,恒本 电热双用驱蚊器/蚊香器 3F3-19 3盒装,家居家装>清洁用品>驱虫用品>恒本>恒本 电热双用驱蚊器/蚊香器 3F3-1...,京东商城,楼龙旗舰店
1019005004,家居家装|清洁用品|驱虫驱蚊,恒本 纳米精油驱蚊贴 植物精油驱蚊贴JJF121 4盒80片装,家居家装>清洁用品>驱虫用品>恒本>恒本 纳米精油驱蚊贴 植物精油驱蚊贴JJ...,京东商城,楼龙旗舰店
1019005004,家居家装|清洁用品|驱虫驱蚊,恒本 宝宝植物精油驱蚊防蚊贴-绿色 4盒80片装,家居家装>清洁用品>驱虫用品>红兔子>恒本 宝宝植物精油驱蚊防蚊贴-绿色 4盒...,京东商城,祥韧家居生活馆
1019005004,家居家装|清洁用品|驱虫驱蚊,恒本 宝宝植物精油驱蚊防蚊贴-绿色 1盒20片装,家居家装>清洁用品>驱虫用品>红兔子>恒本 宝宝植物精油驱蚊防蚊贴-绿色 1盒...,京东商城,祥韧家居生活馆
1019005004,家居家装|清洁用品|驱虫驱蚊,安速(ARS) 驱虫手环2枚/盒驱蚊驱虫 韩国进口（安速专卖店）纯天然无毒无害 1盒装,家居家装>清洁用品>驱虫用品>安速>安速(ARS) 驱虫手环2枚/盒驱蚊驱虫...,京东商城,安速专卖店
1019005004,家居家装|清洁用品|驱虫驱蚊,安速进口驱蚊手环,家居家装>清洁用品>驱虫用品>安速>安速进口驱蚊手环,京东商城,郁金香家居专营店
1019005004,家居家装|清洁用品|驱虫驱蚊,维康竹炭 夏季必备 数字驱蚊贴 防蚊数字贴1个装 C1108,家居家装>清洁用品>驱虫用品>红兔子>维康竹炭 夏季必备 数字驱蚊贴 防蚊数字...,京东商城,祥韧家居生活馆
1019005004,家居家装|清洁用品|驱虫驱蚊,幸福家宝宝婴儿孕妇电热驱蚊液加热套装蚊香液45ml/瓶*3瓶 无味型,家居家装>清洁用品>驱虫用品>幸福家宝宝婴儿孕妇电热驱蚊液加热套装蚊香...,京东商城,幸福家
1019005004,家居家装|清洁用品|驱虫驱蚊,雷达（RADO） 欧护驱蚊液 （清新芦荟）100ml,家居家装>清洁用品>驱虫用品>雷达（RADO）>雷达驱蚊液,京东商城,雷达（RADO）
1019005004,家居家装|清洁用品|驱虫驱蚊,可拉熊 天然植物精油驱蚊贴（36片/袋）驱蚊手环组合 夏季必备/安全有效 儿童防蚊组合套装 贴1袋环1条,家居家装>清洁用品>驱虫用品>可拉熊>可拉熊 天然植物精油驱蚊贴（36片/袋）...,京东商城,英力特家居旗舰店
1019005004,家居家装|清洁用品|驱虫驱蚊,韩国BugsLock 驱蚊手环 宝宝婴儿童防蚊贴 驱蚊贴手链 粉色PINK,家居家装>清洁用品>驱虫用品>有乐>韩国BugsLock 驱蚊手环 宝宝婴儿...,京东商城,有乐家居专营店
1019005004,家居家装|清洁用品|驱虫驱蚊,维康 竹炭带天然驱蚊手环夏日防蚊手腕带手圈环保有效强效驱蚊 颜色随机C1106 - 5个装,家居家装>清洁用品>驱虫用品>维康>维康 竹炭带天然驱蚊手环夏日防蚊手腕带手...,京东商城,米悦家居专营店
1019005004,家居家装|清洁用品|驱虫驱蚊,雷达 欧护off驱蚊液100ml 防蚊液 驱蚊水 防蚊用品 成人户外用品 (金银花香型),家居家装>清洁用品>驱虫用品>雷达（RADO）>雷达 欧护off驱蚊液100ml 防蚊液...,京东商城,雅冠家居
1019005004,家居家装|清洁用品|驱虫驱蚊,恒本 植物精油防蚊手环驱蚊圈 驱蚊手镯 可调节大小 5个装,家居家装>清洁用品>驱虫用品>恒本>恒本 植物精油防蚊手环驱蚊圈 驱蚊手镯 ...,京东商城,普润家居专营店
1019005004,家居家装|清洁用品|驱虫驱蚊,恒本 KT猫无扣夜光驱蚊手环香茅草防蚊手环 驱蚊手镯 三个装,家居家装>清洁用品>驱虫用品>恒本>恒本 KT猫无扣夜光驱蚊手环香茅草防蚊手...,京东商城,普润家居专营店
1019005004,家居家装|清洁用品|驱虫驱蚊,朴森家健宝天然驱蚊贴户外专用型MR06三盒装,首页>家居/家装建材/厨具>生活日用>驱蚊驱虫>朴森家健宝天然驱蚊贴户外专用型MR0...,苏宁,
1019005004,家居家装|清洁用品|驱虫驱蚊,户清 强效驱蚊液 驱蚊酯 安全环保 含金银花 清凉舒爽 驱蚊止痒,首页>家居/家装建材/厨具>生活日用>驱蚊驱虫>户清强效驱蚊液驱蚊酯安全环保...,苏宁,
1019005004,家居家装|清洁用品|驱虫驱蚊,户清 驱蚊套装 驱蚊液2瓶 驱蚊手环6条,首页>家居/家装建材/厨具>生活日用>驱蚊驱虫>户清驱蚊套装驱蚊液2瓶驱蚊手环...,苏宁,
1019005004,家居家装|清洁用品|驱虫驱蚊,贝贝熊 驱蚊贴 防蚊贴 恒达纳米驱蚊贴36片装,家居家装>清洁用品>驱虫用品> 贝贝熊>贝贝熊 驱蚊贴 防蚊贴 恒达纳米驱蚊贴3...,京东商城,迪门子家居专营店
1019005004,家居家装|清洁用品|驱虫驱蚊,安速杀蚊鱼电池式风扇驱蚊套装90晚外出旅行携带,家居家装>清洁用品>驱虫用品> 安速>安速杀蚊鱼电池式风扇驱蚊套装90晚外出旅...,京东商城,安速专卖店
1019005004,家居家装|清洁用品|驱虫驱蚊,雷达 驱蚊液100ml 欧护OFF 成人驱蚊水 户外喷雾 防蚊液 灭蚊 效预防蚊子叮咬 (金银花香型),首页>家居/家装建材/厨具>生活日用>驱蚊驱虫>雷达驱蚊液100ml欧护OFF...,苏宁,雷达
1019005004,家居家装|清洁用品|驱虫驱蚊,植物精油驱蚊贴孕妇婴幼儿童成人驱蚊贴 安全绿色 40片,家居家装>清洁用品>驱虫用品> 其它>植物精油驱蚊贴孕妇婴幼儿童成人驱蚊贴 安...,京东商城,陶钰源家居专营店
1019005004,家居家装|清洁用品|驱虫驱蚊,超威 贝贝健驱蚊液（植物薄荷）100ml/瓶,家居家装>清洁用品>驱虫用品> 立白>超威驱蚊液,京东商城,立白
1019005004,家居家装|清洁用品|驱虫驱蚊,TO-PLAN驱蚊贴孕妇宝宝婴儿童防蚊贴成人卡通植物避蚊贴手环天然 4袋144枚,首页>家居/家装建材/厨具>生活日用>驱蚊驱虫>TO-PLAN驱蚊贴孕妇宝宝婴儿童防...,苏宁,TO-PLAN
1019005004,家居家装|清洁用品|驱虫驱蚊,蓝鲲电热蚊香液套装孕妇儿童驱蚊液电蚊香器液体蚊香灭蚊液 1器+4液套装,家居家装>清洁用品>驱虫用品> 蓝鲲>蓝鲲电热蚊香液套装孕妇儿童驱蚊液电蚊香器...,京东商城,德润家居专营店
1019005004,家居家装|清洁用品|驱虫驱蚊,继红 可爱表情六片装驱蚊贴（20套入）,家居家装>清洁用品>驱虫用品>继红>继红 可爱表情六片装驱蚊贴（20套入）,京东商城,奇尔汇
1019005004,家居家装|清洁用品|驱虫驱蚊,金盾 植物精油驱蚊贴18贴,所有分类>家居家纺、锅具餐具>装饰/日用>驱虫防虫>防蚊贴/防蚊环>金盾>金盾 植物精油驱蚊贴...,1号店,金盾
1019005004,家居家装|清洁用品|驱虫驱蚊,维康 强效驱蚊贴 时效72小时 2片1包（10包）,家居家装>清洁用品>驱虫用品>维康>维康 强效驱蚊贴 时效72小时 2片1包...,京东商城,维康家居专营店
1019005004,家居家装|清洁用品|驱虫驱蚊,魅之优品硅胶驱蚊手环 送特效驱蚊精油 *2套装,家居家装>清洁用品>驱虫用品>魅之优品>魅之优品硅胶驱蚊手环 送特效驱蚊精油 *...,京东商城,义乌仁璟家居
1019005004,家居家装|清洁用品|驱虫驱蚊,日本to-plan驱蚊贴防蚊贴36*3+宝宝婴儿防蚊手带 两条L0374/L0328,家居家装>清洁用品>驱虫用品>日本to-plan驱蚊贴防蚊贴36*3+...,京东商城,一品居家居店
1019005004,家居家装|清洁用品|驱虫驱蚊,恒本婴儿家用电热蚊香液套装 儿童驱蚊液套装便携驱蚊器,家居家装>清洁用品>驱虫用品>维康>恒本婴儿家用电热蚊香液套装 儿童驱蚊液套...,京东商城,恒伟家居专营店
1019005004,家居家装|清洁用品|驱虫驱蚊,恒本宝宝驱蚊贴防蚊贴 植物精油3盒装,家居家装>清洁用品>驱虫用品>维康>恒本宝宝驱蚊贴防蚊贴 植物精油3盒装,京东商城,忽然一周家居生活馆
1019005004,家居家装|清洁用品|驱虫驱蚊,康菲格尔长效驱蚊手环1包装 纯天然植物配方 宝宝婴儿驱蚊防蚊子用品 红色熊掌,家居家装>清洁用品>驱虫用品>康菲格尔长效驱蚊手环1包装 纯天然植物配...,京东商城,锦怡家居生活馆
1019005004,家居家装|清洁用品|驱虫驱蚊,彩虹蚊香片天然植物驱蚊草精油（5001B）（整件起售1件含80盒）,家居家装>清洁用品>驱虫用品>彩虹>彩虹蚊香片天然植物驱蚊草精油（5001B...,京东商城,彩虹集团驱虫用品专营店
1019005004,家居家装|清洁用品|驱虫驱蚊,黑客驱蚊电热蚊香液 清新无味驱蚊液 灭蚊液,家居家装>清洁用品>驱虫用品>黑客驱蚊电热蚊香液 清新无味驱蚊...,京东商城,琳霏家居
1019005004,家居家装|清洁用品|驱虫驱蚊,彩虹 便携式户外驱蚊片 (5008),家居家装>清洁用品>驱虫用品>彩虹>彩虹 便携式户外驱蚊片 (5008),京东商城,彩虹集团驱虫用品专营店
1019005004,家居家装|清洁用品|驱虫驱蚊,彩虹蚊香液套装 电蚊液+加热器 驱蚊液/驱蚊水 (Q5135),家居家装>清洁用品>驱虫用品>彩虹蚊香液套装 电蚊液+加热器 驱蚊液/...,京东商城,彩虹集团京东官方旗舰店
1019005004,家居家装|清洁用品|驱虫驱蚊,暖友home款驱蚊宝驱蚊精油30ml,首页>家居/家装建材/厨具>生活日用>驱蚊驱虫>暖友home款驱蚊宝驱蚊精油30ml,苏宁,暖友
1019005004,家居家装|清洁用品|驱虫驱蚊,暖友植物精华驱蚊脚环5条装,首页>家居/家装建材/厨具>生活日用>驱蚊驱虫>暖友植物精华驱蚊脚环5条装,苏宁,暖友
1019005004,家居家装|清洁用品|驱虫驱蚊,夏季必备驱蚊必备 可充电带电筒特大网电蚊拍,家居家装>清洁用品>驱虫用品>楼龙(Loulong)>夏季必备驱蚊必备 可充电带电筒特大网电蚊...,京东商城,普润家居专营店
1019005004,家居家装|清洁用品|驱虫驱蚊,恒本 电热蚊香液 驱蚊液无味型 hb5 4盒装,家居家装>清洁用品>驱虫用品>维康>恒本 电热蚊香液 驱蚊液无味型 hb5 ...,京东商城,圣唐家居馆
1019005004,家居家装|清洁用品|驱虫驱蚊,恒本 宝宝植物精油纳米驱蚊防蚊贴 黄色 JJF121 hb30 1盒20片,家居家装>清洁用品>驱虫用品>维康>恒本 宝宝植物精油纳米驱蚊防蚊贴 黄色 ...,京东商城,圣唐家居馆
1019005004,家居家装|清洁用品|驱虫驱蚊,恒本 宝宝植物精油纳米驱蚊防蚊贴 黄色 JJF121 hb30 2盒40片,家居家装>清洁用品>驱虫用品>维康>恒本 宝宝植物精油纳米驱蚊防蚊贴 黄色 ...,京东商城,圣唐家居馆
1019005004,家居家装|清洁用品|驱虫驱蚊,恒本 电热蚊香片送蚊香器 无味型 驱蚊片 1盒72片装,家居家装>清洁用品>驱虫用品>维康>恒本 电热蚊香片送蚊香器 无味型 驱蚊片...,京东商城,来此购生活馆
1019005004,家居家装|清洁用品|驱虫驱蚊,恒本 2合1电热蚊香液送蚊香器 驱蚊片 驱蚊液 组合装 hb17（1） 1盒装,家居家装>清洁用品>驱虫用品>维康>恒本 2合1电热蚊香液送蚊香器 驱蚊片 ...,京东商城,圣唐家居馆
1019005004,家居家装|清洁用品|驱虫驱蚊,恒本 笑脸卡通防蚊贴 驱蚊手环JJJ158 10包60片装,家居家装>清洁用品>驱虫用品>维康>恒本 笑脸卡通防蚊贴 驱蚊手环JJJ15...,京东商城,来此购生活馆
1019005004,家居家装|清洁用品|驱虫驱蚊,恒本 植物精油驱蚊贴 植物精油驱蚊贴 6盒120片装,家居家装>清洁用品>驱虫用品>维康>恒本 植物精油驱蚊贴 植物精油驱蚊贴 ...,京东商城,来此购生活馆
1019005004,家居家装|清洁用品|驱虫驱蚊,恒本 新款电热蚊香液 驱蚊液无味型 3盒装,家居家装>清洁用品>驱虫用品>恒本>恒本 新款电热蚊香液 驱蚊液无味型 3盒...,京东商城,普润家居专营店
1019005004,家居家装|清洁用品|驱虫驱蚊,恒本 新款电热蚊香液 清香型 驱蚊液 4盒装,家居家装>清洁用品>驱虫用品>恒本>恒本 新款电热蚊香液 清香型 驱蚊液 4...,京东商城,普润家居专营店
1019005004,家居家装|清洁用品|驱虫驱蚊,恒本 新款笑脸卡通防蚊贴 驱蚊手环JJJ158 10包60片装,家居家装>清洁用品>驱虫用品>恒本>恒本 新款笑脸卡通防蚊贴 驱蚊手环JJJ...,京东商城,普润家居专营店
1019005004,家居家装|清洁用品|驱虫驱蚊,恒本 电热蚊香液 驱蚊液无味型 防蚊虫 4盒装,家居家装>清洁用品>驱虫用品>恒本>恒本 电热蚊香液 驱蚊液无味型 防蚊虫 ...,京东商城,普润家居专营店
1019005004,家居家装|清洁用品|驱虫驱蚊,恒本 新款电热蚊香液 驱蚊液 清香型 驱蚊防虫 6盒装,家居家装>清洁用品>驱虫用品>恒本>恒本 新款电热蚊香液 驱蚊液 清香型 驱...,京东商城,普润家居专营店
1019005004,家居家装|清洁用品|驱虫驱蚊,皎洁电热蚊香液 宝宝无味驱蚊婴儿防蚊液无加热器,家居家装>清洁用品>驱虫用品>皎洁电热蚊香液 宝宝无味驱蚊婴儿防蚊液无...,京东商城,锦怡家居生活馆
1019005004,家居家装|清洁用品|驱虫驱蚊,比扣正品 光触媒卡通灭蚊灯 紫光驱蚊灯 5LED灯头 桔黄,家居家装>清洁用品>驱虫用品>振兴>比扣正品 光触媒卡通灭蚊灯 紫光驱蚊灯 ...,京东商城,生活演义创意家居
1019005004,家居家装|清洁用品|驱虫驱蚊,恒本 电热蚊香片无味型 驱蚊片 JJH01 3盒90片装,家居家装>清洁用品>驱虫用品>维康>恒本 电热蚊香片无味型 驱蚊片 JJH0...,京东商城,祥韧家居生活馆
1019005004,家居家装|清洁用品|驱虫驱蚊,恒本 电热蚊香液 驱蚊液 清香型 驱蚊防虫 2盒装,家居家装>清洁用品>驱虫用品>维康>恒本 电热蚊香液 驱蚊液 清香型 驱蚊防...,京东商城,祥韧家居生活馆
1019005004,家居家装|清洁用品|驱虫驱蚊,恒本 宝宝植物精油驱蚊防蚊贴-绿色 1盒20片装,家居家装>清洁用品>驱虫用品>维康>恒本 宝宝植物精油驱蚊防蚊贴-绿色 1盒...,京东商城,祥韧家居生活馆
1019005004,家居家装|清洁用品|驱虫驱蚊,恒本 2合1电热蚊香液送蚊香器 驱蚊片 驱蚊液 组合装 hb17（1） 2盒装,家居家装>清洁用品>驱虫用品>维康>恒本 2合1电热蚊香液送蚊香器 驱蚊片 ...,京东商城,祥韧家居生活馆
1019005004,家居家装|清洁用品|驱虫驱蚊,TO-PLAN 绿色香气/驱蚊手环手带 纳米 纯天然植物精油 时效240小时5条装,家居家装>清洁用品>驱虫用品>绿叶>TO-PLAN 绿色香气/驱蚊手环手带 ...,京东商城,宏宇户清
1019005004,家居家装|清洁用品|驱虫驱蚊,恒本 电热蚊香液 清香型 驱蚊液 1盒装,家居家装>清洁用品>驱虫用品>恒本>恒本 电热蚊香液 清香型 驱蚊液 1盒装,京东商城,楼龙旗舰店
1019005004,家居家装|清洁用品|驱虫驱蚊,恒本 2合1电热蚊香液送蚊香器 驱蚊片 驱蚊液 组合装 hb17（1） 4盒装,家居家装>清洁用品>驱虫用品>恒本>恒本 2合1电热蚊香液送蚊香器 驱蚊片 ...,京东商城,楼龙旗舰店
1019005004,家居家装|清洁用品|驱虫驱蚊,恒本 电热蚊香液 驱蚊液 清香型 驱蚊防虫 1盒装,家居家装>清洁用品>驱虫用品>恒本>恒本 电热蚊香液 驱蚊液 清香型 驱蚊防...,京东商城,楼龙旗舰店
1019005004,家居家装|清洁用品|驱虫驱蚊,恒本 宝宝植物精油纳米驱蚊防蚊贴 黄色 JJF121 hb30 2盒40片,家居家装>清洁用品>驱虫用品>恒本>恒本 宝宝植物精油纳米驱蚊防蚊贴 黄色 ...,京东商城,楼龙旗舰店
1019005004,家居家装|清洁用品|驱虫驱蚊,恒本 纳米精油驱蚊贴 植物精油驱蚊贴JJF121 3盒60片装,家居家装>清洁用品>驱虫用品>恒本>恒本 纳米精油驱蚊贴 植物精油驱蚊贴JJ...,京东商城,楼龙旗舰店
1019005004,家居家装|清洁用品|驱虫驱蚊,恒本 电热蚊香液 驱蚊液无味型 防蚊虫 4盒装,家居家装>清洁用品>驱虫用品>恒本>恒本 电热蚊香液 驱蚊液无味型 防蚊虫 ...,京东商城,楼龙旗舰店
1019005004,家居家装|清洁用品|驱虫驱蚊,恒本 电热蚊香液 驱蚊液无味型 防蚊虫 3盒装,家居家装>清洁用品>驱虫用品>恒本>恒本 电热蚊香液 驱蚊液无味型 防蚊虫 ...,京东商城,楼龙旗舰店
1019005004,家居家装|清洁用品|驱虫驱蚊,维康 驱蚊防蚊手环 香水味五个装随机发货,所有分类>家居家纺、锅具餐具>装饰/日用>驱虫防虫>防蚊贴/防蚊环>维康>维康 驱蚊防蚊手环 ...,1号店,维康
