1019005001,家居家装|清洁用品|纸品湿巾,可心柔可湿水200抽2层软抽,首页>家居/家装建材/厨具>清洁用品>纸品湿巾>可心柔可湿水200抽2层软抽,苏宁,可心柔
1019005001,家居家装|清洁用品|纸品湿巾,佳佰Hommy厨房湿巾10片/包（试用装）,家居家装>清洁用品>纸品湿巾>佳佰（Hommy）>佳佰厨房湿巾,京东商城,佳佰（Hommy）
1019005001,家居家装|清洁用品|纸品湿巾,清风（APP） 抽取式面纸 原木纯品150抽4包装,家居家装>清洁用品>纸品湿巾>清风（APP）>清风抽取式面纸,京东商城,清风（APP）
1019005001,家居家装|清洁用品|纸品湿巾,清风妇婴用纸婴儿可用卫生纸原木纯品卷筒卫生纸270段3提装（12卷/提）,家居家装>清洁用品>纸品湿巾>清风（APP）>清风妇婴用纸婴儿可用卫生纸原木纯品卷筒卫...,京东商城,百隆家居用品专营店
1019005001,家居家装|清洁用品|纸品湿巾,创意印花面巾纸 印花纸巾8盒装 100%原生木桨,首页>家居/家装建材/厨具>清洁用品>纸品湿巾>创意印花面巾纸印花纸巾8盒装10...,苏宁,贸号
1019005001,家居家装|清洁用品|纸品湿巾,清风（APP） 抽取式卫生纸 清香型 100抽3包,家居家装>清洁用品>纸品湿巾>清风（APP）>清风抽取式卫生纸,京东商城,清风（APP）
1019005001,家居家装|清洁用品|纸品湿巾,清风（APP） 纸手帕 原木纯品 3层18包迷你型,家居家装>清洁用品>纸品湿巾>清风（APP）>清风纸手帕,京东商城,清风（APP）
1019005001,家居家装|清洁用品|纸品湿巾,爱森 湿巾盒 外出婴儿手湿纸巾盒 便携式湿巾盒 出游必备湿巾盒,首页>家居/家装建材/厨具>清洁用品>纸品湿巾>爱森湿巾盒外出婴儿手湿纸巾盒便...,苏宁,爱森
1019005001,家居家装|清洁用品|纸品湿巾,6桶装 包邮 玫瑰缘30片桶装 洁肤湿巾 便携式车内小湿巾无酒精无香精,首页>家居/家装建材/厨具>清洁用品>纸品湿巾>6桶装包邮玫瑰缘30片桶装洁肤...,苏宁,玫瑰缘
1019005001,家居家装|清洁用品|纸品湿巾,心相印厨房用纸无芯卷纸实心卫生纸 75节/卷 （1提/共2卷）,家居家装>清洁用品>纸品湿巾>心相印>心相印厨房用纸无芯卷纸实心卫生纸 75节...,京东商城,启明家居用品店
1019005001,家居家装|清洁用品|纸品湿巾,清风 原生木浆220米2层大卷纸、大盘纸（220米/卷 12卷/箱 整箱装）开票 包邮,家居家装>清洁用品>纸品湿巾>清风 >清风 原生木浆220米2层大卷纸、大盘纸...,京东商城,清风纸业官方旗舰店
1019005001,家居家装|清洁用品|纸品湿巾,安尔乐柔网日用超薄10片LJC9110(5包装）+柔棉夜用超薄10片LJC8210（4包装,家居家装>清洁用品>纸品湿巾>安尔乐>安尔乐柔网日用超薄10片LJC9110(...,京东商城,妙多良品家居专营店
1019005001,家居家装|清洁用品|纸品湿巾,幸福阳光太阳花系列120g10卷3层平纹长卷无芯卷纸,首页>家居/家装建材/厨具>清洁用品>纸品湿巾>幸福阳光太阳花系列120g10卷3层...,苏宁,幸福阳光
1019005001,家居家装|清洁用品|纸品湿巾,幸福阳光太阳花系列200抽3包抽取式面纸,首页>家居/家装建材/厨具>清洁用品>纸品湿巾>幸福阳光太阳花系列200抽3包抽取式...,苏宁,幸福阳光
1019005001,家居家装|清洁用品|纸品湿巾,洁柔 FACE古龙水香迷你手帕 面巾纸 12粒 015187,首页>家居/家装建材/厨具>清洁用品>纸品湿巾>洁柔FACE古龙水香迷你手帕面巾...,苏宁,洁柔
1019005001,家居家装|清洁用品|纸品湿巾,洁柔FACE古龙水香迷你手帕 面巾纸18粒 014951,首页>家居/家装建材/厨具>清洁用品>纸品湿巾>洁柔FACE古龙水香迷你手帕面巾纸...,苏宁,洁柔
1019005001,家居家装|清洁用品|纸品湿巾,心相印 特柔3层卷筒卫生纸 160g/卷×10卷/提 2提装,家居家装>清洁用品>纸品湿巾>心相印>心相印 特柔3层卷筒卫生纸 160g/卷...,京东商城,妙多优品
1019005001,家居家装|清洁用品|纸品湿巾,心相印茶语系列 特柔3层 无香卷筒卫生纸 145g/卷×2卷/包 5包装,家居家装>清洁用品>纸品湿巾>心相印>心相印茶语系列 特柔3层 无香卷筒卫生纸...,京东商城,妙多优品
1019005001,家居家装|清洁用品|纸品湿巾,简家 创意家居加厚塑料卡通纸巾筒简约纸巾盒纸巾抽 K0641,家居家装>清洁用品>纸品湿巾>简家>简家 创意家居加厚塑料卡通纸巾筒简约纸巾...,京东商城,简家家居旗舰店
1019005001,家居家装|清洁用品|纸品湿巾,九佳兴男士湿巾翻盖装20片*10包,家居家装>清洁用品>纸品湿巾>九佳兴>九佳兴男士湿巾翻盖装20片*10包,京东商城,
1019005001,家居家装|清洁用品|纸品湿巾,整箱清风母婴系列原生木浆无芯卷纸 平纹长卷 3层240克/卷 10卷/提 4提/箱 包邮,家居家装>清洁用品>纸品湿巾>清风 >整箱清风母婴系列原生木浆无芯卷纸 平纹长...,京东商城,清风纸业官方旗舰店
1019005001,家居家装|清洁用品|纸品湿巾,九佳兴洁肤柔湿巾独立装10片*12 清新茉莉,家居家装>清洁用品>纸品湿巾>九佳兴>九佳兴洁肤柔湿巾独立装10片*12 清...,京东商城,
1019005001,家居家装|清洁用品|纸品湿巾,整箱清风 原生木浆MINI 3层纸手帕 手帕纸 6包/条40条/箱0.38元/包 两色混装,家居家装>清洁用品>纸品湿巾>清风 >整箱清风 原生木浆MINI 3层纸手帕 ...,京东商城,清风纸业官方旗舰店
1019005001,家居家装|清洁用品|纸品湿巾,九佳兴光盘眼镜清洁湿巾50片,家居家装>清洁用品>纸品湿巾>九佳兴>九佳兴光盘眼镜清洁湿巾50片,京东商城,
1019005001,家居家装|清洁用品|纸品湿巾,DT3100心相印 100抽 塑装面巾纸 抽纸（茶语系列）2提装（8包/提）,家居家装>清洁用品>纸品湿巾>心相印>DT3100心相印 100抽 塑装面巾纸...,京东商城,白猫健康生活馆
1019005001,家居家装|清洁用品|纸品湿巾,心相印茶语200抽软抽3提（3包/提 茶语手帕纸2条（10包/条）组合装,家居家装>清洁用品>纸品湿巾>心相印>心相印茶语200抽软抽3提（3包/提 ...,京东商城,白猫健康生活馆
1019005001,家居家装|清洁用品|纸品湿巾,心相印经典系列220抽塑装面巾纸4提装（1提3包）,家居家装>清洁用品>纸品湿巾>心相印>心相印经典系列220抽塑装面巾纸4提装（...,京东商城,
1019005001,家居家装|清洁用品|纸品湿巾,清风净润杀菌湿巾湿纸巾 10片/包x1包,家居家装>清洁用品>纸品湿巾>清风 >清风净润杀菌湿巾湿纸巾 10片/包x1包,京东商城,启明家居用品店
1019005001,家居家装|清洁用品|纸品湿巾,抽纸组合 清风纸巾 抽纸婴儿可用 原木纯品抽纸 无香 180抽 2层软包抽纸 18包纸巾,家居家装>清洁用品>纸品湿巾> 清风（kyfen）>抽纸组合 清风纸巾 抽纸婴儿可用 原木纯...,京东商城,清风纸业官方旗舰店
1019005001,家居家装|清洁用品|纸品湿巾,清风卷纸 妇婴用纸 婴儿用纸 卫生纸无芯卷纸4提（40卷 1KG/提）赠2包抽纸 全国包邮,家居家装>清洁用品>纸品湿巾>清风 >清风卷纸 妇婴用纸 婴儿用纸 卫生纸无芯...,京东商城,清风纸业官方旗舰店
1019005001,家居家装|清洁用品|纸品湿巾,整箱清风高克重超质感三层卷纸 420段/卷 卷筒卫生纸 9卷/提 6提/袋 11.2KG,家居家装>清洁用品>纸品湿巾>清风 >整箱清风高克重超质感三层卷纸 420段/...,京东商城,清风纸业官方旗舰店
1019005001,家居家装|清洁用品|纸品湿巾,品萱 Premuim抽取式面纸200抽3包 纤体装 软抽面巾纸餐巾纸,家居家装>清洁用品>纸品湿巾>品萱>品萱 Premuim抽取式面纸200抽3...,京东商城,联珏居家日用专营店
1019005001,家居家装|清洁用品|纸品湿巾,整箱清风抽纸200抽2层 小熊迷你抽纸 纸巾 面巾纸 整箱16提48包 包邮 原生木浆,家居家装>清洁用品>纸品湿巾>清风 >整箱清风抽纸200抽2层 小熊迷你抽纸 ...,京东商城,清风纸业官方旗舰店
1019005001,家居家装|清洁用品|纸品湿巾,妮飘（Nepia） 湿纸巾 黑郁薄荷 10抽/包,家居家装>清洁用品>纸品湿巾>妮飘（Nepia）>妮飘湿纸巾,京东商城,妮飘（Nepia）
1019005001,家居家装|清洁用品|纸品湿巾,洁柔c&s200抽抽取式纸面巾 抽纸 (3包装)006338,首页>家居/家装建材/厨具>清洁用品>纸品湿巾>洁柔c&s200抽抽取式纸面巾抽纸...,苏宁,洁柔
1019005001,家居家装|清洁用品|纸品湿巾,心相印特柔三层卷筒卫生纸120克/卷 10卷/提 2提装,家居家装>清洁用品>纸品湿巾>心相印>心相印特柔三层卷筒卫生纸120克/卷 1...,京东商城,恒安官方旗舰店
1019005001,家居家装|清洁用品|纸品湿巾,妮飘 纤巧装盒装面纸2层150抽*5盒 抽纸纸巾面巾纸餐巾纸 天然木浆,家居家装>清洁用品>纸品湿巾>妮飘（Nepia）>妮飘 纤巧装盒装面纸2层150抽*5盒 ...,京东商城,联珏居家日用专营店
1019005001,家居家装|清洁用品|纸品湿巾,心相印卷纸系列特柔三层卷筒纸 120g*10粒/提 卫生纸 正品保障BT710,家居家装>清洁用品>纸品湿巾>心相印>心相印卷纸系列特柔三层卷筒纸 120g*...,京东商城,天兴欣业家居专营店
1019005001,家居家装|清洁用品|纸品湿巾,V235J*6,家居家装>清洁用品>纸品湿巾>维达>V235J*6,京东商城,百迅家居专营店
1019005001,家居家装|清洁用品|纸品湿巾,心相印 优选原生自然系列 特柔三层卷筒卫生纸 10粒/提 3提装,家居家装>清洁用品>纸品湿巾>心相印>心相印 优选原生自然系列 特柔三层卷筒卫...,京东商城,百隆家居用品专营店
1019005001,家居家装|清洁用品|纸品湿巾,妮飘（Nepia） 湿巾 凯蒂 10抽/包,家居家装>清洁用品>纸品湿巾>妮飘（Nepia）>妮飘湿巾,京东商城,妮飘（Nepia）
1019005001,家居家装|清洁用品|纸品湿巾,心相印优选系列100克三层无芯长卷纸 10卷/提 4提装,家居家装>清洁用品>纸品湿巾>心相印>心相印优选系列100克三层无芯长卷纸 1...,京东商城,妙多良品家居专营店
1019005001,家居家装|清洁用品|纸品湿巾,清风迷你130抽软抽抽纸卫生纸巾餐巾纸抽纸（130抽6包）3提,家居家装>清洁用品>纸品湿巾>清风（kyfen）>清风迷你130抽软抽抽纸卫生纸巾餐巾纸抽...,京东商城,启明家居用品店
1019005001,家居家装|清洁用品|纸品湿巾,清风超大容量200抽软抽抽纸面巾纸巾 加量装 200+20抽/包 3包/提x3提,家居家装>清洁用品>纸品湿巾>清风（kyfen）>清风超大容量200抽软抽抽纸面巾纸巾 加...,京东商城,启明家居用品店
1019005001,家居家装|清洁用品|纸品湿巾,【？】清风200克超质感新韧时代 3提,家居家装>清洁用品>纸品湿巾>清风（kyfen）>【？】清风200克超质感新韧时代 ...,京东商城,启明家居用品店
1019005001,家居家装|清洁用品|纸品湿巾,【？】清风180克卷纸 5提,家居家装>清洁用品>纸品湿巾>清风（kyfen）>【？】清风180克卷纸 5提,京东商城,启明家居用品店
1019005001,家居家装|清洁用品|纸品湿巾,心相印优选140克无芯长卷卷纸实心卫生纸 140g/卷（5提/共50卷）,家居家装>清洁用品>纸品湿巾>心相印>心相印优选140克无芯长卷卷纸实心卫生纸...,京东商城,启明家居用品店
1019005001,家居家装|清洁用品|纸品湿巾,心相印厨房专用纸2卷装 2卷/1包 KT102,家居家装>清洁用品>纸品湿巾>心相印>心相印厨房专用纸2卷装 2卷/1包 KT...,京东商城,天兴欣业家居专营店
1019005001,家居家装|清洁用品|纸品湿巾,心相印薰衣草系列3层卷筒纸10卷/提 BT1110,家居家装>清洁用品>纸品湿巾>心相印>心相印薰衣草系列3层卷筒纸10卷/提 B...,京东商城,天兴欣业家居专营店
1019005001,家居家装|清洁用品|纸品湿巾,清风纸巾 抽纸 婴儿可用小花韵200抽软抽纸（3包/条）,家居家装>清洁用品>纸品湿巾>清风（APP）>清风纸巾 抽纸 婴儿可用小花韵200抽软...,京东商城,妙多良品家居专营店
1019005001,家居家装|清洁用品|纸品湿巾,汉堡纸 防油纸 加厚汉堡纸食品包装纸两种图案可选*5包,家居家装>清洁用品>纸品湿巾>禧宏（xihong）>汉堡纸 防油纸 加厚汉堡纸食品包装纸两种...,京东商城,千牛家居
1019005001,家居家装|清洁用品|纸品湿巾,维达卷纸厨房纸巾多用卫生纸巾吸油(6提12卷）V4020-6提,首页>家居/家装建材/厨具>清洁用品>纸品湿巾>维达卷纸厨房纸巾多用卫生纸巾吸油(6...,苏宁,维达
1019005001,家居家装|清洁用品|纸品湿巾,心相印茶语系列 盒装面巾纸 抽纸 200抽×3盒/提,家居家装>清洁用品>纸品湿巾>心相印>心相印茶语系列 盒装面巾纸 抽纸 200...,京东商城,妙多良品家居专营店
1019005001,家居家装|清洁用品|纸品湿巾,整箱清风 金装原木系列200克4层 卷筒卫生纸 10卷/提 6提/袋,家居家装>清洁用品>纸品湿巾>清风（kyfen）>整箱清风 金装原木系列200克4层 卷筒...,京东商城,清风纸业官方旗舰店
1019005001,家居家装|清洁用品|纸品湿巾,清风（APP） 厨房纸巾 随手擦 抽取式200抽,家居家装>清洁用品>纸品湿巾>清风（APP）>清风厨房纸巾,京东商城,清风（APP）
1019005001,家居家装|清洁用品|纸品湿巾,泉林本色百草舒180抽3连包 面巾纸 一箱装16提,家居家装>清洁用品>纸品湿巾>泉林本色>泉林本色百草舒180抽3连包 面巾纸 ...,京东商城,沁宜家居专营店
1019005001,家居家装|清洁用品|纸品湿巾,一帆 通用湿巾100片筒装 新包装,家居家装>清洁用品>纸品湿巾>一帆>一帆 通用湿巾100片筒装 新包装,京东商城,博纳清洁用品专营店
1019005001,家居家装|清洁用品|纸品湿巾,心相印抽纸 茶语系列200抽塑装软抽面巾纸 3包装 6提全国包邮,家居日用>纸品湿巾>心相印>心相印抽纸 茶语系列200抽塑装软抽面巾纸 3包装 6提全国包邮,国美电器网上商城,心相印
1019005001,家居家装|清洁用品|纸品湿巾,心相印抽纸RDT200 软抽面巾纸200抽3包装 6提组合包邮,家居日用>纸品湿巾>心相印>心相印抽纸RDT200 软抽面巾纸200抽3包装 6提组合包邮,国美电器网上商城,心相印
1019005001,家居家装|清洁用品|纸品湿巾,心相印三层卷筒纸120g*10粒/提*2提 有芯卷纸,首页>家居/家装建材/厨具>清洁用品>纸品湿巾>心相印三层卷筒纸120g*10粒/提...,苏宁,
1019005001,家居家装|清洁用品|纸品湿巾,心相印卷纸 特柔三层卫生卷筒纸温柔加倍 呵护升级140g *4卷*6提,家居家装>清洁用品>纸品湿巾>心相印>心相印卷纸 特柔三层卫生卷筒纸温柔加倍 ...,京东商城,天兴欣业家居专营店
1019005001,家居家装|清洁用品|纸品湿巾,葡萄牙原装进口 Renova 卷筒纸 檀香实用装 140节*6卷 8色选1,家居家装>清洁用品>纸品湿巾>瑞诺瓦之爱（Renova）>葡萄牙原装进口 Renova 卷筒纸 檀...,京东商城,南京迅合贸易
1019005001,家居家装|清洁用品|纸品湿巾,心相印特柔三层卷筒纸180g*10粒/提*2提 BT810,首页>家居/家装建材/厨具>清洁用品>纸品湿巾>心相印特柔三层卷筒纸180g*10粒...,苏宁,
1019005001,家居家装|清洁用品|纸品湿巾,心相印茶语系列三层特柔卷筒纸145g*2粒/提*4提 BT1402,首页>家居/家装建材/厨具>清洁用品>纸品湿巾>心相印茶语系列三层特柔卷筒纸145g...,苏宁,
1019005001,家居家装|清洁用品|纸品湿巾,蝶枫 抽取式纸巾400张纸巾 1*8/提 3层软抽 8020A,家居家装>清洁用品>纸品湿巾> 亿家喜（E.G.S）>蝶枫 抽取式纸巾400张纸巾 1*8/提...,京东商城,纸巾姑娘
1019005001,家居家装|清洁用品|纸品湿巾,清风 110g商务卷筒纸 8提装 B22AA1,家居家装>清洁用品>纸品湿巾> 清风（APP）>清风 110g商务卷筒纸 8提装 B22...,京东商城,振聪家居专营店
1019005001,家居家装|清洁用品|纸品湿巾,【家装节】心相印200软抽抽纸卫生纸巾餐巾纸抽纸（3包/1提） 整箱16提包邮,家居家装>清洁用品>纸品湿巾> 心相印>【家装节】心相印200软抽抽纸卫生纸巾餐...,京东商城,启明家居用品店
1019005001,家居家装|清洁用品|纸品湿巾,洁云卡通2层手帕纸-12包装,家居家装>清洁用品>纸品湿巾> 洁云>洁云卡通2层手帕纸-12包装,京东商城,沁宜家居专营店
1019005001,家居家装|清洁用品|纸品湿巾,洁云100抽抽取式卫生纸-单包装,家居家装>清洁用品>纸品湿巾> 洁云>洁云100抽抽取式卫生纸-单包装,京东商城,沁宜家居专营店
1019005001,家居家装|清洁用品|纸品湿巾,雅致生活100克无芯卷纸-10卷装,家居家装>清洁用品>纸品湿巾> 洁云>雅致生活100克无芯卷纸-10卷装,京东商城,沁宜家居专营店
1019005001,家居家装|清洁用品|纸品湿巾,洁云卡通150抽塑包面纸-3包装(中幅),家居家装>清洁用品>纸品湿巾> 洁云>洁云卡通150抽塑包面纸-3包装(中幅),京东商城,沁宜家居专营店
1019005001,家居家装|清洁用品|纸品湿巾,泉林本色 百草舒面巾纸/抽纸180抽*3包,首页>家居/家装建材/厨具>清洁用品>纸品湿巾>泉林本色百草舒面巾纸/抽纸180抽...,苏宁,
1019005001,家居家装|清洁用品|纸品湿巾,豪氏 洁肤卫生湿巾 10片,家居家装>清洁用品>纸品湿巾> 豪氏（howard）>豪氏 洁肤卫生湿巾 10片,京东商城,多多健康大药房旗舰店
1019005001,家居家装|清洁用品|纸品湿巾,心相印厨房纸2提+心相印抽纸DT200纸巾面巾纸1提,首页>家居/家装建材/厨具>清洁用品>纸品湿巾>心相印厨房纸2提+心相印抽纸DT20...,苏宁,心相印
1019005001,家居家装|清洁用品|纸品湿巾,顺清柔尚花卫生卷纸3层超强柔润12卷/提A0772无芯,首页>家居/家装建材/厨具>清洁用品>纸品湿巾>顺清柔尚花卫生卷纸3层超强柔润12卷...,苏宁,顺清柔
1019005001,家居家装|清洁用品|纸品湿巾,顺清柔金色BB卫生卷纸100%原生木浆超柔10卷/提A0476长卷,首页>家居/家装建材/厨具>清洁用品>纸品湿巾>顺清柔金色BB卫生卷纸100%原生木...,苏宁,顺清柔
1019005001,家居家装|清洁用品|纸品湿巾,清风卷纸婴儿可用卫生纸 蓝超质感卷纸3层314段 （10卷/提）,家居家装>清洁用品>纸品湿巾> 清风（APP）>清风卷纸婴儿可用卫生纸 蓝超质感卷纸3层...,京东商城,百隆家居用品专营店
1019005001,家居家装|清洁用品|纸品湿巾,洁云加韧250张压花卫生纸6包2提+卡通手帕纸24包2条,家居家装>清洁用品>纸品湿巾> 洁云>洁云加韧250张压花卫生纸6包2提+卡通...,京东商城,沁宜家居专营店
1019005001,家居家装|清洁用品|纸品湿巾,得宝 通爽手帕纸 长包装9片/小包*10小包/条*2条 德国得宝,家居家装>清洁用品>纸品湿巾> 得宝（TASCO）>得宝 通爽手帕纸 长包装9片/小包*10...,京东商城,优尚生活馆
1019005001,家居家装|清洁用品|纸品湿巾,整箱清风 卷筒卫生纸 几何 3层270段10卷装 一箱10提100小卷,家居家装>清洁用品>纸品湿巾> 五月花（May Flower）>整箱清风 卷筒卫生纸 几何 3层270段...,京东商城,妮飘旗舰店
1019005001,家居家装|清洁用品|纸品湿巾,妇婴专用卷纸 产妇卫生纸 小碎花三层无芯长卷纸 辣妈必备爱家女人精选VF2001,家居家装>清洁用品>纸品湿巾> 可心柔（COROU）>妇婴专用卷纸 产妇卫生纸 小碎花三层无芯...,京东商城,纸巾姑娘
1019005001,家居家装|清洁用品|纸品湿巾,泉林本色卷纸百草舒BK140克 三层卷筒卫生纸 特惠装,家居家装>清洁用品>纸品湿巾> 泉林本色>泉林本色卷纸百草舒BK140克 三层卷筒...,京东商城,金邦专营店
1019005001,家居家装|清洁用品|纸品湿巾,泉林本色软抽纸巾 不漂白无香面巾纸 抽取式餐巾纸5提 100抽*20包,首页>家居/家装建材/厨具>清洁用品>纸品湿巾>泉林本色软抽纸巾不漂白无香面巾纸...,苏宁,泉林本色
1019005001,家居家装|清洁用品|纸品湿巾,心相印优选7片丝瓜湿巾1包【赠品装，禁止单排】,家居家装>清洁用品>纸品湿巾> 心相印>心相印优选7片丝瓜湿巾1包【赠品装，禁止...,京东商城,振聪家居专营店
1019005001,家居家装|清洁用品|纸品湿巾,泉林本色活动赠品卷纸（误拍不发货）,家居家装>清洁用品>纸品湿巾> 泉林本色>泉林本色活动赠品卷纸（误拍不发货）,京东商城,金邦专营店
1019005001,家居家装|清洁用品|纸品湿巾,清风（APP） 抽取式面纸 超质感新韧时代ULTRA 3层120抽6包装,家居家装>清洁用品>纸品湿巾> 清风（APP）>清风抽取式面纸,京东商城,清风（APP）
1019005001,家居家装|清洁用品|纸品湿巾,洁云柔韧3层360节卷纸1提 +福瑞200抽面纸2提 +福瑞手帕纸2条 +纯水亲肤湿巾4包,家居家装>清洁用品>纸品湿巾> 洁云>洁云柔韧3层360节卷纸1提 +福瑞20...,京东商城,洁云专营店
1019005001,家居家装|清洁用品|纸品湿巾,洁云 尚品3层手帕纸（1条销售，共10包）,家居家装>清洁用品>纸品湿巾> 洁云>洁云 尚品3层手帕纸（1条销售，共10包...,京东商城,洁云专营店