1019002009,家居家装|灯具|氛围照明,SD灯饰 Sweetbox系列 宫廷盐灯水晶盐灯 大号s013含白炽灯泡 黄光,家居家装>灯具>氛围照明>SD>SD盐灯,京东商城,SD
1019002009,家居家装|灯具|氛围照明,Beau&Vert博慧雅 无线防水可调光LED氛围照明灯 珍珠 直径25cm白色IP44,家居家装>灯具>氛围照明>博慧雅（Beau&Vert）>博慧雅氛围照明灯,京东商城,博慧雅（Beau&Vert）
1019002009,家居家装|灯具|氛围照明,Beau&Vert博慧雅 无线防水可调光LED氛围照明灯 冰爽 33cm×28cm白色IP68,家居家装>灯具>氛围照明>博慧雅（Beau&Vert）>博慧雅氛围照明灯,京东商城,博慧雅（Beau&Vert）
1019002009,家居家装|灯具|氛围照明,娜佳水晶盐灯 塞戈维亚城堡 欧式经典 氛围照明 净化空气负离子养生盐灯 白色,家装建材>灯饰照明>氛围照明>娜佳>娜佳水晶盐灯 塞戈维亚城堡 欧式经典 氛...,京东商城,娜佳灯饰专卖店
1019002009,家居家装|灯具|氛围照明,娜佳水晶盐灯 装饰灯卧室灯客厅灯氛围照明 青花奉天瓶景德镇陶瓷灯 净化空气负离子养生盐灯,家装建材>灯饰照明>氛围照明>娜佳>娜佳水晶盐灯 装饰灯卧室灯客厅灯氛围照明...,京东商城,娜佳灯饰专卖店
1019002009,家居家装|灯具|氛围照明,娜佳水晶盐灯 装饰灯卧室灯客厅灯饰氛围照明 大号金、银宝盆 净化空气负离子养生盐灯 银色,家装建材>灯饰照明>氛围照明>娜佳>娜佳水晶盐灯 装饰灯卧室灯客厅灯饰氛围照...,京东商城,娜佳灯饰专卖店
1019002009,家居家装|灯具|氛围照明,太阳能灯串 太阳能灯 圣诞节日串灯庭院灯景观灯装饰灯 三色彩光,家居家装>灯具>氛围照明>布雷科曼（BULEKEM）>太阳能灯串 太阳能灯 圣诞节日串灯庭院灯...,京东商城,布雷科曼BULEKEM旗舰店
1019002009,家居家装|灯具|氛围照明,娜佳水晶盐灯 装饰灯卧室灯氛围照明 三叶仙草陶瓷白色 净化空气负离子养生盐灯,家装建材>灯饰照明>氛围照明>娜佳>娜佳水晶盐灯 装饰灯卧室灯氛围照明 三...,京东商城,娜佳灯饰专卖店
1019002009,家居家装|灯具|氛围照明,奥智捷 节能插电 创意暖光卧室床头灯 插座灯陶瓷小夜灯 锦上添花,家居家装>灯具>氛围照明>奥智捷 节能插电 创意暖光卧室床头灯 插...,京东商城,奥智捷智能照明旗舰店
1019002009,家居家装|灯具|氛围照明,娜佳水晶盐灯 装饰灯卧室灯客厅灯氛围照明 青花文渊阁景德镇陶瓷灯 净化空气负离子养生盐灯,家装建材>灯饰照明>氛围照明>娜佳>娜佳水晶盐灯 装饰灯卧室灯客厅灯氛围照明...,京东商城,娜佳灯饰专卖店
1019002009,家居家装|灯具|氛围照明,冠雅 机灵猫LED小夜灯节能省电 8007蓝色,家居家装>灯具>氛围照明>冠雅>冠雅 机灵猫LED小夜灯节能省电 800...,京东商城,冠雅官方旗舰店
1019002009,家居家装|灯具|氛围照明,冠雅 帅帅虎LED小夜灯节能省电 8002蓝色,家居家装>灯具>氛围照明>冠雅>冠雅 帅帅虎LED小夜灯节能省电 800...,京东商城,冠雅官方旗舰店
1019002009,家居家装|灯具|氛围照明,冠雅 可爱牛LED小夜灯节能省电 8006橙色,家居家装>灯具>氛围照明>冠雅>冠雅 可爱牛LED小夜灯节能省电 800...,京东商城,冠雅官方旗舰店
1019002009,家居家装|灯具|氛围照明,娜佳水晶盐灯 装饰灯卧室灯过道灯客厅灯氛围照明 爱丁堡 欧式经典 净化空气负离子养生盐灯 黑色,家装建材>灯饰照明>氛围照明>娜佳>娜佳水晶盐灯 装饰灯卧室灯过道灯客厅灯氛...,京东商城,娜佳灯饰专卖店
1019002009,家居家装|灯具|氛围照明,Antmin/安特明 LED灯带 5050贴片60珠软灯条 节能环保 暗槽灯带 浪漫温馨 客厅卧室氛围照明,所有分类>家居家纺、锅具餐具>家具家装>灯具灯饰>灯带>Antmin/安特明>Antmin/安特明...,1号店,Antmin/安特明
1019002009,家居家装|灯具|氛围照明,惠美加LED投光灯大功率泛光灯 10/20/30/50W 七彩光色 户外广场广告招牌投射灯 10W 正白光,家居家装>灯具>氛围照明>惠美加 >惠美加LED投光灯大功率泛光灯 10/2...,京东商城,惠美加照明
1019002009,家居家装|灯具|氛围照明,LED筒灯天花灯全套 3W 5W节能客厅、背景墙、商业氛围照明灯2.5寸 2.5寸3W透亮正白光,家装建材>灯饰照明>筒灯/射灯>曦普>LED筒灯天花灯全套 3W 5W节能客厅...,京东商城,曦普照明专营店
1019002009,家居家装|灯具|氛围照明,馨兴点灯 人体感应自动LED灯泡 BS777 红外线人体双感应球泡 E27大螺口节能灯泡 2.5瓦,家居家装>灯具>氛围照明> 馨兴点灯>馨兴点灯 人体感应自动LED灯泡 BS7...,京东商城,馨兴点灯家居旗舰店
1019002009,家居家装|灯具|氛围照明,太阳能灯 太阳能路灯 led庭院灯草坪灯景观灯装饰灯 白光或黄光 插地草坪灯-白光,家居家装>灯具>氛围照明> 布雷科曼（BULEKEM）>太阳能灯 太阳能路灯 led庭院灯草坪灯...,京东商城,布雷科曼BULEKEM旗舰店
1019002009,家居家装|灯具|氛围照明,雷士照明NVC 氛围照明NLL-S18 LED扁三线灯带（2米）黄光 灯带+一个镇流器插头,家装建材>灯饰照明>LED灯>雷士（NVC）>雷士照明NVC 氛围照明NLL-S18...,京东商城,雷士照明专卖店
1019002009,家居家装|灯具|氛围照明,海伯瑞水晶盐灯调光自然形5-7KG,家居家装>灯具>氛围照明>海伯瑞>海伯瑞水晶盐灯,京东商城,海伯瑞
1019002009,家居家装|灯具|氛围照明,Beau&Vert博慧雅 无线防水可调光LED氛围照明灯 宝石 26cm×27cm白色IP68,家居家装>灯具>氛围照明>博慧雅（Beau&Vert）>博慧雅氛围照明灯,京东商城,博慧雅（Beau&Vert）
1019002009,家居家装|灯具|氛围照明,娜佳水晶盐灯 塞戈维亚城堡 欧式经典 氛围照明 净化空气负离子养生盐灯 黑色,家装建材>灯饰照明>氛围照明>娜佳>娜佳水晶盐灯 塞戈维亚城堡 欧式经典 氛...,京东商城,娜佳灯饰专卖店
1019002009,家居家装|灯具|氛围照明,太阳能灯 地埋灯 ledt庭院灯广场灯地砖灯道路灯太阳能路灯 白光-地埋灯,家居家装>灯具>氛围照明>布雷科曼（BULEKEM）>太阳能灯 地埋灯 ledt庭院灯广场灯地...,京东商城,布雷科曼BULEKEM旗舰店
1019002009,家居家装|灯具|氛围照明,清华同方 银河5050灯带led防水超亮 60珠套管防水 LED霓虹灯 5050A,家居家纺、锅具餐具>家具/灯具>灯具>氛围照明>清华同方,1号店,清华同方
1019002009,家居家装|灯具|氛围照明,【京品年货】奥智捷 香薰灯带光源 送天然植物精油 花样年华,家居家装>灯具>氛围照明>奥智捷（Agenius）>【京品年货】奥智捷 香薰灯带光源 送天然...,京东商城,奥智捷智能照明旗舰店
1019002009,家居家装|灯具|氛围照明,鹿鸣LED灯带专用插头高品质灯带配件吊顶氛围照明,家装建材>灯饰照明>氛围照明>鹿鸣 >鹿鸣LED灯带专用插头高品质灯带配件吊顶...,京东商城,鹿鸣旗舰店
1019002009,家居家装|灯具|氛围照明,般若阁 博慧雅氛围照明灯,家居装修 > 灯具 > 吊灯 ,亚马逊(卓越网),般若阁
1019002009,家居家装|灯具|氛围照明,朗美科 7号电池LED小夜灯 光控人体感应灯装饰灯橱柜灯衣柜灯起夜灯婴儿灯 暖光,家居家装>灯具>氛围照明>朗美科（LIGHTMATES）>朗美科 7号电池LED小夜灯 光控人体感...,京东商城,朗美科官方旗舰店
1019002009,家居家装|灯具|氛围照明,惠美加 220V3528型高压灯带专用驱动器 可带10米灯带 户外装饰 情景照明,家居家装>灯具>氛围照明>惠美加 >惠美加 220V3528型高压灯带专用驱...,京东商城,
1019002009,家居家装|灯具|氛围照明,led灯带 3528超亮贴片 5050灯带led高压灯带 led软灯条 60珠/米 蓝色 5050,家居家装>灯具>氛围照明>索尔达>led灯带 3528超亮贴片 5050灯...,京东商城,索尔达官方旗舰店
1019002009,家居家装|灯具|氛围照明,澳克士圆形吸顶灯led卧室灯温馨遥控吸顶灯可调光氛围照明创意灯具XLD-Y015 15W,家装建材>灯饰照明>氛围照明> 澳克士（OKES）>澳克士圆形吸顶灯led卧室灯温馨遥控吸顶...,京东商城,澳克士旗舰店
1019002009,家居家装|灯具|氛围照明,欧普照明 卧室过道壁灯床头灯具小夜灯饰 现代简约 炫影 银色 LED光源5瓦,家居家装>灯具>氛围照明> 欧普（OPPLE）>欧普照明 卧室过道壁灯床头灯具小夜灯饰 ...,京东商城,欧普照明官方旗舰店
1019002009,家居家装|灯具|氛围照明,永武小夜灯台灯两用台灯手电筒台灯 阿波罗台灯卧室床头灯 充电 梦想号(淡黄),家居家装>灯具>氛围照明> 永武科技>永武小夜灯台灯两用台灯手电筒台灯 阿波罗...,京东商城,铁苑灯饰专营店
1019002009,家居家装|灯具|氛围照明,飞利浦 氛围照明罗绚，罗绚任意倾斜翻转变换光影色彩,首页 > 飞利浦philips灯具专场 > 氛围照明罗绚,唯品会,无
1019002009,家居家装|灯具|氛围照明,SD灯饰 Sweetbox系列 海螺小号盐灯 s006含白炽灯泡 黄光,家居家装>灯具>氛围照明>SD>SD盐灯,京东商城,SD
1019002009,家居家装|灯具|氛围照明,飞利浦 二代蜡烛灯五头69188白色,家居家装>灯具>氛围照明>飞利浦（PHILIPS）>飞利浦灯,京东商城,飞利浦（PHILIPS）
1019002009,家居家装|灯具|氛围照明,Beau&Vert博慧雅 无线防水可调光LED氛围照明灯 猫眼 18cm×18cm×20cm白色IP68,家居家装>灯具>氛围照明>博慧雅（Beau&Vert）>博慧雅氛围照明灯,京东商城,博慧雅（Beau&Vert）
1019002009,家居家装|灯具|氛围照明,娜佳水晶盐灯 黑天鹅堡 欧式经典 氛围照明净化空气负离子养生盐灯,家装建材>灯饰照明>氛围照明>娜佳>娜佳水晶盐灯 黑天鹅堡 欧式经典 氛围照...,京东商城,娜佳灯饰专卖店
1019002009,家居家装|灯具|氛围照明,爱的曼语 神奇的熊猫阿宝声控灯语音控制台灯创意智能控制灯具氛围照明小夜灯家居新年生日礼品,家居家装>灯具>氛围照明>爱的曼语>爱的曼语 神奇的熊猫阿宝声控灯语音控制台...,京东商城,淘爱创意家居旗舰店
1019002009,家居家装|灯具|氛围照明,太阳能灯 地埋灯 ledt庭院灯广场灯地砖灯道路灯太阳能路灯 1LED/黄光-地埋灯,家居家装>灯具>氛围照明> 布雷科曼（BULEKEM）>太阳能灯 地埋灯 ledt庭院灯广场灯地...,京东商城,布雷科曼BULEKEM旗舰店
1019002009,家居家装|灯具|氛围照明,开馨宝 物语极炫七彩梦幻小兔 创意小夜灯 表情小夜灯 心情夜灯 生日礼物,家居家纺、锅具餐具>家具/灯具>灯具>氛围照明>开馨宝,1号店,开馨宝
1019002009,家居家装|灯具|氛围照明,Antmin/安特明 LED蜡烛灯3W 餐厅水晶吊灯灯饰客厅氛围照明 E14小螺口尖尾高档尊贵金色,所有分类>家居家纺、锅具餐具>家具家装>灯管/灯泡>LED光源>Antmin/安特明>Antmin/安特明...,1号店,Antmin/安特明
1019002009,家居家装|灯具|氛围照明,劲森光电 工厂照明灯80W 工矿灯厂 高频无极灯,家居家纺、锅具餐具>家具/灯具>灯具>氛围照明>劲森光电,1号店,劲森光电
1019002009,家居家装|灯具|氛围照明,劲森光电 超高效高压钠灯150W 户外路灯节能光源 道路灯,家居家纺、锅具餐具>家具/灯具>灯具>氛围照明>劲森光电,1号店,劲森光电
1019002009,家居家装|灯具|氛围照明,清华同方 银河5050灯带led防水超亮 60珠套管防水 LED霓虹灯 5050A,家居家纺、锅具餐具>家具/灯具>灯具>氛围照明>清华同方,1号店,清华同方
1019002009,家居家装|灯具|氛围照明,奥智捷 节能插电 创意暖光卧室床头灯 插座灯陶瓷小夜灯 美羊羊,家居家装>灯具>氛围照明>奥智捷 节能插电 创意暖光卧室床头灯 插...,京东商城,奥智捷智能照明旗舰店
1019002009,家居家装|灯具|氛围照明,冠雅 笨笨熊LED小夜灯节能省电 8004绿色,家居家装>灯具>氛围照明>冠雅>冠雅 笨笨熊LED小夜灯节能省电 800...,京东商城,冠雅官方旗舰店
1019002009,家居家装|灯具|氛围照明,led灯带 3528超亮贴片 5050灯带led高压灯带 led软灯条 60珠/米 黄色 3528,家居家装>灯具>氛围照明>索尔达>led灯带 3528超亮贴片 5050灯...,京东商城,索尔达官方旗舰店
1019002009,家居家装|灯具|氛围照明,Antmin/安特明 LED蜡烛小灯泡 led3W水晶吊顶灯饰 E14拉尾金色节能氛围照明,所有分类>家居家纺、锅具餐具>家具家装>灯管/灯泡>LED光源>Antmin/安特明>Antmin/安特明...,1号店,Antmin/安特明
1019002009,家居家装|灯具|氛围照明,馨兴点灯 光控感应智能小蝴蝶小夜灯 可变色温白光暖白黄光家居卧室节能LED小夜灯 白色,家居家装>灯具>氛围照明>馨兴点灯>馨兴点灯 光控感应智能小蝴蝶小夜灯 可变...,京东商城,馨兴点灯家居旗舰店
1019002009,家居家装|灯具|氛围照明,海伯瑞1.5－2.5kg几何系列立方体水晶盐灯,家居家装>灯具>氛围照明>海伯瑞>海伯瑞水晶盐灯,京东商城,海伯瑞
1019002009,家居家装|灯具|氛围照明,Philips飞利浦Livingcolors II代魔灯花魁,家居家装>灯具>氛围照明>飞利浦（PHILIPS）>飞利浦代魔灯,京东商城,飞利浦（PHILIPS）
1019002009,家居家装|灯具|氛围照明,Beau&Vert博慧雅 无线防水可调光LED氛围照明灯 HELEN 13cm×13cm×19cm白色IP68,家居家装>灯具>氛围照明>博慧雅（Beau&Vert）>博慧雅氛围照明灯,京东商城,博慧雅（Beau&Vert）
1019002009,家居家装|灯具|氛围照明,娜佳水晶盐灯 索伦堡 欧式经典 氛围照明 净化空气负离子养生盐灯养生盐灯 白色,家装建材>灯饰照明>氛围照明>娜佳>娜佳水晶盐灯 索伦堡 欧式经典 氛围照明...,京东商城,娜佳灯饰专卖店
1019002009,家居家装|灯具|氛围照明,巴洛坞 原木壁灯 WL80013,家居家装>灯具>氛围照明>巴洛坞 原木壁灯 WL80013,京东商城,家居就建材家居旗舰店
1019002009,家居家装|灯具|氛围照明,娜佳水晶盐灯 装饰灯卧室灯客厅灯饰氛围照明 大号金、银宝盆 净化空气负离子养生盐灯 金色,家装建材>灯饰照明>氛围照明>娜佳>娜佳水晶盐灯 装饰灯卧室灯客厅灯饰氛围照...,京东商城,娜佳灯饰专卖店
1019002009,家居家装|灯具|氛围照明,太阳能灯串 太阳能灯 圣诞节日串灯庭院灯景观灯装饰灯 蓝光,家居家装>灯具>氛围照明>布雷科曼（BULEKEM）>太阳能灯串 太阳能灯 圣诞节日串灯庭院灯...,京东商城,布雷科曼BULEKEM旗舰店
1019002009,家居家装|灯具|氛围照明,娜佳水晶盐灯 香波城堡 欧式经典 氛围照明 净化空气负离子养生盐灯,家装建材>灯饰照明>氛围照明>娜佳>娜佳水晶盐灯 香波城堡 欧式经典 氛围照...,京东商城,娜佳灯饰国泰易达专卖店
1019002009,家居家装|灯具|氛围照明,馨兴点灯 七彩变色彩色魔幻遥控LED节能球泡灯泡B97 酒柜橱窗壁柜酒店房间客厅情景氛围照明装饰灯,家装建材>灯饰照明>氛围照明>馨兴点灯 七彩变色彩色魔幻遥控LED节能...,京东商城,馨兴点灯
1019002009,家居家装|灯具|氛围照明,奥智捷 节能插电 创意暖光卧室床头灯 插座灯陶瓷小夜灯 心心相印,家居家装>灯具>氛围照明>奥智捷 节能插电 创意暖光卧室床头灯 插...,京东商城,奥智捷智能照明旗舰店
1019002009,家居家装|灯具|氛围照明,飞利浦Philips 氛围灯Livingcolors魔灯绽放69502白色,家居家装>灯具>氛围照明>飞利浦（PHILIPS）>飞利浦魔灯,京东商城,飞利浦（PHILIPS）
1019002009,家居家装|灯具|氛围照明,惠美加 LED射灯天花灯筒灯 3W/5W 家装办公COB集成芯片光源 刀头 白光 /暖白光 3W 正白光,家居家装>灯具>氛围照明>惠美加 >惠美加 LED射灯天花灯筒灯 3W/5W...,京东商城,
1019002009,家居家装|灯具|氛围照明,艾嘉居 创意负离子静电离子球 魔法闪电球 魔幻球小夜灯 生日礼物商务礼品 4寸直径11厘米,家居家装>灯具>氛围照明>艾嘉居>艾嘉居 创意负离子静电离子球 魔法闪电球...,京东商城,艾嘉居旗舰店
1019002009,家居家装|灯具|氛围照明,趣玩 创意墙纸夜精灵LED光控小夜灯 小蜜蜂,家居家装>灯具>氛围照明>趣玩>趣玩 创意墙纸夜精灵LED光控小夜灯 小...,京东商城,趣玩生活旗舰店
1019002009,家居家装|灯具|氛围照明,嘉博视 创意LED小夜灯 光控感应壁灯 卧室床头灯 宝宝起夜灯 自动光感开关 230S 边框颜色随机 黄光,家居家装>灯具>氛围照明> 嘉博视>嘉博视 创意LED小夜灯 光控感应壁灯 ...,京东商城,嘉博视旗舰店
1019002009,家居家装|灯具|氛围照明,朗美科 创意节能电池LED小夜灯 人体感应光控灯 衣柜灯起夜灯婴儿灯 白光,家居家装>灯具>氛围照明> 朗美科（LIGHTMATES）>朗美科 创意节能电池LED小夜灯 人体感...,京东商城,朗美科官方旗舰店
1019002009,家居家装|灯具|氛围照明,海伯瑞水晶盐灯铁艺火盆系列波浪纹果盘,家居家装>灯具>氛围照明>海伯瑞>海伯瑞水晶盐灯,京东商城,海伯瑞
1019002009,家居家装|灯具|氛围照明,SD灯饰 Sweetbox系列 竹节花瓶水晶盐灯 s007含白炽灯泡 黄光,家居家装>灯具>氛围照明>SD>SD盐灯,京东商城,SD
1019002009,家居家装|灯具|氛围照明,Smart&Green智魅光韵 无线防水可调光LED氛围照明灯 世纪光岩 50cm×50cm 白色 IP68,家居家装>灯具>氛围照明>智魅光韵（Smart&Green）>智魅光韵氛围照明灯,京东商城,智魅光韵（Smart&Green）
1019002009,家居家装|灯具|氛围照明,娜佳水晶盐灯 索伦堡 欧式经典 氛围照明 净化空气负离子养生盐灯养生盐灯 黑色,家装建材>灯饰照明>氛围照明>娜佳>娜佳水晶盐灯 索伦堡 欧式经典 氛围照明...,京东商城,娜佳灯饰专卖店
1019002009,家居家装|灯具|氛围照明,SD灯饰 Sweetbox系列 花盆水晶盐灯 s005含白炽灯泡 黄光,家居家装>灯具>氛围照明>SD>SD水晶盐灯,京东商城,SD
1019002009,家居家装|灯具|氛围照明,【馨兴点灯】七彩变色彩色魔幻遥控LED节能球泡灯泡B97 酒柜橱窗壁柜酒店房间客厅情景氛围照明装饰灯,其他/商品/其他,亚马逊(卓越网),馨兴点灯
1019002009,家居家装|灯具|氛围照明,爱的曼语 变身怪杰萌可爱创意灯具 LED节能环保充电小台灯 小夜灯氛围照明 家居礼品礼物 蜘蛛侠,家居家装>灯具>氛围照明>爱的曼语>爱的曼语 变身怪杰萌可爱创意灯具 LED...,京东商城,淘爱创意家居旗舰店
1019002009,家居家装|灯具|氛围照明,太阳能灯串 太阳能灯 圣诞节日串灯庭院灯景观灯装饰灯 绿光,家居家装>灯具>氛围照明>布雷科曼（BULEKEM）>太阳能灯串 太阳能灯 圣诞节日串灯庭院灯...,京东商城,布雷科曼BULEKEM旗舰店
1019002009,家居家装|灯具|氛围照明,LOVE YOUR LIFE 创意蜗牛乌龟投影灯 星星月亮安睡灯 儿童玩具 床头灯,家居家纺、锅具餐具>家具/灯具>灯具>氛围照明>LOVE YOUR LIFE,1号店,LOVE YOUR LIFE
1019002009,家居家装|灯具|氛围照明,飞利浦Philips 氛围装饰桌灯罗曼桌灯31007白色,家居家装>灯具>氛围照明> 飞利浦（PHILIPS）>飞利浦桌灯,京东商城,飞利浦（PHILIPS）
1019002009,家居家装|灯具|氛围照明,成都市樱花节门票1张,家居家装>灯具>氛围照明>萤映雪>成都市樱花节门票1张,京东商城,萤映雪LED照明旗舰店
1019002009,家居家装|灯具|氛围照明,趣玩 橡果LED节能声控光控双重感应灯 黄光,家居家装>灯具>氛围照明>其它>趣玩 橡果LED节能声控光控双重感应灯 ...,京东商城,趣玩生活旗舰店
1019002009,家居家装|灯具|氛围照明,瑞诗诺（RSN）LED轨道灯 射灯 广告灯 12W 商业照明典范 白色壳体,家居家装>灯具>氛围照明>瑞诗诺>瑞诗诺（RSN）LED轨道灯 射灯 广告...,京东商城,瑞诗诺官方旗舰店
1019002009,家居家装|灯具|氛围照明,鹿鸣LED高品质超亮5050贴片灯带客厅餐厅卧室吊顶氛围照明,家装建材>灯饰照明>LED灯>鹿鸣 >鹿鸣LED高品质超亮5050贴片灯带客厅...,京东商城,鹿鸣旗舰店
1019002009,家居家装|灯具|氛围照明,曦普 射灯背景墙灯氛围照明led客厅商业吊顶天花灯全套led筒灯射灯35712w 臻品12w暖白光,家装建材>灯饰照明>筒灯/射灯> 曦普>曦普 射灯背景墙灯氛围照明led客厅商业...,京东商城,曦普照明专营店
1019002009,家居家装|灯具|氛围照明,昂莱/ONLLA 创意儿童节能小夜灯 LED智能红外光控感应夜灯 开心聚会情景照明夜灯 炫彩大地,家居家装>灯具>氛围照明> 昂莱（ONLLA）>昂莱/ONLLA 创意儿童节能小夜灯 L...,京东商城,昂莱LED照明旗舰店
1019002009,家居家装|灯具|氛围照明,Philips飞利浦69152幻彩LED果盘灯,家居家装>灯具>氛围照明>飞利浦（PHILIPS）>飞利浦LED果盘灯,京东商城,飞利浦（PHILIPS）
1019002009,家居家装|灯具|氛围照明,SD灯饰 Sweetbox系列 大号圆缸水晶盐灯 s011含白炽灯泡 黄光,家居家装>灯具>氛围照明>SD>SD盐灯,京东商城,SD
1019002009,家居家装|灯具|氛围照明,SD灯饰 Sweetbox系列 小号圆缸水晶盐灯 s010含白炽灯泡 黄光,家居家装>灯具>氛围照明>SD>SD盐灯,京东商城,SD
1019002009,家居家装|灯具|氛围照明,Smart&Green智魅光韵 无线防水可调光LED氛围照明灯 光华石 50cmX37cm 白色 IP68,家居家装>灯具>氛围照明>智魅光韵（Smart&Green）>智魅光韵氛围照明灯,京东商城,智魅光韵（Smart&Green）
1019002009,家居家装|灯具|氛围照明,娜佳水晶盐灯 香波城堡 欧式经典 氛围照明 净化空气负离子养生盐灯 黑色,家装建材>灯饰照明>氛围照明>娜佳>娜佳水晶盐灯 香波城堡 欧式经典 氛围照...,京东商城,娜佳灯饰专卖店
1019002009,家居家装|灯具|氛围照明,爱的曼语 变身怪杰萌可爱创意灯具 LED节能环保充电小台灯 小夜灯氛围照明 家居礼品礼物 骷髅,家居家装>灯具>氛围照明>爱的曼语>爱的曼语 变身怪杰萌可爱创意灯具 LED...,京东商城,淘爱创意家居旗舰店
1019002009,家居家装|灯具|氛围照明,爱的曼语 七彩发光跳舞音乐花小夜灯 会跳舞的音箱 创意生日礼物实用情人节礼品送女友老婆,家居家装>灯具>氛围照明>爱的曼语 七彩发光跳舞音乐花小夜灯 会跳...,京东商城,淘爱创意家居旗舰店
1019002009,家居家装|灯具|氛围照明,开馨宝 物语极炫七彩梦幻小兔 创意小夜灯 表情小夜灯 心情夜灯 生日礼物,家居家纺、锅具餐具>家具/灯具>灯具>氛围照明>开馨宝,1号店,开馨宝
1019002009,家居家装|灯具|氛围照明,娜佳水晶盐灯 装饰灯卧室灯客厅灯氛围照明 大号金、银满箱 净化空气负离子养生盐灯 金色,家装建材>灯饰照明>氛围照明>娜佳>娜佳水晶盐灯 装饰灯卧室灯客厅灯氛围照明...,京东商城,娜佳灯饰专卖店
1019002009,家居家装|灯具|氛围照明,娜佳水晶盐灯 装饰灯卧室灯客厅灯氛围照明 珐琅彩永康瓶景德镇陶瓷灯 净化空气负离子养生盐灯,家装建材>灯饰照明>氛围照明>娜佳>娜佳水晶盐灯 装饰灯卧室灯客厅灯氛围照明...,京东商城,娜佳灯饰专卖店
1019002009,家居家装|灯具|氛围照明,趣玩 创意礼品礼物怀旧吹控煤油灯 蓝色,家居家装>灯具>氛围照明> 其它>趣玩 创意礼品礼物怀旧吹控煤油灯 蓝色,京东商城,趣玩生活旗舰店
1019002009,家居家装|灯具|氛围照明,豹牌（BAOPAI）陶瓷健康睡眠灯加香薰儿童安睡灯卧室床头夜灯古典台灯BP-1302 花开富贵 豪华版LED灯,家居家装>灯具>氛围照明>豹牌（BAOPAI）>豹牌（BAOPAI）陶瓷健康睡眠灯加香薰...,京东商城,逸凡生活馆
1019002009,家居家装|灯具|氛围照明,趣玩 圣诞创意怀旧吹控煤油灯 红色,家居家装>灯具>氛围照明>其它>趣玩 圣诞创意怀旧吹控煤油灯 红色,京东商城,
1019002009,家居家装|灯具|氛围照明,晨朵LED吹控复古中式灯煤油小夜灯USB充电书房床头台灯可调亮 酒红色,家居家装>灯具>氛围照明> 晨朵>晨朵LED吹控复古中式灯煤油小夜灯USB...,京东商城,晨朵官方旗舰店
1019002009,家居家装|灯具|氛围照明,馨兴点灯 USB多功能HUB 集线器 呼吸小夜灯 浪漫小夜灯 送朋友老婆学生孩子情人礼物 橙色,家居家装>灯具>氛围照明>馨兴点灯>馨兴点灯 USB多功能HUB 集线器 呼...,京东商城,馨兴点灯家居旗舰店
1019002009,家居家装|灯具|氛围照明,Antmin/安特明 LED蜡烛灯 led3W水晶吊灯小灯泡 E14拉尾金色火焰节庆氛围照明玻璃灯罩,所有分类>家居家纺、锅具餐具>家具家装>灯管/灯泡>LED光源>Antmin/安特明>Antmin/安特明...,1号店,Antmin/安特明
1019002009,家居家装|灯具|氛围照明,飞利浦 氛围照明 艾丽丝桌灯 含11WLED光源 70999 白色,家装建材>灯饰照明>台灯> 飞利浦（PHILIPS）>飞利浦 氛围照明 艾丽丝桌灯 含11WL...,京东商城,飞利浦筑斐专卖店
