1019002016,家居家装|灯具|橱柜灯,普利亚Plio LED小射灯酒柜橱柜灯 客厅筒灯 现代简约 水晶灯玄光灯TH0142-1W 茶色暖白光,普利亚（Plio）>普利亚Plio LED小射灯酒柜橱柜灯 ...,京东商城,普利亚照明旗舰店
1019002016,家居家装|灯具|橱柜灯,翰源 LED射灯 D11 大功率3W天花灯全套5公分开孔 超亮小射灯橱柜灯(暖白光)射灯,家居建材 > LED灯 > 翰源,国美电器网上商城,
1019002016,家居家装|灯具|橱柜灯,它尚 LED水晶射灯筒灯 一体化天花灯客厅餐厅卧室过道橱柜灯 大功率全套超亮 3W 超亮 晶黄暖白光 3W,它尚>它尚 LED水晶射灯筒灯 一体化天花灯客...,京东商城,光的照明旗舰店
1019002016,家居家装|灯具|橱柜灯,诺金顿厚料拉丝银超亮大功率led天花灯7w全套服装店射灯节能筒射灯橱柜灯暖白/正白光 THD-07W001 砂银灯体发,家居家装>灯具>LED灯>诺金顿厚料拉丝银超亮大功率led天花灯7...,京东商城,诺金顿灯饰旗舰店
1019002016,家居家装|灯具|橱柜灯,优弗朗斯大功率7W天花灯全套 LED筒灯射灯 超亮小射灯橱柜灯 客厅天花灯具灯饰02006 正白奢华版 7W,家装建材>灯饰照明>LED灯>优弗朗斯大功率7W天花灯全套 LED筒灯...,京东商城,沪能LED灯具旗舰店
1019002016,家居家装|灯具|橱柜灯,Dooda多达 人体感应灯 LED橱柜灯 (橙色),厨具,亚马逊(卓越网),Dooda
1019002016,家居家装|灯具|橱柜灯,宏光 led射灯天花灯1W全套 led背景墙灯橱柜灯酒柜灯 TH1W221,家居装修/类别/灯具/光源/LED灯,亚马逊(卓越网),宏光
1019002016,家居家装|灯具|橱柜灯,宏光 T天花射灯全套 背景墙灯橱柜灯酒柜灯TH6222 高光 含变压器、12v35w光源,家居装修/类别/灯具/家居功能照明/射灯,亚马逊(卓越网),宏光
1019002016,家居家装|灯具|橱柜灯,Koluz LED 人体自动双感应橱柜灯生日礼物女生女生日悦儿0425太空银,家居装修 > 园艺、花束、庭院 > 鲜花、绿植 > 室内植物 > 迷你盆栽 ,亚马逊(卓越网),KOLUZ
1019002016,家居家装|灯具|橱柜灯,BEYOND 碧阳1.3W 暖白 LED 橱柜灯,家居装修 > 灯具 > 光源 > LED灯,亚马逊(卓越网),上海碧阳光电有限公司
1019002016,家居家装|灯具|橱柜灯,光一 水滴人体感应灯小夜灯led光控节能灯创意床头灯电池橱柜灯楼道灯 白色白光,光一 >光一 水滴人体感应灯小夜灯led光控节能...,京东商城,贝诺家居专营店
1019002016,家居家装|灯具|橱柜灯,人体感应灯节能创意光控led小夜灯床头灯电池橱柜灯 趴趴熊小夜灯 创意礼物送男女朋友儿童 橙色,礼品箱包>礼品>创意礼品>言周>人体感应灯节能创意光控led小夜灯床头灯...,京东商城,创意礼品商城
1019002016,家居家装|灯具|橱柜灯,莱威光电LED灯带灯条汽车灯装饰灯鱼缸灯衣柜灯橱柜灯车灯防水 红光,家装建材>灯饰照明>LED灯>莱威光电LED灯带灯条汽车灯装饰灯鱼缸灯...,京东商城,莱威光电官方直营店
1019002016,家居家装|灯具|橱柜灯,youful 优芬 3LED车内灯尾箱灯 拍拍灯应急灯小夜灯墙壁橱柜灯,家居装修 > 灯具 > 吸顶灯,亚马逊(卓越网),youful 优芬
1019002016,家居家装|灯具|橱柜灯,简家 创意人体感应LED光控小夜灯节能橱柜灯装饰拍拍灯K1742 暖光,家居家装>生活日用>浴室用品>简家 创意人体感应LED光控小夜灯节能橱...,京东商城,简家家居旗舰店
1019002016,家居家装|灯具|橱柜灯,趣玩礼品 LED红外人体感应小夜灯/橱柜灯,首页 > 宝宝用品 > 小家电 > 灯具/照明 > 趣玩礼品 LED红外人体感应小夜灯/橱柜灯,贝备网,趣玩
1019002016,家居家装|灯具|橱柜灯,璞高LED射灯吊顶天花灯具220V橱柜灯客厅灯泡全套超小5公分超亮2075LED射灯 黑色3W 正白孔,家装建材 > 灯具照明 > 射灯 > 商品详情,当当网,璞高
1019002016,家居家装|灯具|橱柜灯,普利亚Plio LED小射灯酒柜橱柜灯 客厅筒灯 现代简约 水晶灯玄光灯TH0142-1W 茶色正白光,普利亚（Plio）>普利亚Plio LED小射灯酒柜橱柜灯 ...,京东商城,普利亚照明旗舰店
1019002016,家居家装|灯具|橱柜灯,宏光 天花射灯全套 背景墙灯橱柜灯酒柜灯TH6311大三元 高光 含变压器、12v35w光源,家居装修/类别/灯具/家居功能照明/射灯,亚马逊(卓越网),宏光
1019002016,家居家装|灯具|橱柜灯,宏光 TT防雾天花射灯全套 背景墙灯橱柜灯酒柜灯TH1230G 高光 含变压器、12v35w光源,家居装修/类别/灯具/家居功能照明/射灯,亚马逊(卓越网),宏光
1019002016,家居家装|灯具|橱柜灯,Fontainebleu 枫丹白露 LED3W天花灯射灯电视墙背景墙射灯橱柜灯led筒灯Q1,家居装修 > 灯具 > 光源 > LED灯,亚马逊(卓越网),Fontainebleu 枫丹白露
1019002016,家居家装|灯具|橱柜灯,蔚然吸顶LED人体感应灯光控节能便携小夜灯衣柜橱柜灯电池实用家居 新奇特创意灯具送老师朋友 暖光,礼品箱包>礼品>创意礼品>蔚然吸顶LED人体感应灯光控节能便携小夜...,京东商城,蔚然上品
1019002016,家居家装|灯具|橱柜灯,欣兰雅舍 创意节能LED衣柜灯 超薄橱柜灯 明装柜底灯 高亮装饰灯 按按灯 镜面灰,家装建材>灯饰照明>氛围照明>欣兰雅舍（xlys）>欣兰雅舍 创意节能LED衣柜灯 超薄橱柜...,京东商城,欣兰雅舍旗舰店
1019002016,家居家装|灯具|橱柜灯,翰源 迷你LED射灯大功率一体天花灯 酒柜灯橱柜灯纽扣灯小射灯全套,所有分类 > 家居生活、运动保健 > 家具家装 > 照明灯具 > 翰源,1号店,
1019002016,家居家装|灯具|橱柜灯,普利亚Plio LED小射灯酒柜橱柜灯 客厅筒灯 现代简约 水晶灯玄光灯TH0142-1W 浅黄色暖白光,普利亚（Plio）>普利亚Plio LED小射灯酒柜橱柜灯 ...,京东商城,普利亚照明旗舰店
1019002016,家居家装|灯具|橱柜灯,它尚 LED水晶射灯筒灯 一体化天花灯客厅餐厅卧室过道橱柜灯 大功率全套超亮 3W 超亮 透明正白光 3W,它尚>它尚 LED水晶射灯筒灯 一体化天花灯客...,京东商城,光的照明旗舰店
1019002016,家居家装|灯具|橱柜灯,诺金顿拉丝银大功率一体化led天花灯5W全套背景墙灯橱柜灯展柜灯家居工程照明灯具 THD-05W001 砂银灯体发光?,家居家装>灯具>LED灯>诺金顿拉丝银大功率一体化led天花灯5W...,京东商城,诺金顿灯饰旗舰店
1019002016,家居家装|灯具|橱柜灯,璞高 LED射灯一体化LED天花灯3W全套背景墙射灯橱柜灯,所有分类>家居家纺、锅具餐具>家具家装>灯具灯饰>射灯>璞高>璞高 LED射灯一体...,1号店,璞高
1019002016,家居家装|灯具|橱柜灯,得利来DOLILO 明装LED射灯酒柜灯背景灯衣柜灯橱柜灯 明装小扣3W 暖光,得利来（DOLILO）>得利来DOLILO 明装LED射灯酒柜灯...,京东商城,得利来LED灯饰官方旗舰店
1019002016,家居家装|灯具|橱柜灯,欣兰雅舍 创意节能LED衣柜灯 超薄橱柜灯 明装柜底灯 高亮装饰灯 按按灯 浅灰,家装建材>灯饰照明>氛围照明>欣兰雅舍（xlys）>欣兰雅舍 创意节能LED衣柜灯 超薄橱柜...,京东商城,欣兰雅舍旗舰店
1019002016,家居家装|灯具|橱柜灯,蔚然吸顶LED人体感应灯光控节能便携小夜灯衣柜橱柜灯电池实用家居 新奇特创意灯具送老师朋友 白光,礼品箱包>礼品>创意礼品>蔚然吸顶LED人体感应灯光控节能便携小夜...,京东商城,蔚然上品
1019002016,家居家装|灯具|橱柜灯,【工厂直销】翰源HSD911 LED射灯 大功率3W天花灯开孔5.3公分 小射灯橱柜灯,家具家装 > 灯具照明 > 射灯,当当网,翰源
1019002016,家居家装|灯具|橱柜灯,简家 创意人体感应LED光控小夜灯节能橱柜灯装饰拍拍灯K1742 白光,首页>家居/家装建材/厨具>生活日用>装饰用品>简家创意人体感应LED光控小夜灯节...,苏宁,简家
1019002016,家居家装|灯具|橱柜灯,璞高LED射灯一体化LED天花灯3W全套背景墙小射灯橱柜灯牛眼灯(银色正白光 开孔5-5.5厘米),家具建材>LED灯>璞高>璞高LED射灯一体化LED天花灯3W全套背景墙小射灯橱柜灯牛眼灯(银色正白光 开孔5-5.5厘米),国美电器网上商城,西门子璞高专营店
1019002016,家居家装|灯具|橱柜灯,萱品 电池LED人体感应灯光控灯 床头小夜灯 创意节能衣橱柜灯 楼道灯 墨绿色黄光,母婴>洗护用品>护理用品>萱品>萱品 电池LED人体感应灯光控灯 床头...,京东商城,贝贝炫品
1019002016,家居家装|灯具|橱柜灯,电池LED人体感应灯光控宝宝小夜灯节能橱柜灯楼道灯应急灯 土豪金,家装建材>灯饰照明>手电筒/应急灯>中德标致>电池LED人体感应灯光控宝宝小夜灯节能橱...,京东商城,云筑厨卫专营店
1019002016,家居家装|灯具|橱柜灯,欣兰雅舍XINLANYASHE LED节能创意小夜灯 光控人体感应灯电池灯 衣柜橱柜灯,所有分类>家居家纺、锅具餐具>家具家装>灯具灯饰>小夜灯>欣兰雅舍XINLANYASHE,1号店,小夜灯
1019002016,家居家装|灯具|橱柜灯,翰源 LED射灯 大功率3W天花灯全套5公分开孔 超亮小射灯橱柜灯,所有分类 > 家居生活、运动保健 > 家具家装 > 照明灯具 > 翰源,1号店,
1019002016,家居家装|灯具|橱柜灯,SamvoL山沃照明1*1W*2WLED壁灯LED壁灯 灯泡 橱柜灯 柜台灯绚丽 节能,当当网 > 家具装饰 > 灯具照明 > 壁灯,当当网,Samvol山沃
1019002016,家居家装|灯具|橱柜灯,普利亚Plio LED小射灯酒柜橱柜灯 客厅筒灯 现代简约 水晶灯玄光灯TH0142-1W 浅黄色正白光,普利亚（Plio）>普利亚Plio LED小射灯酒柜橱柜灯 ...,京东商城,普利亚照明旗舰店
1019002016,家居家装|灯具|橱柜灯,翰源 LED射灯 D11 大功率3W天花灯全套5公分开孔 超亮小射灯橱柜灯(正白光)射灯,家居建材 > LED灯 > 翰源,国美电器网上商城,
1019002016,家居家装|灯具|橱柜灯,FREE 福瑞 橱柜配件/橱柜五金/橱柜灯/三角灯 含变压器,家居装修 > 灯具 > 家居功能照明 > 筒灯,亚马逊(卓越网),FREE 福瑞
1019002016,家居家装|灯具|橱柜灯,光一 水滴人体感应灯小夜灯led光控节能灯创意床头灯电池橱柜灯楼道灯 粉色黄光,光一 >光一 水滴人体感应灯小夜灯led光控节能...,京东商城,贝诺家居专营店
1019002016,家居家装|灯具|橱柜灯,得利来DOLILO 明装LED射灯酒柜灯背景灯衣柜灯橱柜灯 明装小扣3W 白光,得利来（DOLILO）>得利来DOLILO 明装LED射灯酒柜灯...,京东商城,得利来LED灯饰官方旗舰店
1019002016,家居家装|灯具|橱柜灯,欣兰雅舍 创意节能LED衣柜灯 超薄橱柜灯 明装柜底灯 高亮装饰灯 按按灯 古铜色,家装建材>灯饰照明>氛围照明>欣兰雅舍（xlys）>欣兰雅舍 创意节能LED衣柜灯 超薄橱柜...,京东商城,欣兰雅舍旗舰店
1019002016,家居家装|灯具|橱柜灯,简家 创意人体感应LED光控小夜灯节能橱柜灯拍拍灯K1742 暖光,首页>家居/家装建材/厨具>生活日用>装饰用品>简家创意人体感应LED光控小夜灯节...,苏宁,简家
1019002016,家居家装|灯具|橱柜灯,VNC LED筒灯3W天花灯全套小开孔 超亮小射灯橱柜灯高效节能 02B-3(正白光),家装建材>LED灯>VNC>VNC LED筒灯3W天花灯全套小开孔 超亮小射灯橱柜灯高效节能 02B-3(正白光),国美电器网上商城,VNC LED国际照明旗舰店
1019002016,家居家装|灯具|橱柜灯,人体感应灯小夜灯橱柜灯楼道衣柜led光控节能创意床头灯电池,电脑办公 > 办公用品 > 其它 > 商品详情,当当网,趣玩
1019002016,家居家装|灯具|橱柜灯,萱品 电池LED人体感应灯光控灯 床头小夜灯 创意节能衣橱柜灯 楼道灯 乳白色黄光,母婴>洗护用品>护理用品>萱品>萱品 电池LED人体感应灯光控灯 床头...,京东商城,贝贝炫品
1019002016,家居家装|灯具|橱柜灯,萱品 电池LED人体感应灯光控灯 床头小夜灯 创意节能衣橱柜灯 楼道灯 枣红色白光,母婴>洗护用品>护理用品>萱品>萱品 电池LED人体感应灯光控灯 床头...,京东商城,贝贝炫品
1019002016,家居家装|灯具|橱柜灯,得利来 新款LED柜底灯 橱柜灯 衣柜工作灯 挥手即亮 手扫感应 半米长 白光,首页>家居/家装建材/厨具>家居照明>射灯>得利来新款LED柜底灯橱柜灯衣...,苏宁,
1019002016,家居家装|灯具|橱柜灯,水滴人体感应灯led小夜灯 光控节能创意床头灯电池楼道橱柜灯宝宝婴儿喂奶灯包邮(浣熊款粉色 白光),母婴用品 玩具>情景玩具>光一情景玩具>水滴人体感应灯led小夜灯 光控节能创意床头灯电池楼道橱柜灯宝宝婴儿喂奶灯包邮(浣熊款粉色 白光),国美电器网上商城,光一情景玩具
1019002016,家居家装|灯具|橱柜灯,普利亚Plio LED小射灯酒柜橱柜灯 客厅筒灯 现代简约 水晶灯玄光灯TH0142-1W 深蓝色暖白光,普利亚（Plio）>普利亚Plio LED小射灯酒柜橱柜灯 ...,京东商城,普利亚照明旗舰店
1019002016,家居家装|灯具|橱柜灯,普利亚Plio LED射灯酒柜橱柜灯3w背景墙筒灯全套客厅灯卧室天花灯TH0108-小3W 正白光,普利亚（Plio）>普利亚Plio LED射灯酒柜橱柜灯3w...,京东商城,普利亚照明旗舰店
1019002016,家居家装|灯具|橱柜灯,它尚 LED水晶射灯筒灯 一体化天花灯客厅餐厅卧室过道橱柜灯 大功率全套超亮 3W 超亮 透明暖白光 3W,它尚>它尚 LED水晶射灯筒灯 一体化天花灯客...,京东商城,光的照明旗舰店
1019002016,家居家装|灯具|橱柜灯,诺金顿拉丝银大功率一体化led天花灯5W全套背景墙灯橱柜灯展柜灯家居工程照明灯具 THD-05W001 砂银灯体发光?,家居家装>灯具>LED灯>诺金顿拉丝银大功率一体化led天花灯5W...,京东商城,诺金顿灯饰旗舰店
1019002016,家居家装|灯具|橱柜灯,欣兰雅舍 创意节能LED衣柜灯 超薄橱柜灯 明装柜底灯 高亮装饰灯 按按灯 磨砂黑,家装建材>灯饰照明>氛围照明>欣兰雅舍（xlys）>欣兰雅舍 创意节能LED衣柜灯 超薄橱柜...,京东商城,欣兰雅舍旗舰店
1019002016,家居家装|灯具|橱柜灯,warsun 电池LED人体感应灯 光控宝宝小夜灯节能橱柜灯楼道灯 正品 苹果银,运动健康>户外装备>户外照明>沃尔森（Warsun）>warsun 电池LED人体感应灯 光控...,京东商城,warsun旗舰店
1019002016,家居家装|灯具|橱柜灯,妙朗 大功率3WLED射灯全套LED天花灯牛眼灯橱柜灯节能灯 INT-01-02(暖白光),家装建材>LED灯>妙朗>妙朗 大功率3WLED射灯全套LED天花灯牛眼灯橱柜灯节能灯 INT-01-02(暖白光),国美电器网上商城,妙朗照明旗舰店
1019002016,家居家装|灯具|橱柜灯,PG 璞高 LED一体化天花灯客厅餐厅浴室厨房吊顶防雾孔灯橱柜灯迷你款 银色3W白光 孔57-62mm,家居装修 > 灯具 > 光源 > LED灯,亚马逊(卓越网),PG 璞高
1019002016,家居家装|灯具|橱柜灯,朗美科 Q型光控小夜灯 LED节能创意人体感应光控橱柜灯 NL020 白色白光,首页>家居/家装建材/厨具>家居照明>装饰灯>朗美科Q型光控小夜灯LED节能创...,苏宁,朗美科
1019002016,家居家装|灯具|橱柜灯,1*1W*2W壁灯LED壁灯大功率 LED灯泡 橱柜灯 柜台灯节能 绚丽,当当网 > 家具装饰 > 灯具照明 > 壁灯,当当网,Samvol山沃
1019002016,家居家装|灯具|橱柜灯,普利亚Plio LED小射灯酒柜橱柜灯 客厅筒灯 现代简约 水晶灯玄光灯TH0142-1W 深蓝色正白光,普利亚（Plio）>普利亚Plio LED小射灯酒柜橱柜灯 ...,京东商城,普利亚照明旗舰店
1019002016,家居家装|灯具|橱柜灯,宏光 天花射灯全套 背景墙灯橱柜灯酒柜灯 TH1236 含变压器、12v35w光源,家居装修/类别/灯具/家居功能照明/射灯,亚马逊(卓越网),宏光
1019002016,家居家装|灯具|橱柜灯,水滴人体感应灯led小夜灯 光控节能创意床头灯电池楼道橱柜灯宝宝婴儿喂奶灯包邮(浣熊款白色 黄光),母婴用品 玩具>情景玩具>光一>水滴人体感应灯led小夜灯 光控节能创意床头灯电池楼道橱柜灯宝宝婴儿喂奶灯包邮(浣熊款白色 黄光),国美电器网上商城,惠州光一商贸专营店
1019002016,家居家装|灯具|橱柜灯,warsun 沃尔森电池LED人体感应灯 光控宝宝小夜灯节能橱柜灯楼道灯,所有分类>运动户外>户外装备>户外照明>其他灯>warsun>warsun 沃尔森...,1号店,warsun
1019002016,家居家装|灯具|橱柜灯,璞高 LED射灯一体化LED天花灯3W全套背景墙小射灯橱柜灯牛眼灯,所有分类>家居家纺、锅具餐具>家具家装>灯具灯饰>射灯>璞高>璞高 LED射灯一体...,1号店,璞高
1019002016,家居家装|灯具|橱柜灯,萱品 电池LED人体感应灯光控灯 床头小夜灯 创意节能衣橱柜灯 楼道灯 墨绿色白光,母婴>洗护用品>护理用品>萱品>萱品 电池LED人体感应灯光控灯 床头...,京东商城,贝贝炫品
1019002016,家居家装|灯具|橱柜灯,普利亚Plio LED射灯酒柜橱柜灯3w背景墙筒灯全套客厅灯卧室天花灯TH0108-小3W,首页>家居/家装建材/厨具>家居照明>射灯>普利亚PlioLED射灯酒柜橱柜灯...,苏宁,普利亚
1019002016,家居家装|灯具|橱柜灯,麦辉LED射灯大功率3W天花灯全套开孔5.6公分橱柜灯MW5015 暖白光,麦辉（MAWUI）>麦辉LED射灯大功率3W天花灯全套开孔5...,京东商城,麦辉照明旗舰店
1019002016,家居家装|灯具|橱柜灯,多达 人体感应灯小夜灯橱柜灯 楼道衣柜led红外光控节能灯创意床头灯 橙色,家装建材>灯饰照明>LED灯> dooda>多达 人体感应灯小夜灯橱柜灯 楼道衣柜l...,京东商城,比高商城
1019002016,家居家装|灯具|橱柜灯,open eyes LED柜内灯 LED橱柜灯 LED灯 DC12V 触摸开关 东莞五丰电子,,亚马逊(卓越网),open eyes
1019002016,家居家装|灯具|橱柜灯,LED1*1W*2W壁灯LED壁灯大功率 LED灯泡 橱柜灯 柜台灯LED灯具,当当网 > 家具装饰 > 灯具照明 > 壁灯,当当网,Samvol山沃
1019002016,家居家装|灯具|橱柜灯,普利亚Plio LED小射灯酒柜橱柜灯 客厅筒灯 现代简约 水晶灯玄光灯TH0142-1W 透明白正白光,普利亚（Plio）>普利亚Plio LED小射灯酒柜橱柜灯 ...,京东商城,普利亚照明旗舰店
1019002016,家居家装|灯具|橱柜灯,妙朗 大功率3W LED射灯全套 LED天花灯牛眼灯橱柜灯节能灯 INT-01-02 正白光,妙朗（MIORON）>妙朗 大功率3W LED射灯全套 LED...,京东商城,妙朗家居旗舰店
1019002016,家居家装|灯具|橱柜灯,普利亚Plio LED射灯酒柜橱柜灯3w背景墙筒灯全套客厅灯卧室天花灯TH0108-小3W 正白光,普利亚（Plio）>普利亚Plio LED射灯酒柜橱柜灯3w...,京东商城,普利亚照明旗舰店
1019002016,家居家装|灯具|橱柜灯,吸顶LED人体感应灯光控节能便携小夜灯衣柜橱柜灯电池实用家居 送父母朋友创意实用礼物 白光,礼品箱包>礼品>创意礼品>言周>吸顶LED人体感应灯光控节能便携小夜灯衣...,京东商城,创意礼品商城
1019002016,家居家装|灯具|橱柜灯,水滴人体感应灯小夜灯led光控节能灯创意床头灯橱柜灯楼道灯门灯 送家人男女朋友礼物 白壳/黄光,礼品箱包>礼品>创意礼品>水滴人体感应灯小夜灯led光控节能灯创意...,京东商城,创意礼品商城
1019002016,家居家装|灯具|橱柜灯,沃尔森人体感应灯 创意小夜灯 床头灯 光控衣柜灯 橱柜灯 壁灯 楼道灯 苹果银,首页>运动户外>户外装备>户外照明/仪表>沃尔森人体感应灯创意小夜灯床头灯...,苏宁,沃尔森Warsun
1019002016,家居家装|灯具|橱柜灯,璞高 LED一体化天花灯客厅餐厅浴室厨房吊顶防雾孔灯橱柜灯迷你款,所有分类>家居家纺、锅具餐具>家具家装>灯具灯饰>射灯>璞高>璞高 LED一体化天...,1号店,璞高
1019002016,家居家装|灯具|橱柜灯,朗美科 7号电池LED小夜灯 光控人体感应灯装饰灯橱柜灯衣柜灯起夜灯婴儿灯 暖光,家居家装>灯具>氛围照明>朗美科（LIGHTMATES）>朗美科 7号电池LED小夜灯 光控人体感...,京东商城,朗美科官方旗舰店
1019002016,家居家装|灯具|橱柜灯,warsun 电池LED人体感应灯 光控宝宝小夜灯节能橱柜灯楼道灯 正品 土豪金,运动健康>户外装备>户外照明>沃尔森（Warsun）>warsun 电池LED人体感应灯 光控...,京东商城,warsun旗舰店
1019002016,家居家装|灯具|橱柜灯,得利来 新款LED柜底灯 橱柜灯 衣柜工作灯 挥手即亮 手扫感应 一米长 白光,首页>家居/家装建材/厨具>家居照明>射灯>得利来新款LED柜底灯橱柜灯衣...,苏宁,
1019002016,家居家装|灯具|橱柜灯,璞高LED一体化天花灯客厅餐厅浴室厨房吊顶防雾孔灯橱柜灯迷你款 银色3W正白光,家装建材>灯饰照明>筒灯/射灯> 璞高>璞高LED一体化天花灯客厅餐厅浴室厨房吊...,京东商城,璞高灯饰官方旗舰店
1019002016,家居家装|灯具|橱柜灯,朗美科 LED铝拉丝感应橱柜灯 节能创意红外线挥手感应光控小夜灯CL022,首页>家居/家装建材/厨具>家居照明>装饰灯>朗美科LED铝拉丝感应橱柜灯节能...,苏宁,朗美科
1019002016,家居家装|灯具|橱柜灯,LED红外人体感应小夜灯/橱柜灯-暖光CL018,首页 / 生活改良 / 灯光照明 / 小夜灯 / LED红外人体感应小夜灯/橱柜灯-暖光CL018,趣玩网,朗美科
1019002016,家居家装|灯具|橱柜灯,翰源迷你LED射灯大功率一体天花灯 酒柜灯橱柜灯纽扣灯小射灯全套 (暖白),家居装修 > 灯具\\照明 > 光源 > LED光源 ,亚马逊(卓越网),
1019002016,家居家装|灯具|橱柜灯,妙朗 大功率3W LED射灯全套 LED天花灯牛眼灯橱柜灯节能灯 INT-01-02 暖白光,妙朗（MIORON）>妙朗 大功率3W LED射灯全套 LED...,京东商城,妙朗家居旗舰店
1019002016,家居家装|灯具|橱柜灯,它尚 LED水晶射灯筒灯 一体化天花灯客厅餐厅卧室过道橱柜灯 大功率全套超亮 3W 超亮 晶黄正白光 3W,它尚>它尚 LED水晶射灯筒灯 一体化天花灯客...,京东商城,光的照明旗舰店
1019002016,家居家装|灯具|橱柜灯,宏光 T天花射灯全套 背景墙灯橱柜灯酒柜灯TH6222 高光 高光（不含变压器光源）,家居装修/类别/灯具/家居功能照明/射灯,亚马逊(卓越网),宏光
1019002016,家居家装|灯具|橱柜灯,光一 水滴人体感应灯小夜灯led光控节能灯创意床头灯电池橱柜灯楼道灯 粉色白光,光一 >光一 水滴人体感应灯小夜灯led光控节能...,京东商城,贝诺家居专营店
1019002016,家居家装|灯具|橱柜灯,光一 水滴人体感应灯小夜灯led光控节能灯创意床头灯电池橱柜灯楼道灯 白色黄光,光一 >光一 水滴人体感应灯小夜灯led光控节能...,京东商城,贝诺家居专营店
1019002016,家居家装|灯具|橱柜灯,得利来 LED天花灯背景墙灯LED射灯酒柜灯橱柜灯 高亮3W 迷你3*1W 开孔50 暖光,得利来（DOLILO）>得利来 LED天花灯背景墙灯LED射灯酒...,京东商城,得利来LED灯饰官方旗舰店
1019002016,家居家装|灯具|橱柜灯,翰源 LED射灯 大功率3W天花灯全套5公分开孔 超亮橱柜灯HSD911,所有分类>家居家纺、锅具餐具>家具家装>灯具灯饰>射灯>翰源>翰源 LED射灯 大...,1号店,翰源
1019002016,家居家装|灯具|橱柜灯,沃尔森人体感应灯 创意小夜灯 床头灯 光控衣柜灯 橱柜灯 壁灯 楼道灯 纯净白,首页>运动户外>户外装备>户外照明/仪表>沃尔森人体感应灯创意小夜灯床头灯...,苏宁,沃尔森Warsun
1019002016,家居家装|灯具|橱柜灯,VNC LED筒灯3W天花灯全套小开孔 超亮小射灯橱柜灯高效节能 02B-3(暖白光),家具建材>LED灯>VNC>VNC LED筒灯3W天花灯全套小开孔 超亮小射灯橱柜灯高效节能 02B-3(暖白光),国美电器网上商城,VNC LED国际照明旗舰店
1019002016,家居家装|灯具|橱柜灯,护眼灯 掌明灯 节能 USB LED 手势灯 橱柜灯 可配合移动电源户外使用 【趣玩】,玩具 > 创意生活 > 办公文具 > 商品详情,当当网,酷毙
1019002016,家居家装|灯具|橱柜灯,得利来 LED橱柜灯柜底灯衣柜灯工作灯 感应灯触摸灯 210 一米暖光,首页>家居/家装建材/厨具>家居照明>射灯>得利来LED橱柜灯柜底灯衣柜灯工作...,苏宁,
1019002016,家居家装|灯具|橱柜灯,朗美科 节能创意LED壁灯过道灯橱柜灯人体感应光控壁灯银色自然光 WS01,首页>家居/家装建材/厨具>家居照明>应急/手电>朗美科节能创意LED壁灯过道灯橱柜...,苏宁,朗美科
1019002016,家居家装|灯具|橱柜灯,光一水滴人体感应灯led小夜灯 光控节能创意床头灯电池楼道橱柜灯包邮(白色黄光 浣熊款),家居日用>创意小件>光一>光一水滴人体感应灯led小夜灯 光控节能创意床头灯电池楼道橱柜灯包邮(白色黄光 浣熊款),国美电器网上商城,光一














