1019006017,家居家装|家具|电视柜,派璀克 钢化玻璃三层黑色小电视柜 现代简约宜家客厅置物柜,所有分类>家居家纺、锅具餐具>家具家装>柜类>电视柜>派璀克>派璀克 钢化玻璃三层...,1号店,派璀克
1019006017,家居家装|家具|电视柜,原点 功能储物茶几 茶几桌 简约电视柜 钢化玻璃电视柜 电视柜 只售上海,所有分类>家居家纺、锅具餐具>家具家装>柜类>电视柜>原点>原点 功能储物茶几 ...,1号店,原点
1019006017,家居家装|家具|电视柜,艺凯丝家具 纯实木电视柜 美式乡村仿古客厅落地柜 储物柜 电视柜,家具>电视柜>艺凯丝>艺凯丝家具 纯实木电视柜 美式乡村仿古客厅落地柜 储物柜 电视柜,国美电器网上商城,艺凯丝
1019006017,家居家装|家具|电视柜,电视架IW1203 32-60寸客厅电视柜 液晶电视支架,家具建材>电视柜>卡步特>电视架IW1203 32-60寸客厅电视柜 液晶电视支架,国美电器网上商城,卡步特家具旗舰店
1019006017,家居家装|家具|电视柜,绿色通道 双门一抽带滑轮电视柜 宜家储物柜/地柜 简约视听柜 奶白色 免运费 W,家具>电视柜>绿色通道>绿色通道 双门一抽带滑轮电视柜 宜家储物柜/地柜 简约视听柜 奶白色 免运费 W,国美电器网上商城,绿色通道
1019006017,家居家装|家具|电视柜,【预售】简约现代 韩式田园 实木组合电视柜 地柜收纳柜 白色 组合,家具>电视柜>家逸>【预售】简约现代 韩式田园 实木组合电视柜 地柜收纳柜 白色 组合,国美电器网上商城,家逸旗舰店
1019006017,家居家装|家具|电视柜,浪漫星钢化玻璃电视柜 创意可以伸缩 时尚现代烤漆电视机柜 Tv880,家具>电视柜>浪漫星>浪漫星钢化玻璃电视柜 创意可以伸缩 时尚现代烤漆电视机柜 Tv880,国美电器网上商城,浪漫星
1019006017,家居家装|家具|电视柜,森岳家具 1.2米卧室电视柜 田园乡村100%实木白橡木1031 1.2米,首页>家居/家装建材/厨具>家具>客厅/餐厅家具>森岳家具1.2米卧室电视柜田园乡...,苏宁,森岳家
1019006017,家居家装|家具|电视柜,绿色通道 双抽翻门/单抽长翻门电视柜 宜家简约视听DVD储物柜  W-TV406(单抽长翻门电视柜),家具>电视柜>绿色通道>绿色通道 双抽翻门/单抽长翻门电视柜 宜家简约视听DVD储物柜  W-TV406(单抽长翻门电视柜),国美电器网上商城,绿色通道旗舰店
1019006017,家居家装|家具|电视柜,电视架IW1203 32-60寸客厅电视柜 液晶电视支架,家具>电视柜>卡步特>电视架IW1203 32-60寸客厅电视柜 液晶电视支架,国美电器网上商城,卡步特
1019006017,家居家装|家具|电视柜,乐和居 电视柜 简约 钢化玻璃 现代简约 2米柜,家具>客厅家具>电视柜>乐和居>乐和居 电视柜 简约 钢化玻璃 现代简约...,京东商城,乐和居家居旗舰店
1019006017,家居家装|家具|电视柜,新悦 B516-C组合电视柜 电视墙 电视墙柜 黑白色 组合购买(如结构图),家具>客厅家具>电视柜>新悦>新悦 B516-C组合电视柜 电视墙 电...,京东商城,新悦家居官方旗舰店
1019006017,家居家装|家具|电视柜,鹏景雅居 客厅家具 欧式实木田园电视柜/地柜/储物柜 G53 家居就旗舰店,家具>客厅家具>电视柜>鹏景雅居>鹏景雅居 客厅家具 欧式实木田园电视柜/...,京东商城,家居就建材家居旗舰店
1019006017,家居家装|家具|电视柜,博洛阁 时尚简约环保高密度板钢化玻璃伸缩电视柜TV026,所有分类>家居家纺、锅具餐具>家具家装>柜类>电视柜>博洛阁>博洛阁 时尚简约环保...,1号店,博洛阁
1019006017,家居家装|家具|电视柜,新悦 电视柜K156 电视墙柜组合地柜电视机柜矮柜 红橡木色 K256-02隔板挂件(单个),家具>客厅家具>电视柜>新悦>新悦 电视柜K156 电视墙柜组合地柜电...,京东商城,新悦家居官方旗舰店
1019006017,家居家装|家具|电视柜,乐和居 电视柜 简约 客厅地柜 储物柜 胡桃色,家具>客厅家具>电视柜>乐和居>乐和居 电视柜 简约 客厅地柜 储物柜 ...,京东商城,乐和居家居旗舰店
1019006017,家居家装|家具|电视柜,派森家具 简约时尚组合电视柜/地柜PS-TV005 实木框架,家具>客厅家具>电视柜>派森家具 简约时尚组合电视柜/地柜PS-...,京东商城,派森家具旗舰店
1019006017,家居家装|家具|电视柜,新悦 组合式电视柜 K156-E 电视墙组合 红橡木色 组合购买(如效果图),家具>客厅家具>电视柜>新悦>新悦 组合式电视柜 K156-E 电视墙...,京东商城,新悦家居官方旗舰店
1019006017,家居家装|家具|电视柜,福立方储物柜带层架带置物柜整体电视柜 视听柜组合机顶盒架现代家具柜子TV4145 深色,首页>家居/家装建材/厨具>家具>客厅/餐厅家具>福立方储物柜带层架带置物柜整体电视柜...,苏宁,福立方
1019006017,家居家装|家具|电视柜,实木地柜 2.4米可伸缩柜 北欧宜家家具 客厅实木电视柜（乌金木色）K0924,家具 > 客厅家具 > 电视柜 > 商品详情,当当网,御品工匠
1019006017,家居家装|家具|电视柜,艾美悦家具 简约电视柜 现代小户型钢化玻璃电视柜时尚储物茶几组合1162,家具>客厅家具>电视柜>艾美悦（IMY-HOME）>艾美悦家具 简约电视柜 现代小户型钢化玻...,京东商城,艾美悦家居旗舰店
1019006017,家居家装|家具|电视柜,御品工匠 电视柜组合柜 书柜储物柜客厅酒柜 胡桃木组合柜 109,家具 > 客厅家具 > 电视柜 > 商品详情,当当网,御品工匠
1019006017,家居家装|家具|电视柜,理佳木业简约玻璃门实木电视柜 TV-278 红色 1500*400*500,家具>客厅家具>电视柜>理佳木业>理佳木业简约玻璃门实木电视柜 TV-27...,京东商城,理佳木业旗舰店
1019006017,家居家装|家具|电视柜,森岳家具 1.5/1.8/2.2米电视柜地柜视听柜 100%实木橡木 仿古色第一代1109 1.8米电视柜,家具>客厅家具>电视柜>森岳>森岳家具 1.5/1.8/2.2米电视柜...,京东商城,润发家具旗舰店
1019006017,家居家装|家具|电视柜,领跑/LING PAO 高端大理石电视柜储物柜 倒影不锈钢装饰面板简约地柜式电视柜,所有分类>家居家纺、锅具餐具>家具家装>柜类>电视柜>领跑/LING PAO>领跑/LING PA...,1号店,领跑/LING PAO
1019006017,家居家装|家具|电视柜,菲澜诗（Filans)FIT-2 高温处理E1环保板 现代简约可伸缩组合电视柜（胡桃木色）,家具>办公茶几>菲澜诗>菲澜诗（Filans)FIT-2 高温处理E1环保板 现代简约可伸缩组合电视柜（胡桃木色）,国美电器网上商城,菲澜诗
1019006017,家居家装|家具|电视柜,信爱家屋 简约烤漆电视柜 现代影视柜 拉伸地柜 TV9038 2/3.2*0.4*0.4M,家具>客厅家具>电视柜>IKAWOOD>信爱家屋 简约烤漆电视柜 现代影视柜 拉...,京东商城,爱家屋家居旗舰店
1019006017,家居家装|家具|电视柜,达美家具简约现代电视柜组合 客厅可伸缩地柜式电视机柜 H815 整套,家具>客厅家具>电视柜>达美>达美家具简约现代电视柜组合 客厅可伸缩地...,京东商城,达美家具官方旗舰店
1019006017,家居家装|家具|电视柜,新悦 B516-C组合电视柜 电视墙 电视墙柜 黑白色 B616-04格板架,家具>客厅家具>电视柜>新悦>新悦 B516-C组合电视柜 电视墙 电...,京东商城,新悦家居官方旗舰店
1019006017,家居家装|家具|电视柜,乐和居 客厅电视柜 组合现代 简约地柜玻璃烤漆矮柜 双抽屉,家具>电视柜>乐和居>乐和居 客厅电视柜 组合现代 简约地柜玻璃烤漆矮柜 双抽屉,国美电器网上商城,乐和居
1019006017,家居家装|家具|电视柜,原点 功能储物电视柜茶几桌 简约钢化玻璃电视柜 只售上海,所有分类>家居家纺、锅具餐具>家具家装>办公家具>原点>原点 功能储物电视柜...,1号店,原点
1019006017,家居家装|家具|电视柜,华谊家具 纯实木 1.8米电视柜 XCF10302-2 北欧田园 美国白橡木,首页 > 家具 > 柜类 > 电视柜,家品会,华谊家具
1019006017,家居家装|家具|电视柜,恩嘉依 恩嘉依伸缩电视柜套餐,首页 > 恩嘉依家具 > 恩嘉依伸缩电视柜套餐,唯品会,无
1019006017,家居家装|家具|电视柜,绿星 日式自然系电视柜,首页 > 绿星COLOR STAR家具专场 > 日式自然系电视柜,唯品会,无
1019006017,家居家装|家具|电视柜,慧乐家 泊雅特电视柜,首页 > 慧乐家Funature家具 > 泊雅特电视柜,唯品会,无
1019006017,家居家装|家具|电视柜,小憨豆 田园电视柜茶几套餐,首页 > 小憨豆BEAN HOMES家具 > 田园电视柜茶几套餐,唯品会,无
1019006017,家居家装|家具|电视柜,诺亚易家 时尚客厅电视柜伸缩自如，时尚大方,首页 > 诺亚易家Noaher家具 > 时尚客厅电视柜,唯品会,无
1019006017,家居家装|家具|电视柜,志达TT 木质 储物 电视组合电视柜 简约地柜 客厅边柜 TG2301,家具>电视柜>悠士风>志达TT 木质 储物 电视组合电视柜 简约地柜 客厅边柜 TG2301,国美电器网上商城,悠士风
1019006017,家居家装|家具|电视柜,小憨豆 现代茶几电视柜套餐,首页 > 小憨豆BEAN HOMES家具 > 现代茶几电视柜套餐,唯品会,无
1019006017,家居家装|家具|电视柜,聚风尚 电视柜 地柜 电视桌 镂空 可储物,家具>客厅家具>电视柜>聚风尚>聚风尚 电视柜 地柜 电视桌 镂空 可储...,京东商城,聚风尚
1019006017,家居家装|家具|电视柜,光明家具 多功能实木电视柜 组合 水曲柳实木壁柜 挂柜 地柜 套装可拆分73601（白色） 左壁柜,家具>客厅家具>电视柜>光明家具（guangmingjiaju）>光明家具 多功能实木电视柜 组合 水曲柳...,京东商城,光明家具旗舰店
1019006017,家居家装|家具|电视柜,森岳家具  B1123/B1031  1米/1.2米地柜电视柜试听柜  100%纯实木,家具 > 客厅家具 > 电视柜 > 商品详情,当当网,润发家具
1019006017,家居家装|家具|电视柜,慧乐家 现代简约泊雅特胡桃木色电视柜,首页 > 慧乐家Funature家具移动端专场 > 现代简约泊雅特胡桃木色电视柜,唯品会,无
1019006017,家居家装|家具|电视柜,派林隆 电视柜 地柜 特价 现代简约中式客厅家具可伸缩黑白色烤漆 组合柜(长2.25-2.87米),家具>电视柜>派林隆家居>派林隆 电视柜 地柜 特价 现代简约中式客厅家具可伸缩黑白色烤漆 组合柜(长2.25-2.87米),国美电器网上商城,派林隆家居旗舰店
1019006017,家居家装|家具|电视柜,松香门第 实木电视柜组合 简约地柜 松木家具墙柜 客厅中式电视机柜 多功能可伸缩组合 电视柜,首页>家居/家装建材/厨具>家具>客厅/餐厅家具>松香门第实木电视柜组合简约地柜...,苏宁,松香门第
1019006017,家居家装|家具|电视柜,富兰德 美式乡村电视柜 木质地柜 视听柜 仿古做旧 彩斗柜 装饰柜 图片色,首页>家居/家装建材/厨具>家具>客厅/餐厅家具>富兰德美式乡村电视柜木质地柜视...,苏宁,富兰德
1019006017,家居家装|家具|电视柜,阿诗兰家具 地柜 钢化玻璃 板式钢琴烤漆 电视柜 A661,家具>电视柜>阿诗兰>阿诗兰家具 地柜 钢化玻璃 板式钢琴烤漆 电视柜 A661,国美电器网上商城,阿诗兰
1019006017,家居家装|家具|电视柜,一米爱 极简之美 黑白经典 电视柜,首页 > 一米爱YIMILOVE家具 > 极简之美 黑白经典 电视柜,唯品会,无
1019006017,家居家装|家具|电视柜,御品工匠 中式实木电视柜 实木雕刻家具 1.8m 地柜 收纳柜 c203 红胡色,首页>家居/家装建材/厨具>家具>客厅/餐厅家具>御品工匠中式实木电视柜实木雕刻家...,苏宁,
1019006017,家居家装|家具|电视柜,理佳木业时尚田园印花带抽白色烤漆茶几电视柜组合21129,家具 > 客厅家具 > 电视柜 > 商品详情,当当网,理佳
1019006017,家居家装|家具|电视柜,福立方现代简约黑色带格子柜组合电视柜 地柜式视听柜 机顶盒架TV4030 黑色,首页>家居/家装建材/厨具>家具>客厅/餐厅家具>福立方现代简约黑色带格子柜组合电视柜...,苏宁,
1019006017,家居家装|家具|电视柜,御品工匠 实木电视柜 电视墙柜 客厅组合柜 实木家具酒柜 储藏柜 乌金木色,首页>家居/家装建材/厨具>家具>卧室家具>御品工匠实木电视柜电视墙柜客厅...,苏宁,
1019006017,家居家装|家具|电视柜,理佳木业 实木多功能储物电视柜 多抽屉储物柜 TV—222 白色,首页>家居/家装建材/厨具>家具>客厅/餐厅家具>理佳木业实木多功能储物电视柜多抽...,苏宁,
1019006017,家居家装|家具|电视柜,惠宜家居电视柜组合 简约现代地柜 水曲柳家具组合厅柜电视柜地柜HY-T020 1.5米,首页>家居/家装建材/厨具>家具>客厅/餐厅家具>惠宜家居电视柜组合简约现代地柜水...,苏宁,
1019006017,家居家装|家具|电视柜,圣罗伦 客厅电视柜简约现代水立方钢化玻璃 带储物柜子691(带储物柜子691-1),家具>电视柜>雅蠛蝶>圣罗伦 客厅电视柜简约现代水立方钢化玻璃 带储物柜子691(带储物柜子691-1),国美电器网上商城,雅蠛蝶
1019006017,家居家装|家具|电视柜,择木宜居 现代简约客厅电视柜 组合钢化玻璃面白色地柜 白色 电视柜 白色,首页>家居/家装建材/厨具>家具>客厅/餐厅家具>择木宜居现代简约客厅电视柜组合钢...,苏宁,
1019006017,家居家装|家具|电视柜,梅德比 电视柜 现代客厅储物钢化玻璃地柜 TV829,家具>电视柜>梅德比电视柜>梅德比 电视柜 现代客厅储物钢化玻璃地柜 TV829,国美电器网上商城,梅德比电视柜
1019006017,家居家装|家具|电视柜,轩航家具 藤编双抽屉电视柜 客厅电视柜 藤木电视柜 酒店电视柜 XH-A195 1500*500*550,家具>客厅家具>电视柜>轩航>轩航家具 藤编双抽屉电视柜 客厅电视柜 ...,京东商城,轩航家具旗舰店
1019006017,家居家装|家具|电视柜,郑太 钢化玻璃电视柜 简约时尚电视柜 烤漆地柜 矮柜特价 白色 2000*400*400,家具>客厅家具>电视柜> 郑太家居>郑太 钢化玻璃电视柜 简约时尚电视柜 烤...,京东商城,郑太家居旗舰店
1019006017,家居家装|家具|电视柜,彼爱家具 【三包到家】个性简约电视柜 时尚钢化玻璃电视柜 2013新款电视柜882# 颜色 尺寸,家具>客厅家具>电视柜> 彼爱1生>彼爱家具 【三包到家】个性简约电视柜 时...,京东商城,彼爱1生家居旗舰店
1019006017,家居家装|家具|电视柜,恩嘉依烤漆电视柜 可伸缩储物电视柜 3色可选 绿色,家具>客厅家具>电视柜>恩嘉依>恩嘉依烤漆电视柜 可伸缩储物电视柜 3...,京东商城,恩嘉依家具旗舰店
1019006017,家居家装|家具|电视柜,欣雅图 男人顾家 幸福爱家 宜家组合时尚简约 钢化玻璃地柜 电视柜157F 2200*450*470,家具>客厅家具>电视柜> 欣雅图>欣雅图 男人顾家 幸福爱家 宜家组合时...,京东商城,欣雅图家具旗舰店
1019006017,家居家装|家具|电视柜,CASALIS|欧式美式家具|手工实木雕花|花样年华|8188-04电视柜 象牙色,家具>客厅家具>电视柜>丽莎之家（CASA LISA）>CASALIS|欧式美式家具|手工实木雕...,京东商城,CASA LISA家居旗舰店
1019006017,家居家装|家具|电视柜,绿色通道 W1066伸缩电视柜3件套 白色/橡木色 W-TV411 白色+橡木色 家居就旗舰店 白色,家具>客厅家具>电视柜>绿色通道>绿色通道 W1066伸缩电视柜3件套 白...,京东商城,家居就建材家居旗舰店
1019006017,家居家装|家具|电视柜,绿芝岛宅乐美2013爆款时尚简约钢化玻璃不锈钢电视柜 储物厅柜 客厅家具特价包邮V037 2000*450*400,家具>客厅家具>电视柜>绿芝岛宅乐美2013爆款时尚简约钢化玻璃...,京东商城,绿芝岛●宅乐美家居官方旗舰店
1019006017,家居家装|家具|电视柜,格日新品 简约时尚现代不锈钢化玻璃烤漆非全实木电视柜地柜130 200*45*39cm,家具>客厅家具>电视柜> 格日>格日新品 简约时尚现代不锈钢化玻璃烤漆非...,京东商城,格日家具旗舰店
1019006017,家居家装|家具|电视柜,网牵 欧式电视柜 客厅电视柜 新款白色电视柜 欧式家具 特价,家具>客厅家具>电视柜>网牵 欧式电视柜 客厅电视柜 新款白色电...,京东商城,洛丽莎家居
1019006017,家居家装|家具|电视柜,筑家家居 现代 钢脚 组合 电视柜/视听柜 黑衫纹+欧花 795x395x400,家具>客厅家具>电视柜>筑家>筑家家居 现代 钢脚 组合 电视柜/视听...,京东商城,筑家家居旗舰店
1019006017,家居家装|家具|电视柜,【美宅】客厅家具现代简约 视听柜 玻璃门角柜+4门1抽电视柜-dsg26 现生产 可定制,家具>客厅家具>电视柜>【美宅】客厅家具现代简约 视听柜 玻璃门...,京东商城,美宅家居
1019006017,家居家装|家具|电视柜,缘订三生 简约现代电视柜 带抽屉电视机柜 时尚烤漆现代简约地柜 DK107 白色 地柜,家具>客厅家具>电视柜>缘订三生>缘订三生 简约现代电视柜 带抽屉电视机柜...,京东商城,缘订三生家具旗舰店
1019006017,家居家装|家具|电视柜,优方圆 简约现代电视柜 板式储物柜 地柜602 白枫木色,家具>客厅家具>电视柜>优方圆 简约现代电视柜 板式储物柜 地柜...,京东商城,深圳优方圆家具旗舰店
1019006017,家居家装|家具|电视柜,明思鑫德定制家具 简约现代 男人顾家小户型 白色钢琴烤漆 鸟巢水立方电视柜,家具>客厅家具>电视柜>明思鑫德>明思鑫德定制家具 简约现代 男人顾家小户...,京东商城,明思鑫德旗舰店
1019006017,家居家装|家具|电视柜,明思鑫德定制家具 简约现代 男人顾家小户型 玻璃工艺 白色钢琴烤漆壁挂电视柜320,家具>客厅家具>电视柜>明思鑫德>明思鑫德定制家具 简约现代 男人顾家小户...,京东商城,明思鑫德旗舰店
1019006017,家居家装|家具|电视柜,卡步特家具 XC008TV简约现代电视柜 经典钢琴烤漆 钢化玻璃 金属 电视地柜,家具>客厅家具>电视柜> 卡步特（CABTE）>卡步特家具 XC008TV简约现代电视柜...,京东商城,卡步特旗舰店
1019006017,家居家装|家具|电视柜,格日家具 小户型时尚简约不锈钢电视柜视听柜地柜茶几组合134 红棕色木皮 200*45*39cm,家具>客厅家具>电视柜>格日家具 小户型时尚简约不锈钢电视柜视听...,京东商城,格日家具旗舰店
1019006017,家居家装|家具|电视柜,美伊尚品欧式雕花风格家具欧式电视柜象牙白实木雕刻家具 ODG-003 象牙白2.2米,家具>客厅家具>电视柜>美伊尚品（MEIYISHANGPIN）>美伊尚品欧式雕花风格家具欧式电视柜象牙白...,京东商城,美伊尚品官方旗舰店
1019006017,家居家装|家具|电视柜,【美宅】现代简约客厅家具 视听柜影视柜 2抽2格电视柜-dsg31 现生产 可定制,家具>客厅家具>电视柜>美宅>【美宅】现代简约客厅家具 视听柜影视柜 ...,京东商城,美宅家居
1019006017,家居家装|家具|电视柜,铮舍家居 老榆木地柜矮柜电视柜 现代简约实木电视柜新中式家具创意,家具>客厅家具>电视柜>铮舍家居>铮舍家居 老榆木地柜矮柜电视柜 现代简...,京东商城,铮舍家居旗舰店
1019006017,家居家装|家具|电视柜,【蜗爱】简约现代电视柜 视听柜 影视柜 百叶门4门电视组合柜-dsg40 现货 可定制,家具>客厅家具>电视柜>【蜗爱】简约现代电视柜 视听柜 影视柜 ...,京东商城,美斯邦家居
1019006017,家居家装|家具|电视柜,派璀克 PATRICK 钢化玻璃不锈钢三层电视柜 37寸及以下黑色 P2-008 家居就旗舰店,家具>客厅家具>电视柜>派璀克（PATRICK）>派璀克 PATRICK 钢化玻璃不锈钢三...,京东商城,家居就建材家居旗舰店
1019006017,家居家装|家具|电视柜,托森 宜家简约电视柜组合 TV3228,家具>客厅家具>电视柜>托森>托森 宜家简约电视柜组合 TV3228,京东商城,托森旗舰店
1019006017,家居家装|家具|电视柜,邦美居家具 法式田园电视柜 欧式电视机柜 白色地柜矮柜储物柜特价 1.8M两抽款,家具>客厅家具>电视柜> 邦美居（bangmeiju）>邦美居家具 法式田园电视柜 欧式电视机柜...,京东商城,邦美居家具旗舰店
1019006017,家居家装|家具|电视柜,屋之宝 大理石电视柜 现代简约电视机柜 客厅电视柜地柜 贝母云石 家装节热卖 茶色,家具>客厅家具>电视柜> 屋之宝>屋之宝 大理石电视柜 现代简约电视机柜 ...,京东商城,屋之宝家具旗舰店
1019006017,家居家装|家具|电视柜,慢生活家居 现代欧式简约 电视柜 黑色白色钢琴烤漆地柜 黑色 1200*400*350,家具>客厅家具>电视柜>理想慢生活（ideal for life）>慢生活家居 现代欧式简约 电视柜 黑色...,京东商城,理想慢生活家具旗舰店
1019006017,家居家装|家具|电视柜,领跑 电视柜 简约 电视柜组合套装 雅致 图片色 电视柜+茶几,家具>客厅家具>电视柜> 领跑（LEADER）>领跑 电视柜 简约 电视柜组合套装 雅致...,京东商城,领跑家居旗舰店
1019006017,家居家装|家具|电视柜,明思鑫德家具定制 简约现代 小户型客厅板式壁挂液晶地柜电视柜地柜08,家具>客厅家具>电视柜>明思鑫德>明思鑫德家具定制 简约现代 小户型客厅板...,京东商城,明思鑫德旗舰店
1019006017,家居家装|家具|电视柜,阿诗郎 电视柜 大理石 20mm加厚 不锈钢钢化玻璃烤漆地柜 A673B 银白龙大理石/带2抽屉,家具>客厅家具>电视柜>阿诗郎（ashilang） >阿诗郎 电视柜 大理石 20mm加厚 不...,京东商城,阿诗郎家具旗舰店
1019006017,家居家装|家具|电视柜,格日家具 时尚钢化玻璃电视柜 现代客厅简约地柜式电视机柜136,家具>客厅家具>电视柜>格日家具 时尚钢化玻璃电视柜 现代客厅简...,京东商城,格日家具旗舰店
1019006017,家居家装|家具|电视柜,美巢氏 可伸缩电视柜 北欧宜家 胡桃色 组合客厅地柜 简约家具 HD006电视柜 2.5米-2.9米伸缩,家具>客厅家具>电视柜> 美巢氏（meichaoshi）>美巢氏 可伸缩电视柜 北欧宜家 胡桃色...,京东商城,成都美巢氏家具专卖店
1019006017,家居家装|家具|电视柜,简猫家居林致简约可伸缩电视柜 钢化玻璃电视机柜 现代宜家视听柜,家具>客厅家具>电视柜>简猫家居（JAMH）>简猫家居林致简约可伸缩电视柜 钢化玻璃电...,京东商城,简猫家居旗舰店
1019006017,家居家装|家具|电视柜,风哥华家具K6 客厅 欧式电视柜 组合柜 地柜 品牌 特价 FE118厅柜组合 单门酒柜 720*455*2100mm,家具>餐厅家具>酒柜> 风哥华>风哥华家具K6 客厅 欧式电视柜 组合柜...,京东商城,风哥华家居旗舰店
1019006017,家居家装|家具|电视柜,贝尼尼 欧式田园纯实木电视柜 1.8米白色地柜特价 环保特价 可定制 象牙白色1.8米 1.8米,家具>客厅家具>电视柜> 贝尼尼（Bernini&Co）>贝尼尼 欧式田园纯实木电视柜 1.8米白...,京东商城,贝尼尼家具旗舰店
1019006017,家居家装|家具|电视柜,柏思诺 电视柜 简约钢化玻璃欧式 现代 地柜影视柜 电视柜,家具>客厅家具>电视柜>柏思诺>柏思诺 电视柜 简约钢化玻璃欧式 现代 ...,京东商城,柏思诺旗舰店