1019004009,家居家装|家装软饰|花瓶、花器,zakka 日式宜家简约复古小清新透明玻璃花瓶玻璃水培花器时尚居家摆件 一生一世真爱款现货,家用/类别/家居/家居装饰/花瓶、装饰瓶、花艺/花瓶装饰瓶,亚马逊(卓越网),ZAKKA
1019004009,家居家装|家装软饰|花瓶、花器,Snowwolf 雪狼 宫廷黄 倾国牡丹 手绘黄色花瓶花器花插 特色陶瓷摆件饰品 BN 37,家用/类别/家居/家居装饰/花瓶、装饰瓶、花艺,亚马逊(卓越网),雪狼
1019004009,家居家装|家装软饰|花瓶、花器,mxmade 茗轩 圆形悬挂式玻璃透明花瓶悬挂花瓶创意水培花器,家用/类别/家居/家居装饰/花瓶、装饰瓶、花艺/仿真绿植,亚马逊(卓越网),mxmade 茗轩
1019004009,家居家装|家装软饰|花瓶、花器,家的感觉 陶瓷装饰品摆件花瓶 现代简约风格默然花器工艺品 BHM-MR0014,所有分类>家居家纺、锅具餐具>装饰/日用>装饰花/花瓶>花瓶>家的感觉>家的感觉 陶瓷装饰品...,1号店,家的感觉
1019004009,家居家装|家装软饰|花瓶、花器,贝亚特欧式复古手绘陶瓷花瓶 花卉图案花器 餐桌家居装饰品摆件 带配5束酒红珍珠茶花,家居家装>家装软饰>花瓶花艺>欧颂（Ausone）>贝亚特欧式复古手绘陶瓷花瓶 花卉图案花器...,京东商城,欧颂旗舰店
1019004009,家居家装|家装软饰|花瓶、花器,WUSE 吾舍 人工吹制绿色玻璃收腰款 花瓶 花器 花插 水生植物瓶,家用/类别/家居/家居装饰/花瓶、装饰瓶、花艺/花瓶装饰瓶,亚马逊(卓越网),WUSE 吾舍
1019004009,家居家装|家装软饰|花瓶、花器,佳盟 欧式田园陶瓷装饰花瓶现代时尚花器整体仿真花花器 DV0008,家用/类别/家居/家居装饰/花瓶、装饰瓶、花艺/花瓶装饰瓶,亚马逊(卓越网),佳盟
1019004009,家居家装|家装软饰|花瓶、花器,德洛美 孔雀开屏玻璃花瓶透明玻璃水晶花瓶 水培花瓶花器,所有分类>家居家纺、锅具餐具>装饰/日用>装饰花/花瓶>花瓶>德洛美>德洛美 孔雀开屏玻璃...,1号店,德洛美
1019004009,家居家装|家装软饰|花瓶、花器,正想 白色贝壳银色雕花陶瓷花瓶 手工艺礼品 落地花器家饰品客厅摆设 鼓形贝壳花瓶,家居家装>家装软饰>花瓶花艺>正想>正想 白色贝壳银色雕花陶瓷花瓶 手工艺礼...,京东商城,正想旗舰店
1019004009,家居家装|家装软饰|花瓶、花器,wo+ 现代时尚简约不规则陶瓷花瓶配手感保湿玫瑰套装 仿真花假花插花瓶花器摆设花 不规则花器+10支粉色玫瑰,家居家装>家装软饰>工艺摆件>wo+ 现代时尚简约不规则陶瓷花瓶配手感...,京东商城,wojia家居旗舰店
1019004009,家居家装|家装软饰|花瓶、花器,欧式马蹄莲口花瓶 荷叶边玻璃花瓶 透明玻璃花瓶 仿真花花器 透明,家居家装>家装软饰>花瓶花艺>德洛美（DLM）>欧式马蹄莲口花瓶 荷叶边玻璃花瓶 透明玻...,京东商城,德洛美家居专营店
1019004009,家居家装|家装软饰|花瓶、花器,Flavinmci/弗莱文茨 炫彩孔雀水晶玻璃琉璃水晶花瓶透明花瓶花器家居装饰花瓶礼品花瓶,所有分类>家居家纺、锅具餐具>装饰/日用>装饰花/花瓶>花瓶>Flavinmci/弗莱文茨>Flavinmci/...,1号店,Flavinmci/弗莱文茨
1019004009,家居家装|家装软饰|花瓶、花器,春意 高档客厅白色瓷器 餐桌花瓶 现代简约时尚陶瓷花瓶花器 结婚礼物 时尚实用装饰品 摆设 高款,家居家装>家装软饰>工艺摆件>lmdec>春意 高档客厅白色瓷器 餐桌花瓶 现代简...,京东商城,lmdec家饰旗舰店
1019004009,家居家装|家装软饰|花瓶、花器,强迪 HP-11玻璃花瓶花器花架简约花瓶 紫色,家居家装>家装软饰>工艺摆件>强迪>强迪 HP-11玻璃花瓶花器花架简约花瓶...,京东商城,苏适家居
1019004009,家居家装|家装软饰|花瓶、花器,玐玖琦珥 欧式新古典花瓶花器清新玉色双耳做旧复古花瓶摆件 HP018,家居家装>家装软饰>工艺摆件>玐玖琦珥>玐玖琦珥 欧式新古典花瓶花器清新玉色双耳...,京东商城,玐玖琦珥欧式家装旗舰店
1019004009,家居家装|家装软饰|花瓶、花器,Snnei室内 美人香肩玻璃落地花瓶 现代时尚高档装饰 欧式奢华花器 湖绿色花瓶 不含花,家居家装>家装软饰>工艺摆件>室内（Snnei）>Snnei室内 美人香肩玻璃落地花瓶 现...,京东商城,snnei室内家居官方旗舰店
1019004009,家居家装|家装软饰|花瓶、花器,客厅装饰品花插陶土花瓶花器装饰器皿陶艺花器托斯卡纳双耳花瓶 深绿色高11cm,家居家装>家装软饰>花瓶花艺>米子家居>客厅装饰品花插陶土花瓶花器装饰器皿陶艺花...,京东商城,米子家居专营店
1019004009,家居家装|家装软饰|花瓶、花器,客厅装饰品花插陶土花瓶花器装饰器皿陶艺花器辛蒂瑞拉桃心花瓶 浅灰色高10cm,家居家装>家装软饰>花瓶花艺>米子家居>客厅装饰品花插陶土花瓶花器装饰器皿陶艺花...,京东商城,米子家居专营店
1019004009,家居家装|家装软饰|花瓶、花器,加厚格纹超透明 玻璃花瓶花器,家居家装>家装软饰>花瓶花艺>德洛美（DLM）>加厚格纹超透明 玻璃花瓶花器,京东商城,欣圣佳美家居专营店
1019004009,家居家装|家装软饰|花瓶、花器,劲爆价欧式现代时尚田园单耳花瓶创意居家陶瓷装饰品花艺/花器 C款不含花,家居家装>家装软饰>花瓶花艺>墨菲>劲爆价欧式现代时尚田园单耳花瓶创意居家陶...,京东商城,墨菲官方旗舰店
1019004009,家居家装|家装软饰|花瓶、花器,欧式花瓶 现代时尚创意复古陶瓷彩绘家居装饰摆件花器/花插摆件 天蓝釉款,家居家装>家装软饰>花瓶花艺>墨菲>欧式花瓶 现代时尚创意复古陶瓷彩绘家居装...,京东商城,墨菲官方旗舰店
1019004009,家居家装|家装软饰|花瓶、花器,现代时尚花瓶 裂纹陶瓷欧式花器花瓶复古创意装饰品摆件,家居家装>家装软饰>花瓶花艺>墨菲>现代时尚花瓶 裂纹陶瓷欧式花器花瓶复古创...,京东商城,墨菲官方旗舰店
1019004009,家居家装|家装软饰|花瓶、花器,BX米子家居 镀银复古花瓶 插花花器台面摆件 托奈特镀银花瓶 双耳大号,家居家装>家装软饰>花瓶花艺> 米子家居>BX米子家居 镀银复古花瓶 插花花器台面...,京东商城,米子家居专营店
1019004009,家居家装|家装软饰|花瓶、花器,dp+ 欧式简约玻璃花瓶现代花器水培器雪绒花水杯型高档客厅摆件,家居家装>家装软饰>花瓶花艺> dp+>dp+ 欧式简约玻璃花瓶现代花器水培器雪...,京东商城,dp+的旗舰店
1019004009,家居家装|家装软饰|花瓶、花器,墨菲 喜鹊欧式田园花瓶 复古时尚创意彩绘陶瓷双耳花器/赏瓶装饰摆件,家居家装>家装软饰>装饰摆件> 墨菲>墨菲 喜鹊欧式田园花瓶 复古时尚创意彩绘...,京东商城,墨菲官方旗舰店
1019004009,家居家装|家装软饰|花瓶、花器,意大利RCR  原装进口 高档台面花瓶礼品 透明水晶玻璃花樽花器,家居日用>工艺摆件>RCR>意大利RCR  原装进口 高档台面花瓶礼品 透明水晶玻璃花樽花器,国美电器网上商城,RCR
1019004009,家居家装|家装软饰|花瓶、花器,意大利RCR 傲柏窄身花瓶 白色透明水晶花樽花器 原装进口 R239930,家居日用>工艺摆件>RCR>意大利RCR 傲柏窄身花瓶 白色透明水晶花樽花器 原装进口 R239930,国美电器网上商城,RCR
1019004009,家居家装|家装软饰|花瓶、花器,CG 欧式水培透明玻璃花瓶 时尚现代花器瓶 家居装饰品摆件插花 不带花 竹节,所有分类>家居家纺、锅具餐具>装饰/日用>装饰花/花瓶>花瓶>CG,1号店,花瓶
1019004009,家居家装|家装软饰|花瓶、花器,罗诗玛诺高档陶瓷花瓶摆件 别墅花瓶摆件公司办公室时尚花插花器装饰品摆设创意田园风格 花瓶+18朵粉红色花,家居家装>家装软饰>装饰摆件> 罗诗玛诺（Nosamalo）>罗诗玛诺高档陶瓷花瓶摆件 别墅花瓶摆件公...,京东商城,罗诗玛诺官方旗舰店
1019004009,家居家装|家装软饰|花瓶、花器,Homix 西德尼 无铅水晶玻璃花瓶花器花插 多色 (优雅蓝),家用/类别/家居/家居装饰/花瓶、装饰瓶、花艺/花瓶装饰瓶,亚马逊(卓越网),Homix
1019004009,家居家装|家装软饰|花瓶、花器,贝亚特欧式复古手绘陶瓷花瓶 花卉图案花器 餐桌家居装饰品摆件 不带花,家居家装>家装软饰>花瓶花艺>欧颂（Ausone）>贝亚特欧式复古手绘陶瓷花瓶 花卉图案花器...,京东商城,欧颂旗舰店
1019004009,家居家装|家装软饰|花瓶、花器,Homix 柏宜斯 无铅水晶玻璃花瓶花器花插 多色 (浪漫紫),家用/类别/家居/家居装饰/花瓶、装饰瓶、花艺/仿真花,亚马逊(卓越网),Homix
1019004009,家居家装|家装软饰|花瓶、花器,宝齐莱 时尚陶瓷花瓶 现代装饰花器/花插 欧式家居饰品摆件 T253 (T253无光黑斜纹),家用/类别/家居/家居装饰/花瓶、装饰瓶、花艺/花瓶装饰瓶,亚马逊(卓越网),宝齐莱
1019004009,家居家装|家装软饰|花瓶、花器,橡树庄园 欧式落地大花瓶 铁艺玻璃花器 仿真花鲜花插花摆件摆设 红色 B款,家用/类别/家居/家居装饰/花瓶、装饰瓶、花艺/花瓶装饰瓶,亚马逊(卓越网),橡树庄园
1019004009,家居家装|家装软饰|花瓶、花器,佳盟 欧式田园陶瓷装饰花瓶现代时尚花器整体仿真花花器 DV0091,家用/类别/家居/家居装饰/花瓶、装饰瓶、花艺/花瓶装饰瓶,亚马逊(卓越网),佳盟
1019004009,家居家装|家装软饰|花瓶、花器,佳盟 欧式田园陶瓷装饰花瓶现代时尚花器整体仿真花花器 DV0101,家用/类别/家居/家居装饰/花瓶、装饰瓶、花艺/花瓶装饰瓶,亚马逊(卓越网),佳盟
1019004009,家居家装|家装软饰|花瓶、花器,佳盟 欧式田园陶瓷装饰花瓶现代时尚花器整体仿真花花器 DV0117,家用/类别/家居/家居装饰/花瓶、装饰瓶、花艺/花瓶装饰瓶,亚马逊(卓越网),佳盟
1019004009,家居家装|家装软饰|花瓶、花器,佳盟 欧式田园陶瓷装饰花瓶现代时尚花器整体仿真花花器 DV0079,家用/类别/家居/家居装饰/花瓶、装饰瓶、花艺/花瓶装饰瓶,亚马逊(卓越网),佳盟
1019004009,家居家装|家装软饰|花瓶、花器,德洛美 地中海风格 陶瓷绿色冰裂纹方口花瓶 花插 花器 家居装饰品摆件,所有分类>家居家纺、锅具餐具>装饰/日用>装饰花/花瓶>花瓶>德洛美>德洛美 地中海风格 ...,1号店,德洛美
1019004009,家居家装|家装软饰|花瓶、花器,伊丽雅佳 花瓶花器装饰品摆件客厅时尚现代简约陶瓷器大花瓶欧式工艺品摆设,家居 > 家居装饰 > 花瓶、装饰瓶、花艺 > 仿真花,亚马逊(卓越网),伊丽雅佳
1019004009,家居家装|家装软饰|花瓶、花器,正想 白色贝壳银色雕花陶瓷花瓶 手工艺礼品 落地花器家饰品客厅摆设 扁身斜口贝壳花瓶,家居家装>家装软饰>花瓶花艺>正想>正想 白色贝壳银色雕花陶瓷花瓶 手工艺礼...,京东商城,正想旗舰店
1019004009,家居家装|家装软饰|花瓶、花器,wo+高档陶瓷花瓶摆件花器 黑白款简约大号花盆 客厅台面插花瓶 现代中国风 黑色陶瓷花瓶,家居家装>家装软饰>工艺摆件>wo+>wo+高档陶瓷花瓶摆件花器 黑白款简约大...,京东商城,wojia家居旗舰店
1019004009,家居家装|家装软饰|花瓶、花器,YOULET 玻璃花瓶 鲜花插工艺品客厅书房装饰花樽花器原装进口 1只装20CM高,所有分类>家居家纺、锅具餐具>装饰/日用>装饰花/花瓶>仿真鲜花>YOULET>YOULET 玻璃花...,1号店,YOULET
1019004009,家居家装|家装软饰|花瓶、花器,YOULET 玻璃花瓶现代时尚简约欧式客厅摆件富贵竹花器原装进口 1只装20CM高,所有分类>家居家纺、锅具餐具>装饰/日用>装饰花/花瓶>仿真鲜花>YOULET>YOULET 玻璃花...,1号店,YOULET
1019004009,家居家装|家装软饰|花瓶、花器,德洛美 欧式田园花瓶花器西班牙色彩 单耳陶瓷花瓶 家居装饰摆设品 大号,所有分类>家居家纺、锅具餐具>装饰/日用>装饰花/花瓶>花瓶>德洛美>德洛美 欧式田园花瓶...,1号店,德洛美
1019004009,家居家装|家装软饰|花瓶、花器,强迪 HP-10扁形玻璃花瓶花器花架简约花瓶 蓝色,家居家装>家装软饰>装饰摆件>强迪>强迪 HP-10扁形玻璃花瓶花器花架简约...,京东商城,强迪家居专营店
1019004009,家居家装|家装软饰|花瓶、花器,【轩品阁】景德镇陶瓷/花瓶三件套摆件/花瓶花插花器/家居装饰花瓶套装 浅灰色,家居家装>家装软饰>工艺摆件>轩品阁>【轩品阁】景德镇陶瓷/花瓶三件套摆件/花...,京东商城,景德镇轩品阁陶瓷
1019004009,家居家装|家装软饰|花瓶、花器,强迪 HP-13彩色玻璃花瓶花瓶花器花架简约花瓶 HP11黑色,家居家装>家装软饰>工艺摆件>强迪>强迪 HP-13彩色玻璃花瓶花瓶花器花架...,京东商城,null
1019004009,家居家装|家装软饰|花瓶、花器,橡树庄园法式乡村圆形玻璃花瓶花器 餐桌装饰摆件装饰品 白色花瓶带10束球菊,家居家装>家装软饰>工艺摆件>橡树庄园>橡树庄园法式乡村圆形玻璃花瓶花器 餐桌装...,京东商城,
1019004009,家居家装|家装软饰|花瓶、花器,Snnei室内 拉玛玻璃花瓶透明 创意欧式插花花器 装饰仿真花花瓶 拉玛花瓶/紫,家居家装>家装软饰>工艺摆件>室内（Snnei）>Snnei室内 拉玛玻璃花瓶透明 创意欧...,京东商城,snnei室内家居官方旗舰店
1019004009,家居家装|家装软饰|花瓶、花器,Snnei室内 带盖直腰透明花瓶 简约欧式时尚玻璃 客厅台面装饰花器 鹦鹉螺组合,家居家装>家装软饰>工艺摆件>室内（Snnei）>Snnei室内 带盖直腰透明花瓶 简约欧...,京东商城,snnei室内家居官方旗舰店
1019004009,家居家装|家装软饰|花瓶、花器,客厅装饰品花插陶土花瓶花器装饰器皿陶艺花器辛蒂瑞拉桃心花瓶 浅灰色高13cm,家居家装>家装软饰>花瓶花艺>米子家居>客厅装饰品花插陶土花瓶花器装饰器皿陶艺花...,京东商城,米子家居专营店
1019004009,家居家装|家装软饰|花瓶、花器,贸号 婚庆玻璃花瓶摆件小鸟高脚花器 水培植物插花瓶,家居家装>家装软饰>花瓶花艺>贸号（MOHO-ZOOM）>贸号 婚庆玻璃花瓶摆件小鸟高脚花器 水培...,京东商城,贸号专营店
1019004009,家居家装|家装软饰|花瓶、花器,欧式马蹄莲口花瓶 荷叶边玻璃花瓶 仿真花花器 紫色,家居家装>家装软饰>花瓶花艺>德洛美（DLM）>欧式马蹄莲口花瓶 荷叶边玻璃花瓶 仿真花...,京东商城,欣圣佳美家居专营店
1019004009,家居家装|家装软饰|花瓶、花器,【畅宁】螺纹花高温瓷花瓶 宜家风 13厘米 陶瓷 花器 2色可选 白色,家居家装>家装软饰>花瓶花艺>畅宁>【畅宁】螺纹花高温瓷花瓶 宜家风 13厘...,京东商城,畅宁官方旗舰店
1019004009,家居家装|家装软饰|花瓶、花器,景秀缘 景德镇陶瓷 韩式陶瓷花瓶三件套摆件 花器插花 家居装饰品 纯手工 矮瓶,家居家装>家装软饰>装饰摆件>景秀缘（J）>景秀缘 景德镇陶瓷 韩式陶瓷花瓶三件套摆...,京东商城,景秀缘陶瓷旗舰店
1019004009,家居家装|家装软饰|花瓶、花器,欧式花瓶摆件 田园现代时尚创意客厅陶瓷花器家居装饰 多款可选 蝴蝶款不含花,家居家装>家装软饰>花瓶花艺>墨菲>欧式花瓶摆件 田园现代时尚创意客厅陶瓷花...,京东商城,墨菲官方旗舰店
1019004009,家居家装|家装软饰|花瓶、花器,劲爆价欧式现代时尚田园单耳花瓶创意居家陶瓷装饰品花艺/花器 D款不含花,家居家装>家装软饰>花瓶花艺>墨菲>劲爆价欧式现代时尚田园单耳花瓶创意居家陶...,京东商城,墨菲官方旗舰店
1019004009,家居家装|家装软饰|花瓶、花器,简约现代陶瓷家居花瓶花器花插 结婚家装饰品摆件 欧式缕空台面瓶 彩色,厨具>餐具>果盘/果篮> 品和>简约现代陶瓷家居花瓶花器花插 结婚家装饰...,京东商城,晟维家居专营店
1019004009,家居家装|家装软饰|花瓶、花器,欧式浮雕陶瓷花瓶摆件 家居工艺品装饰摆设花器 餐桌摆件,家居家装>家装软饰>花瓶花艺>欧颂（Ausone）>欧式浮雕陶瓷花瓶摆件 家居工艺品装饰摆设...,京东商城,欧颂旗舰店
1019004009,家居家装|家装软饰|花瓶、花器,墨菲 雁莺 欧式田园花瓶 复古时尚创意彩绘陶瓷双耳花器/赏瓶装饰摆件,家居家装>家装软饰>装饰摆件> 墨菲>墨菲 雁莺 欧式田园花瓶 复古时尚创意彩...,京东商城,墨菲官方旗舰店
1019004009,家居家装|家装软饰|花瓶、花器,陶瓷装饰品摆件花瓶 现代简约风格 孔雀工艺品花器 家居饰品摆设,家居家装>家装软饰>装饰摆件> 品和>陶瓷装饰品摆件花瓶 现代简约风格 孔雀工...,京东商城,品和家居专营店
1019004009,家居家装|家装软饰|花瓶、花器,墨香雨卉欧式复古时尚创意陶瓷赏瓶/花瓶/花器装饰摆件,家居家装>家装软饰>花瓶花艺> 墨菲>墨香雨卉欧式复古时尚创意陶瓷赏瓶/花瓶/...,京东商城,墨菲官方旗舰店
1019004009,家居家装|家装软饰|花瓶、花器,锦坤 小花瓶 花器 茶道花器 茶道陶泥小花器,所有分类>家居家纺、锅具餐具>餐具水具>茶具1>茶道/零配>锦坤>锦坤 小花瓶 花器 ...,1号店,锦坤
1019004009,家居家装|家装软饰|花瓶、花器,优贝家 希腊浮雕奶杯花瓶 陶瓷花器现代时尚工艺品客厅落地花器,家居家装>家装软饰>花瓶花艺> 优贝家（ubaka）>优贝家 希腊浮雕奶杯花瓶 陶瓷花器现代...,京东商城,优贝家旗舰店
1019004009,家居家装|家装软饰|花瓶、花器,陌上纤虹 电视柜花瓶摆件客厅饰品花器工艺品家居摆设花瓶装饰花瓶现代简约,家居家装>家装软饰>装饰摆件> 陌上纤虹>陌上纤虹 电视柜花瓶摆件客厅饰品花器工艺...,京东商城,陌上纤虹官方旗舰店
1019004009,家居家装|家装软饰|花瓶、花器,罗诗玛诺高档花瓶家居客厅玄关摆设欧式田园复古花器装饰品摆件卧室插花顺瓶装 手绘花鸟图案大水笙陶瓷花瓶,家居家装>家装软饰>花瓶花艺> 罗诗玛诺（Nosamalo）>罗诗玛诺高档花瓶家居客厅玄关摆设欧式田园...,京东商城,罗诗玛诺官方旗舰店
1019004009,家居家装|家装软饰|花瓶、花器,【畅宁】花瓶篮(紫色丝带) 花盆仿真花花瓶花器现代时尚简约装饰品客厅家居摆件批发,首页>家居/家装建材/厨具>生活日用>装饰用品>【畅宁】花瓶篮(紫色丝带)花盆仿真...,苏宁,畅宁
1019004009,家居家装|家装软饰|花瓶、花器,手信 陶瓷 装饰品摆件花瓶 现代简约风格 默然花器 工艺品BHM-MR0014,家用/类别/家居/家居装饰/花瓶、装饰瓶、花艺/花瓶装饰瓶,亚马逊(卓越网),手信
1019004009,家居家装|家装软饰|花瓶、花器,玐玖琦珥 家装软饰欧式彩绘花器花瓶结婚礼物 仿真花器手绘陶瓷花瓶 HP004,家居家装>生活日用>家装软饰>玐玖琦珥 家装软饰欧式彩绘花器花瓶结婚礼...,京东商城,玐玖琦珥欧式家装旗舰店
1019004009,家居家装|家装软饰|花瓶、花器,鸟与花家欧式田园手绘裂纹陶瓷花瓶花器 梦之蓝大奶壶 家居饰品工艺品摆件,家居家装>生活日用>家装软饰>鸟与花家欧式田园手绘裂纹陶瓷花瓶花器 梦...,京东商城,鸟与花家
1019004009,家居家装|家装软饰|花瓶、花器,美朴生活 泰国进口 直纹圆身芒果木花瓶花器28cm ZVBVL0030,家居 > 家居装饰 > 花瓶、装饰瓶、花艺 > 仿真花 ,亚马逊(卓越网),美朴生活
1019004009,家居家装|家装软饰|花瓶、花器,美朴生活 泰国进口 横纹芒果木花瓶花器38cm ZVBVL0080,家居 > 家居装饰 > 花瓶、装饰瓶、花艺 > 仿真花 ,亚马逊(卓越网),美朴生活
1019004009,家居家装|家装软饰|花瓶、花器,佳盟 欧式田园陶瓷装饰花瓶现代时尚花器整体仿真花花器 DV0051,家用/类别/家居/家居装饰/花瓶、装饰瓶、花艺/花瓶装饰瓶,亚马逊(卓越网),佳盟
1019004009,家居家装|家装软饰|花瓶、花器,佳盟 欧式田园陶瓷装饰花瓶现代时尚花器整体仿真花花器 DV0034,家用/类别/家居/家居装饰/花瓶、装饰瓶、花艺/花瓶装饰瓶,亚马逊(卓越网),佳盟
1019004009,家居家装|家装软饰|花瓶、花器,佳盟 欧式田园陶瓷装饰花瓶现代时尚花器整体仿真花花器 DV0124,家用/类别/家居/家居装饰/花瓶、装饰瓶、花艺/花瓶装饰瓶,亚马逊(卓越网),佳盟
1019004009,家居家装|家装软饰|花瓶、花器,佳盟 欧式田园陶瓷装饰花瓶现代时尚花器整体仿真花花器 DV0086,家用/类别/家居/家居装饰/花瓶、装饰瓶、花艺/花瓶装饰瓶,亚马逊(卓越网),佳盟
1019004009,家居家装|家装软饰|花瓶、花器,佳盟 欧式田园陶瓷装饰花瓶现代时尚花器整体仿真花花器 DV0011,家用/类别/家居/家居装饰/花瓶、装饰瓶、花艺/花瓶装饰瓶,亚马逊(卓越网),佳盟
1019004009,家居家装|家装软饰|花瓶、花器,鸟与花家欧式田园手绘复古直筒陶瓷花瓶花器花插 家居装饰品工艺品摆设,家居家装>生活日用>家装软饰>鸟与花家欧式田园手绘复古直筒陶瓷花瓶花器...,京东商城,鸟与花家
1019004009,家居家装|家装软饰|花瓶、花器,正想 白色贝壳银色雕花陶瓷花瓶 手工艺礼品 落地花器家饰品客厅摆设 鼓形花瓶配5枝粉色PU玫瑰,家居家装>家装软饰>花瓶花艺>正想>正想 白色贝壳银色雕花陶瓷花瓶 手工艺礼...,京东商城,正想旗舰店
1019004009,家居家装|家装软饰|花瓶、花器,楼龙 手绘装饰花插 花瓶 花器JH015463 AJH70,家居家装>家装软饰>保暖防护>楼龙(Loulong)>楼龙 手绘装饰花插 花瓶 花器JH015...,京东商城,博纳屋旗舰店
1019004009,家居家装|家装软饰|花瓶、花器,橡树庄园简约电镀酒杯奖杯玻璃花瓶 餐桌客厅会所花艺花器摆件装饰品 单个花瓶,家居家装>家装软饰>工艺摆件>橡树庄园>橡树庄园简约电镀酒杯奖杯玻璃花瓶 餐桌客...,京东商城,橡树庄园专卖店
1019004009,家居家装|家装软饰|花瓶、花器,狮家时尚工艺礼品家居装饰品摆件摆设花瓶花器花插 孔雀花插加13头茶玫瑰1束,礼品箱包>礼品>工艺礼品>狮家时尚工艺礼品家居装饰品摆件摆设花瓶花...,京东商城,狮家旗舰店
1019004009,家居家装|家装软饰|花瓶、花器,花勿缺 透明玻璃花瓶 富贵竹 大号 现代时尚水培水晶花器,所有分类>家居家纺、锅具餐具>装饰/日用>装饰花/花瓶>花瓶>花勿缺>花勿缺 透明玻璃花瓶...,1号店,花勿缺
1019004009,家居家装|家装软饰|花瓶、花器,正想 悦目陶瓷大花瓶 家居饰品仿真花卉花器新房摆件结婚礼物装饰品摆件 白色 果盘,家居家装>家装软饰>花瓶花艺>正想>正想 悦目陶瓷大花瓶 家居饰品仿真花卉花...,京东商城,正想旗舰店
1019004009,家居家装|家装软饰|花瓶、花器,酌月记 工艺花瓶 玻璃花器 家居摆件 艳橙高身,家居家装>家装软饰>工艺摆件>酌月记>酌月记 工艺花瓶 玻璃花器 家居摆件 艳...,京东商城,
1019004009,家居家装|家装软饰|花瓶、花器,强迪 HP-10扁形玻璃花瓶花器花架简约花瓶 黑色,家居家装>家装软饰>工艺摆件>强迪>强迪 HP-10扁形玻璃花瓶花器花架简约...,京东商城,苏适家居
1019004009,家居家装|家装软饰|花瓶、花器,强迪 HP-11玻璃花瓶 花瓶花器花架简约花瓶 黑色,家居家装>家装软饰>工艺摆件>强迪>强迪 HP-11玻璃花瓶 花瓶花器花架简...,京东商城,强迪家居专营店
1019004009,家居家装|家装软饰|花瓶、花器,强迪 HP-16手绘花瓶 花瓶花器花架简约花瓶 白底粉花,家居家装>家装软饰>工艺摆件>强迪>强迪 HP-16手绘花瓶 花瓶花器花架简...,京东商城,强迪家居专营店
1019004009,家居家装|家装软饰|花瓶、花器,意大利RCR 叶纹窄身花瓶 白色透明水晶花樽花器 原装进口R237900,家居家装>家装软饰>工艺摆件>RCR>意大利RCR 叶纹窄身花瓶 白色透明水晶...,京东商城,悠乐家居
1019004009,家居家装|家装软饰|花瓶、花器,德国YOUET悠乐 玻璃花瓶 现代时尚简约欧式客厅摆件花樽花器原装进口 花瓶5,家居家装>家装软饰>工艺摆件>YOULET>德国YOUET悠乐 玻璃花瓶 现代时尚简...,京东商城,
1019004009,家居家装|家装软饰|花瓶、花器,Snnei室内 伊莎贝尔祝福玻璃花瓶 家居装饰摆件 欧式透明插花器HD 23厘米国际绿,家居家装>家装软饰>工艺摆件>室内（Snnei）>Snnei室内 伊莎贝尔祝福玻璃花瓶 家...,京东商城,snnei室内家居官方旗舰店
1019004009,家居家装|家装软饰|花瓶、花器,Snnei室内 圆形座盘玻璃花瓶 创意家居透明水培花器 简欧时尚摆件 座盘玻璃花瓶 不含花,家居家装>家装软饰>工艺摆件>室内（Snnei）>Snnei室内 圆形座盘玻璃花瓶 创意家...,京东商城,snnei室内家居官方旗舰店
