1019007017,家居家装|建材|园艺,花种子阳台盆栽易种 补肾菜板蓝根蒲公英益母草决明子中草药种子 中草药种子 补肾菜,家装建材>装饰材料>园艺休闲>花种子阳台盆栽易种 补肾菜板蓝根蒲公英益...,京东商城,开心农场
1019007017,家居家装|建材|园艺,我要发芽 花卉专用肥料 进口配方 仙人掌 多浆植物花卉用肥 220g/袋,所有分类>家居家纺、锅具餐具>宠物园艺>鲜花速递/绿植园艺>园艺用品>肥料/栽养>我要发芽>我要发芽 花卉专用肥...,1号店,我要发芽
1019007017,家居家装|建材|园艺,美乐棵家庭园艺肥料 颗粒控释植物肥通用型 养分持续释放4个月 250g,家装建材>装饰材料>园艺休闲>美乐棵（MIRACLE-GRO）>美乐棵家庭园艺肥料 颗粒控释植物肥通用型...,京东商城,天浦京东旗舰店
1019007017,家居家装|建材|园艺,华清园HQY 花盆2个装 园艺工具 植物 盆栽 种植 花盆 花卉 礼品 绿植,所有分类>家居家纺、锅具餐具>宠物园艺>鲜花速递/绿植园艺>花瓶/花盆/花架>华清园HQY>华清园HQY 花盆2...,1号店,华清园HQY
1019007017,家居家装|建材|园艺,磨砂花盆☆多肉植物、仙人球专用黑色4号 多肉盆栽 阳台,家装建材>装饰材料>园艺休闲>花勿缺>磨砂花盆☆多肉植物、仙人球专用黑色4号 ...,京东商城,花勿缺旗舰店
1019007017,家居家装|建材|园艺,华清园HQY 蕙兰 鲜花 花卉 年宵花卉 绿植 盆栽 植物 礼品 高档花卉,所有分类>家居家纺、锅具餐具>宠物园艺>鲜花速递/绿植园艺>盆栽>华清园HQY>华清园HQY 蕙兰 ...,1号店,华清园HQY
1019007017,家居家装|建材|园艺,津沽园艺 花卉种子天竺葵种子 盆栽种植 阳台种植 红色白心 约5粒,所有分类>家居家纺、锅具餐具>宠物园艺>鲜花速递/绿植园艺>种子>津沽园艺>津沽园艺 花卉种子天...,1号店,津沽园艺
1019007017,家居家装|建材|园艺,津沽园艺 花卉种子 吉祥果 盆栽种子 阳台种植 约20粒,所有分类>家居家纺、锅具餐具>宠物园艺>鲜花速递/绿植园艺>种子>津沽园艺>津沽园艺 花卉种子 ...,1号店,津沽园艺
1019007017,家居家装|建材|园艺,德国乐株沯盆栽植物花盆阳台种菜自动浇水花盆CUBICO COTTAGE30 象牙白色,家装建材>装饰材料>园艺休闲>乐株沯（lechuza）>德国乐株沯盆栽植物花盆阳台种菜自动浇水花...,京东商城,天盈盛世家居用品专营店
1019007017,家居家装|建材|园艺,Hodo/红豆 红豆集团红豆杉创意花卉高档礼品防辐射除甲醛办公室绿植桌面迷你植物,所有分类>家居家纺、锅具餐具>宠物园艺>鲜花速递/绿植园艺>盆栽>Hodo/红豆>Hodo/红豆 红豆...,1号店,Hodo/红豆
1019007017,家居家装|建材|园艺,华清园HQY 蝴蝶兰 鲜花 礼品 花卉 年宵花卉 绿植 植物 盆栽,所有分类>家居家纺、锅具餐具>宠物园艺>鲜花速递/绿植园艺>盆栽>华清园HQY>华清园HQY 蝴蝶兰...,1号店,华清园HQY
1019007017,家居家装|建材|园艺,津沽园艺 花卉种子 重瓣四季海棠种子 盆栽种植 皇后 粉色 约5粒,所有分类>家居家纺、锅具餐具>宠物园艺>鲜花速递/绿植园艺>种子>津沽园艺>津沽园艺 花卉种子 ...,1号店,津沽园艺
1019007017,家居家装|建材|园艺,我要发芽 蔬菜种子 樱桃萝卜种子 红樱桃萝卜 庭院盆栽 50粒/包,所有分类>家居家纺、锅具餐具>宠物园艺>鲜花速递/绿植园艺>种子>我要发芽>我要发芽 蔬菜种子 ...,1号店,我要发芽
1019007017,家居家装|建材|园艺,津沽园艺 多肉植物宝草玉露苗 套装含盆土 桌面创意迷你盆栽 防辐射绿植,所有分类>家居家纺、锅具餐具>宠物园艺>鲜花速递/绿植园艺>创意迷你植物>津沽园艺>津沽园艺 多肉植物宝...,1号店,津沽园艺
1019007017,家居家装|建材|园艺,我要发芽 水果种子 玲珑西瓜种子 极早熟 甜度高 家庭种植 可盆栽 8粒/包,所有分类>家居家纺、锅具餐具>宠物园艺>鲜花速递/绿植园艺>种子>我要发芽>我要发芽 水果种子 ...,1号店,我要发芽
1019007017,家居家装|建材|园艺,开馨宝 开心农场桌面解压红色恋人DIY种植草娃娃 小草人 小盆栽 草娃娃--相爱七夕节,所有分类>家居家纺、锅具餐具>宠物园艺>鲜花速递/绿植园艺>创意迷你植物>开馨宝>开馨宝 开心农场桌面...,1号店,开馨宝
1019007017,家居家装|建材|园艺,津沽园艺 多肉植物紫乐苗 珍稀品种 含盆土种植套餐 迷你盆栽桌面防辐射,所有分类>家居家纺、锅具餐具>宠物园艺>鲜花速递/绿植园艺>创意迷你植物>津沽园艺>津沽园艺 多肉植物紫...,1号店,津沽园艺
1019007017,家居家装|建材|园艺,花勿缺 地瓜种子 蔬菜种子 土豆种子 家庭种植（牧马山地瓜）,所有分类>家居家纺、锅具餐具>宠物园艺>鲜花速递/绿植园艺>种子>花勿缺>花勿缺 地瓜种子 蔬...,1号店,花勿缺
1019007017,家居家装|建材|园艺,我要发芽 蔬菜种子 野生朝天椒种子 小米椒 泡椒 超辣尖椒 盆栽辣椒50粒/包,所有分类>家居家纺、锅具餐具>宠物园艺>鲜花速递/绿植园艺>种子>我要发芽>我要发芽 蔬菜种子 ...,1号店,我要发芽
1019007017,家居家装|建材|园艺,我要发芽 花卉种子 鸡冠花种子 盆栽花卉 阳台种植 好养活 混色 50粒散装,所有分类>家居家纺、锅具餐具>宠物园艺>鲜花速递/绿植园艺>种子>我要发芽>我要发芽 花卉种子 ...,1号店,我要发芽
1019007017,家居家装|建材|园艺,花容叶貌 粉蕊铁兰 紫凤梨 中小型植物花卉 盆栽绿植 节庆恭贺,所有分类>家居家纺、锅具餐具>宠物园艺>鲜花速递/绿植园艺>盆栽>花容叶貌>花容叶貌 粉蕊铁兰 ...,1号店,花容叶貌
1019007017,家居家装|建材|园艺,花容叶貌 粉掌 桌上中大型四季开花植物 办公室居家恭贺盆栽 净化空气,所有分类>家居家纺、锅具餐具>宠物园艺>鲜花速递/绿植园艺>盆栽>花容叶貌>花容叶貌 粉掌 桌上...,1号店,花容叶貌
1019007017,家居家装|建材|园艺,沃施 豪华1.2气压喷水壶 家庭浇花壶 长柄喷壶 浇水壶 5337水壶,所有分类>家居家纺、锅具餐具>宠物园艺>鲜花速递/绿植园艺>园艺用品>浇灌设备>沃施>沃施 豪华1.2气压...,1号店,沃施
1019007017,家居家装|建材|园艺,PINDSTRUP 林木苗木花木大树种子, 腊梅树种子 30粒,所有分类>家居家纺、锅具餐具>宠物园艺>鲜花速递/绿植园艺>种子>PINDSTRUP>PINDSTRUP ...,1号店,PINDSTRUP
1019007017,家居家装|建材|园艺,花勿缺 给花卉黄叶补充营养必选肥料（ 硫酸亚铁）,所有分类>家居家纺、锅具餐具>宠物园艺>鲜花速递/绿植园艺>园艺用品>肥料/栽养>花勿缺>花勿缺 给花卉黄叶补...,1号店,花勿缺
1019007017,家居家装|建材|园艺,美乐棵 园艺肥料通用型 花卉盆栽营养液花肥 适用所有植物 500ml,所有分类>家居家纺、锅具餐具>宠物园艺>鲜花速递/绿植园艺>园艺用品>肥料/栽养>美乐棵>美乐棵 园艺肥料通用...,1号店,美乐棵
1019007017,家居家装|建材|园艺,花勿缺 西红柿彩包种子 庭院阳台袋装种子种植（牛奶黄番茄）种子,所有分类>家居家纺、锅具餐具>宠物园艺>鲜花速递/绿植园艺>种子>花勿缺>花勿缺 西红柿彩包种...,1号店,花勿缺
1019007017,家居家装|建材|园艺,华清园HQY 黄金葛 植物 花卉 绿植 盆栽 水培 礼品 可养鱼,所有分类>家居家纺、锅具餐具>宠物园艺>鲜花速递/绿植园艺>盆栽>华清园HQY>华清园HQY 黄金葛...,1号店,华清园HQY
1019007017,家居家装|建材|园艺,华清园HQY 绿宝树 幸福树 绿植 盆栽 室内大型植物 高档花卉 礼品,所有分类>家居家纺、锅具餐具>宠物园艺>鲜花速递/绿植园艺>盆栽>华清园HQY>华清园HQY 绿宝树...,1号店,华清园HQY
1019007017,家居家装|建材|园艺,美人兮MEIRENXI 多肉植物盆栽花卉 蛛丝卷绢多肉多浆植物 阳台桌面小型盆栽盆景花卉植物,所有分类>家居家纺、锅具餐具>宠物园艺>鲜花速递/绿植园艺>盆栽>美人兮MEIRENXI>美人兮MEIRENX...,1号店,美人兮MEIRENXI
1019007017,家居家装|建材|园艺,多肉植物盆栽花卉宝石花 玉蝶 多肉组合多浆植物 阳台桌面小型盆栽花卉绿植,所有分类>家居家纺、锅具餐具>宠物园艺>鲜花速递/绿植园艺>盆栽>美人兮MEIRENXI>多肉植物盆栽花卉宝石...,1号店,美人兮MEIRENXI
1019007017,家居家装|建材|园艺,蔬菜种子 五谷杂粮种子组合装 奶油南瓜（3包）早鲜糯白玉米（1包） 家庭种植 菜园种植,家装建材>装饰材料>园艺休闲>津沽园艺>蔬菜种子 五谷杂粮种子组合装 奶油南瓜（...,京东商城,绿之梦园艺生活馆
1019007017,家居家装|建材|园艺,芦荟盆栽苗（3棵）美容芦荟 花卉盆景室内植物 办公桌面防辐射 创意盆栽 护肤美容养颜 不含盆,家装建材>装饰材料>园艺休闲>津沽园艺>芦荟盆栽苗（3棵）美容芦荟 花卉盆景室内...,京东商城,绿之梦园艺生活馆
1019007017,家居家装|建材|园艺,津沽园艺 番杏科生石花种子石头花 多肉植物日轮玉种子混装（2包装） 盆栽易种植 每包10粒,家装建材>装饰材料>园艺休闲>津沽园艺>津沽园艺 番杏科生石花种子石头花 多肉植...,京东商城,津沽园艺旗舰店
1019007017,家居家装|建材|园艺,乐株沯花盆盆栽植物花盆阳台种菜盆自动浇水小花盆CUBICO COLOR22 白色,家装建材>装饰材料>园艺休闲>乐株沯（lechuza）>乐株沯花盆盆栽植物花盆阳台种菜盆自动浇水...,京东商城,天盈盛世家居用品专营店
1019007017,家居家装|建材|园艺,乐株沯植物盆栽花盆室内植物盆栽小花盆免浇水自动灌溉花盆DELTA15 白色,家装建材>装饰材料>园艺休闲>乐株沯（lechuza）>乐株沯植物盆栽花盆室内植物盆栽小花盆免浇...,京东商城,天盈盛世家居用品专营店
1019007017,家居家装|建材|园艺,香远花邺 多肉肥 仙人掌与多浆植物复合肥 多肉植物专用花肥料,家装建材>装饰材料>园艺休闲>香远花邺>香远花邺 多肉肥 仙人掌与多浆植物复合肥...,京东商城,香远花邺旗舰店
1019007017,家居家装|建材|园艺,Benary德国进口 园艺花卉种子 万寿菊小包装100粒,家装建材>装饰材料>园艺休闲>品氏>Benary德国进口 园艺花卉种子 万寿...,京东商城,品氏亿马园艺专卖店
1019007017,家居家装|建材|园艺,花勿缺 （美乐棵6L—）通用型 兰花型 蔬果型 园艺营养土,家装建材>装饰材料>园艺休闲>花勿缺>花勿缺 （美乐棵6L—）通用型 兰花型 ...,京东商城,花勿缺旗舰店
1019007017,家居家装|建材|园艺,BFUS北林出品 园艺花卉种子 高杆橙色硫华菊5克小包装,家装建材>装饰材料>园艺休闲> 品氏>BFUS北林出品 园艺花卉种子 高杆橙色...,京东商城,品氏亿马园艺专卖店
1019007017,家居家装|建材|园艺,丹麦品氏原装100%水藓有机质泥炭土育苗基质80L 18Kg*54 (整托盘54包起批发）,家装建材>装饰材料>园艺休闲>品氏>丹麦品氏原装100%水藓有机质泥炭土育苗...,京东商城,亿马园艺
1019007017,家居家装|建材|园艺,乐株沯盆栽植物花盆大花盆阳台种菜盆懒人免浇水自动灌溉烤漆花盆RONDO40 白色,家装建材>装饰材料>园艺休闲>乐株沯（lechuza）>乐株沯盆栽植物花盆大花盆阳台种菜盆懒人免...,京东商城,天盈盛世家居用品专营店
1019007017,家居家装|建材|园艺,花勿缺（丹参种子.）中草药种子 庭院盆栽袋装彩包种子 约30粒,家装建材>装饰材料>园艺休闲> 花勿缺>花勿缺（丹参种子.）中草药种子 庭院盆栽...,京东商城,花勿缺旗舰店
1019007017,家居家装|建材|园艺,花勿缺（益母草种子.）中草药材种子 家庭种植 袋装彩包种子,家装建材>装饰材料>园艺休闲> 花勿缺>花勿缺（益母草种子.）中草药材种子 家庭...,京东商城,花勿缺旗舰店
1019007017,家居家装|建材|园艺,花勿缺（白玉南瓜.）蔬菜种子 南瓜种子彩包装约6粒 庭院种植,家装建材>装饰材料>园艺休闲> 花勿缺>花勿缺（白玉南瓜.）蔬菜种子 南瓜种子彩...,京东商城,花勿缺旗舰店
1019007017,家居家装|建材|园艺,花勿缺（皇冠瓜种子.）佛手南瓜种子 观赏植物种子 蔬菜种子 8粒,家装建材>装饰材料>园艺休闲> 花勿缺>花勿缺（皇冠瓜种子.）佛手南瓜种子 观赏...,京东商城,花勿缺旗舰店
1019007017,家居家装|建材|园艺,蔬菜种子 娃娃菜F1种子 娃娃菜 口感极好 好种易活 家庭种植（4包装 10克/包）,家装建材>装饰材料>园艺休闲>津沽园艺>蔬菜种子 娃娃菜F1种子 娃娃菜 口感极...,京东商城,绿之梦园艺生活馆
1019007017,家居家装|建材|园艺,花勿缺（水果黄瓜种子.）蔬菜种子 家种阳台,家装建材>装饰材料>园艺休闲> 花勿缺>花勿缺（水果黄瓜种子.）蔬菜种子 家种阳...,京东商城,花勿缺旗舰店
1019007017,家居家装|建材|园艺,花勿缺（春秋黄瓜种子.）蔬菜种子 水果黄瓜种子 家种阳台 20粒,家装建材>装饰材料>园艺休闲> 花勿缺>花勿缺（春秋黄瓜种子.）蔬菜种子 水果黄...,京东商城,花勿缺旗舰店
1019007017,家居家装|建材|园艺,花勿缺（香芹种子.）芹菜种子 四季香芹 蔬菜种子 家庭种植,家装建材>装饰材料>园艺休闲> 花勿缺>花勿缺（香芹种子.）芹菜种子 四季香芹 ...,京东商城,花勿缺旗舰店
1019007017,家居家装|建材|园艺,园艺用品 花肥营养土 发酵鸡粪肥料 发酵有机肥 鸡肥 适合各种植物 无臭无味 4包装,家装建材>装饰材料>园艺休闲>津沽园艺>园艺用品 花肥营养土 发酵鸡粪肥料 发酵...,京东商城,津沽园艺旗舰店
1019007017,家居家装|建材|园艺,香远 向日葵种子 盆栽花卉种子 家庭阳台种植 10种可选 法国食用葵15粒 彩包装,家装建材>装饰材料>园艺休闲>香远花邺>香远 向日葵种子 盆栽花卉种子 家庭阳台...,京东商城,香远花邺旗舰店
1019007017,家居家装|建材|园艺,津沽园艺 蔬菜种子 南瓜种子 黄狼南瓜 改良黑皮南瓜 超甜甘粟王 蜜本 无蔓四号 品种任选 蜜本南瓜种子3包,家装建材>装饰材料>园艺休闲>津沽园艺>津沽园艺 蔬菜种子 南瓜种子 黄狼南瓜 ...,京东商城,津沽园艺旗舰店
1019007017,家居家装|建材|园艺,花勿缺（ 美女樱种子 盆栽阳台 易种花卉花卉种子 室内盆栽花卉植物 50粒,家装建材>装饰材料>园艺休闲> 花勿缺>花勿缺（ 美女樱种子 盆栽阳台 易种花卉...,京东商城,花勿缺旗舰店
1019007017,家居家装|建材|园艺,香远花邺 铁树专用肥 有机肥 盆景肥 绿植盆栽花肥,家装建材>装饰材料>园艺休闲>香远花邺>香远花邺 铁树专用肥 有机肥 盆景肥 绿...,京东商城,香远花邺旗舰店
1019007017,家居家装|建材|园艺,花勿缺（婆婆纳种子）双肾草 补肾强腰 多年生袋装彩包花草种子,家装建材>装饰材料>园艺休闲> 花勿缺>花勿缺（婆婆纳种子）双肾草 补肾强腰 多...,京东商城,花勿缺旗舰店
1019007017,家居家装|建材|园艺,香远花邺 催花王BB肥 缓效控释肥 绿植盆栽花肥 孕蕾催花,家装建材>装饰材料>园艺休闲>香远花邺>香远花邺 催花王BB肥 缓效控释肥 绿植...,京东商城,香远花邺旗舰店
1019007017,家居家装|建材|园艺,津沽园蔬菜种子 美好白茄 绿宝石 黑娇子长茄 优选牛心茄 大田紫罐茄F1茄子种子 品种任选 绿宝石茄子2包,家装建材>装饰材料>园艺休闲> 津沽园艺>津沽园蔬菜种子 美好白茄 绿宝石 黑娇子...,京东商城,津沽园艺旗舰店
1019007017,家居家装|建材|园艺,花勿缺 白莲太阳花种子 家庭专用阳台绿色植物创意盆栽易种,家装建材>装饰材料>园艺休闲>花勿缺>花勿缺 白莲太阳花种子 家庭专用阳台绿色...,京东商城,花勿缺旗舰店
1019007017,家居家装|建材|园艺,津沽园艺 蔬菜种子 菠菜种子 春秋大叶菠菜 红梗菜 翠绿大叶菠菜 山菠菜 多品种任选 春秋大叶菠菜3包,家装建材>装饰材料>园艺休闲> 津沽园艺>津沽园艺 蔬菜种子 菠菜种子 春秋大叶菠...,京东商城,津沽园艺旗舰店
1019007017,家居家装|建材|园艺,【景逸丽都】家庭阳台盆栽种植 蔬菜种子 四季小香葱种子,家装建材>装饰材料>园艺休闲>景逸丽都（JINGYILIDU）>【景逸丽都】家庭阳台盆栽种植 蔬菜种子 ...,京东商城,景逸丽都旗舰店
1019007017,家居家装|建材|园艺,美乐棵家庭园艺肥料 适用于室内户外庭院植物 水溶性通用型6支装,家装建材>装饰材料>园艺休闲>美乐棵（MIRACLE-GRO）>美乐棵家庭园艺肥料 适用于室内户外庭院植...,京东商城,美乐棵旗舰店
1019007017,家居家装|建材|园艺,津沽园艺 景天多肉植物 红美人 迷你小盆栽 办公室桌面必备 创意防辐射肉肉 红美人种植套餐1套,家装建材>装饰材料>园艺休闲> 津沽园艺>津沽园艺 景天多肉植物 红美人 迷你小盆...,京东商城,津沽园艺旗舰店
1019007017,家居家装|建材|园艺,花勿缺（ 红心桃种子 ）果树植物 庭院园林绿化工程花种 花叶观赏食用 红心桃种子 250g,家装建材>装饰材料>园艺休闲> 花勿缺>花勿缺（ 红心桃种子 ）果树植物 庭院园...,京东商城,花勿缺旗舰店
1019007017,家居家装|建材|园艺,花勿缺（ 红叶小檗种子） 即紫叶小檗庭院园林绿化工程花种子叶果观赏 红叶小檗种子 250g,家装建材>装饰材料>园艺休闲> 花勿缺>花勿缺（ 红叶小檗种子） 即紫叶小檗庭院...,京东商城,花勿缺旗舰店
1019007017,家居家装|建材|园艺,津沽园艺 多肉植物筒叶花月 吸财树 种植套装含盆土防辐射创意桌面迷你盆栽 吸财树单株苗2株,家装建材>装饰材料>园艺休闲> 津沽园艺>津沽园艺 多肉植物筒叶花月 吸财树 种植...,京东商城,津沽园艺旗舰店
1019007017,家居家装|建材|园艺,君子兰专用花肥 花卉盆景专用肥料 促花促箭,家装建材>装饰材料>园艺休闲>花勿缺>君子兰专用花肥 花卉盆景专用肥料 促花促...,京东商城,花勿缺旗舰店
1019007017,家居家装|建材|园艺,家装节【爱优尚】水培小发财树 室内观赏小盆栽 办公室植物 桌面绿植 防辐射 净化空气 玻璃瓶,家装建材>装饰材料>园艺休闲> 爱优尚（aiyoushang）>家装节【爱优尚】水培小发财树 室内观赏小...,京东商城,爱优尚绿植花卉旗舰店
1019007017,家居家装|建材|园艺,香远花邺 小花迷高效花草植物营养液2代花卉盆栽盆景种植草娃娃必备,家装建材>装饰材料>园艺休闲>香远花邺>香远花邺 小花迷高效花草植物营养液2代花...,京东商城,香远花邺旗舰店
1019007017,家居家装|建材|园艺,喷雾器 喷壶 饮料瓶喷头 小型气压式 洒水壶 园艺DIY多功能喷雾器 黄色喷雾器,家装建材>装饰材料>园艺休闲>斯特克>喷雾器 喷壶 饮料瓶喷头 小型气压式 洒...,京东商城,斯特克园林旗舰店
1019007017,家居家装|建材|园艺,【景逸丽都】方口环保树脂盆栽花盆 园艺小盆栽 买盆送托 白色 中号,家装建材>装饰材料>园艺休闲>景逸丽都（JINGYILIDU）>【景逸丽都】方口环保树脂盆栽花盆 园艺小...,京东商城,景逸丽都旗舰店
1019007017,家居家装|建材|园艺,大隆园林 大地樱桃萝卜种子 绿色优质小红萝卜 袖珍小萝卜种子 细嫩多汁 清脆爽口,家装建材>装饰材料>园艺休闲>大隆>大隆园林 大地樱桃萝卜种子 绿色优质小红...,京东商城,大隆园林旗舰店
1019007017,家居家装|建材|园艺,【多肉】锦上 多肉植物-秋丽 办公室内桌面小盆栽迷你小绿植 防辐射吸甲醛,家装建材>装饰材料>园艺休闲> 爱花派>【多肉】锦上 多肉植物-秋丽 办公室内桌...,京东商城,爱花派旗舰店
1019007017,家居家装|建材|园艺,绿苑（多肉植物-姬胧月A）景天科 防辐射桌面小盆栽,家装建材>装饰材料>园艺休闲> 绿苑园林>绿苑（多肉植物-姬胧月A）景天科 防辐射...,京东商城,绿苑园林官方旗舰店
1019007017,家居家装|建材|园艺,绿苑（多肉植物-姬星美人A）景天科 防辐射桌面小盆栽,家装建材>装饰材料>园艺休闲> 绿苑园林>绿苑（多肉植物-姬星美人A）景天科 防辐...,京东商城,绿苑园林官方旗舰店
1019007017,家居家装|建材|园艺,木轩 桔黄万寿菊|四季播|彩包 花卉种子|花草种子|易种|阳台盆栽 重瓣40粒/包,家装建材>装饰材料>园艺休闲> 木轩>木轩 桔黄万寿菊|四季播|彩包 花卉种子...,京东商城,木轩园艺官方旗舰店
1019007017,家居家装|建材|园艺,花勿缺（龙骨盆栽—）仙人多肉植物盆景 防辐射 吸甲醇 净化空气 塑料花盆 款式随机 含盆 带土,家装建材>装饰材料>园艺休闲> 花勿缺>花勿缺（龙骨盆栽—）仙人多肉植物盆景 防...,京东商城,花勿缺旗舰店
1019007017,家居家装|建材|园艺,沃施 WORTH 园艺工具960ML喷壶 家庭园艺 洒水 浇花喷雾器5320,家装建材>装饰材料>园艺休闲> 沃施（WORTH）>沃施 WORTH 园艺工具960ML喷壶...,京东商城,沃施驰俄伟业专卖店
1019007017,家居家装|建材|园艺,花堇 高档盆景 梅花盆景盆栽植物 造型独特 红梅 朱砂梅 梅花树桩 6年梅花盆景根茎2.5cm 含盆,家装建材>装饰材料>园艺休闲>花堇>花堇 高档盆景 梅花盆景盆栽植物 造型独...,京东商城,花堇旗舰店
1019007017,家居家装|建材|园艺,香远花邺 三色堇种子 花草盆栽种子 观花花卉种子 家庭阳台种植 波浪三色堇(混色)30粒 彩包装,家装建材>装饰材料>园艺休闲>香远花邺>香远花邺 三色堇种子 花草盆栽种子 观花...,京东商城,香远花邺旗舰店
1019007017,家居家装|建材|园艺,津沽园艺 景天多肉植物 红美人 迷你小盆栽 办公室桌面必备 创意防辐射肉肉 红美人单株苗2株,家装建材>装饰材料>园艺休闲> 津沽园艺>津沽园艺 景天多肉植物 红美人 迷你小盆...,京东商城,津沽园艺旗舰店
1019007017,家居家装|建材|园艺,花容叶貌 迷迭香 大型盆栽 浓香 食用型香料植物 净化空气 西点佐料绿植,所有分类>家居家纺、锅具餐具>宠物园艺>鲜花速递/绿植园艺>盆栽>花容叶貌>花容叶貌 迷迭香 大...,1号店,花容叶貌
1019007017,家居家装|建材|园艺,【景逸丽都】园艺休闲 九里香土培植物千里香 创意绿植盆栽 书房卧室花卉盆景带盆 小盆栽九里香,家装建材>装饰材料>园艺休闲> 景逸丽都（JINGYILIDU）>【景逸丽都】园艺休闲 九里香土培植物千里...,京东商城,景逸丽都旗舰店
1019007017,家居家装|建材|园艺,沃施 WORTH园艺花卉 观花植物 室内花卉盆栽薰衣草贵夫人,家装建材>装饰材料>园艺休闲> 沃施（WORTH）>沃施 WORTH园艺花卉 观花植物 室内...,京东商城,沃施驰俄伟业专卖店
1019007017,家居家装|建材|园艺,我要发芽 蔬菜种子 特长白杜豆种子 豆角种子 白豇豆 40g彩包,所有分类>家居家纺、锅具餐具>宠物园艺>鲜花速递/绿植园艺>种子>我要发芽>我要发芽 蔬菜种子 ...,1号店,我要发芽
1019007017,家居家装|建材|园艺,花容叶貌 幸福树 迷你花卉植物盆栽 送礼佳品 居家办公室净化空气绿植,所有分类>家居家纺、锅具餐具>宠物园艺>鲜花速递/绿植园艺>盆栽>花容叶貌>花容叶貌 幸福树 迷...,1号店,花容叶貌
1019007017,家居家装|建材|园艺,香远花邺 炫酷表情 草头绿植种植 DIY礼品 桌面迷你盆栽 6款可选 晕头,家装建材>装饰材料>园艺休闲>香远花邺>香远花邺 炫酷表情 草头绿植种植 DIY...,京东商城,香远花邺旗舰店
1019007017,家居家装|建材|园艺,盆栽阳台室内 易种 贝壳花银叶边翠菊种子文竹爬山虎地肤草籽种子 种子 爬山虎 彩包/袋,家装建材>装饰材料>园艺休闲>开心农场>盆栽阳台室内 易种 贝壳花银叶边翠菊种子...,京东商城,开心农场旗舰店
1019007017,家居家装|建材|园艺,花勿缺（ 茶花种子—） 世界名花之一庭院园林绿化工程花种子花叶观赏 茶花种子 250g,家装建材>装饰材料>园艺休闲> 花勿缺>花勿缺（ 茶花种子—） 世界名花之一庭院...,京东商城,花勿缺旗舰店