1019002009,家居家装|灯具|氛围照明,欣兰雅舍 人体感应LED小夜灯 婴儿感应夜灯 光控创意 节能宝宝灯 全能款(充插两用),家居家装>灯具>氛围照明> 欣兰雅舍（xlys）>欣兰雅舍 人体感应LED小夜灯 婴儿感应...,京东商城,欣兰雅舍旗舰店
1019002009,家居家装|灯具|氛围照明,SD灯饰 Sweetbox系列 大嘴巴水晶盐灯 s012含白炽灯泡 黄光,家居家装>灯具>氛围照明>SD>SD盐灯,京东商城,SD
1019002009,家居家装|灯具|氛围照明,Smart&Green智魅光韵 无线防水可调光LED氛围照明灯 盈月光语 直径50cm 白色 IP68,家居家装>灯具>氛围照明>智魅光韵（Smart&Green）>智魅光韵氛围照明灯,京东商城,智魅光韵（Smart&Green）
1019002009,家居家装|灯具|氛围照明,Beau&Vert博慧雅 无线防水可调光LED氛围照明灯 MICRO CUBE 16cm×16cm×14cm白色IP68,家居家装>灯具>氛围照明>博慧雅（Beau&Vert）>博慧雅氛围照明灯,京东商城,博慧雅（Beau&Vert）
1019002009,家居家装|灯具|氛围照明,娜佳水晶盐灯 香波城堡 欧式经典 氛围照明 净化空气负离子养生盐灯 白色,家装建材>灯饰照明>氛围照明>娜佳>娜佳水晶盐灯 香波城堡 欧式经典 氛围照...,京东商城,娜佳灯饰专卖店
1019002009,家居家装|灯具|氛围照明,娜佳水晶盐灯 装饰灯卧室灯客厅灯氛围照明 中国红淑芳瓶景德镇陶瓷灯 净化空气负离子养生盐灯,家装建材>灯饰照明>氛围照明>娜佳>娜佳水晶盐灯 装饰灯卧室灯客厅灯氛围照明...,京东商城,娜佳灯饰专卖店
1019002009,家居家装|灯具|氛围照明,太阳能灯 太阳能路灯 led庭院灯户外墙壁灯射灯投光灯 氛围照明,家居家装>灯具>氛围照明>太阳能灯 太阳能路灯 led庭院灯户外墙...,京东商城,布雷科曼BULEKEM旗舰店
1019002009,家居家装|灯具|氛围照明,爱的曼语 变身怪杰萌可爱创意灯具 LED节能环保充电小台灯 小夜灯氛围照明 家居礼品礼物 李小龙,家居家装>灯具>氛围照明>爱的曼语>爱的曼语 变身怪杰萌可爱创意灯具 LED...,京东商城,淘爱创意家居旗舰店
1019002009,家居家装|灯具|氛围照明,劲森光电 3G工厂照明灯 工矿灯80W,家居家纺、锅具餐具>家具/灯具>灯具>氛围照明>劲森光电,1号店,劲森光电
1019002009,家居家装|灯具|氛围照明,飞利浦Philips 氛围灯Livingcolors魔灯绽放69502黑色,家居家装>灯具>氛围照明> 飞利浦（PHILIPS）>飞利浦魔灯,京东商城,飞利浦（PHILIPS）
1019002009,家居家装|灯具|氛围照明,娜佳水晶盐灯 装饰灯卧室灯客厅灯氛围照明 珐琅彩永寿瓶景德镇陶瓷灯 净化空气负离子养生盐灯,家装建材>灯饰照明>氛围照明>娜佳>娜佳水晶盐灯 装饰灯卧室灯客厅灯氛围照明...,京东商城,娜佳灯饰专卖店
1019002009,家居家装|灯具|氛围照明,海伯瑞 月光宝石灯天然晶簇烛台包括铁艺托和茶蜡,家居家装>灯具>氛围照明>海伯瑞>海伯瑞宝石灯,京东商城,海伯瑞
1019002009,家居家装|灯具|氛围照明,led灯带 3528超亮贴片 5050灯带led高压灯带 led软灯条 60珠/米 蓝色 3528,家居家装>灯具>氛围照明>索尔达>led灯带 3528超亮贴片 5050灯...,京东商城,索尔达官方旗舰店
1019002009,家居家装|灯具|氛围照明,馨兴点灯 节能创意感应小夜灯LED 蘑菇灯床头灯小夜灯插电光控 楼道走道楼梯墙角夜灯 橙色,家居家装>灯具>氛围照明>馨兴点灯>馨兴点灯 节能创意感应小夜灯LED 蘑菇...,京东商城,馨兴点灯家居旗舰店
1019002009,家居家装|灯具|氛围照明,欣兰雅舍 阿拉神灯创意变色夜灯 床头灯氛围照明蓝牙音箱便携式无线蓝牙音箱 送TF储存卡 蓝色,家居家装>灯具>氛围照明> 欣兰雅舍（xlys）>欣兰雅舍 阿拉神灯创意变色夜灯 床头灯氛...,京东商城,欣兰雅舍旗舰店
1019002009,家居家装|灯具|氛围照明,嘉博视 LED吹控小夜灯 复古煤油充电调光小台灯 锂电户外照明马灯 T968 墨绿色,家居家装>灯具>氛围照明> 嘉博视>嘉博视 LED吹控小夜灯 复古煤油充电调...,京东商城,嘉博视旗舰店
1019002009,家居家装|灯具|氛围照明,海伯瑞水晶盐灯天然盐石聚宝盆,家居家装>灯具>氛围照明>海伯瑞>海伯瑞水晶盐灯,京东商城,海伯瑞
1019002009,家居家装|灯具|氛围照明,海伯瑞水晶盐灯南瓜形铁艺火盆,家居家装>灯具>氛围照明>海伯瑞>海伯瑞水晶盐灯,京东商城,海伯瑞
1019002009,家居家装|灯具|氛围照明,SD灯饰 Sweetbox系列 宫廷盐灯水晶盐灯 小号s013含白炽灯泡 黄光,家居家装>灯具>氛围照明>SD>SD盐灯,京东商城,SD
1019002009,家居家装|灯具|氛围照明,海伯瑞水晶盐灯自然形烛台赠送茶蜡,家居家装>灯具>氛围照明>海伯瑞>海伯瑞水晶盐灯,京东商城,海伯瑞
1019002009,家居家装|灯具|氛围照明,Smart&Green智魅光韵 无线防水可调光LED氛围照明灯 洛克光岩 33cm×31cm 白色 IP68,家居家装>灯具>氛围照明>智魅光韵（Smart&Green）>智魅光韵氛围照明灯,京东商城,智魅光韵（Smart&Green）
1019002009,家居家装|灯具|氛围照明,Beau&Vert博慧雅 无线防水可调光LED氛围照明灯 水晶布丁 25cm×25cm×25cm白色IP44,家居家装>灯具>氛围照明>博慧雅（Beau&Vert）>博慧雅氛围照明灯,京东商城,博慧雅（Beau&Vert）
1019002009,家居家装|灯具|氛围照明,娜佳水晶盐灯 装饰灯卧室灯阳台灯过道灯客厅灯氛围照明 爱丁堡 欧式经典 净化空气负离子养生,家装建材>灯饰照明>氛围照明>娜佳>娜佳水晶盐灯 装饰灯卧室灯阳台灯过道灯客...,京东商城,娜佳灯饰国泰易达专卖店
1019002009,家居家装|灯具|氛围照明,爱的曼语 变身怪杰萌可爱创意灯具 LED节能环保充电小台灯 小夜灯氛围照明 家居礼品礼物 奶牛,家居家装>灯具>氛围照明>爱的曼语>爱的曼语 变身怪杰萌可爱创意灯具 LED...,京东商城,淘爱创意家居旗舰店
1019002009,家居家装|灯具|氛围照明,太阳能灯 水漂灯 led庭院灯 户外池塘灯 湖泊灯 彩光-水漂灯,家居家装>灯具>氛围照明>布雷科曼（BULEKEM）>太阳能灯 水漂灯 led庭院灯 户外池塘...,京东商城,布雷科曼BULEKEM旗舰店
1019002009,家居家装|灯具|氛围照明,奥智捷 仿羊皮灯置物灯雕花灯壁灯三种花型1.2米 花样年华,家居家装>灯具>氛围照明>奥智捷（Agenius）>奥智捷 仿羊皮灯置物灯雕花灯壁灯三种花型...,京东商城,奥智捷智能照明旗舰店
1019002009,家居家装|灯具|氛围照明,LED带音响小夜灯触摸调光小台灯USB充电小台灯电脑手机音响卧室床头灯 黑色,家居家装>灯具>氛围照明>晨朵>LED带音响小夜灯触摸调光小台灯USB充...,京东商城,晨朵官方旗舰店
1019002009,家居家装|灯具|氛围照明,馨兴点灯 光控感应智能小方小夜灯 浪漫温馨家居卧室LED节能小夜灯 生日礼品 蓝色,家居家装>灯具>氛围照明>馨兴点灯>馨兴点灯 光控感应智能小方小夜灯 浪漫温...,京东商城,馨兴点灯家居旗舰店
1019002009,家居家装|灯具|氛围照明,伟普照明 蒂凡尼系列 装饰灯卧室灯阳台灯过道灯具客厅灯饰氛围照明 卧室床头灯 欧式台灯,家装建材>灯饰照明>装饰灯>伟普照明 蒂凡尼系列 装饰灯卧室灯阳台灯...,京东商城,娜佳灯饰
1019002009,家居家装|灯具|氛围照明,曦普 射灯背景墙灯氛围照明led客厅商业吊顶天花灯全套led筒灯射灯35712w 精品3w白光,家装建材>灯饰照明>筒灯/射灯> 曦普>曦普 射灯背景墙灯氛围照明led客厅商业...,京东商城,曦普照明专营店