1019007017,家居家装|建材|园艺,绿趣园艺 观音竹(2盆装 厂商带货直送,限上海市区),家居装修 > 园艺、花束、庭院 > 鲜花、绿植 > 室内植物 > 观叶盆栽,亚马逊(卓越网),绿趣园艺
1019007017,家居家装|建材|园艺,EDIBELL 爱迪贝尔 晶之爱-珍爱相约（紫+白）6103,家居装修 > 园艺、花束、庭院 > 鲜花、绿植 > 室内植物 > 迷你盆栽,亚马逊(卓越网),EDIBELL 爱迪贝尔
1019007017,家居家装|建材|园艺,缤纷盆载 绿铁(2棵 含花盆 厂商带货直送,限北京市区),家居装修 > 园艺、花束、庭院 > 鲜花、绿植 > 室内植物 > 迷你盆栽,亚马逊(卓越网),缤纷盆载
1019007017,家居家装|建材|园艺,清晏斋 瓷盆-独本发财树(厂商带货直送,限北京市区),家居装修 > 园艺、花束、庭院 > 鲜花、绿植 > 室内植物 > 观叶盆栽,亚马逊(卓越网),清晏斋
1019007017,家居家装|建材|园艺,绿趣园艺 火炬(厂商带货直送,限上海市区),家居装修 > 园艺、花束、庭院 > 鲜花、绿植 > 室内植物 > 观叶盆栽,亚马逊(卓越网),绿趣园艺
1019007017,家居家装|建材|园艺,绿趣园艺 大黄金宝玉(限上海市区供应, 厂商带货直送),家居装修 > 园艺、花束、户外 > 园艺与花束 > 室内植物 > 观叶盆栽,亚马逊(卓越网),
1019007017,家居家装|建材|园艺,绿趣园艺 大天堂鸟(1.5M 厂商带货直送,限上海市区),家居装修 > 园艺、花束、庭院 > 鲜花、绿植 > 室内植物 > 观叶盆栽,亚马逊(卓越网),绿趣园艺
1019007017,家居家装|建材|园艺,锦萱 DIY园艺易拉罐花卉植物 幸运草种子 迷你植物 罐装植物 办公室种植 室内种植 迷你园艺,家居装修 > 园艺、花束、庭院 > 鲜花、绿植 > 种子 > 花种 ,亚马逊(卓越网),锦萱
1019007017,家居家装|建材|园艺,雨后花语 仙人球盆栽 金琥 降低电磁辐射 增加氧气浓度 2个,家居装修 > 园艺、花束、庭院 > 鲜花、绿植 > 室内植物 > 迷你盆栽,亚马逊(卓越网),雨后花语
1019007017,家居家装|建材|园艺,雨后花语 室内迷你盆栽 袖珍椰子 可水培 无土环保 不含容器发货 2盆,家居装修 > 园艺、花束、庭院 > 鲜花、绿植 > 室内植物 > 水生植物 ,亚马逊(卓越网),雨后花语
1019007017,家居家装|建材|园艺,雨后花语 花仙子种子 瓜果蔬菜类 可食用或观赏植物 地栽室内盆栽均可 风铃观赏椒,家居装修 > 园艺、花束、庭院 > 鲜花、绿植 > 种子 > 蔬菜种子,亚马逊(卓越网),雨后花语
1019007017,家居家装|建材|园艺,雨后花语 易拉罐种子系列 室内种植 迷你园艺 草莓,家居装修 > 园艺、花束、庭院 > 鲜花、绿植 > 庭院植物 > 果树 ,亚马逊(卓越网),雨后花语
1019007017,家居家装|建材|园艺,雨后花语 园艺用品系列 海绵宝宝 水培植物根部护理 室内装饰,家居装修 > 园艺、花束、庭院 > 园艺设施 > 花肥、药剂、营养土,亚马逊(卓越网),雨后花语
1019007017,家居家装|建材|园艺,锦萱 香椿树苗 庭院植物 果树 树苗 被称为“树上蔬菜” 保健蔬菜 提高免疫力 吃香椿有益健康 保健养生 不支持货到付款,家居装修 > 园艺、花束、庭院 > 鲜花、绿植 > 室内植物 > 观叶盆栽 ,亚马逊(卓越网),锦萱
1019007017,家居家装|建材|园艺,【花清枫】如水金色万年青盆栽，容易养，好成活 适合室内桌面摆放的水培小植物（北方地区因天气严寒暂不发货，北方地区客户勿订购） 搭配透明玻璃盆,家居装修 > 园艺、花束、庭院 > 鲜花、绿植 > 室内植物 > 盆景 ,亚马逊(卓越网),花清枫
1019007017,家居家装|建材|园艺,锦萱 三叶草种子 别名车轴草种子 家庭种植实用装 阳台室内盆栽花卉种子 庭院花种子,家居装修 > 园艺、花束、庭院 > 鲜花、绿植 > 种子 > 香草、药草种子,亚马逊(卓越网),锦萱
1019007017,家居家装|建材|园艺,锦萱 锦葵种子 别名荆葵，钱葵，小钱花，金钱紫花葵，小白淑气花，淑气花，棋盘花种子 家庭种植实用装 阳台室内盆栽花卉种子 庭院花种子,家居装修 > 园艺、花束、庭院 > 鲜花、绿植 > 种子 > 花种,亚马逊(卓越网),锦萱
1019007017,家居家装|建材|园艺,锦萱 果香菊种子 家庭种植实用装 阳台室内盆栽花卉种子 庭院花种子,家居装修 > 园艺、花束、庭院 > 鲜花、绿植 > 种子 > 香草、药草种子,亚马逊(卓越网),锦萱
1019007017,家居家装|建材|园艺,锦萱 萝卜芽菜苗种子 家庭种植实用装 阳台室内盆栽花卉种子 庭院花种子 瓜果蔬菜种子,家居装修 > 园艺、花束、庭院 > 鲜花、绿植 > 种子 > 蔬菜种子,亚马逊(卓越网),锦萱
1019007017,家居家装|建材|园艺,锦萱 麦仙翁种子 家庭种植实用装 阳台室内盆栽花卉种子 庭院花种子,家居装修 > 园艺、花束、庭院 > 鲜花、绿植 > 种子 > 花种,亚马逊(卓越网),锦萱
1019007017,家居家装|建材|园艺,锦萱 彩蝶蓝萼鼠尾草种子 家庭种植实用装 阳台室内盆栽花卉种子 庭院花种子,家居装修 > 园艺、花束、庭院 > 鲜花、绿植 > 种子 > 花种,亚马逊(卓越网),锦萱
1019007017,家居家装|建材|园艺,蔬菜小葱种子 上海小香葱（3包装）香味浓口感好 春秋播种 庭院家庭阳台种植,家装建材>装饰材料>园艺休闲>津沽园艺>蔬菜小葱种子 上海小香葱（3包装）香味浓...,京东商城,绿之梦园艺生活馆
1019007017,家居家装|建材|园艺,小花农 DIY易拉罐 办公室防辐射迷你植物盆栽 罐头花 牵牛花 40085,家居装修 > 园艺、花束、庭院 > 鲜花、绿植 > 室内植物 > 迷你盆栽,亚马逊(卓越网),小花农
1019007017,家居家装|建材|园艺,小花农 DIY易拉罐 办公室防辐射迷你植物盆栽 罐头花 紫罗兰 40094,家居装修 > 园艺、花束、庭院 > 鲜花、绿植 > 室内植物 > 迷你盆栽,亚马逊(卓越网),小花农
1019007017,家居家装|建材|园艺,清晏斋小型台湾榕树盆栽(含花盆 厂商带货直送,限北京市区),家居装修 > 园艺、花束、庭院 > 鲜花、绿植 > 室内植物,亚马逊(卓越网),清晏斋
1019007017,家居家装|建材|园艺,蝴蝶兰 粉白色(单棵 限上海市区供应 12月-2月供应, 厂商带货直送),家居装修 > 园艺、花束、庭院 > 鲜花、绿植 > 室内植物 > 观花盆栽,亚马逊(卓越网),Modular 莫多拉
1019007017,家居家装|建材|园艺,蝴蝶兰 粉白色(八棵 限上海市区供应 12月-2月供应, 厂商带货直送),家居装修 > 园艺、花束、庭院 > 鲜花、绿植 > 室内植物 > 观花盆栽,亚马逊(卓越网),Modular 莫多拉
1019007017,家居家装|建材|园艺,绿趣园艺 榕树球(厂商带货直送,限上海市区),家居装修 > 园艺、花束、庭院 > 鲜花、绿植 > 室内植物 > 观叶盆栽,亚马逊(卓越网),绿趣园艺
1019007017,家居家装|建材|园艺,清晏斋办公室内桌面小绿植花卉 小发财树含盆套装(厂商带货直送,限北京市区),家居装修 > 园艺、花束、庭院 > 鲜花、绿植 > 室内植物 > 迷你盆栽,亚马逊(卓越网),清晏斋
1019007017,家居家装|建材|园艺,清晏斋办公室内桌面小绿植花卉 水培金边吊兰含盆套装(厂商带货直送,限北京市区),家居装修 > 园艺、花束、庭院 > 鲜花、绿植 > 室内植物 > 迷你盆栽,亚马逊(卓越网),清晏斋
1019007017,家居家装|建材|园艺,饭盆型 陶瓷 花盆 小号 约250g 迷你植物盆栽小花盆花器皿绿植,家装建材>装饰材料>园艺休闲>饭盆型 陶瓷 花盆 小号 约250g 迷...,京东商城,爱花派旗舰店
1019007017,家居家装|建材|园艺,开心农场阳台种菜 28联深层种植箱 家庭阳台屋顶蔬菜花卉菜园绿植盆栽 百变组合 仅种植箱,家装建材>装饰材料>园艺休闲>开心农场阳台种菜 28联深层种植箱 家庭...,京东商城,开心农场
1019007017,家居家装|建材|园艺,小花农 荷兰进口风信子种球 2粒袋装 蓝色,家居装修 > 园艺、花束、庭院 > 鲜花、绿植 > 室内植物 > 迷你盆栽,亚马逊(卓越网),小花农
1019007017,家居家装|建材|园艺,Little Garden 秘密小花园 晶灵花园系列 星座许愿水晶 土の愿 朝气黄,家居装修 > 园艺、花束、庭院 > 鲜花、绿植 > 室内植物 > 迷你盆栽,亚马逊(卓越网),秘密小花园
1019007017,家居家装|建材|园艺,【花清枫】如水小红星盆栽，容易养，好成活 寓意鸿运当头 适合办公室的水培植物 送礼首选 （北方地区因天气严寒暂不发货，北方地区客户勿订购）(晶莹玻璃盆款),家居装修 > 园艺、花束、庭院 > 鲜花、绿植 > 室内植物 > 迷你盆栽,亚马逊(卓越网),花清枫
1019007017,家居家装|建材|园艺,光一 五色菊 特殊植物 室内迷你植物花卉盆栽 小型带盆底盆栽 大号,家居装修/类别/园艺、花束、庭院/鲜花、绿植/室内植物/迷你盆栽,亚马逊(卓越网),光一
1019007017,家居家装|建材|园艺,秘密小花园 创意桌面玩具 迷你绿植 清爽地中海风情 藿香草,家居装修 > 园艺、花束、庭院 > 鲜花、绿植 > 室内植物 > 迷你盆栽,亚马逊(卓越网),秘密小花园
1019007017,家居家装|建材|园艺,秘密小花园 踏雪寻梅系列 圣诞款迷你小绿植 秋罗,家居装修 > 园艺、花束、庭院 > 鲜花、绿植 > 室内植物 > 迷你盆栽,亚马逊(卓越网),秘密小花园
1019007017,家居家装|建材|园艺,光一 牛至 室内植物花卉 鲜花小型盆栽 桌面迷你绿植含泥土肥料,家居装修/类别/园艺、花束、庭院/鲜花、绿植/室内植物/迷你盆栽,亚马逊(卓越网),光一
1019007017,家居家装|建材|园艺,光一 蜀葵 室内植物花卉 鲜花小型盆栽 桌面迷你绿植含泥土肥料,家居装修/类别/园艺、花束、庭院/鲜花、绿植/室内植物/迷你盆栽,亚马逊(卓越网),光一
1019007017,家居家装|建材|园艺,光一 松叶牡丹 室内植物花卉 鲜花小型盆栽 桌面迷你绿植含泥土肥料,家居装修/类别/园艺、花束、庭院/鲜花、绿植/室内植物/迷你盆栽,亚马逊(卓越网),光一
1019007017,家居家装|建材|园艺,光一 五色菊 特殊植物 室内迷你植物花卉盆栽 小型带盆底盆栽 大号,家居装修/类别/园艺、花束、庭院/鲜花、绿植/室内植物/迷你盆栽,亚马逊(卓越网),光一
1019007017,家居家装|建材|园艺,小花农 精装十二星座 射手狮子巨蟹处女金牛水瓶天蝎牧羊魔蝎 套装 双子座长春花,家居装修 > 园艺、花束、庭院 > 鲜花、绿植 > 室内植物 > 迷你盆栽,亚马逊(卓越网),小花农
1019007017,家居家装|建材|园艺,津沽园艺 花卉种子 爱情魔豆 神奇魔幻植物盆栽种植1粒 文字随机,所有分类>家居家纺、锅具餐具>宠物园艺>鲜花速递/绿植园艺>种子>津沽园艺>津沽园艺 花卉种子 ...,1号店,津沽园艺
1019007017,家居家装|建材|园艺,津沽园艺 花卉种子 香草 芳香植物 蓝色希德薰衣草 家庭阳台庭院种植约10粒,所有分类>家居家纺、锅具餐具>宠物园艺>鲜花速递/绿植园艺>种子>津沽园艺>津沽园艺 花卉种子 ...,1号店,津沽园艺
1019007017,家居家装|建材|园艺,津沽园艺 多肉植物 小星球兜 仙人球 防辐射防静电约1.5-2.5cm 单株苗,所有分类>家居家纺、锅具餐具>宠物园艺>鲜花速递/绿植园艺>盆栽>津沽园艺>津沽园艺 多肉植物 ...,1号店,津沽园艺
1019007017,家居家装|建材|园艺,光一 醉蝶花 室内植物花卉 鲜花小型盆栽 桌面迷你绿植含泥土肥料,家居装修/类别/园艺、花束、庭院/鲜花、绿植/室内植物/迷你盆栽,亚马逊(卓越网),光一
1019007017,家居家装|建材|园艺,立泰悦达 （整套含盆）夏威夷椰子 绿植 绿色植物 绿萝 室内植物 高档礼品花卉 L1198,家居装修 > 园艺、花束、庭院 > 鲜花、绿植 > 室内植物 > 观叶盆栽,亚马逊(卓越网),立泰悦达
1019007017,家居家装|建材|园艺,立泰悦达 鸟巢蕨盆栽 绿植 绿色植物 绿萝吊兰 室内植物 高档礼品花卉 L1169（H:约23-25cm）,家居装修 > 园艺、花束、庭院 > 鲜花、绿植 > 室内植物 > 水生植物 ,亚马逊(卓越网),立泰悦达
1019007017,家居家装|建材|园艺,立泰悦达 发财树盆栽 绿色植物 绿萝吊兰 室内植物 高档礼品花卉 L1152（H:约25cm）,家居装修 > 园艺、花束、庭院 > 鲜花、绿植 > 室内植物 > 观叶盆栽,亚马逊(卓越网),立泰悦达
1019007017,家居家装|建材|园艺,立泰悦达 花卉病虫清（3个装） 绿植 绿色植物 绿萝吊兰 盆栽 室内植物 高档盆花 花卉 L1127,家居装修 > 园艺、花束、庭院 > 鲜花、绿植 > 室内植物 > 水生植物 ,亚马逊(卓越网),立泰悦达
1019007017,家居家装|建材|园艺,立泰悦达 千手观音盆栽 绿植 绿色植物 绿萝吊兰 室内植物 高档礼品花卉 L1166（H:约30cm）,家居装修 > 园艺、花束、庭院 > 鲜花、绿植 > 室内植物 > 水生植物 ,亚马逊(卓越网),立泰悦达
1019007017,家居家装|建材|园艺,立泰悦达 绿植 绿色植物 鸟巢蕨 盆栽 室内植物 高档盆花 花卉 L1110（H:约20-25cm）,家居装修 > 园艺、花束、庭院 > 鲜花、绿植 > 室内植物 > 观叶盆栽,亚马逊(卓越网),立泰悦达
1019007017,家居家装|建材|园艺,立泰悦达 千手观音盆栽 绿植 绿色植物 绿萝吊兰 室内植物 高档礼品花卉 L1168（H:约30cm）,家居装修 > 园艺、花束、庭院 > 鲜花、绿植 > 室内植物 > 水生植物 ,亚马逊(卓越网),立泰悦达
1019007017,家居家装|建材|园艺,Sprout 我要发芽 花卉种子 藤本月季花种子 蔷薇花种子 可盆栽 庭院种植 品种齐全 (金丝10粒),家居装修 > 园艺、花束、庭院 > 鲜花、绿植 > 种子 > 花种,亚马逊(卓越网),Sprout 我要发芽
1019007017,家居家装|建材|园艺,Sprout 我要发芽 花卉种子 藤本月季花种子 蔷薇花种子 可盆栽 庭院种植 品种齐全 (藤金兔10粒),家居装修 > 园艺、花束、庭院 > 鲜花、绿植 > 种子 > 花种,亚马逊(卓越网),Sprout 我要发芽
1019007017,家居家装|建材|园艺,花堇 桌面绿植 盆栽 虎皮兰 仙人多肉防辐射植物盆栽 罗马盆蓝栽好,家装建材>装饰材料>园艺休闲>花堇 桌面绿植 盆栽 虎皮兰 仙人多肉防...,京东商城,花堇旗舰店
1019007017,家居家装|建材|园艺,花堇 植物肥料 基质有机肥料 种菜种花 鸡屎粪肥,家装建材>装饰材料>园艺休闲>花堇 植物肥料 基质有机肥料 种菜种花 ...,京东商城,花堇旗舰店
1019007017,家居家装|建材|园艺,立泰悦达 大型植物绿宝石 盆栽 水培 花卉 绿色室内植物 园艺产品用品 净化空气 礼品花,家装建材>装饰材料>园艺休闲>立泰悦达>立泰悦达 大型植物绿宝石 盆栽 水培 花...,京东商城,立泰悦达旗舰店
1019007017,家居家装|建材|园艺,花堇 仙人多肉植物 绿植盆栽 防辐射 桌面绿植 迷你植物 玉露,家装建材>装饰材料>园艺休闲>花堇>花堇 仙人多肉植物 绿植盆栽 防辐射 桌...,京东商城,花堇旗舰店
1019007017,家居家装|建材|园艺,花堇 仙人多肉植物 绿植盆栽 防辐射 桌面绿植 迷你植物 火祭,家装建材>装饰材料>园艺休闲>花堇>花堇 仙人多肉植物 绿植盆栽 防辐射 桌...,京东商城,花堇旗舰店
1019007017,家居家装|建材|园艺,立泰悦达绿植/绿色植物/绿萝吊兰/猪笼草/盆栽/室内植物/高档盆花/花卉/L1102 盆栽猪笼草,家装建材>装饰材料>园艺休闲>立泰悦达>立泰悦达绿植/绿色植物/绿萝吊兰/猪笼草...,京东商城,立泰悦达
1019007017,家居家装|建材|园艺,花堇 食虫植物 吃虫驱虫防蚊家居必备盆栽 猪笼草 带盆,家装建材>装饰材料>园艺休闲>花堇>花堇 食虫植物 吃虫驱虫防蚊家居必备盆栽...,京东商城,花堇旗舰店
1019007017,家居家装|建材|园艺,【立泰悦达】富贵塔竹（精品13层含盆）绿色 室内盆栽植物 高档礼品花卉 净化空气 美化环境 富贵塔竹13层,家装建材>装饰材料>园艺休闲>立泰悦达>【立泰悦达】富贵塔竹（精品13层含盆）绿...,京东商城,立泰悦达旗舰店
1019007017,家居家装|建材|园艺,津沽园艺 多肉植物 石头花 2年生番杏属金铃苗2.0cm以上 稀有品种 单株苗,所有分类>家居家纺、锅具餐具>宠物园艺>鲜花速递/绿植园艺>盆栽>津沽园艺>津沽园艺 多肉植物 ...,1号店,津沽园艺
1019007017,家居家装|建材|园艺,津沽园艺 蔬菜种子 油菜 矮脚白 家庭阳台菜园庭院种植约30克,所有分类>家居家纺、锅具餐具>宠物园艺>鲜花速递/绿植园艺>种子>津沽园艺>津沽园艺 蔬菜种子 ...,1号店,津沽园艺
1019007017,家居家装|建材|园艺,花勿缺 盆栽菊花种子 家庭袋装彩包种植(花环菊)种子 约50粒,所有分类>家居家纺、锅具餐具>宠物园艺>鲜花速递/绿植园艺>种子>花勿缺>花勿缺 盆栽菊花种子...,1号店,花勿缺
1019007017,家居家装|建材|园艺,花勿缺 蔬果种子 阳台庭院种植 盆栽蔬菜（长茄子）种子,所有分类>家居家纺、锅具餐具>宠物园艺>鲜花速递/绿植园艺>种子>花勿缺>花勿缺 蔬果种子 阳...,1号店,花勿缺
1019007017,家居家装|建材|园艺,花勿缺 观花植物 室内花卉盆栽 阳台花（垂吊美女樱 ）种子,所有分类>家居家纺、锅具餐具>宠物园艺>鲜花速递/绿植园艺>种子>花勿缺>花勿缺 观花植物 室...,1号店,花勿缺
1019007017,家居家装|建材|园艺,华清园HQY 鸿运当头 凤梨 绿植 红星 盆栽 花卉 植物 鲜花 礼品 水培,所有分类>家居家纺、锅具餐具>宠物园艺>鲜花速递/绿植园艺>盆栽>华清园HQY>华清园HQY 鸿运当...,1号店,华清园HQY
1019007017,家居家装|建材|园艺,华清园HQY 小仙女 高档花卉 绿植 盆栽 花卉 水培,所有分类>家居家纺、锅具餐具>宠物园艺>鲜花速递/绿植园艺>盆栽>华清园HQY>华清园HQY 小仙女...,1号店,华清园HQY
1019007017,家居家装|建材|园艺,津沽园艺 花卉种子 重瓣大牵牛 喇叭花 阳台盆栽种植 约10粒,所有分类>家居家纺、锅具餐具>宠物园艺>鲜花速递/绿植园艺>种子>津沽园艺>津沽园艺 花卉种子 ...,1号店,津沽园艺
1019007017,家居家装|建材|园艺,宝芮思 经典版仿真绣球盆栽 402713,家居装修 > 园艺、花束、庭院 > 鲜花、绿植 > 室内植物 > 迷你盆栽,亚马逊(卓越网),宝芮思
1019007017,家居家装|建材|园艺,津沽园艺 园艺用品 种子植物花卉标签 插地牌 10个装随机发,所有分类>家居家纺、锅具餐具>宠物园艺>鲜花速递/绿植园艺>园艺用品>园艺工具>津沽园艺>津沽园艺 园艺用品 ...,1号店,津沽园艺
1019007017,家居家装|建材|园艺,会珍 风信子荷兰种球 水培土培都行24个品种盆栽花卉 发货带水培瓶一套 芬达,家居装修 > 园艺、花束、庭院 > 鲜花、绿植 > 室内植物 > 观花盆栽,亚马逊(卓越网),会珍
1019007017,家居家装|建材|园艺,会珍 风信子荷兰种球 水培土培都行24个品种盆栽花卉 发货带水培瓶一套 星空,家居装修 > 园艺、花束、庭院 > 鲜花、绿植 > 室内植物 > 观花盆栽,亚马逊(卓越网),会珍
1019007017,家居家装|建材|园艺,华清园HQY 红掌 火鹤 绿植 盆栽 花卉 鲜花 礼品 年宵花卉,所有分类>家居家纺、锅具餐具>宠物园艺>鲜花速递/绿植园艺>盆栽>华清园HQY>华清园HQY 红掌 ...,1号店,华清园HQY
1019007017,家居家装|建材|园艺,花勿缺 （文竹）盆栽花卉水培植物 办公室 室内 防辐射创意绿植盆景,所有分类>家居家纺、锅具餐具>宠物园艺>鲜花速递/绿植园艺>盆栽>花勿缺>花勿缺 （文竹）盆栽...,1号店,花勿缺
1019007017,家居家装|建材|园艺,花勿缺 【八千代】多肉植物绿植 小盆栽 净化空气 防辐射 含花盆,所有分类>家居家纺、锅具餐具>宠物园艺>鲜花速递/绿植园艺>盆栽>花勿缺>花勿缺 【八千代】多...,1号店,花勿缺
1019007017,家居家装|建材|园艺,华清园HQY 孔雀竹芋 绿植 水培 盆栽 花卉 可养鱼 植物,所有分类>家居家纺、锅具餐具>宠物园艺>鲜花速递/绿植园艺>盆栽>华清园HQY>华清园HQY 孔雀竹...,1号店,华清园HQY
1019007017,家居家装|建材|园艺,立泰悦达 花卉种子 蔬菜种子 家庭种植 园艺产品 盆栽植物 绿色植物 室内植物(意大利生菜),家具>肥料/种子>立泰悦达>立泰悦达 花卉种子 蔬菜种子 家庭种植 园艺产品 盆栽植物 绿色植物 室内植物(意大利生菜),国美电器网上商城,立泰悦达专营店
1019007017,家居家装|建材|园艺,香远 波斯菊种子 阳台花卉种子 盆栽花草种子 5种可选 波斯菊混色100粒 彩包装,家装建材>装饰材料>园艺休闲>香远花邺>香远 波斯菊种子 阳台花卉种子 盆栽花草...,京东商城,香远花邺旗舰店
1019007017,家居家装|建材|园艺,澳缇娅铂萨 天然液体花肥 适用于所有盆景植物的家庭园艺肥料 200克/瓶,家装建材>装饰材料>园艺休闲>澳缇娅铂萨 天然液体花肥 适用...,京东商城,澳缇娅肥料专营店
1019007017,家居家装|建材|园艺,德国乐株沯花盆懒人花盆办公室盆栽植物自动浇水花盆MINI CUBI 白色,家装建材>装饰材料>园艺休闲>乐株沯（lechuza）>德国乐株沯花盆懒人花盆办公室盆栽植物自动...,京东商城,天盈盛世家居用品专营店
1019007017,家居家装|建材|园艺,花勿缺 美乐棵 家庭园艺肥料 适用于室内户外庭院植物 水溶性花肥,所有分类>家居家纺、锅具餐具>宠物园艺>鲜花速递/绿植园艺>园艺用品>肥料/栽养>花勿缺>花勿缺 美乐棵 家庭...,1号店,花勿缺
1019007017,家居家装|建材|园艺,华清园HQY 元宝树 绿植 盆栽 植物 花卉 白盆 绿盆 蓝盆 粉盆 黄盆,所有分类>家居家纺、锅具餐具>宠物园艺>鲜花速递/绿植园艺>盆栽>华清园HQY>华清园HQY 元宝树...,1号店,华清园HQY
1019007017,家居家装|建材|园艺,华清园HQY 金丝楠盆景 礼品 植物 绿植 盆景 花卉 盆栽 绿植 高档花卉 金丝楠,所有分类>家居家纺、锅具餐具>宠物园艺>鲜花速递/绿植园艺>盆栽>华清园HQY>华清园HQY 金丝楠...,1号店,华清园HQY
1019007017,家居家装|建材|园艺,我要发芽 蔬菜种子 紫黑长茄种子 茄子 家庭阳台种菜种子 四季可植,所有分类>家居家纺、锅具餐具>宠物园艺>鲜花速递/绿植园艺>种子>我要发芽>我要发芽 蔬菜种子 ...,1号店,我要发芽
1019007017,家居家装|建材|园艺,津沽园艺 荷兰进口郁金香大种球 蒙特勒 黄红纹重瓣 秋冬室内花卉,所有分类>家居家纺、锅具餐具>宠物园艺>鲜花速递/绿植园艺>盆栽>津沽园艺>津沽园艺 荷兰进口郁...,1号店,津沽园艺
1019007017,家居家装|建材|园艺,爱优尚 金桔 金橘树盆栽 圣诞节礼品 阳台庭院室内年宵花卉盆景 瓷盆,家装建材>装饰材料>园艺休闲>爱优尚（aiyoushang）>爱优尚 金桔 金橘树盆栽 圣诞节礼品 ...,京东商城,爱优尚绿植花卉旗舰店
1019007017,家居家装|建材|园艺,我要发芽 蔬菜种子 变色朝天椒种子 早熟 可阳台盆栽 2.5g彩包,所有分类>家居家纺、锅具餐具>宠物园艺>鲜花速递/绿植园艺>种子>我要发芽>我要发芽 蔬菜种子 ...,1号店,我要发芽
1019007017,家居家装|建材|园艺,开馨宝 小花迷青草种植迷你植物盆栽 圣诞节草人 种植小草盆栽桌面 草娃娃（X恋人）,所有分类>家居家纺、锅具餐具>宠物园艺>鲜花速递/绿植园艺>创意迷你植物>开馨宝>开馨宝 小花迷青草种...,1号店,开馨宝
1019007017,家居家装|建材|园艺,立泰悦达绿植/绿色植物/绿萝吊兰/生物杀虫剂药（5个装）/盆栽/室内植物/高档盆花/花卉/L1089 生物杀虫剂,家装建材>装饰材料>园艺休闲>立泰悦达绿植/绿色植物/绿萝吊兰/生物杀...,京东商城,立泰悦达
1019007017,家居家装|建材|园艺,爱优尚 巴西木 大型盆栽 室内办公室净化空气植物 白圆柱瓷盆,家装建材>装饰材料>园艺休闲>爱优尚（aiyoushang）>爱优尚 巴西木 大型盆栽 室内办公室净化...,京东商城,爱优尚绿植花卉旗舰店
1019007017,家居家装|建材|园艺,花堇 水生花卉富贵竹盆景 室内盆栽 水培植物 净化空气 观音竹 含玻璃瓶,家装建材>装饰材料>园艺休闲>花堇>花堇 水生花卉富贵竹盆景 室内盆栽 水培...,京东商城,花堇旗舰店
1019007017,家居家装|建材|园艺,立泰悦达 花卉种子 蔬菜种子 种花种菜 园艺产品用品 水培 花卉 盆栽 绿色室内植物 黄圣女蕃茄,家装建材>装饰材料>园艺休闲>立泰悦达>立泰悦达 花卉种子 蔬菜种子 种花种菜 ...,京东商城,立泰悦达旗舰店
1019007017,家居家装|建材|园艺,立泰悦达 兰花 大花蕙兰 蝴蝶兰 年宵花卉 盆栽 绿色 室内植物 净化空气 高档礼品花 蕙兰曙光组盆,家装建材>装饰材料>园艺休闲>立泰悦达>立泰悦达 兰花 大花蕙兰 蝴蝶兰 年宵花...,京东商城,立泰悦达旗舰店
