1019006024,家居家装|家具|梳妆台、梳妆桌,家逸韩式化妆柜（小号）梳妆台 木质化妆柜 田园化妆柜 欧式化妆柜 白色化妆柜 多层化妆柜052,家具>卧室家具>梳妆台/凳>家逸韩式化妆柜（小号）梳妆台 木质化妆柜...,京东商城,家逸家居
1019006024,家居家装|家具|梳妆台、梳妆桌,尼克爱家 化妆台 古典梳妆台 梳妆桌 化妆台 化妆镜 美卡 梳妆台,家具>卧室家具>梳妆台/凳>尼克爱家 化妆台 古典梳妆台 梳妆桌 化...,京东商城,尼克爱家家居旗舰店
1019006024,家居家装|家具|梳妆台、梳妆桌,新悦 化妆台F3080F（含妆镜） 梳妆台 化妆柜化妆桌梳妆柜 妆台 妆凳,家具>卧室家具>梳妆台/凳>新悦>新悦 化妆台F3080F（含妆镜） 梳妆...,京东商城,新悦家居官方旗舰店
1019006024,家居家装|家具|梳妆台、梳妆桌,新悦化妆台D6582F-1（含妆镜D6587F） 梳妆台 化妆柜化妆桌梳妆柜 檀木色 妆台+妆凳(D6585J),家具>卧室家具>梳妆台/凳>新悦化妆台D6582F-1（含妆镜D65...,京东商城,新悦家居官方旗舰店
1019006024,家居家装|家具|梳妆台、梳妆桌,莱茵塞纳 白色梳妆桌子 棕色化妆台现代简约 韩式梳妆台 实木 宜家欧式化妆桌 KH7844 白,家具>卧室家具>梳妆台/凳>莱茵塞纳 白色梳妆桌子 棕色化妆台现代简...,京东商城,莱茵塞纳
1019006024,家居家装|家具|梳妆台、梳妆桌,新悦 化妆台B5080F（含妆镜B6081F） 梳妆台,家具>卧室家具>梳妆台/凳>新悦>新悦 化妆台B5080F（含妆镜B608...,京东商城,新悦家居官方旗舰店
1019006024,家居家装|家具|梳妆台、梳妆桌,九信 现代简约电视储物柜欧式实木柜 田园梳妆桌 梳妆柜 可移动化妆台梳妆台JX-H-140 白色 年后发货,家具>卧室家具>梳妆台/凳>九信>九信 现代简约电视储物柜欧式实木柜 田园...,京东商城,九信家居旗舰店
1019006024,家居家装|家具|梳妆台、梳妆桌,FABIO Q家居 梳妆台 长镜 创意化妆台 现代简约 纯白含妆凳,家具>卧室家具>梳妆台/凳>法比奥（FABIOQ）>FABIO Q家居 梳妆台 长镜 创意化...,京东商城,FABIO Q家居旗舰店
1019006024,家居家装|家具|梳妆台、梳妆桌,东居家居 新品 地中海家具 地中海 梳妆台+凳,家具>卧室家具>梳妆台/凳>东居家居 新品 地中海家具 地中海 梳妆...,京东商城,东居家居旗舰店
1019006024,家居家装|家具|梳妆台、梳妆桌,尼克爱家美式实木家具梳妆台妆台妆镜妆凳化妆台 包邮特价 奥兰多,尼克爱家美式实木家具梳妆台妆台妆镜妆凳化...,京东商城,尼克爱家家居旗舰店
1019006024,家居家装|家具|梳妆台、梳妆桌,芬格美家fokme多功能翻盖梳妆台可爱梳妆台梳妆凳套装,家具>卧室家具>梳妆台/凳>芬格美家（fokme）>芬格美家fokme多功能翻盖梳妆台可爱梳...,京东商城,芬格美家官方旗舰店
1019006024,家居家装|家具|梳妆台、梳妆桌,新悦 化妆台B6082F（含妆镜B6083F） 梳妆台化妆柜化妆桌 妆台 梳妆柜,家具>卧室家具>梳妆台/凳>新悦>新悦 化妆台B6082F（含妆镜B608...,京东商城,新悦家居官方旗舰店
1019006024,家居家装|家具|梳妆台、梳妆桌,欧施洛 梳妆台 化妆台 妆台+凳 韩式化妆台 时尚简约 现代化妆桌 田园馆,家具>卧室家具>梳妆台/凳>欧施洛家具>欧施洛 梳妆台 化妆台 妆台+凳 韩式...,京东商城,欧施洛家具旗舰店
1019006024,家居家装|家具|梳妆台、梳妆桌,欧巴美oubami 简约欧式 白蜡木梳妆台/凳 妆凳,家具>卧室家具>梳妆台/凳>欧巴美（obami）>欧巴美oubami 简约欧式 白蜡木梳妆...,京东商城,欧巴美家具旗舰店
1019006024,家居家装|家具|梳妆台、梳妆桌,家逸正品家具 日式化妆梳妆台实木特价梳妆柜多功能小移动化妆柜(白色),家具建材>梳妆台>家逸>家逸正品家具 日式化妆梳妆台实木特价梳妆柜多功能小移动化妆柜(白色),国美电器网上商城,家逸旗舰店
1019006024,家居家装|家具|梳妆台、梳妆桌,FABIO Q家居 梳妆台 长镜 创意化妆台 现代简约 睿智灰 含妆凳,家具>卧室家具>梳妆台/凳>法比奥（FABIOQ）>FABIO Q家居 梳妆台 长镜 创意化...,京东商城,FABIO Q家居旗舰店
1019006024,家居家装|家具|梳妆台、梳妆桌,御品工匠 实木梳妆台 梳妆桌 化妆台 实木家具 中式宜家 K0306,所有分类>家居家纺、锅具餐具>家具家装>桌类>梳妆台/桌>御品工匠>御品工匠 实木梳妆台...,1号店,御品工匠
1019006024,家居家装|家具|梳妆台、梳妆桌,御品工匠 盛唐时代 东南亚风格家具 水曲柳实木梳妆台 带柜化妆桌 kc02,家具>梳妆台>御品工匠>御品工匠 盛唐时代 东南亚风格家具 水曲柳实木梳妆台 带柜化妆桌 kc02,国美电器网上商城,御品工匠家具旗舰店
1019006024,家居家装|家具|梳妆台、梳妆桌,极鼎家具 欧式田园梳妆台凳 白色实木雕花化妆凳组合 梳妆凳子 荷花白 470*350*450mm,家具>卧室家具>梳妆台/凳>极鼎 >极鼎家具 欧式田园梳妆台凳 白色实木雕花...,京东商城,极鼎家具旗舰店
1019006024,家居家装|家具|梳妆台、梳妆桌,家逸 韩式田园梳妆台 简约梳妆台 欧式梳妆台 现代 简约化妆柜 实木梳妆台 整装发货特价 白色129,家具>卧室家具>梳妆台/凳>家逸>家逸 韩式田园梳妆台 简约梳妆台 欧式梳...,京东商城,家逸家居
1019006024,家居家装|家具|梳妆台、梳妆桌,实木梳妆台 乌金木色梳妆桌化妆台 中式宜家妆台特价306,家具 > 卧室家具 > 梳妆台 > 商品详情,当当网,御品工匠
1019006024,家居家装|家具|梳妆台、梳妆桌,拉慕尔家具 欧式田园梳妆台凳 白色实木雕花化妆凳组合 梳妆凳子,家具>卧室家具>梳妆台/凳>极鼎 >拉慕尔家具 欧式田园梳妆台凳 白色实木雕...,京东商城,拉慕尔家居旗舰店
1019006024,家居家装|家具|梳妆台、梳妆桌,家逸 韩式田园梳妆台 简约梳妆台 欧式梳妆台 现代 简约梳妆台 实木梳妆台带凳 整装发货 白色201,家具>卧室家具>穿衣镜 >家逸>家逸 韩式田园梳妆台 简约梳妆台 欧式梳...,京东商城,家逸家居
1019006024,家居家装|家具|梳妆台、梳妆桌,华谊家具 纯实木 梳妆台/化妆桌 XCF10509 北欧田园 美国白橡木,家具>桌/椅/凳/榻>梳妆台/凳>华谊家具 纯实木 梳妆台/化妆桌 XCF10509 北欧田园 美国白橡木,家品会,
1019006024,家居家装|家具|梳妆台、梳妆桌,翠景园 时尚梳妆台 简约现代化妆桌 梳妆桌 化妆台 梳妆柜 白色,首页>家居/家装建材/厨具>家具>卧室家具>翠景园时尚梳妆台简约现代化妆桌...,苏宁,翠景园
1019006024,家居家装|家具|梳妆台、梳妆桌,家逸 家逸 韩式全木梳妆台白色整装发货买就送梳妆凳一个,首页 > 家逸家具专场 > 家逸 韩式全木梳妆台白色整装发货,唯品会,无
1019006024,家居家装|家具|梳妆台、梳妆桌,美宅 简约现代环保板式时尚卧室家具梳妆台梳妆桌化妆柜+妆凳现生产可定制,所有分类>家居家纺、锅具餐具>家具家装>桌类>梳妆台/桌>美宅>美宅 简约现代环保板...,1号店,美宅
1019006024,家居家装|家具|梳妆台、梳妆桌,择木宜居 韩式实木浮雕梳妆台化妆台 梳妆镜储物收纳柜梳妆桌凳套装,所有分类>家居家纺、锅具餐具>家具家装>桌类>梳妆台/桌>择木宜居>择木宜居 韩式实木浮...,1号店,择木宜居
1019006024,家居家装|家具|梳妆台、梳妆桌,伏贝尼 法式家具化妆台桌 美式象牙白实木梳妆台 欧式简约现代韩式田园梳妆台包物流到点,家具>卧室家具>梳妆台/凳>伏贝尼>伏贝尼 法式家具化妆台桌 美式象牙白实木...,京东商城,伏贝尼家居旗舰店
1019006024,家居家装|家具|梳妆台、梳妆桌,里外 现代中式田园实木梳妆台 梳妆凳 W5202 中式实木家具套装 原木色,家具>卧室家具>梳妆台/凳>里外（LIWAI） >里外 现代中式田园实木梳妆台 梳妆凳 ...,京东商城,里外官方旗舰店
1019006024,家居家装|家具|梳妆台、梳妆桌,巴黎时光 化妆台 梳妆台 法式 图色 梳妆台,家具>卧室家具>梳妆台/凳>巴黎时光 化妆台 梳妆台 法式 图色 梳...,京东商城,巴黎时光
1019006024,家居家装|家具|梳妆台、梳妆桌,中格套房家具 曲木清华 中式家具 橡木化妆台 实木梳妆台6147,家具>卧室家具>梳妆台/凳> 中格家具（Zhonge）>中格套房家具 曲木清华 中式家具 橡木化...,京东商城,中格家具旗舰店
1019006024,家居家装|家具|梳妆台、梳妆桌,雨林霏 B14 现代时尚 板实木木结合梳妆台 梳妆桌,家具>卧室家具>梳妆台/凳>雨林霏>雨林霏 B14 现代时尚 板实木木结合梳...,京东商城,雨林霏家具旗舰店
1019006024,家居家装|家具|梳妆台、梳妆桌,盛唐时代 实木梳妆台 化妆台现代中式 纹理美观家具H2306 梳妆台,家具>卧室家具>梳妆台/凳>盛唐时代>盛唐时代 实木梳妆台 化妆台现代中式 纹...,京东商城,盛唐时代家具官方旗舰店
1019006024,家居家装|家具|梳妆台、梳妆桌,里外 现代中式田园实木梳妆台 化妆台 单个妆台 不含妆凳 实木加板材 家居就旗舰店 原木色,家具>卧室家具>梳妆台/凳> 里外（LIWAI） >里外 现代中式田园实木梳妆台 化妆台 单...,京东商城,家居就建材家居旗舰店
1019006024,家居家装|家具|梳妆台、梳妆桌,金海马 韩式田园梳妆台妆凳组合 时尚实木化妆台桌特价 301 白色(偏粉) 妆台凳,家具>卧室家具>梳妆台/凳>金海马（Kinhom）>金海马 韩式田园梳妆台妆凳组合 时尚实木...,京东商城,金海马官方旗舰店
1019006024,家居家装|家具|梳妆台、梳妆桌,德家家具29 欧式梳妆台 实木 妆台 梳妆桌 化妆台 妆镜 优雅雕花,家具>卧室家具>梳妆台/凳> 德家>德家家具29 欧式梳妆台 实木 妆台 梳...,京东商城,德家旗舰店
1019006024,家居家装|家具|梳妆台、梳妆桌,帝诗尼 原木色梳妆台收纳 虎斑木烤漆化妆台 中式2抽木质梳妆桌 虎斑木色 9032 实木梳妆台,家具>卧室家具>梳妆台/凳> 帝诗尼>帝诗尼 原木色梳妆台收纳 虎斑木烤漆化妆...,京东商城,帝诗尼家具旗舰店
1019006024,家居家装|家具|梳妆台、梳妆桌,花季人生 美式乡村实木家具 高档 实木梳妆台时尚化妆台HQF-02梳妆凳,家具>卧室家具>梳妆台/凳> 花季人生>花季人生 美式乡村实木家具 高档 实木梳...,京东商城,花季人生家具旗舰店
1019006024,家居家装|家具|梳妆台、梳妆桌,格杰家具 卧室妆台 梳妆台桌 简约现代白樱桃化妆台 C801 白樱桃(不含凳子),家具>卧室家具>梳妆台/凳> 格杰>格杰家具 卧室妆台 梳妆台桌 简约现代白...,京东商城,格杰家具官方旗舰店
1019006024,家居家装|家具|梳妆台、梳妆桌,法丽莎家具G1欧式梳妆台雕花化妆台实木梳妆桌化妆桌卧室梳妆台9838# 含凳A款,首页>家居/家装建材/厨具>家具>卧室家具>法丽莎家具G1欧式梳妆台雕花化妆台实...,苏宁,法丽莎(Faliso)
1019006024,家居家装|家具|梳妆台、梳妆桌,芬格美家fokme多功能翻盖梳妆台可爱梳妆台梳妆凳套装 深橡木色,家具>卧室家具>梳妆台/凳>芬格美家（fokme）>芬格美家fokme多功能翻盖梳妆台可爱梳...,京东商城,芬格美家官方旗舰店
1019006024,家居家装|家具|梳妆台、梳妆桌,美乐乐家具 梳妆台 化妆台 实木家具 法式风格 卧室家具/ HFE 妆台+妆镜,家具>卧室家具>梳妆台/凳>美乐乐（MEILELE）>美乐乐家具 梳妆台 化妆台 实木家具 法...,京东商城,美乐乐官方旗舰店
1019006024,家居家装|家具|梳妆台、梳妆桌,新悦 化妆台D6581F-1(含妆镜D6586F) 梳妆台简约现代 檀木色 妆台,家具>卧室家具>梳妆台/凳>新悦>新悦 化妆台D6581F-1(含妆镜D...,京东商城,新悦家居官方旗舰店
1019006024,家居家装|家具|梳妆台、梳妆桌,新悦化妆台D6582F-1（含妆镜D6587F） 梳妆台 化妆柜化妆桌梳妆柜 檀木色 妆台,家具>卧室家具>梳妆台/凳>新悦化妆台D6582F-1（含妆镜D65...,京东商城,新悦家居官方旗舰店
1019006024,家居家装|家具|梳妆台、梳妆桌,法比奥Q家居 梳妆台 长镜 创意梳妆台化妆台 现代简约梳妆台 睿智灰 不含妆凳,家具>卧室家具>梳妆台/凳>法比奥Q家居 梳妆台 长镜 创意梳妆台化...,京东商城,FABIO Q家居旗舰店
1019006024,家居家装|家具|梳妆台、梳妆桌,新悦化妆台K2380F（含妆镜K2381F） 梳妆台简约现代欧式时尚 化妆柜化妆桌梳妆柜 红橡木色 妆台+妆凳(K2388J,家具>卧室家具>梳妆台/凳>新悦化妆台K2380F（含妆镜K2381...,京东商城,新悦家居官方旗舰店
1019006024,家居家装|家具|梳妆台、梳妆桌,欧巴美oubami 简约欧式 白蜡木梳妆台/凳 妆台,家具>卧室家具>梳妆台/凳>欧巴美（obami）>欧巴美oubami 简约欧式 白蜡木梳妆...,京东商城,欧巴美家具旗舰店
1019006024,家居家装|家具|梳妆台、梳妆桌,御品工匠 化妆台 乌金木色中式宜家实木梳妆台 带妆凳 K0311,所有分类>家居家纺、锅具餐具>家具家装>桌类>梳妆台/桌>御品工匠>御品工匠 化妆台 乌...,1号店,御品工匠
1019006024,家居家装|家具|梳妆台、梳妆桌,元润 梳妆台 宜家宜家梳妆台 简约 现代小梳妆台化妆台 妆台,家居 > 家具 > 卧室家具 > 梳妆台,亚马逊(卓越网),
1019006024,家居家装|家具|梳妆台、梳妆桌,艺凯丝 欧式田园简约梳妆台家具 韩式卧室公主化妆台储物化妆桌,家具>梳妆台>艺凯丝梳妆台>艺凯丝 欧式田园简约梳妆台家具 韩式卧室公主化妆台储物化妆桌,国美电器网上商城,艺凯丝梳妆台
1019006024,家居家装|家具|梳妆台、梳妆桌,艺凯丝 欧式古典梳妆台 黑色纯实木贵族梳妆桌 复古化妆台 桌套装,家具>梳妆台>艺凯丝梳妆台>艺凯丝 欧式古典梳妆台 黑色纯实木贵族梳妆桌 复古化妆台 桌套装,国美电器网上商城,艺凯丝梳妆台
1019006024,家居家装|家具|梳妆台、梳妆桌,家逸 韩式田园梳妆台 简约梳妆台 欧式梳妆台 现代 简约梳妆台 实木梳妆台带凳子整装发货 白色201,家具>卧室家具>梳妆台/凳>家逸>家逸 韩式田园梳妆台 简约梳妆台 欧式梳...,京东商城,家逸家居
1019006024,家居家装|家具|梳妆台、梳妆桌,邦美居 梳妆台 欧式 实木梳妆 台HK0901 妆台,所有分类>家居家纺、锅具餐具>家具家装>桌类>梳妆台/桌>邦美居>邦美居 梳妆台 欧式...,1号店,邦美居
1019006024,家居家装|家具|梳妆台、梳妆桌,双十二 鹏景雅居 欧式 韩式实木梳妆台田园妆桌带妆镜不含妆凳 象牙白色化妆台 G36 家居就旗舰店,家具>卧室家具>梳妆台/凳>鹏景雅居>双十二 鹏景雅居 欧式 韩式实木梳妆台田...,京东商城,家居就建材家居旗舰店
1019006024,家居家装|家具|梳妆台、梳妆桌,九信 现代简约 时尚 欧式实木 化妆柜梳妆柜 可移动化妆台梳妆台JXH-140,所有分类>家居家纺、锅具餐具>家具家装>桌类>梳妆台/桌>九信>九信 现代简约 时尚...,1号店,九信
1019006024,家居家装|家具|梳妆台、梳妆桌,艺凯丝家具 纯实木梳妆台 韩式田园卧室化妆桌套装 四斗柜化妆台,家具>梳妆台>艺凯丝>艺凯丝家具 纯实木梳妆台 韩式田园卧室化妆桌套装 四斗柜化妆台,国美电器网上商城,艺凯丝家具旗舰店
1019006024,家居家装|家具|梳妆台、梳妆桌,SweetNight韩式家具 实木妆台 欧式田园梳妆台 欧式妆台特价妆台 H605 1200*440*1456,家具>卧室家具>梳妆台/凳>Sweetnight>SweetNight韩式家具 实木妆台 ...,京东商城,Sweetnight家居旗舰店
1019006024,家居家装|家具|梳妆台、梳妆桌,达美家具 板式现代简约时尚梳妆台 化妆台 不包含小凳子 梳妆桌C811 卡其,家具>卧室家具>梳妆台/凳>达美>达美家具 板式现代简约时尚梳妆台 化妆台...,京东商城,达美家具官方旗舰店
1019006024,家居家装|家具|梳妆台、梳妆桌,优尚美家 欧式实木带抽屉带镜子梳妆台 法式卧室家具 韩式化妆桌 白色田园化妆台 103,家具>卧室家具>梳妆台/凳>优尚美家>优尚美家 欧式实木带抽屉带镜子梳妆台 法...,京东商城,优尚美家旗舰店
1019006024,家居家装|家具|梳妆台、梳妆桌,鹏景雅居 法式梳妆台 欧式实木化妆桌妆柜 田园卧室家具套房特价H35 家居就旗舰店 珍珠白,家具>卧室家具>梳妆台/凳>鹏景雅居>鹏景雅居 法式梳妆台 欧式实木化妆桌妆柜...,京东商城,家居就建材家居旗舰店
1019006024,家居家装|家具|梳妆台、梳妆桌,御品工匠 实木梳妆台梳妆桌 金胡桃色实木中式宜家妆台特价H2310(金胡桃色梳妆台),家具>梳妆台>御品工匠>御品工匠 实木梳妆台梳妆桌 金胡桃色实木中式宜家妆台特价H2310(金胡桃色梳妆台),国美电器网上商城,御品工匠家具旗舰店
1019006024,家居家装|家具|梳妆台、梳妆桌,风哥华G1 欧式家具 欧式梳妆台 实木化妆台 梳妆桌 妆台 C822 象牙白 妆台 含凳,家具>卧室家具>梳妆台/凳>风哥华>风哥华G1 欧式家具 欧式梳妆台 实木化...,京东商城,风哥华家居旗舰店
1019006024,家居家装|家具|梳妆台、梳妆桌,盛唐时代 实木梳妆台宜家家具 现代简约木质小化妆台带妆镜K0309 乌金木色 梳妆台+妆凳,家具>卧室家具>梳妆台/凳>盛唐时代>盛唐时代 实木梳妆台宜家家具 现代简约木...,京东商城,盛唐时代家具官方旗舰店
1019006024,家居家装|家具|梳妆台、梳妆桌,翠景园 时尚梳妆台 简约现代化妆桌 梳妆桌 化妆台 梳妆柜 白枫色,首页>家居/家装建材/厨具>家具>卧室家具>翠景园时尚梳妆台简约现代化妆桌...,苏宁,翠景园
1019006024,家居家装|家具|梳妆台、梳妆桌,择木宜居 欧美实木浮雕梳妆台化妆台 梳妆镜储物收纳柜梳妆桌凳套装 梳妆桌+凳子 套装,家具>卧室家具>梳妆台/凳>择木宜居>择木宜居 欧美实木浮雕梳妆台化妆台 梳妆...,京东商城,择木宜居旗舰店
1019006024,家居家装|家具|梳妆台、梳妆桌,法丹娜韩式欧式风格梳妆台化妆镜田园梳妆桌带妆凳 市区物流点自提,家具>卧室家具>梳妆台/凳>法丹娜（F-ada）>法丹娜韩式欧式风格梳妆台化妆镜田园梳妆桌...,京东商城,法丹娜家居旗舰店
1019006024,家居家装|家具|梳妆台、梳妆桌,【京好】梳妆台镜子 欧式实木现代简约化妆柜盒桌椅凳雕花套装家具 B款象牙白色 梳妆凳台桌椅套装,家具>卧室家具>梳妆台/凳> 京好>【京好】梳妆台镜子 欧式实木现代简约化妆...,京东商城,京好家具旗舰店
1019006024,家居家装|家具|梳妆台、梳妆桌,里外 卧室梳妆台//梳妆凳//妆台镜 美式田园卧室实木梳妆台组合 BY13ZA 樱桃色 妆台镜+妆凳组合,家具>卧室家具>梳妆台/凳>里外（LIWAI） >里外 卧室梳妆台//梳妆凳//妆台镜 美...,京东商城,里外官方旗舰店
1019006024,家居家装|家具|梳妆台、梳妆桌,风哥华 欧式家具 梳妆台 欧式 简约 实木 化妆台/桌 特价 9838 市区物流点自提 妆台,家具>卧室家具>梳妆台/凳> 风哥华>风哥华 欧式家具 梳妆台 欧式 简约 实...,京东商城,风哥华家居旗舰店
1019006024,家居家装|家具|梳妆台、梳妆桌,巴黎时光 梳妆台 化妆台 欧式 田园 公主 图色 单桌,家具>卧室家具>梳妆台/凳>巴黎时光 梳妆台 化妆台 欧式 田园 公...,京东商城,巴黎时光
1019006024,家居家装|家具|梳妆台、梳妆桌,富兰德 美式乡村地中海 梳妆台 梳妆桌 梳妆镜 化妆镜 简约田园 含梳妆凳,家具>卧室家具>梳妆台/凳>富兰德>富兰德 美式乡村地中海 梳妆台 梳妆桌 ...,京东商城,富兰德家居旗舰店
1019006024,家居家装|家具|梳妆台、梳妆桌,邦美居 法式田园 欧式化妆台 梳妆台带镜子 1.2米实木化妆桌K05,家具>卧室家具>梳妆台/凳>邦美居（bangmeiju）>邦美居 法式田园 欧式化妆台 梳妆台带镜...,京东商城,邦美居家具旗舰店
1019006024,家居家装|家具|梳妆台、梳妆桌,里外 田园 梳妆台 化妆台 韩式家具卧室梳妆台 象牙白优雅系列 ST907 妆台,家具>卧室家具>梳妆台/凳>里外（LIWAI） >里外 田园 梳妆台 化妆台 韩式家具卧室...,京东商城,里外官方旗舰店
1019006024,家居家装|家具|梳妆台、梳妆桌,缘订三生 妆台 化妆台 梳妆台 梳妆桌 时尚 烤漆妆台 钢琴漆 伸缩妆台A601 黑白色 妆台-不含凳,家具>卧室家具>梳妆台/凳>缘订三生>缘订三生 妆台 化妆台 梳妆台 梳妆桌 ...,京东商城,缘订三生家具旗舰店
1019006024,家居家装|家具|梳妆台、梳妆桌,雨林霏 303 板木结合韩式家具 梳妆台 梳妆桌,家具>卧室家具>梳妆台/凳>雨林霏>雨林霏 303 板木结合韩式家具 梳妆台...,京东商城,雨林霏家具旗舰店
1019006024,家居家装|家具|梳妆台、梳妆桌,邦美居 仿古家具 木纹家具梳妆台 田园 欧式梳妆台 欧式公主H995,家具>卧室家具>梳妆台/凳>邦美居（bangmeiju）>邦美居 仿古家具 木纹家具梳妆台 田园 ...,京东商城,邦美居家具旗舰店
1019006024,家居家装|家具|梳妆台、梳妆桌,松木家具 田园梳妆台 宜家带抽实木梳妆桌 化妆桌 化妆台 实木梳妆台,家具>卧室家具>梳妆台/凳>北欧童话（BOTH）>松木家具 田园梳妆台 宜家带抽实木梳妆桌...,京东商城,北欧童话旗舰店
1019006024,家居家装|家具|梳妆台、梳妆桌,红星美凯龙/源氏木语/梳妆台实木/纯橡木化妆台/带抽屉/美式乡村/梳妆桌化妆桌/Y0120 仿古色,家具>卧室家具>梳妆台/凳> 源氏木语>红星美凯龙/源氏木语/梳妆台实木/纯橡木...,京东商城,红星美凯龙星易家旗舰店
1019006024,家居家装|家具|梳妆台、梳妆桌,惠宜实木妆台亚花梨全实木梳妆台梳妆柜 特价包邮E041,家具>卧室家具>梳妆台/凳> 惠宜>惠宜实木妆台亚花梨全实木梳妆台梳妆柜 特...,京东商城,惠宜专营店
1019006024,家居家装|家具|梳妆台、梳妆桌,风哥华家具G2 欧式家具 欧式梳妆台 实木化妆台 法式梳妆A802 市区物流点自提 妆台 含凳,家具>卧室家具>梳妆台/凳> 风哥华>风哥华家具G2 欧式家具 欧式梳妆台 实...,京东商城,风哥华家居旗舰店
1019006024,家居家装|家具|梳妆台、梳妆桌,铂森 欧式 白色 烤漆 小 化妆台 梳妆台 镜妆台 妆台桌 现代 简约 KC-6201 白色 组装,家具>卧室家具>梳妆台/凳> 铂森（bosen）>铂森 欧式 白色 烤漆 小 化妆台 梳妆...,京东商城,铂森旗舰店
1019006024,家居家装|家具|梳妆台、梳妆桌,美式梳妆台 橡木家具 纯实木 梳妆台 欧式 化妆柜 宜家田园梳妆桌 妆台,首页>家居/家装建材/厨具>家具>卧室家具>美式梳妆台橡木家具纯实木梳妆台...,苏宁,爱琴海
1019006024,家居家装|家具|梳妆台、梳妆桌,红星  聖喬治 梳妆台+梳妆凳 法式田园 WPSQZ-008,首页 > 红星家品会家具专场 > 聖喬治 梳妆台+梳妆凳 法式田园 WPSQZ-008,唯品会,无
1019006024,家居家装|家具|梳妆台、梳妆桌,理佳木业 韩式田园简约化妆台 梳妆台 实木化妆桌HZT-309,首页>家居/家装建材/厨具>家具>卧室家具>理佳木业韩式田园简约化妆台梳妆台...,苏宁,理佳木业
1019006024,家居家装|家具|梳妆台、梳妆桌,法丽莎家具G1欧式梳妆台实木化妆台梳妆卧室梳妆镜象牙白化妆台A011 桌+凳,首页>家居/家装建材/厨具>家具>卧室家具>法丽莎家具G1欧式梳妆台实木化妆台梳...,苏宁,法丽莎(Faliso)
1019006024,家居家装|家具|梳妆台、梳妆桌,心情生活 粉红公主多功能梳妆台梳妆椅 最爱公主风 RSRQ00060,家具>卧室家具>梳妆台/凳>心情生活>心情生活 粉红公主多功能梳妆台梳妆椅 最...,京东商城,心情生活家具旗舰店
1019006024,家居家装|家具|梳妆台、梳妆桌,莱茵塞纳 梳妆台套装 梳妆桌简约时尚 韩式梳妆桌 田园梳妆台,所有分类>家居家纺、锅具餐具>家具家装>桌类>梳妆台/桌>莱茵塞纳>莱茵塞纳 梳妆台套装...,1号店,莱茵塞纳
1019006024,家居家装|家具|梳妆台、梳妆桌,美伊尚品 欧式风格 雕花家具 公主田园时尚实木梳妆台/凳桌 化妆桌 CZT-002,家具>卧室家具>梳妆台/凳>美伊尚品 欧式风格 雕花家具 公主田园时...,京东商城,美伊尚品官方旗舰店
1019006024,家居家装|家具|梳妆台、梳妆桌,新悦 化妆台T5081F梳妆台(含妆镜)简约现代欧式时尚 化妆柜化妆桌梳妆柜 胡桃木色 妆台+妆凳(T5086J),家具>卧室家具>梳妆台/凳>新悦 化妆台T5081F梳妆台(含妆镜)...,京东商城,新悦家居官方旗舰店
1019006024,家居家装|家具|梳妆台、梳妆桌,家逸 韩式田园梳妆台 简约梳妆台 欧式梳妆台 现代 简约梳妆台 实木梳妆台 整装发货特价 白色,家具>卧室家具>梳妆台/凳>家逸>家逸 韩式田园梳妆台 简约梳妆台 欧式梳...,京东商城,家逸家居
