1019006024,家居家装|家具|梳妆台、梳妆桌,法比奥Q家居 梳妆台 长镜 创意梳妆台化妆台 现代简约梳妆台 睿智灰 含妆凳,家具>卧室家具>梳妆台/凳>法比奥Q家居 梳妆台 长镜 创意梳妆台化...,京东商城,FABIO Q家居旗舰店
1019006024,家居家装|家具|梳妆台、梳妆桌,新悦化妆台K2380F（含妆镜K2381F） 梳妆台简约现代欧式时尚 化妆柜化妆桌梳妆柜 红橡木色 妆台,家具>卧室家具>梳妆台/凳>新悦化妆台K2380F（含妆镜K2381...,京东商城,新悦家居官方旗舰店
1019006024,家居家装|家具|梳妆台、梳妆桌,新悦 化妆台D6581F-1(含妆镜D6586F) 梳妆台简约现代 檀木色 3斗,家具>卧室家具>梳妆台/凳>新悦>新悦 化妆台D6581F-1(含妆镜D...,京东商城,新悦家居官方旗舰店
1019006024,家居家装|家具|梳妆台、梳妆桌,达美家俱 现代简约时尚梳妆台 不包含小化妆台梳妆台C805 薰衣草,家具>卧室家具>梳妆台/凳>达美家俱 现代简约时尚梳妆台 不包含小化...,京东商城,达美家具官方旗舰店
1019006024,家居家装|家具|梳妆台、梳妆桌,华谊家具 化妆桌 纯实木 仿古色 XCF10509 实木 梳妆桌 梳妆台 环保养生 家居就旗舰店,家具>卧室家具>梳妆台/凳>华谊>华谊家具 化妆桌 纯实木 仿古色 XCF...,京东商城,家居就建材家居旗舰店
1019006024,家居家装|家具|梳妆台、梳妆桌,家逸 韩式田园梳妆台 简约梳妆台 欧式梳妆台 现代 简约化妆柜 实木梳妆台 整装发货特价 白色,家具>卧室家具>梳妆台/凳>家逸>家逸 韩式田园梳妆台 简约梳妆台 欧式梳...,京东商城,家逸家居
1019006024,家居家装|家具|梳妆台、梳妆桌,高鸿 梳妆台 日韩风格 多功能梳妆桌 板式家具 强大储物功能 带镜子,家具>卧室家具>梳妆台/凳>标卓>高鸿 梳妆台 日韩风格 多功能梳妆桌 板...,京东商城,高鸿家具
1019006024,家居家装|家具|梳妆台、梳妆桌,周家庄 法式家具卧室梳妆台田园梳妆柜化妆台欧式梳妆桌化妆桌镜组合 米白色 梳妆柜,家具>卧室家具>梳妆台/凳>周家庄 法式家具卧室梳妆台田园梳妆柜化妆...,京东商城,周家庄家具旗舰店
1019006024,家居家装|家具|梳妆台、梳妆桌,和购 田园卧室家具 田园梳妆台 欧式实木化妆桌 不含妆凳 梳妆台 7193 家居就旗舰店 白色,家具>卧室家具>梳妆台/凳>和购 >和购 田园卧室家具 田园梳妆台 欧式实木...,京东商城,家居就建材家居旗舰店
1019006024,家居家装|家具|梳妆台、梳妆桌,艺凯丝 欧式纯实木家具梳妆台 美式乡村田园化妆桌 卧室梳妆桌组(无雕花妆镜),家具建材>梳妆台>艺凯丝>艺凯丝 欧式纯实木家具梳妆台 美式乡村田园化妆桌 卧室梳妆桌组(无雕花妆镜),国美电器网上商城,艺凯丝家具旗舰店
1019006024,家居家装|家具|梳妆台、梳妆桌,艺凯丝纯实木梳妆台家具 象牙白化妆台 女士卧室带镜化妆桌 新品(圆镜),家具建材>梳妆台>艺凯丝>艺凯丝纯实木梳妆台家具 象牙白化妆台 女士卧室带镜化妆桌 新品(圆镜),国美电器网上商城,艺凯丝家具旗舰店
1019006024,家居家装|家具|梳妆台、梳妆桌,好事达 雅曼梳妆桌椅 1516 好事达新品 多功能简易梳妆台镜子现代1516,家具 > 卧室家具 > 梳妆台 > 商品详情,当当网,好事达
1019006024,家居家装|家具|梳妆台、梳妆桌,FABIO Q家居 梳妆台 长镜 创意化妆台 现代简约 卡其色 含妆凳,家具>卧室家具>梳妆台/凳>法比奥（FABIOQ）>FABIO Q家居 梳妆台 长镜 创意化...,京东商城,FABIO Q家居旗舰店
1019006024,家居家装|家具|梳妆台、梳妆桌,欧式实木梳妆台/桌 简约现代 田园雕刻化妆桌/梳妆柜 特价包物流,家具>卧室家具>梳妆台/凳>欧式实木梳妆台/桌 简约现代 田园雕刻化...,京东商城,欧意家居旗舰店
1019006024,家居家装|家具|梳妆台、梳妆桌,家逸 韩式田园梳妆台 简约梳妆台 欧式梳妆台 现代 简约梳妆台 实木梳妆台带凳子整装发货 棕色202,家具>卧室家具>梳妆台/凳>家逸>家逸 韩式田园梳妆台 简约梳妆台 欧式梳...,京东商城,家逸家居
1019006024,家居家装|家具|梳妆台、梳妆桌,邦美居 欧式家具奢华实木化妆桌仿古梳妆柜田园梳妆台H991,所有分类>家居家纺、锅具餐具>家具家装>桌类>梳妆台/桌>邦美居>邦美居 欧式家具奢华...,1号店,邦美居
1019006024,家居家装|家具|梳妆台、梳妆桌,艺凯丝品质家具 纯实木欧式田园温馨梳妆台 法式浪漫白色化妆台桌,家具>梳妆台>艺凯丝>艺凯丝品质家具 纯实木欧式田园温馨梳妆台 法式浪漫白色化妆台桌,国美电器网上商城,艺凯丝家具旗舰店
1019006024,家居家装|家具|梳妆台、梳妆桌,艺凯丝 卧室实木梳妆台镜 美式田园乡村组合化妆台桌 仿古储物柜,家具建材>梳妆台>艺凯丝>艺凯丝 卧室实木梳妆台镜 美式田园乡村组合化妆台桌 仿古储物柜,国美电器网上商城,艺凯丝家具旗舰店
1019006024,家居家装|家具|梳妆台、梳妆桌,艺凯丝 欧式时尚奢华梳妆台 纯实木卧室梳妆桌 白色鹅掌楸化妆桌,家具>梳妆台>艺凯丝>艺凯丝 欧式时尚奢华梳妆台 纯实木卧室梳妆桌 白色鹅掌楸化妆桌,国美电器网上商城,艺凯丝家具旗舰店
1019006024,家居家装|家具|梳妆台、梳妆桌,洛丽莎 欧式梳妆台 实木梳妆桌 白色 化妆台 梳妆镜 简约妆台 欧式妆台不含凳,家具>卧室家具>梳妆台/凳>洛丽莎 欧式梳妆台 实木梳妆桌 白色 化...,京东商城,洛丽莎家居
1019006024,家居家装|家具|梳妆台、梳妆桌,lenox时尚简约实木三斗柜 欧式卧室梳妆台化妆桌储物柜特价包邮920 香槟色 妆镜+后挂柜,家具>卧室家具>梳妆台/凳>lenox时尚简约实木三斗柜 欧式卧室梳...,京东商城,百诺家具旗舰店
1019006024,家居家装|家具|梳妆台、梳妆桌,艺凯丝 卧室家具 欧式梳妆台 实木梳妆台 法式新婚梳妆桌化妆台(妆台),家具>梳妆台>艺凯丝梳妆台>艺凯丝 卧室家具 欧式梳妆台 实木梳妆台 法式新婚梳妆桌化妆台(妆台),国美电器网上商城,艺凯丝梳妆台
1019006024,家居家装|家具|梳妆台、梳妆桌,诗恩 韩式田园梳妆台 玫瑰把手化妆台 田园风格 折叠镜子 化妆镜 实木,所有分类>家居家纺、锅具餐具>家具家装>镜子>化妆镜>诗恩>诗恩 韩式田园梳妆台 玫瑰把手化妆台 田园风格 折叠镜子 化妆镜 实木,1号店,诗恩
1019006024,家居家装|家具|梳妆台、梳妆桌,御品工匠 梳妆台 梳妆桌 欧式实木家具 化妆镜 带妆凳 B08,家具 > 卧室家具 > 梳妆台 > 商品详情,当当网,御品工匠
1019006024,家居家装|家具|梳妆台、梳妆桌,优尚美家 田园梳妆台 欧式家具公主妆台 奢华储物 简约法式化妆台 带抽屉镜子化妆台 109,家具>卧室家具>梳妆台/凳>优尚美家>优尚美家 田园梳妆台 欧式家具公主妆台 ...,京东商城,优尚美家旗舰店
1019006024,家居家装|家具|梳妆台、梳妆桌,迪邦 韩式化妆台 梳妆台田园妆台妆台妆镜 韩式梳妆桌婚庆妆台特价,家具>卧室家具>梳妆台/凳>迪邦 韩式化妆台 梳妆台田园妆台妆台妆镜...,京东商城,迪邦家具旗舰店
1019006024,家居家装|家具|梳妆台、梳妆桌,预售 盛唐时代 实木梳妆台 乌金木色梳妆桌化妆台 中式宜家妆台特价306 乌金木色 梳妆台,家具>卧室家具>梳妆台/凳>盛唐时代>预售 盛唐时代 实木梳妆台 乌金木色梳妆...,京东商城,盛唐时代家具官方旗舰店
1019006024,家居家装|家具|梳妆台、梳妆桌,鹏景雅居 韩式实木梳妆台化妆台 梳妆镜储物收纳柜梳妆田园梳妆台简约梳妆台 X75 家居就旗舰店,家具>卧室家具>梳妆台/凳> 鹏景雅居>鹏景雅居 韩式实木梳妆台化妆台 梳妆镜储...,京东商城,家居就建材家居旗舰店
1019006024,家居家装|家具|梳妆台、梳妆桌,欧巴美oubami 简约欧式 白蜡木梳妆台/凳 原木色 妆台,家具>卧室家具>梳妆台/凳> 欧巴美（obami）>欧巴美oubami 简约欧式 白蜡木梳妆...,京东商城,欧巴美家具旗舰店
1019006024,家居家装|家具|梳妆台、梳妆桌,合家家具 田园梳妆台 实木梳妆桌 白色 韩式化妆台 梳妆镜 欧式 1M 妆台,家具>卧室家具>梳妆台/凳> 合家家具>合家家具 田园梳妆台 实木梳妆桌 白色 ...,京东商城,合家家具旗舰店
1019006024,家居家装|家具|梳妆台、梳妆桌,美莲娜梳妆台实木家具现代简约韩式田园化妆台梳妆柜D801,家具>卧室家具>梳妆台/凳>美莲娜>美莲娜梳妆台实木家具现代简约韩式田园化妆...,京东商城,美莲娜家具旗舰店
1019006024,家居家装|家具|梳妆台、梳妆桌,家装节 百氏壹品 梳妆台 简约现代化妆柜宜家田园化妆桌E1级板材 部分包邮 BST1001 白橡 妆台,家具>卧室家具>梳妆台/凳> 百氏壹品（BESTINGHOME）>家装节 百氏壹品 梳妆台 简约现代化妆柜...,京东商城,百氏壹品家居官方旗舰店
1019006024,家居家装|家具|梳妆台、梳妆桌,高尔顿golden life 欧式实木梳妆台化妆台白色带凳子,家具>卧室家具>梳妆台/凳> 高尔顿（golden life）>高尔顿golden life 欧式实木梳...,京东商城,高尔顿旗舰店
1019006024,家居家装|家具|梳妆台、梳妆桌,莱茵塞纳 田园梳妆台凳赠梳妆镜 白色化妆桌子化妆凳 木制梳妆桌梳妆凳 雕花化妆桌赠化妆镜,家具>卧室家具>梳妆台/凳> 莱茵塞纳>莱茵塞纳 田园梳妆台凳赠梳妆镜 白色化妆...,京东商城,莱茵塞纳旗舰店
1019006024,家居家装|家具|梳妆台、梳妆桌,红庭 新古典家具梳妆台梳妆凳 贴金银箔化妆台带镜子 高档外贸别墅会所家具宫廷风 国内首发,家具>卧室家具>梳妆台/凳> 红庭>红庭 新古典家具梳妆台梳妆凳 贴金银箔化...,京东商城,红庭家具旗舰店
1019006024,家居家装|家具|梳妆台、梳妆桌,宝诗顿 欧式实木烤漆梳妆台妆镜 欧式梳妆桌梳妆台 JO04 黑红色,家具>卧室家具>梳妆台/凳>宝诗顿（BOSEETON）>宝诗顿 欧式实木烤漆梳妆台妆镜 欧式梳妆...,京东商城,宝诗顿家居旗舰店
1019006024,家居家装|家具|梳妆台、梳妆桌,红庭 地中海彩绘做旧梳妆台 梳妆凳套组 绿色卧室妆台带镜子 高档外贸别墅会所实木家具,家具>卧室家具>梳妆台/凳> 红庭>红庭 地中海彩绘做旧梳妆台 梳妆凳套组 ...,京东商城,红庭家具旗舰店




