1020001007,宠物|宠物生活|出行装备,韩版宠物背心式蓬蓬纱裙狗胸背带 狗狗牵引绳 贵宾泰迪比熊小型犬狗绳 粉纱围边 S号,宠物生活>出行装备>宠物牵引>蓝荔>韩版宠物背心式蓬蓬纱裙狗胸背带 狗狗牵引...,京东商城,蓝荔宠物用品专营店
1020001007,宠物|宠物生活|出行装备,Petstyle 牵引套装 宠物狗项圈 牵引绳 脖圈 颈圈 中小型犬 适用 GM1206 绿色,宠物生活>出行装备>宠物牵引>乐宠（Leepet）>Petstyle 牵引套装 宠物狗项圈 ...,京东商城,宠乐宠物用品专营店
1020001007,宠物|宠物生活|出行装备,德国Trixie 宠物牵引绳带 欧洲古典系列 XS 15840,宠物生活>出行装备>宠物牵引> TRIXIE>德国Trixie 宠物牵引绳带 欧洲古典...,京东商城,派特宠物用品旗舰店
1020001007,宠物|宠物生活|出行装备,德国Trixie 宠物狗项圈/颈链 蝴蝶系列 XS-S 15646,宠物生活>出行装备>宠物牵引> TRIXIE>德国Trixie 宠物狗项圈/颈链 蝴...,京东商城,派特宠物用品旗舰店
1020001007,宠物|宠物生活|出行装备,憨憨乐园 宠物包 大号宠物折叠包 宠物背包外出包 粉红色 S,宠物生活>出行装备>便携包/笼> 憨憨乐园>憨憨乐园 宠物包 大号宠物折叠包 宠物背...,京东商城,憨憨乐园官方旗舰店
1020001007,宠物|宠物生活|出行装备,派可/PETCO 狗狗田园风围嘴 宠物三角巾GM1259 绿色格子 L,宠物生活>出行装备>服饰> 乐宠（Leepet）>派可/PETCO 狗狗田园风围嘴 宠物三...,京东商城,宠乐宠物用品专营店
1020001007,宠物|宠物生活|出行装备,德国Flexi福莱希泰迪金毛幼犬宠物用品狗链牵引绳小型犬 欢乐时光粉# XS号-3米/12KG,宠物生活>出行装备>宠物牵引> 福莱希（FLEXI）>德国Flexi福莱希泰迪金毛幼犬宠物用品...,京东商城,禾仕嘉官方旗舰店
1020001007,宠物|宠物生活|出行装备,宠物胸背式牵引带1.2小型犬用 狗狗胸背带 宠物牵引绳 狗绳狗链子 【素色系列】随机）,宠物生活>出行装备>宠物牵引>蓝荔>宠物胸背式牵引带1.2小型犬用 狗狗胸背...,京东商城,蓝荔宠物用品专营店