1020001007,宠物|宠物生活|出行装备,优贝卡豪华双层双座宠物汽车垫米黄色H42004B,宠物生活>出行装备>外出用品>优贝卡（ondoing）>优贝卡汽车垫,京东商城,优贝卡（ondoing）
1020001007,宠物|宠物生活|出行装备,福莱希宠物伸缩链Comfort Long舒适加长L煤灰,宠物生活>出行装备>宠物牵引>福莱希（FLEXI）>福莱希伸缩链,京东商城,福莱希（FLEXI）
1020001007,宠物|宠物生活|出行装备,优贝卡超豪华三层加厚面料全防护宠物汽车垫H42020卡其色,宠物生活>出行装备>外出用品>优贝卡（ondoing）>优贝卡宠物汽车垫,京东商城,优贝卡（ondoing）
1020001007,宠物|宠物生活|出行装备,BIS宠物专业蛇链金色16号,宠物生活>出行装备>宠物牵引>BIS>BIS专业蛇链,京东商城,BIS
1020001007,宠物|宠物生活|出行装备,贝亭中位透明宠物包黑色印花,宠物生活>出行装备>便携包>贝亭（petwin）>贝亭宠物包,京东商城,贝亭（petwin）
1020001007,宠物|宠物生活|出行装备,福莱希宠物伸缩链舒适坚固L煤灰色,宠物生活>出行装备>宠物牵引>福莱希（FLEXI）>福莱希宠物伸缩链,京东商城,福莱希（FLEXI）
1020001007,宠物|宠物生活|出行装备,福莱希宠物伸缩链Classic Compact Mini经典坚固迷你XS粉红色,宠物生活>出行装备>宠物牵引>福莱希（FLEXI）>福莱希宠物伸缩链,京东商城,福莱希（FLEXI）
1020001007,宠物|宠物生活|出行装备,优贝卡钢管制宠物折叠布笼大号红色H20007L81,宠物生活>出行装备>便携包>优贝卡（ondoing）>优贝卡折叠布笼,京东商城,优贝卡（ondoing）
1020001007,宠物|宠物生活|出行装备,福莱希宠物伸缩链funtime mini欢乐时光S薰衣草紫,宠物生活>出行装备>宠物牵引>福莱希（FLEXI）>福莱希宠物伸缩链,京东商城,福莱希（FLEXI）
1020001007,宠物|宠物生活|出行装备,贝亭幼犬专用宠物包红色M,宠物生活>出行装备>便携包>贝亭（petwin）>贝亭宠物包,京东商城,贝亭（petwin）
1020001007,宠物|宠物生活|出行装备,PETINUM 点点猫带(项圈) 宠物猫咪用 粉/白/蓝3色 人造革,所有分类>家居家纺、锅具餐具>宠物园艺>出行装备>宠物牵引>PETINUM>PETINUM 点点...,1号店,PETINUM
1020001007,宠物|宠物生活|出行装备,PETINUM 纯皮幻彩(项圈)桔 小型 / 迷你宠物狗/犬用 黄 / 蓝 / 桔3色 100%纯皮,所有分类>家居家纺、锅具餐具>宠物园艺>出行装备>宠物牵引>PETINUM>PETINUM 纯皮...,1号店,PETINUM
1020001007,宠物|宠物生活|出行装备,PETINUM 小鱼配件猫带(项圈)橙 宠物猫咪用 粉/紫/橙/蓝4色 人造革,所有分类>家居家纺、锅具餐具>宠物园艺>出行装备>宠物牵引>PETINUM>PETINUM 小鱼...,1号店,PETINUM
1020001007,宠物|宠物生活|出行装备,PETINUM 蕾丝套装(项圈+牵引绳)黑 小型/迷你宠物狗/犬用 粉桔黑白4色 人造革,所有分类>家居家纺、锅具餐具>宠物园艺>出行装备>宠物牵引>PETINUM>PETINUM 蕾丝...,1号店,PETINUM
1020001007,宠物|宠物生活|出行装备,IRIS 爱丽思 宠物车载垫 副驾驶座和后排座位都有 出口品质,所有分类>家居家纺、锅具餐具>宠物园艺>出行装备>外出用品>IRIS 爱丽思>IRIS 爱丽思 宠...,1号店,IRIS 爱丽思
1020001007,宠物|宠物生活|出行装备,爱贝特 新宠之康 宠物用除蚤狗狗项圈 犬用灭蚤除虱去跳蚤项圈 不挑色,所有分类>家居家纺、锅具餐具>宠物园艺>出行装备>宠物牵引>爱贝特>爱贝特 新宠之康 宠...,1号店,爱贝特
1020001007,宠物|宠物生活|出行装备,宠物包黄色格子猫包狗包 大号20寸,宠物生活>出行装备>便携包>宠物包黄色格子猫包狗包 大号20寸,京东商城,小脚丫宠物用品
1020001007,宠物|宠物生活|出行装备,宠物用品狗狗DIY项圈 项圈配饰 PU材质水晶钻头素面项圈 狗狗项圈 pu项圈-粉红 粉色蝴蝶结,宠物生活>出行装备>宠物牵引>乐比>宠物用品狗狗DIY项圈 项圈配饰 PU材...,京东商城,九易宠物
1020001007,宠物|宠物生活|出行装备,ferplast 皮质宠物手执链、牵引绳（宝石蓝）1.2m/L码 75459025,宠物生活>出行装备>宠物牵引>ferplast>ferplast 皮质宠物手执链、牵引绳...,京东商城,派特宠物用品旗舰店
1020001007,宠物|宠物生活|出行装备,宠物牵引带夜光反光狗用胸背带1.5 黄色,宠物生活>出行装备>宠物牵引>宠物牵引带夜光反光狗用胸背带1.5 黄色,京东商城,小脚丫宠物用品
1020001007,宠物|宠物生活|出行装备,德国Trixie 牵引带 狗凯尼格黑色系列 加长版 2米 可同时牵引2只宠物,宠物生活>出行装备>宠物牵引>TRIXIE>德国Trixie 牵引带 狗凯尼格黑色系...,京东商城,派特宠物用品旗舰店
1020001007,宠物|宠物生活|出行装备,宠物包 外出便携包 可折叠 旅游包 狗包猫包 通风透气 （ 粉色M46*24.5*33cm）,宠物生活>出行装备>便携包>其它>宠物包 外出便携包 可折叠 旅游包 狗包...,京东商城,宠乐宠物用品专营店
1020001007,宠物|宠物生活|出行装备,宠物包 外出便携包 可折叠 旅游包 狗包猫包 通风透气 （绿色S43*24.5*33cm）,宠物生活>出行装备>便携包>其它>宠物包 外出便携包 可折叠 旅游包 狗包...,京东商城,宠乐宠物用品专营店
1020001007,宠物|宠物生活|出行装备,多格 宠物外出携便式甲壳虫形航空托运箱 1.3kg黄色 粉红色 颜色随机发,宠物生活>出行装备>便携包>多格 宠物外出携便式甲壳虫形航空托运箱 ...,京东商城,金多乐宠物用品专营店
1020001007,宠物|宠物生活|出行装备,绚丽(Petio)透明伸缩宠物狗狗牵引带(黄色),宠物生活>出行装备>宠物牵引>其它>绚丽(Petio)透明伸缩宠物狗狗牵引带...,京东商城,宠乐宠物用品专营店
1020001007,宠物|宠物生活|出行装备,家狗宠物牵引绳 1012脚印颈拉 宽10MM 小型犬用 宠物绳狗绳狗链子 红色,宠物生活>出行装备>宠物牵引>家狗宠物牵引绳 1012脚印颈拉 宽10...,京东商城,快乐宠物用品
1020001007,宠物|宠物生活|出行装备,【年货大拜年】宠物牵引带 泰迪 胸背带中小型犬背心式狗绳狗链子 海军蓝色 m- 3号,宠物生活>出行装备>宠物牵引>百变（Happydoggy）>【年货大拜年】宠物牵引带 泰迪 胸背带中...,京东商城,九易宠物
1020001007,宠物|宠物生活|出行装备,宠物日用品 牵引绳 狗胸背套装牵引带 缝花边（小桃图案）拉胸 红色 大号带宽1.5cm带长120cm,宠物生活>出行装备>宠物牵引>其它>宠物日用品 牵引绳 狗胸背套装牵引带 缝...,京东商城,宠乐宠物用品专营店
1020001007,宠物|宠物生活|出行装备,【年终热卖】得乐 宠物牵引带 狗狗伸缩牵引带 三色可选 黄色扁带 自动牵引绳,宠物生活>出行装备>宠物牵引>得乐（DELE）>【年终热卖】得乐 宠物牵引带 狗狗伸缩牵...,京东商城,宠乐宠物用品专营店
1020001007,宠物|宠物生活|出行装备,yapeedog雅皮狗CKC-001爪印宠物项圈/真皮脖圈颈圈泰迪贵宾小型犬中型犬不伤毛 中国红 L码-调节35cm-45cm,宠物生活>出行装备>宠物牵引>雅皮狗（YAPEE DOG）>yapeedog雅皮狗CKC-001爪印...,京东商城,雅皮狗
1020001007,宠物|宠物生活|出行装备,多格漫89968宠物绑带背心爱心图案SS号1111007,宠物生活>出行装备>宠物牵引>多格漫89968宠物绑带背心爱心图案SS...,京东商城,酷迪宠物
1020001007,宠物|宠物生活|出行装备,哲哲ZEZE 宠物包旅游外出折叠简约狗狗 猫咪便携包背肩包 款式一 大号,宠物生活>出行装备>便携包>哲哲ZEZE 宠物包旅游外出折叠简约狗狗...,京东商城,zeze宠物用品旗舰店
1020001007,宠物|宠物生活|出行装备,宠爱一生宠物牵引绳钥匙包零钱包/狗牵绳牵引带/遛狗散步用,宠物生活>出行装备>宠物牵引>雅皮狗（YAPEE DOG）>宠爱一生宠物牵引绳钥匙包零钱包/狗牵绳牵...,京东商城,雅皮狗
1020001007,宠物|宠物生活|出行装备,福莱希flexi宠物伸缩链限量版炫彩系列 绝版 狗牵引绳 狗绳 狗链 牵引带 绿色 XS,宠物生活>出行装备>宠物牵引>福莱希>福莱希flexi宠物伸缩链限量版炫彩系列...,京东商城,如一宠物专营店
1020001007,宠物|宠物生活|出行装备,福莱希flexi宠物伸缩链经典基础系列 狗牵引绳 狗绳 狗链 牵引带 粉色 XS,宠物生活>出行装备>宠物牵引>福莱希（FLEXI）>福莱希flexi宠物伸缩链经典基础系列 ...,京东商城,如一宠物专营店
1020001007,宠物|宠物生活|出行装备,狗狗宠物胸前背包 双肩胸背宠物包四孔前背包 宠物便携包 不挑色,宠物生活>出行装备>便携包>百变（Happydoggy）>狗狗宠物胸前背包 双肩胸背宠物包四孔前背...,京东商城,九易宠物
1020001007,宠物|宠物生活|出行装备,小型犬宠物用品狗用品牵引绳项圈牵引带颈圈狗链子紫色钻套装,宠物生活>出行装备>宠物牵引>小型犬宠物用品狗用品牵引绳项圈牵引带颈圈...,京东商城,雅皮狗
1020001007,宠物|宠物生活|出行装备,得乐L002-L003专业级宠物牵引绳/牵引器/自动伸缩牵狗器/狗绳狗链子 中国红 M码4米,宠物生活>出行装备>宠物牵引>得乐（DELE）>得乐L002-L003专业级宠物牵引绳/...,京东商城,雅皮狗
1020001007,宠物|宠物生活|出行装备,CHUKCHI宠物中大型犬真皮牵引绳项圈套装/上层小牛皮/狗狗脖套狗绳 M项圈36-46cm 1.5米牵引绳,宠物生活>出行装备>宠物牵引>楚克奇（CHUKCHI）>CHUKCHI宠物中大型犬真皮牵引绳项圈...,京东商城,雅皮狗
1020001007,宠物|宠物生活|出行装备,可折叠式宠物包猫包狗包 心型 红色心型 大号约51CM*21CM*29CM,宠物生活>出行装备>便携包>可折叠式宠物包猫包狗包 心型 红色心型 ...,京东商城,小脚丫宠物用品
1020001007,宠物|宠物生活|出行装备,可折叠式宠物包猫包狗包 樱花 红色樱花A 中号约42CM*20CM*26CM,宠物生活>出行装备>便携包>可折叠式宠物包猫包狗包 樱花 红色樱花A...,京东商城,小脚丫宠物用品
1020001007,宠物|宠物生活|出行装备,闪亮电子/迪士尼布鲁托LED发光项圈/闪光/夜光/宠物发光狗项圈/狗链圈 多色选择 黄色 红色L码,宠物生活>出行装备>宠物牵引>宠宠熊（Mr.Bear）>闪亮电子/迪士尼布鲁托LED发光项圈/闪...,京东商城,精彩宠物用品专营店
1020001007,宠物|宠物生活|出行装备,ADD拉带ADL-25（蓝）25X1200MM宠物外出用品牵引带1118071,宠物生活>出行装备>宠物牵引>ADD拉带ADL-25（蓝）25X120...,京东商城,酷迪宠物
1020001007,宠物|宠物生活|出行装备,纯色LED发光项圈/宠物闪光项圈/狗猫项圈/光亮模式可调纯色 多色选择 绿色 绿色L码,宠物生活>出行装备>宠物牵引>星播客 >纯色LED发光项圈/宠物闪光项圈/狗猫项...,京东商城,精彩宠物用品专营店
1020001007,宠物|宠物生活|出行装备,京贝 豹纹宠物外出便携包狗猫背包 L001S,宠物生活>出行装备>便携包>京贝 豹纹宠物外出便携包狗猫背包 L00...,京东商城,Kingpets京贝宠物用品
1020001007,宠物|宠物生活|出行装备,IBIYAYA依比呀呀FC1008宠物拉杆包狗拉杆包可拆洗可折叠猫拉杆箱咖啡色,宠物生活>出行装备>便携包>依比呀呀（IBIYAYA）>IBIYAYA依比呀呀FC1008宠物拉...,京东商城,CHUKCHI宠物
1020001007,宠物|宠物生活|出行装备,得乐L002-L003专业级宠物牵引绳/牵引器/自动伸缩牵狗器/狗绳狗链子 天蓝 中型犬35KG拉力,宠物生活>出行装备>宠物牵引>得乐（DELE）>得乐L002-L003专业级宠物牵引绳/...,京东商城,雅皮狗
1020001007,宠物|宠物生活|出行装备,德国Trixie 宠物胸背带 现代艺术之玫瑰心（粉红色15998）M码,宠物生活>出行装备>宠物牵引>TRIXIE>德国Trixie 宠物胸背带 现代艺术之...,京东商城,派特宠物用品旗舰店
1020001007,宠物|宠物生活|出行装备,宠物小狗狗牵引绳子双头牵引带 中小型犬用品缎带牵引绳 颜色随机 颜色随机 大号2cm,宠物生活>出行装备>宠物牵引>宠物小狗狗牵引绳子双头牵引带 中小型犬用...,京东商城,九易宠物
1020001007,宠物|宠物生活|出行装备,宠物狗狗骨头项圈 颈圈 犬用脖圈 狗链 狗狗用品颜色随机 L-2.5cm,宠物生活>出行装备>宠物牵引>宠物狗狗骨头项圈 颈圈 犬用脖圈 狗链 ...,京东商城,宠乐宠物用品专营店
1020001007,宠物|宠物生活|出行装备,德国Trixie 宠物项圈 大型狗项圈 纳瓦色系列(黑色15608）L码,宠物生活>出行装备>宠物牵引>TRIXIE>德国Trixie 宠物项圈 大型狗项圈 ...,京东商城,
1020001007,宠物|宠物生活|出行装备,哲哲ZEZE 宠物航空箱 航空笼 便携式狗窝 猫箱 猫房 猫窝 加厚旅行箱 墨绿色 59*37*38,宠物生活>出行装备>便携包>哲哲ZEZE 宠物航空箱 航空笼 便携式...,京东商城,zeze宠物用品旗舰店
1020001007,宠物|宠物生活|出行装备,安酷宠物镶钻狗牵引器AK-325 黑色 M,宠物生活>出行装备>宠物牵引>安酷（Anku）>安酷宠物镶钻狗牵引器AK-325 黑色 ...,京东商城,安酷官方旗舰店
1020001007,宠物|宠物生活|出行装备,安酷宠物尼龙狗带 狗绳子链子胸背带 AK-413 蓝色 L,宠物生活>出行装备>宠物牵引>安酷（Anku）>安酷宠物尼龙狗带 狗绳子链子胸背带 AK...,京东商城,安酷官方旗舰店
1020001007,宠物|宠物生活|出行装备,德国Trixie 宠物项圈 夏威夷风情系列(黄色15447)M码,宠物生活>出行装备>宠物牵引>TRIXIE>德国Trixie 宠物项圈 夏威夷风情系...,京东商城,派特宠物用品旗舰店
1020001007,宠物|宠物生活|出行装备,【雅皮狗】宠物牵引绳牵引带/狗牵绳狗链子P链/EAG镀铬金属链4.0mmx120c鋅頭狗鍊潜水料把手带钩 蓝色把手 XX,宠物生活>出行装备>宠物牵引>雅皮狗（YAPEE DOG）>【雅皮狗】宠物牵引绳牵引带/狗牵绳狗链子...,京东商城,CHUKCHI宠物
1020001007,宠物|宠物生活|出行装备,PETinum*蕾丝系列项圈*（粉桔黑白4色）黑色M 中/小型犬用 人造革 宠物狗项圈 闪耀水钻+梦幻蕾丝,宠物生活>出行装备>宠物牵引>PETinum>PETinum*蕾丝系列项圈*（粉桔黑白...,京东商城,柏可心宠物用品旗舰店
1020001007,宠物|宠物生活|出行装备,安酷尼龙缝皮拉手宠物狗狗牵引绳AK-202 黑色 尺寸见详情,宠物生活>出行装备>宠物牵引>安酷尼龙缝皮拉手宠物狗狗牵引绳AK-20...,京东商城,安酷官方旗舰店
1020001007,宠物|宠物生活|出行装备,安酷PU镶钻宠物狗项圈AK-108 白色 尺寸见详情,宠物生活>出行装备>宠物牵引>安酷PU镶钻宠物狗项圈AK-108 白色...,京东商城,安酷官方旗舰店
1020001007,宠物|宠物生活|出行装备,细纹圆绳宠物链子狗狗胸牵带牵引绳狗胸背带颜色可选SML规格 3 M-中型,宠物生活>出行装备>宠物牵引>细纹圆绳宠物链子狗狗胸牵带牵引绳狗胸背带...,京东商城,宠乐宠物用品专营店
1020001007,宠物|宠物生活|出行装备,宠爱一生宠物牵引用品大型犬狗链 狗狗胸背带牵引绳 耐磨耐咬牵引绳项圈经典套装 黑色 M-中型犬,宠物生活>出行装备>宠物牵引>楚克奇（CHUKCHI）>宠爱一生宠物牵引用品大型犬狗链 狗狗胸背...,京东商城,CHUKCHI宠物
1020001007,宠物|宠物生活|出行装备,【京品年货】宠物真皮牵引绳018套装/中大型犬牵引带项圈/狗绳/狗链子套装 带字母钉 牛皮牵引绳1.45米,宠物生活>出行装备>宠物牵引>北京环宇>【京品年货】宠物真皮牵引绳018套装/中...,京东商城,CHUKCHI宠物
1020001007,宠物|宠物生活|出行装备,【京品年货】宠爱一生宠物牵引用品狗链 狗爪印牵引绳牵引带套装 真皮狗狗猫咪项 粉红色套装 S调节19cm-27cm,宠物生活>出行装备>宠物牵引>楚克奇（CHUKCHI）>【京品年货】宠爱一生宠物牵引用品狗链 狗...,京东商城,CHUKCHI宠物
1020001007,宠物|宠物生活|出行装备,宠物嘴套 7号,宠物生活>出行装备>宠物牵引>宠物嘴套 7号,京东商城,波奇
1020001007,宠物|宠物生活|出行装备,红色卡通图案宠物胸背带 贵宾泰迪狗用牵引绳 狗链猫绳 M,宠物生活>出行装备>宠物牵引>红色卡通图案宠物胸背带 贵宾泰迪狗用牵引...,京东商城,如一宠物专营店
1020001007,宠物|宠物生活|出行装备,华元hoopet 镶钻狗狗猫猫项圈宠物用品脖圈颈圈狗脖套粉色狗项链小型犬 11Q0048G 粉红 S号脖围35cm内,宠物生活>出行装备>宠物牵引>华元宠具（hoopet）>华元hoopet 镶钻狗狗猫猫项圈宠物用...,京东商城,hoopet华元宠具
1020001007,宠物|宠物生活|出行装备,HOOPET 华元 宠物项圈脖链颈圈 12Q0014G 狗狗项圈脖套铁链项链 P链 金属训练链狗用品 S号,宠物生活>出行装备>宠物牵引>HOOPET 华元 宠物项圈脖链颈圈 1...,京东商城,hoopet华元宠具
1020001007,宠物|宠物生活|出行装备,宠物项圈 猫颈圈 小型犬泰迪项圈狗狗项圈狗圈 带铃铛反光脚印猫项圈 橘红色 小型犬或猫咪宽1cm,宠物生活>出行装备>宠物牵引>宠物项圈 猫颈圈 小型犬泰迪项圈狗狗项圈...,京东商城,九易宠物
1020001007,宠物|宠物生活|出行装备,得乐专业级宠物牵引绳/牵引器/自动伸缩牵狗器/狗绳狗链子4色可选 天蓝色 M号4米,宠物生活>出行装备>宠物牵引>得乐（DELE）>得乐专业级宠物牵引绳/牵引器/自动伸缩牵...,京东商城,雅皮狗
1020001007,宠物|宠物生活|出行装备,爱丽思IRIS直销 折叠式宠物笼 宠物房子OPK-610,宠物生活>出行装备>便携包>爱丽思>爱丽思IRIS直销 折叠式宠物笼 宠物...,京东商城,爱丽思官方旗舰店
1020001007,宠物|宠物生活|出行装备,CHUKCHI宠物狗爪印牵引绳牵引带套装/真皮狗狗猫咪项圈 天蓝色 S码-调节19cm-27cm,宠物生活>出行装备>宠物牵引>雅皮狗（YAPEE DOG）>CHUKCHI宠物狗爪印牵引绳牵引带套装...,京东商城,雅皮狗
1020001007,宠物|宠物生活|出行装备,【京品年货】宠爱一生宠物牵引用品狗链 狗爪印牵引绳牵引带套装 真皮狗狗猫咪项 天蓝色套装 L调节35cm-45cm,宠物生活>出行装备>宠物牵引>楚克奇（CHUKCHI）>【京品年货】宠爱一生宠物牵引用品狗链 狗...,京东商城,CHUKCHI宠物
1020001007,宠物|宠物生活|出行装备,小伙伴 双层泡棉脖圈式宠物牵引绳 项圈式狗绳 小中大型犬选用 蓝 中,宠物生活>出行装备>宠物牵引>宠爱有佳>小伙伴 双层泡棉脖圈式宠物牵引绳 项圈式...,京东商城,麦豆宠物用品专营店
1020001007,宠物|宠物生活|出行装备,德国Trixie 宠物项圈 大型狗项圈 运动狗(浅蓝色15967)L码,宠物生活>出行装备>宠物牵引>TRIXIE>德国Trixie 宠物项圈 大型狗项圈 ...,京东商城,派特宠物用品旗舰店
1020001007,宠物|宠物生活|出行装备,德国Trixie 宠物牵引绳带 狗骨头和脚印系列（加长版17049）M码 2米,宠物生活>出行装备>宠物牵引>TRIXIE>德国Trixie 宠物牵引绳带 狗骨头和...,京东商城,派特宠物用品旗舰店
1020001007,宠物|宠物生活|出行装备,蓝荔 便携式宠物狗猫旅行水壶 饮水器 适用于各种宠物 颜色随机发放,宠物生活>出行装备>外出用品>蓝荔>蓝荔 便携式宠物狗猫旅行水壶 饮水器 适...,京东商城,蓝荔宠物用品专营店
1020001007,宠物|宠物生活|出行装备,雅皮狗YP-CKC01宠物牵引绳带套装/真皮项圈狗爪印图案多尺码 咖啡色套装 L码-调节35cm-45cm,宠物生活>出行装备>宠物牵引>雅皮狗YP-CKC01宠物牵引绳带套装/...,京东商城,雅皮狗
1020001007,宠物|宠物生活|出行装备,宠物领结蝴蝶结铃铛宠物项圈 紫色,宠物生活>出行装备>宠物牵引>宠物领结蝴蝶结铃铛宠物项圈 紫色,京东商城,小脚丫宠物用品
1020001007,宠物|宠物生活|出行装备,牵手宝贝宠物口罩 狗狗嘴套 防止撕咬吃/防咬口罩/捡东西吃/乱叫 深棕色 M合适体重11KG-22KG,宠物生活>出行装备>宠物牵引>牵手宝贝宠物口罩 狗狗嘴套 防止撕咬吃/...,京东商城,金多乐宠物用品专营店
1020001007,宠物|宠物生活|出行装备,PETinum*点点猫带*（粉蓝白3色）蓝色均码 宠物猫猫项圈,宠物生活>出行装备>宠物牵引>PETinum>PETinum*点点猫带*（粉蓝白3色）...,京东商城,柏可心宠物用品旗舰店
1020001007,宠物|宠物生活|出行装备,雅皮狗littlegifts 雪纳瑞Schnauzer宠物礼品生日礼品送礼盒金属,宠物生活>出行装备>外出用品>雅皮狗（YAPEE DOG）>雅皮狗littlegifts 雪纳瑞Sc...,京东商城,CHUKCHI宠物
1020001007,宠物|宠物生活|出行装备,雅皮狗littlegifts 雪纳瑞Schnauzer宠物礼品生日礼品送礼盒金属,宠物生活>出行装备>外出用品>雅皮狗（YAPEE DOG）>雅皮狗littlegifts 雪纳瑞Sc...,京东商城,雅皮狗
1020001007,宠物|宠物生活|出行装备,雅皮狗littlegifts 罗威纳犬Rottoweiler宠物礼品生日礼品瓷釉节日礼品,宠物生活>出行装备>外出用品>雅皮狗littlegifts 罗威纳犬R...,京东商城,雅皮狗
1020001007,宠物|宠物生活|出行装备,宠物狗狗印花胸背带牵引绳 颜色随机 2.5印花混色,宠物生活>出行装备>宠物牵引>其它>宠物狗狗印花胸背带牵引绳 颜色随机 2....,京东商城,宠乐宠物用品专营店
1020001007,宠物|宠物生活|出行装备,华元hoopet 3米20kg拉力可伸缩宠物牵引泰迪狗绳自动牵引狗牵引绳 13G0006G 七彩 S号,宠物生活>出行装备>宠物牵引>华元宠具（hoopet）>华元hoopet 3米20kg拉力可伸缩...,京东商城,hoopet华元宠具
1020001007,宠物|宠物生活|出行装备,意潇狗狗牵引绳胸牵带宠物牵引绳图案随机颜色可选 J00339 橙色 (20mmx1200mm),宠物生活>出行装备>宠物牵引>意潇>意潇狗狗牵引绳胸牵带宠物牵引绳图案随机颜...,京东商城,宠乐宠物用品专营店
1020001007,宠物|宠物生活|出行装备,意潇小型犬脖圈式胸牵带宠物牵引带牵引绳狗狗胸牵带 JO0220 绿黄粉彩条 10mmX1200mm,宠物生活>出行装备>宠物牵引>意潇>意潇小型犬脖圈式胸牵带宠物牵引带牵引绳狗...,京东商城,宠乐宠物用品专营店
1020001007,宠物|宠物生活|出行装备,【年终热卖】意潇小型犬彩条牵引绳宠物牵引带牵引绳狗狗胸牵带 JO0221 蓝紫彩条 10mmX1200mm,宠物生活>出行装备>宠物牵引>意潇>【年终热卖】意潇小型犬彩条牵引绳宠物牵引...,京东商城,宠乐宠物用品专营店
1020001007,宠物|宠物生活|出行装备,宠物包 宠物包包 宠物便携包 猫包 橘色 M,宠物生活>出行装备>便携包>宠物包 宠物包包 宠物便携包 猫包 橘色...,京东商城,蓝荔宠物用品专营店
1020001007,宠物|宠物生活|出行装备,Dogness多尼斯宠物狗狗项圈 大中小型犬用 老虎 M,宠物生活>出行装备>宠物牵引>宠宠熊（Mr.Bear）>Dogness多尼斯宠物狗狗项圈 大中小...,京东商城,宠宠熊宠物用品专营店
1020001007,宠物|宠物生活|出行装备,德国Trixie 宠物牵引绳带 夏威夷风情系列（黄色15440)S码 1.2米,宠物生活>出行装备>宠物牵引>TRIXIE>德国Trixie 宠物牵引绳带 夏威夷风...,京东商城,派特宠物用品旗舰店
1020001007,宠物|宠物生活|出行装备,多格 宠物外出携便式航运箱 0.97kg紫色 适合吉娃娃博美等小型犬适用,宠物生活>出行装备>便携包>多格>多格 宠物外出携便式航运箱 0.97kg...,京东商城,金多乐宠物用品专营店
1020001007,宠物|宠物生活|出行装备,o宠物车载胸背带安全带 狗绳子狗链子牵引绳 小型犬泰迪比熊贵宾12Q0002G 浅灰色 L号,宠物生活>出行装备>宠物牵引>华元宠具（hoopet）>o宠物车载胸背带安全带 狗绳子狗链子牵引...,京东商城,hoopet华元宠具
1020001007,宠物|宠物生活|出行装备,宠物日用品 宠物牵引绳 狗狗胸背套装牵引带 嵌入两条反光拉胸 红色 大号带宽2.5cm带长120cm,宠物生活>出行装备>宠物牵引>其它>宠物日用品 宠物牵引绳 狗狗胸背套装牵引...,京东商城,宠乐宠物用品专营店
1020001007,宠物|宠物生活|出行装备,宠物日用品 宠物牵引绳 狗狗胸背套装牵引带 格子泡棉拉胸 卡其 小号,宠物生活>出行装备>宠物牵引>其它>宠物日用品 宠物牵引绳 狗狗胸背套装牵引...,京东商城,宠乐宠物用品专营店
1020001007,宠物|宠物生活|出行装备,福莱希flexi宠物伸缩链限量版炫彩系列 绝版 狗牵引绳 狗绳 狗链 牵引带 紫色 M,宠物生活>出行装备>宠物牵引>福莱希flexi宠物伸缩链限量版炫彩系列...,京东商城,如一宠物专营店
1020001007,宠物|宠物生活|出行装备,CHUKCHI宠物狗爪印牵引绳牵引带套装/真皮狗狗猫咪项圈 咖啡色套餐 S码-调节19cm-27cm,宠物生活>出行装备>宠物牵引>雅皮狗（YAPEE DOG）>CHUKCHI宠物狗爪印牵引绳牵引带套装...,京东商城,雅皮狗
1020001007,宠物|宠物生活|出行装备,宠物项圈 PU皮小狗项圈 猫圈 带铃铛狗圈 小型犬猫狗项圈 粉红 S,宠物生活>出行装备>宠物牵引>麦豆（Madden）>宠物项圈 PU皮小狗项圈 猫圈 带铃铛狗...,京东商城,麦豆宠物用品专营店
