1020001007,宠物|宠物生活|出行装备,优贝卡汽车垫狗狗车垫宠物车载垫 小中大型狗车垫宠物后座车垫 狗狗外出用品 三层面料加厚免邮,宠物生活>出行装备>外出用品>优贝卡（ondoing）>优贝卡汽车垫狗狗车垫宠物车载垫 小中大型...,京东商城,优贝卡宠物用品旗舰店
1020001007,宠物|宠物生活|出行装备,德国Trixie 宠物牵引绳带 纳瓦色系列之黑色（加长15603）S码 2米,宠物生活>出行装备>宠物牵引>TRIXIE>德国Trixie 宠物牵引绳带 纳瓦色系...,京东商城,派特宠物用品旗舰店
1020001007,宠物|宠物生活|出行装备,德国Trixie 宠物牵引绳带 油印系列之淡紫色（加长版15404）M码 2米,宠物生活>出行装备>宠物牵引>TRIXIE>德国Trixie 宠物牵引绳带 油印系列...,京东商城,派特宠物用品旗舰店
1020001007,宠物|宠物生活|出行装备,宠物包蓝色条纹猫包狗包18寸中号,宠物生活>出行装备>便携包/笼>宠物包蓝色条纹猫包狗包18寸中号,京东商城,小脚丫宠物用品
1020001007,宠物|宠物生活|出行装备,安酷宠物项圈 绒面尼龙Love 狗项圈 玫红 S,宠物生活>出行装备>宠物牵引>安酷（Anku）>安酷宠物项圈 绒面尼龙Love 狗项圈 ...,京东商城,安酷官方旗舰店
1020001007,宠物|宠物生活|出行装备,安酷宠物项圈 尼龙字母狗项圈 黑色 L,宠物生活>出行装备>宠物牵引>安酷（Anku）>安酷宠物项圈 尼龙字母狗项圈 黑色 L,京东商城,安酷官方旗舰店
1020001007,宠物|宠物生活|出行装备,福莱希flexi宠物伸缩链Gaint系列 狗牵引绳 狗绳 狗链 牵引带 黑色 XL,宠物生活>出行装备>宠物牵引>福莱希（FLEXI）>福莱希flexi宠物伸缩链Gaint系列...,京东商城,如一宠物专营店
1020001007,宠物|宠物生活|出行装备,宠物牵引带胸背带1.0小圆尼龙反光狗绳 黄色,宠物生活>出行装备>宠物牵引>宠物牵引带胸背带1.0小圆尼龙反光狗绳 ...,京东商城,小脚丫宠物用品
1020001007,宠物|宠物生活|出行装备,爱贝特 水钻骨头亮皮宠物项圈小型犬猫猫狗狗适用 猫项圈,所有分类>家居家纺、锅具餐具>宠物园艺>出行装备>宠物牵引>爱贝特>爱贝特 水钻骨头亮皮...,1号店,爱贝特
1020001007,宠物|宠物生活|出行装备,怡亲 宠物用品户外尼龙蛇纹反夜光拉胸背带牵引绳牵引带狗链狗绳子,所有分类>家居家纺、锅具餐具>宠物园艺>出行装备>宠物牵引>怡亲>怡亲 宠物用品户外尼...,1号店,怡亲
1020001007,宠物|宠物生活|出行装备,PETINUM 幕色星空(项圈) 中小型宠物狗/犬用 蓝粉2色 人造革,所有分类>家居家纺、锅具餐具>宠物园艺>出行装备>宠物牵引>PETINUM>PETINUM 幕色...,1号店,PETINUM
1020001007,宠物|宠物生活|出行装备,PETINUM 纯皮星光(项圈)黑 大中小型宠物狗/犬用 红 / 黑2色 100%纯皮,所有分类>家居家纺、锅具餐具>宠物园艺>出行装备>宠物牵引>PETINUM>PETINUM 纯皮...,1号店,PETINUM
1020001007,宠物|宠物生活|出行装备,solvit宠物车载筐宠物篮狗袋汽车前座安全吊篮床可拆卸外出便携包 咖啡色 XL码,宠物生活>出行装备>外出用品>solvit>solvit宠物车载筐宠物篮狗袋汽车前座...,京东商城,爱宝嘉宠物用品专营店
1020001007,宠物|宠物生活|出行装备,Loole乐乐 宠物衣服 狗狗衣服 泰迪衣服 金色礼服 春夏新款 黑色S,首页>家居/家装建材/厨具>宠物生活>出行装备>Loole乐乐宠物衣服狗狗衣服...,苏宁,乐乐(loole)
1020001007,宠物|宠物生活|出行装备,豹纹鞋印刷PU皮料+胶底 宠物鞋 狗鞋狗狗夏季凉鞋 一双四只 白色豹纹和金色豹纹可选 金色豹汶 38E,首页>家居/家装建材/厨具>宠物生活>出行装备>豹纹鞋印刷PU皮料+胶底宠物鞋狗...,苏宁,贝乐
1020001007,宠物|宠物生活|出行装备,宠物衣服狗狗衣服 泰迪冬绒面厚实星际宝贝史迪奇变身装 绿色 M-胸围45-47c,首页>家居/家装建材/厨具>宠物生活>出行装备>宠物衣服狗狗衣服泰迪冬绒面厚实星际...,苏宁,petcirle
1020001007,宠物|宠物生活|出行装备,宠物运动鞋 小狗的鞋子 狗狗印花PU防雨室内鞋 时尚鞋 泰迪鞋 7,宠物生活>出行装备>其它>星播客 >宠物运动鞋 小狗的鞋子 狗狗印花PU防雨...,京东商城,麦豆宠物用品专营店
1020001007,宠物|宠物生活|出行装备,得乐DELE 自动伸缩宠物狗狗牵引绳 宠物用品,所有分类>家居家纺、锅具餐具>宠物园艺>出行装备>宠物牵引>得乐DELE,1号店,宠物牵引
1020001007,宠物|宠物生活|出行装备,光月传说 宠物外出提包 犬猫旅行提箱 狗笼猫屋,所有分类>家居家纺、锅具餐具>宠物园艺>出行装备>便携包>光月传说>光月传说 宠物外出提...,1号店,光月传说
1020001007,宠物|宠物生活|出行装备,All For Paws AFP宠物食物零食包双色大小号 宠物用品狗户外玩具出游便携收纳,所有分类>家居家纺、锅具餐具>宠物园艺>出行装备>外出用品>All For Paws>All For Pa...,1号店,All For Paws
1020001007,宠物|宠物生活|出行装备,爱贝特 狗狗背包胸前包袋鼠包 外出便携双肩泰迪狗背包 宠物用品,所有分类>家居家纺、锅具餐具>宠物园艺>出行装备>便携包>爱贝特>爱贝特 狗狗背包胸前...,1号店,爱贝特
1020001007,宠物|宠物生活|出行装备,宠淘淘猫/狗日用 狗狗项圈 可爱骨头款 小型宠物项圈(黑 S),家居日用>出行装备>宠淘淘>宠淘淘猫/狗日用 狗狗项圈 可爱骨头款 小型宠物项圈(黑 S),国美电器网上商城,淘派宠物用品专营店
1020001007,宠物|宠物生活|出行装备,宠淘淘宠物猫/狗日用 狗项圈卡诺依高档彩色印花项圈  带铃铛项圈(蓝),家居日用>出行装备>宠淘淘>宠淘淘宠物猫/狗日用 狗项圈卡诺依高档彩色印花项圈  带铃铛项圈(蓝),国美电器网上商城,淘派宠物用品专营店
1020001007,宠物|宠物生活|出行装备,爱贝特 宠物围巾帅气三角巾皮带扣式项圈可连牵引绳狗项圈牵引绳,所有分类>家居家纺、锅具餐具>宠物园艺>出行装备>宠物牵引>爱贝特>爱贝特 宠物围巾帅气...,1号店,爱贝特
1020001007,宠物|宠物生活|出行装备,宠淘淘宠物牵引绳 狗狗胸背带 尼龙反光牵引绳 荧光牵引带 狗链(黑 M),家居日用>出行装备>宠淘淘>宠淘淘宠物牵引绳 狗狗胸背带 尼龙反光牵引绳 荧光牵引带 狗链(黑 M),国美电器网上商城,淘派宠物用品专营店
1020001007,宠物|宠物生活|出行装备,宠淘淘宠物牵引绳 狗狗牵引带 尼龙反光胸背带牵引绳 遛狗绳(黑 M),家居日用>出行装备>宠淘淘>宠淘淘宠物牵引绳 狗狗牵引带 尼龙反光胸背带牵引绳 遛狗绳(黑 M),国美电器网上商城,淘派宠物用品专营店
1020001007,宠物|宠物生活|出行装备,宠淘淘宠物用品 狗狗牵引绳 宠物胸背带牵引绳 大中型犬牵引带 狗链(蓝红 L),家居日用>出行装备>宠淘淘>宠淘淘宠物用品 狗狗牵引绳 宠物胸背带牵引绳 大中型犬牵引带 狗链(蓝红 L),国美电器网上商城,淘派宠物用品专营店
1020001007,宠物|宠物生活|出行装备,优贝卡狗狗背包 狗包 猫包 宠物包 外出 便携 宠物背包 车载宠物旅行包 透气轻巧 黑色,宠物生活>出行装备>便携包>优贝卡（ondoing）>优贝卡狗狗背包 狗包 猫包 宠物包 外出...,京东商城,优贝卡宠物用品旗舰店
1020001007,宠物|宠物生活|出行装备,【京品年货】CHUKCH/宠物牵引绳/大中型犬用/尼龙绳海绵把手/狗牵绳狗链 中国红 M号,宠物生活>出行装备>宠物牵引>楚克奇（CHUKCHI）>【京品年货】CHUKCH/宠物牵引绳/大...,京东商城,CHUKCHI宠物
1020001007,宠物|宠物生活|出行装备,得乐宠物自动伸缩牵引器3米长狗狗牵引绳牵引带外出遛狗绳宠物用品狗链,宠物生活>出行装备>宠物牵引>得乐（DELE）>得乐宠物自动伸缩牵引器3米长狗狗牵引绳牵...,京东商城,百享宠物用品专营店
1020001007,宠物|宠物生活|出行装备,特价宠物嘴套 网状透气狗嘴套 多种型号可选择 7,宠物生活>出行装备>宠物牵引>麦豆（Madden）>特价宠物嘴套 网状透气狗嘴套 多种型号可...,京东商城,麦豆宠物用品专营店
1020001007,宠物|宠物生活|出行装备,宠物包红色条纹猫包狗包 中号18寸,宠物生活>出行装备>便携包>宠物包红色条纹猫包狗包 中号18寸,京东商城,小脚丫宠物用品
1020001007,宠物|宠物生活|出行装备,All For Paws AFP宠物食物零食包双色大小号 宠物用品狗户外玩具出游便携收纳,所有分类>家居家纺、锅具餐具>宠物园艺>出行装备>外出用品>All For Paws>All For Pa...,1号店,All For Paws
1020001007,宠物|宠物生活|出行装备,爱丽思IRIS 宠物猫狗便携航空箱外出笼/包 可爱软套 SCC-460 黄色,宠物生活>出行装备>便携包>爱丽思（IRIS）>爱丽思IRIS 宠物猫狗便携航空箱外出笼...,京东商城,爱丽思宠物旗舰店
1020001007,宠物|宠物生活|出行装备,2014新款 台湾IBIYAYA伊比呀呀FC1220 透明宠物提包 狗狗折叠包 粉红色 M-中型,宠物生活>出行装备>便携包/笼>依比呀呀（IBIYAYA）>2014新款 台湾IBIYAYA伊比呀呀...,京东商城,CHUKCHI宠物
1020001007,宠物|宠物生活|出行装备,美国Sturdi专业猫比赛便携式宠物箱 宠物狗外出笼 打比赛装用笼 猫狗窝 0715094 单门褐色,宠物生活>出行装备>便携包>天元（pet star）>美国Sturdi专业猫比赛便携式宠物箱 ...,京东商城,酷迪宠物
1020001007,宠物|宠物生活|出行装备,宠物辅助安全带! 美国solvit宠物牵引带大中小型犬伸缩牵引绳 前后部佩戴 金色 M码,宠物生活>出行装备>宠物牵引>solvit>宠物辅助安全带! 美国solvit宠物牵...,京东商城,爱宝嘉宠物用品专营店
1020001007,宠物|宠物生活|出行装备,SOLVIT 宠物用品 宠物牵引带 狗狗车用牵引绳后座后备箱带 大型犬,所有分类>家居家纺、锅具餐具>宠物园艺>出行装备>宠物牵引>SOLVIT>SOLVIT 宠物用...,1号店,SOLVIT
1020001007,宠物|宠物生活|出行装备,狗链 牵引绳 户外尼龙蛇纹 反光宠物用品拉胸背带 狗绳子 颜色随机 S,宠物生活>出行装备>宠物牵引>多格漫（DoggyMan）>狗链 牵引绳 户外尼龙蛇纹 反光宠物用品...,京东商城,波奇
1020001007,宠物|宠物生活|出行装备,安琪圈圈AngyChain 宠物手提包VJ10068 蓝格子,宠物生活>出行装备>便携包>安琪圈圈（AngyChain）>安琪圈圈宠物手提包,京东商城,安琪圈圈（AngyChain）
1020001007,宠物|宠物生活|出行装备,宠物用品 可爱宠物背包/狗狗背包/狗狗自背包 适合中小型犬 红色 中大型犬用 均码,宠物生活>出行装备>便携包>百变（Happydoggy）>宠物用品 可爱宠物背包/狗狗背包/狗狗自...,京东商城,九易宠物
1020001007,宠物|宠物生活|出行装备,VIGOROUS 誉盛 亮钻锚点项圈 小型犬 狗项圈 宠物项圈 YS-1217,所有分类>家居家纺、锅具餐具>宠物园艺>出行装备>宠物牵引>VIGOROUS>VIGOROUS 誉...,1号店,VIGOROUS
1020001007,宠物|宠物生活|出行装备,宠淘淘猫/狗日用 宠物项圈 狗项圈高级PU革仿皮三角巾项圈(枚红 S),家居日用>出行装备>宠淘淘>宠淘淘猫/狗日用 宠物项圈 狗项圈高级PU革仿皮三角巾项圈(枚红 S),国美电器网上商城,淘派宠物用品专营店
1020001007,宠物|宠物生活|出行装备,【年货大拜年】宠物航空箱 飞机笼 空运箱 猫狗笼子 透气狗狗航空箱中号55*35*32,宠物生活>出行装备>航空箱>百变（Happydoggy）>【年货大拜年】宠物航空箱 飞机笼 空运箱...,京东商城,九易宠物
1020001007,宠物|宠物生活|出行装备,sunnypet 轻巧便携 易收折 小型犬 狗包 肩背 前背 透气 宠物包 军绿色 均码,宠物生活>出行装备>便携包>SUNNYPET>sunnypet 轻巧便携 易收折 小型...,京东商城,Sunnypet宠物用品
1020001007,宠物|宠物生活|出行装备,FLEXI福莱希 德国进口 泰迪金毛幼犬宠物用品猫狗链牵引绳 小型 大型犬,所有分类>家居家纺、锅具餐具>宠物园艺>出行装备>宠物牵引>FLEXI福莱希>FLEXI福莱希 德...,1号店,FLEXI福莱希
1020001007,宠物|宠物生活|出行装备,迪巴拉（Dybala）双排钉纯牛皮宠物狗狗项圈 3.5cm宽 中大型犬用 狗项圈 狗圈,宠物生活>出行装备>宠物牵引>迪巴拉（Dybala）>迪巴拉（Dybala）双排钉纯牛皮宠物狗...,京东商城,迪巴拉宠物用品旗舰店
1020001007,宠物|宠物生活|出行装备,Hagen 哈根进口经典航空箱 宠物用品 狗笼子外出笼,所有分类>家居家纺、锅具餐具>宠物园艺>出行装备>便携包>Hagen>Hagen 哈根进口...,1号店,Hagen
1020001007,宠物|宠物生活|出行装备,Loole/乐乐 乐动精灵卫衣 宠物衣服卫衣 宠物衣服 狗狗衣服 秋冬泰迪衣服J00727 玫红 S背长24领围20胸,首页>家居/家装建材/厨具>宠物生活>出行装备>Loole/乐乐乐动精灵卫衣宠物...,苏宁,
1020001007,宠物|宠物生活|出行装备,Loole/乐乐 乐动精灵卫衣 宠物衣服卫衣 宠物衣服 狗狗衣服 秋冬泰迪衣服J00727 橙色 M背长29领围22胸,首页>家居/家装建材/厨具>宠物生活>出行装备>Loole/乐乐乐动精灵卫衣宠物...,苏宁,
1020001007,宠物|宠物生活|出行装备,爆 狗狗秋冬季宠物 衣服 泰迪星座款休闲半身卫衣 狗狗衣服 双鱼座 XXS-胸围30cm,首页>家居/家装建材/厨具>宠物生活>出行装备>爆狗狗秋冬季宠物衣服泰迪星座款...,苏宁,
1020001007,宠物|宠物生活|出行装备,Hoopet/华元宠具 狗狗防咬防叫口罩 黄小鸭小型犬狗嘴套 防捡拾宠物嘴套外出用品13G0060G,所有分类>家居家纺、锅具餐具>宠物园艺>出行装备>外出用品>Hoopet/华元宠具>Hoopet/华元宠...,1号店,Hoopet/华元宠具
1020001007,宠物|宠物生活|出行装备,FLEXI/福莱希 纯牛皮优质大狗宠物牵引绳子 真皮狗狗牵引带狗狗链子 宠物用品10Q0037G,所有分类>家居家纺、锅具餐具>宠物园艺>出行装备>宠物牵引>FLEXI/福莱希>FLEXI/福莱希 ...,1号店,FLEXI/福莱希
1020001007,宠物|宠物生活|出行装备,宠物衣服秋冬狗狗衣服 圣诞节+万圣节过节必备珊瑚绒冬款卫衣 南瓜头 XS-胸围38m,首页>家居/家装建材/厨具>宠物生活>出行装备>宠物衣服秋冬狗狗衣服圣诞节+万圣节...,苏宁,
1020001007,宠物|宠物生活|出行装备,优贝卡 宠物胸背带 牵引带 狗胸背 狗绳项圈 狗链 遛狗绳套装 泰迪金毛 大中小型犬 纯红色 10*1200mm,宠物生活>出行装备>宠物牵引> 优贝卡（ondoing）>优贝卡 宠物胸背带 牵引带 狗胸背 狗绳...,京东商城,优贝卡宠物用品旗舰店
1020001007,宠物|宠物生活|出行装备,petio宠物用品狗狗时尚胸背带 防水 超耐用 粉色 S-10mm,宠物生活>出行装备>宠物牵引> petio>petio宠物用品狗狗时尚胸背带 防水 ...,京东商城,宠宠熊宠物用品专营店
1020001007,宠物|宠物生活|出行装备,DAB领巾项圈宠物三角巾宠物围脖三色可选 GM0934 蓝格 S-小型,宠物生活>出行装备>服饰>乐宠（Leepet）>DAB领巾项圈宠物三角巾宠物围脖三色可选...,京东商城,宠乐宠物用品专营店
1020001007,宠物|宠物生活|出行装备,宠物日用品 宠物牵引绳 胸背带 狗胸背套装牵引带 镶色拉胸 粉咖啡 小号带宽1cm带长120cm,宠物生活>出行装备>宠物牵引>其它>宠物日用品 宠物牵引绳 胸背带 狗胸背套...,京东商城,宠乐宠物用品专营店
1020001007,宠物|宠物生活|出行装备,方格fango宠物尿垫 宠物垫子 两片体验装,宠物生活>出行装备>外出用品>方格fango宠物尿垫 宠物垫子 两片体...,京东商城,fango旗舰店
1020001007,宠物|宠物生活|出行装备,全家宠物 日本爱丽思IRIS 网状手提宠物笼MPC-450 （猫狗通用） 橙 700*20*20,宠物生活>出行装备>便携包/笼>爱丽思（IRIS）>全家宠物 日本爱丽思IRIS 网状手提宠...,京东商城,全家宠物
1020001007,宠物|宠物生活|出行装备,芘嘉儿/petcare BT66RD 多功能宠物狗狗拉杆箱包 大空间 超大通风 热卖单品 米色,宠物生活>出行装备>便携包>芘嘉儿（petcare）>芘嘉儿/petcare BT66RD 多...,京东商城,绿兔家居专营店
1020001007,宠物|宠物生活|出行装备,全家宠物 日本爱丽思IRIS 软套宠物笼SCC-460 粉,宠物生活>出行装备>便携包/笼>爱丽思（IRIS）>全家宠物 日本爱丽思IRIS 软套宠物笼...,京东商城,全家宠物
1020001007,宠物|宠物生活|出行装备,得乐 宠物自动伸缩牵引带 小号镶钻 三色可选 蓝色扁带 自动牵引绳,宠物生活>出行装备>宠物牵引>其它>得乐 宠物自动伸缩牵引带 小号镶钻 三色...,京东商城,宠乐宠物用品专营店
1020001007,宠物|宠物生活|出行装备,优贝卡 两用型宠物牵引带 汽车/平时散步使用宠物牵引绳带小包 蓝色 100*2.5*1.2cm,宠物生活>出行装备>宠物牵引> 优贝卡（ondoing）>优贝卡 两用型宠物牵引带 汽车/平时散步...,京东商城,优贝卡宠物用品旗舰店
1020001007,宠物|宠物生活|出行装备,vigorous/誉盛 宠物项圈 狗狗项圈牵引带 贵宾泰迪小型犬 YS-HJ-001-A 蓝色 1.5*30*120,宠物生活>出行装备>宠物牵引> 8IN1>vigorous/誉盛 宠物项圈 狗狗项...,京东商城,禾仕嘉官方旗舰店
1020001007,宠物|宠物生活|出行装备,哲哲zeze宠物发光项圈 夜光闪光狗猫项圈3码4色高品质耐用 引绳带,宠物生活>出行装备>宠物牵引>哲哲（zeze）>哲哲zeze宠物发光项圈 夜光闪光狗猫项...,京东商城,zeze宠物用品旗舰店
1020001007,宠物|宠物生活|出行装备,全家宠物 日本爱丽思 携带式宠物小笼BL460 橙,宠物生活>出行装备>便携包/笼>爱丽思（IRIS）>全家宠物 日本爱丽思 携带式宠物小笼BL...,京东商城,全家宠物
1020001007,宠物|宠物生活|出行装备,小号精致耐用 带骨头带铃铛迷你小项圈 小狗项圈猫项圈 宠物饰品 黑色 s,宠物生活>出行装备>宠物牵引>小号精致耐用 带骨头带铃铛迷你小项圈 小...,京东商城,九易宠物
1020001007,宠物|宠物生活|出行装备,vigorous/誉盛 P链牵引带 金毛 大型犬 宠物牵引带 狗牵引带V-NL-008 橙色-牵引120/P链150 1.2*120,宠物生活>出行装备>宠物牵引> 8IN1>vigorous/誉盛 P链牵引带 金毛...,京东商城,禾仕嘉官方旗舰店
1020001007,宠物|宠物生活|出行装备,IBIYAYA依比呀呀外出便携宠物包/宠物折叠包/猫包狗包/航空包拎包1006灰色,宠物生活>出行装备>便携包>依比呀呀（IBIYAYA）>IBIYAYA依比呀呀外出便携宠物包/宠...,京东商城,CHUKCHI宠物
1020001007,宠物|宠物生活|出行装备,vigorous/誉盛 亮钻锚点项圈 小型犬 狗项圈 宠物项圈YS-1217 黑色 1.5*35,宠物生活>出行装备>宠物牵引> 8IN1>vigorous/誉盛 亮钻锚点项圈 小...,京东商城,禾仕嘉官方旗舰店
1020001007,宠物|宠物生活|出行装备,vigorous/誉盛 宠物项圈 狗项圈 贵宾泰迪项圈 狗用品V-MS-029 红色 1.5*35,宠物生活>出行装备>宠物牵引> 8IN1>vigorous/誉盛 宠物项圈 狗项圈...,京东商城,禾仕嘉官方旗舰店
1020001007,宠物|宠物生活|出行装备,vigorous/誉盛 P袋牵引带 宠物牵引带 狗牵引带 金毛 中大型犬V-NL-001 绿色 1.0*120,宠物生活>出行装备>宠物牵引> 8IN1>vigorous/誉盛 P袋牵引带 宠物...,京东商城,禾仕嘉官方旗舰店
1020001007,宠物|宠物生活|出行装备,宠物网眼布项圈 狗狗项圈 宠物脖套 宠物牵引项圈 狗狗头圈 带金属锁扣 红色,宠物生活>出行装备>宠物牵引> 光月传说（Light&moon）>宠物网眼布项圈 狗狗项圈 宠物脖套 宠物...,京东商城,如一宠物专营店
1020001007,宠物|宠物生活|出行装备,BG180芘嘉儿条纹超大容量宠物狗狗外出便携包 猫包 大空间通风好 蓝色 L49*30*23cm,宠物生活>出行装备>便携包>芘嘉儿（petcare）>BG180芘嘉儿条纹超大容量宠物狗狗外出...,京东商城,绿兔家居专营店
1020001007,宠物|宠物生活|出行装备,美容罩防咬圈 宠物保护套 头套 猫狗通用 伊丽莎白项圈 红色 XS号,宠物生活>出行装备>外出用品>贝亭（petwin）>美容罩防咬圈 宠物保护套 头套 猫狗通用...,京东商城,蓝荔宠物用品专营店
1020001007,宠物|宠物生活|出行装备,宠物便携包 宠物三用包蓝色S号 小号 猫狗外出包 背包 挎包 宠物书包 0715135,宠物生活>出行装备>便携包/笼>天元（pet star）>宠物便携包 宠物三用包蓝色S号 小号 猫...,京东商城,酷迪宠物
1020001007,宠物|宠物生活|出行装备,爱丽思IRIS直销 网状手提树脂宠物笼 便携宠物航空箱MPC-450 绿色,宠物生活>出行装备>便携包>爱丽思（IRIS）>爱丽思IRIS直销 网状手提树脂宠物笼 ...,京东商城,爱丽思宠物旗舰店
1020001007,宠物|宠物生活|出行装备,天元爪印皮项圈 狗项圈 颈圈 宠物用品 脖圈装饰 外出牵引 1112261 黑色 小号,宠物生活>出行装备>宠物牵引>天元（pet star）>天元爪印皮项圈 狗项圈 颈圈 宠物用品 ...,京东商城,酷迪宠物
1020001007,宠物|宠物生活|出行装备,福莱希flexi宠物新风尚系列带状 狗牵引绳 狗绳 狗链 牵引带 多款可选 蛇纹M S,宠物生活>出行装备>宠物牵引>福莱希（FLEXI）>福莱希flexi宠物新风尚系列带状 狗牵...,京东商城,如一宠物专营店
1020001007,宠物|宠物生活|出行装备,天元漆皮镶钻骨头项圈 狗项圈 颈圈 外出牵引 宠物用品 脖圈装饰 1112231 粉色,宠物生活>出行装备>宠物牵引>天元（pet star）>天元漆皮镶钻骨头项圈 狗项圈 颈圈 外出...,京东商城,酷迪宠物
1020001007,宠物|宠物生活|出行装备,天元漆皮镶钻骨头项圈 狗项圈 颈圈 外出牵引 宠物用品 脖圈装饰 1112231 绿色,宠物生活>出行装备>宠物牵引>天元（pet star）>天元漆皮镶钻骨头项圈 狗项圈 颈圈 外出...,京东商城,酷迪宠物
1020001007,宠物|宠物生活|出行装备,福莱希flexi宠物新风尚系列带状 狗牵引绳 狗绳 狗链 牵引带 多款可选 豹纹 S,宠物生活>出行装备>宠物牵引>福莱希（FLEXI）>福莱希flexi宠物新风尚系列带状 狗牵...,京东商城,如一宠物专营店
1020001007,宠物|宠物生活|出行装备,实惠出口优质狗狗雨衣 16号 宠物雨衣 狗狗雨衣 红色 16号,宠物生活>出行装备>服饰>其它>实惠出口优质狗狗雨衣 16号 宠物雨衣 ...,京东商城,宠乐宠物用品专营店
1020001007,宠物|宠物生活|出行装备,宠物发光项圈尼龙材防水狗项圈 LED发光颈圈夜光/防丢失5002 荧光绿 M-中型犬,宠物生活>出行装备>宠物牵引>雅皮狗（YAPEE DOG）>宠物发光项圈尼龙材防水狗项圈 LED发光...,京东商城,CHUKCHI宠物
1020001007,宠物|宠物生活|出行装备,德国Flexi福莱希 泰迪金毛幼犬宠物用品猫狗链牵引绳 小型 大型犬 经典红 XS号-3米/8KG,宠物生活>出行装备>宠物牵引> 福莱希（FLEXI）>德国Flexi福莱希 泰迪金毛幼犬宠物用...,京东商城,禾仕嘉官方旗舰店
1020001007,宠物|宠物生活|出行装备,德国Trixie 宠物牵引绳带 狗骨头和脚印系列 S-17009-1.2米,宠物生活>出行装备>宠物牵引>TRIXIE>德国Trixie 宠物牵引绳带 狗骨头和...,京东商城,派特宠物用品旗舰店
1020001007,宠物|宠物生活|出行装备,E耐威克 宠物可收缩自动牵引绳 家用牵引带 自动伸缩牵狗器 遛狗绳3米 黑色,宠物生活>出行装备>宠物牵引>耐威克（Navarch）>E耐威克 宠物可收缩自动牵引绳 家用牵引...,京东商城,耐威克宠物用品旗舰店
1020001007,宠物|宠物生活|出行装备,E耐威克 宠物可收缩自动牵引绳 家用牵引带 自动伸缩牵狗器 遛狗绳3米 玫瑰红色,宠物生活>出行装备>宠物牵引>耐威克（Navarch）>E耐威克 宠物可收缩自动牵引绳 家用牵引...,京东商城,耐威克宠物用品旗舰店
1020001007,宠物|宠物生活|出行装备,德国Trixie 宠物胸背带 月亮系列 S-15984,宠物生活>出行装备>宠物牵引>TRIXIE>德国Trixie 宠物胸背带 月亮系列 ...,京东商城,派特宠物用品旗舰店
1020001007,宠物|宠物生活|出行装备,爱丽思IRIS便携宠物笼子树脂狗猫旅行航空箱BL-460 黄色,宠物生活>出行装备>便携包/笼>爱丽思（IRIS）>爱丽思IRIS便携宠物笼子树脂狗猫旅行航...,京东商城,爱丽思宠物旗舰店
1020001007,宠物|宠物生活|出行装备,爱丽思IRIS便携宠物笼子树脂狗猫旅行航空箱BL-460 浅蓝色,宠物生活>出行装备>便携包/笼>爱丽思（IRIS）>爱丽思IRIS便携宠物笼子树脂狗猫旅行航...,京东商城,爱丽思宠物旗舰店
1020001007,宠物|宠物生活|出行装备,多格漫 宠物 饮水瓶头 便笼内外使用 狗挂式饮水器 喝水瓶 GM1234 咖啡色,宠物生活>出行装备>外出用品>多格漫（DoggyMan）>多格漫 宠物 饮水瓶头 便笼内外使用 狗...,京东商城,宠乐宠物用品专营店
1020001007,宠物|宠物生活|出行装备,贴布狗绳 可调节缝布宠物狗链子 牵引绳带 胸背带 泰迪金毛狗绳 大号 M-中型,宠物生活>出行装备>宠物牵引> PETNA>贴布狗绳 可调节缝布宠物狗链子 牵引绳带...,京东商城,奇摩宠物商城
